Source,URL,Category,Keyword,Time,Title,Content
VN Express,https://vnexpress.net/cac-ngan-hang-trung-uong-chuong-vang-hon-usd-4899937.html,Quốc tế,"USD,vàng,giá vàng,đôla Mỹ,ngân hàng trung ương","Thứ ba, 17/6/2025, 15:35 (GMT+7)",Các ngân hàng trung ương chuộng vàng hơn USD,"Khảo sát của Hội đồng Vàng Thế giới cho thấy đa số ngân hàng trung ương muốn tăng tỷ trọng vàng và giảm USD trong dự trữ ngoại hối 5 năm tới. Ngày 17/6, Hội đồng Vàng Thế giới (WGC) công bố kết quả khảo sát với 73 ngân hàng trung ương giai đoạn 25/2-20/5. Theo đó, 76% dự báo tỷ trọng vàng trong dự trữ ngoại hối sẽ tăng trong 5 năm tới. Tỷ lệ này cao hơn mức 69% trong khảo sát năm ngoái. Ngược lại, 75% cho rằng tỷ trọng USD trong dự trữ ngoại hối sẽ giảm. Năm ngoái, chỉ 62% dự báo điều này. ""Hiệu suất của vàng trong thời kỳ khủng hoảng, vai trò đa dạng hóa danh mục đầu tư và khả năng phòng trừ lạm phát là những yếu tố chính thúc đẩy các ngân hàng trung ương tích trữ thêm kim loại quý trong năm tới"", WGC giải thích. Những năm gần đây, các ngân hàng trung ương tìm cách giảm phụ thuộc vào đồng USD do lo ngại bất ổn địa chính trị và nợ công của Mỹ. Xu hướng ""phi đô la hóa"" tăng tốc, đặc biệt tại các nước đang phát triển, kể từ sau chiến sự tại Ukraine. Trong ba năm qua, các ngân hàng trung ương đều mua hơn 1.000 tấn vàng mỗi năm. Mức này gấp đôi trung bình của thập kỷ trước. ""Tốc độ tích trữ vàng tăng đột biến trong bối cảnh bất ổn địa chính trị và kinh tế toàn cầu kéo dài"", WGC nhấn mạnh. Ngân hàng Trung ương Anh vẫn là nơi được ưa chuộng nhất để lưu trữ kim loại quý, theo khảo sát của WGC. Năm nay, giá vàng đã tăng gần 30%, chạm mức cao kỷ lục 3.500 USD một ounce cuối tháng 4. Mức này cao gần gấp đôi so với tháng 2/2022, thời điểm xung đột Nga - Ukraine mới nổ ra. Kết quả khảo sát cũng cho thấy 95% ngân hàng trung ương tin rằng lượng vàng dự trữ tiếp tục tăng trong 12 tháng tới. Đây là tỷ lệ cao nhất từng ghi nhận, tăng so với 81% trong khảo sát năm ngoái. Bên cạnh đó, 59% ngân hàng trung ương cho rằng các yếu tố như xung đột thương mại và thuế nhập khẩu có liên quan đến chiến lược quản lý dự trữ của họ. So với các nước phát triển, những yếu tố này tác động đến các nền kinh tế mới nổi và đang phát triển nhiều hơn. Một báo cáo tuần trước của Ngân hàng Trung ương châu Âu (ECB) cũng cho biết trong 3 năm qua, ""các nước có quan hệ địa chính trị gần gũi với Trung Quốc và Nga"" mua vàng nhiều hơn các nước khác. Báo cáo cho biết kim loại quý được coi là biện pháp phòng ngừa nguy cơ bị đóng băng tài sản tài chính do lệnh trừng phạt. Hà Thu(theo Reuters)"
VN Express,https://vnexpress.net/canada-muon-dat-thoa-thuan-kinh-te-voi-my-trong-30-ngay-4899779.html,Quốc tế,"Canada,Mỹ,thuế nhập khẩu,Mark Carney,thỏa thuận thương mại,thỏa thuận kinh tế","Thứ ba, 17/6/2025, 11:28 (GMT+7)",Canada muốn đạt thỏa thuận kinh tế với Mỹ trong 30 ngày,"Thủ tướng Canada Mark Carney thông báo ông và Tổng thống Mỹ Donald Trump thống nhất hai nước sẽ hoàn tất một thỏa thuận an ninh - kinh tế mới trong 30 ngày. Thông báo được đưa ra bất ngờ, chỉ vài giờ sau khi giới chức Canada cho biết hai bên vẫn còn nhiều việc phải làm để đạt thỏa thuận. ""Tổng thống Trump và Thủ tướng Carney đã cập nhật nhiều vấn đề từng được nêu ra trong các cuộc đàm phán. Hai lãnh đạo thống nhất tiếp tục thảo luận hướng tới một thỏa thuận mới trong 30 ngày tới"", thông báo của Văn phòng Thủ tướng Canada ngày 16/6 cho biết. Dù vậy, cơ quan này không khẳng định liệu Canada sẽ chấp nhận Mỹ giữ lại một số thuế nhập khẩu hay không. Ông Carney chiến thắng trong cuộc bầu cử hồi tháng 4 nhờ cam kết ngăn chặn chính sách thuế của ông Trump. Hai bên đã gặp nhau bên lề Hội nghị Thượng đỉnh G7 tại Canada. Tại đây, ông Trump vẫn nhấn mạnh quan điểm ủng hộ thuế nhập khẩu. ""Tôi và Mark có quan điểm khác nhau. Chúng tôi sẽ xem liệu có thể tìm được tiếng nói chung hay không. Tôi vẫn thích thuế nhập khẩu"", ông Trump nói. Trước đó, ông Trump cho biết thỏa thuận với Canada là khả thi, nhưng nhấn mạnh thuế nhập khẩu vẫn phải đóng vai trò quan trọng. Chính phủ Canada đến nay vẫn phản đối mạnh điều này. Canada hiện là nước cung cấp nhôm, thép lớn nhất cho Mỹ. Từ đầu tháng này, thuế nhập khẩu nhôm, thép vào Mỹ được nâng gấp đôi,lên 50%. Tuần trước, ông Carney cho biết hai nước đang đàm phán tích cực về thuế nhập khẩu. Canada cũng đã chuẩn bị phương ántrả đũanếu đàm phán không thành công. Trước đó, Canada đã nhiều lầnáp thuế trả đũaMỹ. 10 ngày qua, kỳ vọng về một thỏa thuận nhanh chóng đã giảm dần, khi quan chức Canada nhận định Mỹ dường như không vội vàng. ""Chúng tôi vẫn đang trong quá trình thảo luận. Lập trường là không nên áp thuế hàng Canada xuất khẩu sang Mỹ. Chúng tôi sẽ tiếp tục đàm phán đến khi tìm được thỏa thuận tốt nhất có thể"", Đại sứ Canada tại Washington Kirsten Hillman cho biết sau cuộc gặp giữa ông Carney và ông Trump. Hà Thu(theo Reuters)"
VN Express,https://vnexpress.net/my-anh-cong-bo-chi-tiet-thoa-thuan-thuong-mai-4899778.html,Quốc tế,"Donald Trump,Anh,Mỹ,Keir Starmer,thuế nhập khẩu,thỏa thuận thương mại","Thứ ba, 17/6/2025, 10:49 (GMT+7)",Mỹ - Anh công bố chi tiết thỏa thuận thương mại,"Ngày 16/6, Tổng thống Mỹ Donald Trump ký thỏa thuận chính thức giảm một số loại thuế nhập khẩu với Anh, như ôtô, máy bay và linh kiện máy bay. Thông tin này được ông Trump và Thủ tướng Anh Keir Starmer công bố bên lề Hội nghị Thượng đỉnh G7 đang diễn ra tại Canada. Theo đó, mỗi năm, 100.000 xe hơi của Anh xuất khẩu sang Mỹ sẽ chỉ bị áp thuế 10%, thấp hơn nhiều so với mức 25% mà các quốc gia khác hiện phải chịu. Ngoài ra, theo sắc lệnh do Nhà Trắng công bố, Mỹ cũng dự định áp hạn ngạch nhập khẩu với thép và nhôm từ Anh. Các mặt hàng trong hạn ngạch sẽ được miễn thuế, với điều kiện Anh phải chứng minh chuỗi cung ứng và năng lực sản xuất không đe dọa an ninh quốc gia Mỹ. Mức hạn ngạch cụ thể sẽ do Bộ trưởng Thương mại Mỹ Howard Lutnick quyết định. Anh trước đó cũng tránh đượcmức thuế 50%mà ông Trump áp với nhôm, thép của các nước khác từ đầu tháng. Mức nước này hiện phải chịu chỉ là 25%. Dù vậy, họ sẽ phải đạt thỏa thuận với Mỹ trước ngày 9/7 để tránh thuế bị nâng lên. Hai bên cũng thống nhất miễn thuế nhập khẩu cho ngành hàng không Anh, gồm cả máy bay và linh kiện máy bay. Tuy nhiên, một số lĩnh vực quan trọng khác, như dược phẩm, lại không được đề cập. Trong sự kiện công bố hôm 16/6, Tổng thống Trump ca ngợi mối quan hệ với Anh là ""tuyệt vời"". ""Chúng tôi đã ký và thỏa thuận đã hoàn tất"", ông nói. Thủ tướng Anh cũng gọi đây là ""một ngày rất tốt đẹp với cả hai quốc gia"". Anh là nước đầu tiên đạt thỏa thuận giảm thuế nhập khẩu với Mỹ. Đổi lại, nước này cũng chấp thuận giảm thuế với bò và ethanol của Mỹ, nhưng khẳng định các sản phẩm này vẫn sẽ phải đáp ứng tiêu chuẩn thực phẩm ngặt nghèo của Anh. Đầu tháng trước, hai quốc gia cho biết đãđạt thỏa thuận thương mại. Tuy nhiên hôm đó, hai bên chưa ký kết văn bản nào và cũng không công bố nhiều chi tiết. Việc thực thi thỏa thuận sẽ mất nhiều thời gian, do nhiều chi tiết cần được thống nhất thêm và một số vấn đề vẫn cần làm rõ. Anh gọi thỏa thuận này là chiến thắng lớn cho ngành hàng không và xe hơi. ""Việc đưa các thỏa thuận thương mại vào thực thi thường mất nhiều tháng, nhưng chúng tôi đã hoàn tất loạt cam kết đầu tiên chỉ trong vài tuần. Và chúng tôi sẽ không dừng lại ở đây"", Bộ trưởng Thương mại Anh Jonathan Reynolds tuyên bố. Ông cho biết hai nước đang nỗ lực nhằm đạt được ""những ưu đãi đáng kể"" cho ngành dược phẩm Anh. Hà Thu(theo Reuters)"
VN Express,https://vnexpress.net/loat-cong-ty-bat-dong-san-chia-thuong-cho-co-dong-muc-cao-nhat-nhieu-nam-4899312.html,Doanh nghiệp,"Bất động sản,chia thưởng,Đất Xanh,DIC Corp,Vefac,SJ Group","Thứ ba, 17/6/2025, 13:12 (GMT+7)",Loạt công ty bất động sản chia thưởng cho cổ đông mức cao nhất nhiều năm,"Một số công ty bất động sản như Vefac, DIC Corp, Đất Xanh, SJ Group… trả cổ tức cho cổ đông lên đến vài trăm phần trăm sau nhiều năm không thực hiện. Ngày 4/7, Công ty cổ phần Trung tâm Hội chợ Triển lãm Việt Nam (Vefac) sẽ trả cổ tức với tỷ lệ 435% (tương ứng mỗi cổ phiếu nhận 43.500 đồng). Trong đó, 135% là cổ tức của năm 2024, nguồn vốn thực hiện từ khoản lợi nhuận sau thuế chưa phân phối lũy kế đến cuối năm ngoái. Số cổ tức còn lại là khoản công ty tạm ứng đợt một năm nay. Vefac sẽ sử dụng lợi nhuận sau thuế quý đầu năm (17.220 tỷ đồng) để chi trả khoản này. Với hơn 166 triệu cổ phiếu đang lưu hành, tổng số tiền công ty cần chi cho đợt cổ tức này ước tính khoảng 7.247 tỷ đồng. Vefac là công ty con của tập đoàn Vingroup, đồng thời là chủ đầu tư khu đô thị mới tại các xã Xuân Canh, Đông Hội và Mai Lâm, huyện Đông Anh (tên thương mại Vinhomes Global Gate). Đây là lần đầu tiên công ty con của Vingroup trả cổ tức kể từ khi giao dịch cổ phiếu trên UPCoM năm 2015. Năm nay, nhiều doanh nghiệp bất động sản khác cũng ""dốc hầu bao"" trả cổ tức đậm. Công ty cổ phần Phát triển đô thị Công nghiệp số 2 (D2D) vừa gây chú ý khi trả cổ tức bằng tiền với tỷ lệ 84%, tức mỗi phiếu nhận 8.400 đồng. Với hơn 30,2 triệu cổ phiếu đang lưu hành, D2D cần chi hơn 254 tỷ đồng trả cổ tức, tức chiếm gần 99% lợi nhuận lũy kế đến cuối năm 2024. Một số công ty địa ốc như Idico (IDC), Sonadezi Long Bình (SZB), Sonadezi Giang Điền (SZG) cũng mạnh tay trả cổ tức tiền mặt.  Ngoài hình thức tiền mặt, các công ty bất động sản khác còn trả cổ tức bằng cổ phiếu. SJ Group công bố Nghị quyết Hội đồng quản trị phát hành 182,6 triệu cổ phiếu để chia thưởng cho cổ đông với tổng tỷ lệ 159%. Trong đó, 86,25 triệu cổ phiếu sẽ được doanh nghiệp này dùng trả cổ tức các năm 2018, 2019, 2020, 2021 và 2024. Số còn lại được công ty thưởng cho cổ đông với tỷ lệ 83,9%. Nguồn vốn để chia thưởng được lấy từ lợi nhuận chưa phân phối (866 tỷ đồng), quỹ đầu tư phát triển (745 tỷ đồng) và thặng dư vốn cổ phần (218 tỷ đồng). Để phát hành số cổ phiếu trên, SJ Group sẽ phải sử dụng số tiền có trong 3 khoản mục trên. Đạt Phương, CNT, Vinaconex, DIC Corp, Nhà Đà Nẵng, Đất Xanh... cũng công bố phát hành hàng chục triệu cổ phiếu để chia thưởng cho cổ đông với tỷ lệ cao nhất trong nhiều năm trở lại đây. Nhìn chung, những công ty địa ốc trả cổ tức caođều thuộc nhóm đã trải qua một quãng thời gian chưa thực hiện việc này nên dồn vào năm nay. Ngoài ra, các doanh nghiệp trả cổ tức bằng cổ phiếu thể hiện việc họ đang cần huy động vốn, đặc biệt trong bối cảnh nhóm bất động sản thu hút dòng tiền từ đầu năm. Theo thống kê từ Chứng khoán Vietcap, VN-index - chỉ số đại diện cho thị trường chứng khoán Việt Nam - đã tăng khoảng 3% trong 5 tháng đầu năm. Tuy nhiên, các cổ phiếu bất động sản đã tăng 45,32%. Không chỉ tăng trưởng trong nửa đầu năm, các cổ phiếu bất động sản vẫn được các chuyên gia đánh giá sẽ có diễn biến khả quan, giúp các doanh nghiệp dễ dàng huy động vốn hơn. Ông Nguyễn Trọng Đình Tâm, Phó giám đốc Khối Phân tích, Chứng khoán Asean, dự báo lợi nhuận của nhóm bất động sản có thể tăng 15% năm nay, hỗ trợ tích cực cho giá cổ phiếu. Ngoài ra, ông cho rằng câu chuyện sáp nhập cũng sẽ là chất xúc tác cho đà đi lên của nhóm này. Bên cạnh tăng trưởng lợi nhuận, Chứng khoán Yuanta chỉ ra một số yếu tố khác giúp các doanh nghiệp bất động sản hưởng lợi trong nửa cuối năm. Đó là lãi suất vay mua nhà đã ổn định ở mức thấp 5,5-7,5% một năm, cho kỳ hạn 12-36 tháng. Ngay cả việc tăng 0,5-1 điểm phần trăm cũng khó có thể ảnh hưởng đáng kể đến tâm lý thị trường bất động sản. Theo lời kêu gọi của Thủ tướng nhằm hỗ trợ thị trường địa ốc, Vietcombank, Agribank và BIDV đang cung cấp lãi suất rẻ 5,5% mỗi năm trong 5 năm cho những người vay dưới 35 tuổi. Nhiều ngân hàng khác cũng đang cung cấp lãi suất vay mua nhà khuyến mãi với các điều khoản và điều kiện khác nhau. Nguồn cung đi lên cũng là một yếu tố hỗ trợ. Theo dữ liệu từ Yuanta, trong quý I, thị trường có 19.760 căn hộ được phép mở bán tại TP HCM và Hà Nội, tăng 50% so với quý cuối năm 2024 và gấp 3,5 lần so với cùng kỳ 2023. Ngoài ra, thị trường ghi nhận 134.634 giao dịch trong quý đầu năm, tăng 20% so với quý trước và nhích 1% so với cùng kỳ năm ngoái. ""Mặc dù mức tăng này chưa phản ánh đà phục hồi mạnh mẽ, nhưng cho thấy nhu cầu cơ bản trên thị trường vẫn ổn định"", báo cáo của Yuanta nêu. Công ty chứng khoán này còn cho rằng việc Chính phủ đang đẩy mạnh cải cách hành chính và hoàn thiện khung pháp lý nhằm tạo nền tảng vững chắc cho sự phục hồi và tăng trưởng kinh tế, đặc biệt trong lĩnh vực bất động sản. Một loạt sửa đổi quan trọng trong Luật Đất đai, Nhà ở, Kinh doanh bất động sản đã góp phần làm rõ quy trình thủ tục và tạo thuận lợi trong phát triển cũng như cấp vốn cho các dự án. Việc đơn giản hóa quy trình xây dựng cũng đang được đẩy mạnh. Ngày 29/5, Thủ tướng đã đề xuất cắt giảm 30% thủ tục hành chính và thời gian xử lý liên quan đến cấp phép xây dựng. Đặc biệt, Yuanta nhận định phương án miễn giấy phép xây dựng cho các dự án đã có phê duyệt quy hoạch 1/500 là một bước ngoặt lớn với ngành bất động sản. Trọng Hiếu"
VN Express,https://vnexpress.net/tap-doan-cao-su-nang-co-tuc-len-1-600-ty-dong-4899886.html,Doanh nghiệp,"tập đoàn cao su,cổ tức,GVR","Thứ ba, 17/6/2025, 12:33 (GMT+7)",Tập đoàn Cao su nâng cổ tức lên 1.600 tỷ đồng,"Tập đoàn Công nghiệp cao su Việt Nam dành 1.600 tỷ đồng chia cổ tức tiền mặt, thay vì 1.200 tỷ đồng như kế hoạch ban đầu nhờ lợi nhuận tăng vọt. Phương án cổ tức năm 2024 mới được Tập đoàn Công nghiệp cao su Việt Nam (mã chứng khoán: GVR) thông qua tại phiên họp cổ đông thường niên sáng 17/6. GVR trước đó tính dành 1.200 tỷ đồng lợi nhuận để chia cổ tức tiền mặt 3%, tức mỗi cổ phiếu nhận 300 đồng. Tuy nhiên, kết quả kinh doanh năm ngoái tăng vọt nên ban lãnh đạo đề xuất dành 1.600 tỷ đồng để chia cổ tức, tương ứng tỷ lệ 4%. Ông Lê Thanh Hưng, Tổng giám đốc GVR, cho biết họ có đủ nguồn lực để vừa thanh toán cổ tức, vừa cân đối nguồn vốn và dòng tiền cho nhu cầu đầu tư, trả nợ năm nay. GVR năm ngoái đặt mục tiêu doanh thu hợp nhất xấp xỉ 25.000 tỷ đồng và lãi sau thuế 3.437 tỷ đồng, nhưng thực tế cao hơn 15% và 43%. Tăng trưởng chủ yếu nhờ giá bán mủ cao su cao hơn kỳ vọng ban đầu của ban lãnh đạo. Năm nay, doanh thu hợp nhất được kỳ vọng tăng thêm 8%, lên 31.044 tỷ đồng, mức cao nhất từ trước đến nay. Lợi nhuận sau thuế cũng dự kiến tăng 3% lên gần 5.000 tỷ đồng. GVR tiếp tục trình phương án dành 1.600 tỷ đồng để chia cổ tức 4%. Mảng cao su đang đóng góp khoảng 80% doanh thu. Phần còn lại đến từ chế biến gỗ, bất động sản khu công nghiệp, năng lượng và nông nghiệp. Tuy nhiên, diện tích vườn cao su trong nước đang thu hẹp dần vì các địa phương thu hồi đất để phát triển các công trình trọng điểm quốc gia. Do đó, GVR đang có kế hoạch mở rộng 40.000 ha ở Campuchia và 30.000 ha ở Lào để ổn định sản lượng và doanh thu mảng này. Lãnh đạo GVR nhận định năm nay là khởi đầu cho chu kỳ hồi phục của giá bán mủ cao su sau giai đoạn mất cân bằng cung cầu. Năm ngoái, giá bán bình quân đạt 43 triệu đồng một tấn nhưng dự báo năm nay lên 46-47 triệu đồng. ""Đây là dự báo thận trọng bởi giá bán bình quân 6 tháng đầu năm đã đạt gần 52 triệu đồng. Giá có thể điều chỉnh trong những tháng cuối năm nhưng do ảnh hưởng của yếu tố mùa vụ nên mức giảm không nhiều"", ông Trần Thanh Phụng - Phó tổng giám đốc GVR nói. Năm nay, ông Phụng dự báo nguồn cung thiếu hụt không đáng kể. Tuy nhiên, năm sau nguồn cung hụt hơn 1 triệu tấn so với nhu cầu và đến năm 2028 hụt khoảng 2 triệu tấn. Phương Đông"
VN Express,https://vnexpress.net/chu-tich-tong-giam-doc-viconship-muon-tham-gia-hdqt-hang-tau-hai-an-4902909.html,Doanh nghiệp,"Hải An,Viconship,vận tải biển","Thứ ba, 17/6/2025, 18:38 (GMT+7)","Chủ tịch, tổng giám đốc Viconship muốn tham gia HĐQT hãng tàu Hải An","Ông Nguyễn Xuân Dũng, Chủ tịch Viconship và Tổng giám đốc Tạ Công Thông là hai ứng cử viên tham gia HĐQT Vận tải và Xếp dỡ Hải An nhiệm kỳ 2023-2028. Thông tin này được Công ty cổ phần Vận tải và Xếp dỡ Hải An (mã chứng khoán: HAH) công bố trong tài liệu chuẩn bị cho phiên họp thường niên năm 2025. Trước đó, ngày 12/6, công ty này đã nhận đơn từ nhiệm vị trí thành viên Hội đồng quản trị (HĐQT) của ông Phạm Quang Khánh và Nguyễn Văn Trúc. Ông Nguyễn Xuân Dũng sinh năm 1979, có 3 bằng cử nhân và là Thạc sĩ Quản trị Kinh doanh. Doanh nhân này đã có hơn 20 năm công tác trong ngành ngân hàng. Tháng 4/2024, ông Dũng được bổ nhiệm làm Chủ tịch HĐQT Công ty cổ phần Container Việt Nam (Viconship). Còn ông Tạ Công Thông sinh năm 1985, có trình độ cử nhân quản trị kinh doanh bảo hiểm, kinh tế ngoại thương. Ông Thông được bầu làm thành viên HĐQT Viconship vào tháng 3/2021 và đảm nhận thêm vị trí Tổng giám đốc từ tháng 2/2024 đến nay. Viconship là doanh nghiệp có thị phần khai thác cảng lớn nhất Hải Phòng, chiếm khoảng 30%. Doanh nghiệp này cùng các công ty con gồm TNHH Trung tâm Logistics Xanh và TNHH MTV Dịch vụ Cảng Xanh đang sở hữu khoảng 15,3% vốn của Vận tải và Xếp dỡ Hải An. Nhóm Viconship trở thành cổ đông lớn của hãng tàu này vào cuối tháng 4 năm nay. Vận tải và Xếp dỡ Hải An hoạt động chính trong lĩnh vực cảng biển, vận tải biển. Doanh nghiệp này là công ty nội sở hữu đội tàu container lớn nhất Việt Nam với 16 chiếc, tổng sức chở khoảng 26.500 TEU. Năm nay, Hải An lên kế hoạch kinh doanh với tổng doanh thu 4.556 tỷ đồng và lợi nhuận hợp nhất sau thuế 865 tỷ, lần lượt tăng 13% và 8% so với thực hiện 2024. Công ty dự kiến trả cổ tức năm 2024 với tỷ lệ 10% tiền mặt và 30% bằng cổ phiếu. Trọng Hiếu"
VN Express,https://vnexpress.net/kiotviet-ho-tro-ho-kinh-doanh-giam-chi-phi-su-dung-may-tinh-tien-4902938.html,Doanh nghiệp,"máy tính tiền,hóa đơn điện tử,KiotViet","Thứ ba, 17/6/2025, 19:00 (GMT+7)",KiotViet hỗ trợ hộ kinh doanh giảm chi phí sử dụng máy tính tiền,"KiotViet giảm giá 30% phần mềm quản lý bán hàng, miễn phí sử dụng hóa đơn điện tử, chữ ký số, cung cấp giải pháp hỗ trợ tư vấn, lắp đặt... Các gói hỗ trợ nêu tại thông báo ""Đồng hành hộ kinh doanh giảm chi phí sử dụng máy tính tiền"" ngày 14/6. Loạt ưu đãi nhằm hưởng ứng thông điệp của Thủ tướng Chính phủ trong Công điện số 88 về việc hỗ trợ chi phí cho hộ kinh doanh áp dụng hóa đơn điện tử. Theo đó, KiotViet giảm giá 30% đối với phần mềm quản lý bán hàng. Với ưu đãi này, chỉ từ dưới 6.000 đồng mỗi ngày, nhóm SME, hộ kinh doanh có thể dễ dàng tiếp cận và sử dụng phần mềm với chi phí hợp lý. Song song đó, khách hàng của KiotViet cũng được miễn phí sử dụng hóa đơn điện tử và chữ ký số, theo chính sách được công bố ngày 14/5. Bên cạnh giảm chi phí phần mềm, doanh nghiệp cung cấp giải pháp hỗ trợ gồm: tư vấn, triển khai tận nơi, qua kênh online với đội ngũ hơn 1.500 chuyên viên tư vấn, chăm sóc khách hàng trên toàn quốc. KiotViet hỗ trợ khách hàng suốt quá trình tìm hiểu quy định, cài đặt, vận hành và triển khai hóa đơn điện tử khởi tạo từ máy tính tiền. Đại diện doanh nghiệp cho biết, đơn vị mong muốn đồng hành cộng đồng kinh doanh thực hiện đúng quy định pháp luật, phát triển bền vững trong thời kỳ chuyển đổi số. Bà Liên (55 tuổi, Hoàn Kiếm) đang kinh doanh cửa hàng tạp hóa nhỏ, là những khách hàng đầu tiên được áp dụng chính sách mới đối với phần mềm bán hàng của KiotViet từ 14/6. Bà cho biết trước đây bà gặp nhiều khó khăn trong việc thích nghi với việc bán hàng trong thời chuyển đổi số, vì đã quen với việc ghi chép thủ công. Với hóa đơn điện tử từ máy tính tiền, ban đầu bà chần chừ không sử dụng, phần vì ngại công nghệ mới, phần vì chi phí ban đầu khá cao đối với các hộ kinh doanh nhỏ lẻ. ""Khi được đội ngũ KiotViet tư vấn và hỗ trợ, tôi đã đăng ký sử dụng phần mềm. Sau vài ngày tôi đã nhập hàng hóa xong và làm quen được các thao tác cơ bản từ máy tính tiền"", bà Liên nói. KiotViet được thành lập từ năm 2014, cung cấp các phần mềm quản lý bán hàng phổ biến tại Việt Nam. Công ty hoạt động với cam kết tạo ra những sản phẩm hiệu quả cho mô hình kinh doanh vừa, nhỏ và siêu nhỏ. Các phần mềm của đơn vị có giao diện đơn giản, dễ sử dụng, tiết kiệm chi phí, được hơn 300.000 nhà bán hàng tin dùng. Các tính năng cơ bản gồm: doanh thu, dòng tiền, quản lý kho, xuất, in hoá đơn... Doanh nghiệp còn cung cấp cổng vận chuyển KiotViet; bán hàng online trên các nền tảng thương mại điện tử; giải pháp thanh toán Napas, VietQR, Visa, Mastercard; xuất hóa đơn điện tử hợp lệ theo quy định của cơ quan thuế và ký số trên cùng một ứng dụng... Hoàng Đan"
