Source,URL,Category,Keyword,Time,Title,Content
ZNews,https://znews.vn/chinh-phu-duoc-ban-hanh-nghi-quyet-de-sua-luat-post1563181.html,Xã hội,Null,"Thứ ba, 24/6/2025 22:45 (GMT+7)",Chính phủ được ban hành nghị quyết để sửa luật,"Ngày 24/6, Chủ tịch Quốc hội Trần Thanh Mẫn ký ban hành Nghị quyết số 206/2025 của Quốc hội về cơ chế đặc biệt xử lý khó khăn, vướng mắc do quy định của pháp luật. Theo đó, từ ngày 24/6/2025 đến hết ngày 28/2/2027 (thời gian nghị quyết có hiệu lực),Chính phủđược ban hành nghị quyết quy phạm pháp luật để điều chỉnh một số quy định của luật, nghị quyết do Chính phủ trình. Việc này chỉ được áp dụng trong thời gian luật, nghị quyết của Quốc hội chưa được sửa đổi, bổ sung theo trình tự rút gọn và phải được báo cáo Ủy ban Thường vụ Quốc hội, Quốc hội tại phiên họp, kỳ họp gần nhất. Nghị quyết cũng quy định, trường hợp việc ban hành nghị quyết của Chính phủ dẫn đến đồng thời phải sửa đổi các luật, nghị quyết của Quốc hội, pháp lệnh, nghị quyết của Ủy ban Thường vụ Quốc hội không do Chính phủ trình thì cơ quan chủ trì soạn thảo phải xin ý kiến cơ quan trình luật, nghị quyết, pháp lệnh đó. Đồng thời, Chính phủ phải báo cáo Ủy ban Thường vụ Quốc hội trước khi ban hành. Nếu việc ban hành nghị quyết của Chính phủ có nội dung điều chỉnh vấn đề chưa có luật, nghị quyết của Quốc hội quy định hoặc tác động lớn đến kinh tế - xã hội, quốc phòng, an ninh, đối ngoại thì phải xin ý kiến cơ quan có thẩm quyền của Đảng trước khi ban hành. Trường hợp nghị quyết của Chính phủ dẫn đến phải sửa đổi, bổ sung nghị định của Chính phủ, quyết định của Thủ tướng, thông tư của bộ trưởng, thủ trưởng cơ quan ngang bộ thì quy định ngay trong nghị quyết đó. Nghị quyết cũng quy định rõ, nghị quyết của Chính phủ phải xác định rõ thời điểm hết hiệu lực thi hành, và phải trước ngày 1/3/2027; danh mục văn bản quy phạm pháp luật và điều, khoản, điểm được đề xuất sửa đổi, bổ sung để bảo đảm tính thống nhất, đồng bộ. Ngoài ra, Nghị quyết cũng quy định, trong trường hợp luật, nghị quyết không do Chính phủ trình chưa được sửa đổi, Ủy ban Thường vụ Quốc hội được ban hành nghị quyết để điều chỉnh quy định của luật, nghị quyết và báo cáo Quốc hội tại kỳ họp gần nhất. Tương tự như nghị quyết của Chính phủ sửa đổi luật, nghị quyết của Ủy ban Thường vụ Quốc hội cũng phải xác định rõ thời điểm hết hiệu lực thi hành, và phải trước ngày 1/3/2027; danh mục văn bản quy phạm pháp luật và điều, khoản, điểm được đề xuất sửa đổi, bổ sung để bảo đảm tính thống nhất, đồng bộ. Nghị quyết cũng quy định, cơ quan, người có thẩm quyền phải ban hành văn bản quy phạm pháp luật theo thẩm quyền hoặc trình cấp có thẩm quyền ban hành văn bản quy phạm pháp luật theo trình tự, thủ tục rút gọn để xử lý các văn bản được điều chỉnh bởi nghị quyết của Chính phủ, Ủy ban Thường vụ Quốc hội trước ngày 1/3/2027. 3 phương án xử lý vướng mắc do quy định của pháp luật Theo quy định tại nghị quyết thì các khó khăn, vướng mắc do quy định của pháp luật được xác định là các quy định mâu thuẫn, chồng chéo trong cùng một văn bản quy phạm pháp luật hoặc giữa các văn bản quy phạm pháp luật. Quy định của văn bản quy phạm pháp luật không rõ ràng, có nhiều cách hiểu khác nhau, không hợp lý, không khả thi, gây khó khăn trong áp dụng, thực hiện pháp luật. Quy định của văn bản quy phạm pháp luật tạo gánh nặng chi phí tuân thủ; chưa có quy định của văn bản quy phạm pháp luật hoặc có quy định nhưng hạn chế việc đổi mới, sáng tạo, phát triển động lực tăng trưởng mới, khơi thông nguồn lực, thúc đẩy tăng trưởng kinh tế và hội nhập quốc tế. Nghị quyết cũng quy định 3 phương án xử lý các khó khăn, vướng mắc. Phương án 1 là giải thích luật, nghị quyết của Quốc hội, pháp lệnh, nghị quyết của Ủy ban Thường vụ Quốc hội; hướng dẫn áp dụng văn bản quy phạm pháp luật. Phương án 2 là ban hành văn bản quy phạm pháp luật theo trình tự, thủ tục rút gọn để quy định vấn đề mới hoặc sửa đổi, bổ sung, thay thế quy định hiện hành. Phương án 3 là ban hành nghị quyết của Chính phủ, nghị quyết của Ủy ban Thường vụ Quốc hội trong thời gian luật, nghị quyết của Quốc hội chưa được sửa đổi, bổ sung theo quy trình rút gọn nói trên. Tủ sách Xã hộigiới thiệu những cuốn sách hay và mới về các chủ đề từ thời sự, chính trị, đến giao thông, hạ tầng... Tủ sách đồng thời cung cấp nhiều kiến thức, dữ liệu để độc giả hiểu nhiều lĩnh vực khác nhau của đời sống xã hội.  Quốc hội thông qua sửa Hiến pháp, cấp huyện dừng hoạt động từ 1/7 10:06 16/6/202510:0616/6/2025Xã hộiXã hội 0 Theo nghị quyết vừa được Quốc hội thông qua, Thủ tướng sẽ chỉ định chủ tịch, phó chủ tịch UBND ở các tỉnh, thành phố trực thuộc Trung ương hình thành sau sắp xếp.  Thí điểm Viện KSND khởi kiện vụ án dân sự, bảo vệ nhóm dễ tổn thương 15 giờ trước11:5724/6/2025Xã hộiXã hội 0 Quốc hội thông qua nghị quyết cho phép Viện Kiểm sát Nhân dân thí điểm khởi kiện vụ án dân sự để bảo vệ lợi ích công và nhóm dễ bị tổn thương khi không có ai đứng ra khởi kiện.  Quốc hội biểu quyết nhiều dự án luật, họp bàn công tác nhân sự 20 giờ trước07:0524/6/2025Xã hộiXã hội 0 Cùng với việc biểu quyết thông qua nhiều dự án luật và Nghị quyết quan trọng, trong buổi chiều ngày 24/6, Quốc hội sẽ họp riêng về công tác tổ chức, nhân sự thuộc thẩm quyền."
ZNews,https://znews.vn/tu-17-nguoi-dan-di-cong-chung-phai-chup-anh-cung-cong-chung-vien-post1563191.html,Xã hội,Null,"Thứ ba, 24/6/2025 09:53 (GMT+7)","Từ 1/7, người dân đi công chứng phải chụp ảnh cùng công chứng viên","Luật Công chứng được Quốc hội thông qua tại Kỳ họp thứ 8 sẽ có hiệu lực từ ngày 1/7. Một trong những điểm mới đáng chú ý là quy định người đi công chứng phải chụp ảnh tại thời điểm ký văn bản, dưới sự chứng kiến trực tiếp của công chứng viên. Từ 1/7, người dân đi công chứng phải chụp ảnh cùng công chứng viên.Ảnh minh họa. Theo đó, khoản 1 Điều 50 nêu rõ: ""Người yêu cầu công chứng, người làm chứng, người phiên dịch phải ký vào từng trang của giao dịch trước sự chứng kiến trực tiếp của công chứng viên, trừ trường hợp quy định tại khoản 2 Điều này và trường hợp người yêu cầu công chứng không ký được và không điểm chỉ được. Việc ký văn bản công chứng điện tử thực hiện theo quy định của Chính phủ. Việc ký văn bản công chứng trước sự chứng kiến của công chứng viên phải được chụp ảnh và lưu trữ trong hồ sơ công chứng"". Quy định không phải chụp ảnh khi công chứng là trong trường hợp người có thẩm quyền giao kết giao dịch của tổ chức tín dụng, doanh nghiệp, hợp tác xã, liên hiệp hợp tác xã đã đăng ký chữ ký mẫu tại tổ chức hành nghề công chứng thì người đó có thể ký trước vào văn bản giao dịch; công chứng viên phải đối chiếu chữ ký của họ trong văn bản giao dịch với chữ ký mẫu trước khi thực hiện việc công chứng (khoản 2 Điều 50). Tại Nghị định số 104/2025 của Chính phủ quy định chi tiết một số điều và biện pháp thi hành Luật Công chứng cũng dành Điều 46 (Chụp ảnh công chứng viên chứng kiến việc ký văn bản công chứng) hướng dẫn chi tiết quy định này. Cụ thể, ảnh chụp công chứng viên chứng kiến việc ký văn bản công chứng phải đáp ứng 3 yêu cầu. Một là nhận diện được người ký văn bản công chứng và công chứng viên thực hiện việc công chứng. Hai là rõ ràng, sắc nét, không dễ bay màu hoặc phai mực; không được cắt ghép, chỉnh sửa, thêm, bớt chi tiết hoặc bối cảnh. Bà là được in màu hoặc đen trắng trên giấy A4; trường hợp sử dụng giấy in ảnh chuyên dụng thì kích thước ảnh tối thiểu là 13cm x 18cm. Nghị định cũng quy định trường hợp có nhiều người tham gia giao dịch ký văn bản công chứng tại cùng một thời điểm và cùng một địa điểm thì có thể chụp ảnh từng người ký trước sự chứng kiến công chứng viên hoặc chụp ảnh chung tất cả những người ký trước sự chứng kiến công chứng viên. Còn trường hợp nhiều người tham gia giao dịch ký văn bản công chứng tại các thời điểm hoặc địa điểm khác nhau thì chụp ảnh người ký văn bản công chứng trước sự chứng kiến của công chứng viên tại các thời điểm hoặc địa điểm tương ứng. Ảnh chụp là một thành phần của hồ sơ công chứng, chỉ được lưu trữ và sử dụng theo quy định pháp luật về lưu trữ hồ sơ công chứng. ""Trường hợp người yêu cầu công chứng và công chứng viên thấy cần thiết thì có thể quay phim quá trình diễn ra việc các bên tham gia giao dịch ký văn bản công chứng; tư liệu hình ảnh là một thành phần của hồ sơ công chứng, chỉ được lưu trữ và sử dụng theo quy định pháp luật về lưu trữ hồ sơ công chứng"", Nghị định số 104/2025 nêu rõ. Sách hay về xã hội Văn minh Việt Nam- nhà dân tộc học Georges Condominas từng nhận xét tác phẩm này là “Cửa sổ để thế giới hiểu về Việt Nam”. SáchBàn về Quốc hội - những thách thức của những khái niệmlà kết quả của cả một quá trình tích lũy và suy ngẫm của tiến sĩ Nguyễn Sĩ Dũng, nguyên Phó chủ nhiệm Văn phòng Quốc hội.  CSGT TP.HCM thí điểm mua bán xe trên VneID, không cần công chứng Bộ Công an chọn TP.HCM triển khai thí điểm giao dịch chuyển quyền sở hữu điện tử phục vụ sang tên xe trên Cổng dịch vụ công Bộ Công an.  Từ 1/3, học lái xe ở đâu? Cục Đường bộ Việt Nam yêu cầu các sở GTVT tiếp tục thực hiện quản lý công tác đào tạo lái xe, đào tạo, kiểm tra, cấp chứng chỉ bồi dưỡng kiến thức pháp luật về giao thông đường bộ.  Nghiêm cấm liên hoan, chúc mừng nhận chức, lên chức khi sáp nhập 3 giờ trước23:2624/6/2025Xã hộiXã hội 0 Ban Bí thư lưu ý hạn chế việc tổ chức tổng kết, gặp mặt, chia tay; nghiêm cấm việc tổ chức liên hoan, chúc mừng nhận chức, lên chức liên quan đến sắp xếp, hợp nhất đơn vị hành chính."
ZNews,https://znews.vn/xe-dau-keo-container-bay-cabin-khi-va-cham-o-binh-duong-post1563189.html,Xã hội,Null,"Thứ ba, 24/6/2025 12:09 (GMT+7)",Xe đầu kéo container bay cabin khi va chạm ở Bình Dương,"Theo thông tin ban đầu, rạng sáng 24/6, chiếc xe đầu kéo container lưu thông trên đường Mỹ Phước Tân Vạn theo hướng từ Bình Phước đi Bình Dương. Khi đi đến đoạn thuộc khu phố 3B (phường Thới Hòa, thành phố Bến Cát, tỉnh Bình Dương) thì bất ngờ tông vào đuôi một xe đầu kéo container khác đang đậu. Cú tông mạnh khiến cabin xe đầu kéo bị tách rời, lao xuống đường, thùng container trượt khỏi khung. Tài xế may mắn chỉ bị thương nhẹ. Hiện trường vụ tai nạn. Ngay sau khi xảy ra vụ tai nạn, lực lượng chức năng địa phương đã tới hiện trường, tiến hành khám nghiệm, phân luồng giao thông qua khu vực. Đến 10 giờ sáng cùng ngày, sau khi hoàn tất công tác khám nghiệm, xe cẩu đến, di dời xe đầu kéo container ra khỏi hiện trường. Nguyên nhân vụ tai nạn đang được công an điều tra làm rõ. Thực trạng giao thông, văn hóa ứng xử của người tham gia, văn hóa quản lý, điều hành giao thông, các vấn đề liên quan tới quy hoạch và giải pháp xây dựng giao thông Việt Nam trong tương lai đều được PGS.TS. Phạm Ngọc Trung đề cập tới trong cuốnVăn hóa giao thông ở Việt Nam hiện nay.  Người đàn ông tử vong sau va chạm với xe lôi tự chế bán rau ở TP.HCM Chiếc xe lôi tự chế chở rau củ va chạm xe máy khiến người đàn ông đang đi lấy bánh mì ở quận Gò Vấp tử vong tại chỗ.  Một cán bộ cảnh sát giao thông Đắk Lắk nói người dân ‘mồm thối’ Đoạn clip được chia sẻ trên mạng xã hội có nội dung một cán bộ cảnh sát giao thông Đắk Lắk chửi dân “mồm thối” khi đo nồng độ cồn.  Phà Cát Lái kẹt cứng đến nửa đêm, ôtô 'chôn chân' suốt 4 giờ Khu vực quanh phà Cát Lái kẹt xe từ chiều tối 22/6 và đến gần nửa đêm vẫn ùn tắc nghiêm trọng, ôtô xếp dài hơn 3 km, nhiều người đợi 4 tiếng vẫn chưa qua được phà."
ZNews,https://znews.vn/kiem-tra-dot-xuat-co-so-an-uong-o-ha-noi-25-co-so-khong-dat-post1563180.html,Xã hội,Null,"Thứ ba, 24/6/2025 22:48 (GMT+7)","Kiểm tra đột xuất cơ sở ăn uống ở Hà Nội, 25 cơ sở không đạt","Ngày 24/6, Phó Chủ tịch UBND TP Hà Nội Vũ Thu Hà     chủ trì Hội nghị đánh giá công tác triển khai “Tháng hành động vì ATTP”     năm 2025 của Hà Nội và nhiệm vụ trọng tâm 6 tháng cuối năm 2025. Báo     cáo kết quả triển khai Tháng hành động vì ATTP 2025 cho thấy, toàn TP     Hà Nội thành lập 627 đoàn kiểm tra, giám sát về ATTP, trong đó, 17 đoàn     cấp TP; 55 đoàn cấp quận, huyện, thị xã: 555 đoàn cấp xã, phường, thị trấn. 3 đoàn kiểm tra liên ngành TP đã kiểm tra đột xuất, định kỳ 36 cơ sở sản xuất, chế biến, kinh doanh thực phẩm, dịch vụ ăn uống.     Trong đó, có 25/36 cơ sở không đạt (tỷ lệ 69,4%); giao Ban Chỉ đạo ATTP     quận, huyện, thị xã xử lý vi phạm 18 cơ sở với số tiền phạt hơn 610     triệu đồng; tiếp tục làm việc, xử lý vi phạm theo quy định với 7 cơ sở. Các lỗi vi phạm chủ yếu về điều kiện cơ sở vật chất, trang thiết bị dụng     cụ, bảo quản thực phẩm, nguyên liệu thực phẩm không bảo đảm (khu vực     sản xuất không bố trí theo nguyên tắc một chiều, cống rãnh hở, ứ đọng,     khu vực chứa đựng bảo quản thực phẩm thiếu giá kệ, khu vực sản xuất, chế     biến có côn trùng (ruồi)... Phó Chủ tịch UBND TP Vũ Thu Hà phát biểu chỉ đạo tại hội nghị. Ảnh:UBND TP Hà Nội. Về công tác kiểm tra nhóm sản phẩm     dinh dưỡng, thực phẩm chức năng, 2 đoàn kiểm tra liên ngành của thành     phố đã kiểm tra tại 6 cơ sở sản xuất thực phẩm bảo vệ sức khỏe trên địa     bàn, lấy 9 mẫu để kiểm nghiệm các chỉ tiêu theo quy định. Tuy     nhiên, các cơ sở đa phần chưa thực sự hợp tác với các đoàn kiểm tra, 2     trong 6 cơ sở tại thời điểm đoàn kiểm tra thông báo đóng cửa, dừng hoạt     động (tuy nhiên vẫn có hoạt động sản xuất các ngày trước đó). Cá     biệt có một cơ sở không thực hiện lưu mẫu của bất cứ sản phẩm hay     nguyên liệu nào sau khi sản xuất, số lượng sản phẩm theo cơ sở báo cáo     ít hơn thực tế sản xuất và lưu thông. ""Đặc biệt, có 2 vụ án, 8 bị     can bị khởi tố về tội sản xuất, buôn bán hàng giả là lương thực, thực     phẩm theo Điều 193 Bộ luật Hình sự, 7 vụ việc chuyển cơ quan công an xác     minh, điều tra, xử lý (đang chờ kết quả)"", báo cáo nêu. Phát biểu tại hội nghị, Phó Chủ tịch UBND TP Vũ Thu Hà cho biết, Hà Nội     yêu cầu các công việc không gián đoạn khi chuyển tiếp giữa hai mô hình,     đặc biệt là công tác bảo đảm ATTP. ""Hiện nay, TP đang chuẩn bị cho các     hoạt động kỷ niệm 80 năm Cách mạng tháng Tám thành công và Quốc khánh     2/9. Trong đó, Chủ tịch UBND TP Hà Nội đã chỉ đạo triển khai ngay các     biện pháp bảo đảm ATTP từ ngày 1/7"", bà Hà nói. Riêng nhóm quản     lý chặt chẽ việc tổ chức kinh doanh thức ăn đường phố chủ yếu trách     nhiệm của cấp xã phường. Do đó, bà Hà đề nghị các xã, phường mới rà     soát, triển khai các nội dung tuyên truyền, đảm bảo các lực lượng tổ     chức thực hiện. TP giao Sở Y tế chủ trì, phối hợp với các sở liên quan     để hướng dẫn chi tiết các quy định, điều kiện tổ chức kinh doanh thức ăn     đường phố, từ đó, các xã phường có cơ sở triển khai thực hiện... Tủ sách Xã hộigiới thiệu những cuốn sách hay và mới về các chủ đề từ thời sự, chính trị, đến giao thông, hạ tầng... Tủ sách đồng thời cung cấp nhiều kiến thức, dữ liệu để độc giả hiểu nhiều lĩnh vực khác nhau của đời sống xã hội.  Một công nhân tử vong do cột điện rơi trúng 12:05 26/5/202512:0526/5/2025Xã hộiXã hội 0 Dù nhanh chóng được đưa đến bệnh viện cấp cứu song ông Đ.T.L đã không qua khỏi sau khi bị cột điện rơi thẳng xuống, đè trúng trong lúc làm việc.  Xe container chở trụ điện lao xuống vực, hai người tử vong 10:46 18/3/202510:4618/3/2025Xã hộiXã hội 0 Hai người tử vong tại chỗ và một người bị thương trong vụ xe chở cột điện rơi xuống vực ở khu vực ngã ba Nhà thờ, gần trung tâm xã Đưng K'Nớ, huyện Lạc Dương (Lâm Đồng).  Nghiêm cấm liên hoan, chúc mừng nhận chức, lên chức khi sáp nhập 3 giờ trước23:2624/6/2025Xã hộiXã hội 0 Ban Bí thư lưu ý hạn chế việc tổ chức tổng kết, gặp mặt, chia tay; nghiêm cấm việc tổ chức liên hoan, chúc mừng nhận chức, lên chức liên quan đến sắp xếp, hợp nhất đơn vị hành chính."
ZNews,https://znews.vn/be-trai-4-thang-tuoi-bi-bo-roi-cung-giay-viet-tay-xin-loi-con-post1562202.html,Xã hội,Null,"Thứ ba, 24/6/2025 00:02 (GMT+7)",Bé trai 4 tháng tuổi bị bỏ rơi cùng giấy viết tay xin lỗi con,"Cháu bé hơn 4 tháng tuổi bị bỏ rơi đang được người dân chăm sóc. Chiều 23/6, ông Bùi Văn Hiển, Chủ tịch UBND thị trấn Mãn Đức (huyện Tân Lạc, tỉnh Hòa Bình), cho biết trên địa bàn vừa xảy ra vụ việc một cháu bé khoảng 4 tháng tuổi bị bỏ rơi. Theo đó, khoảng 1h45 ngày 21/6, một người dân trú tại khu Mường Cộng (thị trấn Mãn Đức) nghe tiếng khóc trẻ em ở hiên nhà. Khi ra ngoài thì phát hiện một cháu bé nằm trong hộp giấy, kèm theo một hộp sữa, một túi bỉm, vài bộ quần áo. Ngoài ra, người bỏ rơi đứa bé để lại tờ giấy với dòng chữ: ""Cháu khó khăn không có khả năng nuôi con, mong bác giúp cháu chăm sóc nuôi nấng con lớn khôn nên người... Mẹ xin lỗi con rất nhiều, con trai của mẹ"". Hiện cơ quan chức năng đang xử lý vụ việc theo quy định. Tủ sách Xã hộigiới thiệu những cuốn sách hay và mới về các chủ đề từ thời sự, chính trị, đến giao thông, hạ tầng... Tủ sách đồng thời cung cấp nhiều kiến thức, dữ liệu để độc giả hiểu nhiều lĩnh vực khác nhau của đời sống xã hội.  Bé gái sơ sinh bị bỏ rơi bên cạnh 'giấy từ bỏ nuôi con' Nghe tiếng khóc của trẻ nhỏ giữa đêm, vợ chồng anh L. ra kiểm tra thì phát hiện bé gái sơ sinh được bỏ lại trong làn nhựa trước cổng nhà kèm tờ giấy “từ bỏ nuôi con”.  Bé sơ sinh còn nguyên dây rốn và nhau thai bị bỏ rơi trên đường Một bé gái sơ sinh nặng 4 kg bị bỏ rơi tại đoạn đường thuộc thôn 4 (xã An Phú, TP Pleiku, Gia Lai) trong tình trạng còn dính dây rốn và nhau thai.  Bé gái 9 tháng tuổi bị bỏ rơi cùng lời khẩn cầu 'tìm người nuôi hộ' Một bé gái khoảng 9 tháng tuổi bị bỏ rơi ở Bệnh viện Nhi tỉnh Gia Lai. Cơ quan chức năng đang làm các thủ tục cần thiết để tìm người thân cho cháu bé."
ZNews,https://znews.vn/rua-vang-quy-hiem-lac-vao-san-nha-post1563183.html,Xã hội,Null,"Thứ ba, 24/6/2025 16:00 (GMT+7)",Rùa vàng quý hiếm ‘lạc’ vào sân nhà,"Ngày 24/6, Hạt Kiểm lâm huyện Hương Khê (Hà Tĩnh) xác nhận, đơn vị vừa phối hợp với Vườn Quốc gia Vũ Quang tiếp nhận một cá thể rùa vàng quý hiếm do người dân giao nộp. Cá thể rùa vàng quý hiếm được bàn giao cho cơ quan chức năng. Trước đó, vào ngày 22/6, chị Võ Thị Hồng Trang (thị trấn Hương Khê) ra mở cửa cổng thì phát hiện một cá thể rùa màu vàng nặng gần 0,2 kg trong sân nhà. Khi biết đây là loài rùa quý hiếm, được liệt kê trong Sách đỏ IUCN 2012 và cần được bảo vệ khẩn cấp nên chị Trang đã liên hệ cơ quan chức năng để bàn giao. Được biết, cá thể rùa này tên thường gọi là rùa Sa Nhân, tên khoa học là Cuora Mouhotii, là một loài rùa trên cạn rất quý hiếm, thuộc họ rùa đầm Emydidae và bộ rùa Testudinata, được tìm thấy nhiều ở khu vực các nước như Trung Quốc, Ấn Độ, Lào và Việt Nam. Tủ sách Xã hộigiới thiệu những cuốn sách hay và mới về các chủ đề từ thời sự, chính trị, đến giao thông, hạ tầng... Tủ sách đồng thời cung cấp nhiều kiến thức, dữ liệu để độc giả hiểu nhiều lĩnh vực khác nhau của đời sống xã hội.  Nhặt được cá thể cu li cực kỳ quý hiếm ở ven đường Tình cờ nhặt được một con vật nhỏ có thân hình lạ bên đường, anh Hoàng Ánh Q. (SN 1996) ở Quảng Bình đã mang con vật đến cơ quan chức năng giao nộp.  Bẫy ảnh phát hiện nhiều động vật quý hiếm tại Thanh Hóa Tại các tiểu khu của Khu Bảo tồn Thiên nhiên Pù Hu, để bảo tồn nguồn gen động thực vật đặc trưng, qua đặt bẫy ảnh, Ban Quản lý ghi nhận, phát hiện nhiều động vật hoang dã.  Trăn bạch tạng quý hiếm dài 5 m, ngày ăn 15 kg thức ăn Một con trăn bạch tạng dài khoảng 5 m vừa được Trung tâm Nuôi trồng nghiên cứu chế biến dược liệu Cục Hậu cần - Kỹ thuật (Quân khu 9) hay còn gọi Trại rắn Đồng Tâm tiếp nhận."
