Source,URL,Category,Keyword,Time,Title,Content
ZNews,https://lifestyle.znews.vn/tac-dung-that-su-cua-la-oi-trong-chua-tieu-duong-post1561350.html,Sức khỏe,Null,"Thứ năm, 26/6/2025 13:29 (GMT+7)",Tác dụng thật sự của lá ổi trong chữa tiểu đường,"Lá ổi là một vị thuốc quen thuộc, được ghi nhận có vị đắng, tính ấm, vào kinh tỳ và vị, có tác dụng sáp trường, sinh tân, thanh thử nhiệt. Ảnh:Freepik. Bác sĩ Dương Minh Tuấn, khoa Nội tiết - Đái tháo đường, Bệnh viện Bạch Mai, cho biết trong thực hành lâm sàng, ông từng gặp không ít bệnh nhân vừa mới được chẩn đoán đái tháo đường đã vội tin theo lời mách truyền miệng là ""uống nước lá ổi mỗi ngày sẽ khỏi bệnh"". Theo bác sĩ Tuấn, tâm lý tìm kiếm phương pháp ""tự nhiên"",  ít can thiệp và dễ thực hiện là điều dễ hiểu. Tuy nhiên, nếu chỉ dựa vào lá ổi mà từ chối điều trị theo y học hiện đại, người bệnh có thể phải trả giá bằng chính sức khỏe của mình. Trong y học cổ truyền, lá ổi là một vị thuốc quen thuộc, được ghi nhận có vị đắng, tính ấm, vào kinh tỳ và vị, có tác dụng sáp trường, sinh tân, thanh thử nhiệt. Với các triệu chứng tương ứng với bệnh đái tháo đường ngày nay như khát nhiều, tiểu nhiều, sụt cân, lá ổi từng được sử dụng như một giải pháp hỗ trợ. ""Về mặt dược lý hiện đại, các nghiên cứu cho thấy lá ổi chứa flavonoid, đặc biệt là quercetin - hoạt chất có thể ức chế enzym α-glucosidase, giúp làm chậm hấp thu đường sau ăn. Một số thử nghiệm nhỏ cho thấy trà lá ổi có thể góp phần cải thiện đường huyết và chỉ số HbA1c ở người tiền đái tháo đường"", bác sĩ Tuấn phân tích. Về mặt dược lý hiện đại, các nghiên cứu cho thấy lá ổi chứa flavonoid, đặc biệt là quercetin - hoạt chất có thể ức chế enzym α-glucosidase, giúp làm chậm hấp thu đường sau ăn. Ảnh:Thuocdantoc. Ông cho biết thêm tại Nhật Bản, một số sản phẩm trà lá ổi đã được đưa vào nhóm thực phẩm chức năng hỗ trợ kiểm soát đường huyết. Tuy nhiên, các bằng chứng khoa học vẫn còn hạn chế, thiếu các nghiên cứu lớn, dài hạn và chưa được chuẩn hóa về hàm lượng hoạt chất cũng như cách sử dụng. Đáng chú ý, đến nay, chưa có tổ chức chuyên ngành nào như từ Hiệp hội Đái tháo đường Mỹ (ADA), Hiệp hội Đái tháo đường châu Âu (EASD), đến Hội Nội tiết và Đái tháo đường Việt Nam, khuyến cáo dùng lá ổi như một phương pháp điều trị chính thức cho bệnh nhân đái tháo đường. Bên cạnh đó, việc tự ý sử dụng thảo dược mà không kiểm soát được liều lượng, cách chế biến hoặc thời điểm dùng có thể gây ra nhiều hệ lụy. Một số người gặp phải tác dụng phụ như rối loạn tiêu hóa, hạ đường huyết không mong muốn. Nguy hiểm hơn, không ít bệnh nhân bỏ thuốc tây, hoàn toàn dựa vào ""liệu pháp thiên nhiên"",  dẫn tới mất kiểm soát đường huyết, biến chứng sớm và nặng hơn. Đặc biệt nghiêm trọng là với bệnh nhân đái tháo đường type 1 -  thể bệnh phụ thuộc hoàn toàn vào insulin. Việc thay thế điều trị bằng lá ổi không chỉ vô hiệu mà còn có thể đẩy người bệnh vào tình trạng nhiễm toan ceton, hôn mê và nguy kịch nếu không được tiêm insulin kịp thời. Bác sĩ Tuấn cũng cảnh báo lá ổi có thể đóng vai trò hỗ trợ trong kế hoạch điều trị tổng thể nếu được sử dụng đúng cách và dưới sự giám sát y tế. Tuy nhiên, nó tuyệt đối không thể thay thế các nguyên tắc điều trị nền tảng gồm chế độ ăn hợp lý, luyện tập thể lực, theo dõi định kỳ và dùng thuốc theo chỉ định. Những lời từ trái tim bác sĩ Từ những kiến thức y khoa được chia sẻ một cách dễ hiểu, gần gũi, cung cấp kiến thức chăm sóc sức khỏe uy tín cho độc giả đến những câu chuyện đời, chuyện nghề tự mình chứng kiến và trải nghiệm, nhiều bác sĩ đã tạo nên những cuốn sách giàu giá trị, được đánh giá cao.  Bé 10 tuổi nhập viện vì bị chuột cắn Sau khi nhập viện, các bác sĩ đã tiêm huyết thanh kháng độc tố uốn ván, vaccine phòng dại và điều trị kháng sinh để ngăn ngừa nhiễm trùng lan rộng cho bệnh nhi.  6 lầm tưởng phổ biến về bệnh trĩ Nhiều người thường cho rằng thói quen ăn đồ cay nóng là nguyên nhân trực tiếp dẫn đến bệnh trĩ. Trên thực tế, điều này không hoàn toàn đúng.  Người đàn ông 39 tuổi chết não hiến 7 mô tạng, hồi sinh nhiều cuộc đời Nguyện vọng cuối cùng của gia đình người đàn ông 39 tuổi đã mang lại cơ hội sống cho nhiều người khác. Giữa khoảnh khắc sinh - tử, lòng nhân ái đã viết nên một câu chuyện xúc động về sự sống tiếp nối."
ZNews,https://lifestyle.znews.vn/vi-sao-bua-an-nen-keo-dai-it-nhat-20-phut-post1562864.html,Sức khỏe,Null,"Thứ năm, 26/6/2025 11:01 (GMT+7)",Vì sao bữa ăn nên kéo dài ít nhất 20 phút?,"Ăn quá nhanh, vừa ăn vừa xem điện thoại là những thói quen xấu cho hệ tiêu hóa. Ảnh:Freepik. Trong nhịp sống hiện đại đầy hối hả, nhiều người có xu hướng ăn uống vội vàng để tiết kiệm thời gian. Một số người thậm chí có thể hoàn tất cả bữa ăn chỉ trong vài phút, như một việc phải làm cho xong trước khi quay lại công việc hoặc các hoạt động khác trong ngày. Tuy nhiên, theo hãng tinAssociated Press, các chuyên gia cảnh báo rằng việc ăn quá nhanh không chỉ gây nghẹn, đầy bụng hay khó tiêu mà còn khiến bạn dễ nạp vào cơ thể nhiều thức ăn hơn mức cần thiết. Tiến sĩ Leslie Heinberg, chuyên gia tại Trung tâm Sức khỏe Hành vi Cleveland (Mỹ), cho biết nếu một người hoàn tất bữa ăn trong vòng 20-30 phút, điều đó có thể là dấu hiệu họ đang ăn quá nhanh. Bà giải thích rằng dạ dày cần khoảng 20 phút để gửi tín hiệu đến não rằng cơ thể đã đủ no. Khi ăn quá vội vàng, con người dễ bỏ qua tín hiệu này và tiếp tục ăn thêm, vô thức đưa cơ thể vào trạng thái quá tải. Không chỉ vậy, thói quen ăn nhanh còn làm tăng nguy cơ nuốt phải quá nhiều không khí, dẫn đến đầy hơi, khó tiêu. Nếu thức ăn không được nhai kỹ, hệ tiêu hóa phải hoạt động vất vả hơn để xử lý, làm giảm khả năng hấp thu dưỡng chất và thậm chí có thể gây tắc nghẽn thực quản. Một thói quen phổ biến khác là vừa ăn vừa xem điện thoại, tivi hoặc làm việc. Theo tiến sĩ Heinberg, điều này làm giảm khả năng nhận biết cảm giác no, khiến bạn ăn nhiều hơn mà không nhận ra. Ngược lại, khi toàn tâm tập trung vào bữa ăn, con người có xu hướng ăn ít hơn nhưng cảm thấy hài lòng hơn. Để hình thành thói quen ăn uống lành mạnh, chuyên gia khuyến nghị nên đặt điện thoại xuống, ngồi ăn trong không gian yên tĩnh và thư giãn. Bạn cũng có thể thử dùng tay không thuận khi cầm muỗng hoặc đũa, hoặc tạm ngưng giữa bữa để uống nước. Những hành động đơn giản này sẽ giúp làm chậm nhịp ăn một cách tự nhiên. Một mẹo khác được khuyên dùng là tăng số lần nhai trước khi nuốt, bởi việc nhai kỹ không chỉ hỗ trợ tiêu hóa mà còn khiến bạn cảm nhận rõ hương vị món ăn hơn. Bên cạnh đó, để kiểm soát tốt hơn lượng thức ăn, chuyên gia gợi ý bạn có thể bắt đầu bằng việc ghi lại nhật ký ăn uống, sử dụng đĩa nhỏ để tránh ăn quá nhiều và lên kế hoạch bữa ăn từ đầu ngày để chủ động kiểm soát khẩu phần. Làm thế nào để xua tan cơn giận dữ hay nỗi sợ hãi? Điều gì ảnh hưởng đến giấc ngủ hay nên đi ngủ vào thời gian nào? Nhằm nghiên cứu và đưa ra những chỉ dẫn cụ thể cho bạn đọc, Tri thức trực tuyến giới thiệu cuốnYang sheng: Chữa lành cơ thể, làm đẹp tâm hồncủa tác giả Katie Brindle.  Điều gì xảy ra khi ngủ với điều hòa cả đêm? Ngày càng phổ biến trong mỗi gia đình, điều hòa mang lại cảm giác dễ chịu giữa thời tiết oi bức. Nhưng nếu lạm dụng cả đêm, thiết bị này có thể âm thầm ảnh hưởng đến sức khỏe.  Cứu cô gái bị lưỡi kéo đâm xuyên sọ Nữ bệnh nhân 25 tuổi nhập viện trong tình trạng có vết thương sưng nề vùng thái dương trái do lưỡi kéo sắc nhọn găm sâu vào hộp sọ.  Vì sao ăn nhiều nhưng vẫn gầy? Một số người dù ăn rất nhiều nhưng cân nặng không tăng. Theo bác sĩ, nguyên nhân đến từ đặc điểm thể trạng, tỷ lệ trao đổi chất, yếu tố di truyền và cả thói quen ăn uống hàng ngày."
ZNews,https://lifestyle.znews.vn/de-nghi-xu-ly-duoc-pham-hoang-huong-meli-chinh-hang-ngan-98-post1563957.html,Sức khỏe,Null,"Thứ năm, 26/6/2025 20:46 (GMT+7)","Đề nghị xử lý 'Dược phẩm Hoàng Hường meli chính hãng’, Ngân 98","Tối 26/6, Cục An toàn thực phẩm, Bộ Y tế, cho biết thực hiện chỉ đạo của Thủ tướng Chính phủ, cơ quan này đã triển khai đồng bộ các giải pháp, tập trung kiểm tra, xử lý và tuyên truyền trong lĩnh vực an toàn thực phẩm trong tháng cao điểm từ ngày 17/5 đến 17/6. Theo đó, Cục đã có công văn gửi Cục Phát thanh Truyền hình và Thông tin điện tử (Bộ VH-TT-DL), đề nghị xử lý vi phạm quảng cáo đối với fanpage có tên ""Dược phẩm Hoàng Hường Meli chính hãng"". Fanpage Dược phẩm Hoàng Hường meli chính hãng, Ngân 98, Ngân collagen bị Bộ Y tế đề nghị xử lý. Cục An toàn thực phẩm cũng đã ban hành 9 công văn gửi các cơ quan: Cục Quản lý và Phát triển thị trường trong nước (Bộ Công thương), Sở An toàn thực phẩm TP.HCM, Chi cục An toàn vệ sinh thực phẩm Hà Nội, đề nghị phối hợp, kiểm tra, xử lý thông tin các sản phẩm giảm cân của các cá nhân có nickname Ngân 98, Ngân collagen. Qua rà soát, kiểm soát quảng cáo, kinh doanh thực phẩm trong thương mại điện tử, Cục An toàn thực phẩm đã có công văn gửi Cục Thương mại điện tử và Kinh tế số, Cục Quản lý và Phát triển thị trường trong nước (Bộ Công thương) để kiểm tra, xử lý 16 đường link vi phạm. Cục An toàn thực phẩm cũng có các công văn đề nghị Công ty TNHH Shopee và Công ty TNHH thương mại điện tử Lazada Việt Nam rà soát, ngừng kinh doanh, gỡ bỏ thông tin các sản phẩm không có giấy tiếp nhận đăng ký bản công bố sản phẩm rao bán trên 2 sàn thương mại điện tử này. Cũng theo Cục An toàn thực phẩm, trong tháng cao điểm đấu tranh ngăn chặn, đẩy lùi buôn lậu, gian lận thương mại, hàng giả, xâm phạm quyền sở hữu trí tuệ (từ 17/5-17/6/2026), cục này đã kiểm tra đột xuất 17 cơ sở sản xuất, kinh doanh thực phẩm chức năng tại 5 tỉnh, thành, gồm: Bắc Ninh, Thái Bình, Đồng Nai, Nam Định và Hà Nội. Qua đó, phát hiện 1 cơ sở vi phạm về ghi nhãn, 2 cơ sở vi phạm về quảng cáo; 1 cơ sở vi phạm cùng lúc 4 hành vi về điều kiện sản xuất, kinh doanh. Ngoài ra, có  4 cơ sở kinh doanh thực phẩm không hoạt động tại địa chỉ đã đăng ký.  Cục An toàn thực phẩm đang lấy ý kiến các bộ, ngành về tăng mức xử phạt hành chính đối với vi phạm trong lĩnh vực an toàn thực phẩm; tiếp tục phối hợp chặt chẽ với các cơ quan chức năng, xử lý nghiêm các hành vi vi phạm. Nước tăng lực sẽ gặm nhấm cơ thể bạn từ bên trong Nước tăng lực không làm bạn khỏe hơn, nó chỉ xua tan cảm giác mệt mỏi nhất thời. Có điều, loại đồ uống này sẽ gây ảnh hưởng xấu tới sức khỏe vì hàm lượng đường quá cao. Tất nhiên, nếu chỉ uống một hoặc hai chai về cơ bản sẽ không ảnh hưởng tới sức khỏe cơ thể. Tuy nhiên, mỗi khi uống các loại nước tăng lực, mọi người có lẽ sẽ không mấy khi ý thức rằng “mình đang hấp thu quá nhiều đường hay caffeine”. Chính sự “hấp thu trong vô thức” là nguyên nhân nguy hiểm của các loại nước uống tăng lực. Uống quá nhiều nhưng bản thân không ý thức được điều đó.  20 năm sống cùng bệnh thận của chàng trai 24 tuổi Khi bạn bè sống với đam mê và tự do, Hoàng Anh học cách lớn lên bên kim tiêm, dây truyền và một chiếc máy lặng lẽ giữ lại sự sống của mình mỗi tuần.  Men tim tăng 200 lần, bé gái 4 tuổi nguy kịch do sốt xuất huyết nặng Bé gái nhập viện với triệu chứng sốt cao, nôn ói, đau bụng, nhanh chóng rơi vào sốc sốt xuất huyết nặng, suy hô hấp, trụy mạch, tổn thương gan, tim, thận nghiêm trọng.  Bé gái 10 tuổi có hai tử cung, một quả thận Kết quả khám và siêu âm cho thấy bé gái ở Hà Tĩnh có tử cung đôi, một khối ứ dịch âm đạo phải và chỉ có thận trái."
ZNews,https://lifestyle.znews.vn/bac-si-o-tphcm-do-xung-dien-lap-lai-trat-tu-cho-trai-tim-lech-nhip-post1552804.html,Sức khỏe,Null,"Thứ năm, 26/6/2025 08:09 (GMT+7)","Bác sĩ ở TP.HCM dò xung điện, lập lại trật tự cho trái tim lệch nhịp","Trong phòng can thiệp của khoa Loạn nhịp Tim, Bệnh viện Thống Nhất (TP.HCM) ánh sáng được điều chỉnh dịu bớt để các màn hình điện sinh lý hiện rõ từng xung động tim. Không gian gần như không có tiếng nói, chỉ còn tiếng “bíp” đều đặn từ máy theo dõi sinh hiệu và âm thanh tim đập đang được ghi lại bằng tín hiệu điện. Bệnh nhân nằm yên trên bàn thủ thuật, chỉ được gây tê vùng mạch máu đùi. TS.BS Trương Quang Khanh, Trưởng khoa Loạn nhịp Tim, vừa thao tác qua màn hình vừa khẽ hỏi “Chú có thấy tức ngực không?” Người đàn ông 53 tuổi gật đầu nhẹ, vẫn tỉnh táo, như một người chứng kiến chính mình trong cuộc chiến bên trong trái tim. Một dây điện cực nhỏ, đầu chỉ khoảng 2 mm, được luồn qua mạch máu ở đùi vào tận bên trong buồng tim. Trên màn hình, nhịp tim hiện lên bằng những đường sóng điện học phức tạp, từng nhịp đập là bản đồ chỉ đường cho bác sĩ đi tìm nơi điện loạn. Mỗi thao tác chọc kim, luồn dây, định vị đầu đốt đều phải diễn ra chính xác từng milimet. Chỉ cần lệch khỏi bó His (nơi nối giữa nhĩ và thất) có thể khiến toàn bộ nhịp tim bị cắt đứt. Với bác sĩ làm điện sinh lý, sai số là điều không được phép xảy ra. Khi xác định đúng vị trí gây loạn nhịp, đầu đốt phát dòng điện tần số radio, đốt nóng vùng mô tim trong vài giây. Đó giống như hành động cắt đứt một đường dây điện lỗi, lập lại trật tự cho hệ thống điện sinh học phức tạp của trái tim. Trên màn hình máy điện sinh lý, tín hiệu điện học đột ngột thay đổi. Dòng điện bất thường vừa bị triệt tiêu. Trái tim, sau nhiều năm lệch nhịp đang đập lại đều đặn, như vừa được tái lập trình. Thủ thuật thành công, bác sĩ Khanh rút dần dây điện cực ra khỏi tim, băng ép lại vùng mạch máu. Sau khoảng 4-6 tiếng, bệnh nhân có thể tự đi lại bình thường. Người đàn ông 53 tuổi này đã được xử lý cùng lúc 2 cơ chế nhịp nhanh chỉ trong một giờ. Không chỉ gây hồi hộp, mệt mỏi, các cơn nhịp tim nhanh có thể khiến người bệnh ngất xỉu, tụt huyết áp, thậm chí đột tử. Với bệnh nhân mang hai loại loạn nhịp bẩm sinh, việc đốt điện không chỉ là điều trị mà là biện pháp sống còn. Cơ chế đốt điện là sử dụng nhiệt từ sóng radio để phá hủy ổ phát xung bất thường. Nếu nhịp tim là một bản nhạc, thì bác sĩ đang loại bỏ những nốt lạc tông, giúp trái tim trở lại giai điệu đúng của nó. Theo bác sĩ Khanh, từ 7h30 sáng đến tận 12h đêm, các ca đốt điện tim diễn ra liên tục. Có ngày tiếp nhận đến 20-22 ca, với ê-kíp thay phiên để không gián đoạn việc điều trị. Một ca đốt trung bình kéo dài 45 phút đến 3 tiếng.Với những ca khó, bác sĩ phải dò tìm từng tín hiệu, kích cơn nhịp nhanh giả lập nhiều lần để truy ra ổ bệnh. Ngày càng nhiều người trẻ mắc rối loạn nhịp tim. Nguyên nhân không chỉ là di truyền mà còn đến từ lối sống hiện đại như stress kéo dài, thức khuya, rượu bia, thực phẩm chứa sabutamol, một chất kích tim bị cấm trong chăn nuôi.  Biểu hiện nhỏ nhận biết huyết áp không bình thường Nhiều người có nguy cơ mắc bệnh huyết áp cao trong nhiều năm mà không xuất hiện bất kỳ dấu hiệu cảnh báo nào.  20 năm sống cùng bệnh thận của chàng trai 24 tuổi Khi bạn bè sống với đam mê và tự do, Hoàng Anh học cách lớn lên bên kim tiêm, dây truyền và một chiếc máy lặng lẽ giữ lại sự sống của mình mỗi tuần.  Men tim tăng 200 lần, bé gái 4 tuổi nguy kịch do sốt xuất huyết nặng Bé gái nhập viện với triệu chứng sốt cao, nôn ói, đau bụng, nhanh chóng rơi vào sốc sốt xuất huyết nặng, suy hô hấp, trụy mạch, tổn thương gan, tim, thận nghiêm trọng."
ZNews,https://lifestyle.znews.vn/be-trai-11-tuoi-thoat-nguy-co-vo-sinh-nho-ca-mo-noi-soi-ha-tinh-hoan-post1563741.html,Sức khỏe,Null,"Thứ năm, 26/6/2025 22:33 (GMT+7)",Bé trai 11 tuổi thoát nguy cơ vô sinh nhờ ca mổ nội soi hạ tinh hoàn,"Hình ảnh mổ nội soi cho bệnh nhi 11 tuổi. Ảnh:BVCC. Ngày 26/6, BVĐK tỉnh Cao Bằng cho biết đơn vị vừa phẫu thuật thành công cho một bệnh nhi 11 tuổi mắc dị tật tinh hoàn ẩn hai bên. Trước đó, bệnh nhi được gia đình đưa đến viện trong tình trạng không sờ thấy tinh hoàn ở bìu, nghi ngờ mắc tinh hoàn ẩn - một dị tật bẩm sinh nguy hiểm ở hệ sinh dục nam. Nếu không điều trị sớm, trẻ có thể đối mặt với nhiều biến chứng nghiêm trọng như vô sinh, ung thư tinh hoàn và rối loạn nội tiết. Sau khi khám lâm sàng và siêu âm kỹ lưỡng, các bác sĩ xác định tinh hoàn của bệnh nhi nằm sâu trong ổ bụng. Ê-kíp phẫu thuật đã lựa chọn phương pháp nội soi - kỹ thuật ít xâm lấn, cho phép quan sát rõ đường đi và vị trí của tinh hoàn để đưa về bìu một cách an toàn. Ca phẫu thuật diễn ra thuận lợi trong khoảng 90 phút, không ghi nhận biến chứng. Sau mổ, sức khỏe bệnh nhi ổn định, tinh hoàn đã được định vị đúng vị trí giải phẫu, bìu không sưng đau và vết mổ đang hồi phục tốt. Bác sĩ khoa Ngoại tổng hợp, BVĐK tỉnh Cao Bằng cho biết: “Phẫu thuật nội soi là lựa chọn tối ưu trong điều trị tinh hoàn ẩn, đặc biệt với trẻ lớn hoặc khi tinh hoàn nằm sâu trong ổ bụng. Phát hiện sớm và can thiệp kịp thời có ý nghĩa quyết định trong việc bảo toàn chức năng sinh sản”. Trẻ em không phải sinh ra đã khỏe mạnh về cảm xúc, trẻ phải được tôi luyện. Trẻ cần được nuôi dưỡng và dạy bảo các kỹ năng xác định cảm xúc của mình và thể hiện ra theo cách tích cực, từ đó, trẻ có thể kết nối với những người khác theo cách thông minh về cảm xúc.  Đề nghị xử lý 'Dược phẩm Hoàng Hường meli chính hãng’, Ngân 98 Cục An toàn thực phẩm, Bộ Y tế đề nghị các cơ quan chức năng kiểm tra xử lý vi phạm các cá nhân nickname Ngân 98, Ngân collagen, fanpage ""Dược phẩm Hoàng Hường meli chính hãng"".  6 lầm tưởng phổ biến ở người mắc bệnh phổi 7 giờ trước19:5026/6/2025Sức khỏeSức khỏe 0 Hiểu đúng về bệnh và chủ động điều chỉnh lối sống là những bước quan trọng giúp người bệnh COPD sống khỏe.  Mỡ máu như thế nào là cao? 10 giờ trước17:2226/6/2025Sức khỏeSức khỏe 0 Mỡ máu cao là yếu tố nguy cơ hàng đầu gây đột quỵ và bệnh tim mạch. Phát hiện sớm sự bất thường này sẽ giúp bảo vệ tim mạch và sức khỏe lâu dài."
