Source,URL,Category,Keyword,Time,Title,Content
ZNews,https://lifestyle.znews.vn/hai-benh-nhan-o-tphcm-bi-viem-nao-do-zona-post1563313.html,Sức khỏe,Null,"Thứ ba, 24/6/2025 13:48 (GMT+7)",Hai bệnh nhân ở TP.HCM bị viêm não do zona,"Bệnh nhân viêm não do zona đang được điểu trị tích cực tại khoa Nhiễm. Ảnh:BVCC. Hai trường hợp đang được điều trị tại khoa Nhiễm Việt - Anh, Bệnh viện Bệnh Nhiệt đới TP.HCM gồm cụ bà D.T.P. (87 tuổi, Lâm Đồng) và ông N.M.H. (63 tuổi, Bình Thạnh). Cả hai đều mắc biến chứng viêm não do zona thần kinh, một bệnh lý hiếm gặp nhưng có xu hướng gia tăng. Đại diện khoa cho biết từ đầu năm đến nay, đơn vị đã tiếp nhận 4-5 ca viêm não do zona. Nhiều trường hợp tổn thương da rất nhỏ, thậm chí khó phát hiện, như với cụ bà P. và ông H. Khi nhập viện, cả hai đều có triệu chứng điển hình của viêm não như sốt, đau đầu, rối loạn tri giác. Cụ bà P. vẫn còn một vết sang thương nhỏ dưới ngực trái, trong khi ông H. chỉ có duy nhất một nốt đóng vảy, khiến việc chẩn đoán trở nên khó khăn. Tính đến hiện tại, cụ bà P. đã nằm viện hơn một tháng, vẫn hôn mê, phải thở máy. Ông H. đã tỉnh nhưng còn yếu, phải hỗ trợ thở oxy, chưa thể tự chủ sinh hoạt nên chưa thể xuất viện. Zona thần kinh là bệnh truyền nhiễm cấp tính do virus Varicella-zoster, cũng là tác nhân gây bệnh thủy đậu. Sau đợt nhiễm đầu tiên, virus tồn tại trong các hạch thần kinh dưới dạng bất hoạt. Khi hệ miễn dịch suy yếu, virus có thể tái hoạt, di chuyển ngược theo sợi thần kinh hoặc qua máu vào não, vượt qua hàng rào máu não, gây tổn thương các tế bào thần kinh và mạch máu, dẫn đến viêm não, nhồi máu hoặc xuất huyết não. Ngoài việc tấn công trực tiếp, cơ chế viêm còn liên quan đến phản ứng miễn dịch quá mức của cơ thể. Biến chứng có thể kéo dài nhiều tháng, thậm chí nhiều năm, ảnh hưởng nặng nề đến chất lượng cuộc sống, với các triệu chứng như đau dây thần kinh sau zona, suy giảm trí nhớ, viêm phổi. Hiện zona đã có thuốc kháng virus đặc hiệu, tuy nhiên điều trị biến chứng vẫn khó khăn. Các bác sĩ khuyến cáo người dân nên duy trì lối sống lành mạnh, tránh căng thẳng, bổ sung dinh dưỡng hợp lý, không hút thuốc lá, giữ vệ sinh cá nhân và hạn chế tiếp xúc với người có sang thương đang hoạt động. Tiêm vaccine zona là biện pháp phòng ngừa hiệu quả nhất, đặc biệt ở nhóm người cao tuổi hoặc có bệnh nền. Trong nhiều năm hành nghề y và từng giữ chức trưởng khoa dinh dưỡng của một bệnh viện lớn, tác giả Hạ Manh đã điều trị hơn 10.000 ca bệnh liên quan đến chế độ ăn uống không lành mạnh. Cuốn sách ""Ăn chuẩn ít bệnh"" (tập 1) được viết ra từ những kinh nghiệm chuyên môn của vị bác sĩ này, nó sẽ mang đến cho người bệnh những kiến thức hữu ích về dinh dưỡng, để xây dựng chế độ ăn hợp lý.  Suýt không qua khỏi vì uống thuốc giảm đau tùy tiện Thường xuyên tự ý sử dụng các loại thuốc không rõ nguồn gốc có pha trộn corticoid để giảm đau, người bệnh ở Thanh Hóa phải nhập viện vì suy kiệt nghiêm trọng, tiên lượng dè dặt.  Người Việt 'hủy diệt' dạ dày với những món ăn độc lạ Gỏi cá sống, côn trùng chiên, tiết canh hay trứng sống pha bia là những món ăn khiến nhiều người thích thú nhưng lại tiềm ẩn rủi ro cho hệ tiêu hóa và sức khỏe.  5 môi trường thanh thiếu niên cần đề phòng để tránh bệnh não mô cầu Trường học, ký túc xá, bar, lễ hội… là nơi thanh thiếu niên thường sinh hoạt, giao lưu. Việc dùng chung đồ cá nhân có thể khiến vi khuẩn não mô cầu lây lan, tăng nguy cơ mắc bệnh."
ZNews,https://lifestyle.znews.vn/suyt-khong-qua-khoi-vi-uong-thuoc-giam-dau-tuy-tien-post1563303.html,Sức khỏe,Null,"Thứ ba, 24/6/2025 12:02 (GMT+7)",Suýt không qua khỏi vì uống thuốc giảm đau tùy tiện,"Bác sĩ Huy thăm khám cho bệnh nhân. Ảnh:BVCC. Ngày 24/6, các bác sĩ Trung tâm Hồi sức tích cực, Bệnh viện Bệnh Nhiệt đới Trung ương, thông tin đơn vị đang điều trị cho nam bệnh nhân T.V.M. (77 tuổi, trú tại Thanh Hóa) trong tình trạng nhiễm khuẩn huyết nặng trên nền suy thượng thận do lạm dụng corticoid kéo dài. Bệnh nhân nhập viện khi thể trạng suy kiệt nghiêm trọng, tiên lượng rất dè dặt. Theo Thạc sĩ, bác sĩ Hà Việt Huy, ông M. tiền sử đau khớp mạn tính hơn 10 năm, thường xuyên tự ý sử dụng các loại thuốc có corticoid không rõ nguồn gốc để giảm đau. Việc dùng thuốc kéo dài không theo đơn, không kiểm soát liều lượng đã dẫn đến tình trạng ức chế tuyến thượng thận, gây suy thượng thận và làm suy giảm hệ miễn dịch. Gần một tháng trước nhập viện, bệnh nhân xuất hiện nhọt lớn vùng sau gáy, sốt cao liên tục 39-40 độ C, mệt mỏi và lơ mơ. Dù đã điều trị kháng sinh tại cơ sở y tế địa phương trong khoảng 20 ngày nhưng tình trạng nhiễm trùng không cải thiện, ý thức xấu dần. Xét nghiệm cấy máu xác định nhiễm tụ cầu vàng đa kháng (MRSA) - loại vi khuẩn nguy hiểm có khả năng đề kháng cao với nhiều loại kháng sinh thông thường. Khi chuyển đến Bệnh viện Bệnh Nhiệt đới Trung ương, bệnh nhân rơi vào tình trạng suy hô hấp nặng, rối loạn toan chuyển hóa nặng, phải đặt nội khí quản, thở máy dẫn lưu ổ mủ và hồi sức tích cực. Hiện bệnh nhân vẫn sốt, dù có đáp ứng bước đầu nhưng tiên lượng rất nặng do nền bệnh quá nặng và miễn dịch suy giảm trầm trọng. Bác sĩ Huy cảnh báo: ""Đây là hậu quả điển hình của tình trạng lạm dụng corticoid trong cộng đồng, nhất là thông qua các bài thuốc dân gian không rõ nguồn gốc, không định lượng. Dùng lâu dài, corticoid không chỉ gây suy tuyến nội tiết mà còn phá vỡ hệ thống miễn dịch, tạo điều kiện cho nhiễm trùng nặng và nhiều biến chứng nguy hiểm"". Qua trường hợp bệnh nhân M., bác sĩ Huy khuyến cáo người dân tuyệt đối không tự ý sử dụng thuốc giảm đau kéo dài nếu chưa được bác sĩ thăm khám. Những loại thuốc ""uống vào thấy đỡ ngay"" nhưng không rõ thành phần, không có đơn kê chỉ mang lại hiệu quả tức thời, trong khi có thể âm thầm phá hoại nội tiết và miễn dịch, dẫn tới hậu quả khôn lường khi bệnh bùng phát. Bệnh của thời thức ăn tiện lợi Qua 400 trang sách, bác sĩ Robert H.Lustig đã chỉ ra nguy cơ các bệnh con người có thể mắc phải trong bối cảnh thực ăn nhanh, đồ đóng hộp lên ngôi. Trong đó, Lustig nhấn mạnh rằng, thực phẩm tiện lợi được sản xuất hàng loạt chính là sát thủ âm thầm.  Người Việt 'hủy diệt' dạ dày với những món ăn độc lạ Gỏi cá sống, côn trùng chiên, tiết canh hay trứng sống pha bia là những món ăn khiến nhiều người thích thú nhưng lại tiềm ẩn rủi ro cho hệ tiêu hóa và sức khỏe.  20 năm sống cùng bệnh thận của chàng trai 24 tuổi Khi bạn bè sống với đam mê và tự do, Hoàng Anh học cách lớn lên bên kim tiêm, dây truyền và một chiếc máy lặng lẽ giữ lại sự sống của mình mỗi tuần.  Biểu hiện nhỏ nhận biết huyết áp không bình thường Nhiều người có nguy cơ mắc bệnh huyết áp cao trong nhiều năm mà không xuất hiện bất kỳ dấu hiệu cảnh báo nào."
ZNews,https://znews.vn/hien-truong-vu-dien-vien-nhu-lai-than-chuong-roi-lau-tu-vong-post1563359.html,Giải trí,Null,"Thứ ba, 24/6/2025 16:55 (GMT+7)",Hiện trường vụ diễn viên 'Như Lai thần chưởng' rơi lầu tử vong,"TheoMingpao, đạo diễn nổi tiếng kiêm chỉ đạo võ thuật Đường Giai (tên thật Hoàng Đường), chồng của nữ diễn viên gạo cội Tuyết Ni ngã từ trên cao và tử vong tại ngã tư Tiêm Sa Chủy vào chiều 23/6. Không tìm thấy thư tuyệt mệnh tại hiện trường và nguyên nhân tử vong vẫn chưa được xác định sau khi khám nghiệm tử thi. Đường Giai sống với vợ là Tuyết Ni và con trai của họ trong một căn hộ ở khu dân cư Jordan. Tuyết Ni gần đây phải nằm viện vì ung thư tuyến tụy. Đường Giai được cho là tuyệt vọng vì vợ bị bệnh. Khoảng 17h ngày 23/6, cảnh sát nhận được báo cáo một người đàn ông ngã từ trên cao và tử vong tại ngã tư đường Austin và đường Songshan ở Tiêm Sa Chủy. Nạn nhân là võ sư nổi tiếng Đường Giai. Theo điều tra sơ bộ của cảnh sát, người đàn ông 88 tuổi ngã từ nóc một tòa nhà và tử vong tại chỗ. Hiện trường vụ Đường Giai qua đời. Ảnh:HK01. Mingpaođã liên lạc với diễn viên võ thuật Tiền Gia Lạc về sự qua đời của Đường Giai. Tiền Gia Lạc trả lời anh không biết lý do đồng nghiệp mất đột ngột và gia đình Đường Giai nên công khai mọi chuyện. Hiệp hội võ thuật sẽ sớm tìm ra sự thật và chắc chắn sẽ giúp đỡ nếu gia đình Đường Giai cần bất kỳ sự hỗ trợ nào. Hồ Phong bàng hoàng khi nghe tin Đường Giai ngã từ trên tòa nhà xuống và tử vong. Anh hỏi phóng viên chuyện gì đã xảy ra và nói: ""Chúng tôi là bạn bè trong nhiều thập kỷ nhưng ít liên lạc hơn trong những năm gần đây. Tại sao mọi chuyện lại xảy ra như vậy?"". Huỳnh Tông Trạch chia sẻ anh đã gặp Đường Giai khi mới vào nghề. Chính Đường Giai đã dạy Huỳnh Tông Trạch cách quay cảnh hành động, giúp anh bôi rượu thuốc vào giữa đêm và nhẹ nhàng gọi anh là ""con trai"". Huỳnh Tông Trạch nhớ từng chi tiết nhỏ của hai người và học được nhiều điều từ đàn anh. Nam diễn viên nghẹn ngào rơi nước mắt và cảm thấy buồn trước thông tin về Đường Giai. Đường Giai 88 tuổi, tên thật là Hoàng Đường, là huấn luyện viên võ thuật độc quyền của Trương Triệt vào những năm 1960. Vào những năm 1980, ông đã đạo diễn các bộ phimNgười thừa kế Thiếu Lâm, Tam đại thiếu lâm, Hồng quyền đại sư, sau đó gia nhập TVB với tư cách huấn luyện viên võ thuật. Vợ của Đường Gia là Tuyết Ni là một ngôi sao nổi tiếng trong thời đại phim Quảng Đông. Cặp đôi có hai người con trai. Nguyên nhân Đường Giai qua đời được suy đoán có thể liên quan đến căn bệnh ung thư tuyến tụy của Tuyết Ni. Đường Giai có thể lo lắng vợ mình không còn nhiều thời gian nữa, nên từng nói với con trai rằng hai người muốn cùng nhau ra đi. Ngày 23/6, ông viết di chúc và đợi luật sư đến ký. Nhưng sau đó, Đường Giai qua đời. Bạn đang ăn vì thích… hay ăn để sống khỏe? Chúng ta đang sống trong một thời đại thịnh vượng chưa từng có với công nghệ phát triển, đời sống tiện nghi, y học hiện đại. Nhưng nghịch lý thay, bệnh tật lại ngày càng phổ biến, thậm chí còn “trẻ hóa” một cách đáng sợ. Làm sao để ăn đúng và hiểu đúng về thực phẩm? Làm sao để đưa ăn uống trở về với vai trò vốn có của nó? Đó chính là lý do cuốn sáchMinh triết trong ăn uống phương Đông ra đời. Cuốn sách không phải một cẩm nang ăn kiêng, cũng không đơn thuần là tập hợp công thức nấu ăn mà là một lời cảnh tỉnh quan trọng đến độc giả rằng cách bạn ăn đang quyết định chất lượng sống, sức khỏe tinh thần và cả tuổi thọ của mình.  Sao Mỹ bị tài xế tông tử vong rồi bỏ trốn 19:27 20/6/202519:2720/6/2025Giải tríGiải trí 0 Sara Burack qua đời sau vụ tai nạn giao thông thảm khốc, hưởng dương 40 tuổi. Tài xế gây án đã bỏ trốn khỏi hiện trường và hiện bị cảnh sát truy tìm.  Diễn viên 'Như Lai thần chưởng' rơi lầu tử vong 16 giờ trước10:1424/6/2025Giải tríGiải trí 0 Ông Đường Giai rơi lầu và qua đời ở tuổi 88. Cảnh sát bước đầu nhận định ông chịu cú sốc tâm lý nặng nề do bệnh tình của vợ nên có thể đã nghĩ quẩn.  Danh hài Nhật Bản qua đời ở tuổi 38 17:25 19/6/202517:2519/6/2025Giải tríGiải trí 0 Kaga Takuya qua đời hôm 14/6 sau thời gian nhập viện vì đột quỵ thân não. Trước đó, anh được biết tới là một trong các thành viên sáng lập nhóm hài Tứ Thiên Vương nổi tiếng."
ZNews,https://znews.vn/brooklyn-beckham-ninh-vo-post1563366.html,Giải trí,Null,"Thứ ba, 24/6/2025 17:45 (GMT+7)",Brooklyn Beckham nịnh vợ,"Theo tờMirror, Brooklyn Beckham vừa gây chú ý khi có bài đăng mùi mẫn thể hiện tình cảm dành cho vợ trên trang cá nhân, nhân dịp kỷ niệm 5 năm anh cầu hôn cô. Cặp đôi chia sẻ khoảnh khắc ngọt ngào trên mạng xã hội, trong đó Brooklyn âu yếm hôn lên cổ Nicola khi cô chụp ảnh selfie trước gương. Nicola trang điểm đậm, tóc cuốn lô, tỏ ra hạnh phúc khi được chồng thể hiện tình cảm. “Đã 5 năm kể từ ngày tôi ngỏ lời với người phụ nữ xinh đẹp này. Quyết định đúng đắn nhất đời tôi. Anh yêu em rất nhiều"", con trai cả của David Beckham viết. Bài đăng của Brooklyn nhanh chóng thu hút sự quan tâm. Anh được khen là người chồng tình cảm khi công khai thể hiện tình yêu dành cho vợ, giữa lúc cô được cho là bị tổn thương trước hàng loạt cáo buộc vô cớ suốt thời gian qua. Brooklyn thể hiện tình cảm với vợ nhân dịp kỷ niệm 5 năm anh cầu hôn cô. Ảnh:@brooklynpeltzbeckham. Cũng trong hôm 23/6, em trai Brooklyn - Cruz Beckhamm, gây tranh luận khi được cho là có động thái mỉa mai anh trai. Cụ thể, sau khi chia sẻ về đam mê âm nhạc trên mạng xã hội, anh chàng bị một tài khoản đặt câu hỏi muốn theo đuổi công việc này lâu dài hay chỉ ""cả thèm chóng chán"". Cruz đáp lại đầy ẩn ý: ""Nhầm người rồi bạn ơi"". Bình luận của Cruz được cho là đang nhắm đến Brooklyn, mỉa mai chuyện anh trai ""lông bông"", tới nay vẫn không có nghề nghiệp ổn định. Một ngày trước, bạn bè của Nicola Peltz lên tiếng, cho rằng những cuộc tấn công cùng cáo buộc sai lệch gần đây nhắm vào nữ diễn viên là ""không công bằng"" và đang ngày càng vượt quá giới hạn. Nicola bị tổn thương sau nhiều công kích, theoMirror. Sự lôi cuốn của thanh âm Cuốn sách Lược sử âm nhạc của nhà nghiên cứu âm nhạc bậc thầy thế giới Robert Philip, dẫn dắt độc giả trên hành trình khám phá cực kỳ lôi cuốn mọi hình thái âm nhạc. 40 chương sách đưa người đọc đi từ dạng thức sơ khai của âm nhạc đến khi con người sử dụng âm nhạc, qua giai đoạn sự lên ngôi của các nhạc cụ, dàn nhạc, đến khi âm nhạc tạo ra những cơn bão trong tâm trí con người thời cách mạng, cuối cùng là âm nhạc trong nhịp sống hiện đại và âm nhạc hướng về tương lai.  Jessie J phẫu thuật ung thư vú Nữ ca sĩ sinh năm 1988 vừa trải qua ca phẫu thuật cắt bỏ khối u và hiện đã trở về nhà tĩnh dưỡng, chờ kết quả. Cô cho biết sẽ chiến đấu với căn bệnh ung thư bằng tinh thần lạc quan, tích cực.  Lee Min Ho bị chỉ trích Lee Min Ho gây tranh cãi khi khoe quà sinh nhật xa xỉ được fan tặng. Nhiều ý kiến chỉ trích rằng điều này không phù hợp với một diễn viên kỳ cựu, chuẩn bị kỷ niệm 20 năm hoạt động.  'Elio' - Cuộc phiêu lưu đặc sắc ngoài không gian Mượn chuyến du hành vũ trụ xa xôi, ""Elio"" gửi đi lời tâm sự thủ thỉ cho những ai luôn thấy mình cô đơn và lạc lõng, không có một nơi để thuộc về."
ZNews,https://znews.vn/tan-lam-xuat-hien-ben-ban-trai-kem-10-tuoi-post1563116.html,Giải trí,Null,"Thứ ba, 24/6/2025 00:14 (GMT+7)",Tần Lam xuất hiện bên bạn trai kém 10 tuổi,"TheoSohu, mới đây, mạng xã hội Trung Quốc lan truyền đoạn video ghi lại cảnh nam diễn viên Ngụy Đại Huân đến đón Tần Lam. Đáng chú ý, người cầm lái chính là cha ruột của Ngụy Đại Huân. Theo video, Tần Lam đến studio của Tống Giai để tụ họp cùng vợ chồng nữ diễn viên này. Đến khuya, Ngụy Đại Huân xuất hiện để đón bạn gái về. Trước khi rời đi, Tần Lam ôm tạm biệt bạn bè, trong khi nam diễn viên kiên nhẫn ngồi chờ ở ghế phụ. Hình ảnh này khiến tin đồn chia tay giữa hai nghệ sĩ bị bác bỏ, đồng thời làm dấy lên suy đoán về khả năng họ đang nghiêm túc tiến tới hôn nhân. Hình ảnh Tần Lam và Ngụy Đại Huân được lan truyền trên Weibo. Ảnh:Weibo. Tần Lam - nữ diễn viên nổi tiếng với vai Phú Sát hoàng hậu trongDiên hy công lược- hiện 45 tuổi, hơn Ngụy Đại Huân 10 tuổi. Cả hai từng nhiều lần bị bắt gặp hẹn hò, tay trong tay đi dạo, tuy nhiên chưa từng xác nhận mối quan hệ. Từ đầu năm 2024, xuất hiện tin đồn họ đã chia tay do gia đình nam diễn viên không ủng hộ vì khoảng cách tuổi tác và vấn đề sinh con. Một số nguồn còn cho rằng Ngụy Đại Huân từng cầu hôn nhưng bị từ chối. Tuy nhiên, động thái mới nhất khi cha con Ngụy Đại Huân cùng đón Tần Lam về nhà lúc đêm khuya, được xem là tín hiệu cho thấy mối quan hệ của họ không chỉ bền chặt mà còn có sự ủng hộ từ gia đình. Dù cả hai vẫn chưa chính thức lên tiếng, cụm từ “Ngụy Đại Huân đưa Tần Lam về nhà” nhanh chóng leo lên top tìm kiếm Weibo. Tần Lam và Ngụy Đại Huân nhiều lần vướng tin hợp tan. Ảnh:Sohu. Tần Lam sinh năm 1979, là nữ diễn viên nổi bật của màn ảnh Hoa ngữ. Cô ghi dấu ấn qua vai Phú Sát hoàng hậu trongDiên Hy Công Lược(2018). Trước đó, Tần Lam từng góp mặt trong các phim truyền hình nhưHoàn Châu Cách Cách 3,Thần điêu đại hiệp.Ngoài diễn xuất, cô còn là gương mặt quen thuộc trong các sự kiện thời trang. Ngụy Đại Huân sinh năm 1989, được biết đến nhiều qua các show giải trí, nhưng chỉ thực sự bứt phá nhờ vai Mạnh Yến Thần trong phimMy Human Smoke(2023). Sự lôi cuốn của thanh âm Cuốn sách Lược sử âm nhạc của nhà nghiên cứu âm nhạc bậc thầy thế giới Robert Philip, dẫn dắt độc giả trên hành trình khám phá cực kỳ lôi cuốn mọi hình thái âm nhạc. 40 chương sách đưa người đọc đi từ dạng thức sơ khai của âm nhạc đến khi con người sử dụng âm nhạc, qua giai đoạn sự lên ngôi của các nhạc cụ, dàn nhạc, đến khi âm nhạc tạo ra những cơn bão trong tâm trí con người thời cách mạng, cuối cùng là âm nhạc trong nhịp sống hiện đại và âm nhạc hướng về tương lai. Cuốn sách làm nổi bật rằng, âm nhạc không chỉ là một hình thức nghệ thuật mà còn là một hiện tượng xã hội phức tạp. Nó phản ánh cấu trúc xã hội, các mối quan hệ quyền lực và những thay đổi trong xã hội. Âm nhạc phát triển theo nhiều chiều hướng khác nhau trong các nền văn hóa.  Việt Anh: 'Nếu có biến, phải khóa giỏ hàng đầu tiên' Tối 23/6, NSƯT Việt Anh lên tiếng về việc trang cá nhân đột ngột biến mất. Anh cho biết đóng tài khoản mạng để ""xử lý việc bị hack Facebook"".  Vợ chồng Justin Bieber bất ổn Hailey Bieber liên tục xuất hiện mà không đeo nhẫn cưới, làm dấy lên tin đồn hôn nhân rạn nứt. Justin Bieber sau đó đăng loạt trạng thái ẩn ý, cho thấy tâm trạng bất ổn.  Park Sung Woong, Ji Chang Wook tới Việt Nam Nam diễn viên Park Sung Woong và Ji Chang Wook sẽ tham dự Liên hoan phim châu Á Đà Nẵng lần thứ 3 (DANAFF III), diễn ra từ 29/6 đến 5/7."
ZNews,https://znews.vn/anh-noi-y-cua-my-nhan-squid-game-post1563249.html,Giải trí,Null,"Thứ ba, 24/6/2025 10:20 (GMT+7)",Ảnh nội y của mỹ nhân 'Squid Game',"TheoNews1, Park Gyu Young - nữ diễn viên nổi tiếng qua loạt phimSquid Gamethu hút sự chú ý với vóc dáng gợi cảm. Trên trang cá nhân 4 triệu lượt theo dõi, Park Gyu Young đăng tải bộ ảnh nội y hợp tác cùng Calvin Klein. Park Gyu Young quyến rũ trong bộ ảnh nội y mới. Ảnh:@lavieenbluu. Qua ba bức ảnh cùng một video giới thiệu sản phẩm, Park Gyu Young tự tin khoe thân hình thon thả, quyến rũ. Trước đó vài tuần, nữ diễn viên cũng thực hiện bộ ảnh cho thương hiệu này với phiên bản tóc ngắn cá tính. Dưới phần bình luận, người hâm mộ từ nhiều khu vực như Đông Nam Á, châu Mỹ để lại lời khen ngợi: ""Cô ấy thật dễ thương"", ""Nữ diễn viên yêu thích của tôi"", ""Cô ấy mặc gì cũng hợp"". Sắp tới, Park Gyu Young sẽ tái ngộ khán giả trongSquid Game3đồng thời là mùa cuối vào ngày 27/6. Nhân vật của cô là Kang No Eul, một người mẹ đang nỗ lực tìm kiếm con gái mất tích. Song, Kang No Eul được cho là yếu tố bất ngờ trong đội quân đeo mặt nạ đảm nhận công việc quản lý người chơi. Sinh năm 1993, Park Gyu Young tốt nghiệp ngành Thời trang và Môi trường tại Đại học Yonsei. Năm 2016, cô khởi đầu sự nghiệp diễn xuất qua việc đóng MV và vai phụ trong nhiều tác phẩm truyền hình. Trong đó,Sweet Home, CelebrityvàSweet Home 2giúp nữ diễn viên tới gần khán giả, trước khiSquid Gamegây bão toàn cầu. Trên trang cá nhân, Park Gyu Young thường xuyên chia sẻ công việc người mẫu ảnh. Năm 2025, cô trở thành gương mặt đại diện cho nhiều thương hiệu nổi tiếng như Gucci, Tiffany & Co. Ước tính, Park Gyu Young sở hữu khối tài sản khoảng5 triệu USD, theoStylecaster. Chuyên mục giải trígiới thiệu cuốnBí quyết kinh doanh cửa hàng thời trang và những mánh lới bạn chưa biếtđưa ra những kinh nghiệm bán hàng thực chiến của một chuyên gia có 20 năm bán buôn, bán lẻ và nghiên cứu các mô hình kinh doanh của ngành công nghiệp thời trang trên khắp Trung Quốc. Thông qua đó, tác giả sẽ tổng kết những bí quyết giúp một cửa hàng kinh doanh thành công và cách để người kinh doanh xây dựng được thương hiệu cá nhân.  Sao nam bị tố hẹn hò cùng lúc 7 cô gái Theo The Thaiger, Shell Thakrit Chaiwut bị tố lừa dối 7 cô gái. Một người trong số đó mang thai.  Johnny Depp nói 'dễ bị lừa' khi yêu Amber Heard Trong cuộc phỏng vấn mới nhất, tài tử chia sẻ về vụ kiện trước đây với Amber Heard. Nam diễn viên cho biết khi yêu, anh là người cả tin và dễ bị lừa.  Ngôi sao Thái Lan nhập viện khẩn cấp vì xẹp phổi Diễn viên Thái Lan Ching Ching Krissada nhập viện khẩn cấp vì xẹp phổi, phải phẫu thuật để điều trị. Hiện sức khỏe cô đã ổn định nhưng phải huỷ bỏ toàn bộ lịch trình sắp tới."
