Source,URL,Category,Keyword,Time,Title,Content
ZNews,https://znews.vn/nhu-cau-vang-cua-viet-nam-giam-manh-post1550357.html,Kinh doanh,Null,"Thứ năm, 1/5/2025 19:49 (GMT+7)",Nhu cầu vàng của Việt Nam giảm mạnh,"Nhu cầu vàng thỏi tại Việt Nam suy giảm trong khi các nước ASEAN khác tăng mạnh. Ảnh:Reuters. Theo báo cáo của WGC, nhu cầu vàng thỏi và tiền vàng của Việt Nam chỉ đạt 12 tấn trong quý đầu năm. Nguyên nhân chủ yếu là tình trạng khan hiếm nguồn cung trong nước và mức phí bảo hiểm cao, dẫn đến sự suy giảm nhu cầu vàng. Trái lại, ở các nước Đông Nam Á khác, nhu cầu vàng thỏi ghi nhận mức tăng mạnh. Cụ thể, lượng mua vàng thỏi của các nhà đầu tư Singapore trong quý I/2025 đạt 2,5 tấn, tăng 35% so với cùng kỳ năm ngoái và là mức cao nhất kể từ năm 2010. Nhu cầu đầu tư vàng tại Indonesia, Malaysia và Thái Lan cũng tăng trưởng hai chữ số so với quý I/2024. Bảng xếp hạng nhu cầu vàng thỏi và tiền vàng của các quốc gia trong quý I/2025. Ảnh:WGC. Tuy nhiên, nhu cầu trang sức vàng tại các quốc gia ASEAN suy giảm, chủ yếu do giá vàng liên tục lập đỉnh. Tại Singapore, lượng tiêu thụ vàng trang sức giảm 20%, còn 1,7 tấn, ngang bằng với Thái Lan và xếp sau Indonesia (4,1 tấn), Malaysia (3,8 tấn), Việt Nam (3,5 tấn). Trước biến động này, một số thị trường đã chủ động điều chỉnh để thích ứng với thay đổi trong hành vi tiêu dùng. Tại Indonesia, các nhà sản xuất đã chuyển hướng sang những dòng trang sức có hàm lượng vàng thấp hơn nhằm đáp ứng nhu cầu ngày càng tăng đối với các sản phẩm có mức giá phải chăng hơn. Trong khi đó, nhiều cửa hàng kim hoàn tại Malaysia triển khai chương trình khuyến khích người tiêu dùng đổi trang sức cũ lấy sản phẩm mới. Dù hình thức này không làm thay đổi tổng nhu cầu tiêu thụ vàng, nhưng lại giúp duy trì doanh thu và thu hút sự quan tâm của người tiêu dùng đối với trang sức vàng. Ông Fan Shaokai, Giám đốc khu vực châu Á - Thái Bình Dương (trừ Trung Quốc) của WGC, nhận định rằng nhu cầu vàng trang sức toàn cầu đang ở mức thấp nhất kể từ khi đại dịch Covid-19 bùng phát. Theo ông, đây là hệ quả tất yếu khi giá vàng đã 20 lần lập đỉnh mới chỉ trong quý đầu tiên. Về phía các ngân hàng trung ương, ông Fan cho biết các tổ chức này đã tiếp tục xu hướng mua ròng vàng năm thứ 16 liên tiếp, với tổng khối lượng 243,7 tấn trong quý I/2025. Dù giảm 21% so với cùng kỳ năm ngoái, giá trị mua vào vẫn tăng do giá vàng duy trì ở mức cao. Việc mua vàng của các ngân hàng trung ương được thúc đẩy bởi nhu cầu đa dạng hóa danh mục, kiểm soát rủi ro, phòng ngừa lạm phát và ứng phó với những bất ổn địa chính trị. Cũng theo WGC, nhu cầu đầu tư vàng toàn cầu đã tăng vọt 170% so với cùng kỳ, đạt 551,9 tấn. Đáng chú ý, các quỹ ETF vàng ghi nhận mức mua ròng 226,5 tấn, đảo chiều so với mức bán ròng 113 tấn cùng kỳ năm 2024. Tổng nhu cầu vàng toàn cầu, bao gồm đầu tư, trang sức, mua vào của ngân hàng trung ương và sử dụng trong công nghệ, đạt 1.206 tấn trong quý I/2025, tăng nhẹ 1% so với năm ngoái. Ông Fan nhận định rằng trong bối cảnh bất ổn địa chính trị gia tăng và thị trường tài chính nhiều biến động, vàng tiếp tục khẳng định vai trò là tài sản trú ẩn an toàn. WGC dự báo các yếu tố như nguy cơ đình lạm trong ngắn hạn, rủi ro suy thoái kinh tế trung hạn, mối tương quan tăng giữa cổ phiếu và trái phiếu, tình trạng thâm hụt ngân sách Mỹ và căng thẳng địa chính trị sẽ tiếp tục thúc đẩy nhu cầu đầu tư vàng trong thời gian tới. Nhiều tổ chức tài chính quốc tế đã nâng dự báo giá vàng trong bối cảnh thị trường tiếp tục đối mặt với các yếu tố bất ổn kinh tế và địa chính trị. Goldman Sachs nhận định giá vàng có thể chạm ngưỡng4.000 USD/ounce ngay trong năm nay, trong khi UBS dự báo kim loại quý này sẽ đạt mốc3.800 USD/ounce vào giữa năm 2026. Tuần trước, giá vàng thế giới đã lập đỉnh lịch sử ở mức3.500 USD/ounce, nhưng sau đó điều chỉnh giảm khi căng thẳng Mỹ - Trung có dấu hiệu hạ nhiệt. Hiện tại, giá vàng đang dao động quanh vùng 3.200-3.300 USD/ounce. Nền kinh tế với độ mở lớn như Việt Nam không thể tránh khỏi những tác động từ xu hướng kinh tế thế giới. Trong thế giới kinh doanh phức tạp và thay đổi liên tục như hiện nay, việc cập nhật kiến thức và hiểu biết về các xu hướng kinh doanh trên thế giới là rất quan trọng. Để độc giả có thể tiếp cận những thông tin kinh tế quốc tế mới nhất,Tri Thức - Znewsgiới thiệuTủ sách kinh tế thế giớivới những cuốn sách và câu chuyện kinh doanh đáng chú ý. Từ việc nghiên cứu các công ty hàng đầu đến việc khám phá những xu hướng kinh tế mới, Tủ sách sẽ là nơi cập nhật các thông tin mới nhất về hoạt động kinh tế toàn cầu.  Giá vàng thế giới bất ngờ rớt mạnh Bất chấp các dữ liệu kinh tế suy yếu của Mỹ, giá vàng giao ngay vẫn rơi xuống vùng 3.235 USD/ounce - cách xa đỉnh lịch sử thiết lập đầu tuần trước.  Giá vàng miếng lại vượt 121 triệu đồng/lượng Giá vàng miếng SJC lại tăng vượt mốc 121 triệu đồng/lượng trong bối cảnh giá vàng thế giới phục hồi. Hiện chênh lệch giữa vàng trong nước và quốc tế lên tới gần 17 triệu/lượng.  Gia tộc nắm quyền định giá vàng thế giới 200 năm Mạng lưới ngân hàng do Rothschild, Schiff Warburg và các nhà ngân hàng Do Thái xây dựng tại các quốc gia trên thực tế đã tạo nên hệ thống tiền tệ quốc tế và trung tâm thanh toán thế giới sớm nhất trong lịch sử."
ZNews,https://znews.vn/lai-suat-tiet-kiem-sap-toi-se-ra-sao-post1550328.html,Kinh doanh,Null,"Thứ năm, 1/5/2025 16:24 (GMT+7)",Lãi suất tiết kiệm sắp tới sẽ ra sao?,"Theo báo cáo của Ngân hàng Nhà nước (NHNN) về diễn biến thị trường tiền tệ tuần 21-25/4, lãi suất liên ngân hàng kỳ hạn qua đêm, 1 tuần, 2 tuần giảm mạnh so với tuần trước đó, lần lượt đạt 2,46%, 2,88% và 4,18%/năm. Tuy vậy, với động thái hút ròng19.720 tỷ đồngtrên thị trường mở của NHNN, giới phân tích cho rằng lãi suất ngắn hạn có thể tăng trở lại trong các phiên giao dịch tuần này. Vào đầu phiên giao dịch ngày 29/4, NHNN công bố tỷ giá trung tâm của đồng Việt Nam với USD tăng 12 đồng, ở mức 23.960 đồng. Tỷ giá tham khảo tại Sở giao dịch NHNN mua vào - bán ra tăng nhẹ, ở mức 23.762 - 26.158 đồng. Tuy nhiên, tỷ giá trên thị trường tự do đã tiến sát ngưỡng 26.500 đồng/USD, tăng gần 4% trong tháng 4 vừa qua. Điều hành tỷ giá và lãi suất là bài toán khó đối với bất kỳ ngân hàng trung ương nào. Muốn kiềm chế tỷ giá, buộc phải tăng lãi suất. Tuy nhiên, lãi suất tăng cao sẽ gây khó khăn cho sản xuất, còn thị trường bất động sản - vốn phụ thuộc lớn vào tín dụng, có nguy cơ đóng băng. Tuy nhiên, việc duy trì một đồng nội tệ yếu sẽ có lợi cho xuất khẩu. Hơn nữa, NHNN đã kiềm chế lãi suất trong một thời gian khá dài nhằm hỗ trợ doanh nghiệp phục hồi sản xuất. Lãi suất huy động manh nha tăng trở lại. Ảnh:Nam Khánh. Với những diễn biến gần đây của kinh tế thế giới, nhất là việc Tổng thống Mỹ Donald Trump ban hành chính sách thuế đối ứng lên các quốc gia, tình hình kinh tế vĩ mô thế giới càng biến động khó lường, khiến những dự báo đều trở nên lỗi thời. Theo ông Nguyễn Cảnh Anh, Chủ tịch HĐQT Eximbank, những bất ổn của kinh tế thế giới sẽ ảnh hưởng đến kinh tế trong nước. Với ngành ngân hàng, những bất ổn đó dẫn đến lãi suất đầu vào có xu hướng tăng cao, kể cả lãi suất trên thị trường quốc tế; rủi ro tỷ giá tăng khó lường, lạm phát cũng tăng lên. ""Chúng tôi đánh giá áp lực huy động vốn dài hạn sẽ tăng lên, dẫn đến cạnh tranh về lãi suất huy động"", ông Nguyễn Cảnh Anh nhận định. Trên thực tế, lãi suất trên thị trường quốc tế cũng tăng cao khiến ngân hàng phải tạm dừng kế hoạch huy động vốn trên thị trường quốc tế. Theo ông Phạm Như Ánh, Tổng giám đốc Ngân hàng MB, năm nay, ngân hàng dự kiến sẽ phát hành khoảng 100-300 triệu USDtrái phiếu xanh ra thị trường quốc tế. Nhưng lãi suất USD đang cao hơn cả lãi suất VND nên MB phải lựa chọn thời điểm phù hợp. ""Vốn của MB là không thiếu, vốn trong nước đang rẻ nên chúng tôi đang tận dụng nguồn lực từ trong nước. Đến thời điểm phù hợp, chi phí phù hợp sẽ phát hành trái phiếu xanh"", ông Ánh cho hay. Mặc dù vậy, các NHTM thời gian qua đã cố gắng ghìm lãi suất huy động và cho vay theo chỉ đạo của Thủ tướng Chính phủ và NHNN nhằm hỗ trợ doanh nghiệp và nền kinh tế. Ông Jens Lotter, Tổng giám đốc Ngân hàng Techcombank, nhận định sức ép cạnh tranh giữa các NHTM ngày càng trở nên khốc liệt. NHNN kêu gọi các NHTM giảm lãi suất cho vay, nên mặt bằng NIM - một chỉ báo về khả năng sinh lời và tăng trưởng của các ngân hàng - sẽ có xu hướng đi xuống. ""Techcombank sẽ phải tuân theo mặt bằng lãi suất chung, không thể đơn phương nâng lãi suất huy động cao hơn thị trường. Không chỉ giảm lãi suất cho vay, chúng tôi còn giảm lãi suất huy động để góp phần tạo động lực tốt hơn cho tăng trưởng kinh tế"", CEO Techcombank nói. Theo ông Nguyễn Đức Vinh, Tổng giám đốc Ngân hàng VPBank, với áp lực về lãi suất huy động và cho vay khi cố gắng chia sẻ những khó khăn với khách hàng, ngân hàng vẫn xây dựng phương án bảo vệ NIM tiếp tục tăng trong năm nay. Từ sau cuộc họp ngày 25/2 giữa NHNN với các NHTM về lãi suất, đã có 29 ngân hàng thương mại trong nước giảm lãi suất huy động với mức giảm 0,1-1,05%/năm. Tuy nhiên, đà giảm lãi suất đã chững lại trong tháng 4 khi chỉ có 9 ngân hàng giảm lãi suất, gồm VPBank, MB, Eximbank, Nam A Bank, OCB, VCBNeo, GPBank, Techcombank và Viet A Bank. Đáng chú ý, đã xuất hiện trở lại các ngân hàng tăng lãi suất tiết kiệm tại một số kỳ hạn, nhất là các kỳ hạn ngắn, bao gồm GPBank, Agribank, MB và Eximbank. Riêng OCB và Bac A Bank đã tăng lãi suất tại các kỳ hạn 1-36 tháng trong tháng 4 vừa qua. Nền kinh tế với độ mở lớn như Việt Nam không thể tránh khỏi những tác động từ xu hướng kinh tế thế giới. Trong thế giới kinh doanh phức tạp và thay đổi liên tục như hiện nay, việc cập nhật kiến thức và hiểu biết về các xu hướng kinh doanh trên thế giới là rất quan trọng. Để độc giả có thể tiếp cận những thông tin kinh tế quốc tế mới nhất,Tri Thức - Znewsgiới thiệuTủ sách kinh tế thế giớivới những cuốn sách và câu chuyện kinh doanh đáng chú ý. Từ việc nghiên cứu các công ty hàng đầu đến việc khám phá những xu hướng kinh tế mới, Tủ sách sẽ là nơi cập nhật các thông tin mới nhất về hoạt động kinh tế toàn cầu.  Gửi tiền vào đâu để hưởng lãi suất 6%/năm? Mức lãi suất trên 6%/năm chủ yếu tập trung tại nhóm ngân hàng tư nhân vừa và nhỏ. Cá biệt, một số ngân hàng tư nhân lớn cũng đang áp dụng mức lãi suất này với tiền gửi hạn dài.  Đề xuất lãi suất cho vay 'gần như 0%/năm' Đại diện doanh nghiệp đề xuất mức lãi suất mang tính tượng trưng, 'gần như là 0%/năm' để doanh nghiệp chú trọng đầu tư đổi mới sáng tạo.  Giá USD tự do lập đỉnh mới Giá USD trên thị trường tự do đã vượt mốc 26.500 đồng, cao nhất từ trước đến nay. Đà tăng xuất hiện trong bối cảnh thị trường chính thức đang tạm ngưng giao dịch vì kỳ nghỉ lễ."
ZNews,https://znews.vn/kon-tum-tim-nha-dau-tu-7-du-an-khu-do-thi-o-mang-den-post1550326.html,Kinh doanh,Null,"Thứ năm, 1/5/2025 16:00 (GMT+7)",Kon Tum tìm nhà đầu tư 7 dự án khu đô thị ở Măng Đen,"Măng Đen được định hướng là vùng du lịch, sản xuất nông, lâm nghiệp và trọng điểm phát triển kinh tế phía đông tỉnh Kon Tum. Ảnh:Minh Hoàng. HĐND tỉnhKon Tumvừa thông qua danh mục gồm 7 khu đất thực hiện đấu thầulựa chọn nhà đầu tư. Tổng diện tích 7 khu đất là 1.860 ha, đều thuộc thị trấn Măng Đen, huyện Kon Plông. Các dự án khu đô thị, dịch vụ này có tiến độ triển khai từ năm nay. UBND tỉnh Kon Tum sẽ lập kế hoạch chi tiết triển khai thực hiện. Kon Tum là địa phương nằm ở phía bắc Tây Nguyên. Sắp tới, tỉnh này và Quảng Ngãi sẽ sáp nhập thành một tỉnh mới có tên Quảng Ngãi. Còn Măng Đen là thị trấn thuộc huyện Kon Plông, tỉnh Kon Tum, cách thành phố Kon Tum khoảng 60 km và được mệnh danh là ""Đà Lạt thứ hai"" của Tây Nguyên. Theo quy hoạch, Măng Đen được định hướng là vùng du lịch, sản xuất nông, lâm nghiệp và trọng điểm phát triển kinh tế phía đông tỉnh Kon Tum. Giai đoạn 2020-2021, địa phương này từng diễn ra tình trạng ""sốt"" đất, kéo theo nhiều sai phạm trong quản lý đất đai, xây dựng nhà ở. Năm 2023, Thanh tra Sở Tài nguyên và Môi trường tỉnh Kon Tum (nay là Sở Nông nghiệp và Môi trường) kiến nghị thu hồi 151 trường hợp, với diện tích trên 102.000 m2, đã được giao quản lý không thu tiền sử dụng đất trái quy định. Trong môi trường kinh tế hiện nay, đầu tư trở thành khái niệm phổ biến. Để độc giả có thể tiếp cận những xu hướng đầu tư mới nhất,Tri Thức - Znewsxây dựng chủ đềĐầu tư qua sách- nơi ghi lại những cuốn sách, câu chuyện, xu hướng đầu tư đã và đang diễn ra trong nước và thế giới. Không chỉ tập trung vào các lĩnh vực đầu tư phổ biến như bất động sản, chứng khoán, trái phiếu, ngoại hối, tiền ảo... Đầu tư qua sách còn bao gồm các kiến thức về quản lý gia sản, tài chính cá nhân.  Homestay Măng Đen cạn phòng, Đà Lạt vẫn 'thoáng' dịp 30/4 Trước kì nghỉ lễ 30/4-1/5 khoảng 2 tuần, việc đặt phòng tại Đà Lạt không quá khó khăn. Ở phía Măng Đen, nhiều khách sạn và homestay đã thông báo đầy khách.  Làm sân bay Măng Đen có khả thi? Bộ Giao thông Vận tải vừa có tờ trình về “Đề án nghiên cứu khả năng hình thành Cảng hàng không Măng Đen”, kinh phí gần 5.000 tỷ đồng.  Thu hồi 39 vị trí đất xây biệt thự trái quy định ở Măng Đen Phòng TN&MT huyện Kon Plông, Kon Tum vừa thu hồi 39 trường hợp thông báo giới thiệu địa điểm đất xây dựng biệt thự cho các hộ gia đình, cá nhân trái quy định của pháp luật."
ZNews,https://znews.vn/them-xe-buyt-mien-phi-noi-nha-ga-t3-va-t1-tan-son-nhat-post1550290.html,Kinh doanh,Null,"Thứ năm, 1/5/2025 12:05 (GMT+7)",Thêm xe buýt miễn phí nối nhà ga T3 và T1 Tân Sơn Nhất,"Xe buýt mới sẽ di chuyển bên trong sân đậu tàu bay, giúp tiết kiệm thời gian hơn các chuyến xe buýt khác. Ảnh:TIA. Để phục vụ hành khách chu đáo và thuận tiện hơn trong việc thực hiện các chuyến bay nối chuyến (transit) từ nhà ga T3 sang nhà ga T1,sân bay Tân Sơn Nhấtmới đây đã triển khai tuyến shuttle bus miễn phí bên trong sân đậu tàu bay. Nhà ga T3 vừa được đưa vào hoạt động, chuyên phục vụ các chuyến bay nội địa tương tự nhà ga T1, trong khi nhà ga T2 dành cho các chuyến bay quốc tế. Tuy nhiên, khoảng cách giữa T3 và T1 khá xa và bất tiện nếu phải đi vòng ra ngoài sân bay, qua đường Trường Sơn đông đúc xe cộ. Việc triển khai xe buýt miễn phí chạy trong sân đậu máy bay giúp rút ngắn đáng kể quãng đường và thời gian. Theo đó, từ 1/5, các tuyến xe buýt sẽ hoạt động từ 7h đến 3h sáng hôm sau với tần suất 20 phút/chuyến. Những chiếc xe trung chuyển này sẽ chạy từ sảnh transit nhà ga T3, đi qua sân đậu tàu bay và thả khách xuống tại cửa A2 nhà ga T1. Sau đó, hành khách sẽ thực hiện các chuyến bay tại nhà ga T1 (nếu bay quốc nội) và nhà ga T2 (nếu bay quốc tế). Dịch vụ này dành riêng cho hành khách nối chuyến (transit) đã hoàn tất thủ tục và có thẻ lên tàu (boarding pass) cho chặng bay tiếp theo. Hành lý ký gửi cũng được các hãng hàng không chuyển tiếp tự động. Hiện tại, Vietnam Airlines là hãng duy nhất khai thác tại nhà ga T3 với hai đường bay TP.HCM - Hà Nội và TP.HCM - Vân Đồn. Khách nối chuyến trên các hành trình như từ Hà Nội vào TP.HCM để tiếp tục bay đến Pháp, Đức hoặc các điểm đến quốc tế khác có thể sử dụng dịch vụ này. Tương tự, hành khách bay từ Hà Nội vào TP.HCM trên chuyến bay của Vietnam Airlines, sau đó nối chuyến đi Côn Đảo do Vasco khai thác, cũng có thể sử dụng xe buýt miễn phí để sang nhà ga T1. Trong ngày 1/5, sân bay Tân Sơn Nhất dự kiến có 353 chuyến bay đi và 362 chuyến bay đến. Các chuyến bay tập trung chủ yếu trên đường bay nội địa với 406 chuyến đi và đến. Tại nhà ga hành khách quốc nội T3, sân bay Tân Sơn Nhất dự kiến khai thác 41 chuyến bay với hơn 9.100 hành khách. Sân bay Tân Sơn Nhất khuyến cáo hành khách nội địa nên có mặt trước giờ khởi hành ít nhất 2 tiếng, hành khách quốc tế đến trước 3 tiếng, đồng thời chuẩn bị đầy đủ giấy tờ và kiểm tra hành lý đúng quy định. Hành khách được khuyến khích làm thủ tục check-in trực tuyến để tiết kiệm thời gian. Tri Thức - Znewsgiới thiệu độc giảTủ sách kiến thức kinh tếvới đa dạng cuốn sách, câu chuyện trong lĩnh vực kinh doanh, kinh tế. Là nguồn tư liệu cho những người quan tâm và muốn nâng cao kiến thức trong lĩnh vực kinh tế. Những cuốn sách, câu chuyện trong Tủ sách không chỉ đơn thuần là những tác phẩm của tri thức mà còn chứa đựng bí quyết, kinh nghiệm quý báu từ các tác giả, nhà quản lý có uy tín và kinh nghiệm lâu năm trong ngành. Đọc sách không chỉ giúp người đọc tiếp cận những kiến thức mới mà còn giúp mở rộng tầm nhìn và phát triển bản thân. Tủ sách kiến thức kinh tế mong muốn lan tỏa tri thức trong lĩnh vực kinh doanh, đồng thời phát triển văn hóa đọc cho người Việt.  Vietjet hoàn thành chuyển giao dịch vụ mặt đất ở sân bay Tân Sơn Nhất Trước thềm cao điểm lễ 30/4-1/5, hãng hàng không Vietjet đã nhận chuyển giao thành công công tác phục vụ mặt đất tại sân bay quốc tế Tân Sơn Nhất, TP.HCM.  Di chuyển thế nào ở sân bay Tân Sơn Nhất trong dịp lễ 30/4? Sân bay Tân Sơn Nhất dự kiến phục vụ 520 chuyến bay và 95.000 hành khách trong ngày cao điểm nhất của dịp lễ 30/4-1/5 tới, tăng 35% so với cùng kỳ năm ngoái.  Vietnam Airlines hoãn việc chuyển mọi chuyến bay về ga T3 Tân Sơn Nhất Ban đầu, Vietnam Airlines dự kiến chuyển toàn bộ chuyến bay nội địa về nhà ga T3 Tân Sơn Nhất từ ngày 28/4, nhưng hiện tại, kế hoạch đang được điều chỉnh."
