Source,URL,Category,Keyword,Time,Title,Content
ZNews,https://lifestyle.znews.vn/du-khach-mang-du-am-le-dieu-binh-o-tphcm-den-da-lat-post1550414.html,Du lịch,Null,"Thứ sáu, 2/5/2025 14:29 (GMT+7)",Du khách mang dư âm lễ diễu binh ở TP.HCM đến Đà Lạt,"Hạnh (ngụ Ninh Bình) diện áo dài, chụp ảnh tại chợ Đà Lạt sáng ngày 2/5. Ngày thứ 3 của kỳ nghỉ lễ 30/4-1/5, biên độ nhiệt tại Đà Lạt rơi vào khoảng 17-26 độ C, theo Google Weather. Thời tiết se se lạnh chiều lòng người dân, du khách đến địa phương vui chơi dịp lễ. Theo ghi nhận củaTri Thức - Znews, đường phố Đà Lạt bắt đầu nhộn nhịp từ sáng nhưng không xảy ra tình trạng ùn tắc cục bộ. Hưởng ứng kỷ niệm 50 năm ngày giải phóng miền Nam, thống nhất đất nước, khắp các tuyến đường tại đây được giăng dây cờ đỏ sặc sỡ, hàng phượng tím kế bên càng tô đậm màu lá cờ Tổ Quốc, tạo nên nét riêng của Đà Lạt. Đường phố Đà Lạt ngập cờ đỏ sao vàng. Một số tiểu thương trong chợ Đà Lạt vẫn bày bán mặt hàng in cờ Tổ Quốc. Đáng chú ý, tại khu vực chợ Đà Lạt, một số du khách vẫn diện áo dài, trang phục màu sắc quân đội, đeo khăn rằn... để dạo chợ, mua sắm, dù lễ diễu binh, diễu hành ở TP.HCM đã trôi qua 2 ngày. Ông Đặng Thế Phụng, giảng viên một trường Sĩ quan Lục quân, cùng vợ du ngoạn chợ Đà Lạt sáng ngày 2/5. Cả hai di chuyển từ TP.HCM sau khi chiêm ngưỡng lễ kỷ niệm hoành tráng ở thành phố ngày 30/4. Tương tự, Hoàng Oanh (25 tuổi, ngụ TP.HCM) thấm mệt sau khi thức trắng đêm “đu concert Quốc gia” hôm 30/4, nhưng cô cùng bạn tiếp tục vượt hơn 300 km lên Đà Lạt nghỉ dưỡng các ngày lễ còn lại, trên người vẫn là chiếc áo “Độc lập - Tự do - Hạnh phúc” và khăn rằn quấn quanh cổ. Sáng sớm 1/5 cô cùng bạn sẽ đến Đà Lạt, song tình trạng ùn tắc ở cửa ngõ TP.HCM kéo dài thời gian di chuyển khoảng 2 tiếng so với dự kiến. Ông Phụng cùng vợ dạo chợ Đà Lạt sáng 2/5. Trước đó, ngày 1/5,  trung tâm Đà Lạt chứng kiến mức độ ùn tắc giao thông nhẹ tại tuyến đèo Prenn, 3 Tháng 4, Trần Hưng Đạo, Trần Phú, Phan Đình Phùng… đặc biệt là các vòng xuyến, chợ Đà Lạt, khu Hòa Bình... Dịp này, thành phố tổ chức nhiều chương trình phục vụ du khách. Đây cũng là một trong số nguyên do dẫn đến sự bận rộn tại các tuyến đường chính. Đến khoảng 18h, dòng người bắt đầu đổ về chợ đêm Đà Lạt, một trong số điểm du lịch đêm phổ biến tại đây, đi dạo và thưởng thức nhiều thức đồ ấm nóng như sữa đậu nành, bánh tráng nướng, hạt dẻ... Số lượng khách tham quan tăng dần, đỉnh điểm là lúc 21h. Phan Lê Minh Hằng (ngụ Khánh Vĩnh) cùng gia đình ghé Đà Lạt trong kỳ nghỉ dài ngày. Bạn trẻ tỏ ra thích thú trước không khí nhộn nhịp ở phố núi về đêm. Dạo chợ đêm cũng là hoạt động cuối cùng kết thúc một ngày ăn chơi của Hằng. Chụp ảnh, ăn uống là một số hoạt động chính diễn ra ở chợ Đà Lạt đêm 1/5. Theo UBND TP Đà Lạt, kể từ ngày 1/5, lượng khách đến địa phương tăng mạnh, trái ngược với cảnh thông thoáng vào ngày 30/4. Du khách chủ yếu lượng khách tới từ TP.HCM, các tỉnh Đông Nam Bộ và lân cận Lâm Đồng. Tỷ lệ đặt phòng trước trên địa bàn dịp nghỉ lễ 30/4 - 1/5 chiếm khoảng 70%, 30% còn lại vẫn trống, theo ông Lê Anh Kiệt, Trưởng Phòng Văn hoá Khoa học và Thông tin, UBND TP Đà Lạt. Bên cạnh đó, với thời tiết mát mẻ đặc trưng, địa phương dự kiến đón hơn 80.000 lượt khách vi vu tránh nóng vào kỳ nghỉ này. Một góc đường Tăng Bạt Hổ tối ngày 1/5. Du khách ngồi kín đường đợi thưởng thức sữa đậu nành nóng, bánh tráng nướng giữa tiết trời se lạnh. Du lịch là để tận hưởng hay sống ảo? Theo TS Đặng Hoàng Giang - tác giả cuốn sáchVẻ đẹp của cảnh sắc tầm thường- việc chạy theo những gì được cho là đẹp theo tiêu chuẩn số đông đang phá vỡ sự nguyên sơ, gây tổn hại nghiêm trọng đến hệ sinh thái tự nhiên. Mục Du lịch - Ẩm thực giới thiệu nội dung buổi chia sẻ của tác giả Đặng Hoàng Giang về quan điểm du lịch đang khiến con người quên đi việc tận hưởng vẻ đẹp của thiên nhiên. > Đọc tiếp:Hệ luỵ của du lịch 'sống ảo'"
ZNews,https://lifestyle.znews.vn/con-duong-trang-xoa-bi-cam-that-day-an-toan-o-chau-au-post1550450.html,Du lịch,Null,"Thứ sáu, 2/5/2025 12:02 (GMT+7)","Con đường trắng xóa, bị cấm thắt dây an toàn ở châu Âu","Tuyến đường băng dài khoảng 27 km, nối cảng Rohuküla và đảo Hiiumaa trên biển Baltic. Theo quy định an toàn của Estonia, tuyến đường đặc biệt này chỉ mở cửa đón khách vào mùa đông, khi lớp băng dày từ 22 cm trở lên, đủ để chịu được sức nặng của các phương tiện giao thông qua lại. Ảnh:Eestielu. Để lái xe trên tuyến đường này, các tài xế phải nắm vững và tuân theo loạt quy định ""siêu lạ"" như cấm di chuyển kể từ thời điểm Mặt trời lặn hay yêu cầu duy trì tốc độ đi dưới 25 km/h hoặc trên 40 km/h. Ảnh:DELFI. Theo lý giải của các chuyên gia, nếu lái xe không đúng quy định ở tốc độ trong khoảng 25-40 km/h quá lâu có thể làm nứt vỡ lớp băng. Ảnh:Visit Estonia. Trong khi việc thắt dây an toàn khi lái xe là quy định bắt buộc trong bộ luật giao thông đường bộ tại hầu hết quốc gia trên thế giới, thì trên tuyến đường băng này, đây lại là hành vi vi phạm. Lý do là để phòng khi đang đi trên đường và băng nứt, tài xế cần thoát khỏi xe một cách nhanh nhất. Việc thắt dây an toàn có thể khiến những người trên xe bị mắc kẹt lâu hơn, chậm trễ thoát hiểm. Ảnh:Express. Bên cạnh đó, trên cả tuyến đường, tài xế không được phép dừng đỗ xe cũng như luôn phải duy trì khoảng cách tối thiểu với xe trước là 250 m. Tuyến đường này được coi là một trong những điểm du lịch mùa đông độc đáo nhất ở Bắc Âu. Du khách tới đây vừa có thể chiêm ngưỡng cảnh quan thiên nhiên tuyệt đẹp, vừa có thể trực tiếp tham gia những trải nghiệm mạo hiểm. Du lịch là để tận hưởng hay sống ảo? Theo TS Đặng Hoàng Giang - tác giả cuốn sáchVẻ đẹp của cảnh sắc tầm thường- việc chạy theo những gì được cho là đẹp theo tiêu chuẩn số đông đang phá vỡ sự nguyên sơ, gây tổn hại nghiêm trọng đến hệ sinh thái tự nhiên. Mục Du lịch - Ẩm thực giới thiệu nội dung buổi chia sẻ của tác giả Đặng Hoàng Giang về quan điểm du lịch đang khiến con người quên đi việc tận hưởng vẻ đẹp của thiên nhiên. > Đọc tiếp:Hệ luỵ của du lịch 'sống ảo'  Ngọn đồi xe tắt máy vẫn tự leo dốc tại Ấn Độ Không chỉ nổi tiếng với lực hút kỳ lạ, Magnetic Hill còn trở thành điểm dừng chân hoàn hảo cho những tay đua mệt mỏi khi di chuyển trên đường cao tốc.  Quy tắc du lịch lạ lùng ở Triều Tiên Triều Tiên là quốc gia khép kín và bí ẩn nhất thế giới với nhiều quy tắc kỳ lạ, nhưng hầu hết du khách sau khi đến đất nước này đều đánh giá đó là nơi hấp dẫn nhất mà họ từng đặt chân.  Cuộc sống kỳ lạ của bộ tộc lấy tro cốt làm thức ăn 11:10 14/9/202411:1014/9/2024Du lịchĐịa điểm du lịch 0 Không chỉ có niềm tin về việc sử dụng tro cốt để ăn, bộ tộc bí ẩn Yanomami còn có truyền thống cho phép bé gái đính hôn khi còn rất nhỏ."
ZNews,https://lifestyle.znews.vn/rai-3-tan-ngao-ra-bai-bien-o-trung-quoc-vi-so-e-khach-dip-le-post1550447.html,Du lịch,Null,"Thứ sáu, 2/5/2025 13:00 (GMT+7)",Rải 3 tấn ngao ra bãi biển ở Trung Quốc vì sợ ế khách dịp lễ,"Điểm du lịch thuê 2 chiếc xe, rải ngao khắp bãi biển. Du khách không muốn đào dưới lớp cát vẫn có thể chạy theo xe rải ngao để thu hoạch. Ảnh:Jin Jie. Lo ngại ế khách trong ""tuần lễ vàng"" Quốc tế Lao động 1/5, một điểm du lịch ven biển tại Nhật Chiếu, tỉnh Sơn Đông (Trung Quốc) rải 3 tấn ngao lên bãi biển nhằm nâng cao trải nghiệm tắm biển, với mục tiêu “không ai ra về tay trắng”, theoThe Paper. Hoạt động này nhanh chóng thu hút sự chú ý của dư luận, đồng thời vấp phải nhiều ý kiến trái chiều. Trước nhiều bàn tán, đại diện điểm du lịch xác nhận khoảng 3 tấn ngao được rải mỗi ngày, phục vụ trải nghiệm tự tay thu hoạch ngao của du khách. Hoạt động này mang tên ""Long Vương dâng báu vật"", với kỳ vọng khiến du khách cảm thấy hào hứng và hài lòng khi tới bãi biển. Theo đại diện điểm du lịch xác nhận khoảng 3 tấn ngao được rải mỗi ngày khắp khu vực ven biển thành phố Nhật Chiếu, tỉnh Sơn Đông (Trung Quốc) để thu hút du khách. Ảnh:Jin Jie. Đại diện điểm du lịch còn tiết lộ toàn bộ số ngao được đào từ các bãi bồi bởi lực lượng lao động do đơn vị thuê. “Khu vực này có rất nhiều ngao hoang dã, nhưng phần lớn nằm sâu dưới lớp bùn, du khách bình thường khó có thể đào được. Chúng tôi sợ rằng khách đi xa đến không thu hoạch được gì sẽ thất vọng, nên quyết định tổ chức hoạt động này để đảm bảo ai đến cũng có thể mang về chút ‘chiến lợi phẩm’”,vị đại diện điểm du lịch chia sẻ. Tuy nhiên, hoạt động này nhanh chóng gây ra những tranh luận sôi nổi trên mạng xã hội. Một số người cho rằng đây là cách làm sáng tạo và mang lại niềm vui cho du khách. Ngược lại, nhiều ý kiến chỉ trích việc “diễn cảnh thiên nhiên” làm mất đi tính chân thực của trải nghiệm du lịch, biến hoạt động khám phá thành một “trò dàn dựng”. Hàng trăm người chạy theo xe rải ngao để nhặt. Ảnh:163. Không chỉ Sơn Đông, xu hướng tạo ""trải nghiệm nhân tạo"" nhằm hút khách du lịch đang ngày càng phổ biến tại nhiều nơi ở Trung Quốc, đặc biệt vào các dịp cao điểm. Song, phần lớn các trải nghiệm ""nhân tạo"" này đều vấp phải chỉ trích từ du khách. Chẳng hạn, năm 2017, một khu du lịch ở Hải Nam bị phát hiện đặt sẵn ngọc trai vào hàu rồi tổ chức ""trò chơi mò ngọc dưới biển"", khiến du khách cảm thấy bị lừa. Các khu sinh thái tại Giang Tô, Quảng Đông cũng từng bị tố trồng sen và thả cá theo mùa chỉ để du khách có khung cảnh ""check-in"" trong dịp cao điểm... Mùa đông 2023-2024, các khu trượt tuyết ở Trương Gia Khẩu và Cáp Nhĩ Tân phải sử dụng 100% tuyết nhân tạo để giữ hình ảnh điểm đến giữa bối cảnh thời tiết không đủ lạnh để có tuyết... Du lịch là để tận hưởng hay sống ảo? Theo TS Đặng Hoàng Giang - tác giả cuốn sáchVẻ đẹp của cảnh sắc tầm thường- việc chạy theo những gì được cho là đẹp theo tiêu chuẩn số đông đang phá vỡ sự nguyên sơ, gây tổn hại nghiêm trọng đến hệ sinh thái tự nhiên. Mục Du lịch - Ẩm thực giới thiệu nội dung buổi chia sẻ của tác giả Đặng Hoàng Giang về quan điểm du lịch đang khiến con người quên đi việc tận hưởng vẻ đẹp của thiên nhiên. > Đọc tiếp:Hệ luỵ của du lịch 'sống ảo'  Hẹn hò sau giờ làm tại phòng tắm công cộng ở Trung Quốc Khách hàng ở độ tuổi từ 20 đến 40 là đối tượng chính sử dụng dịch vụ tắm rửa, ăn uống và thư giãn sau một ngày làm việc mệt mỏi ở xứ tỷ dân.  Robot 'phủ sóng' tại loạt khu du lịch Trung Quốc Không chỉ hỗ trợ du khách leo núi, robot tại loạt danh lam thắng cảnh còn nâng tầm trải nghiệm và mở ra hướng đi mới cho ngành du lịch Trung Quốc trong kỷ nguyên số.  Khách Trung chán ngán Thái Lan, Việt Nam hưởng lợi 18:26 25/4/202518:2625/4/2025Du lịchĐịa điểm du lịch 0 Việt Nam vượt Thái Lan trở thành điểm đến hàng đầu của khách Trung Quốc trong quý I. Trước đà tụt dốc, du lịch Thái Lan gấp rút tung các gói trợ giá, quảng bá để giành lại thị phần."
ZNews,https://lifestyle.znews.vn/du-khach-phai-lam-to-khai-dien-tu-khi-nhap-canh-thai-lan-post1550484.html,Du lịch,Null,"Thứ sáu, 2/5/2025 20:41 (GMT+7)",Du khách phải làm tờ khai điện tử khi nhập cảnh Thái Lan,"Từ 1/5, du khách nước ngoài đến Thái Lan phải khai báo điện tử bắt buộc. Ảnh:Julito Elizalde/Pexels. Bắt đầu từ ngày 1/5, Thái Lan chính thức triển khai hệ thống thẻ nhập cảnh điện tử (e-Arrival Card) đối với tất cả du khách nước ngoài. Đây không phải là thị thực mà là một hình thức khai báo điện tử bắt buộc, được áp dụng nhằm hiện đại hóa quy trình nhập cảnh và phù hợp với các thông lệ quốc tế. Tại cửa khẩu quốc tế Nong Khai, Đông Bắc Thái Lan, nhiều du khách cho biết đã từng đến Thái Lan trước đó nhưng đây là lần đầu họ biết đến quy định mới. Sau khi quét mã QR do cơ quan chức năng cung cấp, nhiều người mất khá nhiều thời gian để hoàn tất tờ khai trực tuyến, đặc biệt với những người không rành tiếng Anh hoặc không quen với công nghệ. Chị Nguyễn Thị Ánh Tuyết, đến từ Phan Thiết (Bình Thuận), chia sẻ: ""Mọi lần tôi qua đây thủ tục nhập cảnh khá đơn giản, nhưng hôm nay phải khai tờ khai điện tử thì thủ tục rườm rà hơn. Ví dụ như lớp trẻ thì sẽ dễ, nhưng người lớn tuổi trong gia đình tôi thấy hơi khó khăn một chút"". Tương tự, ông King Wa Yung, du khách đến từ Kong Kong (Trung Quốc), nhận xét: ""Tôi cho rằng lần đầu làm tờ khai này sẽ hơi mất thời gian, khoảng 30 phút, nhưng những lần sau sẽ dễ dàng hơn"". Khách du lịch quốc tế tham quan một ngôi chùa ở Bangkok, Thái Lan. Ảnh:THX/TTXVN. Theo quy định, du khách nhập cảnh hoặc xuất cảnh khỏi Thái Lan phải điền các thông tin bắt buộc như: họ tên, số hộ chiếu, kế hoạch đi lại, nơi lưu trú tại Thái Lan và tình trạng sức khỏe. Tờ khai có thể được thực hiện trong vòng 3 ngày trước chuyến đi hoặc ngay tại cửa khẩu. Sau khi hoàn tất, du khách sẽ nhận được thư điện tử xác nhận và mã QR để xuất trình cho lực lượng chức năng. Anh Nguyễn Võ Thành An, một người Việt sống tại Lào, cho rằng hệ thống khai báo điện tử giúp tiết kiệm thời gian và thuận tiện hơn nếu điền đúng thông tin trên hộ chiếu. Việc khai báo điện tử hoàn toàn miễn phí. Các cơ quan chức năng Thái Lan khuyến cáo người dân chỉ sử dụng hệ thống chính thức và cảnh giác với các trang web yêu cầu trả phí – vì đó có thể là trang giả mạo. Việc áp dụng hệ thống nhập cảnh điện tử được kỳ vọng sẽ giúp Thái Lan nâng cao hiệu quả kiểm soát biên giới, đồng thời tạo điều kiện thuận lợi hơn cho khách quốc tế trong bối cảnh du lịch đang phục hồi mạnh mẽ sau đại dịch. Du lịch là để tận hưởng hay sống ảo? Theo TS Đặng Hoàng Giang - tác giả cuốn sáchVẻ đẹp của cảnh sắc tầm thường- việc chạy theo những gì được cho là đẹp theo tiêu chuẩn số đông đang phá vỡ sự nguyên sơ, gây tổn hại nghiêm trọng đến hệ sinh thái tự nhiên. Mục Du lịch - Ẩm thực giới thiệu nội dung buổi chia sẻ của tác giả Đặng Hoàng Giang về quan điểm du lịch đang khiến con người quên đi việc tận hưởng vẻ đẹp của thiên nhiên. > Đọc tiếp:Hệ luỵ của du lịch 'sống ảo'  Khách Việt phải khai báo online trước 3 ngày khi đến Thái Lan Du khách quốc tế đến Thái Lan, bao gồm cả Việt Nam, phải khai báo trực tuyến trong vòng 3 ngày khi nhập cảnh thay vì điền giấy như trước, theo TAT.  Tranh cãi quán cà phê 'vườn thú người' ở Thái Lan Một quán cà phê ở Chiang Mai, Thái Lan bác bỏ chỉ trích khi khách hàng cho rằng nơi này đang biến không gian làm việc của người lao động thành ""vườn thú"".  Khách Trung chán ngán Thái Lan, Việt Nam hưởng lợi 18:26 25/4/202518:2625/4/2025Du lịchĐịa điểm du lịch 0 Việt Nam vượt Thái Lan trở thành điểm đến hàng đầu của khách Trung Quốc trong quý I. Trước đà tụt dốc, du lịch Thái Lan gấp rút tung các gói trợ giá, quảng bá để giành lại thị phần."
ZNews,https://lifestyle.znews.vn/du-lich-tphcm-thang-dam-dip-304-post1550530.html,Du lịch,Null,"Thứ sáu, 2/5/2025 22:28 (GMT+7)",Du lịch TP.HCM thắng đậm dịp 30/4,"Bạn trẻ check-in tại một quán cà phê được trang trí cờ đỏ sao vàng tại TP.HCM. Ảnh:Linh Huỳnh. Dịp kỷ niệm 50 năm Ngày Giải phóng miền Nam, thống nhất đất nước (30/4/1975 – 30/4/2025), ngành du lịch TP.HCM ghi nhận kỳ nghỉ lễ sôi động. Thống kê từ Sở Du lịch TP.HCM, cáckhách sạntrên địa bàn, công suất phòng ngày 27/4-1/5 đạt mức 95-100% tại khu vực trung tâm. Nhiều khách sạn 4-5 sao thông báo “cháy phòng” từ sớm, trong khi các khách sạn lân cận cũng ghi nhận tỷ lệ lấp đầy từ 80% trở lên. Ngoài dịch vụ lưu trú, các khách sạn đồng loạt tổ chức hoạt động chào mừng như treo cờ, trưng bày sản phẩm văn hóa như chiếu phim tư liệu lịch sử, tổ chức viết lưu bút, và trình diễn nghệ thuật truyền thống. Nhiều dòng lưu bút từ du khách bày tỏ niềm tự hào, xúc động trong dịp lễ 30/4 tại TP.HCM. Ảnh:Sở Du lịch TP.HCM. Sổ lưu bút đặt tại tiền sảnh nhiều khách sạn ghi nhận hàng trăm dòng lưu bút từ du khách bày tỏ niềm tự hào dân tộc, sự xúc động khi được hòa mình vào lễ kỷ niệm trọng đại, ngắm nhìn phố phường rợp đỏ cờ hoa. Nhiều du khách chia sẻ đây là kỳ nghỉ đáng nhớ nhất họ từng trải qua tại TP.HCM. Không chỉ dừng lại ở lưu trú, xu hướngdu lịch tại chỗ, đặc biệt là các tour nội đô và hành trình lịch sử, thực sự bùng nổ trong dịp lễ năm nay. Thống kê từ các công ty lữ hành cho thấy lượng khách đặt tour trong thành phố tăng mạnh, với nhiều sản phẩm tour kín lịch từ sớm. Cụ thể, BestPrice cho biết lượng khách đặt tour nội đô trong dịp 29/4–4/5 tăng gấp đôi so với cùng kỳ năm 2024. Vietluxtour ghi nhận tổng lượng khách đến TP.HCM tăng 50%, riêng khách đoàn và doanh nghiệp tăng 25%. Các tour chủ đề như “Dấu ấn thống nhất hào hùng” và “Trở về miền đất thép” nhận được sự quan tâm đặc biệt. Du lịch Việt tăng trưởng 20%, trong đó 58% khách hàng lựa chọn đi tour nội địa. Trong khi đó, Vietravel và Saigontourist cho biết mặc dù lượng khách đến Thành phố ổn định, nhu cầu du lịch trong Thành phố lại vượt kỳ vọng nhờ sức hút từ chuỗi sự kiện kỷ niệm quy mô lớn. Dịp này công suất phòng từ ngày 27/4 đến 1/5 đạt mức 95-100% tại khu vực trung tâm TP.HCM. Nhiều khách sạn 4-5 sao thông báo “cháy phòng” từ sớm. Ảnh:Sở Du lịch TP.HCM. Đáng chú ý, các doanh nghiệp đã có sự đầu tư sáng tạo khi triển khai các tour tương tác theo chủ đề như “Thám hiểm địa đạo - Trở về miền đất thép” - nơi du khách trực tiếp trải nghiệm cảm giác chui hầm, dùng cơm vắt, mặc quân phục chiến sĩ như một cách ""sống lại lịch sử"". Các city tour kết hợp hoạt động giải mật thư theo dấu ấn Sài Gòn xưa cũng được giới trẻ đón nhận nhiệt tình. Các gói tour linh hoạt như mua riêng vé máy bay, khách sạn, hướng dẫn viên... cũng gia tăng đáng kể, phục vụ nhóm khách trẻ và gia đình muốn tự thiết kế hành trình. Không khí lễ hội tại TP.HCM không chỉ đến từ các sự kiện quy mô lớn mà còn lan tỏa nhờ sự vào cuộc của người dân trên địa bàn. Trên khắp các tuyến phố, hàng nghìn ngôi nhà treo cờ đỏ sao vàng, băng rôn, phối hợp giữ gìn vệ sinh và trật tự. Nhiều người dân trở thành “hướng dẫn viên không chuyên”, sẵn sàng chỉ đường, giới thiệu đặc sản, chia sẻ câu chuyện Sài Gòn xưa với khách du lịch. Tinh thần hiếu khách, tự hào dân tộc cùng sự năng động, thân thiện của người dân đã góp phần quan trọng vào thành công của kỳ nghỉ lễ 30/4 năm nay, biến TP.HCM trở thành điểm đến không chỉ đẹp mà còn sống động và đầy ý nghĩa. Theo Sở Du lịch TP.HCM, đợt cao điểm này là minh chứng cho sức sống du lịch Thành phố sau đại dịch và cho thấy tiềm năng rất lớn từ các sản phẩm gắn với lịch sử, văn hóa và bản sắc địa phương. Thành phố sẽ tiếp tục đầu tư, nâng chất lượng sản phẩm du lịch nhằm đáp ứng nhu cầu đa dạng và gia tăng trải nghiệm cho du khách trong những chặng đường tới. Du lịch là để tận hưởng hay sống ảo? Theo TS Đặng Hoàng Giang - tác giả cuốn sáchVẻ đẹp của cảnh sắc tầm thường- việc chạy theo những gì được cho là đẹp theo tiêu chuẩn số đông đang phá vỡ sự nguyên sơ, gây tổn hại nghiêm trọng đến hệ sinh thái tự nhiên. Mục Du lịch - Ẩm thực giới thiệu nội dung buổi chia sẻ của tác giả Đặng Hoàng Giang về quan điểm du lịch đang khiến con người quên đi việc tận hưởng vẻ đẹp của thiên nhiên. > Đọc tiếp:Hệ luỵ của du lịch 'sống ảo'  Du khách mang dư âm lễ diễu binh ở TP.HCM đến Đà Lạt Diện quân phục, khoác khăn rằn dạo chợ là một vài điều dễ thương ở Đà Lạt trong ngày nghỉ lễ thứ 2 và 3. Ngoài ra, một số tiểu thương vẫn còn bày bán mặt hàng in cờ Tổ quốc.  Kết màn 3D Mapping gây choáng ngợp tại TP.HCM tối 30/4 Đội Việt Nam và Pháp mang đến màn trình diễn 3D Mapping mãn nhãn trên tòa nhà UBND thành phố, khép lại chuỗi sự kiện ""Sắc màu thành phố Bác"", chào mừng 50 năm thống nhất đất nước.  Khuyến cáo khách du lịch đến TP.HCM dịp 30/4 03:17 30/4/202503:1730/4/2025Du lịchDu lịch 0 Sở Du lịch TP.HCM khuyến cáo du khách có thể số điện thoại (028)1022, bấm nhánh số 8, để phản ánh các tình trạng đối với hoạt động lưu trú, ăn uống và mua sắm trong dịp nghỉ lễ 30/4-1/5."
