Source,URL,Category,Keyword,Time,Title,Content
ZNews,https://znews.vn/psg-gap-chelsea-la-tran-chung-ket-ty-usd-post1568309.html,Thể thao,Null,"Chủ nhật, 13/7/2025 21:00 (GMT+7)",PSG gặp Chelsea là trận chung kết tỷ USD,"PSG nổi lên như một thế lực trong làng bóng đá thế giới. Đằng sau tiếng hò reo và ánh đèn rực rỡ tại MetLife Stadium là một sự thật trần trụi: bóng đá hiện đại, ở đỉnh cao nhất, là sân chơi của những kẻ nắm tiền. PSG và Chelsea không chỉ là hai đội lọt vào chung kết FIFA Club World Cup 2025™. Họ là hai CLB chi tiêu nhiều nhất thế giới trong ba mùa giải gần nhất. Tính từ hè 2022 đến nay, bộ đôi này ""đốt"" tổng cộng gần3 tỷ USDvào thị trường chuyển nhượng. Riêng mùa 2025, PSG bỏ ra hơn500 triệu USDđể đưa về 11 cầu thủ mới, trong khi Chelsea không kém cạnh với hàng trăm triệu đô cho những cái tên như Joao Pedro hay Jamie Gittens - những người vừa gia nhập và ngay lập tức mang lại hiệu quả. Luis Enrique nói rằng PSG thành công vì ""chúng tôi cùng nhau làm việc, theo một triết lý tập thể"". Nhưng ngay sau đó, ông cũng thẳng thắn thừa nhận: “PSG là nơi mà ngân sách không phải là vấn đề. Chúng tôi có thể mua bất kỳ ai mình muốn”. Câu nói ấy, dù chỉ là một dòng, đã tóm gọn bản chất của thành công mà PSG đang sở hữu. Triết lý, hệ thống, chiến thuật - tất cả đều quan trọng. Nhưng không có hàng trăm triệu USD để chiêu mộ Joao Neves, Khvicha Kvaratskhelia hay Ousmane Dembélé, những ""triết lý"" đó sẽ mãi chỉ nằm trên giấy. Chelsea cũng mua sắm rầm rộ thời gian qua. Chelsea cũng vậy. Sau khi tỷ phú Mỹ Todd Boehly tiếp quản từ Roman Abramovich, CLB thành London bước vào giai đoạn ""mua không cần nghĩ"", với hàng loạt thương vụ bị coi là vung tay quá trán. Nhưng sai ở đâu, họ mua thêm ở đó. Trượt Enzo Fernandez ư? Trả thêm. Mudryk mờ nhạt ư? Thêm João Pedro. Và vòng quay lại tiếp tục. Bóng đá giờ không phải là trò chơi của sự kiên nhẫn - mà là của khả năng… nạp tiền liên tục. Trớ trêu thay, chính FIFA - tổ chức luôn hô hào sự công bằng và phát triển bóng đá toàn cầu - lại tạo ra một sân chơi mà chênh lệch tài chính được hợp pháp hóa. Gói thưởng1 tỷ USDcho Club World Cup được phân chia chủ yếu dựa trên ""tiêu chí thương mại"". Kết quả? 12 CLB châu Âu nhận623 triệu USD; 20 CLB còn lại - từ châu Á, châu Phi, Nam Mỹ - chia nhau vỏn vẹn377 triệu USD. Nói cách khác, Club World Cup không phải nơi thu hẹp khoảng cách giàu-nghèo, mà là nơi củng cố quyền lực tài chính. Các đội bóng từng cố gắng tạo nên kỳ tích - như Fluminense hay Al Ahly - sớm bị loại. Họ không thiếu ý chí, chỉ thiếu tiền. Theo thống kê, 20/22 cầu thủ đá chính trong trận chung kết này là các bản hợp đồng chuyển nhượng. Đó là minh chứng rõ ràng cho quy luật tàn khốc của bóng đá đỉnh cao: muốn thắng, trước hết phải mua được đội hình để thắng. Chấn thương? Có tiền thì mua người thay thế. Sai lầm chuyển nhượng? Có tiền thì mua tiếp. Những đội như PSG và Chelsea có thể thất bại tạm thời, nhưng với dòng tiền khổng lồ từ quỹ đầu tư quốc gia (PSG) hay các tập đoàn tài chính Mỹ (Chelsea), thất bại không bao giờ là ngõ cụt. FIFA Club World Cup là nơi phân hoá giàu-nghèo rõ rệt. Dù ai giành chiến thắng vào rạng sáng 14/7, một điều đã rõ: chiếc cúp sẽ thuộc về kẻ giàu hơn. Và sang năm, rất có thể cũng vẫn là hai cái tên ấy, bởi bóng đá hiện đại đã bước vào vòng lặp khép kín: Giàu - Mua người - Thắng - Giàu hơn - Mua tiếp. Các đội bóng còn lại - từ Nam Mỹ đến châu Á - chỉ là phông nền cho cuộc chơi ấy. Họ có thể chiến đấu ngoan cường, tạo nên bất ngờ trong chốc lát, nhưng không thể cạnh tranh lâu dài nếu không có túi tiền tỷ đô. Và FIFA, thay vì cân bằng lại trò chơi, dường như đang tiếp tục đổ dầu vào ngọn lửa bất công. Club World Cup 2025 không chỉ là một trận đấu, mà là tấm gương phản chiếu trung thực nhất về bóng đá hiện đại: nơi mà chiến thuật tối thượng không còn là pressing hay kiểm soát bóng - mà là quyền lực của đồng tiền. Xem FIFA Club World Cup 2025™ trực tiếp và duy nhất tại Việt Nam trên FPT Play, tạihttp://fptplay.vn"
ZNews,https://znews.vn/club-world-cup-giac-mong-quyen-luc-cua-infantino-post1568267.html,Thể thao,Null,"Chủ nhật, 13/7/2025 12:11 (GMT+7)",Club World Cup - giấc mộng quyền lực của Infantino,"Chủ tịch FIFA, Gianni Infantino rất hài lòng về FIFA Club World Cup. Bởi vì nếu chịu lắng nghe, ông đã biết rằng FIFA Club World Cup 2025™ - giải đấu mới mà bản thân ra sức tô hồng - không hề là “thành công vĩ đại” như những gì rao giảng trước dàn “huyền thoại FIFA” và một nhóm phóng viên được lựa chọn kỹ lưỡng tại... sảnh Trump Tower. Vâng, người hâm mộ không đọc nhầm: Trump Tower. Cảnh tượng này không chỉ kỳ quặc mà còn mang tính biểu tượng cao độ - một lãnh đạo thể thao toàn cầu, tự giam mình trong vỏ bọc quyền lực và xa rời thực tại, tung hô một giải đấu bị giới chuyên môn, cầu thủ, người hâm mộ và các giải VĐQG đồng loạt chỉ trích. Infantino nói Club World Cup thu về2,1 tỷ USD, đạt lượng khán giả trung bình 40.000 người/trận, và... có tới “hai đến ba tỷ người xem toàn cầu”. Không một con số nào trong đó được dẫn nguồn cụ thể, không một đơn vị độc lập nào được phép kiểm chứng. Tất cả được rút gọn thành một thông điệp: ""Tin tôi đi, tôi là FIFA"". Điều đáng nói hơn cả không phải là những con số phóng đại đó, mà là cách chúng được phục vụ. Trước mặt Infantino là dàn “huyền thoại” gồm Del Piero, Stoichkov, Ronaldo, Baggio - những người thay nhau ca ngợi FIFA như thể đang đọc diễn văn chính trị. Họ không chỉ được đài thọ toàn bộ chi phí đi lại, lưu trú, mà còn được tạo cơ hội “làm ăn” với các nhà tài trợ. Đổi lại, họ phải hát khúc ca ngợi FIFA. Một màn diễn mà ai cũng biết kết thúc từ trước, ngoại trừ người xem. Chủ tịch FIFA vẫn cho rằng Club World Cup 2025 đã thành công. Trong khi ấy, báo chí bị kiểm soát gắt gao. Chỉ hai câu hỏi mang tính phản biện được phép đặt ra, phần còn lại bị bỏ qua. Thay vào đó là những câu hỏi dễ chịu như: “Tổng thống Mỹ, ông Donald Trump có thích bóng đá không?” - mở màn cho một màn khoe khoang khác của Infantino về những lần gặp gỡ tại Nhà Trắng. Tuy nhiên, bên ngoài Trump Tower, thực tại phơi bày rõ ràng hơn. 39 giải VĐQG đã kiện FIFA lên Ủy ban châu Âu vì hành vi phá vỡ lịch thi đấu quốc tế. Tổ chức cầu thủ chuyên nghiệp FifPro lên tiếng cảnh báo về tình trạng kiệt sức. Ngay cả những cầu thủ có mặt tại Mỹ cũng không giấu được nỗi lo. Jürgen Klopp thì thẳng thừng gọi giải đấu này là “ý tưởng tồi tệ nhất từng được áp dụng trong bóng đá”. Với Infantino, những tiếng nói đó chẳng đáng bận tâm. Ông không đến để đối thoại, mà để áp đặt. Mục tiêu cuối cùng của ông chưa bao giờ là phát triển bóng đá toàn cầu một cách công bằng - mà là mở rộng quyền lực của FIFA vào lãnh địa béo bở nhất: bóng đá cấp CLB, nơi doanh thu truyền hình, tài trợ và danh tiếng đều đạt đỉnh. Club World Cup chỉ là vỏ bọc cho tham vọng đó. Và đúng như dự tính, Chelsea - bất kể kết quả chung kết với PSG - sẽ mang về hơn100 triệu USD. Một khoản tiền đủ làm biến dạng cán cân cạnh tranh trong bóng đá nội địa. Nhưng Infantino không bận tâm đến “hệ sinh thái mong manh” đó. Ông chỉ quan tâm đến việc: giải đấu của mình đã diễn ra, tiền đã đổ về, và những người được trả tiền đã nói điều ông muốn nghe. Club World Cup của Chủ tịch FIFA, Gianni Infantino đã học nhiều điều từ dự án Super League thất bại. Khi được hỏi về thời tiết nóng nực khiến cầu thủ ngột ngạt, ông nhún vai: “Olympic ở Paris cũng nóng. Chúng tôi sẽ có thêm thời gian nghỉ uống nước”. Khi bị chất vấn về những hàng ghế trống, ông phản biện: “Tôi thà có 35.000 người trong sân 80.000 chỗ, còn hơn 20.000 người trong sân 20.000 chỗ”. Trong logic của ông, bề ngoài lúc nào cũng quan trọng hơn bản chất. Có một thứ mà Infantino và nhóm lãnh đạo FIFA học rất nhanh từ mô hình Super League từng thất bại: muốn kiểm soát tương lai bóng đá, đừng thuyết phục các CLB nhỏ, hãy chiều lòng các CLB lớn. Họ đã làm điều đó bằng tiền, bằng lời hứa về sân khấu toàn cầu, và bằng cách tạo ra một giải đấu mà phần còn lại chỉ là phông nền. Và như vậy, một lần nữa, người ta nhận ra: Club World Cup không chỉ là một giải đấu - nó là tuyên ngôn về quyền lực. Là bản thử nghiệm cho một hệ sinh thái mà FIFA có thể kiểm soát hoàn toàn từ trên xuống dưới. Và Gianni Infantino, với nụ cười tự mãn và bàn tay vẫy hờ trước những câu hỏi khó, sẽ tiếp tục làm điều đó. Không vì bóng đá. Mà vì FIFA. Và vì chính mình. Xem FIFA Club World Cup 2025™ trực tiếp và duy nhất tại Việt Nam trên FPT Play, tạihttp://fptplay.vn"
ZNews,https://znews.vn/sao-viet-hoi-tu-mung-sinh-nhat-con-trai-quang-hai-post1568347.html,Thể thao,Null,"Chủ nhật, 13/7/2025 21:34 (GMT+7)",Sao Việt hội tụ mừng sinh nhật con trai Quang Hải,"Tối 13/7, vợ chồng Quang Hải - Chu Thanh Huyền tổ chức tiệc sinh nhật tròn một tuổi cho cậu quý tử Lido tại một khách sạn sang trọng ở Hà Nội. Từng có thời gian dài gắn bó với Quang Hải tại CLB Hà Nội và giữ mối quan hệ thân thiết ngoài đời, Bùi Hoàng Việt Anh cùng Mạch Ngọc Hà đã có mặt từ sớm để chung vui trong tiệc sinh nhật của bé Lido. Tiền đạo Tuấn Hải và Văn Tùng diện trang phục đơn giản đến chúc mừng sinh nhật ""quý tử"" nhà Quang Hải. Gia Đình vợ chồng Đoàn Văn Hậu - Doãn Hải My cùng hậu vệ Thành Chung, diễn viên Bảo Hân có mặt chung vui. HLV Polking cùng mẹ của ông kịp đáp chuyến bay từ Brazil về Hà Nội để góp mặt ở tiệc sinh nhật của bé Lido. Gia đình Quang Hải chụp ảnh nhân dịp đặc biệt này. Buổi sáng cùng ngày, Quang Hải và bà xã đã tổ chức lễ thôi nôi cho ""quý tử"" của mình ở nhà riêng tại Đông Anh, Hà Nội. Nàng Wags tự tay chuẩn bị từng món đồ cho lễ thôi nôi của con trai. Trước buổi tiệc sinh nhật của bé Lido, Quang Hải và bà xã xuất hiện tại địa điểm tổ chức tiệc thôi nôi cho con trai để kiểm tra và duyệt lại toàn bộ khâu chuẩn bị. Thực đơn cao cấp chuẩn 5 sao với nguyên liệu hảo hạng gồm salad hải sản Hạ Long, súp hải sâm Lý Sơn, tôm hùm chiên muối đỏ, gà hấp sốt nấm rừng, cá vược nướng muối tiêu, bò Úc om nấm… Mỗi món đều được chăm chút từ nguyên liệu đến cách trình bày. Mục Thể thao giới thiệu cuốn“Death or Glory: The Dark History of the World Cup”của tác giả Jon Spurling vào năm 2010. Cuốn sách viết về những chuyện hậu trường xung quanh các đội bóng lớn như Brazil, Argentina, Italy, Đức... xuyên suốt các kỳ World Cup từ 1930 đến 2006.  Vợ Quang Hải đọ sắc với bà xã Văn Hậu, Đức Chinh Chu Thanh Huyền hiếm hoi xuất hiện chung khung hình với Doãn Hải My và Mai Hà Trang, cả ba nàng WAGs đều rạng rỡ, cuốn hút.  Louis Phạm gây tranh cãi khi úp mở muốn trở lại đội tuyển quốc gia 16:29 12/7/202516:2912/7/2025Thể thaoThể thao 0 Cựu VĐV Thể dục dụng cụ (TDDC) Phạm Như Phương (Louis Phạm) bất ngờ úp mở chuyện trở lại thi đấu chuyên nghiệp ở bộ môn dancesport, thu hút nhiều ý kiến trái chiều từ cộng đồng mạng.  Dàn phù rể toàn sao tuyển Việt Nam gây sốt mạng xã hội 11:11 11/7/202511:1111/7/2025Thể thaoThể thao 0 Dàn phù rể gồm gương mặt đình đám của làng bóng đá Việt Nam, với tổng giá trị chuyển nhượng lên tới hơn 30 tỷ đồng, góp mặt trong đám cưới của trung vệ Dương Thanh Hào khiến dân mạng trầm trồ."
ZNews,https://znews.vn/bangladesh-moi-viet-nam-va-campuchia-da-giao-huu-post1568290.html,Thể thao,Null,"Chủ nhật, 13/7/2025 15:33 (GMT+7)",Bangladesh mời Việt Nam và Campuchia đá giao hữu,"Bangladesh mời Việt Nam và Campuchia đá giao hữu. Ảnh:ASEAN Football. Việc mời tuyển Việt Nam và Campuchia tham dự loạt trận giao hữu trong dịp FIFA Days tới là một phần trong kế hoạch chuẩn bị của Bangladesh. Đội tuyển nước này xem đây là dịp để rà soát lực lượng và tích lũy kinh nghiệm trước khi bước vào vòng loại Asian Cup 2027. Nếu Việt Nam và Campuchia đồng ý tham dự, đây sẽ là cơ hội để cả ba đội kiểm nghiệm lực lượng, thử nghiệm chiến thuật trong môi trường thi đấu chính thức. Đáng chú ý, nếu góp mặt, tuyển Việt Nam sẽ có bước chạy đà quan trọng trước khi bước vào trận gặp Nepal ở lượt trận tiếp theo của Asian Cup 2027 vào ngày 9/10. Ở đợt tập trung gần nhất vào tháng 6, HLV Kim Sang-sik và các học trò không có trận giao hữu quốc tế nào, thay vào đó chỉ tổ chức đá tập nội bộ với U22 Việt Nam. Hiện VFF chưa đưa ra phản hồi chính thức về lời mời từ phía Bangladesh. Tuy nhiên, nếu tận dụng tốt dịp FIFA Days sắp tới, tuyển Việt Nam sẽ có thêm điều kiện để hoàn thiện bộ khung chiến thuật dưới thời HLV Kim Sang-sik, đồng thời tích lũy điểm số trên BXH FIFA. Trước đó, tuyển Việt Nam đã từ chối tham dự King’s Cup 2025 tại Thái Lan. Liên đoàn bóng đá nước này đã mời Iraq,Hong Kongvà CH Fiji. Nếu tiếp tục từ chối các lời mời, tuyển Việt Nam đứng ngoài loạt trận giao hữu quốc tế trong khi các đối thủ trong khu vực đều có lịch thi đấu tích cực. Malaysia tham dự giải đấu ở Trung Á. Trong khi đó, Indonesia hay Philippines đều lên kế hoạch giao hữu với các đối thủ mạnh hơn trên BXH FIFA. Cuốn sách “Fear and Loathing in La Liga”của nhà báo thể thao nổi tiếng Sid Lowe, một chuyên gia về bóng đá Tây Ban Nha trênGuardian, xuất bản năm 2014, kể về những chuyện trong và ngoài sân cỏ xoay quanh các trận El Clasico xuyên suốt lịch sử.  ‘Cầu thủ Việt Nam e dè trong việc tiếp nhận sự góp ý’ Xoay quanh câu chuyện thủ môn Nguyễn Filip sốc trước những phản ứng của đồng đội, HLV Bae Ji-won cho rằng sự e dè trong việc tiếp nhận góp ý, nhất là trên sân cỏ, vẫn là vấn đề lớn với cầu thủ Việt Nam.  U23 Việt Nam chốt danh sách dự giải Đông Nam Á 15:38 12/7/202515:3812/7/2025Thể thaoThể thao 07 Sáng 12/7, HLV Kim Sang Sik công bố danh sách 23 cầu thủ chính thức của U23 Việt Nam tham dự Giải vô địch U23 Đông Nam Á 2025 tại Indonesia.  Louis Phạm gây tranh cãi khi úp mở muốn trở lại đội tuyển quốc gia 16:29 12/7/202516:2912/7/2025Thể thaoThể thao 0 Cựu VĐV Thể dục dụng cụ (TDDC) Phạm Như Phương (Louis Phạm) bất ngờ úp mở chuyện trở lại thi đấu chuyên nghiệp ở bộ môn dancesport, thu hút nhiều ý kiến trái chiều từ cộng đồng mạng."
ZNews,https://znews.vn/phan-ung-cua-rodrygo-khi-duoc-hoi-gia-nhap-arsenal-post1568107.html,Thể thao,Null,"Chủ nhật, 13/7/2025 06:21 (GMT+7)",Phản ứng của Rodrygo khi được hỏi gia nhập Arsenal,"Mundo Deportivođăng lại đoạn video ghi lại cảnh một fan xin chụp hình với Rodrygo trên đường phố và được đáp lại với vẻ thân thiện. Tuy nhiên, khi nam thanh niên này đặt câu hỏi: ""Anh sẽ gia nhập Arsenal chứ?"", ngôi sao của Real Madrid giả vờ như không nghe thấy, chụp hình với một người khác rồi rời đi. Rodrygo phớt lờ câu hỏi về tương lai. Rodrygo hiện tại còn giao kèo với Real Madrid đến tháng 6/2028, nhưng cầu thủ cũng khá bất mãn khi liên tục bị gạt khỏi danh sách đá chính của CLB thời gian qua. Bản thân Rodrygo cũng sẵn sàng cho một cuộc đào thoát khỏi Bernabeu. TheoDiario AS, Rodrygo quyết định nếu phải rời Madrid, anh sẽ chỉ gia nhập Liverpool, Arsenal hoặc Chelsea. Trong đó, tiền đạo này coi Arsenal là điểm đến lý tưởng. ""Pháo thủ"" được cho là sẵn sàng chi khoảng 90 triệu euro để có được chữ ký của ngôi sao Brazil, nhưng con số này vẫn kém 10 triệu euro so với mức giá Real đưa ra. Tại FIFA Club World Cup 2025™, Rodrygo chỉ được ra sân trong một trận duy nhất, khiến tin đồn về việc anh muốn rời Madrid ngày càng trở nên rõ ràng hơn. Lần cuối Rodrygo đá chính là trận chung kết Copa del Rey gặp Barcelona (26/4), nhưng bị thay ra sau hiệp 1. Mục tiêu của Rodrygo là duy trì phong độ và thời lượng thi đấu ổn định nhằm chuẩn bị cho World Cup 2026, nơi anh kỳ vọng sẽ là trụ cột trên hàng công tuyển Brazil. Tủ sách thể thaomang tới những câu chuyện thể thao quá khứ và hiện tại, những bí mật hậu trường, những giải đấu, ký ức của những cựu danh thủ, HLV, các huyền thoại như Sir Alex Ferguson, Steven Gerrard, Park Hang-seo, Lê Công Vinh...  Real Madrid mở cửa cho Rodrygo ra đi Tương lai của Rodrygo tại Real Madrid đang chạm ngưỡng rạn vỡ.  Chelsea 2-0 PSG: Palmer lập cú đúp 32 phút trước02:0814/7/2025Thể thaoThể thao 0 Rạng sáng 14/7, Chelsea chủ động pressing và gây nhiều khó khăn cho PSG ở chung kết FIFA Club World Cup 2025 trên sân vận động MetLife.  Sao Việt hội tụ mừng sinh nhật con trai Quang Hải 5 giờ trước21:3413/7/2025Thể thaoThể thao 0 Bùi Hoàng Việt Anh, Phạm Tuấn Hải cùng nhiều cầu thủ tên tuổi tham dự buổi tiệc mừng sinh nhật tròn một tuổi của bé Nguyễn Quang Minh (tên thân mật là Lido), con trai tiền vệ Nguyễn Quang Hải."
ZNews,https://znews.vn/mu-chot-thu-mon-thay-onana-post1568304.html,Thể thao,Null,"Chủ nhật, 13/7/2025 19:00 (GMT+7)",MU chốt thủ môn thay Onana,"""Quỷ đỏ"" phải tìm người gác đền mới trong bối cảnh Andre Onana không đạt phong độ ổn định kể từ khi gia nhập Old Trafford với giá 47 triệu bảng năm 2023. Mới nhất, Onana còn dính chấn thương gân kheo, qua đó vắng mặt ở giai đoạn đầu mùa giải mới, với trận mở mànPremier LeaguegặpArsenalngày 17/8. Trước đó, MU được cho là tiếp cận Emiliano Martinez - nhà vô địch World Cup 2022 cùng tuyển Argentina. Tuy nhiên, mức giá 40 triệu bảng mà Aston Villa đưa ra buộc CLB chủ sân Old Trafford phải rút lui. Trong bối cảnh đó, John Victor trở thành phương án khả dĩ. TheoGoalBrazil, MU sẵn sàng kích hoạt điều khoản giải phóng hợp đồng trị giá 6 triệu bảng của thủ môn này. Phía Botafogo cũng chuẩn bị cho sự ra đi của Victor khi sắp chiêu mộ Matheus Mendes của Atletico Mineiro thay thế. Thủ môn 29 tuổi gây ấn tượng mạnh khi cùng Botafogo dự FIFA Club World Cup 2025™, được bầu hay nhất trận dù đội thua Palmeiras 0-1 ở vòng 16 đội. Ở vòng bảng, anh còn chơi xuất sắc trong trận thắng PSG 1-0. Gia nhập Botafogo từ Santos cách đây 18 tháng với giá chưa đầy 1 triệu bảng, Victor cùng đội bóng Brazil giành cú đúpSerie Avà Copa Libertadores, đồng thời lọt vào Đội hình tiêu biểu của cả hai giải đấu năm 2024. Nếu thương vụ hoàn tất, MU kỳ vọng Victor sẽ mang lại sự cạnh tranh cần thiết để Onana trở lại phong độ đỉnh cao, hoặc sẵn sàng thay thế vị trí số 1 trong khung gỗ. Cuốn sách“Leading: Learning from Life and My Years at Manchester United”được Sir Alex Ferguson viết chung với Michael Moritz xuất bản năm 2015 đem tới kinh nghiệm sống quý báu cho bất kỳ ai.  Onana đảo lộn kế hoạch của MU Manchester United đối mặt với bài toán khó ở vị trí thủ môn sau khi Andre Onana dính chấn thương gân kheo trong buổi tập mới nhất.  Man Utd ra giá bán lỗ Andre Onana Manchester United cân nhắc bán thủ môn Andre Onana với mức giá thấp hơn so với số tiền đã chi ra để chiêu mộ anh.  Bản hợp đồng bất ngờ của MU John Victor có thể trở thành bản hợp đồng gây bất ngờ của MU khi đội bóng Anh nhắm đến thủ môn xuất sắc của Botafogo trong bối cảnh tương lai Andre Onana vẫn còn bỏ ngỏ."
