Source,URL,Category,Keyword,Time,Title,Content
ZNews,https://znews.vn/thu-bong-da-xau-xi-cua-river-plate-post1563882.html,Thể thao,Null,"Thứ năm, 26/6/2025 19:17 (GMT+7)",Thứ bóng đá xấu xí của River Plate,"River Plate để thua 0-2 trước Inter Milan ở lượt cuối bảng E củaFIFA Club World Cup 2025™ sáng 26/6. Trong trận đấu này, cầu thủ Quarta của River Plate nhận thẻ đỏ ở phút 66, khiến đội bóng Argentina gặp bất lợi lớn trong phần còn lại của trận đấu. Đến phút 90+5, một cầu thủ khác của River Plate là tuyển thủ quốc gia Gonzalo Montiel cũng bị đuổi khỏi sân do lỗi phản ứng với trọng tài. River Plate rời giải với tổng cộng 3 thẻ đỏ, dẫn đầu trong số các đội dự giải. Xếp ngay sau họ là một đại diện Argentina khác, Boca Juniors, với 2 thẻ đỏ. Ngoài ra, River Plate cũng đứng đầu hai thống kê đáng quên khác: số thẻ vàng phải nhận (9 lần, ngang với Tunis) và số lần phạm lỗi trung bình trong một trận đấu (18 lần). Trong trận gặp Inter, hậu vệ Marcos Acuna bị tố cáo có hành vi lăng mạ và phân biệt chủng tộc với Denzel Dumfries của đối thủ. Cựu hậu vệ Sevilla có thể đối diện với án phạt nặng từ FIFA nếu ban tổ chức tiến hành điều tra. Cổ động viên của River Plate cũng để lại hình ảnh xấu xí ở cuối trận, khi nhiều fan quá khích đã ném vật thể lạ về phía Dumfries và cầu thủ Inter để giải tỏa nỗi bức xúc. Nhiều tiếng la ó và huýt sáo cũng hướng về chính các cầu thủ River Plate sau màn trình diễn kém cỏi trước đối thủ từ Italy. Bóng đá Argentina để lại hình ảnh xấu xí trên đất Mỹ. Về mặt chuyên môn, họ cũng gây thất vọng lớn khi cả hai đại diện hùng mạnh và giàu truyền thống, River Plate và Boca Juniors, đều bị loại ngay từ vòng bảng. Xem FIFA Club World Cup 2025™ trực tiếp và duy nhất tại Việt Nam trên FPT Play, tại http://fptplay.vn Mục Thể thao giới thiệu cuốn“Death or Glory: The Dark History of the World Cup”của tác giả Jon Spurling vào năm 2010. Cuốn sách viết về những chuyện hậu trường xung quanh các đội bóng lớn như Brazil, Argentina, Italy, Đức... xuyên suốt các kỳ World Cup từ 1930 đến 2006.  Bóng đá Đông Á thảm bại ở FIFA Club World Cup 14 giờ trước13:2826/6/2025Thể thaoThể thao 01 Hai đại diện của bóng đá Đông Á gồm Urawa Red Diamonds (Nhật Bản) và Ulsan HD (Hàn Quốc) chia tay FIFA Club World Cup 2025 với kết quả toàn thua.  Ramos: 'Mọi người không tin Monterrey tiến xa' 14 giờ trước13:2326/6/2025Thể thaoThể thao 01 Sergio Ramos không giấu được niềm vui khi Monterrey tiến vào vòng 16 đội FIFA Club World Cup 2025™, sau chiến thắng thuyết phục 4-0 trước Urawa Reds sáng 26/6.  MU sắp đón tân binh thứ 2 14 giờ trước13:2426/6/2025Thể thaoThể thao 0 MU tiến rất gần đến việc hoàn tất thương vụ chiêu mộ Bryan Mbeumo từ Brentford, đánh dấu tân binh thứ hai trong kỳ chuyển nhượng hè năm nay."
ZNews,https://znews.vn/mu-sap-don-tan-binh-thu-2-post1563817.html,Thể thao,Null,"Thứ năm, 26/6/2025 13:24 (GMT+7)",MU sắp đón tân binh thứ 2,"Mbeumo chuẩn bị gia nhập MU hè này. TheoESPN, các điều khoản cơ bản của thương vụ được thống nhất, và cả hai bên đang thảo luận về các khoản phí bổ sung và phương thức thanh toán. Mức phí rơi vào khoảng 60 triệu bảng, kèm theo 5 triệu bảng phụ phí, nâng tổng giá trị thương vụ lên 65 triệu bảng, bằng con số mà Brentford kỳ vọng. Cuộc đàm phán giữa hai bên được cho là diễn ra suôn sẻ. ""Bầy ong"" chấp nhận cho MU thanh toán theo nhiều đợt. Khả năng cao ""Quỷ đỏ"" sẽ hoàn tất thương vụ trước khi thầy trò HLV Ruben Amorim quay lại tập luyện vào ngày 7/7. Mbeumo có thời gian thích nghi với MU ngay từ đầu. The Athleticxác nhận việc Mbeumo ưu tiên gia nhập MU là yếu tố giúp thương vụ tiến triển nhanh chóng, bất chấp sự quan tâm từ Tottenham. Cầu thủ này đang chờ sự chấp thuận từ Brentford để tiến hành kiểm tra y tế và hoàn tất các thủ tục gia nhập đội bóng mới. Trước đó, MU chiêu mộ thành công Matheus Cunha từ Wolves với mức phí 62,5 triệu bảng. Cầu thủ người Brazil gây ấn tượng mạnh tại Molineux và hứa hẹn cùng Mbeumo tăng cường sức mạnh cho hàng tấn công của CLB chủ sân Old Trafford. Mbeumo nổi bật với lối chơi tốc độ, kỹ thuật và khả năng dứt điểm đa dạng. Kể từ khi gia nhập Brentford với mức giá chỉ 5,8 triệu bảng năm 2019, anh ghi 70 bàn trong 242 trận trên mọi đấu trường, trong đó có 42 bàn tại Premier League sau 136 lần ra sân. Mùa giải vừa qua, chân sút 25 tuổi ghi tới 20 bàn và có thêm 7 kiến tạo giúp Brentford cán đích ở vị trí thứ 10 tại Premier League. Cuốn tự truyện “Carlo Ancelotti: Quiet Leadership”xuất bản năm 2016 của Carlo Ancelotti kể về bí quyết làm nên sự nghiệp đứng vững trên đỉnh cao suốt hơn 20 năm của nhà cầm quân người Italy.  MU mắc kẹt với trò cưng của Ten Hag Manchester United đang gặp khó khăn trong việc bán hậu vệ Tyrell Malacia trong kỳ chuyển nhượng mùa hè 2025.  Kế hoạch đón 5 tân binh, chia tay 7 cầu thủ của MU CLB chủ sân Old Trafford có thể bổ sung ít nhất 5 tân binh trong hè 2025 để tiếp tục quá trình thay máu đội hình.  MU hét giá cho Garnacho MU đang tìm cách cân đối tài chính và tối ưu hóa sổ sách bằng cách bán đi một số cầu thủ chủ chốt, trong đó có Alejandro Garnacho."
ZNews,https://znews.vn/cham-dut-ky-nguyen-ronaldo-o-valladolid-post1563719.html,Thể thao,Null,"Thứ năm, 26/6/2025 05:17 (GMT+7)",Chấm dứt kỷ nguyên Ronaldo ở Valladolid,"Ronaldo ""béo"" không còn là cổ đông chính của Real Valladolid. Cựu danh thủ người Brazil Ronaldo Nazario chính thức rút lui, khép lại     một nhiệm kỳ làm chủ tịch bị đánh giá là nhiều tranh cãi và ít thành tựu, theoMarca. Thỏa thuận được ký kết tại Madrid, đánh dấu việc     Ignite trở thành cổ đông chi phối của CLB xứ Castile với 54,36% cổ phần. Đáng     chú ý, Ben Oldman - nắm giữ 33,26% cổ phần - sẽ có quyền quyết định nhờ một     thỏa thuận nội bộ với Ignite. Phần còn lại thuộc về Agora (9,65%) và các cổ     đông nhỏ lẻ, bao gồm cả Hội đồng thành phố Valladolid (2,73%). Thương vụ chuyển giao này chính thức khép lại     chuỗi ngày dài bất ổn về quyền sở hữu CLB. Mùa hè năm ngoái, Ernesto Tinajero -     người từng tranh mua đội bóng với chính Ronaldo năm 2018 - suýt chút nữa hoàn     tất thương vụ. Tuy nhiên, mọi thứ chỉ thật sự rõ ràng khi Ignite, dưới sự dẫn     dắt của Gabriel Solares, xuất hiện với đề xuất cụ thể và sức nặng tài chính đủ     để đưa mọi chuyện đi đến hồi kết. Trước đó, đã có nhiều lời đồn từ Mexico, Ai     Cập, Mỹ… nhưng tất cả đều chỉ là “tin đồn chuyển nhượng” đúng nghĩa. Ngay sau khi nắm quyền, ban lãnh đạo mới của     Valladolid đã lên kế hoạch gặp thị trưởng Jesús Julio Carnero - một động thái     thể hiện mong muốn tạo dựng mối quan hệ chặt chẽ với chính quyền địa phương.     Sau đó, họ sẽ tổ chức buổi ra mắt chính thức trước truyền thông và người hâm mộ     xứ sở rượu vang. Về mặt chuyên môn, Gabriel Solares bật đèn     xanh để Victor Orta - cựu Giám đốc Thể thao của Sevilla và Leeds United - gia     nhập CLB với vai trò tương tự. Ngoài ra, HLV Borja Jimenez cũng đang được cân     nhắc đưa vào ban huấn luyện, như một phần trong chiến lược làm mới toàn diện từ     thượng tầng đến băng ghế chỉ đạo. Triều     đại Ronaldo khép lại trong sự tiếc nuối xen lẫn thất vọng - với những lần thăng     hạng rồi lại xuống hạng, cùng một dự án thể thao thiếu chiều sâu. Giờ đây,     người hâm mộ Valladolid đặt kỳ vọng vào một khởi đầu mới - thực dụng hơn, bài     bản hơn - dưới thời Gabriel Solares và Ignite Sports. Cuốn tự truyện “Basta: My Life, My Truth” xuất bản năm 2019của kể lại sự nghiệp Marco van Basten dưới góc nhìn thứ nhất. Huyền thoại người Hà Lan khép lại sự nghiệp ở tuổi 28 khi dính chấn thương mắt cá.  Ronaldo 'béo' tiếp tục gây phẫn nộ Người hâm mộ Real Valladolid liên tục phản đối ông chủ Ronaldo Luís Nazário de Lima, trong bối cảnh đội bóng của La Liga đã rớt hạng La Liga 2024/25.  Barca lội ngược dòng, bỏ xa Real 7 điểm 05:16 4/5/202505:164/5/2025Thể thaoThể thao 02 Rạng sáng 4/5, Barca thắng ngược Real Valladolid 2-1 ở vòng 34 La Liga.  Tiền đạo 38 tuổi giải cứu 'Hiện tượng' Girona 10:23 14/5/202510:2314/5/2025Thể thaoThể thao 0 Girona giành chiến thắng quan trọng 1-0 trước Real Valladolid, với bàn thắng muộn của lão tướng Cristhian Stuani."
ZNews,https://znews.vn/he-luy-khi-lyon-bi-danh-rot-hang-post1563710.html,Thể thao,Null,"Thứ năm, 26/6/2025 05:00 (GMT+7)",Hệ luỵ khi Lyon bị đánh rớt hạng,"TheoL'Équipe, UEFA sẽ hủy bỏ thỏa thuận tài chính với CLB nếu đội bóng này chính thức rớt hạng. Thỏa thuận kể trên là một phần trong cơ chế kiểm soát tài chính của UEFA, cho phép Lyon được tiếp tục tham dự đấu trường châu Âu, với điều kiện chấp nhận hàng loạt biện pháp ràng buộc: chịu mức phạt tài chính lớn, bị giới hạn quỹ lương và chuyển nhượng, đồng thời cam kết lộ trình tái cấu trúc tài chính nghiêm ngặt. Tuy nhiên, nếu Lyon phải xuống chơi ở Ligue 2, toàn bộ thỏa thuận sẽ bị hủy. UEFA yêu cầu ban lãnh đạo đội bóng nộp đầy đủ hồ sơ chứng minh việc tuân thủ các điều kiện. Trong trường hợp Lyon bị loại khỏi cúp châu Âu, Strasbourg sẽ là đội được thế chỗ. Dù vậy, quyết định xuống hạng vẫn chưa phải là án chung thẩm. Lyon còn quyền kháng cáo - và ban lãnh đạo đội bóng chắc chắn sẽ sử dụng cơ hội này để cứu vãn tình thế. Trong lúc chờ đợi phán quyết cuối cùng, viễn cảnh một mùa hè đầy biến động tại Groupama đang dần hiện rõ. Nguyên nhân chính khiến Lyon rơi vào tình cảnh bi đát - dẫn đến việc bị đánh rớt hạng - là khoản nợ khổng lồ 175 triệu euro (tương đương hơn203 triệu USD) - con số được Ủy ban kiểm soát tài chính (DNCG) phát hiện và đưa ra cảnh báo từ tháng 11/2023. Khi đó, Lyon bị giáng hạng tạm thời và chịu lệnh cấm chuyển nhượng trong kỳ chuyển nhượng mùa đông. Dù CLB tuyên bố có kế hoạch tài chính khả thi, DNCG không bị thuyết phục. Tình hình càng trở nên phức tạp khi các khoản nợ liên quan đến Eagle Football Group - tập đoàn của ông chủ người Mỹ John Textor - được công bố. Tổng số nợ của hệ sinh thái bóng đá do Textor sở hữu (gồm Lyon, Botafogo, Molenbeek và từng sở hữu một phầnCrystal Palace) lên đến gần575 triệu USD. Kế hoạch điều chuyển vốn từ Botafogo về Lyon bị DNCG từ chối, khiến Lyon không thể xoay xở đủ dòng tiền theo yêu cầu. Ở mùa 2024/25, Lyon về đích ở vị trí thứ 6, kết quả giúp họ giành quyền dựEuropa League. Cuốn tự truyện “Basta: My Life, My Truth” xuất bản năm 2019của kể lại sự nghiệp Marco van Basten dưới góc nhìn thứ nhất. Huyền thoại người Hà Lan khép lại sự nghiệp ở tuổi 28 khi dính chấn thương mắt cá.  PSG vô địch từ khi bóng chưa lăn 17:15 25/6/202517:1525/6/2025Thể thaoThể thao 0 Án phạt Lyon phải nhận chỉ là hệ quả từ tình hình tài chính bi đát của các CLB Ligue 1 trong nhiều năm qua.  'Trận động đất' làm rung chuyển bóng đá Pháp 10:11 25/6/202510:1125/6/2025Thể thaoThể thao 0 Sau Girondines Bordeaux, một ""ông lớn"" khác của bóng đá Pháp là Lyon đang lâm cảnh khủng hoảng vì tài chính.  Lyon bị giáng xuống hạng, Premier League hưởng lợi 18:00 25/6/202518:0025/6/2025Thể thaoThể thao 0 Các đội bóng ở Ngoại hạng Anh sẵn sàng tận dụng cơ hội từ cuộc bán tháo cầu thủ của Lyon sau khi CLB Pháp nhận án phạt xuống hạng Ligue 1."
ZNews,https://znews.vn/dai-dien-nhat-ban-bi-de-bep-o-club-world-cup-post1563765.html,Thể thao,Null,"Thứ năm, 26/6/2025 10:05 (GMT+7)",Đại diện Nhật Bản bị đè bẹp ở Club World Cup,"Urawa Reds (áo đỏ) gây thất vọng. Ảnh:Reuters. Đại diện Mexico, Monterrey, có chiến thắng xứng đáng trước Urawa Reds với các pha lập công của Deossa, Berterame (cú đúp) và Corona. Trận thắng này cũng giúp Monterrey làm nên lịch sử khi trở thành đội bóng đầu tiên ở khu vực CONCACAF (Bắc Trung Mỹ) đánh bại một CLB đến từ Nhật Bản trong lịch sử giải đấu. Trước đó, các CLB J.League toàn thắng cả 4 trận khi gặp những đội đến từ CONCACAF. Năm 2023, Urawa Reds đánh bại Club Leon 1-0. Trong các năm 2011 và 2018, Kashima Antlers cũng lần lượt đánh bại Monterrey (thắng 4-3 trên chấm phạt đền) và Guadalajara (3-2). Vào năm 2008, Gamba Osaka cũng khiến Pachuca ôm hận ở FIFA Club World Cup với thắng lợi 1-0. Ở giải năm nay, Urawa Reds gây thất vọng khi để thua cả 3 trận ở vòng bảng trước Monterrey, Inter Milan và River Plate. Đại diện Nhật Bản sớm bị loại ở lượt đấu trước khi để thua 1-2 trước Inter Milan. Trong khi đó, chiến thắng trước Urawa Reds giúp Monterrey giành vé vào vòng knock-out tại bảng E của FIFA Club World Cup 2025™. Đại diện Mexico xếp nhì bảng, kém Inter Milan 2 điểm. Ở vòng đấu kế tiếp, Monterrey sẽ chạm tránDortmund, đội đứng đầu bảng F. Xem FIFA Club World Cup 2025™ trực tiếp và duy nhất tại Việt Nam trên FPT Play, tại http://fptplay.vn Mục Thể thao giới thiệu cuốn“Death or Glory: The Dark History of the World Cup”của tác giả Jon Spurling vào năm 2010. Cuốn sách viết về những chuyện hậu trường xung quanh các đội bóng lớn như Brazil, Argentina, Italy, Đức... xuyên suốt các kỳ World Cup từ 1930 đến 2006.  CAHN hay HLV Polking cần cúp Quốc gia? 18 giờ trước09:1026/6/2025Thể thaoThể thao 0 Thất bại tại V.League và cúp Đông Nam Á, HLV Mano Polking buộc phải đưa CAHN vượt qua Thể Công Viettel ở bán kết Cúp Quốc gia 2024/2025, diễn ra lúc 19h15 ngày 26/6.  Kịch bản không tưởng ở bảng E FIFA Club World Cup 18 giờ trước09:2026/6/2025Thể thaoThể thao 07 Sáng 26/6, River Plate đang từ đội đầu bảng E bất ngờ bị loại ở FIFA Club World Cup 2025™.  Real nhắm 4 tài năng trẻ sáng giá ở châu Âu 18 giờ trước09:0826/6/2025Thể thaoThể thao 016 Các tuyển trạch viên Real Madrid theo dõi sát sao giải vô địch U19 và U21 châu Âu hè này, với 4 cầu thủ được xác định là những nhân tố tiềm năng."
ZNews,https://znews.vn/real-nham-4-tai-nang-tre-sang-gia-o-chau-au-post1563729.html,Thể thao,Null,"Thứ năm, 26/6/2025 09:08 (GMT+7)",Real nhắm 4 tài năng trẻ sáng giá ở châu Âu,"""Los Blancos"" nổi tiếng với việc chiêu mộ những tài năng trẻ xuất sắc của bóng đá thế giới. Đầu tháng này, Real hoàn tất thỏa thuận với tiền vệ Abdellah Ouazane. Cầu thủ 16 tuổi được đánh giá có lối chơi tương đồng Jude Bellingham và sẽ gia nhậpReal Madridtừ Ajax vào tháng 7. Real vẫn tiếp tục tìm kiếm những bản hợp đồng mới khi nhắm đến 4 tài năng trẻ hiện thi đấu tại giải vô địch U19 và U21 Châu Âu. TheoMarca, tiền đạo Nick Woltemade của Stuttgart và tuyển Đức là cái tên nổi bật nhất trong danh sách, cùng với các cầu thủ Castello Lukeba (Pháp), Cristian Mosquera (Tây Ban Nha) và Kees Smit (Hà Lan). Woltemade hiện là vua phá lưới tại giải vô địch U21 Châu Âu và vừa nâng tổng số bàn thắng lên 6 sau pha lập công vào lưới Pháp, đưa Đức chạm trán Anh ở trận chung kết. Castello Lukeba, trung vệ của RB Leipzig, cũng được các CLB lớn Châu Âu để mắt, trong đó có Liverpool vàChelsea. Mosquera được Real quan tâm, đặc biệt khi hợp đồng của hậu vệ này vớiValenciachỉ còn một năm. Cuối cùng, tiền vệ Kees Smit của AZ Alkmaar cũng thu hút sự chú ý tại giải U19 Châu Âu năm nay. Tài năng 19 tuổi hiện chia sẻ vị trí vua phá lưới tại giải với Pablo Garcia (Tây Ban Nha) và hai cầu thủ người Đức - Said El Mala và Max Moerstedt. Anh chuẩn bị cùng Hà Lan đá trận chung kết U19 châu Âu với Tây Ban Nha. Real Madrid đã bổ sung Trent Alexander-Arnold, Franco Mastantuono và Dean Huijsen vào đội hình một cho mùa giải 2025/26. Giờ họ được cho là lên kế hoạch chiêu mộ Alejandro Grimaldo của Bayer Leverkusen. Mục thể thao giới thiệucuốn sách “The Special One: The Secret World of Jose Mourinho”của tác giả Diego Torres được xuất bản năm 2014. Cuốn sách này nói về những mặt tối của HLV người Bồ Đào Nha: những mánh khóe, nỗi sợ hãi, sự tức giận, buồn đau, bị làm nhục, những cãi vã, những nỗi ám ảnh trong thời gian là HLV hay bậc nhất thế giới.  Chấm dứt kỷ nguyên Ronaldo ở Valladolid Từ ngày 25/6, Real Valladolid bước sang một chương mới trong lịch sử khi
Gabriel Solares và tập đoàn Ignite Sports Spain hoàn tất thương vụ thâu tóm đội
bóng.  Real Madrid không hoàn hảo, nhưng đáng sợ Real Madrid không cần phô trương. Họ chỉ cần trở lại đúng lúc - và thế là đủ để khiến cả Man City lẫn Juventus phải dè chừng.  Alonso giúp Real Madrid 'lột xác' Từ thế bị dồn ép, Real Madrid lột xác ngoạn mục thắng Pachuca 3-1 nhờ những điều chỉnh chiến thuật của HLV Xabi Alonso."
ZNews,https://lifestyle.znews.vn/video-canh-ca-voi-bryde-boi-loi-tai-vung-bien-binh-dinh-post1563938.html,N/A,Null,N/A,Không có tiêu đề,
ZNews,https://lifestyle.znews.vn/hoi-an-lien-tuc-gay-sot-tren-truyen-thong-an-do-post1563837.html,Du lịch,Null,"Thứ năm, 26/6/2025 18:08 (GMT+7)",Hội An liên tục gây 'sốt' trên truyền thông Ấn Độ,"Du khách đạp xe ngắm phố cổ Hội An yên bình vào sáng sớm. Ảnh:Phạm Toàn. Trong tháng 6, Hội An liên tục được nhắc đến trong 2 bài viết thuộc chuyên mục du lịch củaTimes of India- tờ báo có lượng độc giả hàng đầu Ấn Độ. Một bài xếp Hội An vào top 5 điểm đến du lịch wellness (chăm sóc sức khỏe) hàng đầu châu Á năm nay, bài còn lại gợi ý phố cổ Hội An là một trong 10 điểm đến hấp dẫn với chi phí phải chăng cho mùa hè. Từ sau đại dịch, du lịch chăm sóc sức khỏe tiếp tục là xu hướng được nhiều du khách lựa chọn. Đặc biệt, châu Á - vốn được xem là cái nôi của các phương pháp trị liệu cổ truyền từ xa xưa - đã định nghĩa lại ý nghĩa của du lịch chăm sóc sức khỏe bằng một loạt những trải nghiệm phong phú. Từ tắm rừng ở Nhật Bản, liệu pháp Ayurved ở Ấn Độ đến thiền chánh niệm ở Thái Lan, những chuyến du lịch nghỉ dưỡng kết hợp phục hồi thể chất và tinh thần đang ngày càng hút khách. Trong danh sách các điểm đến chăm sóc sức khỏe hàng đầu châu Á, Hội An được đánh giá cao nhờ không gian yên bình, tĩnh lặng, gần gũi với thiên nhiên. Những con đường lát đá rợp bóng cây, dòng sông Hoài lững lờ trôi giữa lòng phố cổ, nhịp sống chậm rãi và yên bình - tất cả tạo nên bầu không khí lý tưởng để du khách tái tạo năng lượng, rời xa căng thẳng thường nhật. Du khách có thể nghỉ dưỡng kết hợp tham gia các khóa học yoga, chăm sóc sức khỏe khi đến Hội An. Ảnh:Namia River Retreat. Times of Indianhận xét: ""Không chỉ là một Di sản Thế giới được UNESCO công nhận, Hội An (Việt Nam) còn là một viên ngọc quý cho những du khách muốn kết hợp du lịch trị liệu với chi phí phải chăng"". Đến đây, du khách sẽ có cơ hội tham gia các khóa thực hành yoga, trải nghiệm các liệu pháp spa cùng các gói detox theo phong cách truyền thống của Việt Nam với chi phí hợp lý. Khác với những điểm wellness hiện đại, Hội An hấp dẫn ở sự mộc mạc, nguyên bản - một vẻ đẹp không cần tô vẽ mà vẫn cuốn hút. Một số đại diện khác cũng xuất hiện trong top 5 điểm đến chăm sóc sức khỏe hàng đầu châu Á doTimes of Indiabình chọn như Bali (Indonesia), Kerala (Ấn Độ), Chiang Mai (Thái Lan), Minakami (Nhật Bản). Trong bài viết giới thiệu 10 chuyến đi hấp dẫn với chi phí phải chăng cho mùa hè, Hội An tiếp tục được đánh giá cao. TheoTimes of India, đây là lựa chọn phù hợp với các gia đình trẻ hoặc nhóm bạn tìm kiếm trải nghiệm giàu bản sắc mà không quá tốn kém. Với cảnh quan yên bình, trải nghiệm hấp dẫn, chi phí phải chăng, Hội An ngày càng thu hút khách trong và ngoài nước. Ảnh:Phạm Toàn, Linh Huỳnh. ""Việt Nam là một trong những điểm đến du lịch hè phổ biến nhất trên thế giới. Trong đó, Hội An là thành phố lý tưởng cho những ai yêu thích lịch sử, văn hóa và cảnh quan, từ những tòa nhà Pháp cổ đầy màu sắc đến kênh đào xưa. Chi phí cho một chuyến bay khứ hồi từ Ấn Độ đến Hội An ước tính khoảng 664 -1.956 USD, tùy thời điểm và hãng hàng không"", Times of India viết. Không còn là điểm đến ""ẩn mình"", Hội An đang dần trở thành lựa chọn hàng đầu với du khách quốc tế - những người ngày càng chú trọng đến trải nghiệm tinh thần và giá trị văn hóa trong mỗi chuyến đi. Học kỹ năng sống từ những cuốn cẩm nang sinh tồn Sách“Cẩm nang sinh tồn”, “100 kỹ năng sinh tồn”, “Sống sót”là câu chuyện của những phượt thủ, nhà thám hiểm về cách thoát hiểm và sinh tồn.  Gần 2 tháng khách Nga 'săn' ảnh người Hội An Đến Hội An vào đầu tháng 5, nhiếp ảnh gia người Nga len lỏi vào cuộc sống thường nhật, tìm từng điểm chạm văn hóa để kể chuyện về con người bằng bộ ảnh ""People of Hội An"".  Hà Giang, Hội An lọt top điểm đến đẹp nhất thế giới Trong danh sách 44 điểm đến đẹp nhất thế giới do tạp chí Time Out công bố đầu tháng 4, Hà Giang và Hội An lần lượt xếp vị trí thứ 10 và 44.  Khách ngoại bất ngờ nhìn Hội An 'lột xác' sau 30 năm 08:21 13/3/202508:2113/3/2025Du lịchĐịa điểm du lịch 0 Vào năm 1994, hoạt động du lịch ở Hội An vẫn còn đơn sơ, cơ sở hạ tầng hạn chế, nhưng mọi thứ đã biến đổi hoàn toàn chỉ sau 30 năm."
