Source,URL,Category,Keyword,Time,Title,Content
Tuoi tre,https://tuoitre.vn/bi-khoi-to-tiktoker-du-bau-troi-do-loi-do-tiktok-khong-canh-bao-20251108194551629.htm,,"tiktoker,Công an TP.HCM,điều 331 Bộ luật hình sự",08/11/2025 20:16 GMT+7,"Bị khởi tố, TikToker 'Dù Bầu Trời' đổ lỗi do TikTok không cảnh báo","Đoàn Quốc Việt (chủ tài khoản TikTok Dù Bầu Trời) khai báo tại cơ quan điều tra - Ảnh: Công an TP.HCM Mở rộng điều tra vụ án do Lê Anh Điệp (chủ tài khoảnTikTokTàng Keng Ông Trùm) thực hiện, ngày 8-11, Công an TP.HCM cho biết Cơ quan cảnh sát điều tra đã khởi tố bị can, thi hành lệnh bắt bị can để tạm giam đối với Đoàn Quốc Việt (22 tuổi, ngụ TP Hà Nội) để điều tra về tội ""lợi dụng các quyền tự do dân chủ xâm phạm lợi ích của Nhà nước, quyền, lợi ích hợp pháp của tổ chức, cá nhân"". Tạicơ quan điều tra, Việt thừa nhận toàn bộ hành vi phạm tội của mình. Việt khai nhận được tin nhắn của Lê Anh Điệp (chủ tài khoản TikTok Tàng Keng Ông Trùm) về việc video clip xúc phạm người miền Nam của Điệp đã lên xu hướng. Từ đó, Việt nảy sinh ý tưởng và bắt chước làm theo hai video clip, từ xúc phạm người miền Nam đến người miền Bắc. Dù vậy, nền tảng này không có bất cứ dấu hiệu cảnh báo nào. Chỉ sau khi hàng xóm và vợ con Việt phàn nàn, Việt mới gỡ các nội dung này. ""Tôi đã nhận thức rõ cái sai của mình, xin lỗi người dân Việt Nam vì hành vi sai trái. Tôi hy vọng không ai bắt chước mình để đánh mất đi tuổi trẻ, một tương lai"", Việt khai báo. Trước đó, Văn phòng Cơ quan cảnh sát điều tra xác định tài khoản TikTok ""Dù Bầu Trời"" do Đoàn Quốc Việt quản trị, sử dụng, thường xuyên đăng tải các video clip có nội dung kích động, miệt thị, xúc phạm, gây chia rẽ vùng miền và phá hoại khối đại đoàn kết dân tộc, thu hút hàng trăm nghìn lượt tương tác, ảnh hưởng đến an ninh trật tự trên không gian mạng. Kết quả điều tra xác định: xuất phát từ động cơ muốn ""ăn theo"" và bắt chước tài khoản ""Tàng Keng Ông Trùm"" để tăng tương tác, Đoàn Quốc Việt đã cố ý đăng tải các video clip có nội dung ""phá hoại khối đại đoàn kết dân tộc"" và ""xúc phạm nghiêm trọng danh dự, nhân phẩm của người khác"", vi phạm quy định tại điểm c khoản 1 Điều 8 và điểm a khoản 3 Điều 16Luật An ninh mạngnăm 2018. Mở rộng điều tra vụ án do Lê Anh Điệp (chủ tài khoản TikTok Tàng Keng Ông Trùm) thực hiện, Công an TP.HCM tiếp tục tạm giam đối với chủ tài khoản TikTok 'Dù Bầu Trời'."
Tuoi tre,https://tuoitre.vn/bi-thu-tran-luu-quang-khao-sat-do-thi-lan-bien-can-gio-yeu-cau-thi-cong-nhanh-dung-tien-do-20251108182711266.htm,,"Vinhomes Green Paradise,Ban thường vụ Thành ủy,Trần Lưu Quang,Cần Giờ,đô thị lấn biển",08/11/2025 19:56 GMT+7,"Bí thư Trần Lưu Quang khảo sát đô thị lấn biển Cần Giờ, yêu cầu thi công nhanh, đúng tiến độ","Bí thư Thành ủy TP.HCM Trần Lưu Quang cùng đoàn công tác khảo sát tiến độ thực hiện dự án khu đô thị du lịch lấn biển Cần Giờ - Ảnh: VIỆT DŨNG/SGGP Sau khi làm việc với lãnh đạo Petrovietnam, chiều 8-11, Bí thư Thành ủy TP.HCM Trần Lưu Quang cùng đoàn công tác của Ban Thường vụ Thành ủy đã đi phà từ Vũng Tàu qua Cần Giờ để khảo sát dự án khu đô thị du lịch lấn biển Cần Giờ do Tập đoàn Vingroup xây dựng. Tại buổi làm việc với lãnh đạo TP.HCM sáng 8-11, Chủ tịch hội đồng thành viên Petrovietnam đã đề xuất được triển khai dự án cung cấp nước sạch cho người dân xã đảo Thạnh An. Chia sẻ về việc này, Bí thư Thành ủy cho biết xã đảo Thạnh An không lớn nhưng dân cư san sát nhau. Trong bối cảnh chỉ tiêu nước sạch cả nước rất cao, ông không khỏi bất ngờ khi TP.HCM là trung tâm lớn nhưng đến nay vẫn có một địa bàn chưa có nước sạch. Ngay khi được xin ý kiến, Bí thư Thành ủy đã cho chủ trương làm ngay. Cùng dự cuộc khảo sát với Bí thư Thành ủy có Phó bí thư thường trực Thành ủy Lê Quốc Phong, các Phó bí thư Đặng Minh Thông, Văn Thị Bạch Tuyết, cùng lãnh đạo UBND TP và các sở ngành. Theo báoSài Gòn Giải Phóng, đoàn công tác đã nghe chủ đầu tư, đơn vị thi công báo cáo tiến độ thực hiện dự án. Các sở ban ngành và chính quyền địa phương cũng thông tin các nhiệm vụ liên quan. Đại diện chủ đầu tư, các đơn vị thi công cũng kiến nghị một số khó khăn, vướng mắc cần được TP.HCM hỗ trợ, tháo gỡ. Phát biểu tại buổi khảo sát, Bí thư Thành ủy TP.HCMTrần Lưu Quangđề nghị chủ đầu tư, các nhà thầu phải đẩy nhanh tiến độ thi công dự án, đảm bảo đúng tiến độ đề ra. Ông cũng lưu ý các sở ban ngành, chính quyền địa phương chủ động phối hợp chặt chẽ với chủ đầu tư trong toàn bộ quá trình triển khai dự án. Giải quyết nhanh các thủ tục hành chính, tạo điều kiện tốt nhất về hạ tầng kết nối và môi trường đầu tư. Đồng thời giám sát chặt chẽ việc thực hiện các cam kết về bảo vệ môi trường, hệ sinh thái, đảm bảo phát triển hài hòa giữa kinh tế và thiên nhiên, đúng định hướng phát triển bền vững của thành phố… Khu đô thị lấn biển Cần Giờ, ghi nhận tháng 10-2025 - Ảnh: CHÂU TUẤN Cần Giờ từ vùng đất xa xôi, cách trở củaTP.HCM, đang chuyển mình với đô thị lấn biển và hàng loạt siêu dự án hạ tầng. Trong đó, khu đô thị lấn biển Vinhomes Green Paradise đang dần hình thành nền móng đô thị sau 6 tháng khởi công. Với quy mô hơn 2.870ha, dân số dự kiến khoảng 230.000 người, khu đô thị được định vị là thành phố sinh thái - thông minh - nghỉ dưỡng đạt chuẩn quốc tế. Các trục giao thông về Cần Giờ đang được mở rộng toàn diện theo hướng đa phương thức - kết nối vùng. Trong đó, tuyến đường sắt tốc độ cao 350km/h từ Bến Thành đi Cần Giờ sẽ tăng tính kết nối với nhu cầu đi lại, cũng như mạng lưới metro TP.HCM. Khi hoàn thành, người dân có thể đến biển Cần Giờ chỉ trong 20 phút, thay vì gần 2 giờ như hiện nay. Dự án dự kiến khởi công năm 2025 và hoàn thành năm 2028. Bí thư Trần Lưu Quang yêu cầu đẩy nhanh tiến độ khu đô thị lấn biển Cần Giờ, đảm bảo đúng tiến độ - Ảnh: CHÂU TUẤN Song song, cầu Cần Giờ đang được hoàn thiện hồ sơ để sớm triển khai, trong khi dự án nút giao thông kết nối cao tốc Bến Lức - Long Thành với đường Rừng Sác (tổng vốn gần 2.970 tỉ đồng) dự kiến khởi công đầu năm 2026. Khi nút giao này đưa vào khai thác, người dân từ miền Tây và Đông Nam Bộ có thể đi thẳng đến Cần Giờ qua đường vành đai 3 TP.HCM - cao tốc Bến Lức Long Thành - đường Rừng Sác để đến Cần Giờ nhanh hơn. Tuyến đường vượt biển Cần Giờ - Vũng Tàu cũng đang được nghiên cứu với kỳ vọng là dấu gạch nối rất quan trọng của tuyến đường ven biển TP.HCM, khởi đầu cho hành trình kết nối đường ven biển từ miền Trung qua TP.HCM đến Đồng bằng sông Cửu long. Khởi công ngày 19-4, Tập đoàn Vingroup bắt đầu xây dựng khu đô thị du lịch lấn biển Vinhomes Green Paradise tại huyện Cần Giờ cũ (TP.HCM). Sau hơn nửa năm, vùng bờ biển từng hoang sơ dần thay da đổi thịt với tốc độ thi công hiếm thấy."
Tuoi tre,https://tuoitre.vn/thu-tuong-nhat-ban-muon-giam-luong-cua-ban-than-va-noi-cac-20251108165236817.htm,,"Sanae Takaichi,đảng Dân chủ,nippon,Chính phủ,cải cách",08/11/2025 17:03 GMT+7,Thủ tướng Nhật Bản muốn giảm lương của bản thân và nội các,"Thủ tướng Takaichi Sanae trò chuyện với các thành viên nội các - Ảnh: AFP TheoJapan Times, ngày 8-11,Thủ tướng Nhật Bản Takaichi Sanaecho biết bà dự định sửa đổi Luật đãi ngộ công chức, nhằm giảm mức lương hiện hành của các thành viên nội các, trong đó có cả chính bà. Động thái này được xem là cách bà Takaichi khẳng định cam kết cải cách, thực hiện lời kêu gọi lâu nay về việc cắt giảm lương nội các. ""Tôi sẽ tiến hành sửa đổi luật để nội các không nhận mức lương vượt quá lương của các nghị sĩ"", bà Takaichi tuyên bố trong cuộc họp báo nhậm chức hồi tháng 10. Để triển khai kế hoạch này, chính phủ dự kiến sẽ tổ chức cuộc họp cấp bộ trưởng sớm nhất vào ngày 11-11 để xác nhận việc tạm ngưng các khoản phụ cấp bổ sung dành cho Thủ tướng và các bộ trưởng - những khoản tiền được trả ngoài lương nghị sĩ cơ bản. Theo thông tin từ Chánh văn phòng Nội các Minoru Kihara, luật sửa đổi sẽ quy định rõ việc tạm ngừng chi trả các khoản phụ cấp bổ sung cho Thủ tướng và bộ trưởng ""trong một thời gian nhất định"". Hiện nay, mỗi nghị sĩNhật Bảnnhận 1,294 triệu yen (khoảng 8.500 USD)/tháng. Thủ tướng nhận thêm 1,152 triệu yen (khoảng 7.500 USD), trong khi các bộ trưởng nhận thêm 489.000 yen (khoảng 3.100 USD). Trong khuôn khổ chương trình cải cách hành chính và tài chính, Thủ tướng đã tự nguyện trích lại 30% lương hằng tháng, còn các bộ trưởng giảm 20%. Kế hoạch giảm lương của bà Takaichi được ông Fumitake Fujita, đồng lãnh đạo Đảng Đổi mới Nhật Bản (JIP), đánh giá là ""tuyệt vời"". Tuy nhiên, một số ý kiến vẫn bày tỏ nghi ngại, cho rằng việc cắt giảm lương các bộ trưởng có thể mâu thuẫn với nỗ lực tăng thu nhập cho người dân. Ông Yuichiro Tamaki, lãnh đạo Đảng Dân chủ vì nhân dân (DPFP), chỉ trích kế hoạch này là ""biểu tượng của tư duy giảm phát"". Thắng lợi của bà Takaichi không chỉ là một sự kiện lịch sử mà đối với nhiều người dân, nhất là phụ nữ và giới trẻ Nhật Bản, còn có tính biểu tượng rất cao."
Tuoi tre,https://tuoitre.vn/sac-mau-an-do-ruc-ro-trong-le-hoi-anh-sang-diwali-giua-long-tp-hcm-20251108201557756.htm,,"Ấn Độ,Việt Nam,Quan hệ Việt Nam - Ấn Độ,TP.HCM",08/11/2025 23:32 GMT+7,Sắc màu Ấn Độ rực rỡ trong Lễ hội ánh sáng Diwali giữa lòng TP.HCM,"Từ trái sang: Lãnh sự Ấn Độ tại TP.HCM Mahesh Chand Giri, Tổng lãnh sự Cuba tại TP.HCM Ariadne Feo Labrada, Annie Dube, Tổng lãnh sự Canada tại TP.HCM và Chủ tịch Hội Hữu nghị Việt Nam - Ấn Độ tại TP.HCM Huỳnh Thành Lập thực hiện nghi thức thắp đèn truyền thống Ấn Độ tượng trưng cho ánh sáng của tri thức, sự khởi đầu tốt lành và xua tan bóng tối khai mạc chương trình tối 8-11 - Ảnh: THANH HIỆP Sự kiện do Hiệp hội Doanh nghiệp Ấn Độ tại Việt Nam (INCHAM Việt Nam) và Tổng lãnh sự quán Ấn Độ tại TP.HCM tổ chức. Đây là hoạt động thường niên lớn nhất trong năm của cộng đồng người Ấn Độ tại Việt Nam, nhằm tôn vinh giá trị văn hóa, tinh thần đoàn kết và tăng cường giao lưu hữu nghị giữa hai quốc gia. Phát biểu tại buổi lễ, Chủ tịch INCHAM Việt Nam Jayprakash Shriram nhấn mạnh trong hơn hai thập kỷ qua, quan hệ Việt Nam - Ấn Độ không ngừng phát triển mạnh mẽ trên nhiều lĩnh vực như văn hóa, giáo dục, thương mại và đầu tư. Hiện Ấn Độ là một trong 10 đối tác thương mại hàng đầu của Việt Nam, trong khi Việt Nam được xem là điểm đến tiềm năng cho doanh nghiệp Ấn Độ trong các ngành chế biến thực phẩm, công nghệ, năng lượng và giáo dục. ""Diwali không chỉ là dịp để tôn vinh một truyền thống ngàn năm, mà còn là thời khắc thắp lên ngọn đèn của tình hữu nghị, hợp tác và hy vọng giữa hai dân tộc Việt Nam - Ấn Độ. Mỗi ngọn đèn Diya được thắp lên hôm nay là biểu tượng của sự khởi đầu mới, của lòng biết ơn và khát vọng phát triển"" - ông Jayprakash Shriram nói. Theo số liệu từ Đại sứ quán Ấn Độ, kim ngạch thương mại hai chiều giữa Việt Nam và Ấn Độ đã vượt mốc 15 tỉ USD, phản ánh mối quan hệ hợp tác ngày càng bền chặt giữa hai quốc gia. Các đại biểu hòa chung nhịp điệu âm nhạc của các bản nhạc được phối với trống Dhol, một loại trống truyền thống rất phổ biến trong văn hóa Ấn Độ, đặc biệt ở vùng Punjab (Bắc Ấn) - Ảnh: THANH HIỆP Lễ hội Ánh sáng Diwali là dịp sum họp cho cộng đồng người Ấn Độ tại TP và điểm hẹn văn hóa cùng bạn bè Việt Nam."
Tuoi tre,https://tuoitre.vn/ca-ngo-doc-sau-an-banh-mi-o-tp-hcm-len-162-co-nan-nhan-thai-phu-bi-doa-sinh-non-20251108161237913.htm,,"ngộ độc bánh mì,bánh mì,ăn bánh mì bị ngộ độc,TP.HCM,Sở Y tế TP.HCM",08/11/2025 16:31 GMT+7,"Ca ngộ độc sau ăn bánh mì ở TP.HCM lên 162, có nạn nhân thai phụ bị dọa sinh non","Tính đến chiều 8-11, đã có 4 bệnh viện báo cáo về Sở Y tế TP.HCM 141 trường hợp ngộ độc sau ăn bánh mì tại hai cơ sở ở đường Nguyễn Thái Sơn và Lê Quang Định - Ảnh: TRÍ ĐỨC Chiều 8-11, Phòng Nghiệp vụ y, Sở Y tế TP.HCM cho biết số ca nghingộ độcsau khi ăn bánh mì từ tiệm trên đường Nguyễn Thái Sơn (chi nhánh 1, phường Hạnh Thông) tiếp tục tăng. Đáng chú ý, đã ghi nhận thêm ca ngộ độc sau khi ăn bánh mì tại chi nhánh 2 Lê Quang Định (phường Bình Lợi Trung) của tiệm. Trong đó, có một thai phụ hơn 34 tuần tuổi thai ăn bánh mì tại chi nhánh trên đường Lê Quang Định đang trong tình trạng dọa sinh non. Theo đó, tính đến 16h ngày 8-11, tổng số sơ bộ có 162 ca từ 6 bệnh viện. Cụ thể: Bệnh viện Quân Y 175: 100 ca (đều ăn bánh mì ở chi nhánh 1). Trong đó, 13 ca đang điều trị nội trú, 87 ca đã cho về điều trị ngoại trú. Bệnh viện Đa khoa Tâm Anh: 20 ca (chi nhánh 1 có 19 ca, chi nhánh 2 có 1 ca). Hiện còn 13 trường hợp đang tiếp tục điều trị nội trú (1 ca nằm ICU). Bệnh viện Nhân dân Gia Định: 36 ca (chi nhánh 1 có 14 ca, chi nhánh 2 có 8 ca, còn lại 14 ca chưa rõ), hiện đang điều trị nội trú 24 ca. Có 1 ca vào viện ngày 5-11, cấy máu dương tính Salmonella. Bệnh viện Bình Dân: 1 ca (chi nhánh 1). Bệnh  nhân bị nôn ói, tiêu chảy nhiều lần, phân lỏng, nước kèm đau quặn quanh rốn, đang điều trị nội trú. Bệnh viện Mỹ Đức Tân Bình: 1 ca (chi nhánh 1). Thai phụ sinh năm 1997, thai 34 tuần 2 ngày, bị đau bụng, tiêu chảy sau ăn bánh mì, dọa sinh non, đang điều trị nội trú. Bệnh viện quốc tế Becamex: 5 ca (chi nhánh 1). Tất cả đang điều trị nội trú. Theo báo cáo của Bệnh viện Quân y 175, trong ba ngày 6, 7 và 8-11, bệnh viện đã tiếp nhận khám, cấp cứu và điều trị cho 100 trường hợp nghinhiễm trùng, nhiễm độc thực phẩm. Chẩn đoán chung cho các ca bệnh là nhiễm trùng - nhiễm độc do ăn uống, và đều có yếu tố dịch tễ liên quan là đã ăn bánh mì tại một tiệm trên đường Nguyễn Thái Sơn, phường Hạnh Thông. Phần lớn bệnh nhân khởi phát với các triệu chứng buồn nôn, nôn, đau bụng,tiêu chảy, sốt, mệt mỏi, mức độ biểu hiện khác nhau. Kết quả xét nghiệm cho thấy bạch cầu và CRP tăng. Bệnh viện triển khai phác đồ điều trị bao gồm bù dịch, điện giải, dùng kháng sinh, đồng thời theo dõi biến chứng sốc nhiễm khuẩn và rối loạn nước - điện giải. Bệnh viện Tâm Anh TP.HCM báo cáo tính đến chiều 8-11 đã tiếp nhận 20 ca ngộ độc sau khi ăn bánh mì, tăng 4 ca so với thời điểm sáng 7-11. Tại Bệnh viện Mỹ Đức Tân Bình tiếp nhận bệnh nhân Đ.T.T.H. (28 tuổi, ngụ phường An Hội Đông, TP.HCM) đang mang thai 34 tuần, vào viện vì đau bụng sau ăn bánh mì. Chị H. khai đã ăn bánh mì của cùng thương hiệu với các ca ngộ độc thực phẩm trước đó, nhưng mua tại chi nhánh trên đường Lê Quang Định. Vào tối 6-11, sau ăn tối, chị bị đau bụng, tiêu chảy 1 lần, không sốt. Sáng 7-11 thì tiêu chảy thêm 1 lần, phân vàng, lỏng, không nhầy máu, sau đó không còn tiêu chảy hay nôn ói cho đến hiện tại. Chiều cùng ngày, chị H. thấy bụng căng gò nhiều, không ho, không tiểu buốt gắt, không dấu xuất huyết nên đến khám tại Bệnh viện Mỹ Đức Phú Nhuận. Chị H. được siêu âm ngày 7-11, ghi nhận em bé nặng 2.350 gram, doppler bình thường, có 3 cơn gò trong 10 phút. Bệnh viện Mỹ Đức Phú Nhuận chỉ định nhập viện với chẩn đoán dọa sinh non. Chị sau đó đã nhập viện Bệnh viện Mỹ Đức Tân Bình. Hiện sức khỏe của sản phụ ổn định, không còn đau bụng hay tiêu chảy. Theo tìm hiểu củaTuổi Trẻ Online, tiệm bánh mì gây ra hàng trăm ca ngộ độc trên có hai chi nhánh trên đường Nguyễn Thái Sơn và đường Lê Quang Định. Theo Sở Y tế TP.HCM, dữ liệu lâm sàng và cận lâm sàng của hầu hết bệnh nhân bị ngộ độc thực phẩm sau ăn bánh mì đều phù hợp với tác nhân vi khuẩn đường ruột, nhiều khả năng làSalmonella. Trước tình hình trên, Sở Y tế đã chỉ đạo các bệnh viện bảo đảm thu dung, phân loại và xử trí theo đúng phác đồ điều trị ngộ độc thực phẩm đã được sở ban hành, bao gồm: bù nước - điện giải, theo dõi sinh hiệu và chức năng tạng, chỉ định cận lâm sàng phù hợp, lấy mẫu phân và cấy máu khi nghi nhiễm khuẩn xâm nhập trước khi dùng kháng sinh. Nếu có chỉ định kháng sinh thì cân nhắc theo hướng tác nhân vi khuẩn đường ruột nhóm Salmonella và điều chỉnh theo kháng sinh đồ khi có. Các bệnh viện đã thực hiện chế độ báo cáo nhanh cho Phòng Nghiệp vụ y, đồng thời phối hợp cung cấp thông tin cho Sở An toàn thực phẩm TP.HCM để phục vụ công tác truy xuất và xác minh. Liên quan đến vụ ngộ độc sau khi ăn bánh mì tại một tiệm trên đường Nguyễn Thái Sơn, phường Hạnh Thông, đến sáng 8-11 đã có 4 bệnh viện báo cáo về Sở Y tế TP.HCM với hơn 80 trường hợp, đồng thời đã phát hiện tác nhân."
Tuoi tre,https://tuoitre.vn/clb-bac-ninh-3-tran-lien-tiep-khong-thang-thay-tay-chiu-suc-ep-20251108184117788.htm,,"CLB Bắc Ninh,CLB TP.HCM ngoại binh,Giải hạng nhất",08/11/2025 20:15 GMT+7,"CLB Bắc Ninh 3 trận liên tiếp không thắng, thầy Tây chịu sức ép","Bắc Ninh biết cách ghi bàn nhưng không biết cách bảo vệ tỉ số - Ảnh: CLB BẮC NINH Chiều 8-11, CLB Bắc Ninh tiếp đónXuân Thiện Phú Thọở vòng 7 Giải hạng nhất quốc gia 2025 - 2026 trên sân nhà Việt Yên. Đội bóng dưới sự dẫn dắt của HLV Paulo Foiani dồn lên tấn công ngay từ những phút đầu và tạo ra một số cơ hội nguy hiểm. Xuân Thiện Phú Thọ chọn lối đá phòng ngự phản công. Điều này gây khó khăn nhất định cho Bắc Ninh. Đội chủ nhà bế tắc và chỉ trông chờ vào những đường tạt hoặc bóng dài. Hai đội mang đến thế trận giằng co suốt hiệp 1 mà không có bàn thắng nào được ghi. Phải tới hiệp 2, Bắc Ninh mới có bàn mở tỉ số. Phút 63, Trần Văn Trung (Bắc Ninh) sút từ ngoài vòng cấm, đưa trái bóng đi trúng tay hậu vệ Tiêu Trung Hiếu (Xuân Thiện Phú Thọ), qua đó mang về cho đội chủ nhà quả phạt đền quý giá. Trên chấm luân lưu, Phan Văn Hiếu không mắc sai lầm nào để ghi bàn mở tỉ số 1-0 cho Bắc Ninh trong bối cảnh đội nhà thi đấu bế tắc. Dù vậy, Bắc Ninh cũng không thể bảo toàn được tỉ số này. Phút 67, thủ môn Huỳnh Tuấn Linh (Bắc Ninh) lao ra phá lỗi, đưa bóng đập lưng tiền đạo Yago Ramos của Xuân Thiện Phú Thọ bay vào lưới. 1-1 là tỉ số chung cuộc. Đây là trận không thắng thứ ba liên tiếp của CLB Bắc Ninh. Lần gần nhất đội bóng xứ Kinh Bắc biết đến mùi chiến thắng là trận gặp Quy Nhơn United ở vòng 4 (thắng 3-1). Tính ra suốt từ đầu mùa, đoàn quân HLV Foiani chỉ mới thắng có 2 trận, còn lại toàn hòa (4 trận) và thua (1 trận). 10 điểm sau 7 trận cùng vị trí thứ 4 là kết quả chưa phản ánh đúng tham vọng đua vé thăng hạng của đại gia Bắc Ninh. Phía trên họ lúc này làKhánh Hòa, Đồng Nai và TP.HCM với lần lượt 15 và 14 điểm. CLB Bắc Ninh giành chiến thắng 3-1 trước Quy Nhơn United bằng 3 bàn thắng của Phan Văn Hiếu, Nguyễn Văn Đạt và Kaina Nunes."
