Source,URL,Category,Keyword,Time,Title,Content
Tuoi tre,https://tuoitre.vn/trung-quoc-noi-tau-san-bay-phuc-kien-se-thuong-xuyen-hien-dien-tai-vung-bien-quoc-te-20251108171035532.htm,Thế giới,"Trung Quốc,Tàu sân bay,Phúc Kiến",08/11/2025 17:28 GMT+7,Trung Quốc nói tàu sân bay Phúc Kiến sẽ thường xuyên hiện diện tại vùng biển quốc tế,"Tàu sân bay Phúc Kiến tại lễ bàn giao hôm 5-11 ở Tam Á, cùng với tàu sân bay Sơn Đông và một tàu đổ bộ tấn công cỡ lớn Type 075 ở phía sau - Ảnh: GLOBAL TIMES TheoTân Hoa Xã,phát ngôn viênHải quân Trung Quốc, ông Leng Guowei, ngày 8-11 cho biết tàu sân bay Phúc Kiến vừa được bàn giao của nước này sẽ thường xuyên xuất hiện trên các vùng biển quốc tế. Theo ông Leng, dù cảng quân sự Tam Á ở tỉnh Hải Nam là cảng nhà của tàu sân bay này, thì đại dương bao la mới là ""ngôi nhà thực sự"" của nó. Tàu sân bayPhúc Kiến, đặt theo tên tỉnh ở miền đông Trung Quốc, vừa được biên chế chính thức vào lực lượng hải quân Trung Quốc hôm 5-11. Đây là tàu sân bay thứ ba của Trung Quốc và là tàu chiến lớn nhất của hải quân nước này. Con tàu do Trung Quốc thiết kế và chế tạo được trang bị hệ thống phóng điện từ. Người phát ngôn Leng Guowei cho biết thêm trong thời gian tàu được xây dựng, việc phát triển và thử nghiệm các khí tài hỗ trợ, bao gồm các tiêm kích J-35, J-15T và J-15D,máy baycảnh báo sớm KongJing-600 và trực thăng dòng Z-20, vẫn diễn ra đúng tiến độ. Tàu Phúc Kiến sẽ được trang bị đầy đủ biên đội máy bay trong thời gian tới. Ông nhấn mạnh nhiều trang thiết bị và công nghệ trên tàu Phúc Kiến lần đầu tiên được đưa vào sử dụng thực tế, do đó con tàu sẽ tiếp tục trải qua các đợt thử nghiệm sau khi được biên chế. Việc phát triển và cải tiến vũ khí, trang bị không nhằm vào bất kỳ quốc gia hay mục tiêu cụ thể nào, đồng thời không tạo ra mối đe dọa với các nước hay khu vực khác. Trung Quốc sẽ lên kế hoạch phát triển tàu sân bay tiếp theo dựa trên nhu cầu quốc phòng. Ngày 28-8, Bộ trưởng Quốc phòng Nhật Bản đánh giá hợp tác an ninh giữa Nhật Bản và Anh đã đạt ""mức chưa từng có"" khi tàu sân bay Hải quân Hoàng gia Anh ghé thăm Tokyo."
Tuoi tre,https://tuoitre.vn/giai-thuong-sao-do-vinh-danh-doanh-nhan-tre-xuat-sac-2025110809560256.htm,Kinh doanh,"Lê Khả Phiêu,sao đỏ,Doanh nhân trẻ Việt Nam,ông ĐẶNG HỒNG ANH,Hội Doanh nhân trẻ Việt Nam",08/11/2025 16:26 GMT+7,Giải thưởng Sao Đỏ vinh danh doanh nhân trẻ xuất sắc,"Giải thưởng Sao Đỏ - Doanh nhân trẻ Việt Nam tiêu biểu đã tôn vinh hơn 600 lượt doanh nhân trẻ tiêu biểu, trong đó có 127 doanh nhân Sao Đỏ - Ảnh: C.T. Ông Đặng Hồng Anh - Chủ tịch Hội Doanh nhân trẻ Việt Nam, cho biết Giải thưởng Sao Đỏ - Doanh nhân trẻ Việt Nam không chỉ là danh hiệu, là giải thưởng, ghi nhận tinh thần dám khác biệt, dám phụng sự và dám cống hiến. Giải thưởng đã đi cùng mọi thăng trầm của nền kinh tế quốc gia nên không chỉ tôn vinh thành tích, mà còn khuyến khíchdoanh nhân tiên phongtrong chuyển đổi số, kinh tế xanh và đổi mới sáng tạo. Nhiều doanh nghiệp Sao Đỏ đang đầu tư mạnh vào các ngành công nghiệp mới, như năng lượng sạch, công nghiệp bán dẫn, công nghệ tài chính, logistics thông minh và chuỗi cung ứng toàn cầu. Họ tạo việc làm cho hàng trăm nghìn lao động, với tổng tài sản hàng triệu tỉ đồng, tổng doanh thu hằng năm ước đạt cả trăm nghìn tỉ đồng. Hội Doanh nhân trẻ Việt Nam cho hay năm 2025 đánh dấu 26 năm hành trình Sao Đỏ, cũng là năm tổ chức Đại hộiHội Doanh nhân trẻViệt Nam lần thứ 8, một cột mốc quan trọng để nhìn lại và định vị lại vai trò của thế hệ doanh nhân trẻ trong vận hội mới của đất nước. Lễ trao giải thưởng Sao Đỏ - Doanh nhân trẻ Việt Nam tiêu biểu 2025 sẽ được tổ chức tại Hà Nội, ngày 26-11-2025, tôn vinh 100 doanh nhân trẻ tiêu biểu, trong đó 10 doanh nhân xuất sắc nhất sẽ được trao giải thưởng Sao Đỏ 2025. Nhiều hoạt động đồng hành khác cũng sẽ diễn ra như triển lãm giới thiệu sản phẩm, hàng hóa, dịch vụ của các doanh nhân trẻ và doanh nhân Sao Đỏ, các hoạt động ký kết xúc tiến thương mại, hợp tác đầu tư nội khối... Giải thưởng Sao Đỏ - Doanh nhân trẻ Việt Nam tiêu biểu là giải thưởng cao quý của Trung ương Đoàn, Trung ương Hội LHTN Việt Nam, Hội Doanh nhân trẻ Việt Nam, xét trao tặng những doanh nhân trẻ xuất sắc, có nhiều đóng góp trong sự nghiệp phát triển kinh tế - xã hội. Ra đời vào năm 1999,Giải thưởng Sao Đỏkhông chỉ ghi nhận thành tích kinh doanh, mà còn tôn vinh tinh thần dấn thân, đổi mới, phụng sự Tổ quốc của các thế hệ doanh nhân trẻ Việt Nam. Từ 10 gương mặt Sao Đỏ đầu tiên được cố Tổng Bí thư Lê Khả Phiêu trực tiếp trao giải năm 1999, đến nay qua 13 lần tổ chức, giải thưởng đã bình chọn và tôn vinh hơn 600 lượt doanh nhân trẻ tiêu biểu, trong đó có 127 gương mặt tiêu biểu được trao giải thưởng Sao Đỏ. Từ một giải thưởng khởi đầu khi đất nước còn đang mở cửa, Sao Đỏ nay đã trở thành biểu tượng cho bản lĩnh và trí tuệ Việt Nam. Trong vận hội mới, Sao Đỏ tiếp tục thắp sáng khát vọng - đưa doanh nhân trẻ Việt Nam tiến xa hơn, cùng đất nước bước vào kỷ nguyên kiến tạo thịnh vượng. Sau khi nghị quyết 68-NQ/TW của Bộ Chính trị về phát triển kinh tế tư nhân được ban hành, nhiều doanh nhân trẻ kiến nghị chính sách hỗ trợ nhằm hiện thực hóa khát vọng phát triển doanh nghiệp, đất nước."
Tuoi tre,https://tuoitre.vn/thu-truong-bo-tai-chinh-thong-tin-ve-viec-huy-dong-1-trieu-ti-dong-trai-phieu-von-cho-nen-kinh-te-20251108160841913.htm,Kinh doanh,"trái phiếu doanh nghiệp,cổ phiếu,niêm yết,thị trường vốn,huy động vốn",08/11/2025 16:21 GMT+7,"Thứ trưởng Bộ Tài chính thông tin về việc huy động 1 triệu tỉ đồng trái phiếu, vốn cho nền kinh tế","Thứ trưởng Bộ Tài chính Nguyễn Đức Chi - Ảnh: HỒNG QUANG Tại họp báo, báo chí đặt câu hỏi liên quan tới những giải pháp nào cho các kênh huy động vốn như phát hành cổ phiếu trên thị trường chứng khoán vàtrái phiếu doanh nghiệp, giúp cơ cấu lại thị trường vốn là đưa những kênh này làm trụ cột cho nền kinh tế? Trả lời, ông Nguyễn Đức Chi - Thứ trưởng Bộ Tài chính - cho hay chiến lược phát triển thị trường vốn trên thị trường chứng khoán đến năm 2030 được Thủ tướng Chính phủ phê duyệt, xác định mục tiêu huy động thị trường vốn trên thị trường chứng khoán trở thành kênh huy động vốn chung và dài hạn chủ yếu và quan trọng của nền kinh tế. Vì vậy, Bộ Tài chính đã triển khai đồng bộ nhiều giải pháp, hướng tới phát triển thị trường. Trong suốt thời gian qua, đặc biệt là 2025, bộ đã tiến hành nhiều hoạt động thực tế trên thị trường chứng khoán, thị trường vốn. Đó là việc thúc đẩy để xem xét nâng hạnthị trường chứng khoántừ mức thị trường cận biên lên thị trường mới nổi. Bộ Tài chính cũng có hội nghị đánh giá thị trường trái phiếu năm 2025, chỉ ra tình hình và điểm nghẽn, các vấn đề cần giải quyết và đưa ra giải pháp. Theo ông Chi, thị trường cổ phiếu, thị trường chứng khoán phát triển sẽ tạo cơ sở tốt cho doanh nghiệp có nhu cầu huy động vốn, phát hành cổ phiếu IPO trên thị trường chứng khoán. Do đó, Bộ Tài chính cũng báo cáo Chính phủ ban hành nghị định sửa đổi bổ sung Nghị định 155 tạo điều kiện rất thuận lợi cho doanh nghiệp khi thực hiện IPO gắn với niêm yết cổ phiếu trên thị trường chứng khoán. Trong đó, các nội dung liên quan đến các thủ tục hành chính sẽ được rút ngắn. Đơn cử như thời gian sau IPO xong doanh nghiệp sẽ phải soát xét báo cáo tài chính, nếu thông thường mất khoảng 3-6 tháng, thì với quy định mới giảm xuống còn 30 ngày. Điều này tạo điều kiện rất thuận lợi cho doanh nghiệp IPOcổ phiếutrên thị trường và gắn với niêm yết, tạo động lực cho doanh nghiệp. Đồng thời, việc giảm thời gian sẽ giúp thu hút nhiều nhà đầu tư đầu tư vào các cổ phiếu đã IPO, có tác dụng lớn cho các doanh nghiệp phát hành cổ phiếu trên thị trường, huy động vốn cho sản xuất kinh doanh. Đối với thị trường trái phiếu, ông Chi cho hay kế hoạch phát hành trái phiếu Chính phủ, năm 2025 phát hành khoảng 500.000 tỉ đồng. Thị trường trái phiếu doanh nghiệp cả công chúng và riêng lẻ, khi thị trường phục hồi trở lại quy mô phát hành sẽ là 500.000 tỉ đồng nữa, tức là quy mô toàn thị trường là 1 triệu tỉ đồng. Tuy nhiên, ông Chi cho rằng quy mô thị trường này chưa thực sự tương ứng với tiềm năng, yêu cầu huy động vốn cho cả Chính phủ và doanh nghiệp cho năm 2026 và những năm tiếp theo. Vì vậy, Bộ Tài chính đưa ra giải pháp căn cơ phát triển thị trường, tạo điều kiện cho Chính phủ và doanh nghiệp huy động trái phiếu trên thị trường vốn. Trong đó, tại Luật Chứng khoán năm 2024 đã sửa đổi bổ sung quy định liên quan phát hành trái phiếu, gắn với nhà đầu tư khi thực hiện đầu tư vàotrái phiếudoanh nghiệp. Để thi hành luật, bộ đang xây dựng nghị định Chính phủ hướng dẫn thi hành và xin ý kiến các cơ quan liên quan, bộ ngành cùng các đối tượng tác động để tiếp thu. Nội dung sẽ tập trung cải tiến quy trình thủ tục, làm rõ quy định liên quan tới các nhà phát hành, đảm bảo chất lượng trái phiếu phát hành. Đồng thời, bộ quy định rõ tiêu chí của từng nhà đầu tư tham gia từng loại hình trái phiếu, xây dựng quy trình kiểm tra, rà soát và đảm bảo tính an toàn, minh bạch. Bộ Tài chính sẽ báo cáo Chính phủ trong thời gian tới vấn đề này, kỳ vọng thị trường cổ phiếu, trái phiếu đều tăng trưởng mạnh năm 2026, đáp ứng mục tiêu huy động vốn, chia sẻ một phần kênh tín dụng với kênh ngân hàng thương mại, đảm bảo tính minh bạch và an toàn, bền vững của thị trường vốn. Chiều 21-10, Thủ tướng Phạm Minh Chính chủ trì cuộc họp của Thường trực Chính phủ rà soát tình hình, kết quả thực hiện nhiệm vụ công tác trên các lĩnh vực trong 10 tháng năm 2025, nhiệm vụ trọng tâm những tháng cuối năm 2025."
Tuoi tre,https://tuoitre.vn/yen-sao-khanh-hoa-la-bieu-tuong-van-hoa-kinh-te-cua-tinh-khanh-hoa-20251108115936788.htm,Kinh doanh,"di sản văn hóa phi vật thể,Kỷ lục châu Á,Khánh Hòa,Phát triển kinh tế,Yến sào Khánh Hòa",08/11/2025 16:06 GMT+7,"Yến sào Khánh Hòa là biểu tượng văn hóa, kinh tế của tỉnh Khánh Hòa","Thứ trưởng Bộ Nông nghiệp và Môi trường Phùng Đức Tiến (thứ hai từ phải sang) trao biểu trưng 1 tỉ đồng của Công ty Yến sào Khánh Hòa ủng hộ đồng bào vùng lũ - Ảnh: TRẦN HOÀI Ngày 8-11, Công tyYến sàoKhánh Hòa tổ chức lễ kỷ niệm 35 năm ngày thành lập (9-11-1990 - 9-11-2025). Tại buổi lễ, ông Nguyễn Khắc Toàn - Phó bí thư Tỉnh ủy, Chủ tịch UBND tỉnh Khánh Hòa - cho biếtYến sào Khánh Hòalà biểu tượng văn hóa, kinh tế đặc sắc của địa phương, với hành trình 35 năm gắn bó, gìn giữ và phát triển thương hiệu yến sào Việt Nam vươn ra thế giới. Theo ông Toàn, trong từng bước chuyển mình, công ty luôn kiên trì với sứ mệnh gìn giữ, bảo tồn và lan tỏa giá trị của nguồn tài nguyên thiên nhiên quý giá của quê hương. ""Không chỉ phát triển kinh tế, Công ty Yến sào Khánh Hòa còn được ghi nhận bởi vai trò tiên phong trong bảo tồn tài nguyên thiên nhiên và di sản biển đảo, như việc lễ hội Yến sào Khánh Hòa được công nhận làDi sản văn hóa phi vật thểquốc gia năm 2025"" - ông Toàn phát biểu. Từ những ngày đầu thành lập với 8 đảo yến và 87 lao động, đến nay Công ty Yến sào Khánh Hòa đã quản lý 33 đảo yến, 173 hang yến, tạo việc làm ổn định cho hơn 4.000 lao động, được Tổ chức Kỷ lục châu Á công nhận là đơn vị có số lượng hang đảo yến nhiều nhất và sản lượng khai thác lớn nhất châu Á. Từ doanh thu 23 tỉ đồng vào năm 1991, đến giai đoạn 2020 - 2025, công ty đã đạt tổng doanh thu gần 13.000 tỉ đồng, đóng góp lớn và ổn định cho ngân sách nhà nước. Công ty hiện sở hữu 7 nhà máy chế biến yến sào hàng đầu cả nước, phát triển hơn 60 dòng sản phẩm cao cấp, phủ khắp 34 tỉnh, thành phố. Cột mốc đáng chú ý là cuối năm 2023, Yến sào Khánh Hòa trở thành đơn vị đầu tiên của Việt Nam xuất khẩu chính ngạch tổ yến vào thị trường Trung Quốc, đưa thương hiệu Yến sào Khánh Hòa hiện diện tại hơn 30 quốc gia, vùng lãnh thổ. Dịp này, công ty cũng ủng hộ 1 tỉ đồng hỗ trợ đồng bào các tỉnh khắc phục hậu quả bão lũ, trao tặng 35 nhà đại đoàn kết cho hộ khó khăn tỉnh Khánh Hòa, đóng góp 200 triệu đồng vào Quỹ khuyến học, khuyến tài tỉnh.  Công ty TNHH TM Yến Sào Nha Trang vừa chính thức khai trương không gian trải nghiệm tổ yến mang tên Nest Art Paradise tại Nha Trang Prince Hotel, số 2-4 Nguyễn Thiện Thuật, TP Nha Trang."
Tuoi tre,https://tuoitre.vn/kinh-te-khong-gian-can-bien-cua-tp-hcm-20251108084558204.htm,Kinh doanh,kinh tế không gian cận biên,08/11/2025 08:59 GMT+7,Kinh tế không gian cận biên của TP.HCM,"Những không gian phát triển mới góp phần định hình siêu đô thị TP HCM, ngang tầm các thành phố lớn khu vực châu Á - Ảnh: QUANG ĐỊNH Nếu như trước đây, kinh tế TP được nhìn theo mặt phẳng với những khu công nghiệp, cao ốc, cảng biển và trục giao thông lớn thì nay không gian phát triển được mở rộng theo chiều đứng sau khi TP.HCM sáp nhập cùng Bình Dương và Bà Rịa - Vũng Tàu. Đó là hệ sinh thái tích hợp giữa kinh tế xanh và kinh tế số, gắn trực tiếp với đời sống dân sinh, bao gồm các hoạt động từ nông nghiệp công nghệ cao, giám sát môi trường,logistics thông minh, du lịch bay tầm thấp, đến taxi điện, cứu hộ khẩn cấp và vận tải hàng hóa tự động. Mọi thứ diễn ra ở độ cao mà con người vẫn có thể cảm nhận theo cách vừa gần gũi vừa hiện đại. Một drone giám sát có thể bao quát hàng chục hecta cây trồng mỗi ngày, một thiết bị bay tầng thấp có thể giao hàng từ Bình Dương đến Vũng Tàu chỉ trong vài chục phút. Cùng với hạ tầng dữ liệu, trí tuệ nhân tạo và năng lượng tái tạo, mô hình này đang hình thành một tầng phát triển mới mang tính bền vững và hiệu quả. Trên thế giới, Trung Quốc là quốc gia đi đầu trong phát triển kinh tế không gian cận biên. Trong 4 năm qua, nước này đã hình thành hơn 50.000 doanh nghiệp hoạt động trong lĩnh vực này, từ UAV dân dụng, drone giao hàng, taxi bay, đến các dịch vụ giám sát và an ninh tầng thấp. Chính phủ Trung Quốc đã ban hành khung pháp lý riêng, thành lập Cục Kinh tế không gian cận biên, và quy hoạch ""đường bay tầng thấp"" tại hàng chục TP như Thâm Quyến, Hàng Châu, Quảng Châu. Họ xem đây là một động lực tăng trưởng mới, đặc biệt khi các ngành công nghiệp truyền thống đang chậm lại. TP.HCM mở rộng với đặc thù vừa có đô thị lớn, vừa có cảng biển nước sâu, vừa có vùng nông nghiệp và rừng ven biển, đây đều là những yếu tố hội tụ đủ điều kiện để trở thành trung tâm tiên phong trong khu vực về phát triển không gian cận biên. Điều đặc biệt mô hình chính quyền hai cấp giúp cơ chế điều hành trở nên linh hoạt hơn. Cấp TP đảm nhận chiến lược và quy hoạch hạ tầng không gian như quy hoạch vùng bay, khu công nghệ tầng thấp, trung tâm dữ liệu và năng lượng xanh. Cấp cơ sở có thể trực tiếp thử nghiệm mô hình mới, liên kết doanh nghiệp, hợp tác với các trường đại học và start-up để triển khai dự án thực tế. Khi quyền tự chủ được trao xuống gần dân hơn, sáng kiến địa phương có thể nảy nở, mô hình mới có thể thử nghiệm nhanh hơn, và người dân có thể tham gia sớm hơn vào nền kinh tế mới. Ngoài ra kinh tế không gian cận biên không chỉ nằm trên bầu trời mà còn lan xuống mặt đất. Một nông dân ở Củ Chi có thể dùng drone phun thuốc, giám sát độ ẩm và năng suất cây trồng. Một hợp tác xã ở Phú Mỹ có thể vận hành kho hàng thông minh, kết nối trực tiếp với cảng Cái Mép qua nền tảng dữ liệu. Một thanh niên ở Dĩ An có thể khởi nghiệp với dịch vụ vận hành UAV, du lịch bay tầng thấp hay giám sát rừng, biển. Mọi thứ đều nằm trong tầm tay nếu hạ tầng, dữ liệu và chính sách được mở ra. Khi không gian phát triển mở rộng theo chiều đứng, TP.HCM mở rộng có thể tái cấu trúc mô hình kinh tế theo hướng đa tầng. Tầng cao là trung tâm tài chính, thương mại, đổi mới sáng tạo; tầng trung là công nghiệp và logistics; tầng thấp là sản xuất nông nghiệp công nghệ cao, năng lượng tái tạo, dịch vụ bay, du lịch sinh thái và logistic tầm thấp. Giữa các tầng đó là ""tầng dữ liệu"", đây còn được gọi là ""bộ não số"" của siêu đô thị, kết nối mọi hoạt động, giúp chính quyền điều hành thông minh và người dân được phục vụ tốt hơn. Nhưng để mô hình này thành hiện thực, ba điều kiện tiên quyết phải được đáp ứng: hạ tầng, thể chế và con người. Trong đó hạ tầng phải đồng bộ về hạ tầng số lẫn vật lý. Thể chế phải linh hoạt, cho phép thử nghiệm mô hình mới và điều chỉnh kịp thời. Và con người phải được chuẩn bị từ đào tạo kỹ năng công nghệ, ngoại ngữ, đến kỹ năng khai thác dữ liệu và quản lý vận hành. Khi ba yếu tố này kết hợp, không gian cận biên sẽ không chỉ là nơi thử nghiệm, mà là nền tảng phát triển thật sự của đô thị mở rộng. Kinh tế không gian cận biên còn mang ý nghĩa xã hội sâu sắc. Nó giúp giảm chênh lệch giữa đô thị và nông thôn, tạo việc làm chất lượng cao tại chỗ, giảm áp lực di cư, đồng thời khuyến khích phát triển xanh và tiết kiệm tài nguyên. Người dân không cần rời quê mới có thể tiếp cận công nghệ. Doanh nghiệp nhỏ có thể tham gia chuỗi giá trị toàn cầu mà không cần nhà xưởng lớn. Mỗi làng nghề, mỗi cụm dân cư, mỗi bãi biển hay vùng rừng đều có thể trở thành một ""điểm nhấn"" trong mạng lưới kinh tế mới. Với TP.HCM mới, kinh tế không gian cận biên không chỉ mở ra vùng phát triển rộng hơn, mà còn khơi dậy một cách nhìn mới về phát triển: phát triển không phải chỉ đi lên, mà còn ""đi ngang"" và ""đi sâu"" vào đời sống người dân, sâu vào từng mét vuông đất và từng khoảng không gian trên đầu họ. Đây chính là tư duy phát triển bền vững, không để ai bị bỏ lại phía sau, không để vùng nào đứng ngoài cuộc cách mạng công nghệ. Kinh tế không gian cận biên, nếu được triển khai đúng hướng, sẽ không chỉ tạo ra tăng trưởng, mà còn tạo ra sự hòa hợp giữa công nghệ và con người, giữa phát triển và tự nhiên, giữa tốc độ và bền vững. Tại sự kiện ""Toàn cảnh kinh tế tư nhân Việt Nam lần thứ 1"" mới đây, Liên minh Kinh tế tầm thấp (LAE) chính thức ra mắt, đánh dấu một cột mốc quan trọng trong tiến trình nâng tầm vị thế Việt Nam trên bản đồ công nghệ toàn cầu. Theo chuyên gia Đỗ Thiên Anh Tuấn, kinh tế không gian cận biên hay còn gọi là kinh tế không gian tầm thấp là khái niệm chỉ hệ thống các hoạt động kinh tế diễn ra tại những khu vực nằm ở rìa hoặc vùng chuyển tiếp của một không gian phát triển, ví dụ như giữa trung tâm và ngoại vi, giữa đô thị và nông thôn hoặc giữa các vùng kinh tế, hay giữa các quốc gia liền kề. Đây là không gian mà ở đó mức độ tích hợp kinh tế - xã hội, hạ tầng và thể chế còn hạn chế, nhưng tiềm năng gia tăng giá trị cận biên rất lớn nếu được đầu tư và kết nối hợp lý. UBND TP.HCM vừa ban hành quyết định phê duyệt danh mục 6 công trình, dự án ưu tiên áp dụng cơ chế, chính sách đặc thù quy định tại Nghị quyết số 66.4/2025 của Chính phủ."
