Source,URL,Category,Keyword,Time,Title,Content
ZNews,https://znews.vn/tap-doan-trung-quoc-muon-lam-duong-bo-cao-toc-o-viet-nam-post1563958.html,Kinh doanh,Null,"Thứ năm, 26/6/2025 21:02 (GMT+7)",Tập đoàn Trung Quốc muốn làm đường bộ cao tốc ở Việt Nam,"Ông Nghiêm Giới Hòa đề xuất tham gia các dự án cao tốc với cam kết thời gian hoàn thành giảm một nửa so với dự kiến. Ảnh:VGP/Nhật Bắc. Tiếp tục chương trình tham dự Hội nghị thường niên các nhà tiên phong lần thứ 16 của Diễn đàn Kinh tế Thế giới và làm việc tại Trung Quốc, chiều 26/6, tại thành phố Thượng Hải, Thủ tướng Phạm Minh Chính tiếp ông Nghiêm Giới Hòa, Chủ tịch Tập đoàn Thái Bình Dương. Ông Nghiêm Giới Hòa cho biết tập đoàn đã ký Biên bản ghi nhớ với UBND TPHà Nộivề đầu tư và xây dựng cơ sở hạ tầng trong 5 năm với quy mô hàng tỷ USD. Doanh nghiệp đang tham gia các dự án hạ tầng tại Việt Nam như thi công cầu Tứ Liên, Hà Nội (đã khởi công sau cuộc gặp với Thủ tướng lần trước tại Trung Quốc). Ông báo cáo tình hình đầu tư, hoạt động của tập đoàn tại Việt Nam và trình bày các đề xuất tham gia các dự án trọng điểm khác, đặc biệt là các dự án cao tốc với cam kết sẽ đưa các tuyến này trở thành kiểu mẫu với thời gian hoàn thành giảm một nửa so với dự kiến. Hoan nghênh các đề xuất của ông Nghiêm Giới Hòa, Thủ tướng Phạm Minh Chính đánh giá cao hoạt động đầu tư kinh doanh hiệu quả, bền vững của Tập đoàn Xây dựng Thái Bình Dương trên toàn cầu nói chung và tại Việt Nam nói riêng. Thủ tướng đề nghị tập đoàn tiếp tục làm tốt, khẩn trương hoàn thành các dự án đã triển khai, đồng thời nghiên cứu, trao đổi với TP Hà Nội và các cơ quan liên quan về khả năng tham gia các dự án hạ tầng lớn khác, như đường nối sân bay Gia Bình với trung tâm Hà Nội, cầu Ngọc Hồi, tuyến đường sắt đô thị Văn Cao - Hòa Lạc (Hà Nội). Người đứng đầu Chính phủ cũng đề nghị tập đoàn nghiên cứu thực hiện hợp tác công tư với các đoạn mở rộng của đường bộ cao tốc Bắc - Nam, các dự án cảng biển, sân bay, đường sắt, đường sắt đô thị tại Hà Nội, TP.HCM, các tuyến metro, trong đó có tuyến metro từ sân bay Long Thành về sân bay Tân Sơn Nhất... Cho biết Việt Nam đang phát triển hạ tầng rất mạnh, Thủ tướng mong muốn tập đoàn đầu tư cơ bản, coi trọng đào tạo nhân lực, xây dựng cứ điểm, làm ăn lâu dài tại Việt Nam, cạnh tranh lành mạnh với các doanh nghiệp khác, bảo đảm triển khai các dự án nhanh, chất lượng cao, an toàn, hiệu quả. Tri Thức - Znewsgiới thiệu độc giảTủ sách kiến thức kinh tếvới đa dạng cuốn sách, câu chuyện trong lĩnh vực kinh doanh, kinh tế. Là nguồn tư liệu cho những người quan tâm và muốn nâng cao kiến thức trong lĩnh vực kinh tế. Những cuốn sách, câu chuyện trong Tủ sách không chỉ đơn thuần là những tác phẩm của tri thức mà còn chứa đựng bí quyết, kinh nghiệm quý báu từ các tác giả, nhà quản lý có uy tín và kinh nghiệm lâu năm trong ngành. Đọc sách không chỉ giúp người đọc tiếp cận những kiến thức mới mà còn giúp mở rộng tầm nhìn và phát triển bản thân. Tủ sách kiến thức kinh tế mong muốn lan tỏa tri thức trong lĩnh vực kinh doanh, đồng thời phát triển văn hóa đọc cho người Việt.  Thủ tướng đề nghị COMAC thúc đẩy mua bán, cho thuê máy bay Thủ tướng khẳng định Việt Nam đang tiếp tục hoàn thiện thể chế, cơ chế, chính sách thuận lợi hơn, cắt giảm thủ tục để phát triển ngành hàng không.  Thủ tướng đề nghị tập đoàn Mỹ hỗ trợ đào tạo 100.000 kỹ sư bán dẫn, AI Thủ tướng mời lãnh đạo Cisco tới thăm Việt Nam trong thời gian sớm nhất để bàn hợp tác, trong đó có hỗ trợ, đào tạo cho Việt Nam 100.000 nhân lực bán dẫn và AI trong 5 năm tới.  Thủ tướng đề nghị Foxconn xây nhà máy chip tại Việt Nam Thủ tướng Phạm Minh Chính đặc biệt đề nghị Tập đoàn Foxconn chuyển giao công nghệ và xây dựng nhà máy sản xuất chip bán dẫn tại Việt Nam."
ZNews,https://znews.vn/dung-hon-30-phut-dai-200-m-moi-tinh-la-un-tac-giao-thong-post1563943.html,Kinh doanh,Null,"Thứ năm, 26/6/2025 20:09 (GMT+7)","Dừng hơn 30 phút, dài 200 m mới tính là ùn tắc giao thông","Tình trạng ùn tắc giao thông hiện nay đang được Sở Xây dựng TP.HCM theo dõi qua số lần đăng tin cảnh báo xe đông, đi chậm. Ảnh:Quỳnh Danh. Chiều 26/6, tại cuộc họp báo kinh tế và xã hội TP.HCM, ông Nguyễn Kiên Giang, Phó trưởng Phòng quản lý bảo trì và khai thác công trình giao thông (Sở Xây dựng TP.HCM) đã lý giải cụ thể về định nghĩa ùn tắc giao thông. Theo ông Giang, tình trạng ùn tắc giao thông hiện nay đang được Sở Xây dựng TP.HCM theo dõi qua số lần đăng tin cảnh báo xe đông, đi chậm trên cổng thông tin giao thông TP và các điểm nguy cơ ùn tắc giao thông. Ông Giang cho biết TP.HCM đang dựa vào 3 tiêu chí để xác định tình trạng ùn tắc, bao gồm: Vận tốc trung bình của dòng xe dưới 5 km/h (nghĩa là chậm hơn cả người đi bộ), thời gian dừng kéo dài hơn 30 phút và chiều dài dòng xe dừng từ 200 m trở lên. Theo đó, hệ thống camera giám sát được chia sẻ về Trung tâm điều hành giao thông đô thị sẽ là cơ sở để đánh giá, cảnh báo. Tuy nhiên, TP hiện không phân loại mức độ ùn tắc nghiêm trọng hay không nghiêm trọng. Đối với các điểm dễ xảy ra ùn tắc, TP xác lập dựa trên vị trí hạ tầng dễ bị ảnh hưởng khi có sự cố, tai nạn hoặc khi lượng xe tăng cao như các dịp lễ Tết, lưu lượng giao thông lớn, tình hình giao thông phức tạp diễn ra thường xuyên... Theo ông Giang, đầu năm nay, trên địa bàn TP có 23 điểm nguy cơ. Đến tháng 6, đã có 5 điểm chuyển biến tốt và 9 điểm có dấu hiệu cải thiện nhưng tình hình còn phức tạp. Ông Giang cũng cho biết theo Thông tư 41/2024 của Bộ Giao thông Vận tải, ""điểm đen tai nạn giao thông"" được gọi chính thức là ""điểm hay xảy ra tai nạn giao thông đường bộ"". Trong 6 tháng đầu năm nay, TP.HCM đã xóa được 2 điểm đen và hiện còn 1 điểm tồn tại tại cầu Kênh Một Tấn trên đường Võ Chí Công (TP Thủ Đức). Cũng theo báo cáo mới đây của Sở Xây dựng TP.HCM, từ đầu năm đến nay, TP không ghi nhận tình trạng ùn tắc giao thông theo các tiêu chí nêu trên, ngoại trừ một vụ ùn ứ giao thông do xảy ra va chạm giữa 3 ôtô ở TP Thủ Đức. Sự cố khiến đoạn Quốc lộ 1 từ cầu vượt Sóng Thần đến ngã tư Bình Phước bị kẹt xe cục bộ. Tuy nhiên, Phòng cảnh sát giao thông đã kịp cử lực lượng đến hiện trường, phân luồng, điều tiết, không để tình trạng kéo dài hay gây phức tạp thêm. Tri Thức - Znewsgiới thiệu độc giảTủ sách kiến thức kinh tếvới đa dạng cuốn sách, câu chuyện trong lĩnh vực kinh doanh, kinh tế. Là nguồn tư liệu cho những người quan tâm và muốn nâng cao kiến thức trong lĩnh vực kinh tế. Những cuốn sách, câu chuyện trong Tủ sách không chỉ đơn thuần là những tác phẩm của tri thức mà còn chứa đựng bí quyết, kinh nghiệm quý báu từ các tác giả, nhà quản lý có uy tín và kinh nghiệm lâu năm trong ngành. Đọc sách không chỉ giúp người đọc tiếp cận những kiến thức mới mà còn giúp mở rộng tầm nhìn và phát triển bản thân. Tủ sách kiến thức kinh tế mong muốn lan tỏa tri thức trong lĩnh vực kinh doanh, đồng thời phát triển văn hóa đọc cho người Việt.  Hàng quán chỉ nhận tiền mặt có thể bị xử lý vi phạm, truy thu thuế Chi cục Thuế khu vực 2 cho biết đã ban hành văn bản chỉ đạo các đội thuế địa phương tiến hành rà soát những hộ kinh doanh chỉ nhận tiền mặt, nếu phát hiện trốn thuế sẽ xử lý nghiêm.  Trường hợp nào được miễn giấy phép xây dựng ở TP.HCM từ 1/7? TP.HCM dự kiến công bố danh sách dự án được miễn giấy phép xây dựng từ 1/7, trong đó tập trung nhiều nhất ở quận 7, Nhà Bè, Bình Chánh và TP Thủ Đức.  TP.HCM, Bình Dương, Bà Rịa - Vũng Tàu kết hợp vận hành thử mô hình mới TP.HCM phối hợp Bình Dương và Bà Rịa - Vũng Tàu vận hành thử mô hình chính quyền địa phương 2 cấp tại 168 điểm cầu, chuẩn bị cho việc sáp nhập và tổ chức bộ máy mới."
ZNews,https://znews.vn/gia-tang-trai-nghiem-gan-ket-tan-huong-uu-dai-cung-he-sinh-thai-pvone-post1563895.html,Kinh doanh,Null,"Thứ năm, 26/6/2025 20:00 (GMT+7)","Gia tăng trải nghiệm gắn kết, tận hưởng ưu đãi cùng hệ sinh thái PVOne","Theo đó, khách hàng có thể thoải mái tặng điểm PVOne cho người thân, bạn bè, đối tác… trên cùng hệ sinh thái PVConnect. Đây là tính năng được Ngân hàng TMCP Đại Chúng Việt Nam (PVcomBank) thiết kế với mục đích gia tăng thêm tinh thần gắn kết, đồng thời giúp người nhận điểm PVOne có cơ hội đổi về nhiều phần quà thiết thực, đa dạng theo nhu cầu. PvcomBank triển khai nhiều chương trình gia tăng trải nghiệm khách hàng trong thời gian qua. Đặc biệt, trong khoảng thời gian từ ngày 25/6 đến hết 25/8, khách hàng sử dụng tính năng tặng điểm PVOne trên PVConnect còn được hưởng thêm ưu đãi hoàn điểm thưởng bằng đúng số điểm đã tặng - tối đa lên đến 100.000 điểm PVOne/giao dịch tặng điểm. Ngoài ra, khách hàng cũng có thể được hoàn điểm thưởng PVOne tới 3 lần trong thời gian diễn ra chương trình. Thông qua hệ sinh thái quà tặng đa dạng dành cho những khách hàng thân thiết, người dùng PVConnect có thể sử dụng điểm thưởng PVOne đã tích lũy để đổi về nhiều phần quà hấp dẫn, bao gồm: Quà tặng tài chính (tiền mặt; miễn phí thường niên thẻ tín dụng…); quà tặng hiện vật (đồ công nghệ, chăm sóc sức khỏe…); các loại e-voucher (đa dạng lĩnh vực mua sắm, ẩm thực, du lịch, thẩm mỹ…); quà đối tác (trải nghiệm phòng chờ sân bay PVcomBank Premier Lounge) hoặc quà từ thiện ủng hộ Quỹ học bổng Thắp sáng niềm tin. Năm 2024, PVcomBank cũng triển khai thành công tính năng tặng quà e-voucher đối với chương trình khách hàng thân thiết PVOne, cho phép khách hàng chủ động đổi quà trên hệ thống và gửi tặng tới người thân, bạn bè ngay trên PVConnect hoặc các kênh mạng xã hội. Việc Ngân hàng liên tục mở rộng, phát triển thêm các tiện ích tặng điểm/quà PVOne trên nền tảng PVConnect không chỉ giúp khách hàng chủ động gắn kết với nhau thông qua hệ sinh thái số của PVcomBank, mà còn góp phần gia tăng chất lượng trải nghiệm người dùng. Song song với những chương trình ưu đãi hấp dẫn, vừa mang tính gắn kết, vừa tối ưu lợi ích cho người dùng, quá trình trải nghiệm hệ sinh thái PVConnect cũng trở nên thú vị hơn nhờ những tính năng, tiện ích hiện đại. Khách hàng của PVcomBank có thể dễ dàng tìm thấy những giải pháp phù hợp - đáp ứng trọn vẹn nhu cầu tài chính các nhân, từ các giao dịch hàng ngày (thanh toán hóa đơn tiền điện tự động, thanh toán các loại hóa đơn sinh hoạt); dịch vụ tài chính phục vụ cuộc sống (mua sắm hoàn tiền không giới hạn; chuyển tiền quốc tế online; đặt VNPAY Taxi; đặt vé máy bay/đặt phòng khách sạn) cho đến những tiện ích thông minh trên nền tảng số (quỹ hội nhóm; tính năng thông báo biến động số dư bằng giọng nói; tính năng thay đổi hạn mức thẻ)… Chương trình tích điểm PVOne được PVcomBank triển khai thường niên, cho phép khách hàng dễ dàng tích lũy điểm thưởng thông qua việc sử dụng các sản phẩm, dịch vụ tài chính tại ngân hàng như: Chi tiêu thẻ tín dụng; duy trì số dư tài khoản thanh toán; gửi tiết kiệm; bảo hiểm… với cơ chế tích điểm hấp dẫn theo giá trị giao dịch. Ngân hàng TMCP Đại Chúng Việt Nam (PVcomBank) Website: pvcombank.com.vn Facebook: facebook.com/PVcomBankFanpage  PVcomBank ra mắt thẻ tín dụng phi vật lý 14:00 24/4/202514:0024/4/2025Kinh doanhKinh doanh 0 Với mong muốn nâng cao chất lượng trải nghiệm thanh toán cho người dùng, PVcomBank ra mắt thẻ tín dụng quốc tế phi vật lý mới - PVcomBank Home.  ĐHĐCĐ PVcomBank: Chuyển đổi số, nâng cao trải nghiệm khách hàng 13:16 19/4/202513:1619/4/2025Doanh nghiệp tự giới thiệuKinh doanh 0 Ngày 18/4 tại Quảng Ninh, Ngân hàng TMCP Đại Chúng Việt Nam (PVcomBank) đã tổ chức thành công Đại hội đồng Cổ đông (ĐHĐCĐ) thường niên năm 2025.  PVcomBank ra mắt dòng thẻ đồng thương hiệu Napas và Mastercard 17:00 20/5/202517:0020/5/2025Kinh doanhTài chính - Chứng khoán 0 Ngân hàng TMCP Đại Chúng Việt Nam (PVcomBank) là một trong 6 ngân hàng tiên phong phát hành dòng thẻ đồng thương hiệu NAPAS và Mastercard."
ZNews,https://znews.vn/ong-jonathan-hanh-nguyen-va-gia-dinh-muon-tien-de-ra-tien-o-sasco-post1563964.html,Kinh doanh,Null,"Thứ năm, 26/6/2025 21:44 (GMT+7)",Ông Jonathan Hạnh Nguyễn và gia đình muốn 'tiền đẻ ra tiền' ở Sasco,"Ông Jonathan Hạnh Nguyễn trấn an cổ đông về hoạt động kinh doanh và dòng tiền của Sasco. Ảnh:SAS. CTCP Dịch vụ Hàng không Sân bay Tân Sơn Nhất - Sasco (UPCoM: SAS) vừa tổ chức Đại hội đồng cổ đông thường niên 2025. Cổ đông thông qua phương án trả cổ tức năm 2024 với tỷ lệ hơn 28% bằng tiền, tương ứng 2.809 đồng/cổ phiếu, là mức cao nhất từ trước đến nay. Tổng số tiền dự kiến chi thực hiện quyền cổ đông là375 tỷ đồng. Tổng công ty Cảng hàng không Việt Nam (ACV), cổ đông lớn nhất khi sở hữu 49% vốn Sasco, sẽ nhận184 tỷ đồngcổ tức. Nhóm cổ đông liên quan đến gia đình ông Johnathan Hạnh Nguyễn đang nắm hơn 46,5% vốn nhận khoảng176 tỷ đồng. Công ty đã tạm ứng đợt 1, tỷ lệ 6% vào cuối năm 2024. Số còn lại hơn 22%, dự kiến được chia trả đợt 2 theo quy định. ""Mục tiêu của chúng tôi là bảo vệ quyền lợi cổ đông. Bao giờ tôi còn làm Chủ tịch, còn ngồi đây thì anh em vẫn có thể nở nụ cười"", ông Johnathan Hạnh Nguyễn, Chủ tịch HĐQT Sasco cho biết. Vị lãnh đạo bày tỏ mong muốn có thể chứng kiến 30 năm phát triển tiếp theo của Sasco. Ông đùa rằng ""sẽ cố sống đến 105 tuổi, dù ngồi trên chiếc xe lăn cũng vẫn ngồi để đồng hành với sự tăng trưởng của doanh nghiệp"". Theo phương án phân phối lợi nhuận, Sasco chỉ giữ lại khoảng6 tỷ đồngsau khi trích lập các quỹ và chia cổ tức. Một số cổ đông lo ngại phân phối hết lợi nhuận khiến công ty khó đủ nguồn vốn đầu tư cho các dự án lớn trong giai đoạn thị trường hàng không có nhiều chuyển dịch. Ông Johnathan Hạnh Nguyễn trấn an cổ đông yên tâm về dòng tiền và hoạt động kinh doanh của Sasco. Ông cho biết cá nhân và công ty gia đình đều góp tiền vào đây và luôn tìm cách để ""tiền đẻ ra tiền"", sinh lời cho công ty và cổ đông. Năm nay, công ty đặt mục tiêu doanh thu thuần3.183 tỷ đồng, lợi nhuận trước thuế555 tỷ đồng, tăng lần lượt 3% và 10% so với thực hiện năm trước. Kế hoạch tăng trưởng được xây dựng trên cơ sở sản lượng hành khách dự báo năm 2025 tại Tân Sơn Nhất theo số liệu của ACV, với tổng sản lượng khách ước đạt 42 triệu lượt, tăng 5% so với năm 2024. Đặc biệt, nhà ga quốc nội T3 đi vào hoạt động từ tháng 4 đã mở ra không gian dịch vụ mới, đồng thời tạo áp lực cạnh tranh cao hơn. Bên cạnh đó, một trong những kế hoạch trọng tâm của doanh nghiệp năm nay là tập trung nguồn lực phát triển hệ sinh thái dịch vụ tại sân bay Long Thành. Dù phải chia sẻ thị phần với nhiều đơn vị khác, ban lãnh đạo Sasco cho rằng với quy mô thị trường lớn hơn, doanh số tuyệt đối đem về cũng sẽ lớn hơn đáng kể. Quyền lợi của cổ đông Nhà nước vẫn đặt lên hàng đầu. Công ty xác lập chiến lược mở rộng hợp tác với các đối tác quốc tế, mở rộng chuỗi cung ứng dịch vụ; tích hợp nền tảng bán lẻ trực tuyến, đa dạng hóa nguồn hàng và áp dụng chính sách bán hàng linh hoạt. Tri Thức - Znewsgiới thiệu độc giảTủ sách kiến thức kinh tếvới đa dạng cuốn sách, câu chuyện trong lĩnh vực kinh doanh, kinh tế. Là nguồn tư liệu cho những người quan tâm và muốn nâng cao kiến thức trong lĩnh vực kinh tế. Những cuốn sách, câu chuyện trong Tủ sách không chỉ đơn thuần là những tác phẩm của tri thức mà còn chứa đựng bí quyết, kinh nghiệm quý báu từ các tác giả, nhà quản lý có uy tín và kinh nghiệm lâu năm trong ngành. Đọc sách không chỉ giúp người đọc tiếp cận những kiến thức mới mà còn giúp mở rộng tầm nhìn và phát triển bản thân. Tủ sách kiến thức kinh tế mong muốn lan tỏa tri thức trong lĩnh vực kinh doanh, đồng thời phát triển văn hóa đọc cho người Việt.  Thủ tướng đề nghị COMAC thúc đẩy mua bán, cho thuê máy bay Thủ tướng khẳng định Việt Nam đang tiếp tục hoàn thiện thể chế, cơ chế, chính sách thuận lợi hơn, cắt giảm thủ tục để phát triển ngành hàng không.  Gia đình ông Johnathan Hạnh Nguyễn sắp nhận 174 tỷ đồng cổ tức Nhóm cổ đông liên quan đến gia đình ông Johnathan Hạnh Nguyễn (đang nắm hơn 46,5% vốn) nhận khoảng 174 tỷ đồng cổ tức từ Sasco.  Doanh nghiệp dịch vụ hàng không nhà ông Hạnh Nguyễn lãi đậm Đà phục hồi mạnh mẽ của các thị trường trọng điểm, đặc biệt là Trung Quốc đã đóng góp đáng kể vào kết quả kinh doanh tích cực của Sasco."
ZNews,https://znews.vn/thu-tuong-de-nghi-comac-thuc-day-mua-ban-cho-thue-may-bay-post1563951.html,Kinh doanh,Null,"Thứ năm, 26/6/2025 20:18 (GMT+7)","Thủ tướng đề nghị COMAC thúc đẩy mua bán, cho thuê máy bay","Chủ tịch Tập đoàn COMAC Shen Bo đề nghị phía Việt Nam tiếp tục tạo điều kiện cho việc khai thác tàu bay COMAC. Ảnh:VGP/Nhật Bắc. Tiếp tục chương trình tham dự Hội nghị thường niên các nhà tiên phong lần thứ 16 của Diễn đàn Kinh tế thế giới và làm việc tại Trung Quốc, chiều 26/6, tại thành phố Thượng Hải, Thủ tướng Phạm Minh Chính đã tiếp lãnh đạo Tập đoàn Máy bay thương mại Trung Quốc (COMAC). TheoBáoChính phủ, tại cuộc tiếp, ông Shen Bo, Tổng giám đốc Tập đoàn cho biết, COMAC được thành lập nhằm mục tiêu phát triển ngành hàng không thương mại của Trung Quốc, nổi tiếng với dòng tàu bay C919 và đang phát triển mẫu tàu bay ARJ21. Ngoài ra, doanh nghiệp còn riển khai dự án tàu bay thân rộng C929, với tổng mức đầu tư dự kiến lên đến20 tỷ USD. Tin tưởng dưới sự chỉ đạo của lãnh đạo hai nước, hợp tác hàng không giữa hai nước sẽ ngày càng tốt đẹp, Chủ tịch Tập đoàn COMAC đề nghị phía Việt Nam tiếp tục tạo điều kiện cho việc khai thác tàu bay COMAC; hỗ trợ hợp tác giữa Vietjet và COMAC… Bên cạnh đó là mở rộng hợp tác trong các lĩnh vực khác như bảo dưỡng, sửa chữa máy bay, chế tạo, sản xuất thiết bị, phụ tùng… Thủ tướng đánh giá cao thành tựu nghiên cứu, phát triển các dòng máy bay thương mại hiện đại của COMAC, góp phần đa dạng hóa thị trường cung cấp máy bay thương mại hiện đại, đóng góp vào sự phát triển của ngành hàng không và thành tựu khoa học công nghệ cao của Trung Quốc. Thủ tướng cũng chúc mừng quan hệ thương mại bước đầu của COMAC với các hãng hàng không Việt Nam, đây là cơ sở để hợp tác lâu dài. Việt Nam đang tiếp tục hoàn thiện thể chế, cơ chế, chính sách thuận lợi hơn, cắt giảm thủ tục để phát triển ngành hàng không, trong đó có khuyến khích sự tham của các thành phần kinh tế, phân cấp, phân quyền nhiều hơn cho các chủ thể liên quan. Để hợp tác lâu dài, bền vững, Thủ tướng hoan nghênh và đề nghị COMAC hợp tác với các đối tác Việt Nam sớm triển khai dịch vụ bảo dưỡng, sửa chữa máy bay. Đồng thời, thúc đẩy các hợp đồng mua bán, thuê máy bay với các hãng hàng không; hợp tác đào tạo nhân lực; cũng như hợp tác trên các lĩnh vực khác mà hãng có thế mạnh; tinh thần là hợp tác thấp đến cao, từ đơn giản đến phức tạp, ngày càng chặt chẽ, hiệu quả hơn, cùng có lợi. Tri Thức - Znewsgiới thiệu độc giảTủ sách kiến thức kinh tếvới đa dạng cuốn sách, câu chuyện trong lĩnh vực kinh doanh, kinh tế. Là nguồn tư liệu cho những người quan tâm và muốn nâng cao kiến thức trong lĩnh vực kinh tế. Những cuốn sách, câu chuyện trong Tủ sách không chỉ đơn thuần là những tác phẩm của tri thức mà còn chứa đựng bí quyết, kinh nghiệm quý báu từ các tác giả, nhà quản lý có uy tín và kinh nghiệm lâu năm trong ngành. Đọc sách không chỉ giúp người đọc tiếp cận những kiến thức mới mà còn giúp mở rộng tầm nhìn và phát triển bản thân. Tủ sách kiến thức kinh tế mong muốn lan tỏa tri thức trong lĩnh vực kinh doanh, đồng thời phát triển văn hóa đọc cho người Việt.  Thủ tướng đề nghị COMAC làm trung tâm bảo dưỡng máy bay ở Việt Nam Thủ tướng đề nghị Tập đoàn COMAC hợp tác, hỗ trợ các doanh nghiệp Việt Nam phát triển đội tàu bay, mở rộng các đường bay quốc tế.  Trung Quốc hé lộ C949, máy bay thương mại siêu thanh tốc độ 2.000 km/h Các kỹ sư Comac vừa công bố thiết kế máy bay vượt âm Mach 1,6 (tốc độ 1.960 km/h), với tầm bay xa hơn và vận hành êm hơn đáng kể so với Concorde đã ngừng hoạt động.  Cục Hàng không đề xuất công nhận máy bay Comac của Trung Quốc Điều này sẽ tạo thuận lợi cho hoạt động hàng không dân dụng tại Việt Nam trong bối cảnh thiếu hụt tàu bay, khó khăn trong việc mở rộng đội bay, đường bay."
