Source,URL,Category,Keyword,Time,Title,Content
ZNews,https://znews.vn/tap-doan-danh-khoi-doi-ten-de-lam-nong-nghiep-y-te-post1563395.html,Kinh doanh,Null,"Thứ ba, 24/6/2025 19:29 (GMT+7)","Tập đoàn Danh Khôi đổi tên để làm nông nghiệp, y tế","Từ năm nay, Danh Khôi sẽ tham gia vào hai lĩnh vực mới là nông nghiệp và y tế. Ảnh:NRC. Tại Đại hội đồng cổ đông thường niên 2025 chiều 24/6, ông Lê Thống Nhất - Chủ tịch HĐQT CTCP Tập đoàn Danh Khôi (HNX: NRC) cho biết doanh nghiệp sẽ hiện thực hóa các khoản đầu tư trong hai quý cuối năm, với tổng giá trị ước tính 400-500 tỷ đồng. Mục tiêu nhằm xử lý triệt để vấn đề thuế, đảm bảo kinh doanh có lãi, không còn lỗ. Tuy nhiên, các thông tin cụ thể sẽ được công ty giải trình sau. Theo vị chủ tịch này, từ năm nay trở đi, bên cạnh bất động sản, Danh Khôi sẽ tham gia vào hai lĩnh vực mới là nông nghiệp và y tế. ""Nói là mới nhưng thực tế chúng tôi đã có khoảng 3 năm tham gia tìm hiểu và nghiên cứu. Giờ là thời điểm chín muồi để tham gia vào hai lĩnh vực này. Tuy nhiên, chúng tôi vẫn thận trọng, với doanh thu đóng góp khoảng 30% vào tổng doanh thu trong năm. Hai quý cuối năm nay bắt đầu sẽ ghi nhận doanh thu"", ông Nhất chia sẻ. Với bất động sản, ông khẳng định đây vẫn là ngành cốt lõi của doanh nghiệp. Nửa cuối năm nay, Danh Khôi sẽ ký kết hợp tác với 4 chủ đầu tư phát triển 4-5 dự án ở Nha Trang, Bình Dương, Bình Định, Bình Phước với doanh thu khoảng600 tỷ đồng. ""Các dự án này đã chuẩn chỉnh về pháp lý và chúng tôi tin tưởng đạt được thanh khoản tốt"", Chủ tịch HĐQT bổ sung. Năm nay, Danh Khôi đặt kế hoạch doanh thu đạt959 tỷ đồng, lợi nhuận trước thuế25 tỷ đồng. Trong đó, bất động sản dự kiến đóng góp 68% (650 tỷ đồng), nông nghiệp công nghệ cao 21% (204 tỷ đồng) và y tế/dược phẩm 11% (105 tỷ đồng). Ông Trịnh Văn Bảo, Phó tổng giám đốc công ty cho biết ở mảng lương thực và nông nghiệp, công ty tập trung vào sản phẩm gạo, vật tư nông nghiệp và nông sản công nghệ cao. Trong khi đó, ở bất động sản, Danh Khôi sẽ lựa chọn các dự án có tiềm năng để nhận chuyển nhượng, có thể tự triển khai hoặc liên kết đầu tư theo nhiều loại hình sản phẩm, từ nhà ở thấp tầng, cao tầng, nhà ở xã hội, trung tâm thương mại... Hiện, công ty đang có kế hoạch mở bán dự án Trinifi tại Thành phố mới Bình Dương trong quý III và mở bán dự án The Welltone Luxury Residence tại Nha Trang trong quý III-IV/2025. Đáng chú ý, HĐQT trình đại hội phương án đổi tên công ty từ ""CTCP Tập đoàn Danh Khôi"" thành ""CTCP Tập đoàn NRC"" (NRC Corp), nhằm phù hợp với chiến lược phát triển đa ngành. Ban lãnh đạo kỳ vọng chiến lược đa ngành cùng kế hoạch huy động vốn sẽ giúp doanh nghiệp tái cấu trúc, vượt qua khó khăn và từng bước phục hồi. Tại đại hội, NRC cũng trình đề xuất hủy phương án phát hành cổ phiếu riêng lẻ từng được thông qua năm 2024, do điều kiện kinh tế và thị trường chưa thuận lợi. Thay vào đó, Danh Khôi sẽ chào bán gần 92,6 triệu cổ phiếu riêng lẻ với giá 10.000 đồng/cổ phiếu, để nâng vốn điều lệ từ 926 tỷ lên gần1.852 tỷ đồng. Với số tiền huy động dự kiến hơn925 tỷ đồng, công ty dùng337 tỷ đồngđể nhận chuyển nhượng 33,76 triệu cổ phần tại Tập đoàn Đầu tư Chăm sóc Sức khỏe Xuất sắc Việt Nam; 300 tỷ đầu tư vào dự án The Welltone Luxury Residence tại Nha Trang và phần còn lại dùng để thanh toán nợ trái phiếu, vay ngân hàng, bổ sung vốn lưu động. Tri Thức - Znewsgiới thiệu độc giảTủ sách kiến thức kinh tếvới đa dạng cuốn sách, câu chuyện trong lĩnh vực kinh doanh, kinh tế. Là nguồn tư liệu cho những người quan tâm và muốn nâng cao kiến thức trong lĩnh vực kinh tế. Những cuốn sách, câu chuyện trong Tủ sách không chỉ đơn thuần là những tác phẩm của tri thức mà còn chứa đựng bí quyết, kinh nghiệm quý báu từ các tác giả, nhà quản lý có uy tín và kinh nghiệm lâu năm trong ngành. Đọc sách không chỉ giúp người đọc tiếp cận những kiến thức mới mà còn giúp mở rộng tầm nhìn và phát triển bản thân. Tủ sách kiến thức kinh tế mong muốn lan tỏa tri thức trong lĩnh vực kinh doanh, đồng thời phát triển văn hóa đọc cho người Việt.  Tập đoàn bất động sản chỉ thu hơn 1 tỷ đồng suốt một quý kinh doanh Doanh thu khiêm tốn trong quý IV/2024 đã khiến Tập đoàn Danh Khôi báo lỗ ròng 63 tỷ đồng trong năm vừa qua, lượng tiền mặt đến cuối năm 2024 cũng chỉ còn 470 triệu đồng.  Danh Khôi dự kiến mua một phần dự án của đại gia Dũng 'lò vôi' Tập đoàn Danh Khôi muốn huy động 1.000 tỷ đồng từ việc chào bán cổ phiếu, trong đó dự kiến dùng 195 tỷ đồng để mua lại một phần dự án Khu dân cư Đại Nam Bình Phước.  Đàm phán với Nga, Nhật làm 2 dự án điện hạt nhân Ninh Thuận 2 giờ trước00:2025/6/2025Kinh doanhKinh doanh 0 Chính phủ yêu cầu đàm phán với Nga để ký hiệp định đầu tư nhà máy điện hạt nhân Ninh Thuận 1 trong tháng 8; làm việc với Nhật về khả năng tiếp tục hợp tác tại dự án Ninh Thuận 2."
ZNews,https://znews.vn/thu-tuong-de-nghi-ngan-hang-trung-quoc-tham-gia-trung-tam-tai-chinh-post1563431.html,Kinh doanh,Null,"Thứ ba, 24/6/2025 19:52 (GMT+7)",Thủ tướng đề nghị Ngân hàng Trung Quốc tham gia Trung tâm tài chính,"Thủ tướng Phạm Minh Chính tiếp ông Cát Hải Kiều, Chủ tịch HĐQT Ngân hàng Trung Quốc (BOC). Ảnh:VGP/Nhật Bắc. Chiều nay (24/6), Thủ tướng Phạm Minh Chính đã tiếp ông Cát Hải Kiều - Chủ tịch HĐQT Ngân hàng Trung Quốc (BOC). Sự kiện nằm trong chương trình công tác tham dự Hội nghị WEF Thiên Tân và làm việc tại Trung Quốc của Thủ tướng. Tại buổi gặp, Thủ tướng đánh giá cao vai trò của BOC trong hơn 30 năm qua tại Việt Nam trong phát triển kinh tế - xã hội. Người đứng đầuChính phủđề nghị ngân hàng mở rộng hoạt động tại Việt Nam, đồng thời hỗ trợ tái cấu trúc các định chế tài chính yếu kém. Thủ tướng cũng cho biết chính sách về trung tâm tài chính quốc tế tại Việt Nam sẽ rất thông thoáng. Ông đề nghị BOC chia sẻ kinh nghiệm, hỗ trợ kết nối các đối tác, nhà đầu tư, chuyên gia trong lĩnh vực tài chính để cùng tham gia xây dựng, vận hành và phát triển trung tâm tài chính tại Việt Nam. Về phía BOC, ngân hàng mong muốn đẩy mạnh hiện diện và đầu tư nguồn lực tại thị trường Việt Nam, sẵn sàng cung cấp dịch vụ tài chính toàn diện cho các dự án hạ tầng quy mô lớn. Ngân hàng Trung Quốc cũng cam kết thúc đẩy hợp tác tài chính và tiền tệ giữa hai nước, thanh toán xuyên biên giới, đóng góp vào quá trình xây dựng trung tâm tài chính quốc tế tại Việt Nam. BOC là ngân hàng hàng đầu với mức độ quốc tế hoá cao trong hệ thống ngân hàng Trung Quốc. Tính đến cuối năm 2023, ngân hàng có khoảng 12.000 chi nhánh tại Trung Quốc và 64 quốc gia, khu vực, với hơn 300.000 nhân viên. Chi nhánh đầu tiên tại Việt Nam được thành lập tại TP.HCM từ năm 1995. Ngân hàng này hiện hoạt động dưới tên Ngân hàng Trung Quốc (Hong Kong) - Chi nhánh TP.HCM, chuyên cung cấp tín dụng, thanh toán quốc tế, tài trợ thương mại và dịch vụ ngoại hối. Tri Thức - Znewsgiới thiệu độc giảTủ sách kiến thức kinh tếvới đa dạng cuốn sách, câu chuyện trong lĩnh vực kinh doanh, kinh tế. Những cuốn sách, câu chuyện trong Tủ sách không đơn thuần là những tác phẩm của tri thức mà còn chứa đựng bí quyết, kinh nghiệm quý báu từ các tác giả, nhà quản lý có uy tín và kinh nghiệm lâu năm trong ngành. Đọc sách không chỉ giúp tiếp cận những kiến thức mới mà còn giúp mở rộng tầm nhìn và phát triển bản thân. Tủ sách kiến thức kinh tế mong muốn lan tỏa tri thức trong lĩnh vực kinh doanh, đồng thời phát triển văn hóa đọc cho người Việt.  TP.HCM dự kiến rót gần 7 tỷ USD vào trung tâm tài chính quốc tế TP.HCM dự kiến đầu tư khoảng 172.000 tỷ đồng, tương đương gần 7 tỷ USD, để xây trung tâm tài chính quốc tế tại quận 1 và Thủ Thiêm.  Dành gần 1.000 ha đất xây trung tâm tài chính tại TP.HCM, Đà Nẵng TP.HCM dự kiến dành quỹ đất 600 ha quy hoạch trung tâm tài chính, trong khi Đà Nẵng cũng bố trí quỹ đất khoảng 350 ha gần cảng Liên Chiểu để phát triển trung tâm tài chính quốc tế.  Thủ tướng: Bảo đảm quyền tài sản tại trung tâm tài chính Thủ tướng Phạm Minh Chính vừa chủ trì cuộc họp tiếp tục thảo luận, cho ý kiến với dự thảo Nghị quyết của Quốc hội về xây dựng trung tâm tài chính quốc tế tại Việt Nam."
ZNews,https://znews.vn/xuat-khau-thuy-san-tang-truong-an-tuong-post1563378.html,Kinh doanh,Null,"Thứ ba, 24/6/2025 20:30 (GMT+7)",Xuất khẩu thủy sản tăng trưởng ấn tượng,"Hiệp hội Chế biến và Xuất khẩu Thủy sản Việt Nam (VASEP) cho biết trong 5 tháng đầu năm, tổng kim ngạch xuất khẩu thủy sản đạt trên4,34 tỷ USD, tăng 22% so với cùng kỳ 2024. Riêng tháng 5, kim ngạch xuất khẩu ghi nhận ở mức gần997 triệu USD, tăng 20%. Đáng chú ý, thị trường Mỹ là điểm nhấn với kim ngạch hơn234 triệu USDtrong tháng 5, tăng vọt 61% so với cùng kỳ - đây là mức tăng mạnh nhất trong số các thị trường lớn. ""Nguyên nhân chủ yếu đến từ 'khoảng trống' chính sách thuế khi từ ngày 9/4 đến 9/7, Mỹ áp dụng mức thuế tạm thời 10% đối với hàng hóa nhập khẩu từ Việt Nam, thấp hơn nhiều so với mức 46% được cảnh báo trước đó. Tranh thủ giai đoạn này, nhiều doanh nghiệp Việt đã tăng tốc giao hàng"", bà Lê Hằng, Phó tổng thư ký hiệp hội nhận định. Trong 5 tháng đầu năm, tôm tiếp tục là mặt hàng dẫn đầu với kim ngạch xuất khẩu hơn1,71 tỷ USD, tăng 32%. Riêng tháng 5, số liệu cho thấy xuất khẩu tôm đạt trên415 triệu USDvà là mức cao nhất kể từ đầu năm. Bên cạnh đó, cá tra cũng ghi nhận mức tăng tích cực 11% trong 5 tháng, trong đó riêng tháng 5 tăng mạnh 13%, trái ngược với mức tăng nhẹ chỉ 4% của tháng trước đó. Mặt hàng cá tra xuất khẩu sang Mỹ (vốn giảm mạnh trong tháng 4) đã phục hồi đến 35% vào tháng 5. Đây là minh chứng rõ ràng cho sự điều chỉnh linh hoạt về lịch giao hàng của các doanh nghiệp. Tương tự, cá ngừ cũng cho thấy tín hiệu phục hồi dù tốc độ có phần chậm hơn. Sau khi giảm nhẹ trong tháng 4, xuất khẩu cá ngừ đã tăng 7,6% trong tháng 5, nâng tổng kim ngạch 5 tháng lên hơn405 triệu USD, tăng 5%. Các nhóm sản phẩm khác như mực - bạch tuộc, cua ghẹ và nhuyễn thể có vỏ đều tăng trưởng mạnh, trong đó nhuyễn thể có vỏ đạt mức tăng tới 63%. Về phía thị trường, Mỹ là tâm điểm của biến động. Cụ thể, trong 5 tháng đầu năm, xuất khẩu sang thị trường này đạt774 triệu USD, tăng 27%. Tuy nhiên, mức tăng trưởng này chủ yếu mang tính thời điểm. Trong khi đó, EU và Nhật Bản ghi nhận mức tăng trưởng ổn định hơn, lần lượt 14% và 18% trong 5 tháng. Thị trường Trung Quốc vàHong Kong(Trung Quốc) tiếp tục là điểm tựa quan trọng, với mức tăng lên tới 50%, đặc biệt là các mặt hàng như tôm (tăng 90%) và nhuyễn thể có vỏ (tăng 285%). Tuy nhiên, đằng sau sự tăng trưởng ngắn hạn, ngành thủy sản Việt Nam đang phải đối mặt với thách thức lớn từ chính sách thuế của Mỹ. Theo VASEP, mức thuế đối ứng 46% nếu được áp dụng sẽ làm đội chi phí, tạo gánh nặng thuế chồng thuế và đẩy nhiều doanh nghiệp, đặc biệt là doanh nghiệp nhỏ, vào thế bấp bênh. Từ đó, các doanh nghiệp không chỉ mất đơn hàng mà còn có nguy cơ phá vỡ toàn bộ chuỗi cung ứng và làm gia tăng thất nghiệp cục bộ tại các địa phương có ngành sản xuất thủy sản. Mặt khác, các nước như Trung Quốc, Ấn Độ, Thái Lan hay các nhà sản xuất cá hồi Nam Mỹ cũng đang tìm cách ứng phó hoặc tranh thủ cơ hội thị phần. Dự báo, xuất khẩu thủy sản Việt Nam trong năm nay đang phụ thuộc lớn vào kịch bản thuế quan sau ngày 9/7. Nếu mức thuế giữ ở mức 10% hoặc được xoá bỏ, xuất khẩu thủy sản Việt Nam có thể vượt mốc10 tỷ USD. Trường hợp hàng hoá bị áp thuế lên đến 46%, tổng kim ngạch cả năm có thể giảm về mức9 tỷ USD, với nhiều rủi ro kéo dài. Xuất khẩu thủy sản Việt Nam đang thể hiện sự phục hồi mạnh mẽ và linh hoạt trong bối cảnh nhiều bất định. Tuy nhiên, VASEP đánh giá sự bền vững của tăng trưởng trong nửa cuối năm sẽ phụ thuộc rất lớn vào chính sách thương mại của Mỹ. Đây sẽ là biến số then chốt giúp định hình bức tranh thủy sản Việt Nam trong năm nay. Tri Thức - Znewsgiới thiệu độc giảTủ sách kiến thức kinh tếvới đa dạng cuốn sách, câu chuyện trong lĩnh vực kinh doanh, kinh tế. Là nguồn tư liệu cho những người quan tâm và muốn nâng cao kiến thức trong lĩnh vực kinh tế. Những cuốn sách, câu chuyện trong Tủ sách không chỉ đơn thuần là những tác phẩm của tri thức mà còn chứa đựng bí quyết, kinh nghiệm quý báu từ các tác giả, nhà quản lý có uy tín và kinh nghiệm lâu năm trong ngành. Đọc sách không chỉ giúp người đọc tiếp cận những kiến thức mới mà còn giúp mở rộng tầm nhìn và phát triển bản thân. Tủ sách kiến thức kinh tế mong muốn lan tỏa tri thức trong lĩnh vực kinh doanh, đồng thời phát triển văn hóa đọc cho người Việt.  Đề xuất giảm thuế nhập khẩu thủy sản Mỹ về 0% Hiệp hội Chế biến và Xuất khẩu thủy sản Việt Nam (VASEP) đề xuất giảm thuế nhập khẩu thủy sản Mỹ về 0%, trong bối cảnh Mỹ công bố mức thuế đối ứng mới cho hàng Việt Nam.  Xuất khẩu tôm hùm sang Trung Quốc tăng đột biến Theo Vasep, trong 2 tháng đầu năm nay, xuất khẩu tôm hùm của Việt Nam tăng vọt hơn 18 lần so với cùng kỳ 2023, trong đó xuất khẩu sang Trung Quốc đạt gần 30 triệu USD, tăng 27 lần.  Brazil dừng nhập cá rô phi Việt Nam, doanh nghiệp có bị ảnh hưởng? Theo Vasep, động thái dừng nhập khẩu cá rô phi Việt Nam của Brazil được xem là rào cản ban đầu đối với sản phẩm này của Việt Nam và có thể là các sản phẩm thủy sản khác."
ZNews,https://znews.vn/quan-chuc-fed-ung-ho-cat-giam-lai-suat-tu-thang-7-post1563418.html,Kinh doanh,Null,"Thứ ba, 24/6/2025 19:00 (GMT+7)",Quan chức Fed ủng hộ cắt giảm lãi suất từ tháng 7,"Phó chủ tịch phụ trách giám sát tại Fed Michelle Bowman ủng hộ việc hạ lãi suất. Ảnh:Reuters. Trong bài phát biểu tại Prague (Cộng hòa Séc) ngày 23/6, Phó chủ tịch phụ trách giám sát tại Cục Dự trữ liên bang Mỹ (Fed) Michelle Bowman cho rằng thuế quan của Tổng thốngDonald Trumpcó khả năng tác động tạm thời và hạn chế đến giá cả. Vì vậy, Mỹ cần “mở đường” cho việc hạ lãi suất, theoCNBC. ""Nếu áp lực lạm phát vẫn được kiểm soát, tôi sẽ ủng hộ việc hạ lãi suất ngay trong cuộc họp tháng sau để đưa lãi suất về mức trung lập và duy trì thị trường lao động lành mạnh"", bà cho biết trong bài phát biểu. Đồng thời, trong thời gian chờ đợi, bà sẽ tiếp tục theo dõi chặt chẽ khi các chính sách của chính quyền, nền kinh tế và thị trường tài chính tiếp tục có những biến chuyển. Cuối tuần trước, Thống đốc Fed Christopher Waller cũng cho rằng ngân hàng trung ương Mỹ có thể cân nhắc cắt giảm lãi suất vào tháng 7. Nhiều tháng qua, ông Trump đã liên tục thúc giục Fed phải giảm lãi suất để tiết kiệm chi phí tài chính cho khoản nợ quốc gia đang ngày càng lớn. Tuy nhiên, trong cuộc họp tuần trước, Ủy ban thị trường mở liên bang (FOMC) đã bỏ phiếu giữ nguyên mức lãi suất tham chiếu tại 4,25-4,5%. Cũng trong tuyên bố mới đây, bà Bowman ủng hộ cách tiếp cận mới, đồng thời lưu ý rằng sự bất ổn về chính sách đã giảm bớt và trọng tâm đang chuyển dần sang nguy cơ suy yếu của thị trường lao động. Các nhà kinh tế từng lo ngại rằng các mức thuế quan của ông Trump sẽ làm lạm phát tăng vọt. Tuy nhiên, đến nay, các số liệu cho thấy sự tác động ở mức rất nhỏ. Đồng thời, động thái từ chính quyền Tổng thống Donald Trump cũng trở nên “mềm mỏng” hơn, mở ra khả năng đàm phán với các đối tác thương mại lớn. “Tôi cho rằng tác động của thuế quan đối với lạm phát có thể mất nhiều thời gian cũng như gây nên tác động nhỏ hơn so với dự đoán ban đầu, đặc biệt khi nhiều doanh nghiệp đã chủ động trữ hàng tồn kho trước. Khi cân nhắc bước đi tiếp theo, chúng ta phải xem xét đến việc điều chỉnh lãi suất”, bà Bowman nói. Trên mạng xã hội Truth Social ngày 23/6, Tổng thống Mỹ lặp lại lời kêu gọi Fed giảm lãi thêm 2-3 điểm % vì Mỹ đang không có lạm phát. Tuy nhiên, phát biểu của bà Bowman không đề cập đến mức giảm cụ thể, trong khi ông Waller thì cho rằng không cần thiết phải cắt giảm sâu đến vậy. Tri Thức - Znewsgiới thiệu độc giảTủ sách kiến thức kinh tếvới đa dạng cuốn sách, câu chuyện trong lĩnh vực kinh doanh, kinh tế. Là nguồn tư liệu cho những người quan tâm và muốn nâng cao kiến thức trong lĩnh vực kinh tế. Những cuốn sách, câu chuyện trong Tủ sách không chỉ đơn thuần là những tác phẩm của tri thức mà còn chứa đựng bí quyết, kinh nghiệm quý báu từ các tác giả, nhà quản lý có uy tín và kinh nghiệm lâu năm trong ngành. Đọc sách không chỉ giúp người đọc tiếp cận những kiến thức mới mà còn giúp mở rộng tầm nhìn và phát triển bản thân. Tủ sách kiến thức kinh tế mong muốn lan tỏa tri thức trong lĩnh vực kinh doanh, đồng thời phát triển văn hóa đọc cho người Việt.  Ông Trump lại đe dọa sa thải Chủ tịch Fed vì không giảm lãi suất Thất vọng vì Fed không hạ lãi suất, ông Trump một lần nữa công kích Chủ tịch Fed Powell và ám chỉ sẽ chọn người kế nhiệm sớm, trong bối cảnh kinh tế Mỹ có nhiều dấu hiệu chững lại.  Fed giữ nguyên lãi suất, cảnh báo 'sốc' lạm phát do thuế quan Cục Dự trữ Liên bang Mỹ (Fed) quyết định giữ nguyên lãi suất tham chiếu trong phiên họp tháng 6, đồng thời cảnh báo nguy cơ lạm phát tăng đáng kể do chính sách thuế của ông Trump.  Ông Trump nói về 'ghế' Chủ tịch Fed tiếp theo Khi được hỏi về cựu Thống đốc Fed Kevin Warsh, Tổng thống Mỹ Donald Trump nói ông Warsh ""được đánh giá rất cao"" và là ứng cử viên hàng đầu cho vị trí Chủ tịch tiếp theo của Fed."
