Source,URL,Category,Keyword,Time,Title,Content
Tuoi tre,https://tuoitre.vn/nguoi-cha-di-hang-ngan-cay-so-tim-con-tim-thay-con-sau-hon-5-thang-20250613173916596.htm,Thời sự,"mất liên lạc,tìm con",13/06/2025 18:04 GMT+7,Người cha đi hàng ngàn cây số tìm con: Tìm thấy con sau hơn 5 tháng5,"Ông Nguyễn Văn Quyền trong một lần đi tìm con. Ngày 13-6, ông cho biết gia đình đã tìm thấy con - Ảnh do ông Nguyễn Văn Quyền cung cấp Ông Nguyễn Văn Quyền cho biết B. là con trai lớn trong nhà. B. rất thích đạp xe đi đó đây. Ông Quyền có lần hỏi B. ước mơ của con là gì, thì B. nói thích đạp xe trên quốc lộ 1 vào miền Nam. Tối 17-12-2024, ông Quyền không thấy B. về nhà, nên đi tìm kiếm tại nhiều nơi đều không thấy. Sau đó ông Quyền đã trình báo cơ quan chức năng. Trong hành trình tìm con, ông Quyền đã rong ruổi trên chiếc xe máy, vượt hàng ngàn cây số, đi qua nhiều tỉnh thành. Có lần ông đi đến tỉnh Bình Thuận, một lần khác ông đi đếnCà Mautìm con. Trên đường đi, ông ghé hỏi thăm thông tin về con, cũng nhờ một số người đăng thông tin lên mạng xã hội để tìm con. Mới đây một người quen của ông Quyền từ quê vào Vũng Tàu. Trên xe buýt từ Vũng Tàu đi Đồng Nai đã tình cờ gặp được B.. Nhận được tin, ông Quyền mừng rỡ nhờ người thân đón B., rồi ông mau chóng từ quê vào đón B. về. Qua hỏi thăm trò chuyện với con, ông Quyền biết được trong thời gian hơn 5 tháng rời khỏi nhà, B. đi nhiều nơi, làm một số công việc như bốc vác, phụ rửa chén để kiếm sống. Thời gian này, B. không biết được ông Quyền đi nhiều nơi để tìm mình. ""Nhân duyên lớn mới tìm được cháu, cảm ơn trời đất, cảm ơn mọi người đã quan tâm giúp đỡ. Mong con cảm nhận được tình thương từ gia đình để có quyết định chín chắn"", ông Quyền chia sẻ. Trước đó ngày 27-3,Tuổi Trẻ Onlineđã đưa tin về sự việc ông Quyền mất liên lạc với con trai kể từ ngày 17-12-2024. Sau khi đạp xe chở cháu nội đến trường, ông Trần Vệ không tìm được đường về nhà con trai nên đạp xe ra quốc lộ 1, rồi đi xe khách về nhà em ruột ở TP Phan Thiết (tỉnh Bình Thuận)."
Tuoi tre,https://tuoitre.vn/xac-minh-nguoi-dan-ong-cam-da-chan-dau-o-to-tren-cao-toc-van-phong-nha-trang-20250613162421134.htm,Thời sự,"Khánh Hòa,cao tốc,cao tốc Vân Phong - Nha Trang,nghiện hút,cảnh sát giao thông",13/06/2025 16:42 GMT+7,"Xác minh người đàn ông cầm đá, chặn đầu ô tô trên cao tốc Vân Phong - Nha Trang","Người đàn ông cầm đá, chặn đầu xe trên cao tốc Vân Phong - Nha Trang - Ảnh cắt từ clip Ngày 13-6, mạng xã hội Facebook lan truyền clip camera hành trình ghi lại hình ảnh một nam thanh niên tay cầm hòn đá đi bộ đến chặn đầu một ô tô đang chạy trêncao tốcVân Phong - Nha Trang. Anh N.L. (tài xế xe dịch vụ, người đăng tải clip camera hành trình) cho biết sự việc xảy ra vào lúc 7h27 sáng cùng ngày. Thời điểm này một người đàn ông đi bộ trên cao tốc Vân Phong - Nha Trang, đoạn qua xã Vạn Phú (huyện Vạn Ninh, tỉnh Khánh Hòa), hướng từ huyện Vạn Ninh vào TP Nha Trang. Theo anh L., lúc này người đàn ông nêu trên đã chặn xe, dọa ném đá, sau đó người này trèo qua dải phân cách vào làn còn lại, tiếp tục di chuyển giữa đường cao tốc. ""Lúc đó tôi khá hoảng sợ, may mắn không có xe nào đi cùng chiều phía sau, nếu không sẽ gặp nguy hiểm"", anh L. nói. Trao đổi vớiTuổi Trẻ Online, đại diện Đội tuần tra kiểm soát giao thông đường bộ cao tốc số 6 (Phòng 6, Cục Cảnh sát giao thông) cho biết đã nắm được thông tin sự việc nêu trên. Theo đại diện Đội tuần tra kiểm soát giao thông đường bộ cao tốc số 6, nhận định ban đầu, người đàn ông trên có dấu hiệunghiện hút. Hiện đơn vị đang phối hợp với Công an xã Vạn Phú (huyện Vạn Ninh) điều tra, xử lý vụ việc theo quy định. Một tài xế khi di chuyển trên cao tốc Nha Trang - Cam Lâm vào ngày 4-2 đã trích xuất camera hành trình và cho rằng một xe đã đi lùi trên tuyến cao tốc này, gây nguy hiểm cho xe còn lại."
Tuoi tre,https://tuoitre.vn/mien-ve-di-28-tuyen-xe-buyt-o-tp-hcm-cho-khach-thanh-toan-khong-tien-mat-ngay-16-6-2025061322233907.htm,Thời sự,"Sở Xây dựng,giao thông công cộng,MasterCard,miễn phí vé,xe buýt",13/06/2025 22:38 GMT+7,Miễn vé đi 28 tuyến xe buýt ở TP.HCM cho khách thanh toán không tiền mặt ngày 16-6,"Hành khách đi xe buýt thanh toán không tiền mặt sẽ được miễn phí vé vào ngày 16-6. Thời gian qua, TP.HCM tích cực đẩy mạnh thanh toán không tiền mặt khi đi lại bằng phương tiện công cộng - Ảnh: H.L. Trung tâm Quản lý giao thông công cộng (thuộc Sở Xây dựng TP.HCM) vừa phối hợp các đơn vị triển khai những hoạt động hưởng ứng chương trình""Ngày không tiền mặt năm 2025"". Chương trình được áp dụng cho hành khách không dùng tiền mặt khi đi lại bằng xe buýt trên địa bàn TP.HCM tiện lợi. Đây cũng là bước đẩy mạnh vận động người dân tích cực đi lại bằng phương tiện giao thông công cộng, góp phần hoàn thành mục tiêu chung của thành phố hạn chế xe cá nhân, kiểm soát khí thải, bảo vệ môi trường. Cụ thể, các đơn vịmiễn phí vé đặc biệt trongNgày không tiền mặt16-6khuyến khích và phổ biến hình thức thanh toán không tiền mặt trên 28 tuyến xe buýt với tổng số 514 phương tiện gồm: Công ty CP Xe khách Sài Gòn, Công ty CP Vận tải thành phố, Hợp tác xã vận tải số 26. Một số tuyến xe buýt như: tuyến số 6 (bến xe buýt Chợ Lớn - ĐH Nông Lâm); tuyến số 7 (bến xe buýt Chợ Lớn - Gò Vấp); tuyến số 10 (Đại học Quốc gia- bến xe Miền Tây); tuyến số 50 (Trường đại học Bách khoa - Đại học Quốc gia); tuyến số 103 (bến xe buýt Chợ Lớn - bến xe Ngã Tư Ga)... Trung tâm hướng dẫn hành khách lên xe sử dụng thẻ Mastercard/Visa (hoặc các ứng dụng thanh toán di động như Apple Pay/Google Pay có liên kết với thẻ Mastercard/Visa) thanh toán qua các thiết bị đầu đọc T10 thuộc hệ thống thu phí tự động GoAFC.  Thời gian áp dụng duy nhất trong ngày 16-6. Khách đi xe buýt lưu ý thẻ Mastercard/Visa phải là thẻ có hỗ trợ thanh toán không tiếp xúc (Contactless) qua NFC, bao gồm thẻ Prepaid, Debit và Credit.  Thẻ không nằm trong danh sách nợ vé xe buýt, phải đảm bảo còn hiệu lực và không bị khóa bởi ngân hàng phát hành. Hành khách chạm thẻ: ""Tap"" thẻ của bạn lên khu vực có biểu tượng thanh toán không tiếp xúc trên thiết bị thanh toán. Giữ thẻ: Chạm và giữ thẻ đúng vị trí. Xác nhận: Thiết bị sẽ phát âm thanh thông báo và màn hình hiển thị ""Đã thanh toán"". Đồng thời, máy in sẽ xuất vé giấy. Nhận vé: Nhận vé giấy và sẵn sàng cho chuyến đi của bạn. ""Khi chạm thẻ, thiết bị vẫn sẽ hiển thị thông báo thanh toán thành công và in vé.  Tùy thuộc vào ngân hàng phát hành, quý khách có thể nhận được hoặc không nhận được thông báo giao dịch. Nếu có, giao dịch sẽ hiển thị là 0 đồng/miễn phí. Trường hợp thẻ của quý khách nằm trong danh sách nợ vé xe buýt hoặc thẻ không còn hiệu lực, thiết bị sẽ hiện thông báo ""Thẻ bị từ chối"" và không thể thanh toán"", trung tâm cho hay. Trước đó, TP.HCM là địa phương đi đầu về áp dụng hệ thống vé điện tử trong giao thông công cộng. Dự kiến, trong quý 2-2025 sẽ hoàn thành triển khai đồng bộ thanh toán điện tử cho hơn 2.000 xe buýt đang hoạt động trên địa bàn. Đây là một bước tiến quan trọng trong việc hiện đại hóa hệ thống giao thông công cộng, phù hợp với công cuộc chuyển đổi số theo chủ trương Chính phủ. Hành khách đi lại bằng giao thông công cộng chỉ cần ""chạm"" thanh toán theo mô hình thanh toán EMV OpenLoop. Với mô hình này, hành khách dùng nhiều hình thức thanh toán khác nhau, bao gồm thẻ thanh toán nội địa và quốc tế; ví điện tử; và các phương thức thanh toán thông minh như Apple Pay và Google Pay. Ngoài chương trình miễn phí nói trên, còn có ưu đãi tặng 1 voucher (thẻ nạp card điện thoại mệnh giá 10.000 đồng). Theo đó, hành khách đi trên 40 tuyến xe buýt do Công ty CP xe khách Phương Trang Futabuslines đang đảm nhận thanh toán không tiền mặt trong ngày 16-6 cũng được ưu đãi. Lúc này, lái xe hoặc nhân viên phục vụ thay mặt nhà đồng hành (Mastercard Asia/Pacific Pte.Ltd) tặng trực tiếp 1 voucher là thẻ nạp card điện thoại mệnh giá 10.000 đồng cho hành khách.  Hành khách đi xe buýt, metro, buýt sông... ở TP.HCM có thể dùng thẻ 'chạm' thanh toán không tiền mặt nhanh chóng, thuận tiện."
Tuoi tre,https://tuoitre.vn/ly-do-khong-bau-ma-chi-dinh-nhan-su-chu-tich-tinh-thanh-sau-sap-nhap-20250613140522705.htm,Thời sự,"Chủ tịch,Phó chủ tịch UBND,Hiến pháp,sửa đổi Hiến pháp,sáp nhập tỉnh",13/06/2025 14:25 GMT+7,"Lý do không bầu mà chỉ định nhân sự chủ tịch tỉnh, thành sau sáp nhập","Tỉnh Bình Dương, Bà Rịa - Vũng Tàu sáp nhập với TP.HCM chuẩn bị vận hành chính quyền 2 cấp.  Trong ảnh: khu vực vòng xoay Cát Lái, TP Thủ Đức, TP.HCM - Ảnh: QUANG ĐỊNH Chiều 13-6, Quốc hội thảo luận ở hội trường lần 2 về dự thảo nghị quyết của Quốc hội sửa đổi, bổ sung một số điều củaHiến phápnăm 2013. Trước đó, Ủy ban dự thảo sửa đổi, bổ sung một số điều của Hiến pháp năm 2013 (Ủy ban dự thảo) đã có báo cáo giải trình, tiếp thu ý kiến của nhân dân, các ngành, các cấp và các đại biểu Quốc hội về dự thảo nghị quyết sửa đổi, bổ sung một số điều của Hiến pháp năm 2013. Quá trình thảo luận, lấy ý kiến việc sửa đổi một số điều của Hiến pháp, có ý kiến băn khoăn khi cho phép chỉ định các chức danh của UBND mà không đưa ra để HĐND bầu như bình thường. Lý giải về việc chỉ định nhân sự, Ủy ban soạn thảo cho biết quy định về việc chỉ định chỉ là ""giải pháp có tính chất tình thế"". Điều này tạo cơ sở pháp lý cho việc kịp thời kiện toàn và sớm ổn định tổ chức bộ máy của HĐND, UBND nhiệm kỳ 2021 - 2026 tại các đơn vị hành chính trên cả nước khi thực hiện sáp nhập cấp tỉnh, cấp xã và đồng loạt kết thúc hoạt động của 696 đơn vị cấp huyện. ""Việc chỉ định chỉ áp dụng từ nay đến khi tiến hành cuộc bầu cử đại biểu Quốc hội khóa XVI và đại biểu HĐND các cấp nhiệm kỳ 2026 - 2031. Sau đó, việc bầu các chức danh của HĐND và UBND lại thực hiện bình thường theo quy định của Hiến pháp và Luật Tổ chức chính quyền địa phương"", Ủy ban dự thảo nêu rõ. Nội dung này đã được thuyết minh, giải trình, làm rõ trong tờ trình và bản thuyết minh về dự thảo nghị quyết. Do đó, Ủy ban soạn thảo xin phép giữ quy định về việc chỉ định UBND tại dự thảo nghị quyết, để thể hiện đúng tính chất là điều khoản chuyển tiếp, thi hành Hiến pháp và chỉ áp dụng trong lần sắp xếp tổng thể đơn vị hành chính này. Cũng có ý kiến đề nghị giao thẩm quyền chỉ định trưởng các ban của HĐND cho thường trực HĐND; giao thẩm quyền chỉ định chủ tịch, phó chủ tịch UBND cấp xã cho chủ tịchUBND cấp tỉnhđể bảo đảm phù hợp với nguyên tắc quản lý hành chính. Về việc này, Ủy ban soạn thảo viện dẫn Luật Tổ chức chính quyền địa phương hiện hành và đang được sửa đổi thì cơ cấu thường trực HĐND gồm: chủ tịch, phó chủ tịch và trưởng các ban của HĐND. Do đó, nếu giao cho thường trực HĐND cùng cấp chỉ định trưởng các ban của HĐND thì không bảo đảm chặt chẽ, vì khi chỉ có chủ tịch, phó chủ tịch HĐND thì chưa đủ thành viên để có thể hợp thành thường trực HĐND. Về việc giao thẩm quyền chỉ định chủ tịch, phó chủ tịchUBND cấp xãcho chủ tịch UBND cấp tỉnh, Ủy ban soạn thảo tiếp tục khẳng định việc chỉ định các chức danh của HĐND, UBND chỉ được thực hiện trong thời gian còn lại của nhiệm kỳ 2021 - 2026 và chỉ áp dụng trong đợt sắp xếp đơn vị hành chính trong năm 2025. Hơn nữa, công tác lựa chọn, giới thiệu nhân sự khi chỉ định vẫn được tiến hành hết sức chặt chẽ và do cấp ủy có thẩm quyền quản lý cán bộ chịu trách nhiệm theo đúng quy định của Đảng. Nên để đơn giản hóa thủ tục hành chính, Ủy ban dự thảo đề nghị vẫn giao cho một đầu mối có thẩm quyền là thường trực HĐND cấp tỉnh thực hiện. Để tạo điều kiện thuận lợi cho Chính phủ, các bộ, ngành ở trung ương, địa phương có thêm thời gian, kịp thời triển khai thực hiện chủ trương sắp xếp, tinh gọn tổ chức bộ máy của hệ thống chính trị và tạo cơ sở pháp lý hiến định cho việc thực hiện mô hình chính quyền địa phương 2 cấp, sớm đưa tổ chức bộ máy của chính quyền địa phương chính thức đi vào hoạt động từ ngày 1-7, Ủy ban đề nghị xác định thời điểm có hiệu lực của nghị quyết từ ngày được Quốc hội thông qua (dự kiến 16-6). Chủ tịch nước sẽ thực hiện việc công bố nghị quyết này ngay trong ngày được Quốc hội thông qua để kịp thời thông tin rộng rãi về nội dung sửa đổi, bổ sung Hiến pháp đến đông đảo cử tri và nhân dân cả nước. Đồng thời, để bảo đảm đủ thời gian cho công tác chuyển giao nhiệm vụ, quyền hạn, đồng bộ với lộ trình sắp xếp đơn vị hành chính nói chung, đề nghị chỉnh lý quy định tại dự thảo nghị quyết theo hướng khẳng định các đơn vị hành chính cấp huyện trong cả nước kết thúc hoạt động từ ngày 1-7. Ủy ban dự thảo sửa đổi, bổ sung một số điều của Hiến pháp năm 2013 đã có lý giải về việc tại sao không giữ lại mô hình thành phố trực thuộc thành phố như Thủ Đức (TP.HCM) và Thủy Nguyên (Hải Phòng)."
Tuoi tre,https://tuoitre.vn/vu-nghi-ngo-doc-sau-khi-an-buffet-oc-o-phu-yen-xu-phat-nha-hang-24-trieu-dong-20250613140610912.htm,Thời sự,"y tế,nhà hàng,Phú Yên,ngộ độc thực phẩm,TP Tuy Hòa",13/06/2025 14:50 GMT+7,Vụ nghi ngộ độc sau khi ăn buffet ốc ở Phú Yên: Phạt nhà hàng 24 triệu đồng,"Nhà hàng Phố Đêm Vườn chi nhánh 3 bị xử phạt 24 triệu đồng - Ảnh: MINH CHIẾN Theo đó, Thanh traSở Y tếtỉnh Phú Yên ra quyết định xử phạt vi phạm hành chính đối với Công ty TNHH Phố Đêm Phú Yên, địa điểm kinh doanh là nhà hàng Phố Đêm Vườn chi nhánh 3 (phường 7, TP Tuy Hòa, Phú Yên). Doanh nghiệp nêu trên có các hành vi vi phạm hành chính gồm: nơi chế biến, kinh doanh, bảo quản có côn trùng, động vật gây hại xâm nhập; Thực hiện không đúng quy định của pháp luật về chế độ kiểm thực 3 bước; Không đảm bảo ngăn ngừa nhiễm chéo giữa thực phẩm chưa qua chế biến và thực phẩm đã qua chế biến trong bố trí bếp ăn; Cống, rãnh thoát nước thải khu vực nhà bếp bị ứ đọng. Căn cứ quy định xử phạt vi phạm hành chính trong lĩnh vực an toàn thực phẩm và quy định xử lý vi phạm hành chính trong lĩnh vực y tế, đồng thời áp dụng mức phạt gấp 2 lần đối với vi phạm là tổ chức theo quy định, Thanh tra Sở Y tế Phú Yênđã xử phạt Công ty TNHH Phố Đêm Phú Yên 24 triệu đồng. NhưTuổi Trẻ Onlineđã đưa tin, Sở Y tế tỉnh Phú Yên có báo cáo kết quả điều tra, giám sát nghi ngờ vụngộ độc thực phẩmvào tối 2-6 tại nhà hàng Phố Đêm Vườn chi nhánh 3.  Tại thời điểm điều tra, đoàn công tác không thu nhận được mẫu lưu thức ăn, vì khi phát hiện có các vụ ngộ độc thì thời gian đã 2 ngày, nên cơ sở không còn lưu mẫu thực phẩm cũng như các nguyên liệu có liên quan. Trung tâm Y tế thị xã Đông Hòa báo cáo kết thúc điều trị các trường hợp nghi ngờ ngộ độc thực phẩm, đơn vị đã chẩn đoán 7 trường hợp điều trị ra viện với mã bệnh viêm dạ dày - ruột và đại tràng do nguyên nhân nhiễm trùng và chưa xác định được nguồn gốc nhiễm trùng; hội chứng ruột kích thích, có tiêu chảy; buồn nôn và nôn. Căn cứ vào các nội dung điều tra và phân tích dịch tễ học nêu trên, Sở Y tế tỉnh Phú Yên cho rằng vụ việc nghi ngờ ngộ độc thực phẩm sau khi ăn các món ăn tự chọn tại nhà hàng Phố Đêm Vườn chi nhánh 3 vào tối 2-6, khách hàng có triệu chứng đau bụng, nôn mửa, tiêu chảy chưa đủ cơ sở để kết luận vụ ngộ độc thực phẩm. Theo ông Nguyễn Duy Hướng - trưởng Phòng nghiệp vụ y - dược của Sở Y tế tỉnh Phú Yên,  khi có yếu tố dịch tễ, tức là có một nhóm bệnh nhân nhập viện vì cùng ăn tại một cơ sở cung cấp thực phẩm tại cùng một thời điểm thì trong phác đồ điều trị phải có bước lấy mẫu bệnh phẩm để xác định có phải là do ngộ độc thực phẩm hay không. Tuy nhiên, Trung tâm Y tế thị xã Đông Hòa đã bỏ qua bước này vì đơn vị cho rằng không đủ điều kiện để thực hiện. Đến khi đoàn kiểm tra đến làm việc thì không còn mẫu bệnh phẩm nào để xét nghiệm. Vì không lấy được mẫu bệnh phẩm nên cơ quan chức năng chưa đủ cơ sở để xác định là ngộ độc thực phẩm. Lãnh đạo Sở Y tế đã kiểm điểm lãnh đạo Trung tâm Y tế thị xã Đông Hòa vì để xảy ra thiếu sót này. Liên quan đến vụ bệnh nhân nghi ngộ độc sau khi ăn buffet ốc tại quán Phố Đêm Vườn - chi nhánh 3 (phường 7, TP Tuy Hòa, Phú Yên), cơ quan chức năng đã có báo cáo kết quả kiểm tra quán ban đầu và phát hiện có vi phạm."
Tuoi tre,https://tuoitre.vn/them-2-vo-chong-tai-quang-binh-mat-tich-khi-di-bat-ca-trong-mua-lu-di-thuong-20250613124141834.htm,Thời sự,"Quảng Bình,Mất tích,mưa lũ,bị lũ cuốn,vợ chồng",13/06/2025 13:52 GMT+7,Thêm 2 vợ chồng tại Quảng Bình mất tích khi đi bắt cá trong mưa lũ dị thường,"Chính quyền và người dân địa phương tìm kiếm 2 vợ chồng mất tích dọc cửa biển - Ảnh: QUỐC NAM Trưa 13-6, UBND xã Nhân Trạch (huyện Bố Trạch, tỉnh Quảng Bình) xác nhận các lực lượng chức năng cùng người dân địa phương đang tổ chức tìm kiếm hai người bị mất tích khi đi bắt cá trên sông Dinh trongmưa lũ. Theo thông tin ban đầu, vào sáng sớm cùng ngày, hai vợ chồng ông N.V.C. và bà T.T.N. (trú tại thôn Nhân Hải, xã Nhân Trạch) cùng con trai chèo thuyền đi bắt cá ven sông Dinh, đoạn qua địa bàn xã. Sau đó, người con trở về nhà trước. Đến khoảng 6h sáng, không thấy bố mẹ quay về, người con trai quay lại tìm kiếm thì phát hiện chiếc thuyền nan của bố mẹ bị trôi dạt, không có ai trên thuyền. Ngay khi nhận được thông tin, chính quyền địa phương đã huy động phương tiện và nhân lực để tổ chức tìm kiếm dọc sông Dinh và khu vực ven cửa biển. Tuy nhiên, đến trưa cùng ngày, tung tích hai vợ chồng vẫn chưa được tìm thấy. Trước đó, vào sáng cùng ngày, chính quyền xã Tân Hóa (huyện Minh Hóa, Quảng Bình) cũng tổ chức tìm kiếm hai chị em mất tích. Vào khoảng 1h sáng cùng ngày, ba người phụ nữ trú tại thôn 3, xã Tân Hóa rủ nhau đi soi ếch. Khi đang đi, cả ba không may bị nước lũ cuốn. Một người trong đó kịp vào bờ an toàn, hai người còn lại là chị em ruột bị nước cuốn mất tích. Mưa lớn kéo dài do ảnh hưởng của bão số 1 đã gây vỡ đập thủy lợi Dạ Lam ở xã Thái Thủy, huyện Lệ Thủy, tỉnh Quảng Bình. Nước đang tràn về các xã phía hạ du huyện Lệ Thủy."
Tuoi tre,https://tuoitre.vn/bo-doi-dam-mua-giup-dan-khac-phuc-hau-qua-do-loc-xoay-gay-ra-20250613154746641.htm,Thời sự,"Hà Tĩnh,bị tốc mái,lốc xoáy,khắc phục hậu quả,nhà dân",13/06/2025 16:30 GMT+7,Bộ đội dầm mưa giúp dân khắc phục hậu quả do lốc xoáy gây ra,"Bộ đội được điều động đến giúp người dân khắc phục hậu quả do lốc xoáy tại thôn Trung Tiến, xã Cẩm Trung - Ảnh: LÊ MINH Ngày 13-6, trao đổi vớiTuổi Trẻ Online, đại tá Võ Quang Thiện - chính ủy Bộ Chỉ huy quân sự tỉnh Hà Tĩnh - cho biết sau khi xảy ra trận lốc xoáy khiến hàng loạt nhà dân ở xã Cẩm Trung (huyện Cẩm Xuyên) bị tốc mái, hư hỏng, đơn vị đã điều động gần 100 cán bộ, chiến sĩ bộ đội thường trực và lực lượng dân quân tự vệ giúp nhân dân khắc phục hậu quả. Trước đó, vào hiều tối 12-6, tại thôn Trung Tiến (xã Cẩm Trung) có mưa vừa, sau đó bất ngờ xuất hiện lốc xoáy mạnh quét qua địa bàn thôn khiến hơn 30 ngôi nhà dân bị tốc mái, hư hỏng và nhiều công trình phụ trợ khác bị ảnh hưởng. Ngoài ra nhiều tài sản của người dân trong nhà cũng bị hư hỏng. Trận lốc xoáy đã làm hơn 30 ngôi nhà của người dân bị tốc mái, hư hỏng - Ảnh: LÊ MINH Sáng nay, ngay sau khi có mặt tại thôn Trung Tiến (xã Cẩm Trung) cán bộ, chiến sĩ đã nhanh chóng bắt tay vào việc giúp đỡ bà con nhân dân khắc phục hậu quả lốc xoáy để sớm ổn định lại cuộc sống. Các cán bộ, chiến sĩ chia thành từng nhóm sửa chữa, lợp lại mái nhà, mái che mát, dọn dẹp cây xanh đổ ngã, làm vệ sinh môi trường, thu gom, vận chuyển, sắp xếp, di dời các vật dụng và tài sản bị cuốn bay.  Bộ đội giúp dân khắc phục hậu quả lốc xoáy gây ra dưới mưa - Ảnh: LÊ MINH Ông Hà Văn Bình - chủ tịch UBND huyện Cẩm Xuyên - cho biết ngay sau khi nhận được thông tin về trận lốc xoáy, huyện đã nhanh chóng chỉ đạo các lực lượng tại chỗ hỗ trợ người dân khắc phục hậu quả. Đồng thời yêu cầu xã Cẩm Trung đánh giá thống kê mức độ thiệt hại và đề xuất phương án hỗ trợ cho những hộ bị ảnh hưởng nặng nề. Một trận lốc xoáy xảy ra vào chiều tối hôm qua khiến hơn 30 nhà dân ở Hà Tĩnh bị tốc mái và hư hỏng, rất may không có người bị thương."
