Source,URL,Category,Keyword,Time,Title,Content
VN Express,https://vnexpress.net/mo-rong-quang-truong-ba-dinh-chuan-bi-dieu-binh-dip-quoc-khanh-4898654.html,Chính trị,"quảng trường Ba Đình,diễu binh,Cách mạng tháng Tám,80 Quốc khánh","Thứ sáu, 13/6/2025, 23:27 (GMT+7)",Mở rộng quảng trường Ba Đình chuẩn bị diễu binh dịp Quốc khánh,"TP Hà Nội chủ trì giải phóng mặt bằng, chỉnh trang, mở rộng quảng trường Ba Đình để tổ chức lễ diễu binh, diễu hành kỷ niệm 80 năm Cách mạng tháng Tám và Quốc khánh 2/9. Phó thủ tướng Mai Văn Chính ngày 12/6 giao Bộ Quốc phòng, Công an, Văn hóa Thể thao và Du lịch phối hợp cùng TP Hà Nội thực hiện nội dung nêu trên, báo cáo trước 15/7. Bộ Quốc phòng chủ trì cùng Bộ Công an, Bộ Văn hóa Thể thao và Du lịch sớm hoàn thiện đề án diễu binh, diễu hành trong tháng 6; tổ chức tập luyện, hợp luyện, diễu binh, diễu hành; báo cáo Phó thủ tướng tình hình triển khai trước 15/7. Kế hoạch diễu binh, diễu hành sẽ được xin ý kiến Thường trực Ban Chỉ đạo Trung ương trước khi ban hành. Kịch bản lễ diễu binh, diễu hành cũng cần xây dựng, trong đó có logo, bộ nhận diện, mẫu biểu trưng làm tặng phẩm phục vụ các cuộc gặp mặt của lãnh đạo Đảng, Nhà nước dịp này. Chương trình nghệ thuật đặc biệt sẽ được tổ chức. Các nhiệm vụ này cần báo cáo Phó thủ tướng trước 31/7. Bộ Công an, Quốc phòng và TP Hà Nội xây dựng kế hoạch ""đảm bảo tuyệt đối"" an ninh, an toàn cho các hoạt động kỷ niệm, nhất là sự kiện có sự tham dự của lãnh đạo, nguyên lãnh đạo Đảng, Nhà nước và đại biểu quốc tế. Bộ Ngoại giao chủ trì hoàn thiện kế hoạch mời đại biểu quốc tế, phóng viên nước ngoài và lực lượng các nước tham gia diễu binh, diễu hành; trình Ban Bí thư trong tháng 6. Bộ Y tế có phương án chăm sóc sức khỏe lãnh đạo, nguyên lãnh đạo Đảng, Nhà nước và đại biểu dự lễ kỷ niệm, diễu binh, diễu hành. Phó thủ tướng lưu ý đảm bảo vệ sinh an toàn thực phẩm và sức khỏe nhân dân trước, trong và sau dịp kỷ niệm. Đài truyền hình Việt Nam chủ trì chuẩn bị truyền hình trực tiếp lễ kỷ niệm, diễu binh, diễu hành; cầu truyền hình trực tiếp; chương trình nghệ thuật đặc biệt. ""Nâng cao hơn nữa chất lượng hình ảnh trong truyền hình trực tiếp các hoạt động trọng tâm, nhất là lễ kỷ niệm, diễu binh, diễu hành"", Phó thủ tướng yêu cầu. Viện Hàn lâm Khoa học xã hội Việt Nam chuẩn bị tổ chức hội thảo quốc gia về Cách mạng tháng Tám và Quốc khánh trong tháng 6. Hồi giữa tháng 5, Chính phủ giao Bộ Quốc phòng và Công an chủ động chuẩn bị tổ chức lễ diễu binh, duyệt binh kỷ niệm 80 năm Cách mạng tháng Tám và Quốc khánh 2/9. Thượng tướng Nguyễn Văn Nghĩa, Phó tổng tham mưu trưởng quân đội nhân dân Việt Nam, cho biết dự kiến các lực lượng, khối từng tham gia diễu binh kỷ niệm 50 năm ngày giải phóng miền Nam, thống nhất đất nước tiếp tục tham gia dịp này. Trong đó, lực lượng tham gia gồm 11 khối đứng, 27 khối đi. Vũ Tuân"
VN Express,https://vnexpress.net/cap-tinh-va-xa-hoat-dong-tu-ngay-1-7-4898635.html,Chính trị,,"Thứ sáu, 13/6/2025, 22:26 (GMT+7)",Cấp tỉnh và xã hoạt động từ ngày 1/7,"Tất cả cơ quan, đơn vị thuộc 34 tỉnh, thành phố và 3.321 xã, phường, đặc khu sẽ đồng loạt hoạt động từ ngày 1/7, Bộ Chính trị, Ban Bí thư yêu cầu. Ngày 13/6, Bộ Chính trị, Ban Bí thư ban hành kết luận 167, yêu cầu các cấp ủy hoàn thiện văn bản pháp luật, phương án bố trí nhân sự, trụ sở, phương tiện, cơ sở vật chất để sẵn sàng đưa bộ máy đi vào hoạt động. Để đảm bảo tiến độ tất cả tỉnh thành, xã phường, đặc khu đi vào hoạt động từ 1/7, bí thư đảng ủy, bộ trưởng, thủ trưởng cơ quan ngang bộ, thường trực các tỉnh ủy, thành ủy không đi công tác nước ngoài từ nay đến hết tháng 7. Trường hợp đặc biệt phải báo cáo cấp có thẩm quyền quyết định. Đảng ủy Chính phủ được giao tổ chức hội nghị tập huấn cho địa phương về phân cấp, phân quyền, đảm bảo chính quyền địa phương hai cấp hoạt động thống nhất, thông suốt, không gián đoạn. Đồng thời, Chính phủ rà soát tình hình quản lý, xử lý trụ sở, tài sản, đất đai dôi dư sau sắp xếp đơn vị hành chính nhằm tránh lãng phí, ưu tiên phục vụ mục đích y tế, giáo dục, văn hóa. Ngân sách cần đảm bảo chi trả chế độ cho cán bộ, công chức, viên chức, người lao động chịu ảnh hưởng bởi sắp xếp. Chức danh chủ tịch, phó chủ tịch UBND các tỉnh, thành mới sẽ đồng loạt được công bố ngày 30/6. Đảng ủy Quốc hội chỉ đạo Ủy ban Thường vụ Quốc hội chỉ định chủ tịch, phó chủ tịch HĐND; trưởng các ban của HĐND; trưởng đoàn, phó đoàn đại biểu Quốc hội 34 tỉnh, thành sau sáp nhập. Đảng ủy Mặt trận Tổ quốc Việt Nam sẽ công nhận ủy viên, chủ tịch, phó chủ tịch Mặt trận Tổ quốc các tỉnh, thành mới. Theo kết luận, trong trường hợp đặc biệt, có thể chỉ định nhân sự không phải đại biểu HĐND giữ các chức danh thường trực HĐND cấp tỉnh, xã, trong đó có HĐND lâm thời phường. Ban Tổ chức Trung ương chịu trách nhiệm hướng dẫn việc này, báo cáo Bộ Chính trị, Ban Bí thư xem xét trước 20/6. Lễ công bố và trao các quyết định sáp nhập tỉnh thành; thành lập đảng bộ tỉnh thành mới; chỉ định nhân sự tỉnh thành sẽ được tổ chức đồng thời ngày 30/6 tại các địa phương. Sáng 12/6, Quốc hội thông qua Nghị quyết về sắp xếp đơn vị hành chính cấp tỉnh năm 2025, giảm số tỉnh, thành phố từ 63 xuống còn 34. Cả nước còn 3.321 xã, phường, đặc khu. Vũ Tuân"
VN Express,https://vnexpress.net/chi-dinh-lanh-dao-chinh-quyen-sau-sap-xep-don-vi-hanh-chinh-la-giai-phap-tinh-the-4898570.html,Chính trị,"chủ tịch xã,chỉ định,chủ tịch tỉnh,Sáp nhập tỉnh thành","Thứ sáu, 13/6/2025, 21:34 (GMT+7)",Chỉ định lãnh đạo chính quyền sau sắp xếp đơn vị hành chính 'là giải pháp tình thế',"Ủy ban sửa đổi Hiến pháp cho rằng việc chỉ định các chức danh lãnh đạo chính quyền cấp tỉnh, cấp xã sau sắp xếp là biện pháp có tính chất tình thế nhằm kiện toàn tổ chức, sớm ổn định bộ máy nhà nước ở địa phương. Chiều 13/6, Quốc hội thảo luận về dự thảo Nghị quyết sửa đổi, bổ sung một số điều của Hiến pháp năm 2013. Theo đó, Ủy ban Thường vụ Quốc hội sẽ chỉ định Chủ tịch, Phó chủ tịch HĐND, Trưởng các Ban HĐND, Trưởng đoàn và Phó trưởng đoàn đại biểu Quốc hội tại các tỉnh, thành phố mới được hình thành sau sắp xếp. Thủ tướng chỉ định Chủ tịch, Phó chủ tịch UBND cấp tỉnh; Thường trực HĐND cấp tỉnh chỉ định Ủy viên UBND cùng cấp, đồng thời chỉ định các chức danh lãnh đạo HĐND và UBND ở đơn vị hành chính cấp dưới. Tại cấp xã, thẩm quyền chỉ định Ủy viên UBND thuộc về Thường trực HĐND cùng cấp. Chủ nhiệm Ủy ban Pháp luật và Tư pháp Hoàng Thanh Tùng, đại diện Ủy ban sửa đổi Hiến pháp, cho biết việc chỉ định nhân sự là biện pháp chuyển tiếp, mang tính tình thế, để bảo đảm tổ chức bộ máy chính quyền địa phương nhiệm kỳ 2021-2026 được kiện toàn kịp thời sau khi sắp xếp đơn vị hành chính. Đây là lần sắp xếp quy mô lớn, đồng loạt kết thúc hoạt động gần 700 đơn vị hành chính cấp huyện. Việc chỉ định chỉ áp dụng từ nay đến khi tổ chức bầu cử đại biểu Quốc hội khóa 16 và HĐND các cấp nhiệm kỳ 2026-2031. Sau đó, các chức danh sẽ được bầu cử theo quy định của Hiến pháp và Luật Tổ chức chính quyền địa phương. Do đó, Ủy ban đề nghị giữ nội dung chỉ định trong Nghị quyết như một điều khoản chuyển tiếp, không đưa trực tiếp vào Điều 114 của Hiến pháp để bảo đảm giá trị ổn định lâu dài của văn bản này. Trước đó, đại biểu Phạm Văn Hòa, Phó chủ tịch Hội Luật gia tỉnh Đồng Tháp, đề nghị giao thẩm quyền chỉ định Chủ tịch, Phó chủ tịch UBND cấp xã cho Chủ tịch UBND tỉnh, thay vì Thường trực HĐND tỉnh như dự thảo. Ông cho rằng HĐND là cơ quan dân cử, có chức năng lập pháp, giám sát, nên không phù hợp khi chỉ định nhân sự thuộc cơ quan hành pháp. Ông cũng lưu ý dự thảo chưa quy định rõ thẩm quyền chỉ định cấp phó của HĐND như Phó trưởng ban HĐND cấp tỉnh hoặc cấp xã và đề nghị làm rõ nội dung này. ""Nếu Thường trực HĐND cấp tỉnh là cơ quan chỉ định thì ai sẽ có thẩm quyền cho thôi chức hoặc bãi nhiệm Chủ tịch, Phó chủ tịch UBND cấp xã trong trường hợp các chức danh này vi phạm hoặc bị kỷ luật"", ông đặt vấn đề. Đại biểu Lê Xuân Thân, Chủ tịch Hội Luật gia tỉnh Khánh Hòa, cũng băn khoăn rằng việc chỉ định các chức danh chính quyền thay vì bầu cử sẽ ảnh hưởng đến quyền dân chủ của cử tri. Ông đề nghị cơ quan chủ trì soạn thảo giải trình rõ hơn và quy định cụ thể để bảo đảm minh bạch, dân chủ trong triển khai. Quốc hội sẽ biểu quyết thông qua Nghị quyết vào ngày 16/6. Sơn Hà"
VN Express,https://vnexpress.net/ban-do-34-tinh-thanh-sau-sap-nhap-4898576.html,Chính trị,"bản đồ Việt Nam,Sáp nhập tỉnh thành,bản đồ 34 tỉnh thành","Thứ sáu, 13/6/2025, 17:37 (GMT+7)","Bản đồ 34 tỉnh, thành sau sáp nhập","Việt Nam hiện có 28 tỉnh và 6 thành phố trực thuộc Trung ương, trong đó TP HCM là siêu đô thị, đóng góp GDP lớn nhất cả nước."
VN Express,https://vnexpress.net/ha-noi-va-tp-hcm-duoc-tang-them-10-pho-giam-doc-so-4898451.html,Chính trị,,"Thứ sáu, 13/6/2025, 17:10 (GMT+7)",Hà Nội và TP HCM được tăng thêm 10 phó giám đốc sở,"Chính phủ quy định ngoài tổng số bình quân theo quy định như các địa phương khác, Hà Nội và TP HCM được tăng thêm 10 phó giám đốc sở. Theo nghị định 150/2025, Chính phủ quy định bình quân mỗi sở thuộc tỉnh có ba phó giám đốc. UBND cấp tỉnh sẽ quyết định cụ thể số lượng phó giám đốc cho từng sở, căn cứ vào số sở và tổng số phó giám đốc. Riêng Hà Nội và TP HCM, ngoài tổng số phó giám đốc sở theo bình quân chung, mỗi thành phố được tăng thêm không quá 10 phó giám đốc. Đồng thời, Chính phủ quy định phòng thuộc sở có dưới 10 công chức sẽ được bố trí một phó phòng; phòng 10-14 công chức có hai phó phòng; phòng từ 15 công chức có ba phó phòng. Các sở được tổ chức thống nhất ở các tỉnh, thành phố trực thuộc trung ương gồm: Nội vụ, Tư pháp, Tài chính, Công Thương, Nông nghiệp và Môi trường, Xây dựng, Khoa học và Công nghệ, Văn hóa Thể thao và Du lịch, Giáo dục và Đào tạo, Y tế, Thanh tra tỉnh, Văn phòng UBND. Các sở đặc thù được tổ chức ở một số địa phương gồm: Ngoại vụ, Dân tộc và Tôn giáo, Du lịch. Hà Nội và TP HCM được lập sở Quy hoạch - Kiến trúc. Căn cứ vào danh sách nêu trên, các tỉnh thành được tổ chức không quá 14 sở, riêng Hà Nội và TP HCM được thành lập không quá 15 sở. Chính phủ quy định sở là cơ quan chuyên môn của UBND cấp tỉnh, có chức năng tham mưu, giúp quản lý nhà nước về ngành, lĩnh vực ở địa phương. Sở sẽ trình Chủ tịch UBND tỉnh các dự thảo văn bản; tổ chức thực hiện văn bản quy phạm pháp luật; tuyên truyền, hướng dẫn, phổ biến giáo dục; đăng ký, cấp giấy phép, văn bằng, chứng chỉ; quản lý doanh nghiệp, tổ chức kinh tế, các hội... Theo nghị định, cấp xã có ba phòng chuyên môn, trong đó Văn phòng HĐND và UBND sẽ quản lý lĩnh vực văn phòng, tư pháp, đối ngoại. Phòng Kinh tế (với xã, đặc khu) hoặc Phòng Kinh tế, Hạ tầng và Đô thị (với phường và đặc khu Phú Quốc) sẽ quản lý lĩnh vực tài chính - kế hoạch; xây dựng và công thương; nông nghiệp và môi trường. Phòng Văn hóa - Xã hội quản lý lĩnh vực nội vụ, giáo dục và đào tạo, văn hóa, khoa học và thông tin, y tế. Chính phủ giao cấp xã quyết định lập phòng chuyên môn căn cứ thực tiễn địa phương. Sau sáp nhập toàn quốc có 34 tỉnh, thành phố trực thuộc trung ương và 3.321 xã, phường, đặc khu. Chính quyền địa phương hai cấp dự kiến vận hành từ 1/7. Vũ Tuân"
VN Express,https://vnexpress.net/bo-mo-hinh-thanh-pho-thuoc-tinh-de-phan-tach-ro-do-thi-va-nong-thon-4898478.html,Chính trị,,"Thứ sáu, 13/6/2025, 15:25 (GMT+7)",Bỏ mô hình thành phố thuộc tỉnh để phân tách rõ đô thị và nông thôn,"Ủy ban dự thảo sửa đổi Hiến pháp cho rằng bỏ mô hình thành phố thuộc tỉnh, thành phố thuộc thành phố nhằm phân tách rành mạch giữa đô thị và nông thôn, thống nhất mô hình quản lý theo hướng tinh gọn, hiệu quả. Trong báo cáo giải trình tiếp thu ý kiến nhân dân và đại biểu Quốc hội ngày 12/6, Ủy ban cho biết có một số đề xuất giữ lại các thành phố, thị xã hiện là đơn vị hành chính cấp cơ sở mà không nhất thiết phân chia thành các phường trực thuộc để thuận lợi trong bố trí nguồn lực và phát triển đô thị. Tuy nhiên, quan điểm của Ủy ban là việc xác định đơn vị hành chính dưới tỉnh, thành phố trực thuộc trung ương sẽ do Quốc hội quy định cụ thể trong các luật, phù hợp với từng giai đoạn. Theo dự thảo Luật Tổ chức chính quyền địa phương, xã là đơn vị hành chính ở nông thôn, phường là đơn vị hành chính ở đô thị, đặc khu là đơn vị hành chính ở một số hải đảo quan trọng. Các đơn vị này sẽ được thành lập trên cơ sở quy mô dân số, diện tích, điều kiện địa lý và yêu cầu phát triển kinh tế xã hội, đảm bảo quốc phòng - an ninh. Mô hình này bám sát các chủ trương, nghị quyết, chỉ thị của Đảng. Chính quyền địa phương hai cấp gắn với mô hình hành chính mới sẽ giúp tinh gọn bộ máy, giảm tầng nấc trung gian, tiết kiệm chi phí và nâng cao hiệu quả quản lý. Đồng thời, chính quyền sẽ sát dân, giải quyết kịp thời vấn đề dân sinh, khắc phục tình trạng ""đô thị trong nông thôn, nông thôn trong đô thị"" như hiện nay. Ủy ban khẳng định tổ chức đồng bộ các đơn vị hành chính đô thị thành các phường còn giúp thống nhất mô hình quản lý, thuận lợi cho quy hoạch, tăng khả năng liên kết vùng, đảm bảo tiếng nói và quyền lợi của cư dân các đô thị nhỏ không bị lấn át bởi các đô thị lớn cùng cấp tỉnh. Bên cạnh đó, Ủy ban đề nghị Quốc hội ghi nhận vai trò lịch sử của cấp huyện - đơn vị hành chính trung gian - đã gắn bó và đóng góp quan trọng trong 80 năm phát triển đất nước. Cấp huyện từng được xem là ""pháo đài vững chắc"", trung tâm phát triển kinh tế xã hội, là cầu nối giữa cấp tỉnh và cấp xã, đặc biệt trong các giai đoạn kháng chiến, cải cách hành chính, phòng chống dịch bệnh, xây dựng nông thôn mới... Để tôn vinh những đóng góp đó, Ủy ban đề xuất ghi nhận vai trò và thành tựu của 696 đơn vị hành chính cấp huyện trong nghị quyết kỳ họp, trước khi kết thúc hoạt động vào ngày 1/7 tới. Theo Đề án sắp xếp đơn vị hành chính và tổ chức mô hình chính quyền địa phương hai cấp của Chính phủ (công bố giữa tháng 4), cấp huyện sẽ bị bãi bỏ, kéo theo việc không duy trì các mô hình hành chính trung gian như thành phố thuộc tỉnh, thành phố thuộc thành phố, thị xã, quận, huyện, thị trấn. Hiện cả nước có 84 thành phố trực thuộc tỉnh, 53 thị xã và 2 thành phố trực thuộc thành phố trực thuộc trung ương là Thủ Đức (TP HCM) và Thủy Nguyên (Hải Phòng). Vũ Tuân"
VN Express,https://vnexpress.net/cap-xa-duoc-cap-so-do-lan-dau-cho-nguoi-dan-4898357.html,Chính trị,,"Thứ sáu, 13/6/2025, 11:33 (GMT+7)",Cấp xã được cấp sổ đỏ lần đầu cho người dân,"Từ 1/7, Chủ tịch UBND xã, phường, đặc khu được cấp giấy chứng nhận quyền sử dụng đất, quyền sở hữu tài sản gắn liền với đất lần đầu cho người dân. Theo nghị định của Chính phủ ngày 12/6 về phân cấp, phân quyền lĩnh vực đất đai, Chủ tịch UBND cấp xã sẽ được cấp giấy chứng nhận quyền sử dụng đất, quyền sở hữu tài sản gắn liền với đất (sổ đỏ) lần đầu cho người dân. Đồng thời, cấp xã được cấp sổ đỏ theo phương án góp quyền sử dụng đất, điều chỉnh lại đất đai được phê duyệt. Nhiệm vụ này hiện do cấp tỉnh và huyện đảm nhiệm. Các trường hợp cấp sổ đỏ thuộc thẩm quyền UBND cấp tỉnh sẽ giao về xã, phường, đặc khu gồm: cấp sổ đỏ cho tổ chức trong nước như cơ quan nhà nước, cơ quan Đảng, đơn vị vũ trang, Mặt trận Tổ quốc, tổ chức chính trị - xã hội, đơn vị sự nghiệp công lập; tổ chức tôn giáo; tổ chức nước ngoài có chức năng ngoại giao; người gốc Việt Nam định cư ở nước ngoài; tổ chức kinh tế có vốn đầu tư nước ngoài. Chính phủ giao UBND cấp xã được xác định lại diện tích đất ở và cấp sổ đỏ trong trường hợp thửa đất có vườn, ao, đất thổ cư được cấp sổ đỏ trước ngày 1/7/2004. Ngoài ra, hàng loạt thẩm quyền khác được chuyển giao từ cấp huyện về Chủ tịch UBND cấp xã, như: chấp thuận phương án sử dụng đất nông nghiệp của tổ chức kinh tế; phê duyệt phương án sử dụng đất lúa của cá nhân; thu hồi đất; phê duyệt phương án bồi thường, hỗ trợ, tái định cư; phê duyệt phương án cưỡng chế và kinh phí cho hoạt động cưỡng chế; quyết định giá đất cụ thể; quyết định giá bán nhà ở tái định cư trong địa bàn. Chủ tịch UBND cấp xã được thành lập Hội đồng thẩm định giá đất cũng như quyết định giao đất, cho thuê đất, cho phép chuyển mục đích sử dụng đất với cá nhân, trước đây thuộc thẩm quyền cấp tỉnh. Sáng 12/6, Quốc hội thông qua Nghị quyết về sắp xếp đơn vị hành chính cấp tỉnh năm 2025, giảm số tỉnh, thành phố từ 63 xuống còn 34. Sau sắp xếp, toàn quốc còn 3.321 xã, phường, đặc khu. Dự kiến ngày 30/6, tất cả địa phương sẽ đồng loạt công bố địa giới hành chính mới của tỉnh, xã, cùng bộ máy lãnh đạo mới. Từ ngày 1/7 bộ máy mới theo mô hình chính quyền địa phương hai cấp sẽ chính thức vận hành. Theo Phó chủ tịch Quốc hội Nguyễn Khắc Định, khi sắp xếp đơn vị hành chính, người dân và doanh nghiệp ""có thể yên tâm"" sử dụng giấy tờ hiện hành cho đến khi hết hạn; nếu cần cấp lại theo địa chỉ mới, thủ tục sẽ được đơn giản hóa và không mất phí. Vũ Tuân"
VN Express,https://vnexpress.net/ha-noi-bau-bo-sung-pho-chu-tich-thanh-pho-4898174.html,Nhân sự,"Hà Nội,lãnh đạo thành phố,ông Trương Việt Dũng,bà Phạm Thị Thanh Mai","Thứ sáu, 13/6/2025, 09:39 (GMT+7)",Hà Nội bầu bổ sung phó chủ tịch thành phố,"Ông Trương Việt Dũng, Chánh văn phòng, người phát ngôn của UBND TP Hà Nội, được bầu làm Phó chủ tịch thành phố nhiệm kỳ 2021-2026. Sáng 13/6, tại kỳ họp thứ 23, HĐND TP Hà Nội bầu ông Trương Việt Dũng, 45 tuổi, quê Hà Nội, trình độ thạc sĩ Kiến trúc vào vị trí trên. Tân Phó chủ tịch là người trẻ nhất trong bộ máy lãnh đạo chính quyền Thủ đô hiện nay. Ông từng là thủ khoa xuất sắc Đại học Kiến trúc năm 2003, được thành phố tuyển dụng đặc cách. Khi được bổ nhiệm Phó chánh văn phòng UBND năm 2016, Phó giám đốc Sở Kế hoạch và Đầu tư năm 2018, ông đều thuộc diện cán bộ trẻ nhất từ trước tới nay đảm nhiệm các vị trí này. Ông Dũng sau đó trải qua các vị trí Thành ủy viên, Chánh văn phòng UBND thành phố, đại biểu HĐND thành phố. Sau khi bầu bổ sung, UBND TP Hà Nội có 6 phó chủ tịch gồm các ông Lê Hồng Sơn 61 tuổi, Dương Đức Tuấn 58 tuổi, Nguyễn Trọng Đông 56 tuổi, Nguyễn Mạnh Quyền 50 tuổi, Trương Việt Dũng 45 tuổi và bà Vũ Thu Hà 53 tuổi. Chủ tịch UBND TP Hà Nội là ông Trần Sỹ Thanh, 54 tuổi. Cũng tại phiên họp, HĐND thành phố đã bầu bà Phạm Thị Thanh Mai, 50 tuổi, quê Hà Nội, tiến sĩ quản lý kinh tế, Phó đoàn Đại biểu Quốc hội TP Hà Nội, Ủy viên Ủy ban kinh tế và Tài chính Quốc hội, làm Phó chủ tịch HĐND thành phố nhiệm kỳ 2021-2026. Sau kiện toàn, HĐND TP Hà Nội có ba phó chủ tịch gồm ông Phạm Quý Tiên 57 tuổi, bà Phùng Thị Hồng Hà 54 tuổi và bà Phạm Thị Thanh Mai 50 tuổi. Chủ tịch HĐND TP Hà Nội là ông Nguyễn Ngọc Tuấn, 59 tuổi. Võ Hải"
