Source,URL,Category,Keyword,Time,Title,Content
VN Express,https://vnexpress.net/tong-bi-thu-thuong-benh-binh-tiep-tuc-truyen-cam-hung-cho-cac-the-he-4914716.html,Chính trị,,"Thứ ba, 15/7/2025, 20:39 (GMT+7)",Tổng Bí thư: Thương bệnh binh tiếp tục truyền cảm hứng cho các thế hệ,"Tổng Bí thư mong muốn các thương binh, bệnh binh tiếp tục phát huy truyền thống ""Bộ đội Cụ Hồ"", là ngọn lửa truyền cảm hứng cách mạng cho các thế hệ mai sau. Chiều 15/7, Tổng Bí thư Tô Lâm đến thăm, tặng quà thương, bệnh binh tại Trung tâm Điều dưỡng thương binh Thuận Thành (phường Ninh Xá, tỉnh Bắc Ninh), nhân kỷ niệm 78 năm ngày Thương binh - Liệt sĩ (27/7). Người đứng đầu Đảng bày tỏ lòng biết ơn, tình cảm chân thành và niềm cảm phục tới các bác, anh, chị - những người đã anh dũng chiến đấu, hiến dâng tuổi trẻ, thân thể mình cho nên độc lập, tự do của Tổ quốc. Dù mang thương tật do chiến tranh để lại, các thương binh, bệnh binh vẫn luôn giữ vững phẩm chất, ý chí, niềm tin và tinh thần lạc quan, ""thực sự là những tấm gương sáng để các thế hệ trẻ tự hào, học tập và noi theo"". Tổng Bí thư biểu dương những nỗ lực, sự tận tâm, trách nhiệm của đội ngũ cán bộ, y bác sĩ, nhân viên của Trung tâm Điều dưỡng thương binh Thuận Thành - những người thầm lặng nhưng đầy yêu thương, góp phần mang lại sự ấm áp, an toàn, chăm sóc tốt nhất cho các thương binh, bệnh binh. Ông cảm ơn những người vợ, người thân trong gia đình các thương binh, bệnh binh đã hy sinh, gác lại cuộc sống riêng để ở lại Trung tâm, tận tình chăm sóc, đồng hành cùng các thương, bệnh binh vượt qua thương tật, bệnh tật. Tổng Bí thư nhấn mạnh, Đảng, Nhà nước và nhân dân luôn nhất quán quan điểm: ""Người có công với cách mạng là tài sản quý báu của dân tộc"", là biểu tượng thiêng liêng của lòng yêu nước và đạo lý Việt Nam. Công tác đền ơn đáp nghĩa, uống nước nhớ nguồn không chỉ là chính sách lớn mà còn là ""mệnh lệnh từ trái tim, trách nhiệm chính trị, đạo lý của cả hệ thống chính trị và toàn xã hội"". Để chăm lo tốt hơn đời sống người có công với cách mạng, những năm qua, Đảng và Nhà nước đã ban hành nhiều chế độ, chính sách ưu đãi. Tổng Bí thư đề nghị các cấp ủy, chính quyền, đoàn thể tỉnh Bắc Ninh quan tâm, chăm lo tốt hơn đời sống vật chất, tinh thần các thương binh, bệnh binh, người có công. ""Không chỉ là chăm sóc mà cần tạo điều kiện để các bác, các anh chị được tiếp tục cống hiến, lan tỏa nghị lực, giá trị sống tích cực tới cộng đồng"", ông lưu ý. Tổng Bí thư mong muốn các thương binh, bệnh binh tiếp tục phát huy truyền thống ""Bộ đội Cụ Hồ"", sống vui, sống khỏe, là tấm gương sáng cho con cháu noi theo. Mỗi người là một biểu tượng sinh động của ý chí, nghị lực Việt Nam - là minh chứng sống động về tinh thần yêu nước, bất khuất, kiên trung, tiếp tục là ngọn lửa truyền cảm hứng cách mạng cho các thế hệ mai sau. Nhân dịp này, Tổng Bí thư Tô Lâm đã tặng quà các thương binh, bệnh binh đang điều dưỡng tại Trung tâm; đại diện 5 gia đình liệt sĩ được Thủ tướng cấp bằng ""Tổ quốc ghi công"" dịp tháng 6/2025. Được thành lập từ năm 1965, hiện nay, Trung tâm Điều dưỡng thương binh Thuận Thành là đơn vị sự nghiệp công lập trực thuộc Cục Người có công, Bộ Nội vụ. 60 năm qua, Trung tâm đã tiếp nhận hành nghìn lượt thương binh, bệnh binh bị thương từ chiến trường của các thời kỳ kháng chiến chống Pháp, chống Mỹ, bảo vệ biên giới phía Bắc, phía Tây Nam và làm nhiệm vụ quốc tế tại nước bạn Lào, Campuchia về an dưỡng, điều trị. Hiện nay, Trung tâm nuôi dưỡng, điều trị và thực hiện chế độ chính sách đối với 84 thương binh, bệnh binh nặng hạng 1/4 của 13 tỉnh, thành phố. Trong số đó có 51 thương binh, bệnh binh bị thương thời kỳ kháng chiến chống Mỹ; 33 thương binh, bệnh binh bị thương trong thời kỳ bảo vệ biên giới phía Bắc, phía Tây Nam, quân tình nguyện tại nước Lào, Campuchia và trong xây dựng bảo vệ đất nước. Trước đó chiều cùng ngày, Tổng Bí thư Tô Lâm đã tới dâng hương tại Nhà tưởng niệm các Anh hùng liệt sĩ của Trung tâm Điều dưỡng thương binh Thuận Thành. Vũ Tuân"
VN Express,https://vnexpress.net/ha-noi-se-quy-hoach-lai-ha-tang-truoc-khi-cam-xe-may-xang-4914703.html,Chính trị,,"Thứ ba, 15/7/2025, 19:46 (GMT+7)",Hà Nội sẽ quy hoạch lại hạ tầng trước khi cấm xe máy xăng,"Ngoài hỗ trợ người dân đổi xe, Hà Nội sẽ chuẩn hóa trạm sạc, mở rộng phương tiện công cộng và xây dựng bản tin dự báo ô nhiễm trước khi cấm xe máy xăng từ năm 2026. Chiều 15/7, tại tọa đàmQuyết liệt bảo vệ môi trường, bảo vệ sức khỏe người dân Thủ đô, Phó chủ tịch UBND TP Hà Nội Dương Đức Tuấn nhấn mạnh việc loại bỏ phương tiện chạy xăng dầu là xu thế tất yếu và Hà Nội sẽ nghiên cứu các chính sách hỗ trợ phù hợp nhất cho người dân trong khu vực vành đai 1 khi cấm xe máy xăng từ tháng 7/2026. Theo ông Tuấn, việc chuyển đổi phương tiện không chỉ là trách nhiệm của nhà nước mà cần sự tham gia của doanh nghiệp và người dân. Thành phố sẽ kêu gọi các hãng xe cung cấp phương tiện xanh với chính sách ưu đãi về giá bán và chi phí sử dụng; đồng thời kiến nghị tiếp tục miễn, giảm lệ phí trước bạ và đăng ký xe điện. Song song với hỗ trợ người dân đổi phương tiện, Hà Nội sẽ chuẩn hóa hệ thống trạm sạc, đổi pin cho xe điện; tích hợp các yêu cầu an toàn như phòng cháy, chữa cháy và cứu hộ. Các trạm đổi pin sẽ có sự tham gia của nhiều hãng, tạo thuận lợi cho người dân chuyển đổi phương tiện. Ngoài ra, thành phố sẽ mở rộng mạng lưới giao thông công cộng bằng xe điện, chuyển đổi toàn bộ xe buýt, taxi và xe trung chuyển từ 4 đến 16 chỗ hoạt động trong vành đai 1. Hệ thống đường sắt đô thị cũng sẽ được đẩy nhanh tiến độ để đáp ứng nhu cầu đi lại khi phương tiện cá nhân bị hạn chế. Theo chỉ thị của Thủ tướng ban hành ngày 12/7, từ 1/7/2026, Hà Nội sẽ cấm xe máy xăng trong vành đai 1. Đến năm 2028, phạm vi cấm mở rộng ra vành đai 2 và từ năm 2030 là vành đai 3, đồng thời hạn chế cả với ôtô chạy xăng dầu. Hiện Hà Nội có khoảng 6,9 triệu xe máy, trong đó riêng vành đai 1 có khoảng 450.000 chiếc, tương ứng với 600.000 dân cư sinh sống tại khu vực nội đô lịch sử. Ông Tuấn dẫn các nghiên cứu cho thấy xe máy xăng dầu chiếm tới 60% nguyên nhân gây ô nhiễm không khí tại Hà Nội, trong khi khoảng 70% phương tiện đang sử dụng là xe cũ, khó kiểm soát khí thải. Thành phố cũng đang tính toán lộ trình kiểm chuẩn khí thải cho xe máy từ ngày 1/7/2027. Xây dựng bản tin dự báo ô nhiễm Tại tọa đàm, ông Hoàng Dương Tùng, Chủ tịch Mạng lưới Không khí sạch Việt Nam, chia sẻ nhiều kinh nghiệm từ các thành phố lớn như Bắc Kinh, Jakarta và các nước châu Âu. Các đô thị này đều đồng thời thực hiện cấm xe xăng dầu, khuyến khích phương tiện sạch và đầu tư mạnh cho hạ tầng giao thông công cộng. Từ thực tiễn quốc tế, ông Tùng cho rằng Hà Nội cần thiết kế chính sách hỗ trợ toàn diện, trong đó đặc biệt chú trọng an toàn vận hành, mạng lưới sạc pin và năng lực của giao thông công cộng trước khi cấm xe máy xăng. Ông Hoàng Văn Thức, Cục trưởng Môi trường (Bộ Nông nghiệp và Môi trường), cho biết bộ đang xây dựng hệ thống dự báo ô nhiễm không khí tương tự dự báo thời tiết. Bản tin này sẽ giúp người dân theo dõi chất lượng không khí hằng ngày và là công cụ phục vụ điều hành chính sách môi trường đô thị. Vũ Tuân"
VN Express,https://vnexpress.net/co-so-giao-duc-nghe-nghiep-co-the-duoc-uu-dai-de-nghien-cuu-khoa-hoc-4914387.html,Chính trị,,"Thứ ba, 15/7/2025, 17:24 (GMT+7)",Cơ sở giáo dục nghề nghiệp có thể được ưu đãi để nghiên cứu khoa học,"Nhiều cơ chế ưu đãi được đề xuất nhằm thúc đẩy các cơ sở giáo dục nghề nghiệp nâng cao chất lượng đào tạo, đẩy mạnh hợp tác quốc tế và phát triển nghiên cứu khoa học. Dự thảo Luật Giáo dục nghề nghiệp (sửa đổi) đang được Bộ Giáo dục và Đào tạo lấy ý kiến, trong đó đề xuất Nhà nước tạo điều kiện cho các cơ sở giáo dục nghề nghiệp tổ chức nghiên cứu, ứng dụng khoa học - công nghệ, đổi mới sáng tạo; kết hợp đào tạo với nghiên cứu, sản xuất, kinh doanh và dịch vụ để nâng cao hiệu quả giáo dục. Tại Điều 41, dự luật đề cập chính sách thúc đẩy hợp tác quốc tế, ưu đãi và thu hút đầu tư nước ngoài trong lĩnh vực giáo dục nghề nghiệp; hỗ trợ các cơ sở trong nước cung cấp dịch vụ đào tạo ra nước ngoài. Nhà nước cũng ưu tiên bố trí kinh phí, hỗ trợ giảng viên và giáo viên tham gia đào tạo, bồi dưỡng ở nước ngoài trong các lĩnh vực, ngành nghề trọng điểm, công nghệ mới phục vụ chiến lược phát triển quốc gia. Dự luật cho phép các cơ sở giáo dục nghề nghiệp thu hút giảng viên, chuyên gia, nhà khoa học người nước ngoài hoặc người Việt Nam định cư ở nước ngoài có trình độ cao tham gia giảng dạy và nghiên cứu khoa học. Theo Bộ Giáo dục và Đào tạo, chính sách mới nhằm thể chế hóa Kết luận 91 của Trung ương, tập trung hiện đại hóa giáo dục nghề nghiệp và nâng cao tiềm lực nghiên cứu khoa học trong các cơ sở đào tạo. Dự luật định hướng phát triển giáo dục nghề nghiệp theo hướng mở, linh hoạt, hội nhập và gắn với thị trường lao động. Mục tiêu là điều chỉnh cơ cấu ngành nghề, nâng cao chất lượng nguồn nhân lực, nhất là trong các lĩnh vực công nghệ cao và kinh tế số như trí tuệ nhân tạo, khoa học dữ liệu, bán dẫn, vật liệu mới. Bộ Giáo dục và Đào tạo đánh giá giáo dục nghề nghiệp hiện nay còn nhiều bất cập về cơ cấu ngành nghề, trình độ đào tạo chưa hợp lý, chưa đáp ứng được nhu cầu nhân lực kỹ thuật chất lượng cao cho sản xuất, kinh doanh, đặc biệt ở các ngành kinh tế mũi nhọn. Việc đào tạo các lĩnh vực công nghệ cao như chế tạo vi mạch, sinh học, vật liệu mới còn thiếu chủ động và thiếu các giải pháp căn cơ. Do đó, một trong những định hướng lớn của lần sửa luật này là ưu tiên nguồn lực để phát triển giáo dục nghề nghiệp một cách đồng bộ, từ đội ngũ, cơ sở vật chất đến chương trình đào tạo, đáp ứng yêu cầu phát triển kinh tế xã hội và cách mạng khoa học - công nghệ. Dự thảo Luật Giáo dục nghề nghiệp (sửa đổi) dự kiến được trình Quốc hội thảo luận và thông qua tại Kỳ họp thứ 10, vào tháng 10/2025. Sơn Hà"
VN Express,https://vnexpress.net/da-den-luc-chuyen-doi-cach-tiep-can-giao-duc-trang-bi-kien-thuc-4911099.html,Chính trị,trường học,N/A,N/A,"Bộ trưởng Giáo dục và Đào tạo Nguyễn Kim Sơn cho rằng dạy thêm học thêm sẽ níu kéo, làm cho việc trang bị kiến thức theo lối cũ được bảo lưu, cản trở sự đổi mới.458"
VN Express,https://vnexpress.net/xe-may-xang-gay-o-nhiem-khong-khi-cho-ha-noi-nhu-the-nao-4914462.html,Giao thông,"Hà Nội,ô nhiễm không khí,cấm xe máy xe","Thứ ba, 15/7/2025, 17:32 (GMT+7)",Xe máy xăng gây ô nhiễm không khí cho Hà Nội như thế nào,"Kết quả nghiên cứu công bố năm 2023 cho thấy phát thải khí CO của xe máy chiếm 87%, bụi mịn 66%, là nguồn gây ô nhiễm lớn nhất trong giao thông ở Hà Nôi. Thống kê của Sở Giao thông Vận tải (nay là Sở Xây dựng), đến hết năm 2024 Hà Nội có trên 9,2 triệu phương tiện đang hoạt động, chưa bao gồm xe của cơ quan trung ương. Trong đó thành phố đang quản lý 1,1 triệu ôtô, hơn 6,9 triệu xe máy. Ngoài ra, còn khoảng 1,2 triệu ôtô, xe máy cá nhân từ các tỉnh, thành phố khác lưu thông trên địa bàn. Theo đánh giá của Sở Tài nguyên và Môi trường (nay là Sở Nông nghiệp và Môi trường) TP Hà Nội, hoạt động giao thông là một trong 5 nguồn gây ô nhiễm không khí. Các chỉ số ô nhiễm phổ biến gồm: Bụi mịn PM 2.5, bụi PM 10, dioxit nito (NO2), dioxit lưu huỳnh (SO2), carbon monoxide (CO), ozone mặt đất (O3). Để đánh giá mỗi loại phương tiện gây ô nhiễm thế nào, nhóm tác giả Ngô Quang Khôi và cộng sự đã công bố kết quả nghiên cứu đề tài quốc gia (chủ trì là PGS.TS Hoàng Anh Lê, tài trợ bởi Đại học Quốc gia Hà Nội) khung mô hình phân tán quy mô đường phố của ô nhiễm không khí do giao thông đường bộ tại Hà Nội. Nghiên cứu được công bố năm 2023, sử dụng dữ liệu đếm phương tiện từ các dự án trước đó của Cơ quan Hợp tác quốc tế Nhật Bản (JICA), UBND TP Hà Nội, Bộ Giao thông Vận tải. Dữ liệu ô nhiễm không khí được lấy từ 10 trạm quan trắc ven các tuyến đường do Chi Cục Bảo vệ môi trường Hà Nội quản lý gồm: Trung Yên, Minh Khai, Hàng Đậu, Hoàn Kiếm, Kim Liên, Mỹ Đình, Phạm Văn Đồng, Thành Công, Tân Mai, Tây Mỗ. Kết quả nghiên cứu cho thấy với CO, phát thải của xe máy chạy nhiên liệu hóa thạch (xăng, dầu) đóng góp 87%. Tỷ lệ này chỉ giảm xuống dưới 80% vào thời gian từ 22h đến 5h, trong khi ôtô đóng góp 9%. Với thông số bụi PM nói chung, nghiên cứu chỉ ra xe máy vẫn đóng góp nhiều nhất với 66%, ôtô 13%. Nghiên cứu cũng chỉ ra các điểm nóng ô nhiễm CO, PM 10, PM 2.5 trong không khí tập trung ở tuyến đường vành đai, đường xuyên tâm, nút giao thông đặt biệt. Ô nhiễm không khí trong vành đai 1 ở mức vừa phải, ngoại trừ khu phố cổ có nhiều khách du lịch. Tại vành đai 3, nồng độ ô nhiễm cao nhất, lần lượt là 1.206, 87,5 và 61,5 μgm đối với CO, PM 10 và PM 2.5. Trong đó, nồng độ PM 2.5 cao hơn gần gấp đôi quy chuẩn quốc gia. Nhóm nghiên cứu chỉ ra vành đai 2 và 3 đánh dấu ranh giới của vùng đang phát triển, nơi có nhiều đường chính và cao tốc nên có nhiều xe hạng nặng hơn dẫn tới tạo ra nhiều bụi PM hơn. Ngược lại, trong vành đai 2, có nhiều khu dân cư với lượng xe máy lớn dẫn tới lượng khí thải CO cao hơn. Hà Nội cần phối hợp với các tỉnh lân cận để giảm thiểu ô nhiễm Vấn đề lớn nhất đối với ô nhiễm không khí ở Hà Nội là bụi, gồm bụi PM 10, PM 2.5 và bụi lơ lửng. Thống kê của Bộ Nông nghiệp và Môi trường giai đoạn 2016-2021, giá trị trung bình năm của bụi PM 2.5 ở các trạm quan trắc tự động liên tục ghi nhận vượt ngưỡng quy chuẩn 2-3 lần. Về nguồn gốc bụi mịn, báo cáo nghiên cứu Không khí sạch cho Hà Nội do Ngân hàng thế giới (WB) thực hiện công bố năm 2023 chỉ ra 1/3 bụi PM 2.5 bắt nguồn từ Hà Nội, phần còn lại được vận chuyển từ khu vực bên ngoài đến (đồng bằng sông Hồng, quốc tế). Nguồn giao thông vận tải đã gây ra khoảng 25% ô nhiễm PM 2.5; gần 35% có nguồn gốc từ các hoạt động công nghiệp, bao gồm các nhà máy điện và công nghiệp lớn cũng như làng nghề; 10% từ khu dân cư, chủ yếu đun nấu bằng sinh khối; 20% từ nguồn amoniac trong chăn nuôi gia súc và phân bón; khoảng 7% từ việc đốt phụ phẩm nông nghiệp ngoài trời. WB cho rằng giảm phát thải từ giao thông được coi là giải pháp giảm PM2.5 lớn nhất cho Hà Nội. Trong đó, bốn biện pháp có thể triển khai gồm: Sử dụng xe máy điện để thay thế cho các xe máy sử dụng xăng; ôtô điện thay cho ôtô chạy xăng dầu diezel; áp dụng tiêu chuẩn EURO 5 hoặc EURO 6 cho các phương tiện và thay xe buýt chạy nhiên liệu sạch cho các xe chạy dầu diesel. Nhu cầu đầu tư cho lĩnh vực này được WB ước tính 1,56 tỷ euro, bao gồm ôtô và xe máy điện thay thế xe sử dụng nhiên liệu xăng dầu và áp dụng tiêu chuẩn khí thải cao hơn từ EURO 5 lên EURO 6. Trong 4 biện pháp trên, WB đánh giá can thiệp thay thế xe máy sử dụng nhiên liệu hóa thạch bằng xe máy điện và ôtô sử dụng nhiên liệu hóa thạch bằng ôtô điện sẽ giúp lượng PM 2.5 giảm mạnh nhất. Tuy nhiên, WB nhận định ngay cả khi Hà Nội thực hiện những biện pháp kiểm soát khí thải nghiêm ngặt nhất, nếu chỉ giới hạn ở khu vực Hà Nội hoặc một tỉnh đơn lẻ khác sẽ không đủ để Thủ đô đạt được PM 2.5 ở mức quy chuẩn quốc gia một cách hiệu quả. ""Các chính sách tập trung vào riêng Hà Nội có thể giảm mức PM2.5 xung quanh vào năm 2030 không quá 20%, xuống còn khoảng 48 μg/m3, vẫn gần gấp đôi mức quy chuẩn quốc gia"", WB khuyến cáo và cho rằng phần lớn ô nhiễm đến từ bên ngoài Hà Nội, do đó hành động phối hợp với các tỉnh lân cận là không thể thiếu để cải thiện hiệu quả chất lượng không khí ở Hà Nội. Nhằm giải quyết tình trạng ô nhiễm môi trường, ngày 12/7, Thủ tướng ban hành Chỉ thị 20, trong đó yêu cầu Hà Nội triển khai các giải pháp để tổ chức, cá nhân chuyển đổi phương tiện, bảo đảm đến ngày 1/7/2026 không còn xe môtô, xe gắn máy sử dụng nhiên liệu hóa thạch lưu thông trong vành đai 1. Từ ngày 1/1/2028, ngoài cấm xe môtô, xe gắn máy chạy xăng dầu, ôtô cá nhân sử dụng nhiên liệu hóa thạch cũng bị hạn chế trong khu vực vành đai 1 và vành đai 2; đến năm 2030 áp dụng với toàn bộ phương tiện cá nhân sử dụng nhiên liệu hóa thạch trong phạm vi vành đai 3. Gia Chính"
VN Express,https://vnexpress.net/loat-du-an-trong-diem-o-tp-hcm-khoi-cong-hoan-thanh-truoc-2-9-4914419.html,Giao thông,"cao tốc mộc bài,cầu nhơn trạch,Giao thông TP HCM,ngã tư đình","Thứ ba, 15/7/2025, 10:41 (GMT+7)","Loạt dự án trọng điểm ở TP HCM khởi công, hoàn thành trước 2/9","TP HCM sẽ khởi công cao tốc Mộc Bài, nút giao Ngã tư Đình và thông xe cầu Nhơn Trạch trên Vành đai 3 giúp mở thêm hướng đi mới sang Đồng Nai, ngày 19/8 tới. Theo Ban Quản lý dự án đầu tư xây dựng các công trình giao thông TP HCM,cao tốcTP HCM - Mộc Bài sẽ được khởi công trước gói thầu rà phá bom mìn và di dời hạ tầng kỹ thuật đoạn qua địa bàn thành phố, nhằm chào mừng dịp lễ kỷ niệm 80 năm Quốc khánh cũng như chuẩn bị mặt bằng để thi công các hạng mục chính của dự án. Tuyến cao tốc dài gần 51 km, điểm đầu giaoVành đai 3thuộc địa phận TP HCM, điểm cuối kết nối quốc lộ 22 ở tỉnh Tây Ninh, tổng mức đầu tư hơn 19.600 tỷ đồng. Dự án chia làm 4 thành phần, trong đó thành phần một là xây tuyến chính cao tốc theo hình thức BOT, tổng vốn hơn 10.400 tỷ đồng do UBND TP HCM là cơ quan có thẩm quyền. Thành phần hai là đường gom dân sinh, cầu vượt, vốn đầu tư khoảng 2.422 tỷ đồng. Hai thành phần còn lại là đền bù, hỗ trợ, tái định cư đoạn qua TP HCM và Tây Ninh với gần 4.500 trường hợp bị ảnh hưởng. Công táccắm mốc, giao ranh giải phóng mặt bằng đến nay đã hoàn tất, hai địa phương đang xúc tiến các thủ tục đền bù cho người dân. Trong đó, địa bàn TP HCM có khối lượng lớn, dự kiến chi trả xong đợt một cuối tháng 9 năm nay, trước khi hoàn thành toàn bộ vào cuối tháng 2/2026. Cao tốc TP HCM - Mộc Bài trong giai đoạn đầu được xây dựng 4 làn xe, nhưng mặt bằng được giải tỏa rộng 6 làn nhằm chuẩn bị sẵn cho mở rộng sau này. Dự kiến, công trình sẽ hoàn thành cuối năm 2027, trở thành tuyến đường ngắn nhất kết nối TP HCM với Campuchia qua cửa khẩu Mộc Bài, giảm ùn tắc cho quốc lộ 22 hiện hữu. Cùng với tuyến cao tốc, ngày 19/8, TP HCM cũng dự kiến khởi công dự án nút giaoNgã tư Đình(quốc lộ 1 - Nguyễn Văn Quá, quận 12 cũ), tổng vốn gần 400 tỷ đồng. Hạng mục chính của dự án là cầu vượt trên quốc lộ 1, dài 600 m tính cả đường dẫn, 4 làn xe. Ba tuyến đường qua nút giao gồm Nguyễn Văn Quá, Tân Thới Hiệp 20 và Nguyễn Thị Đặng cũng sẽ được mở rộng, kết hợp với xây dựng đồng bộ hệ thống thoát nước, chiếu sáng... Ngã tư Đình là nút giao quan trọng ở cửa ngõ thành phố, nhiều năm qua thường xuyên ùn tắc, nhất là giờ cao điểm. Dự án khi hoàn thành được kỳ vọng tạo thông thoáng cho khu vực, thuận lợi cho người dân đi lại, giao thương hàng hóa. Ngoài ra, chào mừng lễ Quốc khánh, Ban Quản lý dự án Mỹ Thuận (Bộ Xây dựng) cũng đưa vào khai tháccầu Nhơn Trạchnối TP HCM sang Đồng Nai. Cầu dài hơn 2 km, rộng 19,5 m, là một trong hai gói thầu chính của dự án thành phần 1A thuộc tuyến Vành đai 3 TP HCM. Đây cũng là cây cầu lớn nhất trên tuyến đường này. Khởi công tháng 9/2022, dự án 1A tổng mức đầu tư hơn 6.900 tỷ đồng, từ vốn vay ODA Hàn Quốc và nguồn đối ứng trong nước. Cùng với cầu Nhơn Trạch, gói thầu còn lại của dự án là đường dẫn hai đầu với tổng chiều dài gần 6 km, một bên nối vào nút giao cao tốc TP HCM - Long Thành - Dầu Giây (TP HCM), phía đối diện nối vào tỉnh lộ 25B (Đồng Nai). Do khu vực nút giao giữa cầu Nhơn Trạch và cao tốc Long Thành đang thi công một gói thầu khác thuộc tuyến Vành đai 3, chưa hoàn thiện đồng bộ, TP HCM sẽ tổ chức giao thông tạm từ ngày 19/8 để đảm bảo kết nối. Trong đó, đơn vị thi công sẽ hoàn thành trước khoảng 400 m tuyến chính và một số nhánh rẽ lên cao tốc. Ngoài ra, một đoạn đường tạm dài khoảng 200 m cũng được mở để xe từ cầu Nhơn Trạch rẽ phải vào khu vực trạm thu phí, vòng lên cao tốc Long Thành - Dầu Giây và ngược lại. Sau giai đoạn trên, toàn bộ các hạng mục còn lại tại nút giao sẽ được hoàn thiện trong khoảng thời gian từ cuối tháng 9 đến tháng 12 năm nay. Giang Anh"
