Source,URL,Category,Keyword,Time,Title,Content
VN Express,https://vnexpress.net/pho-diem-toan-tieng-anh-thi-tot-nghiep-dep-bat-ngo-4914700.html,Tin tức,"phổ điểm môn Toán,điểm thi tốt nghiệp THPT,Thi tốt nghiệp THPT 2025,phổ điểm môn Tiếng Anh,phổ điểm thi tốt nghiệp THPT 2025","Thứ ba, 15/7/2025, 19:24 (GMT+7)","Phổ điểm Toán, Tiếng Anh thi tốt nghiệp 'đẹp bất ngờ'","Phổ điểm môn Toán và Tiếng Anh thi tốt nghiệp THPT phân tán đều về hai phía, được nhiều chuyên gia đánh giá ""đẹp bất ngờ"", vì trước đó bị phản ứng là dài và khó. Chiều 15/7, Bộ Giáo dục và Đào tạo công bố phổ điểm thi tốt nghiệp THPT 2025 của 12 môn. Hầu hết được đánh giá có phổ điểm đẹp, theo các chuyên gia khảo thí, nhà quản lý giáo dục. Xem phổ điểm 12 môn thi tốt nghiệp-Dự đoán điểm chuẩn đại học GS.TSKH Nguyễn Đình Đức, Chủ tịch Hội đồng trường Đại học Công nghệ, Đại học Quốc gia Hà Nội, nói bất ngờ khi xem phổ điểm. ""Sau kỳ thi, nhiều thí sinh lo lắng về đề thi Toán và Tiếng Anh khó, tôi đã nghĩ phổ điểm năm nay sẽ thấp hơn năm ngoái rất nhiều. Nhưng thực tế, phổ điểm khá đẹp"", ông Đức nói. Đồng quan điểm, bà Nguyễn Bội Quỳnh, hiệu trưởng trường THPT Việt Đức, Hà Nội, kể sau khi hết giờ làm bài môn Toán và Tiếng Anh, bà ""rất lo"". Thậm chí khi Bộ công bố đáp án chính thức và có học sinh của trường nói tính được 10 Toán, bà cũng ""không dám tin"". ""Đến khi nhìn thấy phổ điểm, tôi rất mừng"", bà nói. Phân tích kỹ hơn, TS Trần Nam Dũng, Phó hiệu trưởng trường Phổ thông Năng khiếu, Đại học Quốc gia TP HCM, nhận xét phổ điểm Toán đúng phân phối chuẩn với điểm trung bình 4,78, trung vị 4,6, lệch trái với đỉnh ở khoảng 4-4,5. Trong hơn 1,12 triệu thí sinh dự thi, chỉ hơn 3.300 em đạt trên 9 điểm - mức rất ít theo đánh giá của ông Dũng. Hơn 500 thí sinh đạt 10, tức 2.000 em mới có một người đạt tuyệt đối. Ông Dũng nhận định mức điểm cao phân hóa rõ ràng. So sánh với phổ điểm các năm trước, phổ điểm Toán năm nay không còn xô lệch về bên phải, mà gần với phân bổ chuẩn hơn, theo đại diện tổ phân tích phổ điểm của Bộ. Phổ điểm môn Tiếng Anh ghi nhận ý kiến tương tự, khi đã loại bỏ được dạng ""hình yên ngựa"" với hai đỉnh như các năm trước. TS Ngôn ngữ học giáo dục Nguyễn Thanh Thúy, khoa Tiếng Anh, trường Đại học Hà Nội, cho biết một phổ điểm đẹp sẽ có đỉnh rơi vào điểm giữa (5/10), hai dốc chia đều sang hai bên, thể hiện mức điểm phân tán đều. Phổ điểm có đỉnh ở khoảng 5-5,25, điểm trung bình 5,38, hơi lệch phải. Số thí sinh đạt điểm 10 là 141 và chỉ hơn 30 điểm liệt (từ 1 trở xuống). ""Điều này cho thấy đề thi không khiến thí sinh trượt tốt nghiệp, nhưng cũng không dễ đạt tuyệt đối"", cô Thúy nói. ""Đây là phổ điểm đẹp, nhưng phù hợp với tính chất kỳ thi đại học hơn là xét tốt nghiệp"". Tuy nhiên, các chuyên gia giáo dục cũng nhìn thấy một số vấn đề trong dạy và học từ phổ điểm các môn thi. Ông Trần Nam Dũng cho rằng chỉ 12% thí sinh đạt từ 7 điểm Toán trở lên là ""quá thấp"". Cùng với đó, 8% thí sinh đạt từ 2,5 điểm trở xuống ""cũng là vấn đề"", đặt ra câu hỏi về việc dạy Toán đại trà ở phổ thông, vì điểm ở mức này tức là ""học sinh không nắm được gì về Toán"". Ông Nguyễn Đình Đức cũng đồng tình là đề thi Toán khó hơn các năm trước, nhưng việc điểm trung bình giảm 1,67, từ 6,45 xuống 4,78 còn có thể do thí sinh không để ý đề tham khảo, chưa học thật, chưa nắm được thực chất. Với môn Tiếng Anh, cô Thúy băn khoăn về độ khó của đề. Theo cô, một trong những lý do chính khiến phổ điểm Tiếng Anh đẹp là vì mẫu số đánh giá giảm so với mọi năm. Năm nay, đây là môn tự chọn, chỉ có hơn 350.000 thí sinh đăng ký, giảm khoảng 650.000 so với các năm trước. Chưa kể, những em chọn môn này để thi đều có sự chuẩn bị, ôn tập. Tuy nhiên, nếu so với đỉnh thứ hai của phổ điểm các năm trước (thường quanh mức 8,5-9), cô Thúy đánh giá điểm năm nay thấp hơn, cho thấy mặt bằng chung là đề khó hơn hẳn. ""Độ khó của đề vẫn khiến cho những em chỉ cần thi tốt nghiệp thấy kết quả không phản ánh thỏa đáng những gì được học ở trường phổ thông"", cô Thúy nói. Ngoài ra, trong bối cảnh hầu hết trường đại học vẫn sử dụng điểm thi tốt nghiệp để xét tuyển, đồng thời Tiếng Anh góp mặt ở đa số tổ hợp, cô Thúy lo bất công giữa thí sinh dùng điểm thi tốt nghiệp với nhóm có IELTS và các chứng chỉ quốc tế khác. Hiện, hầu hết trường quy đổi 6.5 IELTS thành 9-10 điểm Tiếng Anh, trong khi thí sinh có IELTS mức này khó đạt được mức điểm tương đương khi thi tốt nghiệp. Còn ông Đức băn khoăn về tỷ lệ 38% thí sinh dưới trung bình, dù nhóm này so với nhóm dưới trung bình năm ngoái có thể học tốt hơn, do đề khó hơn, yêu cầu đầu ra nâng từ A2 lên B1 (từ bậc 2 lên 3, theo khung năng lực ngoại ngữ 6 bậc). Theo ông, với định hướng đưa Tiếng Anh trở thành ngôn ngữ thứ hai trong trường học, tỷ lệ điểm dưới trung bình môn này cần phải được cải thiện trong thời gian tới. Để từ năm sau, thí sinh không bị sốc về đề thi phân hóa, ông Đức đề nghị Bộ công bố đề minh họa với độ khó tương đương, tuyên truyền sớm và liên tục để thí sinh và xã hội hiểu mục tiêu của kỳ thi, không chỉ để xét tốt nghiệp mà còn làm căn cứ tuyển sinh đại học. ""Đề thi năm nay là sự cảnh tỉnh để học sinh phải học thật, nắm được thực chất"", ông Đức nói. Sáng mai, Bộ sẽ công bố điểm thi tốt nghiệp của hơn 1,16 triệu thí sinh. Các em tra cứu điểm thi tốt nghiệp THPT 2025 tại:https://diemthi.vnexpress.net. Sau khi biết điểm, thí sinh có 10 ngày để nộp đơn phúc khảo nếu muốn, hạn cuối là 25/7. Thí sinh sẽ nhận được giấy chứng nhận kết quả thi, chứng nhận tốt nghiệp tạm thời, học bạ THPT, chậm nhất vào 22/7. Thời gian đăng ký, điều chỉnh và bổ sung nguyện vọng xét tuyển đại học là từ 16/7 đến 17h ngày 28/7, không giới hạn số lần. Thí sinh nộp lệ phí xét tuyển trực tuyến từ 29/7 đến 17h ngày 5/8. Trước khi đăng ký nguyện vọng, thí sinh truy cập trangTra cứu đại họccủaVnExpressđể xem biến động điểm chuẩn các năm theo ngành, trường hay học phí. Hệ thống cũng đưa ra gợi ý nhóm ngành, trường năm ngoái có điểm chuẩn tiệm cận mức thí sinh đạt được theo từng tổ hợp. Điểm chuẩn đại học năm 2025 được công bố trước 17h ngày 22/8. Thanh Hằng - Tâm Lệ"
VN Express,https://vnexpress.net/truong-dai-hoc-can-tho-len-dai-hoc-4914573.html,Tin tức,"Đồng bằng sông Cửu Long,Đại học Cần Thơ,giáo dục đại học","Thứ ba, 15/7/2025, 19:16 (GMT+7)",Trường Đại học Cần Thơ lên đại học,"Trường Đại học Cần Thơ trở thành đại học đầu tiên ở Đồng bằng sông Cửu Long, theo quyết định của Chính phủ ngày 15/7. Chính phủ yêu cầu Đại học Cần Thơ thực hiện tổ chức lại cơ cấu tổ chức và hoạt động trên cơ sở trường Đại học Cần Thơ theo Luật Giáo dục đại học và các quy định liên quan. Hội đồng trường, chủ tịch hội đồng trường, hiệu trưởng trường Đại học Cần Thơ tiếp tục thực hiện chức năng, nhiệm vụ, quyền hạn cho đến khi Bộ trưởng Bộ Giáo dục và Đào tạo quyết định thành lập Hội đồng đại học. Trước đó, cả nước có 8 đại học công lập là: Đại học Quốc gia Hà Nội, Đại học Quốc gia TP HCM, Đại học Thái Nguyên, Huế, Đà Nẵng, Bách khoa Hà Nội, Kinh tế TP HCM, Kinh tế Quốc dân, cùng hai đại học tư thục Duy Tân và Phenika. Theo Luật Giáo dục đại học năm 2018, trường đại học và đại học là hai khái niệm khác nhau. Trường đại học, học viện là cơ sở đào tạo và nghiên cứu nhiều ngành. Còn đại học đào tạo, nghiên cứu nhiều lĩnh vực, gồm các trường đại học, khoa thành viên. Để chuyển từ trường đại học thành đại học, Nghị định 99 năm 2019 của Chính phủ quy định các trường cần đảm bảo ba điều kiện: được tổ chức kiểm định hợp pháp đánh giá đạt chuẩn chất lượng; có ít nhất ba trường và 10 ngành đào tạo tiến sĩ, quy mô sinh viên chính quy trên 15.000; được cơ quan quản lý trực tiếp, các nhà đầu tư chấp thuận. Nhiều trường hiện đặt mục tiêu thành đại học như Y Hà Nội, Y Dược TP HCM, Công nghiệp Hà Nội... Trường Đại học Cần Thơ được thành lập từ năm 1966 với tên gọi Viện Đại học Cần Thơ. Sau năm 1975, viện được đổi tên thành trường Đại học Cần Thơ, là cơ sở đào tạo đại học và sau đại học trọng điểm của ở Đồng bằng sông Cửu Long, đóng vai trò trung tâm văn hóa - khoa học kỹ thuật của vùng. Đại học Cần Thơ hiện có 6 trường thành viên, gồm: Trường Bách khoa, Công nghệ thông tin và Truyền thông, Kinh tế, Nông nghiệp, Sư phạm, Thủy sản. Ngoài ra, trường còn có 10 khoa, 3 viện nghiên cứu và một trường THPT Thực hành Sư phạm và hai phân hiệu. Trường có hơn 47.000 sinh viên, học viên sau đại học. Lệ Nguyễn"
VN Express,https://vnexpress.net/diem-san-cong-thuc-quy-doi-diem-chuan-dai-hoc-cong-nghe-tp-hcm-2025-4914708.html,Tin tức,"điểm sàn,Đại học Kỹ thuật Công Nghệ,xét tuyển đại học 2025,điểm thi tốt nghiệp THPT 2025,điểm chuẩn đại học 2025,công thức quy đổi điểm chuẩn","Thứ ba, 15/7/2025, 18:54 (GMT+7)",Điểm sàn Đại học Công nghệ TP HCM giảm đến 4 điểm,"Trường Đại học Công nghệ TP HCM (HUTECH) nhận hồ sơ từ 15 điểm, giảm 1-4 điểm so với năm ngoái, là trường đầu tiên công bố sàn theo kết quả thi tốt nghiệp THPT. Chiều 15/7, trường Đại học Công nghệ TP HCM công bố ngưỡng đảm bảo chất lượng (điểm sàn) của các phương thức xét tuyển. Xét theo điểm thi tốt nghiệp THPT 2025, thí sinh đạt từ 15 điểm trở lên là đủ điều kiện nộp hồ sơ vào trường. Mức này giảm 1-4 điểm so với năm ngoái. Nếu xét bằng kết quả học bạ, thí sinh phải có tổng điểm trung bình ba môn ở lớp 12 đạt 18 điểm. Với phương thức thi đánh giá năng lực của Đại học Quốc gia TP HCM hoặc V-SAT, trường nhận hồ sơ từ 15 điểm (quy đổi về thang điểm 30). Riêng các ngành thuộc nhóm Sức khỏe, ngưỡng đảm bảo chất lượng đầu vào theo quy định riêng của Bộ Giáo dục và Đào tạo, sẽ được công bố sau. Đồng thời, HUTECH công bố công thức quy đổi điểm sàn, chuẩn đầu vào. Cụ thể, mức điểm chuẩn giữa các phương thức xét tuyển khác nhau được quy đổi từ bảng phân vị tương quan với các giá trị khoảng điểm phân vị cụ thể theo phương pháp nội suy hàm. Theo đó, từ mức điểm chuẩn x thuộc khoảng phân vị (a, b) của phương thức tuyển sinh này sẽ được nội suy tương đương sang mức điểm chuẩn y thuộc khoảng phân vị (c, d) tương ứng với phương thức tuyển sinh khác theo công thức: Bảng phân vị tương quan mức điểm giữa các phương thức xét tuyển của HUTECH như sau: Năm nay, trường tuyển khoảng 13.500 sinh viên cho 61 ngành ba phương thức, gồm: xét điểm thi tốt nghiệp THPT, xét học bạ bằng điểm trung bình ba môn lớp 12 và xét tuyển kết quả kỳ thi đánh giá năng lực 2025 của Đại học Quốc gia TP HCM hoặc kỳ thi V-SAT. Năm ngoái, điểm chuẩn xét bằng kết quả thi tốt nghiệp THPT của HUTECH từ 16 đến 21, cao nhất ở ngành Công nghệ thông tin và Dược học. Lệ Nguyễn"
VN Express,https://vnexpress.net/ninh-binh-dan-dau-diem-toan-thi-tot-nghiep-thpt-2025-4914432.html,Tin tức,"tra cứu điểm thi,phổ điểm Toán,điểm thi tốt nghiệp THPT 2025,điểm thi Toán tốt nghiệp THPT","Thứ ba, 15/7/2025, 16:56 (GMT+7)",Ninh Bình dẫn đầu điểm Toán thi tốt nghiệp THPT 2025,"Với trung bình 5,4 điểm mỗi thí sinh, Ninh Bình (Hà Nam, Nam Định, Ninh Bình cũ) dẫn đầu cả nước ở môn Toán tốt nghiệp THPT 2025, còn lại hầu hết dưới 5. Chiều 15/7, Bộ Giáo dục và Đào tạo công bố phổ điểm và thống kê điểm thi tốt nghiệp THPT 2025 theo địa phương. Ở môn Toán, 5 trong 10 địa phương dẫn đầu có điểm trung bình dưới 5. Ninh Bình dẫn đầu với 5,4 điểm. Xếp sau là Hà Nội và TP HCM với điểm trung bình lần lượt 5,28 và 5,26. Đây là hai địa phương có số lượng thí sinh dự thi lớn nhất cả nước. Hải Phòng (Hải Phòng, Hải Dương cũ) vào top 4 với 5,1 điểm. Ngược lại, Bắc Ninh (Bắc Ninh và Bắc Giang cũ) tụt ba bậc xuống vị trí thứ 6. Top 10 môn Tiếng Anh-Top 10 môn Văn Kỳ thi tốt nghiệp THPT diễn ra hôm 26-27/6 với hơn 1 triệu thí sinh. Nhóm thi theo chương trình giáo dục phổ thông mới (2018) làm bốn bài thi, trong đó Toán, Văn là bắt buộc. Sau khi biết điểm thi tốt nghiệp THPT, thí sinh có 10 ngày để nộp đơn phúc khảo nếu muốn, hạn cuối vào 25/7. Từ 16/7, thí sinh có thể đăng ký, điều chỉnh và bổ sung nguyện vọng xét tuyển đại học không giới hạn số lần, đến 17h ngày 28/7, sau đó nộp lệ phí xét tuyển trực tuyến từ 29/7 đến 17h ngày 5/8. Điểm chuẩn đại học được công bố trước 17h ngày 22/8. Thí sinh truy cập trangTra cứu đại họccủaVnExpressđể xem biến động điểm chuẩn các năm theo ngành, trường. Hệ thống cũng đưa ra gợi ý nhóm ngành, trường năm ngoái có điểm chuẩn tiệm cận mức điểm thí sinh đạt được theo từng tổ hợp. Lệ Nguyễn"
VN Express,https://vnexpress.net/hon-930-thi-sinh-bi-diem-liet-mon-toan-dong-nhat-4914655.html,Tin tức,"điểm liệt,điểm thi tốt nghiệp THPT 2025,phổ điểm thi tốt nghiệp THPT 2025,tra cứu điểm thi tốt nghiệp THPT 2025","Thứ ba, 15/7/2025, 16:42 (GMT+7)","Hơn 930 thí sinh bị điểm liệt, môn Toán đông nhất","Cả nước có 936 thí sinh bị điểm liệt (từ 1 trở xuống) trong kỳ thi tốt nghiệp THPT 2025, trong đó 777 em ở môn Toán, gấp 10 lần so với năm ngoái. Chiều 15/7, Bộ Giáo dục và Đào tạo công bố phổ điểm 12 môn thi tốt nghiệp THPT năm 2025. Môn Toán có nhiều thí sinh bị điểm liệt nhất, sau đó là môn Văn với 87 em, tăng 68. Ở các môn còn lại, số điểm liệt giảm. Cụ thể, môn Tiếng Anh có 28 thí sinh bị điểm liệt, giảm 5 lần so với năm ngoái. Các môn Sử, Địa có 13-19 em đạt từ 1 điểm trở xuống, giảm lần lượt 20 và 75. Lý và Sinh có mức giảm khá mạnh, khi chỉ có 1-3 em. Bốn môn mới năm nay là Tin học, Giáo dục Kinh tế và Pháp luật, Công nghệ Nông nghiệp và Công nghiệp, không có em nào ""dính"" điểm liệt. Phổ điểm 12 môn thi tốt nghiệp THPT năm 2025 Tìm trường đại học, ngành có điểm chuẩn gần với điểm thi Kỳ thi tốt nghiệp THPT diễn ra hôm 26-27/6 với hơn 1,07 triệu thí sinh. Theo kế hoạch của Bộ Giáo dục và Đào tạo, thời gian đăng ký, điều chỉnh và bổ sung nguyện vọng xét tuyển đại học là từ 16/7 đến 17h ngày 28/7, không giới hạn số lần. Thí sinh nộp lệ phí xét tuyển trực tuyến từ 29/7 đến 17h ngày 5/8. Công thức tính điểm xét tốt nghiệp THPT 2025 Trước khi đăng ký nguyện vọng, thí sinh truy cập trangTra cứu đại họccủaVnExpressđể xem biến động điểm chuẩn các năm theo ngành, trường hay học phí. Hệ thống cũng đưa ra gợi ý nhóm ngành, trường năm ngoái có điểm chuẩn tiệm cận mức thí sinh đạt được theo từng tổ hợp. Điểm chuẩn đại học năm 2025 được công bố trước 17h ngày 22/8. Dương Tâm - Doãn Hùng"
VN Express,https://vnexpress.net/pho-diem-sinh-hoc-thi-tot-nghiep-thpt-2025-4914263.html,Tin tức,"phổ điểm Sinh học,điểm thi tốt nghiệp THPT 2025,phổ điểm thi tốt nghiệp THPT 2025,điểm thi Sinh học,tra cứu điểm thi tốt nghiệp THPT 2025","Thứ ba, 15/7/2025, 15:47 (GMT+7)",Phổ điểm Sinh học thi tốt nghiệp THPT 2025,"Phổ điểm môn Sinh của hơn 72.700 thí sinh thi tốt nghiệp THPT năm 2025 được Bộ Giáo dục và Đào tạo công bố chiều 15/7. Phổ điểm 12 môn thi tốt nghiệp-Top 10 tỉnh, thành về điểm môn Sinh Điểm trung bình môn Sinh là 5,78, giảm 0,5 so với năm ngoái. Phổ điểm năm nay có sự trải dài, ít điểm giỏi so với năm trước. Cả nước có 82 bài đạt điểm 10 môn Sinh, trong đó TP HCM nhiều nhất (20). Bắc Ninh là địa phương có điểm trung bình cao nhất. Kỳ thi tốt nghiệp THPT diễn ra hôm 26-27/6 với hơn 1 triệu thí sinh. Nhóm thi theo chương trình giáo dục phổ thông mới (2018) làm bốn bài thi. Trong đó, hai môn bắt buộc là Ngữ văn và Toán. Sinh học được khoảng 72.700 chọn. Đề Sinh học thi tốt nghiệp THPT gồm 28 câu hỏi, trong đó 18 câu chọn phương án, 4 chọn đúng/sai và 6 dạng trả lời ngắn. Thí sinh làm bài trong 50 phút. Năm ngoái, 34 em đạt điểm tuyệt đối môn Sinh, ngược lại gần 46.000 bài thi bị điểm liệt (dưới 1), tương đương khoảng 13,4%. Điểm trung bình chung của cả nước là 6,28. Sau khi biết điểm thi tốt nghiệp THPT, thí sinh có 10 ngày để nộp đơn phúc khảo nếu muốn, hạn cuối vào 25/7. Tìm ngành, trường đại học phù hợp Ngay hôm nay, thí sinh có thể đăng ký, điều chỉnh và bổ sung nguyện vọng xét tuyển đại học không giới hạn số lần, đến 17h ngày 28/7. Sau đó, các em nộp lệ phí xét tuyển trực tuyến từ 29/7 đến 17h ngày 5/8. Điểm chuẩn đại học được công bố trước 17h ngày 22/8. Lệ Nguyễn"
VN Express,https://vnexpress.net/pho-diem-tieng-anh-thi-tot-nghiep-thpt-2025-4914255.html,Tin tức,"điểm thi Tiếng Anh,điểm thi tốt nghiệp THPT 2025,phổ điểm thi môn Tiếng Anh","Thứ ba, 15/7/2025, 15:45 (GMT+7)",Phổ điểm Tiếng Anh thi tốt nghiệp THPT 2025,"Cả nước có 141 thí sinh đạt điểm 10 tiếng Anh, giảm bốn lần so với năm ngoái. Phổ điểm thi tốt nghiệp THPT 2025 môn Tiếng Anh của gần 353.000 thí sinh, được Bộ Giáo dục và Đào tạo công bố chiều 15/7. Điểm trung bình của thí sinh là 5,38, giảm 0,13 điểm. Điểm trung vị là 5,25, tăng 0,05 điểm. Top 10 tỉnh, thành về điểm Tiếng Anh-Phổ điểm tất cả môn thi tốt nghiệp Phổ điểm môn Tiếng Anh thi tốt nghiệp THPT 2025 như sau: Kỳ thi tốt nghiệp THPT năm 2025 diễn ra hôm 26-27/6 với khoảng 1,1 triệu thí sinh. Nhóm học sinh theo chương trình giáo dục phổ thông mới, ngoài hai bài thi bắt buộc là Toán và Văn, các em chọn 2 môn đã học trong chương trình. Tiếng Anh có gần 353.000 em chọn. Đề có 40 câu trắc nghiệm, thời gian làm bài 50 phút. Ngay sau khi rời phòng thi, nhiều thí sinh thanđề Tiếng Anhkhó và dài, nhiều từ mới học thuật xa vời với cấp THPT. Một số em với chứng chỉ IELTS đạt 7.0 phần Đọc nói không tự tin với đề thi tốt nghiệp, chỉ được khoảng 7 điểm. Các giáo viên đưa ra nhận định tương tự. Nhiều câu hỏi ở trình độ B2-C2 trong khi chuẩn đầu ra môn Tiếng Anh của học sinh lớp 12 là B1, tương đương bậc 3/6. Sau khi biết điểm thi tốt nghiệp THPT, thí sinh có 10 ngày để nộp đơn phúc khảo nếu muốn, hạn cuối vào 25/7. Tìm ngành, trường đại học phù hợp với điểm thi Từ 16/7, thí sinh có thể đăng ký, điều chỉnh và bổ sung nguyện vọng xét tuyển đại học không giới hạn số lần, đến 17h ngày 28/7. Sau đó, các em nộp lệ phí xét tuyển trực tuyến từ 29/7 đến 17h ngày 5/8. Điểm chuẩn đại học năm 2025 được công bố trước 17h ngày 22/8. Lệ Nguyễn"
VN Express,https://vnexpress.net/de-thi-olympic-toan-quoc-te-imo-2025-4914518.html,Tin tức,"Olympic Toán quốc tế,IMO,đề thi IMO","Thứ ba, 15/7/2025, 14:09 (GMT+7)",Đề thi Olympic Toán quốc tế 2025,"6 thành viên đội tuyển Việt Nam bước vào ngày đầu thi Olympic Toán quốc tế (IMO) 2025, với ba bài trong 4,5 tiếng, tại Australia. Đề thi IMO ngày 1 (15/7): Kỳ thi Olympic Toán quốc tế 2025 được tổ chức tại Australia từ ngày 10 đến 20/7, trong đó ngày thi chính thức là 15 và 16. Năm nay, học sinh tham gia đến từ gần 100 quốc gia và vùng lãnh thổ. Đội tuyển Việt Nam có 6 học sinh, gồm Nguyễn Đình Tùng (lớp 11, THPT chuyên khoa học Tự nhiên, Đại học Quốc gia Hà Nội), Trần Minh Hoàng, (lớp 12, THPT chuyên Hà Tĩnh), Võ Trọng Khải (lớp 12, THPT chuyên Phan Bội Châu, Nghệ An), Trương Thanh Xuân (lớp 11, THPT chuyên Bắc Ninh), Nguyễn Đăng Dũng, (lớp 12, THPT chuyên Khoa học Tự nhiên, Đại học Quốc gia Hà Nội), Lê Phan Đức Mân (lớp 12, THPT chuyên Lê Hồng Phong, TP HCM). Mỗi ngày thi, các thí sinh phải giải ba bài toán trong 4,5 tiếng. Điểm tối đa cho mỗi bài là 7. Thí sinh có thể nhận đề bài bằng tiếng mẹ đẻ, nhưng phải đăng ký trước và được ban tổ chức phê duyệt. Dựa vào tổng điểm hai bài thi, ban tổ chức xếp giải từ cao xuống thấp. Tổng số huy chương vàng, bạc, đồng chiếm khoảng 50% tổng số thí sinh tham dự. IMO được tổ chức thường niên kể từ năm 1959. Việt Nam tham gia sân chơi này vào năm 1974. Năm ngoái, trong 6 học sinh tham dự, đoàn Việt Nam có hai huy chương bạc, ba huy chương đồng và một bằng khen, đứng thứ 33 trên 108 đội. Đây là thành tích thấp nhất trong 50 năm Việt Nam dự IMO (trừ một số năm không xếp hạng toàn đoàn). Thanh Hằng"
