Source,URL,Category,Keyword,Time,Title,Content
ZNews,https://znews.vn/msb-lay-du-lieu-lam-nen-tang-nang-tam-trai-nghiem-bang-cong-nghe-post1608787.html,Kinh doanh,Null,"Thứ hai, 8/12/2025 10:00 (GMT+7)","MSB lấy dữ liệu làm nền tảng, nâng tầm trải nghiệm bằng công nghệ","Khi hành vi người dùng dịch chuyển lên môi trường số, các ngân hàng phải thay đổi cách vận hành từ cung cấp sản phẩm đại trà sang kiến tạo trải nghiệm cá nhân hóa. Dữ liệu trở thành chìa khóa của hành trình đó. MSB không nằm ngoài xu hướng, khi xác định cách xử lý dữ liệu thông minh không chỉ phục vụ tốt hơn, mà còn có thể chinh phục mục tiêu “ngân hàng của từng khách hàng”. Bên cạnh chiến lược dữ liệu thông minh, MSB chú trọng đầu tư vào công nghệ bảo mật hiện đại, như “lá chắn số” bảo vệ dữ liệu người dùng. Tại MSB, dữ liệu được xem là nền tảng cốt lõi để định hình chiến lược kinh doanh và đổi mới trải nghiệm khách hàng. Việc ứng dụng dữ liệu xuyên suốt toàn hệ thống giúp ngân hàng không chỉ rút ngắn quy trình, mà còn mở rộng khả năng sáng tạo sản phẩm, dịch vụ theo hướng cá nhân hóa. Theo đó, khách hàng cá nhân có thể mở thẻ tín dụng MSB trực tuyến bằng vài thao tác đơn giản. Hệ thống sẽ phân tích dữ liệu tự động và trả kết quả phê duyệt trong 5 phút với hạn mức thẻ lên đến 100 triệu đồng. Mỗi quyết định dựa trên dữ liệu hành vi và chỉ số đánh giá được xử lý bằng mô hình máy học. Kết quả là trải nghiệm tức thì, minh bạch và an toàn, đáp ứng kỳ vọng khách hàng. Với giải pháp phát hành thẻ tín dụng trực tuyến, khách hàng có thể đăng ký và sử dụng thẻ trong vài phút. Đối với khách hàng doanh nghiệp, sản phẩm M-Flex đánh dấu bước tiến trong việc ứng dụng dữ liệu để nâng cao hiệu suất phục vụ. Dựa trên thuật toán phân tích, MSB có thể phê duyệt khoản vay thế chấp trực tuyến lên đến15 tỷ đồngtrong 4 giờ làm việc. Toàn bộ quy trình từ đăng ký, xét duyệt đến giải ngân đều được thực hiện online, giúp khách hàng tiết kiệm thời gian mà vẫn đảm bảo kiểm soát rủi ro cho ngân hàng. Đặc biệt, trong hoạt động tiếp thị và chăm sóc khách hàng, dữ liệu là chìa khóa cho việc cá nhân hóa trải nghiệm. MSB đầu tư vào hạ tầng dữ liệu và nền tảng Martech tiên tiến để hiểu hành vi khách hàng tại mọi điểm chạm. Hệ thống phân tích dữ liệu đa tầng cho phép ngân hàng nhận diện “khoảnh khắc vàng” trong hành trình sử dụng dịch vụ - thời điểm ưu đãi hoặc sản phẩm phù hợp có thể tạo “cú hích” trong lựa chọn của khách hàng và mang đến sự hài lòng vượt kỳ vọng. Song song, hệ thống lắng nghe khách hàng đa kênh của MSB đang ghi nhận hơn 80.000 phản hồi được phân tích và chuyển hóa thành dữ liệu phục vụ việc cải tiến dịch vụ. Việc “nghe, hiểu và đáp ứng” trở nên nhanh chóng và hiệu quả, giúp MSB điều chỉnh quy trình, cập nhật chính sách và mang đến trải nghiệm tối ưu cho khách hàng. Để dữ liệu phát huy đầy đủ giá trị, cách thức quản trị và khai thác hiệu quả là yếu tố được MSB chú trọng. Ngân hàng đưa vào sử dụng bộ giải pháp IBM Cloud Pak for Data - một trong những nền tảng dữ liệu lớn hiện đại hàng đầu hiện nay. Trong đó, IBM Knowledge Catalog đóng vai trò trung tâm, là “bộ não” hiểu biết tài sản dữ liệu mà ngân hàng sở hữu, đồng thời cung cấp tính năng quản trị bộ chính sách dữ liệu chặt chẽ như quyền truy cập, quyền riêng tư, chất lượng dữ liệu và tiện ích giúp tăng tốc độ thu thập, làm giàu từ điển dữ liệu một cách chủ động. Dữ liệu là nền tảng để MSB sáng tạo giải pháp tài chính cá nhân hóa và siêu tốc. Bên cạnh đó, giải pháp như IBM Watsonx.Data, IBM Watson.AI cũng được MSB ứng dụng đồng bộ nhằm tạo ra hệ sinh thái dữ liệu thống nhất. Hệ thống này cho phép tự động hóa quá trình làm sạch, đồng bộ, lưu trữ và phân tích dữ liệu trong thời gian ngắn. Nhờ đó, MSB đạt bước tiến lớn về tốc độ chuẩn hóa và chất lượng dữ liệu. Hàng nghìn điểm dữ liệu mới được cập nhật liên tục, “làm sạch” và đóng gói thành “sản phẩm dữ liệu” sẵn sàng phục vụ cho ứng dụng kinh doanh, nghiên cứu thị trường hay mô hình phân tích dự báo. Việc ứng dụng công nghệ hiện đại giúp dữ liệu được khai thác chủ động, liên tục và linh hoạt trong mọi hoạt động, từ đó thúc đẩy văn hóa ra quyết định dựa trên dữ liệu, khi mọi hành động đều được dẫn dắt bởi góc nhìn số và số liệu thực tế. Với MSB, dữ liệu là công cụ để thấu hiểu, dự đoán và đồng hành khách hàng trong từng quyết định tài chính. MSB đang tiến gần đến mong muốn xây dựng ngân hàng “hiểu khách hàng trước khi họ nói ra”, nơi mỗi sản phẩm, mỗi tương tác đều mang dấu ấn cá nhân hóa. Đó là cách ngân hàng biến dữ liệu thành giá trị thực và đưa công nghệ thành động lực cho trải nghiệm ngân hàng khác biệt.  12:00 2/12/202512:002/12/2025 0 Ngân hàng TMCP Hàng Hải Việt Nam (MSB) vừa chính thức công bố chiến lược dành cho phân khúc khách hàng thu nhập cao (Affluent) và ra mắt thẻ tín dụng MSB Mastercard Green World.  13:00 27/11/202513:0027/11/2025 0 MSB tự hào khi 3 năm liên tiếp góp mặt trong ""Top 100 Nơi làm việc tốt nhất Việt Nam"" và đạt chứng nhận ""Nguồn nhân lực Hạnh phúc"" năm 2025.  11:00 4/12/202511:004/12/2025 0 Xã hội hiện đại tạo động lực để nhà lãnh đạo tái định nghĩa khái niệm thành công, khi quyết định của họ vượt trên lợi ích cá nhân, hướng đến con người và cộng đồng."
ZNews,https://znews.vn/gia-vang-tang-nhe-dau-tuan-post1609332.html,Kinh doanh,Null,"Thứ hai, 8/12/2025 10:02 (GMT+7)",Giá vàng tăng nhẹ đầu tuần,"Giá vàng miếng trong nước bật tăng lên vùng cao mới trong phiên giao dịch sáng 8/12. Ảnh:Châu Dương. Không khí giao dịch vàng trong sáng nay (8/12) sôi động hơn khi các thương hiệu lớn đồng loạt đẩy giá, tạo nên một phiên mở màn đầy kịch tính cho thị trường. Tại Công ty TNHH MTV Vàng bạc đá quý Sài Gòn (SJC),giá vàngmiếng được niêm yết ở mức 152,5 - 154,5 triệu đồng/lượng, tăng 300.000 đồng ở cả hai chiều so với cuối phiên trước. Hiệu ứng tăng giá nhanh chóng lan rộng sang CTCP Vàng bạc đá quý Phú Nhuận (PNJ), Tập đoàn DOJI, Tập đoàn Phú Quý, Bảo Tín Minh Châu, Bảo Tín Mạnh Hải, Công ty Mi Hồng... khi các doanh nghiệp đồng loạt điều chỉnh tăng gần nửa triệu đồng/lượng, kéo mặt bằng giá chung tiến thẳng lên mốc 154,5 triệu đồng/lượng. Diễn biến đảo chiều mạnh của vàng miếng diễn ra ngay sau khi giá từng rơi xuống đáy tuần ở 153,8 triệu đồng/lượng vào phiên ngày 4/12. Dù vậy, so với đầu tuần trước, vàng miếng hiện vẫn thấp hơn gần 500.000 đồng/lượng. Trái với sự bứt tốc của vàng miếng, vàng nhẫn sáng nay lại gần như đứng yên tại nhiều thương hiệu. SJC giữ nguyên giá vàng nhẫn 99,99 loại 1-5 chỉ ở mức 149,5 - 152 triệu đồng/lượng. DOJI và Phú Quý cùng niêm yết mức 150 - 153 triệu đồng/lượng. Riêng Bảo Tín Minh Châu và Bảo Tín Mạnh Hải neo tại 150,8 - 153,8 triệu đồng/lượng, tăng 300.000 đồng so với giá chốt phiên cuối tuần trước. Trong khi đó, Mi Hồng tiếp tục thiết lập mặt bằng giá cao nhất thị trường, giao dịch ở 153,2 - 154,5 triệu đồng/lượng, tăng 200.000 đồng chiều mua và 300.000 đồng chiều bán. Trên thị trường quốc tế, giá vàng mở cửa tuần mới tại mức4.198 USD/ounce, tăng nhẹ so với cuối tuần trước. Sau nhịp suy yếu vào cuối tuần, vàng nhanh chóng phục hồi khi đồng USD hạ nhiệt, chỉ số USD Index giảm sâu dưới mốc 99 điểm. Theo giới phân tích, đà tăng của vàng vẫn mạnh mẽ trong bối cảnh chỉ số USD Index và lợi suất trái phiếu chính phủ Mỹ cùng duy trì ở mức thấp. Điều này phản ánh kỳ vọng của giới đầu tư rằng Cục Dự trữ Liên bang Mỹ (Fed) có thể tiếp tục hạ lãi suất ngay trong tháng này. Khảo sát củaReuterscho thấy thị trường đang nghiêng về kịch bản lãi suất giảm xuống mức 3,125% vào cuối năm 2026. Hiện giá vàng thế giới quy đổi (chưa gồm thuế, phí) tương đương khoảng 134 triệu đồng/lượng, thấp hơn giá vàng trong nước gần 20 triệu đồng/lượng. Trong môi trường kinh tế hiện nay, đầu tư trở thành khái niệm phổ biến. Để độc giả có thể tiếp cận những xu hướng đầu tư mới nhất,Tri Thức - Znewsxây dựng chủ đềĐầu tư qua sách- nơi ghi lại những cuốn sách, câu chuyện, xu hướng đầu tư đã và đang diễn ra trong nước và thế giới. Không chỉ tập trung vào các lĩnh vực đầu tư phổ biến như bất động sản, chứng khoán, trái phiếu, ngoại hối, tiền ảo... Đầu tư qua sách còn bao gồm các kiến thức về quản lý gia sản, tài chính cá nhân.  Theo ước tính của Hội đồng Vàng Thế giới, với lượng vàng trị giá 310 tỷ USD tính đến đầu tháng 12, Moskva hiện là nhà đầu tư vàng lớn thứ năm thế giới.  Trong tuần này, phần lớn chuyên gia Phố Wall vẫn tin rằng vàng sẽ tăng giá hoặc đi ngang, chỉ số ít tỏ ra bi quan với triển vọng của kim loại quý trong ngắn hạn.  Sáng nay (7/12), giá vàng miếng SJC ở mốc 154,2 triệu đồng/lượng. Giá vàng nhẫn thấp hơn vàng miếng từ 700.000 - 1,2 triệu đồng/lượng, tùy từng thương hiệu."
ZNews,https://znews.vn/7-mon-do-nho-giup-can-phong-don-giang-sinh-tuc-thi-post1609238.html,Đời sống,Null,"Thứ hai, 8/12/2025 10:38 (GMT+7)",7 món đồ nhỏ giúp căn phòng 'đón' Giáng sinh tức thì,"Đèn dây led vàng ấm.Ánh sáng vàng nhẹ của đèn dây luôn tạo cảm giác ấm cúng và dễ chịu. Chỉ cần treo một chút quanh cửa sổ hay đầu giường sẽ góp phần đem không khí Giáng sinh đến cho căn phòng. Đây cũng là món đồ dễ mua và dễ kết hợp với mọi phong cách trang trí. Vòng nguyệt quế mini.Một chiếc vòng nguyệt quế kích thước nhỏ có thể treo ở cửa phòng hoặc trên tường. Chất liệu lá thông, ruy băng đỏ hay ít quả thông khô sẽ mang đến cảm giác lễ hội ngay lập tức. Món đồ này vừa đẹp vừa dễ thay đổi màu sắc theo sở thích. Tất treo Giáng sinh.Chiếc tất đỏ treo đầu giường hoặc cạnh bàn làm việc là biểu tượng quen thuộc của mùa Noel. Chỉ một chi tiết nhỏ cũng đủ khiến không gian trở nên vui mắt hơn. Bạn có thể đặt bên trong vài món đồ xinh xắn để tăng sự bất ngờ. Nến thơm hương thông - quế.Mùi hương là cách nhanh nhất để tạo bầu không khí. Nến thơm hương thông, quế hay gừng sẽ giúp căn phòng gợi nhớ ngay đến Giáng sinh. Đây cũng là cách mang lại cảm giác thư giãn sau một ngày dài. Hộp nhạc Giáng sinh mini.Âm thanh du dương từ hộp nhạc mang lại cảm giác bình yên và hoài niệm. Chỉ cần đặt trên bàn học hay kệ sách, giai điệu quen thuộc sẽ tạo nên sắc thái lễ hội rất riêng. Món đồ nhỏ nhưng giúp tinh thần được “bật mood” ngay. Gối ôm hoặc vỏ gối họa tiết Noel.Các họa tiết như tuần lộc, kẹo gậy, bông tuyết hay chỉ đơn giản là thêm sắc xanh, đỏ sẽ giúp phòng ngủ trông mới mẻ hơn chỉ trong vài phút. Thay vỏ gối là cách trang trí tiết kiệm mà hiệu quả. Đây cũng là cách thêm chút ấm áp cho những ngày cuối năm. Một góc cây thông mini.Không cần cây lớn, chỉ một cây hoặc nhánh thông mini đặt trên bàn cũng đủ tạo không khí lễ hội. Bạn có thể tự trang trí bằng bóng nhỏ, dây ruy băng hoặc đèn led. Món đồ nhỏ này mang lại cảm giác Giáng sinh rõ rệt nhất trong căn phòng. Phong cách phỏng vấn lập dị của Steve Jobs Jobs đặt ra những khuôn phép chặt chẽ trong quy trình tuyển dụng. Ông thường hỏi những câu kỳ cục sở trường để xem xét ứng cử viên phản ứng thế nào trong tình huống bất ngờ. Mục tiêu là thu nhận đúng người, những con người sáng tạo, thông minh tinh quái và một chút nổi loạn.  Giáng sinh không chỉ có ánh đèn rực rỡ, các bữa tiệc náo nhiệt. Với người thích sự lặng im, đây còn là thời điểm để tạm rời khỏi ồn ào, tận hưởng kỳ nghỉ lễ riêng tư, thư thái.  20:37 2/12/202520:372/12/2025 0 Giáng sinh đến gần, những món quà nhỏ, dễ kiếm như bánh quy, nến thơm hay túi tote handmade có thể mang lại niềm vui giản dị và ấm áp cho bạn bè trong mùa lễ hội.  17:03 2/12/202517:032/12/2025 0 Là dạ tiệc xa hoa, quy tụ nhiều tiểu thư danh giá nhất thế giới, Le Bal des Débutantes luôn là sự kiện thu hút sự chú ý mỗi lần được tổ chức."
ZNews,https://znews.vn/cong-an-xac-minh-du-an-nuoi-em-nghe-an-bi-to-thieu-minh-bach-post1609326.html,Đời sống,Null,"Thứ hai, 8/12/2025 09:38 (GMT+7)",Công an xác minh dự án 'Nuôi Em Nghệ An' bị tố thiếu minh bạch,"Trao đổi vớiTri Thức - Znews, đại diện Phòng Cảnh sát Hình sự Công an tỉnhNghệ Ancho biết đã tiếp nhận đơn phản ánh từ nhà hảo tâm về tính minh bạch của dự án ""Nuôi Em Nghệ An"" và sẽ xem xét, giải quyết theo thẩm quyền. Những nghi vấn về tính minh bạch của dự án này xuất hiện từ đầu tháng 10 và bùng nổ mạng xã hội những ngày qua khi các mạnh thường quân chia sẻ không thể liên hệ với bà Đỗ Thị Nga - người khởi xướng dự án. Theo thông tin công khai trên trang fanpage có hơn 6.000 người theo dõi, dự án Nuôi Em Nghệ An được phát động vào năm 2018, được lập ra để hỗ trợ bữa ăn bán trú cho học sinh vùng cao trong địa bàn tỉnh. Mỗi ""anh chị nuôi"" sẽ đóng góp khoảng 1,5 triệu đến gần 2 triệu đồng mỗi năm học, nhằm giúp các em nhỏ có bữa trưa đầy đủ hơn. Dự án Nuôi em ở Nghệ An do bà Đỗ Thị Nga khởi xướng bị tố thiếu minh bạch. Bà Đỗ Thị Nga, người khởi xướng và phụ trách dự án, được giới thiệu là Trưởng Ban Thường trực Mạng lưới Tình nguyện Quốc gia khu vực miền Trung - Trung tâm Tình nguyện Quốc gia. Nhận thấy dự án có dấu hiệu thiếu minh bạch, các nhà hảo tâm đã liên hệ với bà Đỗ Thị Nga. Tuy nhiên, từ ngày 15/10 đến nay, họ đã không thể liên lạc với bà Nga để làm rõ các khoản thu, chi. Ngày 23/10, dự án đăng bài viết giải thích về một trong những nghi vấn của nhà hảo tâm. Cụ thể, Nuôi em Nghệ An bị tố sử dụng hình ảnh trong bữa ăn của học trò Trường mầm non Mai Sơn (xã Nhôn Mai), do một quỹ khác hỗ trợ. ""Dự án hoàn toàn không biết những hình ảnh các cô gửi vào nhóm dự án NE (Nuôi em - PV) là hình ảnh bữa ăn của Quỹ Ủng Hộ Các Hoàn Cảnh Khó Khăn hỗ trợ"", phía Nuôi em Nghệ An giải thích. Dưới bài đăng trên fanage, các nhà hảo tâm để lại bình luận yêu cầu bà Nga giải đáp những thắc mắc trong nhóm chungZalosong vẫn không được trả lời. Không nhận được phản hồi, họ đã gửi đơn kiến nghị đến cơ quan chức năng. Cuốn sách viết cho mẹ Có những tình yêu không cần nói thành lời, nhưng vẫn luôn hiện diện, dịu dàng và vĩnh cửu. TrongTriệu lá thư gửi mẹ, mỗi trang sách là một phong thư nhỏ, chứa đựng lời nhắn gửi chân thành và sâu sắc để dành tặng những người phụ nữ quan trọng trong cuộc đời mỗi chúng ta.  Từ dự án thiện nguyện có sức lan tỏa mạnh mẽ trong cộng đồng, Nuôi Em bất ngờ vướng hàng loạt nghi vấn về tính minh bạch trong tài chính và vận hành.  12 giờ trước22:267/12/2025 0 Tối 7/12, ông Hoàng Hoa Trung, người đứng đầu dự án Nuôi Em, thông báo đóng băng tài khoản ngân hàng, tạm dừng dự án để hỗ trợ minh bạch thu chi, giải đáp thắc mắc của nhà tài trợ.  20 giờ trước14:407/12/2025 0 Trước những ồn ào lan truyền trên mạng xã hội về tính minh bạch thông tin, tài chính, đại diện dự án Nuôi Em đã có phản hồi đầu tiên."
ZNews,https://znews.vn/sac-voc-nguoi-dep-tung-vo-dich-giai-the-hinh-han-quoc-post1609203.html,Đời sống,Null,"Thứ hai, 8/12/2025 09:27 (GMT+7)",Sắc vóc người đẹp từng vô địch giải thể hình Hàn Quốc,"Kim Hyo Jung (sinh năm 1992) là người mẫu thể hình nổi tiếng Hàn Quốc. Cô từng góp mặt tại nhiều giải đấu thể hình trong nước lẫn sàn đấu quốc tế. Năm 2023, cô gây chú ý khi giành chức vô địch hạng mục Bikini tại Giải thể hình AGP Pro Hàn Quốc. Cơ bắp săn chắc, vóc dáng chuẩn và nụ cười tỏa nắng giúp cô nhận về nhiều lời tán dương. Chiến thắng đã mở đường để cô tham dự vòng loại Olympia vào cuối năm đó. Thực tế, hành trình chinh phục thể hình của Kim không dễ dàng. Trong một bài đăng trên trang Instagram vào giữa tháng 11, cô tiết lộ ban đầu theo học ngành nghệ thuật và đến với thể hình khá muộn. Cô từng rơi vào tình trạng quá sức với những bài tập cường độ cao lặp đi lặp lại. ""Rồi một tai nạn xe hơi đã buộc tôi phải dừng lại. Tôi đã học được rất nhiều từ khoảng thời gian nghỉ ngơi đó"", Kim kể về biến cố của mình, nhắc nhở những người theo dõi hãy chú ý đến sức khỏe hơn. Phục hồi sau vụ tai nạn, cô trở với việc tập luyện. Kim nói rằng những khi gặp khó khăn, cô sẽ nhìn lại những hình ảnh trong khoảng thời gian phải ngồi xe lăn sau tai nạn, nhắc nhở mình đã mạnh mẽ vượt qua như thế nào. Trên trang cá nhân, Kim chia sẻ nhiều hình ảnh về cuộc sống thường ngày và việc tập luyện. Cô thu hút gần 300.000 người theo dõi nhờ năng lượng tích cực, những chia sẻ hữu ích về chế độ tập luyện và ăn uống lành mạnh. Kim không theo đuổi phong cách xây dựng cơ bắp cuồn cuộn mà giữ cho vóc dáng ở mức săn chắc, mềm mại. Cô kết hợp giữa tập tạ với nhiều môn khác như pilates, bơi lội, đạp xe và chạy bộ để duy trì vóc dáng gợi cảm. Ngoài thể hình, bộ môn Kim yêu thích nhất là chạy bộ. Cô từng tham gia và giành giải trong nhiều cuộc thi chạy tại Hàn Quốc. Những người phụ nữ thay đổi thế giới Dẫu bất bình đẳng từng diễn ra công khai trong quá khứ hay đang âm thầm len lỏi trong xã hội hiện đại, vẫn luôn có những người phụ nữ dám cất lên tiếng nói của mình và khẳng định giá trị bản thân. Hai Bà Trưng - hai nữ anh hùng của Việt Nam - cũng là những tấm gương truyền cảm hứng khi đã góp phần thay đổi thế giới theo cách riêng của họ.  Sau 5 năm giấu kín, Bryan Johnson công khai tình yêu với Kate Tolo - cô gái Australia kém ông 21 tuổi.  08:32 3/12/202508:323/12/2025 0 Sau hơn một thập kỷ rèn luyện, Kiki Vhyce xây dựng và duy trì khối cơ bắp đồ sộ. Cô hiện là huấn luyện viên kiêm người mẫu thể hình nổi tiếng khắp mạng xã hội.  10:54 3/12/202510:543/12/2025 0 Danh sách đội tuyển bóng chuyền nữ dự SEA Games 33 gây chú ý khi quy tụ 3 mỹ nhân bóng chuyền như Đặng Thị Kim Thanh, Hoàng Thị Kiều Trinh và Lê Thanh Thúy."
