Source,URL,Category,Keyword,Time,Title,Content
ZNews,https://znews.vn/vi-sao-ronaldo-vang-mat-o-fifa-club-world-cup-post1561776.html,Thể thao,Null,"Thứ tư, 18/6/2025 11:10 (GMT+7)",Vì sao Ronaldo vắng mặt ở FIFA Club World Cup?,"FIFA Club World Cup mất nhiều thứ khi thiếu Ronaldo. Hồi cuối tháng 5, ông Infantino công khai kêu gọi việc để Cristiano Ronaldo dự FIFA Club World Cup 2025™. “Nếu bất kỳ câu lạc bộ nào quan tâm và muốn chiêu mộ Ronaldo cho FIFA Club World Cup, hãy liên hệ với chúng tôi”, Chủ tịch FIFA nói nửa đùa nửa thật trong cuộc giao lưu với iShowSpeed. Đó là một động thái bất thường từ người đứng đầu FIFA, đơn vị tổ chức giải. Tuy nhiên, phát ngôn ấy có thể lý giải được, nếu chúng ta biết ông Infantino muốn FIFA Club World Cup thành công thế nào trong phiên bản mở rộng đầu tiên lên 32 đội. Ở thời điểm đó, hợp đồng của Ronaldo với câu lạc bộ Al Nassr sắp đáo hạn. FIFA rất muốn CR7 ký hợp đồng ngắn hạn với bất kỳ đội bóng nào để dự Club World Cup 2025. Với mối quan hệ sâu sắc giữa Ronaldo và chính phủ Saudi Arabia - những tin đồn về việc Ronaldo gia nhập Al Hilal bắt đầu lan rộng. Al Hilal là đại diện duy nhất của Saudi Arabia tại FIFA Club World Cup, và việc bổ sung Ronaldo chỉ mang lại điều tốt đẹp về mặt chuyên môn lẫn hình ảnh. Tuy nhiên, trở ngại lớn nằm ở mối quan hệ đối đầu giữa Al Hilal và Al Nassr, hai đội bóng cùng thành phố Riyadh. Dù cả hai đều thuộc sở hữu phần lớn của quỹ đầu tư quốc gia Saudi Arabia, việc chiêu mộ một ngôi sao từ đối thủ được coi là bước đi gây tranh cãi và làm phật ý nhiều CĐV. Tương lai của Ronaldo vẫn còn là dấu hỏi. Giám đốc điều hành của Al Hilal, Esteve Calzada, chia sẻ vớiBBC: “Dù tôi rất tôn trọng Ronaldo như một cầu thủ vĩ đại, tất cả chúng ta có lẽ đều đồng ý với nhau rằng, việc đưa ngôi sao lớn nhất của đối thủ về thi đấu cho đội mình là điều hoàn toàn không hợp lý, nhất là khi hợp đồng chỉ kéo dài từ ba đến bốn tuần”. Một lý do khác khiến Ronaldo không thể đến Al Hilal còn nằm ở việc ban huấn luyện đội bóng này. Nhiều nguồn tin cho rằng Simone Inzaghi, tân HLV Al Hilal, phản đối ý tưởng chiêu mộ Ronaldo. Chiến lược gia người Italy lo ngại việc sở hữu Ronaldo trong đội hình có thể khiến đội bóng mất cân bằng. FIFA sau đó dường như có những động thái để ""kết nối"" Ronaldo với nhiều CLB khác như Inter Miami hay LA FC, nhưng một thương vụ chuyển nhượng kiểu ngắn hạn trong vài tuần luôn cực kỳ phức tạp. Ronaldo có cái tôi lớn, mức lương khổng lồ và ngay cả những CLB dự giải cũng không quá hào hứng với việc đem về một cầu thủ 40 tuổi chỉ trong vòng vài tuần. Điều đó sẽ tạo ra nhiều vấn đề cho phòng thay đồ. Chính vì thế, dù đã nỗ lực hết khả năng, FIFA vẫn không thể đưa Ronaldo tham dự Club World Cup 2025. Tủ             sách thể thaomang tới những câu chuyện thể thao quá khứ và         hiện tại, những bí mật hậu trường, những giải đấu, ký ức của         những cựu danh thủ, HLV, các huyền thoại như Sir Alex Ferguson,         Steven Gerrard, Park Hang-seo, Lê Công Vinh...  Ramos rực sáng ở FIFA Club World Cup 2025™ Sáng 18/6, Sergio Ramos ghi bàn giúp đại diện Mexico cầm hòa đương kim á quân UEFA Champions League, Inter Milan với tỷ số 1-1 ở bảng E.  Real Madrid 1-1 Al Hilal: Đại diện châu Á gây bất ngờ 1 giờ trước02:2419/6/2025Thể thaoThể thao 0 Rạng sáng 19/6, Real vượt lên dẫn trước nhưng bị Al Hilal gỡ hòa nhờ cú đá phạt đền của Neves.  Mudryk nhận tin dữ 4 giờ trước00:0119/6/2025Thể thaoThể thao 0 Mykhailo Mudryk đối mặt một trong những lệnh cấm thi đấu dài nhất lịch sử Premier League sau khi bị Liên đoàn Bóng đá Anh (FA) buộc tội vi phạm quy định chống doping."
ZNews,https://znews.vn/clb-cua-ronaldo-ra-gia-mua-son-heung-min-post1561728.html,Thể thao,Null,"Thứ tư, 18/6/2025 06:58 (GMT+7)",CLB của Ronaldo ra giá mua Son Heung-min,"Son Heung-min có thể rời Tottenham. TheotalkSPORT, Al Ahli, Al Qadsiah và Al Nassr đều đang nhắm đến Son. Trong số đó, Al Ahli có nhiều lợi thế trong việc chiêu mộ đội trưởng tuyển Hàn Quốc, khi họ muốn tăng cường sức mạnh ở cánh trái. Nhà vô địch AFCChampions Leaguecó tham vọng lớn cho mùa giải sắp tới. Cả Al Ahli, Al Qadsiah và Al Nassr đều sẵn sàng chi ra khoảng 40 triệu euro để có được chữ ký của Son. Đội trưởng củaTottenhamchỉ còn 12 tháng trong hợp đồng hiện tại. Spurs sẵn sàng để anh rời đi trong hè này nhằm tránh viễn cảnh mất trắng vào năm sau. Son sẽ bước sang tuổi 33 vào tháng tới. Anh có một mùa giải không thành công khi chỉ ghi được 7 bàn thắng tạiPremier League. Đây là lần đầu tiên kể từ mùa giải 2015/16, Son ghi ít hơn 10 bàn ở giải quốc nội. Nhưng theoAthletic, bất kỳ quyết định nào liên quan đến việc ra đi của tiền đạo người Hàn Quốc sẽ bị trì hoãn cho đến sau chuyến du đấu châu Á của Spurs. CLB thành London đã lên lịch hai trận giao hữu, một vớiArsenalvào ngày 31/7 tạiHong Kong(Trung Quốc) và một vớiNewcastletại Seoul (Hàn Quốc) vào ngày 3/8. Son được xem như biểu tượng thể thao quốc gia tại Hàn Quốc và sẽ là tâm điểm của chuyến du đấu này, khi người hâm mộ bản địa đặt kỳ vọng lớn vào sự hiện diện của anh. Sự hiện diện của Son trong các hoạt động quảng bá, giao lưu với người hâm mộ và thi đấu tại châu Á đã được thống nhất từ trước. Nếu Son vắng mặt, anh sẽ gây rắc rối cho Tottenham, ban tổ chức và các đối tác thương mại. Thành tích bán kết World Cup 2002, sự phát triển của hệ thống K League vẫn là chưa đủ để bóng đá Hàn Quốc tự nuôi sống chính mình. Câu chuyện của nền bóng đá xứ kim chi được khắc họa trongOrganizational Culture, Image, Identity in Professional South Korean Club Footballcủa tác giả người Đức Nikolas Sonneborn.  Trent Alexander-Arnold lại gây tranh cãi 21 giờ trước06:4118/6/2025Thể thaoThể thao 0 Trent Alexander-Arnold ngỡ ngàng với cường độ tập luyện tại Real Madrid, khiến nhiều cổ động viên Liverpool bất bình.  Mount cạn thời gian ở MU 21 giờ trước06:4018/6/2025Thể thaoThể thao 0 Theo tiết lộ từ cựu tuyển trạch viên trưởng Mick Brown, MU sẵn sàng chia tay Mason Mount trong kỳ chuyển nhượng mùa hè năm nay nếu nhận được lời đề nghị phù hợp.  Van Nistelrooy tích cực mua sắm 21 giờ trước06:3018/6/2025Thể thaoThể thao 0 Leicester City của HLV Ruud van Nistelrooy đang củng cố đội hình trong nỗ lực trở lại Premier League."
ZNews,https://znews.vn/ban-gai-hon-13-tuoi-cua-yamal-phan-no-post1561719.html,Thể thao,Null,"Thứ tư, 18/6/2025 06:20 (GMT+7)",Bạn gái hơn 13 tuổi của Yamal phẫn nộ,"Vazquez đang hẹn hò với bạn trai kém 13 tuổi. ""Thật buồn khi thấy nhiều người mang trong mình sự tiêu cực đến mức họ muốn giết chết một người mà họ không hề quen biết. Bản chất của những người này được phản ánh qua những gì họ làm"", Vazquez bức xúc. ""Tôi luôn chọn một cuộc sống có mục đích, luôn phát triển và được bao quanh bởi ánh sáng tích cực. Tôi chỉ muốn chữa lành sau khi bị những kẻ xấu hủy hoại"",  influencer người Tây Ban Nha cho biết thêm. Fati Vazquez vừa thu hút sự chú ý khi cùng với ngôi sao trẻ Lamine Yamal đi nghỉ hè tại Italy. Những hình ảnh của cả hai trên mạng xã hội nhanh chóng làm dậy sóng dư luận, khiến nhiều người đồn đoán về một mối quan hệ tình cảm. Fati là cựu tiếp viên hàng không. Sau khi tốt nghiệp và làm việc trong ngành hàng không, cô gái 30 tuổi quyết định từ bỏ công việc để theo đuổi sự nghiệp influencer. Các nền tảng mạng xã hội của cô thu hút hơn một triệu người theo dõi. Cô hay chia sẻ các nội dung về phong cách sống, ăn uống lành mạnh và luyện tập thể thao. Thậm chí, dân mạng còn phát hiện một bình luận của Yamal trong bức hình gợi cảm của Vazquez từ năm 2020. Khi đó, ngôi sao của Barcelona mới 12 tuổi. Sau khi tỏa sáng tại Euro 2024, Yamal liên tục vướng ồn ào chuyện tình cảm. Chàng trai 17 tuổi còn cặp kè với một người mẫu có tên Anna Gegnoso. Cặp đôi được cho là đi mua sắm cùng nhau tại trung tâm thương mại La Roca Village ở Barcelona hồi tháng 12 năm ngoái. Chuyện tình nổi tiếng nhất của Yamal là với Alex Padilla. Cô nàng xuất hiện bên Yamal và gia đình anh để ăn mừng chiến thắng tại Euro 2024. Tuy nhiên, sau nhiều lần rạn nứt rồi tái hợp, mối quan hệ của cặp đôi thực sự khép lại. Tủ sách thể thaomang tới những câu chuyện thể thao quá khứ và hiện tại, những bí mật hậu trường, những giải đấu, ký ức của những cựu danh thủ, HLV, các huyền thoại như Sir Alex Ferguson, Steven Gerrard, Park Hang-seo, Lê Công Vinh...  Cô gái gây chú ý khi đi nghỉ hè cùng Yamal Fati Vazquez, một influencer nổi tiếng, thu hút sự chú ý khi cùng với ngôi sao trẻ Lamine Yamal đi nghỉ hè tại Italy.  Real Madrid 1-1 Al Hilal: Đại diện châu Á gây bất ngờ 1 giờ trước02:2419/6/2025Thể thaoThể thao 0 Rạng sáng 19/6, Real vượt lên dẫn trước nhưng bị Al Hilal gỡ hòa nhờ cú đá phạt đền của Neves.  Mudryk nhận tin dữ 4 giờ trước00:0119/6/2025Thể thaoThể thao 0 Mykhailo Mudryk đối mặt một trong những lệnh cấm thi đấu dài nhất lịch sử Premier League sau khi bị Liên đoàn Bóng đá Anh (FA) buộc tội vi phạm quy định chống doping."
ZNews,https://lifestyle.znews.vn/dan-venice-muon-chan-kenh-dao-ngan-dam-cuoi-trieu-usd-cua-jeff-bezos-post1561848.html,Du lịch,Null,"Thứ tư, 18/6/2025 18:39 (GMT+7)",Dân Venice muốn chặn kênh đào ngăn đám cưới triệu USD của Jeff Bezos,"Những người biểu tình giăng biểu ngữ ""No space for Bezos"" (tạm dịch: Không có chỗ cho Bezos) trên Cầu Rialto. Ảnh:Manuel Silvestri/Reuters. Một chiều oi ả tháng 6, gần chân cầu Rialto, nhóm thanh niên Venice tự xưng thất nghiệp tụ tập phản đối đám cưới sắp diễn ra của tỷ phú Jeff Bezos và Lauren Sanchez. Họ căng biểu ngữ ""No space for oligarchs, no space for Bezos (tạm dịch: Không có chỗ cho giới 'đầu sỏ', không có chỗ cho Bezos"", kèm hình vẽ tên lửa Blue Origin và kêu gọi chống lại sự kiện sẽ ""ràng buộc thành phố"", theoCNN. Thông tin chi tiết về lễ cưới của Bezos vẫn được giữ kín, nhưng ngân sách khoảng10 triệu USDvà các địa điểm như đảo San Giorgio Maggiore và Misericordia được đồn đoán sẽ được sử dụng. Buổi lễ chính được cho là sẽ diễn ra ngày 28/6. Tuy nhiên, những người biểu tình tuyên bố nhất định tìm cách ngăn chặn. ""Bezos sẽ không bao giờ đến được Misericordia. Chúng tôi sẽ chặn kênh đào bằng xuồng, phao hơi, thuyền; sẽ xếp hàng trên các con phố bằng chính cơ thể chúng tôi"", bà Federica Toninello, người đứng đầu nhóm biểu tình, khẳng định trước đám đông khoảng 300 người. Diễn giả Na Haby Stella Faye kêu gọi: ""Hãy để lễ cưới này được nhớ đến vì sự phản đối, không phải vì 27 lần thay trang phục của Sanchez. Venice không nên trở thành tấm bưu thiếp nơi Bezos tổ chức đám cưới, mà là thành phố không khuất phục trước các nhà tài phiệt"". Một số người phản đối sự hiện diện siêu du thuyền Koru trị giá500 triệu USDcủa Bezos cùng các du thuyền xa hoa khác dự kiến neo tại Venice. Với cư dân địa phương, đám cưới này là biểu tượng cho những vấn đề hiện tại của thành phố. Nỗ lực hạn chế du lịch quá tải từng dẫn đến việc thu phí 10 euro vào dịp cuối tuần, trong khi dân số nội đô giảm dần vì thiếu trường học, bệnh viện, nhà ở giá rẻ. Venice từng ghi dấu phong trào phản đối thành công. Chiến dịch “No Grandi Navi” (tạm dịch: Không tàu lớn) trước Covid-19 buộc các tàu du lịch lớn phải chuyển sang các cảng khác như Ravenna hay Trieste. Các cuộc biểu tình chống thuê nhà kiểu airbnb cũng giúp siết chặt số lượng bất động sản cho thuê ngắn hạn. Tỷ phú Jeff Bezos và vợ sắp cưới Lauren Sanchez. Ảnh:@laurenwsanchez. Dẫu vậy, không phải ai cũng ủng hộ việc phản đối lễ cưới của một tỷ phú tại thành phố vốn gắn liền với hình ảnh lãng mạn. Nhiều đám cưới xa hoa từng diễn ra ở đây, như đám cưới George và Amal Clooney năm 2014, được người dân hưởng ứng. Ba đám cưới trị giá hàng triệu USD đã được tổ chức tại Venice năm nay mà không gặp phản đối nào. Ông Luca Zaia, lãnh đạo vùng Veneto, gọi các cuộc biểu tình là “sự ô nhục”. “Tôi muốn Jeff Bezos được chào đón tại Venice”, ông nói. Luigi Brugnaro, thị trưởng Venice, cũng bày tỏ hy vọng lễ cưới không bị gián đoạn. “Chúng tôi sẽ phải xin lỗi Bezos. Tôi xấu hổ vì những người hành xử như vậy. Không phải mọi người Venice đều như thế”, ông cho biết. Tại triển lãm Kiến trúc Biennale, nhiều người đồng tình với quan điểm của thành phố. Görge Meyer, đến từ Berlin, nhận định: ""Thật nực cười khi một thành phố sống nhờ du lịch như Venice lại khôn muốn có một sự kiện thế này. Họ không nên phản đối một sự kiện có thể tạo việc làm cho hàng trăm lao động"". Nhà văn du lịch Mỹ Gillian Longworth McGuire cho rằng từ lâu Venice đã là nơi tổ chức đám cưới của người nổi tiếng và giàu có. ""Venice đôi khi không rõ mình muốn trở thành gì: một thành phố thương cảng giàu văn hóa hay địa điểm tổ chức tiệc cưới lớn. Nhưng dù sao, thành phố này luôn là điểm giao thoa văn hóa và thế giới. Người ta sẽ vẫn đến đây, bất kể ai kết hôn hay ai phản đối"", McGuire nói. Travel blogger truyền cảm hứng du lịch qua những câu chuyện đầy màu sắc về những điểm đến mới lạ, những trải nghiệm độc đáo mà họ khám phá được trong hành trình. Những bài viết, video hay hình ảnh của họ không chỉ mang lại kiến thức về địa lý, mà còn khơi gợi niềm đam mê khám phá thế giới. Đọc sách là một phần không thể thiếu trong hành trình này, giúp họ tìm hiểu sâu sắc hơn về văn hóa, lịch sử và con người ở mỗi nơi. Mục Du lịch - Ẩm thực giới thiệu chân dung travel blogger kiêm tác sách, những con người lan tỏa nguồn cảm hứng xê dịch và tiếp nạp tri thức. > Xem thêm:Travel blogger Đinh Hằng: Thật khó để cô đơn khi du lịch một mình  Toàn cảnh hắt hủi Jeff Bezos tại Venice trước thềm siêu đám cưới Tên của vị tỷ phú thứ 4 thế giới với dấu gạch chéo màu đỏ được nhóm phản đối treo tháp chuông nhà thờ San Giorgio Maggiore ngày 13/6 nhằm phản đối Bezos tổ chức đám cưới ở Venice, Italy.  Jeff Bezos 'lấy lòng' dân Venice sau làn sóng phản đối đám cưới Vị tỷ phú giàu bậc nhất thế giới không ngó lơ sự phản đối từ người dân Venice (Italy) mà đưa ra phương án nhằm xoa dịu cơn phẫn nộ đối với đám cưới của mình.  Đám cưới bị ghẻ lạnh của tỷ phú Jeff Bezos ở Venice 11:33 9/6/202511:339/6/2025Du lịchĐịa điểm du lịch 0 Một kế hoạch biểu tình của người dân địa phương nhằm phản đối ""đám cưới thế kỷ"" của nhà sáng lập Amazon dự kiến diễn ra vào ngày 24-26/6."
ZNews,https://lifestyle.znews.vn/14000-nguoi-bi-huy-lich-den-bali-do-nui-lua-phun-trao-post1561919.html,Du lịch,Null,"Thứ tư, 18/6/2025 20:24 (GMT+7)",14.000 người bị hủy lịch đến Bali do núi lửa phun trào,"Đám mây tro lan rộng trong không phận Bali. Ảnh:Floriana Jijiana J. Tobin/Reuters. Tình trạng bụi núi lửa phát tán rộng đến không phận khu vực Bali khiến hơn 26 chuyến bay đến và đi từ đảo bị ảnh hưởng. 3 sân bay khác tại tỉnh Đông Nusa Tenggara bao gồm Fransiskus Xaverius Seda ở Maumere cũng buộc đóng cửa do núi Lewotobi Laki-laki phun trào ngày 18/6,Reutersdẫn lời Bộ Giao thông vận tải Indonesia. Trong đó, 2 chuyến bay quốc tế VN641 chặng TP.HCM - Denpasar (Bali) và VN640 hành trình Denpasar (Bali) - TP.HCM của hãng Vietnam Airlines cũng bị hủy nhằm đảm bảo an toàn cho du khách, hãng bay đăng tải trên Fanpage chính thức. Ngoài ra, trong số hơn 26 chuyến bay cũng bao gồm ít nhất 14 chuyến bay từ Ấn Độ, Singapore và Australia đến Bali. AirAsia Malaysia và AirAsia Indonesia cũng hủy chuyến hoặc thay đổi kế hoạch bay đến đảo Lombok gần đó. Sự việc khiến 14.000 hành khách phải trì hoãn/thay đổi kế hoạch du lịch. Cột tro bốc lên từ núi lửa Lewotobi Laki-Laki, Indonesia, ngày 18/6. Ảnh:Bali Legals. TheoEuronews, các chuyến bay buộc hủy vì những đám mây tro núi lửa gây thiệt hại ""nghiêm trọng"" cho động cơ máy bay, ảnh hưởng đến tầm nhìn của phi công. Khi tro tràn vào động cơ máy bay, các hạt nhỏ từ tro có nhiệt độ thấp hơn nhiệt độ bên trong động cơ. Do đó, chúng sẽ tan chảy, kết dính và có thể làm tắc nghẽn các bộ phận quan trọng như cánh quạt tuabin và các đường dẫn nhiên liệu. Việc bay qua đám mây tro cũng giống như phun cát bên ngoài máy bay và có thể làm giảm tầm nhìn của phi công. Núi Lewotobi Laki-laki, nằm ở tỉnh Đông Nusa Tenggara, đã phun trào vào ngày 17/6, phun ra tro bụi cao 11 km. Đài Quan sát Núi lửa của đất nước phải nâng mức cảnh báo lên mức cao nhất. Ngọn núi phun trào lần thứ 2 vào sáng thứ 4 (18/6). ""Theo dự báo, đám mây tro dự kiến sẽ tan vào cuối đêm nay"", hãng JetStar cho biết trong một bản tin du lịch vào giữa trưa. Vụ phun trào cũng buộc chính quyền địa phương sơ tán hàng chục cư dân sống ở 2 ngôi làng gần núi lửa, Avi Hallan, một quan chức tại cơ quan giảm nhẹ thiên tai địa phương, nói vớiReuters. ""Đường phố ở hai ngôi làng đầy tro dày, sỏi và cát"", cô nói và cho biết thêm rằng không có thương vong nào được ghi nhận. Lần phun trào gần nhất là cuối tháng 5. Trước đó, vào tháng 11/2024, một vụ phun trào khác tại núi này khiến 9 người tử vong và hàng nghìn người khác phải sơ tán. Indonesia nằm trên Vành đai lửa Thái Bình Dương, một khu vực có hoạt động địa chấn cao trên đỉnh của nhiều mảng kiến tạo, dễ chịu ảnh hưởng từ các trận núi lửa. Với các món ăn phong phú và đặc sắc, Việt Nam được xếp vào danh sách những quốc gia có nền ẩm thực tuyệt vời của thế giới. MụcDu lịch - Ẩm thựcgiới thiệu hai cuốn sáchLê la quà vặtvàĂn quà xuyên Việt.Xuất bản năm 2017, đây có lẽ là những cuốn sách tranh ẩm thực đầu tiên của một tác giả Việt được xuất bản. Bằng những hình vẽ dễ thương và sinh động, vui tươi và hài hước, những trang vẽ của Đặng Hồng Quân khiến người xem như có thể mường tượng ra khung cảnh náo nhiệt của các hàng quà, thậm chí có đôi khi lộn xộn, nhôm nhoam như ngoài đời thực ta có thể vẫn bắt gặp. > Đọc tiếp:'Từ điển' món ngon nước Việt bằng tranh  Dân Venice muốn chặn kênh đào ngăn đám cưới triệu USD của Jeff Bezos Trong lúc người dân Venice rầm rộ phản đối đám cưới của tỷ phú Jeff Bezos, Thị trưởng thành phố gọi đây là hành động ""ô nhục"".  Nơi hẹn hò của Yamal cùng bạn gái hơn 13 tuổi Ngôi sao bóng đá tuổi 17 cùng bạn gái tin đồn du lịch biển tại một trong số hòn đảo nổi tiếng bậc nhất Italy, nơi sở hữu bề dày lịch sử và hoạt động vui chơi dưới nước đa dạng.  Manwah xin lỗi vì mở 'Trình' đón khách 'Anh trai vượt ngàn chông gai' 11 giờ trước16:5318/6/2025Ẩm thựcĐịa điểm ăn uống 0 Sau sự cố mở nhạc không phù hợp khiến nhóm khách hàng phật lòng, thương hiệu Manwah lên tiếng xin lỗi, thừa nhận thiếu sót trong phục vụ và cam kết cải thiện trải nghiệm khách hàng."
