Source,URL,Category,Keyword,Time,Title,Content
ZNews,https://znews.vn/bo-cong-thuong-ly-giai-muc-chiet-khau-xang-dau-luc-cao-luc-thap-post1564748.html,Kinh doanh,Null,"Thứ ba, 1/7/2025 20:56 (GMT+7)","Bộ Công Thương lý giải mức chiết khấu xăng dầu lúc cao, lúc thấp","Theo Cục Quản lý và Phát triển thị trường trong nước (Bộ Công Thương), mức chiết khấu trong kinh doanh xăng dầu là mức giảm giá của doanh nghiệp bán xăng dầu cho doanh nghiệp mua xăng dầu so với giá bán lẻ xăng dầu. Mức chiết khấu được các doanh nghiệp bán xăng dầu điều chỉnh linh hoạt (phản ánh tính thị trường), phụ thuộc vào biến động của cung cầu, giá cả trên thị trường thế giới và trong nước. Trong 2 tuần vừa qua, thị trường xăng dầu thế giới có sự biến động do xung đột ở khu vực Trung Đông khiến giá xăng dầu thế giới tăng cao, nguy cơ gián đoạn nguồn cung. Có những thương nhân đầu mối giảm mức chiết khấu xăng dầu cho đại lý xuống còn 500 đồng, hoặc còn 100-200 đồng/lít. Việc chiết khấu cao hay thấp phụ thuộc vào mối quan hệ kinh doanh của các doanh nghiệp kinh doanh xăng dầu. Ảnh:Minh Đức. Tuy nhiên, Cục Quản lý và Phát triển thị trường trong nước cho hay đến ngày 25/6, do những tín hiệu tích cực từ việc đàm phán ở khu vực Trung Đông, giá xăng dầu đã giảm, nguy cơ thiếu hụt nguồn cung cũng giảm. Do vậy chiết khấu của các doanh nghiệp đầu mối cũng đã tăng trở lại. Chiết khấu xăng dầu của một số doanh nghiệp đầu mối ngày 30/6 như: Công ty Phúc Lâm: 2.600 đồng; Tổng công ty xăng dầu Quân đội: 1.800-2.300 đồng (tùy từng vùng); Tổng công ty Dầu Việt Nam: 2.300-2.400 đồng; Saigon Petro: xăng 1.600 đồng, dầu 1.400 đồng; Petrolimex: 1.700-1.900 đồng (tùy mặt hàng). Như vậy, các đại lý và cửa hàng bán lẻ xăng dầu khi tham gia kinh doanh trên thị trường cần phải chấp nhận quy luật của thị trường, chịu sự điều tiết của thị trường (cung, cầu, giá cả). Vì vậy cần phải có kế hoạch kinh doanh của mình để ứng phó khi thị trường có biến động. Đơn cử như khi giá xăng dầu thế giới thấp, nguồn cung dồi dào, các doanh nghiệp đầu mối và phân phối có thể để mức chiết khấu cho các công ty bán lẻ ở mức cao. Tuy nhiên, khi giá dầu thế giới tăng hoặc dự báo tăng cao, nguồn cung trở nên khan hiếm hơn thì các công ty bán lẻ có thể phải chấp nhận mức chiết khấu thấp, thậm chí có thể là chiết khấu âm nhưng vẫn phải nhập hàng để duy trì hoạt động kinh doanh, bù lại khi được hưởng mức chiết khấu cao.  Doanh nghiệp xăng dầu lại kêu trời Giá xăng dầu thế giới tăng mạnh khiến các doanh nghiệp đầu mối giảm mạnh chiết khấu, có ngày chiết khấu giảm còn 0 đồng khiến các doanh nghiệp bán lẻ lỗ nặng.  Thủ tướng yêu cầu không để thiếu xăng dầu giữa căng thẳng Trung Đông Thủ tướng chỉ đạo Petrovietnam tăng dự trữ dầu khí, vận hành hiệu quả nhà máy lọc dầu. Petrolimex, Petrovietnam bảo đảm nguồn cung xăng dầu, không để tình trạng găm hàng đội giá.  'Đại gia' nuôi heo Bắc Ninh thắng lớn 6 giờ trước20:511/7/2025Kinh doanhKinh doanh 0 Sau nửa đầu năm, ""đại gia"" chăn nuôi heo Dabaco đã thu về khoản lãi sau thuế hơn 1.000 tỷ đồng, vượt kế hoạch đặt ra cho cả năm nay."
ZNews,https://znews.vn/co-phieu-hang-but-bi-tang-manh-sau-khi-mua-lai-chuoi-nha-sach-post1565174.html,Kinh doanh,Null,"Thứ ba, 1/7/2025 16:21 (GMT+7)",Cổ phiếu hãng bút bi tăng mạnh sau khi mua lại chuỗi nhà sách,"Cổ phiếu TLG tăng lên đỉnh 3 tháng sau thương vụ mua lại chuỗi nhà sách Phương Nam. Ảnh:Minh Khánh. Thị trường chứng khoán Việt Nam tiếp tục giằng co dữ dội     trong phiên giao dịch 1/7. Chỉ số VN-Index biến động trong biên độ hẹp khi tâm     lý thận trọng vẫn bao trùm ở cả phe mua và phe bán. VN-Index mở cửa hôm nay trong sắc xanh và nỗ lực thử thách mốc     1.380 điểm. Tuy nhiên, áp lực chốt lời nhanh chóng kéo tụt thành quả của chỉ số     và dìm xuống dưới tham chiếu. Trong phiên chiều, chỉ số chính thậm chí chịu lực bán mạnh và     rơi một mạch xuống mốc 1.370 điểm. Song, sự hỗ trợ tích cực của dòng tiền phe mua nhanh chóng đưa VN-Index trở lại sắc xanh. Kết phiên, VN-Index tăng 1,77 điểm (+0,1%) lên 1.377,84 điểm.     Trong khi đó, trên sàn Hà Nội, HNX-Index giảm 0,77 điểm (-0,3%) xuống 228,45 điểm     còn UPCoM-Index giảm 0,12 điểm (-0,1%) xuống 100,72 điểm. Giá trị giao dịch trên cả 3 sàn chưa có dấu hiệu bùng nổ nhưng     cũng không ảm đạm, duy trì trước mốc21.000 tỷ đồng. Bảng điện tử trên sàn HoSE rơi vào trạng thái “xanh vỏ, đỏ lòng”.     Dù chỉ số đại diện tăng điểm, số lượng mã giảm lại lớn hơn nhiều so với mã     tăng. Sắc đỏ nhìn chung lấn át bảng điện. Toàn thị trường chứng kiến     411 mã giảm (gồm 13 mã giảm sàn), 877 mã giữ tham chiếu và 317 mã tăng (gồm 24     mã tăng trần). Trong đó, rổ cổ phiếu vốn hóa lớn VN30 phân hóa đồng đều với     13 mã tăng, 4 mã đứng giá và 13 mã giảm. Chỉ số đại diện rổ qua đó giảm nhẹ hơn     1 điểm. VN-Index đang bị dòng tiền chốt lời gây áp lực. Ảnh:TradingView. Với biên độ tăng 2,1%, cổ phiếu VCB là nhân tố chính trong việc     giúp VN-Index lấy lại sắc xanh hôm nay. Là mã chứng khoán có quy mô vốn hóa lớn nhất thị     trường, VCB đóng góp tới 2,4 điểm tăng vào chỉ số chính hôm nay. Ngoài ra, cổ phiếu này còn nhận được sự hỗ trợ từ các mã GVR     (+2,8%), HVN (+2,6%), BID (+0,8%), TCB (+0,6%), VJC (+2,7%), MBB (+0,8%), HDB     (+1,4%), FPT (+0,5%) và MSB (+2,1%). Trong bối cảnh thị trường phân hóa và thiếu vắng thông tin hỗ     trợ, vẫn có một số cổ phiếu như TLG của Thiên Long hay ANV của Nam Việt ghi nhận lực mua đột biến và tăng kịch biên độ nhờ sở hữu câu chuyện riêng. Với TLG, làn sóng gom cổ phiếu xuất hiện trong bối cảnh tập đoàn     đang thực hiện thương vụ thâu tóm chuỗi nhà sách Phương Nam. Theo đó,     thông qua công ty con là Tân Lực Miền Nam, phía Thiên Long sẽ nhận chuyển nhượng     tổng cộng gần 8,3 triệu cổ phiếu PNC của CTCP Văn hóa Phương Nam từ 3 nhóm cổ     đông cá nhân. Lượng cổ phiếu này chiếm hơn 75% vốn điều lệ của chủ chuỗi nhà sách     Phương Nam. Việc thâu tóm nhà sách Phương Nam sẽ lập tức giúp ""ông vua văn     phòng phẩm"" Thiên Long sở hữu hệ thống phân phối khoảng 50 nhà     sách, chủ yếu tập trung tại khu vực miền Nam và trọng điểm là TP.HCM. Hiện cổ phiếu TLG tạm dừng ở mốc 56.200 đồng/cổ phiếu, cao nhất 3 tháng qua. Vốn hóa của tập đoàn tương ứng4.858 tỷ đồng. Ở chiều bên kia, áp lực ghìm chân VN-Index tập trung tại các     mã GAS (-2,1%), MSN (-2,1%), VHM (-0,5%), MWG (-1,5%), VNM (-0,9%), LGC (-6,8%),     VND (-2,3%), SAB (-1%), EIB (-1,3%) và SSI (-1%). Khối ngoại quay đầu bán ròng gần400 tỷ đồnghôm nay, tập     trung tại các mã VJC (-368 tỷ đồng), HDB (-219 tỷ đồng), HPG (-94 tỷ đồng). Trong khi đó, dòng tiền ngoại được chuyển hướng sang các mã     HVN (+70 tỷ đồng), MSN (+61 tỷ đồng), IDC (+59 tỷ đồng). Trong môi trường kinh tế hiện nay, đầu tư đã trở thành khái niệm không mấy xa lạ với hầu hết mọi người. Để độc giả có thể tiếp cận những xu hướng đầu tư mới nhất,Tri Thức - Znewsxây dựng chủ đềĐầu tư qua sách- nơi ghi lại những cuốn sách, câu chuyện, xu hướng đầu tư đã và đang diễn ra. Trong đó, các lĩnh vực đầu tư phổ biến bao gồm bất động sản, chứng khoán, ngoại hối và tiền ảo... Ngoài các câu chuyện về đầu tư, Đầu tư qua sách còn bao gồm các kiến thức về quản lý gia sản, tài chính cá nhân.  Chân dung doanh nghiệp được MobiFone, Techcombank, One Mount thành lập MobiFone và 2 doanh nghiệp tư nhân gồm One Mount Group, Techcombank đã cùng thành lập Công ty Thanh toán số MobiFone với vốn điều lệ 300 tỷ đồng.  Tiền đổ vào cổ phiếu bất động sản VN-Index tiếp tục được dòng tiền ủng hộ kéo lên cao. Trong đó, nhóm bất động sản là động lực chính khi các mã NVL, KDH, NLG, KBC đều có mức tăng tốt.  Ông Tô Hải chi hàng chục tỷ mua cổ phiếu Vietcap, BVBank Tổng giám đốc Vietcap Tô Hải đã chi hàng chục tỷ đồng để mua cổ phiếu VCI và BVB trong các đợt phát hành cổ phiếu của doanh nghiệp thời gian vừa qua."
ZNews,https://znews.vn/mua-oto-phai-co-cho-do-nhin-tu-kinh-nghiem-cac-do-thi-lon-post1565197.html,Kinh doanh,Null,N/A,Mua ôtô phải có chỗ đỗ: Nhìn từ kinh nghiệm các đô thị lớn,"Tại nhiều quốc gia phát triển, quy định yêu cầu người dân chứng minh có chỗ đỗ xe hợp pháp trước khi mua ôtô, còn gọi là chính sách “proof-of-parking”, được áp dụng từ nhiều thập kỷ qua như công cụ kiểm soát tăng trưởng phương tiện cá nhân và giảm áp lực hạ tầng. Nhật Bản là nước tiên phong mô hình trên, khi yêu cầu bất kỳ ai muốn đăng ký xe mới đều phải có giấy xác nhận chỗ đỗ cố định trong bán kính 2 km từ nơi cư trú, được cảnh sát địa phương kiểm tra và xác thực. Tương tự, đảo Jeju (Hàn Quốc) từng ban hành quy định chỉ cho phép đăng ký ôtô đối với người có chứng chỉ gara (chứng minh quyền sử dụng chỗ đỗ). Ở Singapore, chính sách còn khắt khe hơn. Ngoài mức thuế nhập khẩu gấp đôi giá xe, người dân phải chi hàng chục nghìn USD để đấu giá lấy giấy chứng nhận quyền sở hữu xe (COE) với chi phí nhiều thời điểm cao hơn cả giá trị phương tiện. Do tốc độ phát triển phương tiện vượt xa năng lực hạ tầng, nhiều quốc gia áp dụng chính sách mua mua ôtô phải chứng minh chỗ đỗ xe. Các quốc gia này có điểm chung là sớm nhận thức được mối liên hệ trực tiếp giữa tốc độ gia tăng xe cá nhân và áp lực lên hạ tầng đô thị. Khi quỹ đất khan hiếm, việc xe đậu tràn lan xuống lòng đường, vỉa hè không chỉ gây ùn tắc mà còn làm xấu mỹ quan đô thị, giảm chất lượng sống. Tại Việt Nam, vào năm 2011, Hà Nội từng tiên phong áp dụng chính sách tương tự. Người dân khi đăng ký xe ôtô cá nhân phải nộp giấy tờ chứng minh có nơi đỗ, thông qua xác nhận của UBND phường hoặc hợp đồng gửi xe có thời hạn. Bộ Giao thông Vận tải cũng từng kiến nghị đưa quy định này vào hệ thống pháp luật. Tuy nhiên, quy định này chưa thể triển khai vì thiếu cơ chế giám sát hiệu quả. Dù chưa có luật chính thức, giới chuyên gia nhận định với tốc độ tăng phương tiện cá nhân vượt xa năng lực hạ tầng, việc áp dụng các biện pháp quản lý như “proof-of-parking” là xu hướng tất yếu, đặc biệt tại Hà Nội và TP.HCM. Trong bối cảnh đó, xu hướng đang hình thành là các chủ đầu tư bất động sản thương mại, nhà ở cao cấp chủ động tích hợp hạ tầng đỗ xe quy mô lớn trong thiết kế dự án. Bên cạnh việc giải bài toán thực tế, đây còn là yếu tố nâng tầm giá trị sản phẩm trong mắt nhà đầu tư. Tại các thị trường như Singapore, Hong Kong, một chỗ đỗ xe tại trung tâm có thể có giá ngang, thậm chí vượt căn hộ nhỏ. Còn với giới thượng lưu, chỗ đỗ xe định danh là tiện ích và biểu tượng cho sự riêng tư, đẳng cấp. Một trong những dự án bất động sản thương mại cao cấp sở hữu hệ thống chỗ đỗ xe lớn tại Việt Nam là Vinhomes The Gallery - tổ hợp thương mại thấp tầng tọa lạc tại số 148 Giảng Võ, Hà Nội. Nằm tại lõi trung tâm thủ đô, nơi mặt bằng và bãi đỗ hiếm như “vàng mười”, Vinhomes The Gallery mạnh tay đầu tư 4 tầng hầm liên thông rộng tới 71.000 m2, cung cấp 1.544 chỗ đỗ, trong đó có 296 chỗ cố định dành riêng cho các căn thấp tầng thương mại và 1.244 chỗ cho khách vãng lai. Ông Nguyễn Quang Minh, doanh nhân đang tìm hiểu đầu tư vào dự án, nhận xét: “Ở giữa trung tâm mà có chỗ gửi ôtô thoải mái như Vinhomes The Gallery thì quá lý tưởng. Tôi đi gặp đối tác hay tiếp khách không phải lo tìm chỗ đỗ xe. Khách mua sắm cũng sẽ không bỏ lỡ điểm đến này nhờ tiện ích ưu việt là bãi đỗ xe quy mô, tiện nghi”. Vinhomes The Gallery hấp dẫn thương hiệu cao cấp bởi sở hữu tầng hầm rộng đến 71.000 m2. Theo thông tin từ chủ đầu tư, bãi đỗ xe ngầm tại Vinhomes The Gallery thiết kế liên thông 4 tầng hầm, kết nối trực tiếp khối thương mại 5 tầng phía trên. Hầm có 6 thang máy và 11 lối thang bộ, giúp khách gửi xe di chuyển thẳng lên cửa hàng, văn phòng nhanh chóng. Các căn thương mại thấp tầng của dự án được bố trí lối xuống hầm gần kề, đảm bảo khách lái ôtô có trải nghiệm mua sắm riêng tư mà không lo vấn đề đậu xe. Vỉa hè trước cửa hiệu cũng được thiết kế rộng 5 m, phân làn rõ ràng khu vực đón trả khách, lối đi bộ và trưng bày ngoài trời. Nhờ đó, ngay cả giờ cao điểm, luồng giao thông nội bộ vẫn thông thoáng, không xảy ra cảnh ùn ứ trước cửa. Đồng thời, mỹ quan đô thị được đảm bảo khi xe cộ không còn chiếm dụng không gian mặt đất. Trật tự an ninh cũng được tăng cường, giúp nâng cao trải nghiệm cho khách mua sắm và thương hiệu cao cấp thuê mặt bằng. Với tầm nhìn đón đầu xu hướng, Vinhomes The Gallery được xem là dự án tiên phong thiết lập chuẩn mực mới cho bất động sản thương mại cao cấp tại Việt Nam về hạ tầng đỗ xe. Trong dài hạn, hạ tầng tĩnh sẽ là một trong những tiêu chí đánh giá bất động sản cao cấp - tương tự vị trí, thiết kế hay thương hiệu quản lý. Đầu tư vào mặt bằng kinh doanh tại Vinhomes The Gallery vì thế không chỉ là đầu tư không gian thương mại, mà còn là sở hữu năng lực tiếp cận dòng khách và giữ vững giá trị theo thời gian."
ZNews,https://znews.vn/thaco-de-xuat-lam-metro-noi-ben-thanh-thu-thiem-va-san-bay-long-thanh-post1564767.html,Kinh doanh,Null,"Thứ ba, 1/7/2025 17:47 (GMT+7)","Thaco đề xuất làm metro nối Bến Thành, Thủ Thiêm và sân bay Long Thành","Thaco muốn đầu tư làm đường sắt ở TP.HCM. Ảnh:THA. Trong văn bản gửi Chủ tịch UBND TP.HCM, CTCP Đầu tư Tập đoàn Trường Hải (Thaco) cho biết đã đề xuất Chính phủ xem xét cho phép tập đoàn được thực hiện đầu tư dự án đường sắt tốc độ cao Bắc - Nam. Đề xuất này được xây dựng trên tinh thần hưởng ứng Nghị quyết 68 của Bộ Chính trị về phát triển kinh tế tư nhân và Nghị quyết 198 của Quốc hội về các cơ chế, chính sách đặc thù phát triển hệ thống đường sắt đô thị. Riêng tại TP.HCM, Thaco được biết UBND TP đã ban hành kế hoạch đầu tư 355 km đường sắt đô thị từ nay đến năm 2035 theo Nghị quyết 188 của Quốc hội. Trong đó, hai tuyến quan trọng được xác định là metro số 2 (đoạn Tham Lương - Bến Thành và Bến Thành - Thủ Thiêm) và tuyến đường sắt Thủ Thiêm - Long Thành. Ngoài ra, trong quá trình quy hoạch hai tuyến metro và tuyến đường sắt nêu trên, Thaco cho rằng các nhà ga và depot sẽ được định hướng tích hợp toàn diện với mô hình phát triển đô thị theo định hướng giao thông công cộng (theo mô hình TOD). Các khu TOD này sẽ được thiết kế theo hướng đa chức năng, kết hợp hài hòa giữa hệ thống giao thông công cộng với không gian thương mại - dịch vụ, tiện ích công cộng, công viên cây xanh và các khu dân cư mật độ cao... Trên cơ sở quy hoạch này, Thaco đề xuất UBND TP cho phép doanh nghiệp được nghiên cứu đầu tư các dự án nêu trên theo hình thức tổng thầu EPC (hợp đồng thiết kế - mua sắm vật tư, thiết bị - thi công xây dựng công trình) hoặc đầu tư trực tiếp theo quy định của Luật Đầu tư. Thaco cũng kiến nghị cho phép triển khai nghiên cứu song song trong thời gian không quá 3 tháng (kể từ thời điểm được TP.HCM chấp thuận giao nghiên cứu) để xây dựng phương án tổng thể, bao gồm việc lựa chọn phương thức đầu tư phù hợp (đầu tư công hoặc đầu tư trực tiếp). Đồng thời, đề xuất các giải pháp tối ưu nhằm nâng cao hiệu quả khai thác đầu tư, đặc biệt là việc sử dụng không gian ngầm cho các tiện ích công cộng và tích hợp các khu TOD tại vị trí các nhà ga và depot. Tập đoàn cam kết toàn bộ quá trình nghiên cứu sẽ được thực hiện khẩn trương, nghiêm túc, không làm ảnh hưởng đến tiến độ khởi công tuyến metro số 2 vào cuối năm này và đường sắt Thủ Thiêm - Long Thành vào quý IV/2026 theo kế hoạch của TP.HCM. Sau khi hoàn tất nghiên cứu, nếu không được lựa chọn làm nhà đầu tư, doanh nghiệp sẽ bàn giao toàn bộ kết quả nghiên cứu cho thành phố và không yêu cầu hoàn trả bất kỳ chi phí nào. Trên thực tế, với các cơ sở đặc biệt từ Nghị quyết 188 của Quốc hội, hiện TP.HCM đang triển khai các thủ tục liên quan để đầu tư 7 tuyến metro dài 355 km. Trong đó, hai tuyến Thủ Thiêm - Long Thành và metro số 2 đoạn Bến Thành - Thủ Thiêm được nghiên cứu tại hai dự án riêng biệt. Cụ thể, tuyến đường sắt Thủ Thiêm - Long Thành có chiều dài khoảng 42 km (qua TP.HCM 11,7 km và Đồng Nai 30,2 km) với tổng mức đầu tư3,5 tỷ USD. Tuyến này có ý nghĩa chiến lược trong việc kết nối hai sân bay quốc tế Tân Sơn Nhất và Long Thành. Trong khi đó, đoạn Bến Thành - Thủ Thiêm dài 6 km là một phần thuộc toàn tuyến metro số 2 (Củ Chi - Quốc lộ 22 - An Sương - Bến Thành - Thủ Thiêm). Riêng đoạn Bến Thành - Thủ Thiêm được thiết kế đi ngầm toàn bộ, với tổng vốn đầu tư khoảng1,3 tỷ USD. Nếu được nghiên cứu tích hợp, tuyến thống nhất Bến Thành - Thủ Thiêm - sân bay Long Thành sẽ có tổng chiều dài gần 48 km, với tổng mức đầu tư dự kiến khoảng4,8 tỷ USD. Con số này là kết quả cộng gộp từ hai báo cáo nghiên cứu độc lập và sẽ được cập nhật chi tiết hơn trong bước nghiên cứu tiếp theo, khi cơ quan có thẩm quyền xác định công nghệ, phương thức đầu tư và lộ trình thực hiện. Mạng lưới đường sắt của TP.HCM. Ảnh:Sở Xây dựng TP.HCM. Trên cơ sở đề xuất của doanh nghiệp, Chủ tịch UBND TP.HCM Nguyễn Văn Được đã có kết luận chỉ đạo. Cụ thể, UBND TP ghi nhận và đánh giá cao đề xuất tích hợp quy hoạch các tuyến đường sắt đô thị, kết nối từ trung tâm Bến Thành đến Thủ Thiêm và kéo dài đến sân bay quốc tế Long Thành. TP.HCM cho rằng việc tích hợp các tuyến thành một tuyến thống nhất Bến Thành - Thủ Thiêm - Long Thành là hợp lý về mặt kỹ thuật và phù hợp với định hướng phát triển không gian đô thị, góp phần phát huy hiệu quả đầu tư, gia tăng khả năng kết nối và phục vụ phát triển kinh tế - xã hội khu vực phía đông TP.HCM. Hiện, UBND TP.HCM đã có báo cáo gửi Bộ Xây dựng đề xuất Thủ tướng giao TP là cơ quan chủ quản đầu tư dự án. Trên cơ sở đó, đề nghị nhà đầu tư chủ động nghiên cứu, đề xuất nội dung liên quan để thành phố tổng hợp, báo cáo trình cấp có thẩm quyền xem xét theo quy định. Tri Thức - Znewsgiới thiệu độc giảTủ sách kiến thức kinh tếvới đa dạng cuốn sách, câu chuyện trong lĩnh vực kinh doanh, kinh tế. Là nguồn tư liệu cho những người quan tâm và muốn nâng cao kiến thức trong lĩnh vực kinh tế. Những cuốn sách, câu chuyện trong Tủ sách không chỉ đơn thuần là những tác phẩm của tri thức mà còn chứa đựng bí quyết, kinh nghiệm quý báu từ các tác giả, nhà quản lý có uy tín và kinh nghiệm lâu năm trong ngành. Đọc sách không chỉ giúp người đọc tiếp cận những kiến thức mới mà còn giúp mở rộng tầm nhìn và phát triển bản thân. Tủ sách kiến thức kinh tế mong muốn lan tỏa tri thức trong lĩnh vực kinh doanh, đồng thời phát triển văn hóa đọc cho người Việt.  Vingroup, Sun Group, Thaco cam kết đầu tư vào TP.HCM Tổng giám đốc Vingroup mong muốn tiếp tục triển khai các dự án phù hợp với định hướng quy hoạch chung của TP.HCM, còn Chủ tịch Sun Group đưa ra nhiều đề xuất đặc biệt.  Đề nghị VinSpeed, Thaco hoàn thiện hồ sơ đầu tư đường sắt tốc độ cao Bộ Xây dựng đề nghị các doanh nghiệp đăng ký làm dự án đường sắt tốc độ cao Bắc - Nam hoàn thiện hồ sơ đề xuất dự án trong ngày 18/6 để tổng hợp, báo cáo Thủ tướng.  Thaco đề xuất làm quảng trường, khu sinh thái ở Thủ Thiêm Tập đoàn Thaco muốn làm quảng trường trung tâm, công viên bờ sông rộng 27,2 ha và khu lâm viên sinh thái 150,2 ha tại khu đô thị mới Thủ Thiêm (TP Thủ Đức, TP.HCM)."
