Source,URL,Category,Keyword,Time,Title,Content
ZNews,https://znews.vn/ha-noi-phun-nuoc-chong-bui-pha-do-toa-nha-ham-ca-map-post1565622.html,Xã hội,Null,"Thứ năm, 3/7/2025 11:54 (GMT+7)",Hà Nội phun nước chống bụi phá dỡ tòa nhà Hàm cá mập,"Bắt đầu từ 14h (2/7), đơn vị thi công đã huy động máy móc, tiến hành tháo dỡ phần kết cấu bê tông của tòa nhà Hàm cá mập tại số 1-3-5 phố Đinh Tiên Hoàng. Công tác phá dỡ được thực hiện nghiêm ngặt, đảm bảo an toàn tuyệt đối. Máy móc thi công phá dỡ đồng thời với việc phun nước để hạn chế lượng bụi ảnh hưởng tới môi trường xung quanh. Máy móc thi công phá dỡ đồng thời với việc phun nước để hạn chế lượng bụi ảnh hưởng tới môi trường xung quanh. Hà Nội phun nước chống bụi khi phá dỡ tòa nhà Hàm cá mập Ngoài dựng hàng rào chắn cao 6 m quanh tòa nhà Hàm cá mập, phía ngoài tòa nhà Hàm cá mập còn được chăng dây, rào chắn và có nhân viên túc trực để đảm bảo an toàn cho người lưu thông trong quá trình hạ giải công trình. Tòa nhà ""hàm cá mập"" xây dựng từ năm 1991-1993, hướng ra quảng trường Đông Kinh Nghĩa Thục và hồ Gươm, giáp với phố Cầu Gỗ. Tòa nhà có 6 tầng, trong đó từ tầng 2 đến tầng 5 là các nhà hàng, quán cà phê, tầng 6 có tầm nhìn bao quát hồ Hoàn Kiếm. Theo UBND quận Hoàn Kiếm, việc cải tạo, chỉnh trang quảng trường Đông Kinh Nghĩa Thục trong đó có việc hạ giải tòa nhà số 1-3-5 Đinh Tiên Hoàng được triển khai trước. Trong thời gian qua, quận Hoàn Kiếm đã phối hợp các sở, ngành thành phố nghiên cứu lập phương án và báo cáo Thành phố phê duyệt chủ trương đầu tư theo 2 phân kì: Phân kì 1, gồm 5 nội dung: Hạ giải tòa nhà Trung tâm thương mại số 1-3-5 Đinh Tiên Hoàng; Di chuyển trạm biến áp hiện có bên trong tầng 1 công trình số 1-3-5 Đinh Tiên Hoàng của Điện lực Hoàn Kiếm tại mặt phố Cầu Gỗ; Chỉnh trang tòa nhà Hapro (số 7-9 Đinh Tiên Hoàng). Chỉnh trang mái che, mái vẩy, biển hiệu, mặt đứng các công trình xung quanh quảng trường đoạn phố Đinh Tiên Hoàng, đoạn phố Cầu Gỗ, đầu phố Hàng Đào; Chỉnh trang nhà hàng Thủy Tạ... Phân kì 2, gồm: Nghiên cứu giải pháp phát triển không gian ngầm quảng trường; tiếp tục chỉnh trang hết lớp nhà thứ nhất mặt phố xung quanh quảng trường; cải tạo tổng thể hạ tầng kỹ thuật để tương xứng với hoạt động của hồ Hoàn Kiếm là di tích cấp Quốc gia đặc biệt; bổ sung các trang thiết bị đô thị phù hợp với các chức năng hoạt động của khu vực. Những cuốn sách hay về đô thị Hà Nội Hà Nội chuyện xưa phố cũgồm 39 đoản văn biên khảo về các hoạt động ở Hà Nội giữa thế kỷ XX trở về trước, từ chuyện phố xá, quy hoạch, đến chuyện ăn, chuyện mặc,... của người Hà thành. Mùa đi qua phố- bạn đọc sẽ rung động theo những cảm nhận riêng, đôi khi rất khác nhau về Hà Nội trong bốn mùa xuân, hạ, thu, đông.  Hà Nội thông tin chính thức về thời gian phá dỡ tòa nhà Hàm cá mập 18:22 16/5/202518:2216/5/2025Xã hộiXã hội 0 UBND quận Hoàn Kiếm sẽ hạ giải tòa nhà Trung tâm thương mại số 1-3-5 Đinh Tiên Hoàng (tòa nhà Hàm cá mập) trong tháng 5/2025 và kết thúc trong tháng 8/2025.  Sau phá 'Hàm cá mập', Hà Nội thay đài phun nước bằng 'Tháp ánh sáng' 13:08 19/3/202513:0819/3/2025Xã hộiXã hội 0 Đài phun nước hình tròn nằm vị trí chính giữa quảng trường Đông Kinh - Nghĩa Thục, đối diện tòa nhà ""Hàm cá mập"" sẽ được thay thể bằng ""Tháp ánh sáng"".  Diện mạo hồ Gươm sau khi phá dỡ tòa nhà 'Hàm cá mập' 09:03 20/3/202509:0320/3/2025Xã hộiXã hội 026 Sau khi phá dỡ tòa nhà ""Hàm cá mập"", khu vực Quảng trường Đông Kinh - Nghĩa Thục sẽ bố trí 3 tầng hầm."
ZNews,https://znews.vn/566-chien-si-mien-nam-hanh-quan-ra-bac-tap-luyen-dieu-binh-post1565598.html,Xã hội,Null,"Thứ năm, 3/7/2025 12:18 (GMT+7)",566 chiến sĩ miền Nam hành quân ra Bắc tập luyện diễu binh,"Sáng 3/7, ga Hà Nội đón chuyến tàu đặc biệt chở theo 566 cán bộ, chiến sĩ Trung đoàn Cảnh sát cơ động Đông Nam TP.HCM ra Hà Nội tham gia huấn luyện diễu binh, diễu hành phục vụ lễ kỷ niệm 80 năm Cách mạng tháng Tám và Quốc khánh 2/9. Hai đoàn tàu chia làm hai đợt, đoàn đầu tiên gồm 322 cán bộ, chiến sĩ tới ga lúc 8h45, đoàn còn lại đến sau đó gần hai tiếng, mang theo khí thế hào hùng từ phương Nam ra Bắc. Đây là những chiến sĩ được tuyển chọn kỹ lưỡng từ Trung đoàn Cảnh sát cơ động Đông Nam – lực lượng thường trực, cơ động tinh nhuệ của Bộ Công an tại TP.HCM và các tỉnh phía Nam. Ngay khi đặt chân tới Thủ đô, các chiến sĩ nhanh chóng được đưa về Trung tâm Huấn luyện, Bồi dưỡng nghiệp vụ và Giáo dục nghề nghiệp số 1 (thuộc Bộ Tư lệnh Cảnh sát cơ động, đóng tại huyện Chương Mỹ, Hà Nội). Tại đây, họ sẽ bước vào hành trình tập luyện nghiêm ngặt trong nhiều tuần lễ – một phần trong kế hoạch tổng thể của lực lượng Công an Nhân dân cho lễ diễu binh quy mô cấp quốc gia. Không khí buổi sáng tại ga Hà Nội trở nên sôi động và đầy cảm xúc. Nhiều người dân không quản trời mưa gió, đến nhà ga từ sớm để chào đón các chiến sĩ. Công tác di chuyển được tổ chức bài bản, nhanh gọn, không ảnh hưởng đến hoạt động chung của nhà ga. “Lúc ngồi trên tàu, em vừa háo hức vừa hồi hộp. Khi thấy các cán bộ và người dân cầm cờ đỏ sao vàng chào đón đoàn tại ga Hà Nội, em có cảm giác như mình đang bước vào một giai đoạn mới của cuộc đời chiến sĩ. Được tham gia huấn luyện và sau này là diễu binh tại lễ Quốc khánh 2/9 là niềm vinh dự rất lớn với em và cả gia đình”, chiến sĩ Lê Đình Duy chia sẻ. Chung cảm xúc, chiến sĩ Huỳnh Quốc Anh cho biết anh từng xem các lễ diễu binh trên truyền hình nhưng chưa bao giờ nghĩ có ngày mình sẽ là người trực tiếp sải bước giữa Quảng trường Ba Đình lịch sử. “Chúng tôi đã chuẩn bị tâm thế sẵn sàng từ lúc còn ở đơn vị. Ra Hà Nội lần này không chỉ là hành trình rèn luyện mà còn là hành trình khẳng định niềm tin, lòng trung thành tuyệt đối với Đảng, với Nhân dân,” Quốc Anh nói. Theo kế hoạch, chương trình huấn luyện diễu binh, diễu hành của lực lượng Công an Nhân dân diễn ra trong ba giai đoạn. Giai đoạn một (5/5 - 1/6) tập trung huấn luyện cơ bản. Giai đoạn hai (2/6 - 21/8) là thời điểm bước vào huấn luyện chuyên sâu, hợp luyện cụm và tổng hợp. Giai đoạn ba (22/8 - 2/9) sẽ là thời điểm sơ duyệt, tổng duyệt cấp Nhà nước và chính thức làm nhiệm vụ trong đại lễ. Tại lễ diễu binh tới đây, đội hình khối Cảnh sát cơ động sẽ duyệt binh theo đội hình 16 hàng dọc, 10 hàng ngang. Bên cạnh đó, sẽ có hai khối trưởng quân kỳ dẫn đầu cùng sự xuất hiện lần đầu của khối phương tiện đặc chủng hiện đại – biểu tượng cho sức mạnh và sự phát triển của lực lượng Công an Nhân dân trong thời đại mới. Sách hay về xã hội Văn minh Việt Nam- nhà dân tộc học Georges Condominas từng nhận xét tác phẩm này là “Cửa sổ để thế giới hiểu về Việt Nam”. SáchBàn về Quốc hội - những thách thức của những khái niệmlà kết quả của cả một quá trình tích lũy và suy ngẫm của tiến sĩ Nguyễn Sĩ Dũng, nguyên Phó chủ nhiệm Văn phòng Quốc hội.  Chiến binh Quân khu 5 quyết hoàn thành xuất sắc nhiệm vụ A80 Hai tháng qua, gần 500 cán bộ, chiến sĩ của Quân khu 5 đã miệt mài luyện tập diễu binh với tinh thần cao nhất và quyết tâm hoàn thành xuất sắc nhiệm vụ A80.  Người dân vây kín nhà ga chào đón đoàn diễu binh ngày 2/9 Chiều 6/6, rất đông người dân vây kín ga tàu, hò reo cổ vũ, chào đón các chiến sĩ từ miền Nam ra Hà Nội, chuẩn bị cho lễ diễu binh dịp Quốc khánh 2/9.  Các nữ chiến sĩ rạng rỡ đến Hà Nội tập luyện cho diễu binh ngày 2/9 Trưa 6/6, hàng trăm nữ quân nhân từ miền Nam đến ga Hà Nội, chuẩn bị cho lễ diễu binh dịp Quốc khánh 2/9. Các chiến sĩ được đón chào nồng nhiệt trong vòng tay người dân thủ đô."
ZNews,https://znews.vn/nghien-cuu-bo-sung-hanh-vi-tron-kham-nghia-vu-quan-su-vao-luat-hinh-su-post1565638.html,Xã hội,Null,"Thứ năm, 3/7/2025 12:03 (GMT+7)",Nghiên cứu bổ sung hành vi trốn khám nghĩa vụ quân sự vào luật Hình sự,"Nội dung trên được đề cập tại văn bản trả lời kiến nghị cử tri Hưng Yên và Hà Nội của Bộ Quốc phòng về hoạt động khám tuyển nghĩa vụ quân sự. Thanh niên tỉnh Tuyên Quang khám tuyển nghĩa vụ quân sự. Ảnh:Báo Quân đội Nhân dân. Cử tri Hưng Yên đề xuất sửa đổi khoản 1 Điều 332 Bộ luật Hình sự theo hướng: ""Người nào không chấp hành đúng quy định của pháp luật về đăng ký nghĩa vụ quân sự, không chấp hành lệnh gọi khám sức khỏe nghĩa vụ quân sự, không chấp hành lệnh gọi nhập ngũ, lệnh gọi tập trung huấn luyện, đã bị xử phạt vi phạm hành chính về một trong các hành vi này hoặc đã bị kết án về tội này, chưa được xóa án tích mà còn vi phạm, thì bị phạt cải tạo không giam giữ đến 2 năm hoặc phạt tù từ 3 tháng đến 2 năm"". Cử tri Hà Nội cho rằng có sự mâu thuẫn, thiếu thống nhất giữa quy định tại Bộ luật Hình sự năm 2015 và Luật Nghĩa vụ quân sự năm 2015. Theo đó, Bộ luật Hình sự không quy định hành vi ""không chấp hành lệnh gọi khám sức khỏe nghĩa vụ quân sự"" là tội phạm, trong khi Luật Nghĩa vụ quân sự có đề cập. Do đó người không đi khám sức khỏe sẽ không đủ điều kiện để ra lệnh nhập ngũ, gây khó khăn cho công tác truy cứu trách nhiệm, ảnh hưởng đến tính nghiêm minh của pháp luật. Vì vậy, cử tri đề nghị nghiên cứu trình Quốc hội bổ sung hành vi không chấp hành khám sức khỏe nghĩa vụ quân sự vào Điều 332 Bộ luật Hình sự năm 2015. Trả lời cử tri, Bộ Quốc phòng cho biết, Điều 332 Bộ luật Hình sự năm 2015 về tội trốn tránh nghĩa vụ quân sự, góp phần quan trọng tạo hành lang pháp lý trong phòng ngừa, xử lý vi phạm về nghĩa vụ quân sự, từng bước bảo đảm tính nghiêm minh của pháp luật và công bằng xã hội. Tuy nhiên, khoản 1 Điều 332 Bộ luật Hình sự năm 2015 không quy định hành vi ""không chấp hành lệnh gọi khám sức khỏe nghĩa vụ quân sự"" chưa thống nhất với quy định tại khoản 8 Điều 3 Luật Nghĩa vụ quân sự năm 2015. Theo Bộ Quốc phòng, khám sức khỏe là bước chuyển tiếp giữa đăng ký nghĩa vụ quân sự và nhập ngũ, tiêu chuẩn sức khỏe là một trong 4 tiêu chuẩn không thể thiếu để gọi nhập ngũ. Nếu không thực hiện việc khám sức khỏe nghĩa vụ quân sự thì không thể nhập ngũ, đồng thời thuật ngữ ""đã bị xử phạt vi phạm hành chính về hành vi này"" còn có quan điểm khác nhau khi áp dụng gây khó khăn, vướng mắc nhất định trong truy cứu trách nhiệm. ""Tiếp thu ý kiến của cử tri, Bộ Quốc phòng sẽ chỉ đạo các cơ quan, đơn vị nghiên cứu, đề xuất sửa đổi, bổ sung quy định tại khoản 1 Điều 332 Bộ Luật Hình sự năm 2015, để thống nhất với hành vi trốn tránh thực hiện nghĩa vụ quân sự tại khoản 8 Điều 3 Luật Nghĩa vụ quân sự năm 2015, bảo đảm đủ cơ sở truy cứu trách nhiệm, thể hiện sự nghiêm minh và tính răn đe của pháp luật đối với tội trốn tránh nghĩa vụ quân sự"", Bộ Quốc phòng trả lời kiến nghị cử tri. Nghị định số 37/2022 của Chính phủ (về sửa đổi, bổ sung một số điều của các Nghị định quy định xử phạt vi phạm hành chính trong lĩnh vực quốc phòng, cơ yếu; quản lý, bảo vệ biên giới quốc gia; trên các vùng biển, đảo và thềm lục địa của nước Cộng hòa xã hội chủ nghĩa Việt Nam) quy định rõ hình thức xử lý vi phạm quy định về kiểm tra, khám sức khỏe thực hiện nghĩa vụ quân sự. Cụ thể: Phạt tiền 10-12 triệu đồng với hành vi không có mặt đúng thời gian hoặc địa điểm kiểm tra, khám sức khỏe ghi trong lệnh gọi kiểm tra hoặc khám sức khỏe nghĩa vụ quân sự mà không có lý do chính đáng; phạt 12-15 triệu đồng với hành vi cố ý không nhận lệnh gọi kiểm tra, khám sức khỏe nghĩa vụ quân sự mà không có lý do chính đáng; phạt 15-20 triệu đồng với người được khám sức khỏe có hành vi gian dối làm sai lệch kết quả phân loại sức khỏe của mình nhằm trốn tránh nghĩa vụ quân sự; phạt 25-35 triệu đồng đối với hành vi không chấp hành lệnh gọi kiểm tra, khám sức khỏe nghĩa vụ quân sự. Ngoài ra, người tái phạm hoặc vi phạm nghiêm trọng có thể bị phạt cải tạo không giam giữ đến 2 năm hoặc phạt tù từ 3 tháng đến 2 năm. Trường hợp có tình tiết tăng nặng như tự gây thương tích để trốn nghĩa vụ, phạm tội trong thời chiến hoặc lôi kéo người khác cùng vi phạm, mức án có thể lên tới 1-5 năm tù. Tủ sách Xã hộigiới thiệu những cuốn sách hay và mới về các chủ đề từ thời sự, chính trị, đến giao thông, hạ tầng... Tủ sách đồng thời cung cấp nhiều kiến thức, dữ liệu để độc giả hiểu nhiều lĩnh vực khác nhau của đời sống xã hội.  Lạng Sơn giải thể 194 Ban chỉ huy Quân sự cơ sở 20:51 27/6/202520:5127/6/2025Xã hộiXã hội 0 Ngày 27/6, Bộ Chỉ huy Quân sự (CHQS) tỉnh tổ chức công bố quyết định giải thể Ban CHQS cấp xã, phường, thị trấn và thành lập Ban CHQS xã, phường mới sau sáp nhập.  Tái cấu trúc lực lượng ở Quân khu 2 06:40 25/6/202506:4025/6/2025Xã hộiXã hội 010 Ngày 24/6, Bộ Tư lệnh Quân khu 2 tổ chức lễ công bố quyết định sáp nhập và tổ chức lại Bộ Chỉ huy Quân sự (CHQS) tỉnh, thành lập Ban Chỉ huy Bộ đội Biên phòng và Ban Chỉ huy phòng thủ khu vực (PTKV) thuộc Bộ CHQS tỉnh.  Bổ sung nhân sự cán bộ Quân đội quy hoạch BCH Trung ương khoá XIV 20:37 2/7/202520:372/7/2025Xã hộiXã hội 020 Quân ủy Trung ương, Bộ Quốc phòng sẽ kiện toàn cán bộ chỉ huy gắn với nhân sự đại hội đảng các cấp, nhân sự tham gia Trung ương khoá XIV, ĐBQH và HĐND các cấp."
ZNews,https://znews.vn/tim-kiem-nan-nhan-mat-tich-do-lu-o-quang-ngai-post1564770.html,Xã hội,Null,"Thứ năm, 3/7/2025 20:03 (GMT+7)",Tìm kiếm nạn nhân mất tích do lũ ở Quảng Ngãi,"Chiều 3/7, Bí thư Đảng ủy xã Sơn Hạ, tỉnhQuảng NgãiLê Văn Vin cho     biết lực lượng chức năng của xã vẫn đang nỗ lực tìm kiếm nạn nhân bị lũ     cuốn mất tích khi đi đang lưu thông qua cầu tràn Thạch Nham. Hiện nay địa phương tiếp tục có mưa rất to, nước sông Trà Khúc dâng     cao, làm ngập sâu cầu tràn Thạch Nham, gây khó khăn cho công tác tìm     kiếm nạn nhân. Chính quyền địa phương đã tiến hành cắm bảng cấm, cử lực lượng chức     năng canh giữ, không cho người và phương tiện lưu thông trên cầu. Tại Quảng Ngãi vào tối 2/7 và sáng 3/7 có mưa to, nước sông Trà Khúc     dâng cao khiến cầu tràn Thạch Nham trên tỉnh lộ 623B bị nước lũ tràn     qua. Lúc 4h20 cùng ngày, chị Lý Thị Hoài Ch (sinh năm 1985, trú     tại Thôn Cận Sơn, xã Sơn Hạ, tỉnh Quảng Ngãi) điều khiển xe máy từ xã     Sơn Hạ chở theo hàng hóa lưu thông qua cầu tràn Thạch Nham. Lúc này, lực lượng chức năng đã cắm biển cảnh báo nguy hiểm hai bên     đầu cầu Thạch Nham do mực nước sông dâng cao. Tuy nhiên, chị Ch vẫn điều     khiển xe máy đi qua, đến đoạn giữa cầu, do nước sông chảy xiết nên chị     Ch bị lạc tay lái, rơi xuống cầu và bị nước lũ cuốn mất tích. Nhận được tin báo, chính quyền địa phương đã chỉ đạo các đơn vị chức     năng huy động lực lượng, phương tiện triển khai phương án tìm kiếm người     bị nạn, trục vớt phương tiện. Lực lượng Công an Phòng cháy chữa cháy và tìm kiếm cứu nạn cứu hộ     tỉnh Quảng Ngãi đã tổ chức tìm kiếm người mất tích ở khu vực hạ lưu.     Hiện ở Quảng Ngãi đang có mưa rất to, nước lũ lên cao trên sông Trà     Khúc. Lực lượng chức năng khuyến cáo người dân không di chuyển tại những     nơi trũng thấp, có nguy cơ sạt lở, đặc biệt là không cố tình qua các cầu     tràn khi cơ quan chức năng đã cắm biển cảnh báo nguy hiểm. Tủ sách Xã hộigiới thiệu những cuốn sách hay và mới về các chủ đề từ thời sự, chính trị, đến giao thông, hạ tầng... Tủ sách đồng thời cung cấp nhiều kiến thức, dữ liệu để độc giả hiểu nhiều lĩnh vực khác nhau của đời sống xã hội.  Dự kiến 30.000 người dự Lễ diễu binh, diễu hành mừng Quốc khánh 2/9 6 giờ trước22:303/7/2025Xã hộiXã hội 0 Dự kiến khoảng 30.000 đại biểu và Nhân dân tham dự Lễ kỷ niệm, diễu binh, diễu hành mừng Quốc khánh 2/9 tại Quảng trường Ba Đình và trung tâm Hà Nội.  Thủ tướng tham dự Hội nghị Thượng đỉnh BRICS mở rộng năm 2025 7 giờ trước21:113/7/2025Xã hộiXã hội 0 Thủ tướng Phạm Minh Chính và Phu nhân sẽ dẫn đầu Đoàn đại biểu cấp cao tham dự Hội nghị Thượng đỉnh BRICS mở rộng năm 2025 và hoạt động song phương tại Brazil từ ngày 4 đến ngày 8/7.  Kịp thời sơ tán 77 người dân trước sạt lở đất ở Lào Cai 7 giờ trước20:423/7/2025Xã hộiXã hội 0 Mưa lớn kéo dài gây sạt lở đất tại phường Sa Pa và xã Cốc San (Lào Cai). Nhờ phát hiện sớm và di dời khẩn cấp trong đêm, 13 hộ dân với 77 nhân khẩu đã thoát nạn."
ZNews,https://znews.vn/xe-bon-va-cham-xe-dap-nguoi-phu-nu-60-tuoi-tu-vong-tai-cho-post1565298.html,Xã hội,Null,"Thứ năm, 3/7/2025 06:48 (GMT+7)","Xe bồn va chạm xe đạp, người phụ nữ 60 tuổi tử vong tại chỗ","Hiện trường vụ tai nạn. Ngày 2/7, lãnh đạo xã Đức Thọ (Hà Tĩnh) cho biết trên địa bàn vừa xảy ra vụ tai nạn khiến một người tử vong. Theo đó, khoảng 9h cùng ngày, xe bồn chở bê tông mang BKS 38H - 014.xx di chuyển trên quốc lộ 8 theo từ Cửa khẩu quốc tế Cầu Treo về trung tâm xã Đức Thọ. Khi di chuyển đến Km16+230 quốc lộ 8 thuộc địa phận xã Đức Thọ, xe bồn rẽ vào Cụm công nghiệp Đức Thọ và xảy ra va chạm với xe đạp do bà N.T.L. (SN 1965, trú xã Đức Thọ) điều khiển. Cú va chạm mạnh khiến người phụ nữ ngã xuống đường, tử vong tại chỗ. Nhận tin báo, Phòng CSGT Công an Hà Tĩnh phối hợp với Công an xã Đức Thọ và đơn vị liên quan có mặt ở hiện trường phân luồng giao thông, làm rõ sự việc. Hiện nguyên nhân vụ tai nạn đang được điều tra làm rõ. Thực trạng giao thông, văn hóa ứng xử của người tham gia, văn hóa quản lý, điều hành giao thông, các vấn đề liên quan tới quy hoạch và giải pháp xây dựng giao thông Việt Nam trong tương lai đều được PGS.TS. Phạm Ngọc Trung đề cập tới trong cuốnVăn hóa giao thông ở Việt Nam hiện nay.  Xe bồn mất lái đâm sập tiệm làm tóc ở TP.HCM Trưa 14/6, một xe bồn trộn bê tông bất ngờ mất lái, lao sang làn đường ngược chiều rồi đâm sập tiệm tóc bên đường Tỉnh lộ 8, huyện Củ Chi, TP.HCM. Nữ chủ tiệm may mắn thoát nạn.  Đi giao bánh ú cho khách, cô gái trẻ bị xe bồn cuốn vào gầm tử vong Cô gái điều khiển xe máy bị chiếc xe bồn lưu thông cùng chiều tông trúng rồi cuốn vào gầm. Nạn nhân được người dân nhanh chóng đưa đi cấp cứu song không qua khỏi.  Xe ba gác lật ngửa, tài xế tử vong ở Bình Dương Chiếc xe ba gác đang chạy trên đường thì bất ngờ loạng choạng rồi va vào hông xe bồn đi cùng chiều. Sau đó, xe ba gác lật ngửa giữa đường, tài xế văng vào gầm xe bồn và tử vong."
ZNews,https://znews.vn/hai-xe-dau-keo-chay-rui-sau-va-cham-post1565692.html,Xã hội,Null,"Thứ năm, 3/7/2025 16:00 (GMT+7)",Hai xe đầu kéo cháy rụi sau va chạm,"Ngày 3/7, Công an tỉnh Đồng Nai tiến hành xác minh làm rõ vụ tai nạn giữa hai xe ôtô đầu kéo xảy ra trên đường tỉnh 769 đoạn qua xã Bình An khiến hai phương tiện bốc cháy. Hai xe bị thiêu rụi sau khi va chạm. Theo thông tin ban ban đầu, khoảng 5h40 ngày 3/7, trên đường tỉnh 769 qua khu vực trên, xe đầu kéo container biển số 51D-051 và xe đầu kéo biển số 51L-920.45 kéo theo rơ-moóc biển số 50RM-066.20 xảy ra va chạm với nhau. Vụ tai nạn khiến hai phương tiện bốc cháy dữ dội và nhanh chóng thiêu rụi hai xe đầu kéo. Lửa bốc cháy dữ dội. Đội Chữa cháy và cứu nạn, cứu hộ khu vực Nhơn Trạch (Phòng Cảnh sát phòng cháy, chữa cháy và cứu nạn, cứu hộ Công an tỉnh) huy động 3 xe chuyên dụng và 15 cán bộ, chiến sĩ đến hiện trường dập lửa. Đến khoảng 6h30 cùng ngày, vụ cháy được dập tắt hoàn toàn. Hiện cơ quan chức năng đang xác minh nguyên nhân vụ việc. Ký họa về Đông Dương - Nam Kỳlà một bộ tranh gồm hàng trăm bức ký họa có giá trị nghệ thuật đặc sắc, phản ánh trực quan, sinh động về đời sống kinh tế, xã hội, văn hóa ở Sài Gòn và Nam Kỳ đầu thế kỷ XX.  Cháy lớn tại siêu thị Điện máy Xanh ở Đồng Nai 13:01 28/6/202513:0128/6/2025Xã hộiXã hội 0 Ngọn lửa bùng phát dữ dội và nhanh chóng lan rộng, bao trùm toàn bộ siêu thị Điện máy Xanh ở huyện Long Thành (Đồng Nai), thiêu rụi nhiều tài sản.  Ông Vũ Hồng Văn giữ chức Bí thư Tỉnh ủy Đồng Nai sau hợp nhất 11:59 30/6/202511:5930/6/2025Xã hộiXã hội 0 Bộ Chính trị chỉ định ông Vũ Hồng Văn, Bí thư Tỉnh uỷ Đồng Nai nhiệm kỳ 2020-2025, giữ chức vụ Bí thư Tỉnh ủy Đồng Nai sau hợp nhất hai tỉnh Đồng Nai và Bình Phước.  Hàng chục cảnh sát bao vây bắt ghe hút cát trên sông Đồng Nai 11:12 29/6/202511:1229/6/2025Pháp luậtPháp luật 0 Các đối tượng tổ chức khai thác cát trái phép trên sông Đồng Nai đưa về bãi tập kết để đưa đi tiêu thụ, thu lợi trái phép hàng trăm triệu đồng."
