Source,URL,Category,Keyword,Time,Title,Content
ZNews,https://znews.vn/chu-tich-ha-noi-duoc-quoc-hoi-trao-them-mot-so-tham-quyen-dac-thu-post1610246.html,Xã hội,Null,"Thứ năm, 11/12/2025 10:38 (GMT+7)",Chủ tịch Hà Nội được Quốc hội trao thêm một số thẩm quyền đặc thù,"Sáng 11/12, với 431/435 đại biểu có mặt bấm nút tán thành, Quốc hội thông qua Nghị quyết về thí điểm một số cơ chế, chính sách đặc thù để thực hiện các dự án lớn, quan trọng trên địa bànHà Nội. Nghị quyết này có hiệu lực thi hành từ 12/12/2025 và được thực hiện trong 5 năm. Với nghị quyết này, Quốc hội đồng ý trao cơ chế, chính sách vượt trội cho Hà Nội. Theo đó, về thẩm quyền quyết định, chấp thuận chủ trương đầu tư, Quốc hội cho phép HĐND thành phố quyết định chủ trương đầu tư đối với dự án đầu tư công, dự án đầu tư PPP không sử dụng vốn ngân sách Trung ương. Kết quả biểu quyết. Cụ thể, đó là dự án đầu tư công, dự án PPP, dự án đầu tư kinh doanh cần triển khai ngay theo chỉ đạo của Bộ Chính trị, Ban Bí thư, Đảng ủy Chính phủ, Ban chấp hành Đảng bộ thành phố Hà Nội; dự án đầu tư công, dự án PPP đáp ứng tiêu chí dự án quan trọng quốc gia hoặc sử dụng vốn ngân sách địa phương, nguồn vốn hợp pháp khác của địa phương trên địa bàn thành phố có quy mô tổng mức đầu tư từ30.000 tỷ đồngtrở lên. Chủ tịch UBND thành phố được chấp thuận chủ trương đầu tư đối với dự án đầu tư thuộc danh mục dự án thu hút nhà đầu tư chiến lược theo quy định của pháp luật về Thủ đô có quy mô vốn đầu tư từ30.000 tỷ đồngtrở lên; dự án đầu tư công, dự án PPP, dự án đầu tư kinh doanh cần triển khai ngay theo chỉ đạo của Bộ Chính trị, Ban Bí thư, Đảng ủy Chính phủ, Ban chấp hành Đảng bộ thành phố Hà Nội. Những dự án ngoài thẩm quyền chấp thuận chủ trương đầu tư của Chủ tịch UBND thành phố gồm Dự án đầu tư nhà máy điện hạt nhân; Dự án đầu tự của nhà đầu tư nước ngoài trong lĩnh vực kinh doanh dịch vụ viễn thông có hạ tầng mạng, trồng rừng, xuất bản, báo chí; Dự án đầu tư có kinh doanh đặt cược, casino, kinh doanh trò chơi điện tử có thưởng dành cho người nước ngoài. Phó Chủ tịch Quốc hộiVũ Hồng Thanhđiều hành phiên biểu quyết. Dự án tiềm ẩn khả năng ảnh hưởng nghiêm trọng đến môi trường thuộc thẩm quyền chấp thuận chủ trương đầu tư của Quốc hội, Thủ tướng; dự án thuộc lĩnh vực quốc phòng, an ninh có mức độ tuyệt mật, cũng không thuộc thẩm quyền chấp thuận chủ trương đầu tư của Chủ tịch UBND thành phố. Với dự án đầu tư cần áp dụng cơ chế, chính sách đặc biệt khác với quy định của luật, nghị quyết của Quốc hội, pháp lệnh, nghị quyết của Ủy ban Thường vụ Quốc hội, trên cơ sở được sự đồng ý của cấp có thẩm quyền, UBND thành phố báo cáo Chính phủ để trình Ủy ban Thường vụ Quốc hội cho phép thực hiện cơ chế, chính sách đặc biệt, sau đó báo cáo Quốc hội tại kỳ họp gần nhất. Tại nghị quyết, Quốc hội cũng cho phép thực hiện lựa chọn nhà thầu trong trường hợp đặc biệt đối với một số dự án đầu tư công, dự án PPP. HĐND thành phố sẽ quy định nội dung, hồ sơ, điều kiện, tiêu chí, trình tự, thủ tục thực hiện lựa chọn nhà đầu tư, nhà thầu. Các dự án đầu tư công, dự án PPP, dự án đầu tư kinh doanh cần triển khai ngay theo chỉ đạo của Bộ Chính trị, Ban Bí thư, Đảng ủy Chính phủ, Ban chấp hành Đảng bộ Thành phố Hà Nội, theo nghị quyết của Quốc hội, được thực hiện các thủ tục về quy hoạch, khởi công xây dựng công trình đồng thời với thực hiện thủ tục chấp thuận chủ trương đầu tư, quyết định chủ trương đầu tư. Nhà đầu tư, chủ đầu tư không phải thực hiện thủ tục về cấp giấy phép xây dựng theo quy định của pháp luật về xây dựng và chịu trách nhiệm hoàn thiện các điều kiện theo quy định của pháp luật trong thời hạn 6 tháng kể từ ngày khởi công. Trường hợp nhà đầu tư, chủ đầu tư không hoàn thiện điều kiện về khởi công xây dựng công trình trong thời hạn 6 tháng kể từ ngày khởi công sẽ bị xử lý theo các điều, khoản của hợp đồng hoặc UBND thành phố trình HĐND thành phố quyết định phương án thu hồi, chấm dứt dự án, hợp đồng dự án. Nhà đầu tư, chủ đầu tư chịu trách nhiệm toàn diện trước pháp luật về các hậu quả phát sinh do không thực hiện đúng cam kết của mình trong hợp đồng. Liên quan quy định thu hồi đất, giao đất, cho thuê đất, Quốc hội nêu rõ sau khi có ý kiến chỉ đạo của cấp có thẩm quyền cho phép triển khai thực hiện dự án, thành phố sử dụng ngân sách cấp thành phố và các nguồn vốn hợp pháp khác để thực hiện dự án bồi thường, hỗ trợ, tái định cư độc lập trước khi phê duyệt chủ trương đầu tư. Ngoài các trường hợp thu hồi đất quy định tại Điều 79 của Luật Đất đai, HĐND thành phố quyết định từng trường hợp thu hồi đất cụ thể để thực hiện các dự án phát triển kinh tế - xã hội vì lợi ích quốc gia, công cộng và chịu trách nhiệm toàn diện về việc này. HĐND thành phố cũng quyết định tiêu chí, mức bồi thường, hỗ trợ, tái định cư khi Nhà nước thu hồi đất để triển khai các dự án trên địa bàn thành phố. Theo đó, với dự án đầu tư công, dự án PPP, dự án đầu tư kinh doanh cần triển khai ngay theo chỉ đạo của Bộ Chính trị, Ban Bí thư, Đảng ủy Chính phủ, Ban chấp hành Đảng bộ thành phố Hà Nội, mức bồi thường bằng 2 lần so với mức quy định. Các trường hợp còn lại không quá 2 lần so với mức quy định. SáchBàn về Quốc hội - những thách thức của những khái niệmlà kết quả của cả một quá trình tích lũy và suy ngẫm của tiến sĩ Nguyễn Sĩ Dũng, nguyên Phó chủ nhiệm Văn phòng Quốc hội.  25 phút trước10:3011/12/2025 0 Từ ngày 13/12, Bắc Bộ và Bắc Trung Bộ trời chuyển rét, vùng núi và trung du Bắc Bộ từ 13 – 14/12 xuất hiện rét đậm, vùng núi cao có nơi rét hại; đồng bằng Bắc Bộ có nơi rét đậm.  2 giờ trước08:5711/12/2025 0 Chủ tịch Hà Nội yêu cầu Sở Xây dựng không cấp phép thi công đào lòng lề đường, vỉa hè trong giai đoạn cuối năm khi không khí ô nhiễm nghiêm trọng.  2 giờ trước08:4711/12/2025 0 Theo Cục CSGT, tình trạng xe hợp đồng hoạt động như tuyến cố định, xe trá hình đón, trả khách không đúng quy định diễn biến phức tạp, tiềm ẩn nguy cơ cao về tai nạn và ùn tắc giao thông, đồng thời gây cạnh tranh không lành mạnh trong hoạt động kinh doanh vận tải."
ZNews,https://znews.vn/doi-ban-truot-dai-trong-vong-xoay-ma-tuy-post1610230.html,Pháp luật,Null,"Thứ năm, 11/12/2025 10:05 (GMT+7)",Đôi bạn trượt dài trong vòng xoáy ma túy,"Ngày 10/12, Tòa án nhân dân tỉnh Nghệ An mở phiên tòa trực tuyến xét     xử sơ thẩm 2 bị cáo Trần Ngọc Thành (35 tuổi, trú xã An Châu, tỉnh     Nghệ An) và Trần Huy Ngọc (42 tuổi, trú xã Đức Châu, tỉnh Nghệ An) về     tội Mua bán trái phép chất ma túy. Thành có tiền sử phạm tội từ khi mới 15 tuổi và bị đưa vào cơ sở giáo     dục, giáo dưỡng vì hành vi trộm cắp. 2 năm sau, anh ta bị Tòa án nhân     dân quận Hoàn Kiếm (Hà Nội) xử phạt 4 năm tù về tội Phá hủy công trình,     phương tiện quan trọng về an ninh quốc gia. Hai bị cáo Trần Ngọc Thành và Trần Huy Ngọc tại tòa. Năm 2011, Thành tiếp tục bị tuyên phạt 38 tháng tù vì Vi phạm quy     định về điều khiển phương tiện giao thông đường bộ. Những năm sau đó,     Thành liên tục ""vào tù ra tội"" với các tội Trộm cắp tài sản và Mua bán     trái phép chất ma túy. Người thân từng hy vọng sau nhiều lần trả giá, Thành sẽ biết dừng lại     để làm lại cuộc đời. Tuy nhiên, với bản tính lười lao động, anh ta lại     bắt tay với Ngọc - người cũng có nhiều tiền sự và một tiền án liên quan     đến ma túy. Ngày 29/10/2024, để có ma túy sử dụng và bán kiếm lời, Ngọc nhờ Thành     mua hộ 10 gói hồng phiến. Thành đồng ý, liên lạc một phụ nữ ở huyện Quế     Phong (cũ) để đặt mua. Bên bán báo giá 40 triệu đồng, nhưng Thành nâng     giá lên 50 triệu đồng khi thông báo lại cho Ngọc. Cùng ngày, Thành bắt xe lên Quế Phong lấy ""hàng"". Hôm sau, ghé Bệnh     viện Hữu nghị Đa khoa Nghệ An thăm người ốm, Thành mang theo gói ma túy     trong hộp carton và gửi xe buýt để Ngọc nhận tại Diễn Châu. Khoảng 10h,     Ngọc nhận hàng, lấy một phần sử dụng rồi giấu số còn lại để bán dần. Sau     đó, đối tượng chuyển 50 triệu đồng cho Thành. Chiều 6/1/2025, Tổ công tác Công an huyện Diễn Châu đến nhà Ngọc làm     việc về thủ tục cai nghiện bắt buộc. Phát hiện động thái bất thường, lực     lượng chức năng chứng kiến Ngọc thả một lọ nhựa chứa nhiều viên ma túy.     Ngọc bị bắt quả tang cùng tang vật hơn 209 gam ma túy tổng hợp. Hay tin đồng bọn sa lưới, Thành bỏ trốn vào Lâm Đồng. Đầu tháng 10/2025, khi trở về Nghệ An, anh ta bị bắt giữ. Tại tòa, cả hai bị cáo đều thừa nhận hành vi phạm tội. Bị cáo Ngọc khai, do nghiện     nặng, không có nghề nghiệp ổn định nên mua ma túy vừa để bán kiếm lời,     vừa phục vụ nhu cầu cá nhân. Thành thừa nhận đã hưởng lợi 10 triệu đồng     và cho biết trong thời gian trốn chạy luôn bị dằn vặt. Nói lời sau cùng, cả hai bày tỏ hối hận, mong Hội đồng xét xử xem xét giảm nhẹ hình phạt để sớm trở lại với gia đình. Xem xét toàn bộ hồ sơ và lời khai, Hội đồng xét xử tuyên phạt Trần     Ngọc Thành và Trần Huy Ngọc mỗi người 20 năm tù về tội Mua bán trái phép     chất ma túy. Sách về Pháp luật Cuốn sách""Bảo đảm quyền bào chữa của bị cáo trong xét xử sơ thẩm các vụ án hình sự ở Việt Nam""sẽ góp phần làm sáng tỏ những vấn đề lý luận, thực tiễn bảo đảm quyền bào chữa của bị cáo trong hoạt động xét xử sơ thẩm các vụ án hình sự của TAND hiện nay.  4 giờ trước07:2511/12/2025 0 Cơ quan CSĐT Công an tỉnh Thái Nguyên tiến hành khởi tố vụ án, khởi tố bị can, ra lệnh tạm giam đối với Phạm Anh Cường (SN 1989, trú tại phường Tích Lương) về tội ""Chống người thi hành công vụ"" theo quy định tại Khoản 1, Điều 330 BLHS.  4 giờ trước06:5511/12/2025 0 Thứ trưởng Bộ Công an đề nghị Công an tỉnh Lạng Sơn tiếp tục phối hợp chặt chẽ với các lực lượng liên quan để điều tra mở rộng, củng cố tài liệu, chứng cứ, xử lý nghiêm các đối tượng theo quy định pháp luật liên quan đến vụ Đoàn Văn Sáng giết người xảy ra tại xã Hữu Lũng.  2 giờ trước08:5911/12/2025 0 Phòng Cảnh sát hình sự Công an TP Cần Thơ cho biết phối hợp triệt phá một trường gà quy mô lớn, tạm giữ hình sự 23 đối tượng cùng nhiều tang vật liên quan."
ZNews,https://znews.vn/ong-trump-tin-co-the-hoa-giai-xung-dot-thai-lan-campuchia-post1610218.html,Thế giới,Null,"Thứ năm, 11/12/2025 09:10 (GMT+7)",Ông Trump tin có thể hòa giải xung đột Thái Lan - Campuchia,"Tổng thống Mỹ Donald Trump tại Nhà Trắng ngày 10/11. Ảnh:Reuters. Phát biểu tại Nhà Trắng ngày 10/12 (giờ địa phương), ông Trump nói ông sẽ gọi cho lãnh đạo Campuchia vàThái Lan“vào ngày mai”, cho rằng hai nước đã xung đột quá lâu và ông từng giúp họ đạt đồng thuận trong nỗ lực hòa giải hồi tháng 10. Nhà lãnh đạoMỹnhấn mạnh ông “có thể khiến họ ngừng xung đột”, đồng thời ca ngợi các lãnh đạo Phnom Penh và Bangkok là “những người tuyệt vời”, theoAFP. ""Tôi cho rằng mình có thể khiến họ ngừng xung đột"", ông nói. Tuyên bố này được đưa ra trong bối cảnh giao tranh biên giới giữa hai quốc gia Đông Nam Á lại bùng phát hôm 7/12. Binh sĩ hai bên sử dụng cả tiêm kích F-16, pháo phản lực và nhiều loại vũ khí hạng nặng nhằm vào các mục tiêu dọc khu vực tranh chấp, khiến một số binh sĩ và dân thường thiệt mạng. Cũng trong ngày 10/12, Thủ tướng kiêm Bộ trưởng Nội vụ Thái Lan Anutin Charnvirakul khẳng định ông “chưa nhận bất kỳ liên lạc nào” từ Tổng thống Trump liên quan đến đề nghị ngừng bắn,National Thailandcho biết. “Thông thường, mọi cuộc điện đàm giữa các lãnh đạo đều phải được sắp xếp trước. Chúng tôi chưa nhận được bất kỳ sự phối hợp nào”, ông nói. Thủ tướng kiêm Bộ trưởng Nội vụ Thái Lan Anutin Charnvirakul. Ảnh:National Thailand. Khi được hỏi liệu ông có đồng ý trao đổi nếu Tổng thống Mỹ gọi điện, ông Anutin trả lời: “Nếu lãnh đạo Mỹ gọi, tất nhiên chúng tôi sẽ nghe máy. Tôi sẵn sàng giải thích để ông ấy hiểu tình hình thực tế”. Tuy nhiên, ông nhấn mạnh quyết định chấm dứt giao tranh là vấn đề an ninh quốc gia và chỉ có thể do Bangkok và Phnom Penh tự quyết. “Đó là chuyện giữa hai bên. Chúng tôi trân trọng thiện chí của các quốc gia mong muốn hòa bình, nhưng cũng cần làm rõ nguyên nhân và bối cảnh”, ông nói. Lãnh đạo Thái Lan cũng bác bỏ ý kiến cho rằng thỏa thuận hòa bình ký hồi tháng 10 - với sự trung gian của Mỹ - là một sai lầm. Ông cho rằng Bangkok đã tuân thủ toàn bộ điều kiện, trong khi “phía bên kia không thực hiện đầy đủ”. Thái Lan thậm chí đã chuẩn bị cả phương án trao trả tù binh. Trả lời câu hỏi về thời điểm chấm dứt giao tranh hiện nay, Anutin cho biết không thể tiết lộ chi tiết: “Đó là vấn đề an ninh quốc gia. Tôi không thể bình luận thêm”. Sách hay về Đông Nam Á Để giúp độc giả hiểu thêm về Đông Nam Á,Tri Thức - Znewsgiới thiệu ba cuốn sách của Nhà xuất bản Chính trị Quốc gia về chủ đề này: “Cạnh tranh Trung - Ấn tại Đông Nam Á”, “Gắn kết và chủ động thích ứng: Tầm nhìn và triển vọng của ASEAN sau năm 2025” và “Đông Nam Á học - Một số vấn đề về ngôn ngữ và văn hóa”.  Hải quân Hoàng gia Thái Lan huy động lực lượng trên biển, trên bộ và trên không để bảo vệ biên giới Chanthaburi-Trat.  Những cuộc đụng độ biên giới Thái Lan - Campuchia lại bùng phát trong bối cảnh Tổng thống Mỹ Donald Trump tiếp tục nỗ lực dùng vai trò trung gian hòa giải.  Tổng thống Mỹ Donald Trump ngày 9/12 cho biết ông dự kiến có cuộc điện đàm vào ngày 10/12 liên quan đến tình hình Thái Lan - Campuchia."
ZNews,https://znews.vn/tong-thong-ukraine-kyiv-va-washington-da-dat-dong-thuan-post1610254.html,Thế giới,Null,"Thứ năm, 11/12/2025 10:52 (GMT+7)",Tổng thống Ukraine: Kyiv và Washington đã đạt đồng thuận,"Tổng thống Ukraine Volodymyr Zelensky. Ảnh:Kyodo/TTXVN. Theo hãng tinReuters, trong cuộc gặp với Bộ trưởng Tài chínhMỹScott Bessent, con rể của Tổng thốngDonald Trumplà Jared Kushner và Giám đốc điều hành BlackRock Larry Fink, Tổng thống Zelensky cùng Thủ tướng Yulia Svyrydenko đã thảo luận về một “văn kiện kinh tế”. “Các nguyên tắc của văn kiện kinh tế hoàn toàn rõ ràng và chúng tôi hoàn toàn nhất trí với phía Mỹ”, nhà lãnh đạo nói. “Một nguyên tắc quan trọng là để quá trình tái thiết đạt chất lượng cao và tăng trưởng kinh tế sau chiến tranh trở nên rõ ràng, an ninh thực sự phải là cốt lõi. Khi có an ninh, mọi thứ khác cũng sẽ có”, ông Zelensky cho hay. Ông Zelensky cho biết công việc đang được tiến hành song song với “kế hoạch hòa bình căn bản” gồm 20 điểm nhằm chấm dứt xung đột tại Ukraine. Cùng với bản kế hoạch hòa bình là hai văn kiện liên quan khác, đề cập đến các đảm bảo an ninh và các vấn đề kinh tế. Các nhà lãnh đạo Anh,PhápvàĐứcđã có cuộc điện đàm với Tổng thống Trump trong ngày 10/12 để thảo luận về những nỗ lực hòa bình mới nhất của Washington nhằm chấm dứt giao tranh ở Ukraine. Trước đó hai hôm, Tổng thống Ukraine cũng đã gặp các nhà lãnh đạo châu Âu để tìm kiếm sự ủng hộ của các quốc gia này trong việc gây sức ép lênNga. Các nhà lãnh đạo châu Âu khẳng định đây là thời điểm quan trọng trong tiến trình hướng tới hòa bình tại Ukraine. “Các nhà lãnh đạo đều nhất trí rằng đây là thời điểm quan trọng và chúng ta phải tiếp tục tăng cường hỗ trợ Ukraine, đồng thời gia tăng sức ép kinh tế lên Nga để chấm dứt cuộc chiến này. Đây là tiến triển lớn nhất trong bốn năm qua và chúng tôi hoan nghênh việc các cuộc đàm phán đang tiếp tục ở mọi cấp độ”, người phát ngôn của Thủ tướng Anh, ông Tom Wells, phát biểu ngày 8/12. Ông nói thêm rằng những công việc chuyên sâu hơn sẽ tiếp tục trong những ngày tới, dù vẫn còn nhiều vấn đề chưa được giải quyết. Các nhà lãnh đạo châu Âu đang tìm cách bảo đảm rằng bất kỳ lệnh ngừng bắn nào cũng phải đi kèm với các cam kết an ninh vững chắc từ cả châu Âu và Mỹ. Trong khi đó, Tổng thống Trump đến nay vẫn chưa công khai đưa ra những cam kết này. Ngày 6/12, các nhà đàm phán Mỹ và Ukraine đã kết thúc ba ngày thảo luận nhằm thu hẹp khác biệt quanh đề xuất hòa bình của Washington. Tổng thống Zelensky cho biết các cuộc trao đổi với đại diện Mỹ diễn ra mang tính xây dựng, dù vẫn còn nhiều khó khăn.  Người phát ngôn Điện Kremlin Dmitry Peskov cho biết, Nga đang tìm kiếm một thỏa thuận hòa bình lâu dài, ràng buộc về mặt pháp lý với Ukraine chứ không phải một lệnh ngừng bắn có giới hạn.  Washington Post dẫn các nguồn thạo tin cho biết, các quan chức Ukraine và phương Tây đã thảo luận về việc “trao đổi đất đai” giữa Nga và Ukraine cũng như một khu vực phi quân sự rộng lớn dọc theo tiền tuyến nhằm tìm kiếm thỏa thuận hòa bình tiềm năng dễ chấp nhận hơn đối với Kyiv.  Washington gây sức ép buộc Kyiv xem xét nhượng bộ lãnh thổ trước Giáng sinh, trong khi giới chức Mỹ và châu Âu khẳng định chiến trường chưa có thay đổi đáng kể."
ZNews,https://znews.vn/nong-my-bat-giu-tau-cho-dau-ngoai-khoi-venezuela-post1610224.html,Thế giới,Null,"Thứ năm, 11/12/2025 09:54 (GMT+7)",Nóng: Mỹ bắt giữ tàu chở dầu ngoài khơi Venezuela,"Động thái này diễn ra trong bối cảnh hoạt động quân sự củaMỹđang gia tăng ở khu vực Caribe, nhắm vào những gì mà Washington mô tả là tàu của các băng đảng ma túy. “Hôm nay, Cục Điều tra Liên bang Mỹ (FBI), Cơ quan Điều tra An ninh Nội địa (HSI) và Lực lượng Bảo vệ bờ biển Mỹ, với sự hỗ trợ từ Bộ Chiến tranh, đã thực thi lệnh bắt giữ con tàu được sử dụng để vận chuyển dầu trái phép từ Venezuela vàIran”, Bộ trưởng Bondi viết trên mạng xã hội X. Bà Bondi cho biết con tàu này đã bị trừng phạt “do liên quan đến mạng lưới vận chuyển dầu bất hợp pháp”. Video do bà Bondi đăng tải cho thấy, lực lượng an ninh được trang bị vũ khí hạng nặng đã đổ bộ xuống tàu từ trực thăng. Sau thông báo của bà Bondi, Tổng thống MỹDonald Trumpxác nhận nước này đã bắt giữ một tàu chở dầu ngoài khơi bờ biển Venezuela. ""Chúng tôi vừa bắt giữ một tàu chở dầu ngoài khơi Venezuela, một tàu chở dầu lớn, rất lớn, thực sự là lớn nhất từ trước đến nay”, ông Trump nói. Khi được hỏi điều gì sẽ xảy ra với số dầu, Trump nói: ""Tôi đoán là chúng tôi sẽ tạm giữ nó”. Ông Trump đã nhiều lần đề cập đến khả năng can thiệp quân sự vào Venezuela. Vụ việc này là hành động công khai đầu tiên nhằm vào một tàu chở dầu kể từ khi ông ra lệnh tăng cường quân sự quy mô lớn trong khu vực. Các quan chức chính quyền Mỹ không nêu tên con tàu bị bắt giữ. Nhưng theo tập đoàn quản lý rủi ro hàng hải Vanguard của Anh, một tàu chở dầu mang tên Skipper được cho là đã bị bắt giữ ngoài khơi Venezuela vào sáng sớm 10/12. Mỹ cho rằng con tàu này có liên quan đến hoạt động buôn bán dầu của Iran khi còn mang tên Adisa. Theo thông tin vệ tinh được phân tích bởiTankerTrackers.comvà dữ liệu vận chuyển nội bộ từ công ty dầu khí nhà nước Venezuela PDVSA, tàu Skipper đã rời cảng Jose của Venezuela vào khoảng ngày 4 đến 5/12 sau khi bốc dỡ khoảng 1,1 triệu thùng dầu thô Merey của Venezuela. Ngày 10/12, Tổng thống Venezuela Nicolas Maduro đã phát biểu tại một cuộc tuần hành, mà không đề cập đến các báo cáo về vụ bắt giữ tàu chở dầu. Giá dầu tương lai đã bật tăng sau khi tin tức về vụ bắt giữ được công bố. Cụ thể, giá dầu Brent tương lai tăng 27 cent, tương đương 0,4%, lên mức62,21 USD/thùng, trong khi giá dầu thô West Texas Intermediate của Mỹ tăng 21 cent, tương đương 0,4%, lên mức58,46 USD/thùng. Đọc để hiểu rõ hơn lịch sử nước Mỹ Mục Thế giới giới thiệu cuốn sáchLẽ thường- cuốn sách của tác giả Thomas Paine được xuất bản lần đầu vào năm 1776 và đã có vai trò quan trọng trong thời kỳ lập quốc của Mỹ. Cho đến hôm nay, cuốn sách vẫn còn nguyên giá trị lịch sử đối với những ai quan tâm đến lịch sử nước Mỹ.  23 giờ trước11:5110/12/2025 0 Mỹ điều hai tiêm kích F/A-18 bay sát không phận Venezuela trong một chuyến huấn luyện được mô tả là “thường lệ”, nhưng mức độ áp sát kỷ lục làm dấy lên lo ngại căng thẳng khu vực gia tăng.  22:03 5/12/202522:035/12/2025 0 Các nguồn thạo tin cho hay Tổng thống Venezuela liên tục thay đổi nơi nghỉ đêm, đổi điện thoại và điều chỉnh lịch trình nhằm tránh nguy cơ bị tấn công hoặc bị lực lượng đặc nhiệm nhắm mục tiêu.  19:05 7/12/202519:057/12/2025 0 Hàng trăm người dân Cuba đã tập trung tại thủ đô La Habana ngày 6/12 để lên tiếng phản đối chính sách của Mỹ đối với Venezuela. Họ vẫy cờ và hô vang khẩu hiệu ủng hộ Tổng thống Venezuela Nicolas Maduro."
