Source,URL,Category,Keyword,Time,Title,Content
ZNews,https://znews.vn/san-bay-cong-suat-tu-30-trieu-khachnam-phai-lam-duong-sat-ket-noi-post1556205.html,Kinh doanh,Null,"Thứ ba, 27/5/2025 15:53 (GMT+7)",Sân bay công suất từ 30 triệu khách/năm phải làm đường sắt kết nối,"Tân Sơn Nhất là một trong những sân bay quốc tế có công suất thiết kế trên 30 triệu lượt khách/năm tại Việt Nam. Ảnh:Chí Hùng. Chiều 27/5, Bộ trưởng Xây dựng Trần Hồng Minh thừa ủy quyền của Thủ tướng trình bày Tờ trình dự án Luật Đường sắt (sửa đổi). Một trong những nội dung đáng chú ý của dự án Luật này là việc bổ sung quy định các cảng hàng không, cảng biển lớn, khu đầu mối giao thông phải có quy hoạch kết nối với đường sắt. Quy định này nhằm giải quyết bất cập về tính đồng bộ, tính kết nối giữa các phương thức vận tải hiện nay, đồng thời phát huy lợi thế của từng phương thức và vận tải đa phương thức, phát huy thế mạnh của đường sắt trong vận tải hàng hóa, hành khách khối lượng lớn, cự ly trung bình đến cự ly dài. Đồng thời, dự án Luật cũng bổ sung quy định chủ đầu tư các dự án cảng biển, cảng hàng không, cảng cạn phải dành quỹ đất và thực hiện đầu tư đường sắt kết nối với hệ thống đường sắt. Cụ thể, khoản 3 Điều 13 dự thảo Luật Đường sắt (sửa đổi) quy định: “Cảng hàng không có công suất từ 30 triệu hành khách/năm trở lên, cảng biển loại I trở lên và cảng cạn có công suất từ 50.000 TEU/năm trở lên tại các tỉnh/thành phố có đường sắt quốc gia, đường sắt địa phương đi qua phải có quy hoạch kết nối với đường sắt vào trong cảng để đáp ứng nhu cầu vận tải, phát triển kinh tế - xã hội, quốc phòng, an ninh, bảo vệ môi trường”. Đồng thời, khi lập, điều chỉnh quy hoạch, đầu tư xây dựng công trình cảng hàng không, cảng biển, cảng cạn phải dành quỹ đất để xây dựng công trình đường sắt kết nối. Chủ đầu tư công trình cảng xây dựng lộ trình thực hiện kết nối đường sắt theo quy hoạch được phê duyệt. Bộ trưởng Xây dựng Trần Hồng Minh trình bày Tờ trình dự án Luật Đường sắt (sửa đổi). Ảnh:Quochoi.vn. Thẩm tra về nội dung này, Ủy ban Khoa học, Công nghệ và Môi trường của Quốc hội cho biết quy định về kết nối đường sắt này rất cần thiết. Tuy nhiên, đề nghị làm rõ và nghiên cứu, bổ sung một số quy định như cơ chế kết nối đồng bộ và hiệu quả giữa đường sắt với các phương thức vận tải khác, đặc biệt trong việc kết nối đường sắt với các cảng hàng không, cảng biển, cảng cạn, cảng thủy nội địa nhằm tối ưu hóa hệ thống vận tải liên hoàn. Đồng thời, cần làm rõ hơn cơ sở khoa học và thực tiễn để đưa ra tiêu chí công suất của các cảng, đặc biệt là về cảng cạn và cảng hàng không trong kết nối với đường sắt; công suất dự kiến trong tương lai và yêu cầu cụ thể đối với các cảng có công suất thấp hơn nhưng vẫn có nhu cầu kết nối với đường sắt. Ngoài ra, Ủy ban Khoa học, Công nghệ và Môi trường cho rằng việc xác định điều kiện kết nối đối với các cảng quốc tế và các khu vực logistics cũng cần phải được làm rõ hơn để đảm bảo tính khả thi. Ủy ban cũng yêu cầu nghiên cứu, bổ sung quy định về cơ chế phối hợp liên ngành, giao Bộ Xây dựng chủ trì, cùng các bộ liên quan và chính quyền địa phương xây dựng kế hoạch phát triển các điểm kết nối đường sắt - cảng biển - cảng cạn, đường sắt - cảng hàng không, đường sắt - trung tâm logistics. Ngoài ra, Ủy ban cho biết có ý kiến đề nghị làm rõ quy hoạch kết nối với đường sắt là loại quy hoạch nào trong hệ thống quy hoạch và nội dung, trình tự, thủ tục của loại quy hoạch này được thực hiện như thế nào; quy định rõ về các chủ thể sẽ thực hiện nội dung này, để tránh vướng mắc trong quá trình quản lý và triển khai thực hiện. Mặt khác, có ý kiến cho rằng việc kết nối giữa cảng và đường sắt phải được tính toán về hiệu quả kinh tế - xã hội, môi trường và các lợi ích khác so với kết nối các phương thức vận tải khác. Vì vậy, cơ quan soạn thảo cần cân nhắc việc quy định “cứng” như tại dự thảo Luật. Tại khoản 4 Điều 14 dự thảo Luật quy định: “Khi lập, điều chỉnh quy hoạch, đầu tư xây dựng công trình cảng hàng không, cảng biển, cảng cạn quy định tại khoản 3 Điều này phải dành quỹ đất để xây dựng công trình đường sắt kết nối. Chủ đầu tư công trình cảng xây dựng lộ trình thực hiện kết nối đường sắt theo quy hoạch được phê duyệt”. Ủy ban thẩm tra đề nghị làm rõ hơn đối với loại quy hoạch (quy hoạch chi tiết, quy hoạch hệ thống cảng hàng không, quy hoạch hệ thống cảng biển...) phải thực hiện việc lập, điều chỉnh. Đồng thời, cần xác định rõ công trình đường sắt kết nối là công trình như thế nào; quy định cụ thể về quy trình, thủ tục triển khai thực hiện. Tri Thức - Znewsgiới thiệu độc giảTủ sách kiến thức kinh tếvới đa dạng cuốn sách, câu chuyện trong lĩnh vực kinh doanh, kinh tế. Những cuốn sách, câu chuyện trong Tủ sách không đơn thuần là những tác phẩm của tri thức mà còn chứa đựng bí quyết, kinh nghiệm quý báu từ các tác giả, nhà quản lý có uy tín và kinh nghiệm lâu năm trong ngành. Đọc sách không chỉ giúp tiếp cận những kiến thức mới mà còn giúp mở rộng tầm nhìn và phát triển bản thân. Tủ sách kiến thức kinh tế mong muốn lan tỏa tri thức trong lĩnh vực kinh doanh, đồng thời phát triển văn hóa đọc cho người Việt.  Chuyên gia logistics 25 năm kinh nghiệm mất hơn 6 tháng để nhập cảnh 5 giờ trước21:2727/5/2025Kinh doanhKinh doanh 0 Các doanh nghiệp trong lĩnh vực bán dẫn, trí tuệ nhân tạo (AI) và chuyển đổi số châu Âu kêu gọi sự linh hoạt hơn trong việc công nhận kinh nghiệm thay cho bằng cấp học thuật.  Nam Long kỳ vọng thêm quỹ đất và vốn quốc tế nhờ Nghị quyết 68 6 giờ trước20:1227/5/2025Kinh doanhKinh doanh 0 Đại diện Tập đoàn Nam Long kỳ vọng Nghị quyết 68 sẽ cụ thể hóa chính sách, tạo điều kiện để doanh nghiệp mở rộng quỹ đất và thu hút dòng vốn đầu tư quốc tế.  Giá vàng miếng, vàng nhẫn đồng loạt lao dốc 8 giờ trước18:1127/5/2025Kinh doanhKinh doanh 0 Giá vàng trong nước bất ngờ đảo chiều giảm mạnh trong phiên chiều 27/5, với vàng miếng SJC mất tới 700.000 đồng/lượng và vàng nhẫn giảm tới 1 triệu đồng."
ZNews,https://znews.vn/nam-long-ky-vong-them-quy-dat-va-von-quoc-te-nho-nghi-quyet-68-post1556129.html,Kinh doanh,Null,"Thứ ba, 27/5/2025 20:12 (GMT+7)",Nam Long kỳ vọng thêm quỹ đất và vốn quốc tế nhờ Nghị quyết 68,"Bà Nguyễn Thanh Hương, Giám đốc Đầu tư Tập đoàn Nam Long tại tọa đàm ""Gỡ điểm nghẽn thể chế - Khơi thông nguồn lực tư nhân"". Ảnh:BTC. Tại tọa đàm ""Gỡ điểm nghẽn thể chế - Khơi thông nguồn lực tư nhân"" do VTV tổ chức ngày 27/5, bà Nguyễn Thanh Hương, Giám đốc Đầu tư Tập đoàn Nam Long cho rằng kể từ khi Nghị quyết 68 được ban hành, cộng đồng doanh nghiệp tư nhân đã được nhìn nhận đúng vai trò, tiếp thêm năng lượng và củng cố niềm tin. ""Đây là một bước ngoặt mới, giúp doanh nghiệp tự tin hơn, đặc biệt là khi làm việc với các đối tác quốc tế"", bà nhấn mạnh. Thực tế, với hơn 33 năm hoạt động, bà Hương cho biết phần lớn dự án của Nam Long đều kêu gọi vốn từ nước ngoài. Đặc biệt, trong khoảng 10 năm trở lại đây, doanh nghiệp liên tục nỗ lực để khơi thông dòng vốn, có dự án tỷ lệ vốn nước ngoài lên tới 50%. Vị này nhận định đối với các nhà đầu tư quốc tế, yêu cầu quan trọng nhất khi tham gia một dự án là sự rõ ràng về pháp lý và cam kết về tiến độ triển khai. Tuy nhiên, trong 3-4 năm qua, việc tạm dừng nhiều dự án bất động sản khiến dòng vốn từ nhà đầu tư nước ngoài chưa thể đổ vào Việt Nam như kỳ vọng, dù các đối tác quốc tế vẫn dành sự quan tâm lớn và sẵn sàng đầu tư dài hạn. ""Thời gian qua, chúng tôi đã nhiều lần lỡ hẹn với các nhà đầu tư. Có thời điểm chúng tôi hoàn toàn bất lực bởi những yếu tố khách quan bên ngoài"", bà Hương chia sẻ. Trong bối cảnh đó, đại diện Tập đoàn Nam Long cho rằng giá trị lớn nhất mà Nghị quyết 68 mang lại chính là niềm tin. Đây là yếu tố gián tiếp củng cố uy tín của doanh nghiệp Việt Nam trong mắt các đối tác nước ngoài. ""Chúng tôi rất mong chính sách sẽ sớm được cụ thể hóa. Khi các nguồn lực được khơi thông, việc tham gia các dự án lớn, như phát triển đô thị gắn với giao thông (TOD) sẽ trở nên khả thi hơn"", bà nói. Theo bà, chỉ cần có sự hỗ trợ từ Nhà nước, nguồn vốn đầu tư sẽ tăng mạnh, bởi các nhà đầu tư nước ngoài đang đặc biệt quan tâm đến lĩnh vực bất động sản, nhất là các dự án TOD. ""Họ sẵn sàng tham gia ngay khi cơ chế được triển khai minh bạch và kịp thời"", bà Hương nhấn mạnh. Bà Hương cũng cho biết trong quá khứ, đối với các doanh nghiệp bất động sản, khâu chuẩn bị đầu tư có thể kéo dài vài năm chỉ để hoàn thiện pháp lý. Với hệ thống thể chế mới, bà hy vọng thời gian này sẽ được rút ngắn, giúp doanh nghiệp hoạt động hiệu quả hơn. Ngoài ra, bà Hương đánh giá cao một trong những chính sách trụ cột vừa được đề xuất, đó là tạo lập môi trường cạnh tranh bình đẳng, giúp doanh nghiệp tư nhân tiếp cận các nguồn lực quan trọng như quỹ đất và vốn. ""Đối với doanh nghiệp bất động sản, quỹ đất là yếu tố then chốt. Việc mở cửa cạnh tranh công bằng sẽ tạo điều kiện cho khu vực tư nhân tiếp cận các nguồn lực này. Chúng tôi mong các chính sách trụ cột sắp tới sẽ sớm được thể chế hóa cụ thể để doanh nghiệp bất động sản có thể tiếp cận được quỹ đất"", bà chia sẻ. Thực tế, không chỉ Tập đoàn Nam Long, nhiều doanh nghiệp tư nhân khác cũng đều kỳ vọng lớn vào Nghị quyết 68 cũng như các chính sách liên quan nhằm tháo gỡ các điểm nghẽn thể chế và khơi thông nguồn lực phát triển. Tại tọa đàm, TS Nguyễn Xuân Thành - Giảng viên cao cấp Trường Chính sách công và Quản lý Fulbright - phân tích các chính sách mới trong Nghị quyết 68, Nghị quyết 139 cùng với các hành động cụ thể của Chính phủ đã mở ra nhiều hướng tiếp cận nguồn lực cho doanh nghiệp. Về đất đai, có thể kể đến việc tái khai thác các quỹ đất công chưa được sử dụng, đồng thời tạo điều kiện cho các doanh nghiệp nhỏ, công nghệ cao và khởi nghiệp sáng tạo được thuê đất trong khu công nghiệp với diện tích tối thiểu. Về vốn, chính sách hướng tới việc đa dạng hóa các kênh tín dụng, khơi thông thị trường trái phiếu doanh nghiệp, sửa đổi luật để mở rộng đối tượng được hỗ trợ và đơn giản hóa thủ tục tiếp cận vốn. Tuy nhiên, ông Thành nhìn nhận vấn đề ""điểm nghẽn"" hiện nay nằm ở thực thi. Theo ông, việc ban hành chính sách là chưa đủ, điều quan trọng là chính sách đó có tạo được cơ chế tiếp cận nguồn lực công bằng và hiệu quả cho doanh nghiệp hay không. TS Nguyễn Xuân Thành - Giảng viên cao cấp Trường Chính sách công và Quản lý Fulbright. Ảnh:BTC. Ở góc nhìn khác, ông Từ Tiến Phát - Tổng giám đốc Ngân hàng TMCP Á Châu (ACB) cho rằng nguồn vốn vẫn là mối quan tâm hàng đầu của cộng đồng doanh nghiệp, nhất là trong bối cảnh kinh tế đang đối mặt với nhiều biến động và chi phí tài chính ngày càng gia tăng. Theo ông, để khu vực kinh tế tư nhân có thể bứt phá, cần thiết kế một hệ thống chính sách tài chính linh hoạt, thực chất và đồng bộ. Chia sẻ tại tọa đàm, ông Phát cho biết ACB đang phục vụ hơn 1 triệu doanh nghiệp, trong đó phần lớn là doanh nghiệp nhỏ, vừa và hộ kinh doanh cá thể - những thành phần rất nhạy bén nhưng cũng dễ bị tổn thương trước các biến động của thị trường và thay đổi trong chính sách. ""Là một ngân hàng tư nhân, chúng tôi thấu hiểu quá trình chuyển dịch của khu vực kinh tế tư nhân. Các doanh nghiệp rất sẵn sàng đầu tư, đổi mới, nhưng họ cần thấy rõ sự cụ thể, minh bạch trong chính sách"", ông Phát nhấn mạnh. Ngoài ra, ông Đinh Hồng Kỳ - Chủ tịch HĐQT Secoin, đại diện Hiệp hội Doanh nghiệp TP.HCM nhấn mạnh Nhà nước nên để doanh nghiệp được làm tất cả những gì pháp luật không cấm, thay vì áp dụng cách làm hạn chế. Đồng thời, cần xóa bỏ tư duy ""không quản được thì cấm"". ""Chúng tôi rất thấm thía tư duy 'không quản được thì cấm'. Điều này đang kìm hãm sự phát triển của doanh nghiệp và nền kinh tế"", ông nói. Ông Kỳ lấy ví dụ việc TP.HCM ban hành quy định cấm hoạt động Airbnb trong thời gian gần đây. Theo ông, đây là một minh chứng rõ ràng cho việc ""không quản được thì cấm"", trong khi mô hình này đang được áp dụng phổ biến và hiệu quả tại nhiều quốc gia. Các chuyên gia trao đổi tại tọa đàm ""Gỡ điểm nghẽn thể chế - Khơi thông nguồn lực tư nhân"". Ảnh: BTC. Đồng quan điểm, ông Nguyễn Đình Tùng - Tổng giám đốc Công ty T&T Vina cũng  phản ánh trong lĩnh vực nông nghiệp, nhiều sáng kiến và nhu cầu đầu tư đang bị bó hẹp bởi tư duy quản lý này. Đối với ngành trồng sầu riêng, ông cho biết nông dân cần vốn lớn để đầu tư ban đầu bởi 1-2 năm đầu không có thu hoạch. Đồng thời, tài sản hình thành trên đất không thể được sử dụng làm tài sản thế chấp. Vì không thể tiếp cận tín dụng chính thống, nông dân buộc phải tìm đến các kênh tín dụng bên ngoài, hoặc lệ thuộc vào các công ty cung cấp phân bón. Điều này khiến chi phí sản xuất đội lên và rủi ro tài chính tăng cao. ""Người ta phải mua phân bón với giá cao hơn bình thường, hoặc chấp nhận mức lãi suất rất cao. Trong khi đó, họ có tài sản hình thành trên đất nhưng không được công nhận để thế chấp"", ông Tùng bổ sung. Do vậy, ông đề xuất Nhà nước cần công nhận tài sản hình thành trên đất nông nghiệp là đối tượng được thế chấp, thay vì chỉ dựa vào sổ đỏ như hiện nay. ""Nghị quyết thì đã có, tinh thần cũng rất tiến bộ, nhưng nếu không đi sâu vào đời sống thì doanh nghiệp và người dân sẽ không 'hấp thụ' được. Chúng tôi rất mong cơ chế sẽ sớm được cụ thể hóa ở cấp thực thi"", ông Tùng nói. Tri Thức - Znewsgiới thiệu độc giảTủ sách kiến thức kinh tếvới đa dạng cuốn sách, câu chuyện trong lĩnh vực kinh doanh, kinh tế. Là nguồn tư liệu cho những người quan tâm và muốn nâng cao kiến thức trong lĩnh vực kinh tế. Những cuốn sách, câu chuyện trong Tủ sách không chỉ đơn thuần là những tác phẩm của tri thức mà còn chứa đựng bí quyết, kinh nghiệm quý báu từ các tác giả, nhà quản lý có uy tín và kinh nghiệm lâu năm trong ngành. Đọc sách không chỉ giúp người đọc tiếp cận những kiến thức mới mà còn giúp mở rộng tầm nhìn và phát triển bản thân. Tủ sách kiến thức kinh tế mong muốn lan tỏa tri thức trong lĩnh vực kinh doanh, đồng thời phát triển văn hóa đọc cho người Việt.  'FDI được ưu tiên gì, hãy ưu tiên cho doanh nghiệp nội như thế' Dù đóng góp ngày càng lớn cho nền kinh tế, khu vực tư nhân Việt Nam vẫn đối mặt với nhiều rào cản. Các doanh nghiệp kỳ vọng được đối xử công bằng, thuận lợi để bứt phá và vươn tầm.  Cuộc đối thoại đặc biệt của Thủ tướng với các doanh nhân Tại hội nghị triển khai Nghị quyết 68 và Nghị quyết 66, nhiều doanh nhân đã thẳng thắn nêu kiến nghị nhằm tháo gỡ nút thắt về pháp lý, đất đai và vốn cho khu vực kinh tế tư nhân.  Thủ tướng: Đến năm 2030 kinh tế tư nhân đóng góp 55-58% GDP Thủ tướng cho biết mục tiêu đến năm 2030, kinh tế tư nhân tăng trưởng bình quân 10-12%/năm, cao hơn tốc độ tăng trưởng của nền kinh tế quốc gia và đóng góp khoảng 55-58% GDP."
