Source,URL,Category,Keyword,Time,Title,Content
ZNews,https://znews.vn/pv-gas-day-manh-loat-giai-phap-nham-hoan-thanh-vuot-muc-cac-chi-tieu-post1565245.html,Kinh doanh,Null,"Thứ năm, 3/7/2025 18:08 (GMT+7)",PV GAS đẩy mạnh loạt giải pháp nhằm hoàn thành vượt mức các chỉ tiêu,"Trong bối cảnh nhiều thách thức, PV GAS nhận thấy cần nỗ lực hơn nữa nhằm đạt được các yêu cầu về tăng trưởng doanh thu hợp nhất và lợi nhuận sau thuế. PV GAS triển khai thực hiện kế hoạch sản xuất kinh doanh nửa đầu năm 2025 trong bối cảnh gặp nhiều khó khăn, thách thức từ sự bất ổn địa chính trị, chính sách thuế đối ứng của Mỹ, giá dầu Brent chỉ bằng 86,8%, giá CP bằng khoảng 98,3% so với 5 tháng đầu năm 2024, giá LNG tiếp tục ở mức cao làm giảm sức cạnh tranh so với các loại nhiên liệu khác, cũng như tác động kép từ nhu cầu và sản lượng khí khai thác đầu vào suy giảm. Tuy nhiên, với những cố gắng, nỗ lực, quyết tâm, tập trung cao độ của tập thể người lao động, PV GAS tiếp tục đạt được những kết quả tích cực. Các kết quả đạt được là rất tích cực, tuy nhiên, ban lãnh đạo nhận thấy so với mục tiêu tăng trưởng và kỳ vọng của Tập đoàn Công nghiệp - Năng lượng Quốc gia Việt Nam (Petrovietnam), PV GAS cần nỗ lực hơn nữa trong thời gian tới nhằm đạt được các yêu cầu về tăng trưởng doanh thu hợp nhất và lợi nhuận sau thuế. Do đó, Tổng giám đốc PV GAS đã ban hành chỉ thị về việc triển khai các giải pháp thúc đẩy hoạt động sản xuất kinh doanh nhằm hoàn thành vượt mức các chỉ tiêu quản trị năm 2025. Cụ thể, Tổng giám đốc yêu cầu toàn thể PV GAS tập trung vào các nhiệm vụ trọng tâm như tổ chức quán triệt chỉ đạo của Petrovietnam tại Chỉ thị 4913/CT-CNNL ngày 13/6 và xác định việc hoàn thành kế hoạch quản trị được giao là nhiệm vụ trọng tâm, ưu tiên quan trọng hàng đầu. Mỗi đơn vị phải tiếp tục chủ động, tập trung triển khai, đề ra các giải pháp cụ thể và phân công nhiệm vụ rõ ràng để hoàn thành các chỉ tiêu. Cùng với đó, toàn PV GAS tích cực, chủ động tập trung cho hoạt động sản xuất kinh doanh, phát triển mở rộng thị trường, thúc đẩy kinh doanh quốc tế cho sản phẩm LNG, LPG; tìm kiếm khách hàng và phối hợp với các đơn vị trong chuỗi liên kết để tiêu thụ tối đa khí nội địa, LNG và các sản phẩm khí. Họp triển khai công việc tại Kho cảng PV GAS - Vũng Tàu. Việc tập trung nguồn lực triển khai các dự án trọng điểm để đảm bảo tiến độ và chất lượng là một trong những nhiệm vụ quan trọng, cụ thể như dự án mở rộng, nâng công suất kho chứa LNG Thị Vải lên 3 triệu tấn/năm; dự án đường ống thu gom, vận chuyển khí mỏ Sư Tử Trắng; dự án Kho cảng nhập LNG Sơn Mỹ; dự án nâng công suất đường ống dẫn khí Phú Mỹ - Hồ Chí Minh; dự án nâng công suất cảng Thị Vải; dự án kho LPG lạnh Cái Tráp tại Hải Phòng, các kho LNG tại khu vực phía Bắc và Bắc Trung Bộ. Song song, PV GAS cam kết vận hành an toàn, ổn định và hiệu quả các hệ thống công trình khí, đảm bảo cung cấp khí và các sản phẩm khí liên tục, tối đa cho các hộ tiêu thụ. Để thích ứng với giai đoạn phát triển mới, PV GAS sẽ tiếp tục nâng cao năng lực quản trị doanh nghiệp, tăng cường hiệu năng, hiệu lực và hiệu quả hoạt động, hướng tới một mô hình quản trị chuyên nghiệp. Tổng công ty sẽ cập nhật, tinh gọn, đồng bộ các quy định, quy trình nội bộ, đề cao tinh thần trách nhiệm, đạo đức và văn hóa doanh nghiệp nhằm nâng cao hiệu quả công việc và tăng năng suất lao động. Bên cạnh đó, PV GAS sẽ tăng cường quản lý tài chính, đầu tư, tối ưu hóa chi phí và tìm kiếm, kiến tạo các động lực tăng trưởng mới, đồng thời tích cực triển khai các đề tài ứng dụng khoa học công nghệ và đẩy mạnh quá trình chuyển đổi số, đặc biệt là đưa hệ thống ERP vào hoạt động sản xuất kinh doanh để nâng cao năng suất lao động. Tổng giám đốc PV GAS đề nghị các đơn vị triển khai nghiêm túc các nhiệm vụ, giải pháp theo chỉ thị. Kết quả thực hiện các giải pháp thúc đẩy hoạt động sản xuất kinh doanh sẽ là cơ sở để đánh giá mức độ hoàn thành nhiệm vụ của từng đơn vị và người đại diện trong năm 2025, qua đó đảm bảo tính nghiêm túc và hiệu quả của chỉ thị. Tri Thức - Znewsgiới thiệu độc giảTủ sách kiến thức kinh tếvới đa dạng cuốn sách, câu chuyện trong lĩnh vực kinh doanh, kinh tế. Là nguồn tư liệu cho những người quan tâm và muốn nâng cao kiến thức trong lĩnh vực kinh tế. Những cuốn sách, câu chuyện trong Tủ sách không chỉ đơn thuần là những tác phẩm của tri thức mà còn chứa đựng bí quyết, kinh nghiệm quý báu từ các tác giả, nhà quản lý có uy tín và kinh nghiệm lâu năm trong ngành. Đọc sách không chỉ giúp người đọc tiếp cận những kiến thức mới mà còn giúp mở rộng tầm nhìn và phát triển bản thân. Tủ sách kiến thức kinh tế mong muốn lan tỏa tri thức trong lĩnh vực kinh doanh, đồng thời phát triển văn hóa đọc cho người Việt.  PV GAS lọt Top 50 công ty niêm yết tốt nhất Việt Nam 2025 của Forbes Tổng công ty Khí Việt Nam (PV GAS) đứng vị trí thứ 4 trong Danh sách 50 công ty niêm yết tốt nhất Việt Nam năm 2025 do Forbes Việt Nam vừa công bố.  PV GAS kiến nghị ưu tiên khí nội địa, thúc đẩy tiêu thụ LNG tái hóa Tại buổi làm việc với Bộ Công Thương mới đây, Tổng công ty Khí Việt Nam (PV GAS) kiến nghị thúc đẩy tiêu thụ LNG tái hóa và hoàn thiện cơ chế huy động khí năm 2025.  PV GAS đầu tư gần 9.000 tỷ mở rộng kho LNG Thị Vải lên 3 triệu tấn/năm Tổng công ty Khí Việt Nam (PV GAS) lên kế hoạch đấu thầu một số gói để mở rộng kho chứa LNG Thị Vải từ 1 triệu tấn lên 3 triệu tấn/năm. Tổng mức đầu tư dự án hơn 8.867 tỷ đồng."
ZNews,https://znews.vn/tu-17-phi-dang-ky-oto-xe-may-tai-nhieu-dia-phuong-co-thay-doi-lon-post1565779.html,Kinh doanh,Null,"Thứ năm, 3/7/2025 19:18 (GMT+7)","Từ 1/7, phí đăng ký ôtô, xe máy tại nhiều địa phương có thay đổi lớn","Phí cấp chứng nhận đăng ký, biến số ôtô tại các thành phố trực thuộc Trung ương (ngoài Hà Nội, TP.HCM) giảm mạnh từ 1/7. Ảnh:Hồng Quang. Bộ Tài chính đã ban hành hành Thông tư số 71/2025 sửa đổi, bổ sung một số điều của các Thông tư của Bộ trưởng Tài chính quy định về phí, lệ phí. Văn bản này có hiệu lực từ ngày 1/7. Đáng chú ý, tại nội dung sửa đổi bổ sung một số điều của Thông tư số 60/2023 quy định mức thu, chế độ thu, nộp, miễn, quản lý lệ phí đăng ký, cấp biển phương tiện giao thông cơ giới đường bộ, Bộ Tài chính đã chia lại các khu vực để áp dụng mức thu lệ phí cấp chứng nhận đăng ký biển số phương tiện giao thông theo địa giới hành chính. Theo đó, việc quản lý sẽ được rút gọn từ 3 khu vực xuống còn 2 khu vực. Trong đó, Khu vực I gồm Hà Nội, TP.HCM, bao gồm tất cả xã, phường trực thuộc thành phố (không phân biệt nội thành hay ngoại thành), trừ đặc khu trực thuộc cấp tỉnh. Khu vực II gồm đặc khu trực thuộc cấp tỉnh tại khu vực I và các tỉnh, thành phố trực thuộc Trung ương khác ngoài khu vực I. Trước đó tại Thông tư số 60/2023, Bộ Tài chính chia ra làm 3 khu vực. Trong đó, Khu vực I gồm Hà Nội, TP.HCM và bao gồm tất cả quận, huyện trực thuộc thành phố không phân biệt nội thành hay ngoại thành. Khu vực II gồm thành phố trực thuộc Trung ương (trừ Hà Nội, TP.HCM) và Khu vực III gồm các khu vực khác ngoài khu vực I và khu vực II. Với việc chia lại khu vực thì mức thu lệ phí cấp chứng nhận đăng ký, biển số phương tiện giao thông tại nhiều địa bàn đã giảm mạnh. Đa phần người dân tại các địa bàn thuộc Khu vực II cũ (các thành phố trực thuộc Trung ương ngoài Hà Nội, TP.HCM) đều được giảm mức lệ phí. Đơn cử đối với xe ôtô từ 9 chỗ ngồi trở xuống (bao gồm cả xe con pick-up) trước đây mức thu áp dụng cho các tỉnh, thành phố trực thuộc Trung ương (trừ Hà Nội, TP.HCM) là 1 triệu đồng/lần/xe thì hiện tại sẽ áp dụng mức thu là 200.000 đồng. Đối với xe môtô giá trị dưới 15 triệu đồng, mức thu giảm từ 200.000 đồng xuống 150.000 đồng/lần/xe; xe giá trị 15-40 triệu đồng giảm từ 400.000 đồng xuống 150.000 đồng; xe giá trị trên 40 triệu đồng giảm từ 800.000 đồng xuống còn 150.000 đồng. Mức thu lệ phí cấp chứng nhận đăng ký, biển số phương tiện giao thông theo Thông tư 71/2025 của Bộ Tài chính. Ngược lại, một số địa phương sẽ bị tăng mức thu. Đơn cử như người dân tại tỉnh Bình Dương và Bà Rịa - Vũng Tàu (cũ) hiện đã sáp nhập vào TP.HCM sẽ áp dụng mức thu theo khu vực I. Trước đó, các khu vực này áp dụng mức thu theo khu vực II và III. Với quy định mới, mức thu đối với các khu vực này đã tăng mạnh. Đối với xe ôtô (trừ ôtô chở người từ 9 chỗ ngồi trở xuống) là 500.000 đồng/lần/xe; ôtô chở người từ 9 chỗ ngồi trở xuống là 20 triệu đồng/lần/xe. Tương tự, mức thu với xe môtô tăng từ 150.000 đồng trước đó lên 1-4 triệu đồng/lần/xe. Ví dụ xe môtô trị giá đến 15 triệu đồng thì mức thu là 1 triệu đồng/lần/xe; xe trị giá trên 15 triệu đồng đến 40 triệu đồng mức thu là 2 triệu đồng và xe trị giá trên 40 triệu đồng thì mức thu là 4 triệu đồng/lần/xe. Tri Thức - Znewsgiới thiệu độc giảTủ sách kiến thức kinh tếvới đa dạng cuốn sách, câu chuyện trong lĩnh vực kinh doanh, kinh tế. Những cuốn sách, câu chuyện trong Tủ sách không đơn thuần là những tác phẩm của tri thức mà còn chứa đựng bí quyết, kinh nghiệm quý báu từ các tác giả, nhà quản lý có uy tín và kinh nghiệm lâu năm trong ngành. Đọc sách không chỉ giúp tiếp cận những kiến thức mới mà còn giúp mở rộng tầm nhìn và phát triển bản thân. Tủ sách kiến thức kinh tế mong muốn lan tỏa tri thức trong lĩnh vực kinh doanh, đồng thời phát triển văn hóa đọc cho người Việt.  Người dân, doanh nghiệp được giảm 46 loại phí, lệ phí từ 1/7 Bộ Tài chính thông báo giảm 50% với 46 khoản phí, lệ phí trong các lĩnh vực hàng không, công nghiệp, chứng khoán, xây dựng… nhằm hỗ trợ doanh nghiệp và người dân.  Tài xế xe điện TP.HCM sắp được hưởng nhiều ưu đãi thuế Tài xế công nghệ ở TP.HCM có thể được miễn thuế lệ phí trước bạ, miễn thuế giá trị gia tăng trên mỗi đơn hàng trong 2 năm đầu khi chuyển sang chạy xe điện.  Đề xuất miễn lệ phí trước bạ với ôtô điện thêm 2 năm Bộ Tài chính đề xuất kéo dài thời gian miễn 100% lệ phí trước bạ cho ôtô điện đến ngày 28/2/2027, thay vì hết hạn ưu đãi vào cuối tháng 2 năm nay."
ZNews,https://znews.vn/gia-toc-red-bull-giau-nhat-gioi-tai-phiet-thai-lan-so-huu-44-5-ty-usd-post1565746.html,Kinh doanh,Null,"Thứ năm, 3/7/2025 16:14 (GMT+7)","Gia tộc Red Bull giàu nhất giới tài phiệt Thái Lan, sở hữu 44,5 tỷ USD","Tài sản của ông Chalerm Yoovidhya và gia đình đã tăng 24% trong năm nay khi Red Bull tiếp tục có một năm thành công. Ảnh:Reuters. Trong bảng xếp hạng vừa đượcForbescông bố ngày 3/7, tỷ phú Chalerm Yoovidhya - đồng sở hữu thương hiệu Red Bull - giữ vững vị trí người giàu nhất Thái Lan năm thứ hai liên tiếp với khối tài sản lên tới44,5 tỷ USD, tăng mạnh8,5 tỷ USDso với năm ngoái. Mức tăng ấn tượng này chủ yếu đến từ doanh thu gần2,9 tỷ USDcủa Red Bull, với gần 13 tỷ lon được tiêu thụ trên toàn cầu trong năm qua, theoBangkok Post. Xếp thứ hai là anh em nhà Chearavanont thuộc Tập đoàn Charoen Pokphand (CP Group), với tổng tài sản tăng 23%, đạt35,7 tỷ USD. CP Group đang đẩy mạnh đầu tư vào hạ tầng kỹ thuật số, hợp tác cùng BlackRock rót1 tỷ USDxây dựng các trung tâm dữ liệu. Công ty fintech của họ - Ascend Money - cũng vừa nhận được giấy phép thành lập ngân hàng ảo. Vị trí thứ 3 thuộc về tỷ phú năng lượng và viễn thông Sarath Ratanavadi, người đã vươn lên từ hạng 5 vào năm trước. Hiện ông sở hữu khối tài sản tương đương11,2 tỷ USD, tăng 30% so với cùng kỳ. Trong khi đó, tỷ phú Charoen Sirivadhanabhakdi - ông trùm trong ngành bia rượu và bất động sản châu Á - đã tụt xuống vị trí thứ 4 với khối tài sản10,5 tỷ USD. Dù đã chuyển nhượng một phần cổ phần cho 5 người con vào tháng 5, tổng tài sản vẫn được tính dưới tên vị tỷ phú với tư cách là người sáng lập Tập đoàn TCC. Gia đình Chirathivat, chủ sở hữu hệ thống trung tâm thương mại Central, xếp thứ 5 trong giới tài phiệt Thái Lan với khối tài sản8,6 tỷ USD. Tuy nhiên, gia tộc này đã mất 13% giá trị tài sản so với năm ngoái, chủ yếu do sức mua yếu trong ngành bán lẻ. Cựu Thủ tướng Thái Lan Thaksin Shinawatra cũng xếp thứ 11 với tổng tài sản2,1 tỷ USD. Đáng chú ý, năm nay ngưỡng tài sản tối thiểu để góp mặt trong danh sách này đã giảm xuống còn420 triệu USD, so với mức550 triệu USDcủa năm 2024. Dù vậy, đã có 4 người vẫn bị loại khỏi bảng xếp hạng. Một cái tên gây bất ngờ vì vắng mặt là Somphote Ahunai, đại gia năng lượng tái tạo - người đã xuất hiện trong danh sách này liên tục từ năm 2013. Cổ phiếu của công ty Energy Absolute do ông sáng lập đã giảm gần 80% năm vừa qua, khiến tài sản cá nhân sụt mạnh. Ông Somphote cũng đã từ chức Giám đốc điều hành sau khi bị cơ quan quản lý chứng khoán cáo buộc cùng hai người khác có liên quan đến hành vi gian lận trong các hợp đồng đấu thầu từ năm 2013 đến 2015. Ông phủ nhận cáo buộc và tuyên bố sẵn sàng hợp tác với các cơ quan chức năng. Không phải ai cũng có cơ hội gặp gỡ, trò chuyện với những doanh nhân, tỷ phú, những nhà quản lý doanh nghiệp nổi tiếng. Vì vậy, sách trở thành phương thức hiệu quả để người đọc tiếp cận, tìm hiểu về câu chuyện kinh doanh, cuộc đời, kinh nghiệm của các doanh nhân, tỷ phú này. Tri Thức - Znewsgiới thiệu độc giảTủ sách doanh nhân- là những cuốn sách, câu chuyện về cuộc đời và kinh nghiệm của các tỷ phú, nhà quản lý nổi tiếng. Tủ sách không chỉ bao gồm các cuốn sách, câu chuyện từ tác giả độc lập mà còn bao gồm những cuốn sách do chính các tỷ phú viết về cuộc đời mình.  Tỷ phú Thái Lan mất hàng chục triệu USD sau khi chia cổ phần cho 5 con Tỷ phú giàu thứ 2 Thái Lan Charoen Sirivadhanabhakdi đã liên tục rút khỏi các vị trí lãnh đạo nhiều công ty trong thời gian gần đây.  Tỷ phú Thái Lan 'mất' rồi lấy lại 98% tài sản trong một đêm Trong thời gian ngắn, 98% khối tài sản khổng lồ của ông Sarath Ratanavadi - một trong những người giàu nhất Đông Nam Á - đã ""bốc hơi"", khiến giới đầu tư không khỏi sửng sốt.  6 gia tộc giàu nhất Đông Nam Á, riêng Thái Lan có 3 nhà Phần lớn gia tộc giàu nhất Đông Nam Á hoạt động trong lĩnh vực sản xuất, bán lẻ hoặc tài chính. Tuy nhiên, bất động sản và công nghệ cũng là ngành mà nhiều gia tộc tham gia."
ZNews,https://znews.vn/nha-san-xuat-bao-bi-thuy-dien-dau-tu-them-100-trieu-usd-vao-tphcm-post1565834.html,Kinh doanh,Null,"Thứ năm, 3/7/2025 22:36 (GMT+7)",Nhà sản xuất bao bì Thụy Điển đầu tư thêm 100 triệu USD vào TP.HCM,"Tetra Pak có mặt tại Việt Nam từ năm 1994 và chính thức xây dựng nhà máy tại tỉnh Bình Dương cũ vào năm 2019. Ảnh:T.P. Ngày 3/7, Tetra Pak - nhà cung cấp các giải pháp chế biến và đóng gói thực phẩm Thụy Điển - đã chính thức khánh thành giai đoạn 2 nhà máy sản xuất bao bì tiệt trùng Tetra Pak Bình Dương, phường Vĩnh Tân (tỉnh Bình Dương cũ), TP.HCM. Dự án có tổng vốn đầu tư 217 triệu euro (tương đương khoảng234 triệu USD), trong đó giai đoạn 2 có mức đầu tư 97 triệu euro (khoảng105 triệu USD). Bằng việc nâng gấp đôi công suất và cung ứng thêm 15 định dạng bao bì sáng tạo, Tetra Pak Bình Dương có thể đáp ứng tốt hơn nhu cầu từ các nhà sản xuất thực phẩm và đồ uống tại Việt Nam và các thị trường trọng điểm trong khu vực như Thái Lan, Malaysia, Indonesia, Singapore, Phillipines, Australia và New Zealand. Ông Bùi Minh Thạnh, Phó chủ tịch UBND TP.HCM cho biết việc Tetra Pak tiếp tục mở rộng đầu tư tại Việt Nam giúp gắn kết bền chặt giữa doanh nghiệp FDI với sự phát triển của đất nước, đặc biệt trong lĩnh vực thực phẩm và đổi mới công nghệ. ""Đây cũng là tín hiệu tích cực trong bối cảnh hai nước Việt Nam - Thụy Điển nâng cấp quan hệ đối tác chiến lược trong lĩnh vực khoa học công nghệ và đổi mới sáng tạo"", ông Thạnh khẳng định. Kể từ khi chính thức đi vào hoạt động vào năm 2019, nhà máy Bình Dương đã trở thành mắt xích chiến lược trong chuỗi cung ứng của Tetra Pak tại khu vực, với khoảng 50% sản lượng phục vụ thị trường nội địa. Nhà máy cũng đạt chứng nhận LEED (Leadership in Energy and Environmental Design) phiên bản 4 hạng Vàng về thiết kế thiên thiện với môi trường trên toàn bộ nhà máy và vận hành theo các chuẩn mực sản xuất toàn cầu. “Việc mở rộng nhà máy là sự kiện đáng tự hào cho tiêu chí Made in Vietnam và thể hiện cam kết lâu dài của chúng tôi đối với sự phát triển bền vững của đất nước"", bà Nguyễn Thanh Giang, Tổng giám đốc Tetra Pak Việt Nam cho biết. Tri Thức - Znewsgiới thiệu độc giảTủ sách kiến thức kinh tếvới đa dạng cuốn sách, câu chuyện trong lĩnh vực kinh doanh, kinh tế. Là nguồn tư liệu cho những người quan tâm và muốn nâng cao kiến thức trong lĩnh vực kinh tế. Những cuốn sách, câu chuyện trong Tủ sách không chỉ đơn thuần là những tác phẩm của tri thức mà còn chứa đựng bí quyết, kinh nghiệm quý báu từ các tác giả, nhà quản lý có uy tín và kinh nghiệm lâu năm trong ngành. Đọc sách không chỉ giúp người đọc tiếp cận những kiến thức mới mà còn giúp mở rộng tầm nhìn và phát triển bản thân. Tủ sách kiến thức kinh tế mong muốn lan tỏa tri thức trong lĩnh vực kinh doanh, đồng thời phát triển văn hóa đọc cho người Việt.  Đối tác của Nike, adidas mở thêm nhà máy ở Củ Chi Đây là nhà máy thứ 3 tại Việt Nam của Tập đoàn Avery Dennison, sau nhà máy ở Long Hậu (Long An) và Bắc Ninh.  Heineken được đề nghị mở lại nhà máy Quảng Nam sau 1 năm tạm dừng UBND tỉnh Quảng Nam muốn làm việc với Heineken Việt Nam liên quan đến việc đưa nhà máy bia tại Khu công nghiệp Điện Nam - Điện Ngọc hoạt động trở lại.  Thủ tướng đề nghị Airbus đầu tư nhà máy sản xuất linh kiện ở Việt Nam Trao đổi với lãnh đạo Tập đoàn Airbus, Thủ tướng Phạm Minh Chính đề nghị tập đoàn này mở rộng chuỗi cung ứng và sản xuất thiết bị tàu bay tại Việt Nam."
