Source,URL,Category,Keyword,Time,Title,Content
VN Express,https://vnexpress.net/indonesia-thang-8-0-trong-tran-ra-quan-u23-dong-nam-a-4914745.html,Bóng đá,"Indonesia,Brunei,Đội tuyển bóng đá U23 Indonesia,Giải U23 Đông Nam Á 2025,Đội tuyển bóng đá U23 Brunei","Thứ ba, 15/7/2025, 22:21 (GMT+7)",Indonesia thắng 8-0 trong trận ra quân U23 Đông Nam Á,"IndonesiaChủ nhà Indonesia thể hiện sức mạnh vượt trội để thắng Brunei 8-0 ở lượt ra quân để dẫn đầu bảng A giải U23 Đông Nam Á 2025, tối 15/7. * Ghi bàn: Raven 2’ 8’ 30’ 33’ 41’ 62’, Arhan 20’, Hannan 35’ Ở giải đấu trên sân nhà, Indonesia triệu tập đội hình có 14 cầu thủ chưa thi đấu trận nào cho đội U23. Đội thiếu những ngôi sao hàng đầu như Marselino Ferdinan, Rafael Struick và Ivar Jenner. Nhưng họ có hai cầu thủ mang dòng máu lai là hậu vệ Brandon Scheunemann (Đức), và Jens Raven (Hà Lan) - tiền đạo thuộc lứa vô địch U19 Đông Nam Á 2024. Trước đối thủ từ nền bóng đá đứng thứ 183 FIFA, Indonesia thể hiện cách biệt trình độ khi kiểm soát bóng 84%, tung ra 28 pha dứt điểm với 14 trúng đích. Số đường chuyền chủ nhà tạo ra là 631 với 91% chính xác, còn Brunei chỉ có 55 đường chuyền với độ chính xác 40%. Sân Gelora Bung Karno hôm nay thưa thớt khi chỉ có 2.743 khán giả đến theo dõi, trong khi sức chứa tối đa gần 77.000 chỗ ngồi. Tuy nhiên, họ mừng bàn ngay từ phút thứ hai trong pha tấn công thứ hai của đội nhà. Rayhan Hannan bứt tốc ở biên phải đến vòng cấm rồi căng ngang. Jens Raven có mặt đệm chân phải một chạm mở tỷ số. Sáu phút sau, bẫy việt vị của Brunei bị phá khi Achmad Syarif bứt tốc vào vòng cấm nhưng cú sút trúng người thủ môn Khairul Hisyam. Ở tuyến hai, Robi Darwis có mặt để chuyền tiếp cho Raven. Tiền đạo sinh năm 2005 bình tĩnh ngoặt bóng chân phải rồi sút chân trái vào góc thấp phải nhân đôi cách biệt. Hai bàn thắng sớm giúp Indonesia thoải mái chơi bóng, còn đối thủ liên tục mắc lỗi giúp Raven ghi thêm 4 bàn. Phút 30, Nazry Aiman lóng ngóng móc phá bóng nhưng bật ngược về vòng cấm. Raven chớp thời cơ đối mặt thủ môn rồi sút chân phải vào góc cao lập hat-trick. Ba phút sau, từ quả ném biên phải, anh tiếp tục đối mặt thủ môn rồi đá má ngoài chân phải ghi bàn. Bàn thứ năm của Raven được ghi trên chấm phạt đền ở phút 40 với cú đá căng vào góc thấp phải. Trước đó, Muhd Irfan phạm lỗi với Rahmat Reski trong vòng cấm. Bàn thứ sáu của tiền đạo lai Hà Lan đến ở phút 62, khi Muhammad Ferrari chuyền dài từ sân nhà ra sau hàng thủ Brunei. Raven bứt tốc qua hai hậu vệ rồi tâng bóng qua đầu thủ môn, ấn định tỷ số 8-0. Xen giữa các pha lập công của Jens Raven là hai cú sút xa từ khoảng cách 22 m của Arkhan Fikri ở phút 20, và Rayhan Hannan phút 35. Chiến thắng giúp Indonesia chiếm ngôi đầu bảng A từ Philippines -đội thắng Malaysia 2-0ở trận trước. Chủ nhà cũng tạo nên chiến thắng đậm nhất lịch sử giải đấu, ngang bằng trận Thái Lan hạ Campuchia ở vòng bảng kỳ giải 2005. Lượt trận hai bảng A sẽ diễn ra vào ngày 18/7. Indonesia chạm trán Philippines và Brunei gặp Malaysia, đều tại sân Gelora Bung Karno. Đội hình xuất phát Indonesia: Ardiansyah, Muhammad Ferrari, Dony Tri Pamungkas, Robi Darwis, Toni Firmansyah, Rayhan Hannan, Arkhan Fikri, Rahmat Reski, Brandon Scheunemann, Achmad Syarif, Jens Raven Brunei: Khairul Hisyam, Abdul Hafiy, Danisyh Syariee, Azrin Danial, Wafiq Danish, Muhd Ali Munawwar, Muhamad Al-Kholil, Mohd Syafiq Hilmi, Muhd Irfan, Haziq Naqiuddin, Nazry Aiman. Hiếu Lương"
VN Express,https://vnexpress.net/philippines-gay-soc-o-giai-u23-dong-nam-a-4914714.html,Bóng đá,"Indonesia,Giải U23 Đông Nam Á,U23 Malaysia,đội tuyển U23 Philippines","Thứ ba, 15/7/2025, 19:36 (GMT+7)",Philippines gây sốc ở giải U23 Đông Nam Á,"IndonesiaBị đánh giá thấp hơn, nhưng Philippines bất ngờ đánh bại Malaysia 2-0 ở trận ra quân bảng A, giải vô địch U23 Đông Nam Á, chiều 15/7. Người hùng của Philippines là tiền đạo Banatao với cú đúp bàn thắng. Cầu thủ mới 18 tuổi này mang hai dòng máu Mỹ - Philippines, hiện là sinh viên Đại học Old Dominion, tại Virginia, Mỹ. Malaysia chơi nhỉnh hơn, kiểm soát bóng 70%, tung ra 21 cú sút, với 7 trúng đích, nhưng không thể ghi bàn. Các chân sút của họ đều vô duyên hoặc không đủ sắc sảo để hạ thủ môn Philippines, Guimaraes. Ngay cả khi đối mặt thủ môn, tiền đạo Malaysia lại... vấp cỏ rồi sút ra ngoài. Bên cạnh đó, xà ngang và cột dọc hai lần từ chối bàn thắng của Malaysia. Ngược lại, Philippines chọn lối đá phòng ngự - phản công, và đạt kết quả mỹ mãn. Họ kiểm soát 30% thời lượng, chỉ tung 5 cú sút, trúng đích ba và có hai bàn thắng. Nếu xà ngang không từ chối, họ đã có bàn thứ ba. Hai pha ghi bàn của Philippines đến theo cùng kịch bản. Phút thứ 9, sau khi chịu sức ép của đối thủ đầu trận, họ có pha phản công đầu tiên. Tiền vệ Mariona thoát xuống từ cánh trái, dùng động tác giả loại bỏ hậu vệ Malaysia rồi căng ngang vào trong để Banatao đệm bóng vào lưới, mở tỷ số. Đến phút 40, vẫn bằng phản công từ cánh trái, lần này, tiền vệ Dalapo kéo bóng xuống rồi chuyền vào vòng cấm. Banatao thoải mái căn chỉnh trước khi đặt lòng vào góc xa tung lưới nâng tỷ số 2-0. Chiến thắng đến với Philippines là thành quả xứng đáng với lối chơi phòng ngự có chiều sâu và phản công sắc bén mà HLV McPherson xây dựng. Ngoài ra, Philippines cũng chuẩn bị tốt cho giải khi triệu tập một số cầu thủ gốc Philippines như thủ môn Guimaraes (Nhật Bản), trung vệ Noah Leddel (Hong Kong), tiền vệ Jax Pena (Mỹ), tiền vệ Gavin Muens (Mỹ), tiền vệ John Lucero (Thái Lan) và tiền đạo Banatao (Mỹ). Chính các cầu thủ này hợp cùng các cầu thủ trong nước giúp Philippines trở thành đối thủ ngáng đường Malaysia - chỉ có hai cầu thủ nhập tịch là hậu vệ Gabriel Palmero (gốc Tây Ban Nha) và tiền đạo Fergus Tierney (gốc Scotland). Giải U23 Đông Nam Á 2025 diễn ra từ ngày 15 đến 29-7, tại Indonesia với 10 đội tuyển, chia làm ba bảng. Các đội thi đấu vòng tròn một lượt tính điểm, chọn ba đội nhất bảng và một đội nhì bảng có thành tích tốt nhất vào bán kết. Bảng A gồm bốn đội Indonesia, Malaysia, Philippines và Brunei. Với kết quả bất ngờ này, cơ hội đi tiếp sẽ còn cạnh tranh khốc liệt giữa chủ nhà Indonesia, Philippines và Malaysia. Đức Đồng"
VN Express,https://vnexpress.net/con-trai-ronaldo-yamal-chua-gianh-duoc-gi-4914641.html,Bóng đá,"Tây Ban Nha,Cristiano Ronaldo,Cristiano Jr,Lamine Yamal,livestr","Thứ ba, 15/7/2025, 17:22 (GMT+7)",Con trai Ronaldo: 'Yamal chưa giành được gì',"Tây Ban NhaTheo Cristiano Jr, tiền đạo 18 tuổi Lamie Yamal cần cố gắng hơn nếu muốn đạt đến đẳng cấp như Cristiano Ronaldo. Hôm 14/7, trong lúc đi cùng xe hơi với Cristiano Jr, một người bạn đăng video livestream trên mạng xã hội. Khi một người bạn hỏi rằng Lamine Yamal hiện tại có hay hơn Cristiano Ronaldo không, Cristiano Jr đáp: ""Hiện tại ư? Đúng, nhưng Yamal chưa giành được gì. Anh ấy rất giỏi, nhưng vẫn chưa giành được gì"". Yamal thi đấu chuyên nghiệp từ tháng 4/2023. Đến nay, tiền đạo 18 tuổi đã vô địch Euro 2024 với tuyển Tây Ban Nha, giành hai La Liga, Cup Nhà vua và Siêu Cup Tây Ban Nha cùng Barca. Về mặt cá nhân, Yamal giành các danh hiệu Cậu Bé Vàng, Kopa Trophy, Cầu thủ trẻ hay nhất Euro và Bàn thắng đẹp nhất Euro. Trong cuộc đua Quả Bóng Vàng 2024, cầu thủ vừa hết tuổi vị thành niên về thứ 8. Trong khi đó, Ronaldo thi đấu chuyên nghiệp trước khi Yamal ra đời gần 5 năm. Qua hai thập kỷ, anh trở thành một trong những cầu thủ hay nhất lịch sử bóng đá, làm nên một bảng thành tích đồ sộ gồm: Euro 2016, hai Nations League, năm Champions League, ba Ngoại hạng Anh, hai La Liga và hai Serie A. Ronaldocũng là một trong những cầu thủ giàu thành tích cá nhân nhất. Nổi bật trong đó là năm Quả Bóng Vàng, bốn Giày vàng châu Âu, Bàn thắng đẹp nhất năm 2009 và kỷ lục ghi 938 bàn. Trong cuộc đối đầu trực tiếp hồi tháng 6 - chung kết Nations League, Ronaldo cùng Bồ Đào Nha vượt qua Tây Ban Nha củaYamal, với chiến thắng luân lưu 5-3. Bản thân tiền đạo 40 tuổi góp một bàn vào kết quả hòa 2-2 trong 120 phút. Sau trận đó, Ronaldo động viên Yamal, cho rằng tiền đạo này thực sự là hiện tượng trong bóng đá và sẽ giành nhiều danh hiệu UEFA Nations League trong tương lai. Cristiano Jr chào đời năm 2010. Theo hành trình sự nghiệp của cha, cậu bé từng tham gia học viện của Juventus, Man Utd và nay là Al Nassr. Từ tháng 5, Cristiano Jr chơi bốn trận cho tuyển U15 Bồ Đào Nha và ghi hai bàn. Thanh Quý(theoMarca, X)"
VN Express,https://vnexpress.net/hlv-kim-sang-sik-chiu-ap-luc-lap-hat-trick-vo-dich-u23-dong-nam-a-4914626.html,Bóng đá,"Indonesia,U23 Việt Nam,HLV Kim Sang-sik,Giải U23 Đông Nam Á 2025","Thứ ba, 15/7/2025, 16:15 (GMT+7)",HLV Kim Sang-sik chịu áp lực lập hat-trick vô địch U23 Đông Nam Á,"IndonesiaHLV Kim Sang-sik thừa nhận áp lực trước mục tiêu bảo vệ chức vô địch U23 Đông Nam Á trong lần đầu dẫn dắt đội U23 Việt Nam dự một giải chính thức. U23 Đông Nam Á đã tổ chức bốn lần, trong đó Việt Nam vô địch hai kỳ gần nhất (năm 2022 và 2023), đồng thời là đội tuyển giàu thành tích nhất giải (Thái Lan và Indonesia cùng một danh hiệu). Đến kỳ giải này tại Indonesia, HLV Kim Sang-sik được giao nhiệm vụ giúp Việt Nam lập hat-trick vô địch. ""Tôi có chút áp lực khi Việt Nam đã hai lần liền vô địch U23 Đông Nam Á"", HLV Kim Sang-sik nói ở họp báo trước giải tại Indonesia, chiều 15/7. ""Tôi và các cầu thủ sẽ nỗ lực để giành thành tích tốt nhất"". Mục tiêu vượt qua vòng bảng được xem là nằm trong tầm tay thầy trò HLV Kim Sang-sik, khi lần lượt gặp Lào ngày 19/7 và Campuchia ngày 22/7 tại bảng B. Ở bảng A, chủ nhà Indonesia đấu Malaysia, Philippines và Brunei. Còn bảng C có Thái Lan, Timor Leste và Myanmar. Các đội thi đấu vòng tròn một lượt, để chọn ra ba đội nhất và một đội nhì có thành tích tốt nhất vào bán kết. Tuy nhiên, HLV Kim không hề chủ quan. Ông muốn học trò tôn trọng mọi đối thủ, vào sân với tinh thần cao nhất và hướng đến chiến thắng từng trận. Hai đối thủ cạnh tranh vô địch được HLV sinh năm 1976 chọn là Thái Lan và chủ nhà Indonesia. ""Thái Lan có kỹ thuật cá nhân tốt, tập thể mạnh"", HLV Kim cho hay. ""Indonesia thì có tốc độ và thể lực. Họ đều là những đối thủ đáng gờm trên đường đến ngôi vương"". Với chất lượng ổn định, Việt Nam luôn là ứng viên vô địch ở các giải trẻ Đông Nam Á nhiều năm qua. Nếu đoạt Cup, nhà cầm quân Hàn Quốc có thể trở thành HLV đầu tiên vô địch Đông Nam Á ở cả cấp ĐTQG lẫn U23 trong một năm. Bên cạnh đó, đây còn là cơ hội để Việt Nam chứng minh chất lượng đào tạo trẻ so với các nước đang chọn nhập tịch là xu hướng ở ĐTQG. 18 trong 23 cầu thủ Việt Nam được chọn dự giải đang thi đấu ở V-League. Nhiều người trong số đó đã thường xuyên lên ĐTQG, như thủ môn Trần Trung Kiên, tiền vệ Khuất Văn Khang, Nguyễn Văn Trường hay tiền đạo Nguyễn Đình Bắc. Đội mang tên U23 nhưng thực chất là U22 với những cầu thủ sinh từ năm 2003 về sau, nhằm chuẩn bị cho SEA Games 33 và giải U23 châu Á 2026. HLV Kim đánh giá các cầu thủ trẻ nên nhiệt huyết và lắng nghe các HLV nhiều hơn. ""Họ có khả năng thấu hiểu nhanh để xây dựng lối chơi tập thể, có đam mê và động lực. Tôi rất muốn thấy họ tiến bộ từng ngày"", ông cho biết. Để chuẩn bị cho giải đấu, U23 Việt Nam đã tập luyện hai tuần ở Bà Rịa Vũng Tàu (nay là TP HCM). Đến ngày 14/7, đội sang Indonesia và sẽ có bốn ngày thích ứng trước khi ra quân gặp Lào. Hiếu Lương"
VN Express,https://vnexpress.net/hlv-jorge-jesus-toi-dan-al-nassr-vi-ronaldo-4914501.html,Bóng đá,"Cristiano Ronaldo,Jorge Jesus,Al Nassr","Thứ ba, 15/7/2025, 14:28 (GMT+7)",HLV Jorge Jesus: 'Tôi dẫn Al Nassr vì Ronaldo',"HLV người Bồ Đào Nha Jorge Jesus cho biết ông đồng ý dẫn dắt Al Nassr chỉ vì nhận được lời mời từ thủ quân Cristiano Ronaldo. Al Nassr thông báo bổ nhiệm Jesus tối 14/7, theo hợp đồng một năm. Cùng ngày, HLV 70 tuổi rời Lisbon để tới Riyadh. Ông được truyền thông Bồ Đào Nha săn đón ở sân bay Lisbon. Trước câu hỏi vì sao ông chọn dẫn dắt Al Nassr dù vừa làm việc ở CLB kình địch Al Hilal, HLV Jorge Jesus nói: ""Nếu không có lời mời của Ronaldo, tôi chắc chắn không dẫn Al Nassr. Đây là động lực lớn với tôi"". Theo HLV này, Al Nassr nên giành nhiều danh hiệu hơn, một phần vì Ronaldo. ""Ronaldo đã giành mọi danh hiệu có thể cùng các CLB cậu ấy thi đấu"", Jesus nói thêm. ""Nhưng cậu ấy gần như chưa đoạt danh hiệu nào với Al Nassr, nên tôi muốn giúp Ronaldo"". Theo truyền thông Anh, Ronaldo đã là một cổ đông của Al Nassr, nắm giữ 15% cổ phần trị giá khoảng 45 triệu USD, sau khi đồng ý gia hạn hợp đồng hai năm. Sau mùa giải trắng tay 2024-2025, Al Nassr sa thải toàn bộ ban điều hành gồm CEO Majed Al-Jamaan, Giám đốc bóng đá Fernando Hierro, lẫn ban huấn luyện của HLV Stefano Pioli. Jorge Jesus sẽ là HLV thứ 20 dẫn dắt Ronaldo trong sự nghiệp, tính cả tạm quyền. Gắn bó lâu nhất với Ronaldo là Alex Ferguson ở Man Utd thời 2003-2009, với 292 trận đấu. Anh ghi 118 bàn và kiến tạo 63 lần thời này. Khi được hỏi liệu làm việc cùng Ronaldo sẽ ra sao, HLV Jesus nói: ""Chuyện sẽ rất đơn giản. Cậu ấy cũng nói tiếng Bồ Đào Nha như tôi, nên mọi thứ sẽ ổn thôi"". Jesus đã dẫn dắt các đội giành 24 danh hiệu, từ Braga, Benfica, Sporting đến Al Hilal, Flamengo hay Fenerbahce. Ông từng giúp Al Hilal lập kỷ lục Guinness 34 trận bất bại liên tiếp trên mọi đấu trường, rồi rảnh việc từ khi chia tay CLB này tháng 5/2025. Hoàng An(theoKoora)"
VN Express,https://vnexpress.net/viet-nam-vo-dich-giai-bong-da-cong-an-canh-sat-dong-nam-a-2025-4914732.html,Bóng đá,"Hà Nội,CAND Việt Nam II,Giải bóng đá Công an Cảnh sát Đông Nam Á 2025","Thứ ba, 15/7/2025, 21:24 (GMT+7)","Việt Nam vô địch giải bóng đá Công an, Cảnh sát Đông Nam Á 2025","Hà NộiCAND Việt Nam II hạ Campuchia 4-0 trong trận chung kết tối 15/7, vô địch giải bóng đá Công an, Cảnh sát Đông Nam Á Mở rộng 2025. CAND Việt Nam II toàn thắng trên đường vào chung kết. Ở vòng bảng, họ thắng Singapore 3-0, Australia 10-3 và Timor Leste 3-0, để dẫn đầu bảng B. Đến bán kết, đội hạ Thái Lan 2-1. Trong khi đó, Campuchia cũng dẫn đầu bảng A với thành tích toàn thắng trước CAND Việt Nam I, Thái Lan và Lào. Sau đó, đội hòa Timor Leste 2-2 trong hai hiệp chính và thắng 11-10 ở loạt luân lưu bán kết. Vào chung kết, CAND Việt Nam II dùng 9 cầu thủ chuyên nghiệp thuộc đội hạng Nhất PVF-CAND, gồm thủ môn Trương Thái Hiếu, hậu vệ Đào Văn Chưởng, Phùng Viết Trường, Trần Ngọc Sơn, Nguyễn Văn Dũng, tiền vệ Ngô Đức Phú, Nguyễn Huy Hùng, Nguyễn Như Tuấn, tiền đạo Trần Đức Nam. Hai vị trí còn lại là các cựu tuyển thủ Việt Nam - Mai Tiến Thành và Hoàng Đình Tùng. Băng ghế dự bị còn có Phí Minh Long, Nguyễn Ngọc Duy, Tẩy Văn Toàn, Trần Văn Hòa Đội Campuchia cũng dùng nhiều cầu thủ thuộc CLB Visakha đang thi đấu tại giải VĐQG. Ngoài ra, đội còn có tiền đạo người Nigeria Ekejiuba Valentine. Diễn biến trên sân Hàng Đẫy nghiêng hẳn về chủ nhà. Ngay phút thứ 5, Nguyễn Như Tuấn đã mở tỷ số với pha đánh đầu cận thành. Đến phút 32, cầu thủ Campuchia chuyền lỗi ở giữa sân. Trần Đức Nam kiểm soát rồi thấy thủ môn đối phương dâng cao. Anh sút từ vòng tròn giữa sân nhân đôi cách biệt. Sang hiệp hai, Việt Nam vẫn kiểm soát hoàn toàn thế trận. Phút 69, đội phản công nhanh với Đức Nam dẫn bóng rồi chuyền sang trái. Vũ Mạnh Duy khống chế một nhịp rồi bứt tốc vào vòng cấm, trước khi sút chân trái chéo góc ghi bàn. Đến phút 80, Ngô Đức Phú sút ở góc hẹp phải ấn định chiến thắng 4-0. Chức vô địch giúp CAND Việt Nam II nhận 30.000 USD, tương đương 750 triệu đồng, tiền thưởng. Á quân Campuchia nhận 15.000 USD. Thái Lan và Timor Leste đứng thứ ba, mỗi đội nhận 5.000 USD. Lào nhận giải phong cách. Tiền đạo CAND Việt Nam II Trần Đức Nam ẵm cú đúp danh hiệu cá nhân Cầu thủ hay nhất và Vua phá lưới (8 bàn). Thủ môn hay nhất thuộc về Nattawoot Saengdara của Thái Lan. Giải năm nay do Bộ Công an chủ trì, với sự phối hợp của Cục Công tác chính trị (X03), Cục Thể dục Thể thao, LĐBĐ Việt Nam (VFF), Tập đoàn T&T và Ngân hàng SHB. Giải nằm trong hoạt động kỷ niệm 80 năm Ngày truyền thống CAND (19/8/1945 – 19/8/2025) và 20 năm Ngày hội toàn dân bảo vệ an ninh Tổ quốc (19/8/2005 – 19/8/2025). Hiếu Lương"
VN Express,https://vnexpress.net/modric-ra-mat-ac-milan-4914325.html,Bóng đá,"Real Madrid,AC Milan,Luka Modric","Thứ ba, 15/7/2025, 09:28 (GMT+7)",Modric ra mắt AC Milan,"ItalyTiền vệ người Croatia, Luka Modric ký hợp đồng một năm với AC Milan, khép lại 13 mùa giải gắn bó với Real Madrid. Modric đồng ý các điều khoản cá nhân từ tháng 6, nhưng chờ đến khikết thúc hành trình tại FIFA Club World Cupvới Real Madrid mới chính thức chuyển nhượng. Hôm qua,Modricđã bay đến Milan để kiểm tra y tế rồi ký hợp đồng một năm, với tùy chọn gia hạn đến hè 2027. Tiền vệ người Croatia hưởng lương mùa 4 triệu USD và mặc áo số 14. Modric đã nhận được những lời đề nghị hậu hĩnh từ Arab Saudi và MLS, nhưng muốn tiếp tục chơi bóng đỉnh cao ở châu Âu, để nuôi hy vọng dự World Cup 2026. Trước đây, anh đã dự bốn kỳ World Cup 2006, 2014, 2018 và 2022. Trong đó, đỉnh cao là 2018, khi Modric giành giải Quả Bóng Vàng World Cup, còn Croatia về nhì (thua Pháp ở chung kết). Modric trưởng thành từ lò đào tạo Dinamo Zagreb, trước khi gia nhập Tottenham năm 2008. Sau đó bốn mùa, anh chuyển sangReal. Qua 13 năm, tiền vệ cao 1,72 m trở thành cầu thủ giàu thành tích nhất lịch sử CLB, với 28 danh hiệu, trong đó có 6 Champions League và 5 La Liga. Anh đã 6 lần đứng trong đội hình tiêu biểu FIFPro, giành giải Quả Bóng Vàng 2018. Modric là tân binh thứ hai của Milan hè này, sau tiền vệ Samuele Ricci với mức phí 25 triệu USD từ Torino. Đại diện Italy cũng đang nhắm hậu vệ Oleksandr Zinchenko (Arsenal), Radu Dragusin (Tottenham), tiền vệ Adrien Rabiot (Marseille), Hamed Junior Traore (Bournemouth), tiền đạo Dusan Vlahovic (Juventus), Mateo Retegui (Atalanta). Chiều ngược lại, Milan đã bán hai trụ cột Tijjani Reijnders (sang Man City với80 triệu USD) và Theo Hernandez (Al Hilal, 30 triệu USD). AC Milan sẽ đá trận giao hữu đầu tiên với Arsenal tại Sân vận động quốc gia Singapore lúc 18h30 ngày 23/7, giờ Hà Nội. Hồng Duytổng hợp"
VN Express,https://vnexpress.net/real-mua-hau-ve-thu-ba-trong-he-2025-4914298.html,Bóng đá,"Real Madrid,Benfica,Alvaro Carreras","Thứ ba, 15/7/2025, 06:32 (GMT+7)",Real mua hậu vệ thứ ba trong hè 2025,"Real Madrid trả 58,34 triệu USD tuyển mộ hậu vệ trái Alvaro Carreras từ Benfica, ngày 14/7. Carreras sẽ ký hợp đồng 6 năm với Real và ra mắt tại đại bản doanh Valdebebas, ngoại ô Madrid lúc 13h ngày 15/7. Đây là bản hợp đồng thứ ba của Real trong hè 2025, tất cả đều phục vụ mục tiêu gia cố hàng thủ. Trước đó, họ đã chi 60 triệu USD mua trung vệ Dean Huijsen từ Bournemouth, và11 triệu USDđể lấy hậu vệ phải Trent Alexander-Arnold từ Liverpool sớm một tháng dù cầu thủ này sắp thuộc diện tự do. Carreras, 22 tuổi người Tây Ban Nha, được kỳ vọng mang đến sức sống mới cho vị trí hậu vệ trái. Đây là một điểm yếu củaRealmùa trước do Ferland Mendy thường xuyên chấn thương, còn Fran Garcia chưa thật sự ổn định. Carreras từng chơi cho các đội trẻ Real giai đoạn 2017-2020. Do không có cơ hội lên đội một, anh sang Man Utd theo dạng tự do. Tại đây, anh chủ yếu thi đấu cho đội dự bị rồi được đem cho mượn tại hai đội bóng nhỏ là Preston North End, Granada để tích lũy kinh nghiệm. Từ tháng 1/2024, Carreras gia nhập Benfica cũng theo diện cho mượn rồi được mua đứt hồi tháng 6 cùng năm. Trong một năm rưỡi khoác áo Benfica, Carreras tiến bộ vượt bậc, nhờ nền tảng thể lực sung mãn, tư duy chiến thuật sắc sảo, khả năng chơi rộng, lên công về thủ toàn diện. TheoMarca, mẫu hậu vệ biên như Carreras phù hợp với triết lý bóng đá củaXabi Alonso- tân HLV Real ưa chuộng sơ đồ 5 hậu vệ và sử dụng hai cầu thủ chạy cánh dâng cao. Ở FIFA Club World Cup 2025, Fran Garcia chơi tốt bên cánh trái, nhưng Carreras được kỳ vọng sẽ tạo áp lực cạnh tranh và tăng chất lượng chiều sâu cho vị trí này. Theo một điều khoản cài vào hợp đồng với Benfica năm 2024, Man Utd có quyền mua lại Carreras với giá 19 triệu USD, nhưng không kích hoạt. Trước khi lên đường sang Madrid, Carreras gửi lời tri ân Benfica qua mạng xã hội. Hậu vệ 22 tuổi xem đội chủ sân Da Luz như mái nhà trong một năm rưỡi vừa qua, giúp anh trưởng thành cả về chuyên môn lẫn con người. ""Quyết định rời đi không dễ dàng, nhưng tôi muốn tiếp tục theo đuổi ước mơ và biết rằng mình đã nỗ lực cống hiến hết mình cho màu áo thiêng liêng này. Cảm ơn vì tất cả"", Carreras viết thêm. Nhật Tảo"
