Source,URL,Category,Keyword,Time,Title,Content
ZNews,https://znews.vn/hai-bo-bat-tay-chon-cong-nghe-lam-duong-sat-cao-toc-bac-nam-post1567080.html,Kinh doanh,Null,"Thứ ba, 8/7/2025 18:21 (GMT+7)",Hai Bộ 'bắt tay' chọn công nghệ làm đường sắt cao tốc Bắc - Nam,"Phó thủ tướng Trần Hồng Hà yêu cầu 2 Bộ phối hợp chặt chẽ xây dựng hệ sinh thái tiêu chuẩn, quy chuẩn đầy đủ cho đường sắt tốc độ cao. Ảnh:VGP/Minh Khôi. TheoBáo Chính phủ, chiều 8/7, Phó thủ tướng Trần Hồng Hà đã chủ trì cuộc họp nghe báo cáo về việc xây dựng hệ thống tiêu chuẩn, quy chuẩn kỹ thuật cho đường sắt tốc độ cao. Tại cuộc họp, Bộ trưởng Xây dựng Trần Hồng Minh cho biết hiện có 517 bộ tiêu chuẩn, quy chuẩn kỹ thuật phục vụ dự án đường sắt tốc độ cao trục Bắc - Nam, bao gồm 218 tiêu chuẩn, quy chuẩn Việt Nam và 299 tiêu chuẩn, quy chuẩn nước ngoài. Các tiêu chuẩn, quy chuẩn này được phân thành các nhóm chính: Xây dựng công trình; hệ thống công nghệ kỹ thuật đường sắt; trang thiết bị nhà ga và dịch vụ vận hành; hạ tầng kỹ thuật và môi trường; an toàn và hệ thống cảnh báo; cùng một số lĩnh vực khác. Bộ trưởng Trần Hồng Minh khẳng định việc áp dụng tiêu chuẩn nước ngoài trong các dự án đầu tư công là cần thiết và có cơ sở pháp lý rõ ràng, nhằm bảo đảm tính tiên tiến, hiệu quả và an toàn, đặc biệt với công trình quy mô lớn như đường sắt tốc độ cao. Tuy nhiên, Việt Nam chưa lựa chọn nhà đầu tư và công nghệ cụ thể cho tuyến đường sắt tốc độ cao nên việc xây dựng hệ thống tiêu chuẩn quốc gia cho toàn tuyến sẽ được triển khai trong giai đoạn 2025-2026. Trong thời gian này, Bộ Xây dựng sẽ phối hợp cùng Bộ Khoa học và Công nghệ tiếp tục rà soát, nghiên cứu và xây dựng các tiêu chuẩn, quy chuẩn tương thích với yêu cầu thực tiễn. Đáng chú ý, Bộ Xây dựng đã thu thập 299 tiêu chuẩn, quy chuẩn nước ngoài từ các quốc gia có kinh nghiệm phát triển đường sắt hiện đại như Nhật Bản, Hàn Quốc, Trung Quốc và một số nước châu Âu. Một số hạng mục như bê tông cốt thép hay hệ thống tín hiệu thông tin có thể áp dụng tiêu chuẩn trong nước. Tuy nhiên, các hạng mục yêu cầu công nghệ đặc thù như ray dài 100 m, đầu máy, toa xe... chưa thể nội địa hóa và cần áp dụng tiêu chuẩn nước ngoài. Bộ trưởng Trần Hồng Minh nhấn mạnh: ""Với hệ thống tiêu chuẩn, quy chuẩn hiện có, các đơn vị thiết kế hoàn toàn có thể triển khai tuyến đường sắt tốc độ cao Bắc - Nam một cách đồng bộ và phù hợp với yêu cầu kỹ thuật, không gặp vướng mắc lớn trong quá trình thực hiện"". Bộ trưởng Khoa học và Công nghệ Nguyễn Mạnh Hùng cũng cho biết Bộ này đã ban hành 35 tiêu chuẩn chung về đường sắt tốc độ cao (không phụ thuộc vào nhà sản xuất hay quốc gia cung cấp công nghệ) và đang đề xuất bổ sung 42 tiêu chuẩn chung khác. Lãnh đạo Bộ cam kết phối hợp chặt chẽ với Bộ Xây dựng để hoàn thiện hệ thống tiêu chuẩn, quy chuẩn dành cho đường sắt tốc độ cao sau khi xác định công nghệ và nước sản xuất. Tại cuộc họp, nhiều ý kiến cho rằng việc xây dựng tiêu chuẩn, quy chuẩn cho đường sắt tốc độ cao là công việc phức tạp, mang tính đặc thù, chưa có tiền lệ. Các bộ tiêu chuẩn, quy chuẩn cần được chia thành hai nhóm: Tiêu chuẩn chung không phụ thuộc vào nhà sản xuất và tiêu chuẩn riêng gắn với công nghệ cụ thể. Do đó, có đề xuất Bộ Xây dựng và Bộ Khoa học và Công nghệ cần phối hợp trực tiếp, rà soát toàn bộ hệ thống tiêu chuẩn, quy chuẩn, loại bỏ nội dung trùng lặp, bổ sung phần còn thiếu và cập nhật kinh nghiệm từ các quốc gia có đường sắt tốc độ cao phát triển. Đồng thời, 2 Bộ này cần xác định rõ danh mục tiêu chuẩn ""lõi"" gắn với công nghệ lựa chọn để làm cơ sở đánh giá mức độ hoàn thiện hệ thống tiêu chuẩn, quy chuẩn trong nước. Phó thủ tướng Trần Hồng Hà đánh giá cao nỗ lực của 2 Bộ trong việc xây dựng hệ thống tiêu chuẩn, quy chuẩn kỹ thuật cho đường sắt tốc độ cao. Phó thủ tướng nhấn mạnh việc phân loại rõ ràng giữa tiêu chuẩn chung và tiêu chuẩn riêng là cần thiết. Do đó, yêu cầu 2 Bộ phối hợp để thống nhất khái niệm, rà soát toàn bộ các tiêu chuẩn, quy chuẩn hiện có, trước hết là 218 tiêu chuẩn, quy chuẩn hiện có của Việt Nam và 35 tiêu chuẩn chung đã ban hành. Cùng với đó, Phó thủ tướng đề nghị bổ sung nhóm tiêu chuẩn, quy chuẩn liên quan đến đầu máy, động cơ, toa xe… vận hành trên hệ thống đường sắt tốc độ cao. Phó thủ tướng cũng lưu ý việc sử dụng tiêu chuẩn, quy chuẩn nước ngoài để hài hòa hóa và ban hành thành tiêu chuẩn Việt Nam (TCVN) cần tuân thủ đúng quy định về chuyển giao công nghệ, đảm bảo quyền sở hữu trí tuệ. Qua đó, 2 Bộ được yêu cầu phối hợp chặt chẽ, cùng các chuyên gia liên quan, xây dựng hệ sinh thái tiêu chuẩn, quy chuẩn đầy đủ cho đường sắt tốc độ cao, từ khảo sát, thiết kế, thi công đến vận hành... ""Các tiêu chuẩn, quy chuẩn kỹ thuật là yếu tố then chốt để xác định công nghệ, khả năng chuyển giao khi lựa chọn nhà đầu tư đường sắt tốc độ cao"", Phó thủ tướng Trần Hồng Hà khẳng định. Tri Thức - Znewsgiới thiệu độc giảTủ sách kiến thức kinh tếvới đa dạng cuốn sách, câu chuyện trong lĩnh vực kinh doanh, kinh tế. Là nguồn tư liệu cho những người quan tâm và muốn nâng cao kiến thức trong lĩnh vực kinh tế. Những cuốn sách, câu chuyện trong Tủ sách không chỉ đơn thuần là những tác phẩm của tri thức mà còn chứa đựng bí quyết, kinh nghiệm quý báu từ các tác giả, nhà quản lý có uy tín và kinh nghiệm lâu năm trong ngành. Đọc sách không chỉ giúp người đọc tiếp cận những kiến thức mới mà còn giúp mở rộng tầm nhìn và phát triển bản thân. Tủ sách kiến thức kinh tế mong muốn lan tỏa tri thức trong lĩnh vực kinh doanh, đồng thời phát triển văn hóa đọc cho người Việt.  Thủ tướng đề nghị AIIB hỗ trợ Việt Nam huy động vốn làm đường sắt AIIB cam kết đồng hành, hỗ trợ Việt Nam huy động nguồn lực phát triển cơ sở hạ tầng trọng điểm, bảo đảm năng lượng cho vận hành các tuyến đường sắt tốc độ cao.  Bảo đảm khởi công đường sắt cao tốc Bắc - Nam vào tháng 12/2026 Văn phòng Chính phủ ban hành Thông báo số 335/TB-VPCP kết luận của Phó thủ tướng Trần Hồng Hà tại cuộc họp về dự án bồi thường, hỗ trợ, tái định cưtuyến đường sắt tốc độ cao trên trục Bắc - Nam.  Khuyến khích doanh nghiệp tư nhân tham gia đầu tư đường sắt Ngày 27/6, với hơn 89% đại biểu Quốc hội tán thành, Luật Đường sắt (sửa đổi) đã được thông qua với nhiều quy định mới liên quan đến đầu tư đường sắt bằng vốn ngoài Nhà nước."
ZNews,https://znews.vn/ha-noi-giao-them-hon-69000-m2-dat-de-phat-trien-khu-do-thi-tay-ho-tay-post1567098.html,Kinh doanh,Null,"Thứ ba, 8/7/2025 19:39 (GMT+7)",Hà Nội giao thêm hơn 69.000 m2 đất để phát triển khu đô thị Tây Hồ Tây,"Tây Hồ Tây hiện vẫn là khu đô thị có giá đất cao nhất Hà Nội. Ảnh:Thành Đông. UBND TPHà Nộiđã có quyết định về việc giao 69.361,2 m2 đất tại phường Xuân Đỉnh cho Công ty TNHH Phát triển THT để thực hiện Dự án khu trung tâm khu đô thị Tây Hồ Tây (đợt 7 - giai đoạn 2). Quyết định nêu rõ phần đất giao tại phường Xuân Đỉnh đã hoàn thành công tác giải phóng mặt bằng theo xác nhận của UBND quận Tây Hồ trước đây cho Công ty TNHH Phát triển THT. Vị trí, ranh giới, diện tích khu đất được xác định tại bản đồ quy hoạch tổng mặt bằng sử dụng đất QH-04B (gồm 15 tờ) tỷ lệ 1/500 do Trung tâm nghiên cứu kiến trúc - đô thị lập tháng 12/2013, được Sở Quy hoạch Kiến trúc xác nhận ngày 31/12/2013. Trong tổng số hơn 69.361 m2 đất có 14.657 m2 đất tại ô đất ký hiệu K2HH1 để xây dựng khu hỗn hợp dịch vụ công cộng, thương mại kết hợp nhà ở cao cấp; 27.769 m2 đất tại ô đất ký hiệu K2CT1 để xây dựng khu nhà ở cao tầng. Ngoài ra, 4.521 m2 đất tại ô đất ký hiệu C2TH1 sẽ được dùng để xây dựng trường tiểu học; 3.475 m2 đất tại ô đất ký hiệu C2NT1 để xây dựng trường mẫu giáo. Còn lại 600 m2 tại ô đất ký hiệu K2HT1 là đất dự trữ hạ tầng kỹ thuật; 5.775 m2 đất tại ô đất ký hiệu K2CX1 là đất cây xanh, đường dạo đơn vị ở; hơn 12.564 m2 đất để xây dựng đường đô thị, khu vực theo quy hoạch. Sau khi được giao đất, UBND TP Hà Nội yêu cầu Công ty THT liên hệ với Sở Nông nghiệp và Môi trường để xác định giá đất tính thu tiền sử dụng đất, tiền thuê đất; nhận bàn giao đất trên bản đồ và ngoài thực địa. Công ty liên hệ với UBND phường Xuân Đỉnh để lập, thẩm định phương án chi tiết bồi thường hỗ trợ và tái định cư, giải phóng mặt bằng đối với diện tích 74.554,9 m2 đất còn lại của dự án giai đoạn 2. Sau khi xây dựng xong công trình, công ty có trách nhiệm duy trì, bàn giao cho chính quyền địa phương quản lý. Dự án khu trung tâm khu đô thị Tây Hồ Tây có tên thương mại là Starlake, do Công ty TNHH Phát triển THT (thuộc Tập đoàn Daewoo E&C) làm chủ đầu tư, với quy mô vốn hơn1,3 tỷ USD. Trong đó vốn góp thực hiện dự án là4.566 tỷ đồng, còn lại là vốn huy động. Dự án hiện đã đưa vào vận hành các hạng mục biệt thự, nhà liền kề và chung cư. Hiện nay, các tòa nhà thương mại dịch vụ, khách sạn, văn phòng và chung cư cao cấp đang tiếp tục được triển khai xây dựng. Trong tương lai, khu vực này dự kiến trở thành nơi đặt trụ sở của nhiều bộ, ngành, đồng thời kết nối thuận tiện với các tuyến đường sắt đô thị số 2 và số 4 của Thủ đô. Theo bảng giá đất điều chỉnh cuối năm ngoái, Tây Hồ Tây là khu đô thị có giá đất cao nhất Hà Nội, với hơn 113 triệu đồng/m2. Mức này đã tăng 225% so với bảng giá đất ban hành năm 2019 (34,8 triệu đồng/m2). Tri Thức - Znewsgiới thiệu độc giảTủ sách kiến thức kinh tếvới đa dạng cuốn sách, câu chuyện trong lĩnh vực kinh doanh, kinh tế. Những cuốn sách, câu chuyện trong Tủ sách không đơn thuần là những tác phẩm của tri thức mà còn chứa đựng bí quyết, kinh nghiệm quý báu từ các tác giả, nhà quản lý có uy tín và kinh nghiệm lâu năm trong ngành. Đọc sách không chỉ giúp tiếp cận những kiến thức mới mà còn giúp mở rộng tầm nhìn và phát triển bản thân. Tủ sách kiến thức kinh tế mong muốn lan tỏa tri thức trong lĩnh vực kinh doanh, đồng thời phát triển văn hóa đọc cho người Việt.  Chủ đầu tư khu đô thị Tây Hồ Tây bị phạt Do sử dụng hóa đơn, hạch toán chi phí hóa đơn sai quy định, Công ty THT bị cơ quan thuế xử phạt.  Đại gia đổ về khu đô thị đắt nhất Hà Nội xây văn phòng hạng A Loạt dự án văn phòng đang và sắp triển khai tại khu đô thị Tây Hồ Tây dự kiến đóng góp chủ yếu vào nguồn cung văn phòng hạng A tại Hà Nội từ năm 2027 trở đi.  Chủ khu đô thị đắt nhất Hà Nội tiếp tục chuyển nhượng 'đất vàng' Hà Nội ra quyết định giao hơn 15.000 m2 đất tại khu đô thị Tây Hồ Tây cho Công ty Viesta, sau khi chủ đầu tư THT chuyển nhượng phần đất này."
ZNews,https://znews.vn/thai-lan-australia-lac-quan-truoc-loi-de-doa-thue-cua-ong-trump-post1567076.html,Kinh doanh,Null,"Thứ ba, 8/7/2025 20:30 (GMT+7)","Thái Lan, Australia 'lạc quan' trước lời đe dọa thuế của ông Trump","Ngày 7/7 (giờ Mỹ), Tổng thống Donald Trump tiếp tục làm dậy sóng dư luận khi công bố loạt ảnh chụp thư gửi lãnh đạo 14 quốc gia, thông báo mức thuế mới mà Mỹ dự kiến áp dụng từ ngày 1/8 tới. Các mức thuế Mỹ dự kiến áp lên hàng hóa các nước trong danh sách này dao động trong khoảng 25-40%, tùy từng quốc gia. Theo đó, các mặt hàng nhập khẩu từ Nhật Bản, Hàn Quốc, Malaysia, Kazakhstan và Tunisia sẽ phải chịu mức thuế 25%. Nam Phi và Bosnia bị áp thuế 30%, trong khi hàng hóa từ Indonesia phải đối mặt với mức 32%. Bangladesh và Serbia đều nhận mức thuế 35%, còn Campuchia và Thái Lan sẽ phải gánh mức thuế cao hơn là 36%. Đặc biệt, hai quốc gia Đông Nam Á là Lào và Myanmar bị áp mức cao nhất với 40%. So sánh mức thuế đối ứng được ông Trump công bố ngày 7/7 và 2/4. Đồ họa:Huy Hoàng. Trước thư áp thuế của ông Trump, chính phủ Thái Lan bày tỏ lạc quan sẽ đạt được mức thuế thấp hơn con số 36% vừa công bố. Trả lời phỏng vấn một kênh truyền hình trong nước ngày 8/7, Bộ trưởng Tài chính Pichai Chunhavajira cho biết Thái Lan kỳ vọng sẽ hoàn tất đàm phán thương mại với Mỹ trước thời hạn 1/8, theoBloomberg. Ông nhấn mạnh mức thuế mà Washington áp đặt chưa tính đến bản đề xuất mới gửi hôm 6/7 của Bangkok. Trong đó, Thái Lan cam kết thúc đẩy kim ngạch thương mại song phương và cắt giảm 70% mức thặng dư thương mại với Mỹ - hiện ở mức46 tỷ USD- trong vòng 5 năm. Đề xuất bao gồm việc mở rộng cửa cho nông sản và hàng công nghiệp Mỹ, đồng thời tăng nhập khẩu năng lượng cũng như máy bay do hãng Boeing sản xuất. Bộ trưởng Tài chính Thái Lan cho biết nước này tự tin sẽ đạt được thỏa thuận thương mại với mức thuế thấp hơn 36% mà ông Trump công bố ngày 7/7. Ảnh:Reuters. ""Đây là một thỏa thuận có lợi cho cả hai bên. Thái Lan sẵn sàng giảm thuế nhập khẩu với 90% hàng hóa Mỹ"", ông Pichai khẳng định và bày tỏ sự bất ngờ khi Mỹ vẫn giữ nguyên mức thuế 36% trong thư phản hồi gần đây. Năm ngoái, Mỹ là thị trường xuất khẩu lớn nhất của Thái Lan, chiếm khoảng 18% tổng kim ngạch xuất khẩu. Trong 5 tháng đầu năm nay, xuất khẩu Thái Lan đã tăng khoảng 15%, phần lớn nhờ các đơn hàng được đẩy nhanh trong thời gian chính quyền ông Trump tạm hoãn thuế đối ứng 90 ngày. Đạt được mức thuế thấp hơn là yếu tố sống còn để bảo vệ nền kinh tế Thái Lan vốn phụ thuộc vào thương mại trước những biến động bất lợi. Tăng trưởng kinh tế nước này đang chịu sức ép từ gánh nặng nợ hộ gia đình cao nhất Đông Nam Á và tiêu dùng nội địa yếu kém. Giới chức Thái Lan cảnh báo nếu mức thuế 36% được giữ nguyên, GDP nước này có thể mất ít nhất 1 điểm % trong năm nay. Hiện chưa rõ chính quyền ông Trump sẽ áp mức thuế bao nhiêu đối với Australia, bởi nước này không nằm trong danh sách các quốc gia được thông báo mức thuế ngày 7/7. Theo thông báo trước đó của ông Trump ngày 2/4, Australia sẽ phải chịu mức thuế 10% cho hàng hóa xuất khẩu sang Mỹ. Hiện, Ủy ban Năng suất Australia tỏ ra khá lạc quan khi cho biết các chính sách thuế thương mại sẽ chỉ gây ảnh hưởng nhỏ đến nền kinh tế, thậm chí có thể mang lại một số lợi ích nhất định,Guardiancho biết. Các chuyên gia kinh tế cũng nhận định Australia đang ở vị thế tốt nhất thế giới để chống chọi với làn sóng bảo hộ thương mại từ Mỹ. Là chuyên gia hàng đầu thế giới về mô hình hóa tác động của chủ nghĩa bảo hộ thương mại, GS Warwick McKibbin từ Đại học Quốc gia Australia phát biểu tại Hội nghị các nhà kinh tế Australia hôm thứ 7/7 (giờ địa phương) rằng: Những xáo trộn hiện tại nên được nhìn nhận như một ""cơ hội"" để mở rộng quan hệ thương mại với các đối tác. ""Chúng ta nên xúc tiến các cuộc đàm phán thương mại, nên loại bỏ những rào cản khiến việc giao thương trở nên khó khăn"", ông nói. Theo Ủy ban Năng suất Australia, việc nước này trả đũa bằng cách áp thuế ngược lại sẽ phản tác dụng. Giải pháp tốt nhất là cải cách trong nước nhằm nâng cao năng lực sản xuất của nền kinh tế. Trong bối cảnh Thủ tướng Anthony Albanese vẫn chưa có cuộc gặp trực tiếp nào với ông Trump, Bộ trưởng Ngân khố Jim Chalmers khẳng định báo cáo của Ủy ban Năng suất củng cố hướng đi của chính phủ trong việc đối phó với làn sóng bảo hộ thương mại từ Mỹ. ""Thông điệp cốt lõi từ báo cáo là Australia nên tiếp tục theo đuổi thương mại tự do và công bằng. Và đó chính là điều chúng tôi đang làm"", ông Chalmers nhấn mạnh. Ủy ban Năng suất Australia cho biết tác động ""nhỏ nhưng tích cực"" đến GDP (ước tính tăng 0,4%) là nhờ dòng hàng hóa vốn xuất sang Mỹ nay sẽ chuyển hướng với chi phí rẻ hơn, đồng thời một phần dòng vốn đầu tư rút khỏi Mỹ và các quốc gia bị áp thuế cao cũng có thể tìm đến nước này. Tuy vậy, Phó chủ tịch Ủy ban - ông Alex Robson cảnh báo rằng con số tăng trưởng 0,4% chưa tính đến những tác động gián tiếp khó đo lường khác. ""Mức thuế đề xuất có thể chỉ ảnh hưởng trực tiếp nhỏ đến Australia, nhưng sự bất ổn toàn cầu mà chúng tạo ra có thể tác động đến mức sống của người dân trong nước cũng như trên toàn thế giới"", ông Robson cho biết. Nền kinh tế với độ mở lớn như Việt Nam không thể tránh khỏi những tác động từ xu hướng kinh tế thế giới. Trong thế giới kinh doanh phức tạp và thay đổi liên tục hiện nay, việc cập nhật kiến thức và hiểu biết về các xu hướng kinh doanh trên thế giới trở thành nhu cầu cấp thiết. Để độc giả có thể tiếp cận những tri thức kinh tế quốc tế mới nhất,Tri Thức - Znewsgiới thiệuTủ sách kinh tế thế giớivới những cuốn sách và câu chuyện kinh doanh trên thế giới.  EU chạy đua thỏa thuận với Mỹ trước ngày 9/7 Liên minh châu Âu (EU) đang tăng tốc đạt thỏa thuận thương mại với Mỹ trước ngày 9/7 nhằm tránh nguy cơ bị áp mức thuế cao hơn.  Những nước đầu tiên phản ứng lệnh thuế mới của ông Trump Nhiều nước nằm trong danh sách bị áp thuế mới thận trọng lên kế hoạch để đàm phán thương mại với Mỹ, trước khi mức thuế dự kiến có hiệu lực từ ngày 1/8.  Chứng khoán châu Á 'phớt lờ' thư áp thuế của ông Trump Loạt nước châu Á chuẩn bị đối mặt thuế suất 25-40% với hàng xuất sang Mỹ. Song nhà đầu tư vẫn giữ tâm lý tích cực, giúp thị trường khu vực tăng nhẹ đầu tuần."
ZNews,https://znews.vn/du-an-cua-lotte-o-thu-thiem-duoc-duyet-gia-dat-hon-16000-ty-dong-post1567045.html,Kinh doanh,Null,"Thứ ba, 8/7/2025 17:03 (GMT+7)",Dự án của Lotte ở Thủ Thiêm được duyệt giá đất hơn 16.000 tỷ đồng,"Dự án Lotte Eco Smart City Thủ Thiêm được xây dựng trên khu đất có tổng diện tích gần 7,5 ha. Ảnh:Quỳnh Danh. Theo thông tin từ Sở Nông nghiệp và Môi trường TP.HCM, dự án Khu phức hợp thông minh Thủ Thiêm Eco Smart (Lotte Eco Smart City) của Tập đoàn Lotte (Hàn Quốc) đã được phê duyệt giá đất với mức giá là16.190 tỷ đồng. Đây là một trong những dự án có vốn đầu tư lớn tại khu chức năng 2A, Khu đô thị Thủ Thiêm, nay thuộc địa bàn phường An Khánh, TP.HCM. Dự án được công bố từ năm 2017 với tổng vốn khoảng900 triệu USD. Lễ động thổ được tổ chức vào tháng 9/2022, nhưng sau gần 3 năm, khu đất vẫn chưa có dấu hiệu thi công. Thời điểm đó, phía Tập đoàn Lotte cho hay dự án này được xây dựng trên khu đất gần 7,5 ha. Diện tích phát triển khoảng 5 ha với những công năng là khu trung tâm tài chính, thương mại - dịch vụ tổng hợp và dân cư đa chức năng. Điểm nhấn của dự án là tòa tháp Lotte Eco Smart City cao 50 tầng. Giữa tháng 9 vừa năm ngoái, Sở Quy hoạch Kiến trúc TP.HCM đã phê duyệt phương án thiết kế kiến trúc của dự án. Từ đó đến nay, dự án này liên tục được lãnh đạo TP.HCM đốc thúc tháo gỡ vướng mắc. Trước đó, Sở Tài nguyên và Môi trường TP.HCM (nay là Sở Nông nghiệp và Môi trường) trình danh sách các dự án bất động sản cần thẩm định giá trong quý IV/2024 gửi Sở Tài chính, trong đó có dự án Lotte Eco Smart City. Với 22 dự án bất động sản đang vướng, nếu hoàn tất thẩm định giá, số thu dự kiến cho ngân sách TP.HCM khoảng25.483 tỷ đồng. Tri Thức - Znewsgiới thiệu độc giảTủ sách kiến thức kinh tếvới đa dạng cuốn sách, câu chuyện trong lĩnh vực kinh doanh, kinh tế. Là nguồn tư liệu cho những người quan tâm và muốn nâng cao kiến thức trong lĩnh vực kinh tế. Những cuốn sách, câu chuyện trong Tủ sách không chỉ đơn thuần là những tác phẩm của tri thức mà còn chứa đựng bí quyết, kinh nghiệm quý báu từ các tác giả, nhà quản lý có uy tín và kinh nghiệm lâu năm trong ngành. Đọc sách không chỉ giúp người đọc tiếp cận những kiến thức mới mà còn giúp mở rộng tầm nhìn và phát triển bản thân. Tủ sách kiến thức kinh tế mong muốn lan tỏa tri thức trong lĩnh vực kinh doanh, đồng thời phát triển văn hóa đọc cho người Việt.  Đề xuất hơn 1.800 tỷ đồng cho 'khu sinh thái - quảng trường Thủ Thiêm' Dự án bao gồm quảng trường trung tâm, công viên bờ sông ở khu đô thị mới Thủ Thiêm với tổng diện tích khoảng 27,3 ha và khu Lâm viên sinh thái với tổng diện tích lên tới 150,2 ha.  Thaco đề xuất làm metro nối Bến Thành, Thủ Thiêm và sân bay Long Thành Thaco đề xuất nghiên cứu tuyến metro Bến Thành - Thủ Thiêm - Long Thành. Nếu không được chọn làm nhà đầu tư, tập đoàn vẫn bàn giao kết quả nghiên cứu, không yêu cầu hoàn phí.  Thaco đề xuất làm quảng trường, khu sinh thái ở Thủ Thiêm Tập đoàn Thaco muốn làm quảng trường trung tâm, công viên bờ sông rộng 27,2 ha và khu lâm viên sinh thái 150,2 ha tại khu đô thị mới Thủ Thiêm (TP Thủ Đức, TP.HCM)."
