Source,URL,Category,Keyword,Time,Title,Content
ZNews,https://lifestyle.znews.vn/lai-lich-trum-giang-ho-tuan-than-den-o-thanh-hoa-bi-cong-an-kham-nha-post1555695.html,Pháp luật,Null,"Thứ ba, 27/5/2025 06:14 (GMT+7)",Lai lịch trùm giang hồ Tuấn 'thần đèn' ở Thanh Hóa bị công an khám nhà,"Theo thông tin củaVietNamNet, trong ngày 26/5, hàng chục cán bộ,     chiến sĩ của Bộ Công an đã khám xét 3 căn nhà trên địa bàn TP Thanh Hóa.     Trong đó, có một điểm khám xét là nhà riêng của Nguyễn Anh Tuấn (SN     1974), biệt danh Tuấn ""thần đèn"", một trùm giang hồ cộm cán ở Thanh Hóa -     có địa chỉ trên đường Lê Hoàn, phường Lam Sơn, TP Thanh Hóa. Ngoài nhà riêng của Tuấn ""thần đèn"", 2 địa điểm khác, một là căn     nhà ở đường Trường Thi (phường Điện Biên) và căn còn lại trên đường Bùi     Khắc Nhất (phường Đông Hương) đều liên quan đến nơi ở hoặc làm ăn của     Nguyễn Anh Tuấn. Ngôi nhà riêng của Tuấn ""thần đèn"" trên đường Lê Hoàn, TP Thanh Hóa. Được biết, ở xứ Thanh nhắc tới tên Tuấn ""thần đèn"" không ai xa lạ, bởi đây là một trùm giang hồ cộm cán và hung hãn. Trước đây, khi mới bước chân vào giới ""giang hồ"", Tuấn từng nhiều lần     bị công an bắt giữ. Với cái mác nhiều ""tiền án tiền sự"", Tuấn nhanh     chóng chiêu mộ đàn em và bắt đầu con đường làm ăn mới là cho vay nặng     lãi và đòi nợ thuê. Băng nhóm của Tuấn ""thần đèn"" thường sử dụng hàng     nóng như: súng, dao, kiếm… để đi đòi nợ và gây rối trật tự công cộng. Lực lượng chức năng chốt chặn ở cửa ra vào căn nhà của Tuấn ""thần đèn"". Đơn cử như năm 2014, Tuấn cho một giám đốc công ty vay2 tỷ đồngvới     lãi suất “cắt cổ”. Chỉ trong thời gian ngắn, số tiền bị tính lãi đã lên     tới hơn8 tỷ đồng. Do lãi suất quá cao, vị giám đốc này mất khả năng chi     trả, Tuấn sai đàn em đến uy hiếp, đánh người. Với hành vi trên, Tuấn bị     TAND tỉnh Thanh Hóa tuyên phạt 5 năm tù. Sau khi ra tù chưa lâu, Tuấn ""thần đèn"" tiếp tục con đường cũ. Năm     2019, Tuấn bị xử phạt 10 tháng tù vì chỉ đạo đàn em sử dụng súng bắn     nhau trên đường phố… Tuấn ""thần đèn"" được biết đến là trùm giang hồ cộm cán ở Thanh Hóa. Hiện băng nhóm của Tuấn ""thần đèn"" còn lấn sân sang lĩnh vực khác, đó     là can dự vào các hoạt động kinh tế, bảo kê, thâu tóm các mỏ đất, cát. Thủ đoạn của Tuấn là nơi nào được cấp mỏ khai thác, hắn liền chỉ đạo đàn     em đến thăm dò rồi mua lại các phần đất của người dân xung quanh các     mỏ. Bọn chúng thường xuyên quấy nhiễu các mỏ, buộc các chủ mỏ phải sang     nhượng lại. Nếu chủ mỏ có thái độ phản ứng liền bị đàn em của Tuấn đến     đe dọa, phá máy móc không để làm ăn. Sách về Pháp luật Cuốn sách chuyên khảo""Bảo vệ quyền lợi của người thứ ba ngay tình""phân tích các khía cạnh của việc bảo vệ quyền lợi của người thứ ba ngay tình một cách hợp lý, toàn diện; có so sánh với pháp luật một số nước trên thế giới, xem xét thực tiễn áp dụng tại Việt Nam; từ đó đưa ra một số kiến nghị, đề xuất có giá trị từ nhiều góc độ.  Bắt hai đối tượng trong nhóm côn đồ áo đen đập phá quán phở 22:17 26/5/202522:1726/5/2025Pháp luậtPháp luật 0 Công an tỉnh Đắk Lắk vừa phối hợp bắt giữ 2/7 đối tượng mặc áo đen có hành vi xông vào đập phá quán phở trên địa bàn huyện Ea Kar.  Giám định dung dịch màu xanh trong vụ dùng kim tiêm đâm học sinh 22:19 26/5/202522:1926/5/2025Pháp luậtPháp luật 0 Bước đầu, đối tượng khai dung dịch màu xanh trong kim tiêm là nước muối sinh lý pha với thuốc cảm. Tuy nhiên, cơ quan chức năng đang tiến hành giám định thành phần dung dịch.  Bắt thêm 5 người liên quan đến vợ chồng chủ tịch Công ty Hoàng Long 17:54 26/5/202517:5426/5/2025Pháp luậtPháp luật 0 Liên quan đến sai phạm tại Công ty CP đầu tư xây dựng và cung ứng nhân lực Hoàng Long, Cơ quan Cảnh sát điều tra Bộ Công an ra quyết định khởi tố, bắt tạm giam thêm 5 người có liên quan."
ZNews,https://lifestyle.znews.vn/len-mang-livestream-khoe-than-co-gai-tre-bi-de-doa-tong-tien-post1555501.html,Pháp luật,Null,"Thứ ba, 27/5/2025 09:25 (GMT+7)","Lên mạng livestream khoe thân, cô gái trẻ bị đe dọa tống tiền","Thời gian gần đây, nhiều người sử dụng mạng xã hội thường gặp các     buổi livestream có hình ảnh ""nhạy cảm"". Các buổi livestream này không     chỉ gây ảnh hưởng xấu đến văn hóa, đạo đức mà còn tiềm ẩn nhiều rủi ro     dễ bị các đối tượng xấu lợi dụng để chiếm đoạt tài sản. Theo đó, các đối tượng lợi dụng tâm lý tò mò, nhẹ dạ của người dùnginternet, đặc biệt là thanh thiếu niên để tiếp cận, làm quen. Sau     thời gian trò chuyện, các đối tượng gạ gẫm, lôi kéo nạn nhân quay clip,     tự chụp lại các hình ảnh khiêu dâm của bản thân. Khi có được hình ảnh,     các đối tượng sẽ đe dọa, ép buộc nạn nhân phải chuyển tiền nếu không sẽ     phát tán hình ảnh lên mạng xã hội hoặc gửi cho người thân, bạn bè của     nạn nhân. Đầu tháng 5/2025, chị M (SN 2003, trú tại Hà     Nội) tham gia nền tảng mạng xã hội Mango “livestream hở ngực”. Khi     livestream trên nhóm Mango, chị M đã bị một đối tượng quay lại hình ảnh.     Sau đó, đối tượng sử dụng để đe dọa bắt     chị M chuyển tiền nếu không sẽ phát tán lên mạng. Do lo sợ, chị M đã     chuyển cho đối tượng trên. Tuy nhiên, đối tượng không dừng lại, vẫn tiếp     tục đe dọa chị chuyển thêm tiền, nên chị M đã đến cơ quan Công an trình     báo. Để tránh trở thành nạn nhân của thủ đoạn trên, Công an thành phốHà Nộikhuyến cáo người dân như sau: - Cảnh giác khi nhận được lời mời, tin nhắn kết bạn từ người lạ trên mạng xã hội. - Tuyệt đối không tham gia các diễn đàn, hội nhóm có hoạt động trao đổi hình ảnh ""nhạy cảm"" trên không gian mạng. - Không gửi ảnh, video nhạy cảm của bản thân cho người khác (kể cả     người quen), không chia sẻ thông tin cá nhân như tên tuổi, địa chỉ nhà,     số điện thoại,.. với người lạ. Trường hợp bị đe dọa, đề nghị người dân đến ngay Cơ quan Công an nơi     gần nhất để được hướng dẫn, giải quyết theo quy định của pháp luật. Sách về Pháp luật Cuốn sách""Quyền tư pháp và trách nhiệm giải trình của cơ quan thực hiện quyền tư pháp ở Việt Nam hiện nay”không chỉ cung cấp kiến thức nền tảng về quyền tư pháp và trách nhiệm giải trình mà còn đề xuất các giải pháp nhằm bảo đảm thực hiện quyền tư pháp ở Việt Nam thời gian tới trong 3 chương sách.  Đã xác định được danh tính nhóm đối tượng bịt mặt đập phá quán phở 19 giờ trước07:3127/5/2025Pháp luậtPháp luật 01 Liên quan đến vụ việc nhóm đối tượng bịt mặt, mang theo hung khí ngang nhiên xông vào một quán phở đập phá đồ đạc rồi lên xe tẩu thoát, Công an Đắk Lắk cho biết đã xác định được động cơ cũng như danh tính của nhóm đối tượng.  Vì sao không khởi tố vụ Elmaco Ninh Bình đổ chất thải trái quy định? 20 giờ trước07:1327/5/2025Pháp luậtPháp luật 0 Cơ quan CSĐT Công an Ninh Bình ban hành quyết định không khởi tố vụ án hình sự đối với nguồn tin tố giác về hành vi gây ô nhiễm môi trường tại Công ty Cổ phần Tinh bột sắn Elmaco Ninh Bình - đơn vị vận hành nhà máy sản xuất tinh bột sắn tại xã Phúc Sơn, huyện Nho Quan.  Hành trình truy bắt kẻ dùng kim tiêm đâm vào đùi nữ sinh 19 giờ trước08:0027/5/2025Pháp luậtPháp luật 0 Phòng CSHS Công an Bình Dương bắt giữ đối tượng dùng kim tiêm đâm vào đùi 5 nữ sinh từ lớp 6 đến lớp 10 xảy ra trên địa bàn phường Tân Vĩnh Hiệp, TP Tân Uyên, tỉnh Bình Dương."
ZNews,https://lifestyle.znews.vn/da-xac-dinh-duoc-danh-tinh-nhom-doi-tuong-bit-mat-dap-pha-quan-pho-post1554913.html,Pháp luật,Null,"Thứ ba, 27/5/2025 07:31 (GMT+7)",Đã xác định được danh tính nhóm đối tượng bịt mặt đập phá quán phở,"Theo Công an tỉnh Đắk Lắk, trước đó, vào khoảng 8h ngày 26/5, Công an     tỉnh nhận được tin báo của quần chúng nhân dân về việc một nhóm đối     tượng lạ mặt, đi trên một chiếc ôtô 7 chỗ màu trắng cầm theo hung     khí xông vào một quán phở của người dân trên địa bàn xã Ea Đar, huyện Ea     Kar đập phá, tạt sơn vào nhà. Sau khi tiếp nhận tin báo, Phòng Cảnh sát hình sự Công an tỉnh Đắk     Lắk tiến hành xác minh, xác định nguyên nhân ban đầu là do gia đình ông     Phạm Đức Đại (SN 1972, trú tại, thôn 10, xã Ea Đar, huyện Ea Kar, chủ     quán phở) có vay mượn tiền của một số người dân trên địa bàn huyện Ea     Kar để kinh doanh. Tuy nhiên, do quá trình kinh doanh không thuận lợi     dẫn đến việc không có khả năng trả nợ. Nhóm đối tượng ngang nhiên vào quán đập phá. Qua làm việc với vợ chồng ông Đại, lực lượng Công an phát hiện đối     tượng Lê Ngọc Tuấn Anh (SN 1992, trú tại thị trấn Ea Knốp, huyện Ea Kar,     Đắk Lắk) là một trong những đối tượng khả nghi gây ra vụ việc, nên tiến     hành truy xét. Qua truy xét nhanh, Phòng Cảnh sát hình sự Công an tỉnh     Đắk Lắk phối hợp với Phòng Cảnh sát hình sự Công an tỉnh Khánh Hòa bắt     giữ được đối tượng Lê Ngọc Tuấn Anh và Cao Mỹ (SN 1991, trú tại số 1,     thôn Lâm Hạ, xã Đức Phong, huyện Mộ Đức, tỉnh Quảng Ngãi) đang trên     đường tẩu thoát tại địa phận TP Cam Ranh, tỉnh Khánh Hòa. Qua đấu tranh, bước đầu Lê Ngọc Tuấn Anh khai nhận: do vợ chồng ông     Đại nợ của mẹ Tuấn là bà Trương Thị Ngọc Hoàng số tiền1,4 tỷ đồng. Nên     vào khoảng 6h ngày 26/5, Lê Ngọc Tuấn Anh rủ Cao Mỹ, Nguyễn Thành Công     (SN 1988, trú tại phường 3, quận Gò Vấp, TP.HCM), Phan Văn Hóa     (SN 1991, trú tại xã Mỹ Phước, TP Long Xuyên, tỉnh An Giang), Nguyễn     Thái Hào (SN 2003, trú tại xã Thạnh Quới, huyện Vĩnh Thạnh, TP Cần Thơ). 2 người trong nhóm đối tượng liên quan bị bắt giữ. Nguyễn Văn Kim Hùng (SN 1987, trú tại xã Vĩnh Lộc B, huyện Bình Chánh     TP Hồ Chí Minh) và Võ Thanh Tuấn (SN 1999, trú tại xã An Túc, huyện Tri     Tôn, tỉnh An Giang) đi trên chiếc ôtô mang BKS 63A-281.47 và sử     dụng hung khí (gậy bóng chày) đến gia đình nhà ông Đại và người thân của     ông Đại là Nguyễn Doãn Nhân và Nguyễn Doãn Hiệu (đều trú tại xã Ea Đa,     huyện Ea Kar) đập phá tài sản và tạt sơn vào nhàm đồng thời có hành vi     đe dọa gia đình của ông Đại. Tổng tài sản bị thiệt hại hư hỏng khoảng     hơn 10 triệu đồng. Sau khi thực hiện hành vi, các đối tượng rời đi và di chuyển đến tỉnh     Khánh Hòa. Trên đường đi, Nguyễn Thành Công, Phan Văn Hóa, Nguyễn Thái     Hào, Nguyễn Văn Kim Hùng và Võ Thanh Tuấn xuống xe bắt taxi để tẩu     thoát. Riêng Lê Ngọc Tuấn Anh và Cao Mỹ bị bắt giữ tại TP Cam Ranh cùng     phương tiện. Hiện tại Phòng Cảnh sát hình sự tiếp tục truy bắt các đối tượng còn lại. Sách về Pháp luật Cuốn sách""Bảo đảm quyền bào chữa của bị cáo trong xét xử sơ thẩm các vụ án hình sự ở Việt Nam""sẽ góp phần làm sáng tỏ những vấn đề lý luận, thực tiễn bảo đảm quyền bào chữa của bị cáo trong hoạt động xét xử sơ thẩm các vụ án hình sự của TAND hiện nay.  Vì sao không khởi tố vụ Elmaco Ninh Bình đổ chất thải trái quy định? 20 giờ trước07:1327/5/2025Pháp luậtPháp luật 0 Cơ quan CSĐT Công an Ninh Bình ban hành quyết định không khởi tố vụ án hình sự đối với nguồn tin tố giác về hành vi gây ô nhiễm môi trường tại Công ty Cổ phần Tinh bột sắn Elmaco Ninh Bình - đơn vị vận hành nhà máy sản xuất tinh bột sắn tại xã Phúc Sơn, huyện Nho Quan.  Thông tin diễn biến điều tra vụ lừa đảo góp vốn vào Tâm Lộc Phát 20 giờ trước06:2627/5/2025Pháp luậtPháp luật 0 Cơ quan CSĐT Công an TP Hà Nội đang điều tra vụ án ""Lừa đảo chiếm đoạt tài sản"" xảy ra tại Công ty cổ phần tập đoàn Tâm Lộc Phát.  Bắt giám đốc công ty lừa đảo bằng hợp đồng hợp tác kinh doanh 20 giờ trước06:5727/5/2025Pháp luậtPháp luật 0 Trần Ngọc Hiệp, Giám đốc Công ty TNHH xây dựng Cửu Long Giang, tự giới thiệu trúng các gói thầu thực hiện dự án trên địa bàn Bà Rịa - Vũng Tàu để huy động vốn góp của các nhà đầu tư, bằng hình thức hợp đồng hợp tác kinh doanh, hứa chia lợi nhuận theo tỷ lệ vốn góp."
ZNews,https://lifestyle.znews.vn/truy-bat-nghi-pham-phong-hoa-dot-nha-o-bac-giang-post1556060.html,Pháp luật,Null,"Thứ ba, 27/5/2025 09:56 (GMT+7)",Truy bắt nghi phạm phóng hỏa đốt nhà ở Bắc Giang,"Theo đó, đối tượng được xác định là Nguyễn Văn Thụ (SN 1991, trú tại TP     Chí Linh, Hải Dương; hiện tạm trú tổ dân phố My Điền 2, phường     Nếnh, thị xã Việt Yên). Sau khi thực hiện hành vi phóng hỏa, đối tượng     Thụ đã bỏ trốn. Khoảng 3h ngày 26/5, một vụ cháy lớn xảy ra tại khu vực tổ dân phố My     Điền 2, bắt đầu từ chiếc ôtô của người dân tại đây. Ngọn lửa nhanh     chóng lan sang các nhà liền kề, chủ yếu là các hộ kinh doanh xe máy và     xe điện, gây thiệt hại nghiêm trọng về tài sản. Hình ảnh đối tượng Nguyễn Văn Thụ và hiện trường vụ cháy. Ngay khi nhận được tin báo, lãnh đạo UBND thị xã Việt Yên đã chỉ đạo     UBND phường Nếnh phối hợp cùng lực lượng công an, PCCC, tổ liên gia và     các lực lượng tại chỗ khẩn trương đến hiện trường. Đám cháy được khống     chế hoàn toàn vào khoảng 4h30 cùng ngày. Các hộ bị ảnh hưởng bao gồm nhà anh Lê Văn Hưng (SN 1991), diện tích     bị cháy khoảng 144 m2; chị Bùi Thị Hằng (SN 1983), diện tích bị cháy     khoảng 72 m2; anh Nguyễn Đức Thu và nhà anh Nguyễn Văn Ngoan (cùng SN     1984). Vụ cháy lớn gây thiệt hại lớn về tài sản, ảnh hưởng trực tiếp đến     hoạt động kinh doanh và sinh hoạt của các hộ dân, nhưng may mắn không gây     thiệt hại về người. Công an tỉnh Bắc Giang đề nghị người dân nâng cao tinh thần tố giác     tội phạm. Ngay khi phát hiện thông tin liên quan đến đối tượng Thụ,     người dân liên hệ Trung tá Nguyễn Dương Hưng - Phó Thủ trưởng Cơ quan     Cảnh sát điều tra Công an tỉnh Bắc Giang hoặc thông báo Cơ quan Công an nơi gần nhất để phối hợp bắt giữ. Sách về Pháp luật Cuốn sách""Quyền tư pháp và trách nhiệm giải trình của cơ quan thực hiện quyền tư pháp ở Việt Nam hiện nay”không chỉ cung cấp kiến thức nền tảng về quyền tư pháp và trách nhiệm giải trình mà còn đề xuất các giải pháp nhằm bảo đảm thực hiện quyền tư pháp ở Việt Nam thời gian tới trong 3 chương sách.  Đã xác định được danh tính nhóm đối tượng bịt mặt đập phá quán phở 19 giờ trước07:3127/5/2025Pháp luậtPháp luật 01 Liên quan đến vụ việc nhóm đối tượng bịt mặt, mang theo hung khí ngang nhiên xông vào một quán phở đập phá đồ đạc rồi lên xe tẩu thoát, Công an Đắk Lắk cho biết đã xác định được động cơ cũng như danh tính của nhóm đối tượng.  Lên mạng livestream khoe thân, cô gái trẻ bị đe dọa tống tiền 17 giờ trước09:2527/5/2025Pháp luậtPháp luật 0 Chị M (SN 2003, trú tại Hà Nội) tham gia nền tảng mạng xã hội Mango ""livestream hở ngực"".  Hành trình truy bắt kẻ dùng kim tiêm đâm vào đùi nữ sinh 19 giờ trước08:0027/5/2025Pháp luậtPháp luật 0 Phòng CSHS Công an Bình Dương bắt giữ đối tượng dùng kim tiêm đâm vào đùi 5 nữ sinh từ lớp 6 đến lớp 10 xảy ra trên địa bàn phường Tân Vĩnh Hiệp, TP Tân Uyên, tỉnh Bình Dương."
ZNews,https://lifestyle.znews.vn/vi-sao-khong-khoi-to-vu-elmaco-ninh-binh-do-chat-thai-trai-quy-dinh-post1554912.html,Pháp luật,Null,"Thứ ba, 27/5/2025 07:13 (GMT+7)",Vì sao không khởi tố vụ Elmaco Ninh Bình đổ chất thải trái quy định?,"Trước đó, sau khi tiếp nhận hồ sơ từ Sở Tài nguyên và Môi trường (TN&MT), Cơ quan Cảnh sát điều tra (CSĐT) Công an tỉnh Ninh Bình     đã đưa vụ việc vào diện giải quyết nguồn tin tội phạm và tiến hành hàng     loạt biện pháp nghiệp vụ như, khám nghiệm hiện trường, lấy mẫu chất     thải và mẫu đất tại khu vực đổ thải trong khuôn viên nhà máy. Kết quả giám định do Cục Kỹ thuật hình sự Bộ Công an thực hiện kết luận: 4 mẫu chất thải rắn là chất thải thông     thường, không phải chất thải nguy hại; 5 mẫu đất thu tại các vị trí     nghi ngờ đều không có thành phần vượt ngưỡng nguy hại theo quy định hiện     hành. Dù vậy, để củng cố thêm căn     cứ pháp lý, Cơ quan CSĐT đã gửi văn bản đến Bộ Nông nghiệp và Môi trường     đề nghị làm rõ việc Công ty Elmaco thực hiện các biện pháp bảo vệ môi     trường theo giấy phép do UBND huyện Nho Quan     cấp có hợp lệ?; Bên cạnh đó, việc Công ty CP tinh bột sắn Elmaco để số     chất thải (trong khuôn viên) có phải là hành vi đổ thải, chất thải rắn     thông thường trái pháp luật hay không? Tuy nhiên, 2 văn bản trả lời của Bộ Nông nghiệp và Môi trường còn chung chung, không thỏa mãn được yêu cầu điều tra. Người dân địa phương chặn phương tiện ra vào nhà máy. Trên     cơ sở kết quả điều tra và phân tích chứng cứ, ba ngành tư pháp cấp tỉnh     Ninh Bình gồm Công an - Viện kiểm sát - Tòa án đã họp và thống nhất     quan điểm: Hành vi của Công ty CP Tinh bột sắn Elmaco không đủ yếu tố     cấu thành tội ""Gây ô nhiễm môi trường"" theo Điều 235 Bộ luật Hình sự, nhưng có dấu hiệu vi phạm hành chính nghiêm trọng trong lĩnh vực môi     trường. Do     đó, Cơ quan CSĐT Công an tỉnh Ninh Bình đã chuyển hồ sơ sang Sở     TN&MT tỉnh Ninh Bình để xử lý vi phạm hành chính đối với hành vi đổ,     thải trái quy định chất thải rắn thông thường gồm bã sắn và vỏ cáy với tổng khối lượng 158,651 tấn theo quy định. Trước đó, từ đầu năm 2024, hàng chục hộ     dân xã Phúc Sơn đã dựng lều trại, chặn xe nguyên liệu ra vào nhà máy     Elmaco để phản đối tình trạng ô nhiễm kéo dài ảnh hưởng đến sức khỏe và     đời sống sinh hoạt. Người dân cho rằng mùi hôi thối, nước thải và bụi từ     nhà máy phát tán ra môi trường xung quanh, đặc biệt vào mùa nắng nóng,     đã khiến sinh hoạt bị đảo lộn. Phản     ánh của người dân đã được UBND huyện Nho Quan tiếp nhận và đã yêu cầu     nhà máy tạm dừng hoạt động, đồng thời Sở TN&MT Ninh Bình thành lập     đoàn kiểm tra liên ngành để đánh giá mức độ chấp hành pháp luật về bảo     vệ môi trường của doanh nghiệp này. Nhà máy sản xuất tinh bột sắn tại xã Phúc Sơn, huyện Nho Quan. Kết quả phân tích mẫu môi trường do đoàn kiểm tra công bố cho thấy: 4     mẫu nước sinh hoạt lấy từ hộ dân quanh nhà máy có tổng số Coliform vượt     quy chuẩn kỹ thuật; 2 mẫu nước mặt tại Khoang Me và Rộc Giếng Vàng (xã     Phúc Sơn) gần nhà máy có dấu hiệu ô nhiễm amoni (NH4+) và nitrit (NO2-);     5 mẫu đất tại khu vực chứa bã sắn và vỏ cáy có hàm lượng Asen (As) cao     gấp 1,44 lần giới hạn cho phép; 4 mẫu chất thải rắn có tính axit >2     và hàm lượng Asen cao gấp từ 1,65 đến 1,82 lần ngưỡng chất thải nguy hại     theo quy chuẩn kỹ thuật môi trường. Cơ     quan thẩm quyền cho rằng, dù mức độ ô nhiễm là rõ ràng, song do vị trí     phát hiện chất thải vẫn nằm trong khuôn viên nhà máy, chưa có chứng cứ     trực tiếp cho thấy việc xả thải ra môi trường xung quanh gây hậu quả     nghiêm trọng, nên cơ quan điều tra không đủ căn cứ để xử lý hình sự. Sách về Pháp luật Cuốn sách""Bảo đảm quyền bào chữa của bị cáo trong xét xử sơ thẩm các vụ án hình sự ở Việt Nam""sẽ góp phần làm sáng tỏ những vấn đề lý luận, thực tiễn bảo đảm quyền bào chữa của bị cáo trong hoạt động xét xử sơ thẩm các vụ án hình sự của TAND hiện nay.  Thông tin diễn biến điều tra vụ lừa đảo góp vốn vào Tâm Lộc Phát 20 giờ trước06:2627/5/2025Pháp luậtPháp luật 0 Cơ quan CSĐT Công an TP Hà Nội đang điều tra vụ án ""Lừa đảo chiếm đoạt tài sản"" xảy ra tại Công ty cổ phần tập đoàn Tâm Lộc Phát.  Bắt giám đốc công ty lừa đảo bằng hợp đồng hợp tác kinh doanh 20 giờ trước06:5727/5/2025Pháp luậtPháp luật 0 Trần Ngọc Hiệp, Giám đốc Công ty TNHH xây dựng Cửu Long Giang, tự giới thiệu trúng các gói thầu thực hiện dự án trên địa bàn Bà Rịa - Vũng Tàu để huy động vốn góp của các nhà đầu tư, bằng hình thức hợp đồng hợp tác kinh doanh, hứa chia lợi nhuận theo tỷ lệ vốn góp.  Lai lịch trùm giang hồ Tuấn 'thần đèn' ở Thanh Hóa bị công an khám nhà 21 giờ trước06:1427/5/2025Pháp luậtPháp luật 0 Một trong 3 địa điểm mà công an khám xét, có nhà riêng của Nguyễn Anh Tuấn, biệt danh Tuấn ""thần đèn"", trùm giang hồ khét tiếng ở Thanh Hóa."
