Source,URL,Category,Keyword,Time,Title,Content
Tuoi tre,https://tuoitre.vn/bo-chinh-tri-cong-bo-nhan-su-chu-tich-cac-tinh-thanh-moi-vao-30-6-20250613214728922.htm,,"Ban Bí thư,Bộ Chính trị,Ông Trần Cẩm Tú,sáp nhập tỉnh,chủ tịch tỉnh",13/06/2025 22:05 GMT+7,"Bộ Chính trị: Công bố nhân sự chủ tịch các tỉnh, thành mới vào 30-6","Thường trực Ban Bí thư Trần Cẩm Tú - Ảnh: TTXVN Kết luận nêu rõ Bộ Chính trị,Ban Bí thưquyết định triển khai thực hiện việc sáp nhập tỉnh, thành phố đồng thời với sáp nhập xã, phường, đưa toàn bộ các tổ chức, cơ quan, đơn vị cấp tỉnh, cấp xã, phường, đặc khu đi vào hoạt động trên phạm vi toàn quốc từ ngày 1-7. Để bảo đảm chuẩn bị tốt cho các cơ quan, đơn vị, tổ chức cấp tỉnh, cấp xã đi vào hoạt động (hoàn thiện sắp xếp tổ chức bộ máy; giải quyết các khó khăn, vướng mắc phát sinh; bảo đảm bộ máy vận hành thông suốt), yêu cầu các bí thư đảng ủy, bộ trưởng, thủ trưởng cơ quan ngang bộ, thường trực các tỉnh ủy, thành ủy tập trung toàn bộ thời gian, lãnh đạo, chỉ đạo triển khai công việc, không đi công tác nước ngoài từ nay đến hết tháng 7. Trường hợp đặc biệt, báo cáo cấp có thẩm quyền quyết định. Các cấp ủy rà soát, hoàn thiện các văn bản quy định của Đảng, pháp luật Nhà nước, phương án bố trí nhân sự, trụ sở, phương tiện, cơ sở vật chất, bảo đảm sẵn sàng đưa bộ máy cấp tỉnh, cấp xã đi vào hoạt động từ ngày 1-7. Các cấp ủy đảng ở Trung ương và địa phương chịu trách nhiệm duy trì bộ phận thường trực để thường xuyên hướng dẫn các nội dung liên quan trong quá trình chuẩn bị và vận hành bộ máy cấp tỉnh, cấp xã mới. Bộ Chính trị, Ban Bí thư giao Đảng ủyChính phủlãnh đạo, chỉ đạo các địa phương khẩn trương nghiên cứu các nghị định mới, kịp thời phản ánh các nội dung cần làm rõ về phân cấp, phân quyền, phân định thẩm quyền, tổ chức bộ máy chính quyền địa phương... Thực hiện ngay việc tổng rà soát tình hình quản lý, xử lý trụ sở, tài sản, đất đai dôi dư sau sắp xếp đơn vị hành chính, bảo đảm hiệu quả, tránh lãng phí. Tận dụng tối đa cơ sở vật chất, trụ sở có sẵn trên địa bàn theo hướng ưu tiên chuyển đổi công năng sang phục vụ mục đích y tế, giáo dục, văn hóa... Đảng ủy Chính phủ ban hành các quyết định chỉ định chủ tịch, phó chủ tịch UBND của các tỉnh, thành phố (mới) ngay sau khi Bộ Chính trị, Ban Bí thư thông qua phương án nhân sự (bảo đảm công bố, trao quyết định vào 30-6). Cùng với đó, tăng cường chỉ đạo việc bố trí ngân sách và thực hiện chi trả chế độ, chính sách cho cán bộ, công chức, viên chức, người lao động chịu ảnh hưởng bởi sắp xếp. Các bộ, ngành khẩn trương ban hành các văn bản thông tư, hướng dẫn cụ thể hóa các nghị định mới về phân cấp, phân quyền, phân định thẩm quyền theo lĩnh vực quản lý của bộ, ngành mình, hoàn thành trước ngày 20-6. Các bộ, ngành rà soát sửa đổi, bổ sung, ban hành mới (nếu cần) hoặc bãi bỏ các văn bản thông tư, hướng dẫn trong phạm vi nhiệm vụ, quyền hạn, lĩnh vực quản lý, bảo đảm đồng bộ, thống nhất với văn bản quy định mới ban hành, hoàn thành trước ngày 25-6. Với Đảng ủy Quốc hội, Bộ Chính trị, Ban Bí thư giao lãnh đạo, chỉ đạo Ủy banThường vụ Quốc hộikịp thời ban hành nghị quyết chỉ định chủ tịch, phó chủ tịch HĐND, trưởng các ban của HĐND, trưởng đoàn, phó trưởng đoàn đại biểu Quốc hội của các tỉnh, thành phố (mới) ngay sau khi Bộ Chính trị, Ban Bí thư thông qua phương án nhân sự (bảo đảm công bố, trao quyết định vào 30-6). Cùng với đó, rà soát, bổ sung hướng dẫn về tổ chức HĐND cấp phường (lâm thời) tại các địa phương như TP.HCM, TP Đà Nẵng... Ban Tổ chức Trung ươngsẽ chủ trì, phối hợp với các cơ quan có liên quan, các tỉnh ủy, thành ủy thuộc diện hợp nhất, sáp nhập khẩn trương hoàn thành phương án nhân sự cấp ủy cấp tỉnh bao gồm nhân sự: Chủ tịch, phó chủ tịch UBND, chủ tịch, phó chủ tịch HĐND, trưởng các ban của HĐND, trưởng đoàn, phó trưởng đoàn đại biểu Quốc hội tỉnh, thành phố (trường hợp đặc biệt, cho phép chỉ định nhân sự không phải là đại biểu HĐND giữ các chức danh thường trực HĐND cấp tỉnh; đại biểu HĐND và thường trực HĐND cấp xã, trong đó có HĐND lâm thời cấp phường). Nội dung trên, Ban Tổ chức Trung ương sẽ báo cáo Bộ Chính trị, Ban Bí thư xem xét, quyết định trước ngày 20-6. Phối hợp Đảng ủy Chính phủ, Đảng ủy Quốc hội trình cấp có thẩm quyền ban hành quyết định chỉ định nhân sự cấp ủy cấp tỉnh (mới) trước ngày 25-6. Ban Tổ chức Trung ương hướng dẫn các tỉnh, thành ủy thực hiện thống nhất, đồng bộ việc ban hành quyết định kết thúc hoạt động của đảng bộ xã, phường, thị trấn; đảng bộ huyện, quận, thị xã, thành phố thuộc tỉnh và quyết định thành lập đảng bộ xã, phường, đặc khu trực thuộc tỉnh, thành ủy. Bộ Chính trị, Ban Bí thư giao ban thường vụ các tỉnh, thành ủy không thuộc diện hợp nhất, sáp nhập tiến hành việc công bố các nghị quyết của Ủyban Thường vụ Quốc hội hợp nhất, sáp nhập đơn vị cấp xã. Trao các quyết định thành lập đảng bộ xã, phường, đặc khu; chỉ định nhân sự cấp ủy cấp xã; phân công cán bộ giữ các chức vụ lãnh đạo HĐND, UBND cấp xã; thời điểm tổ chức ngày 30-6 tại các địa phương. Căn cứ các quy định Đảng, pháp luật Nhà nước, chỉ đạo của Bộ Chính trị, Ban Bí thư, Quốc hội, Chính phủ, ban thường vụ các tỉnh, thành ủy chủ động thực hiện ngay việc chỉ định HĐND, UBND và các chức vụ lãnh đạo cấp ủy, HĐND, UBND cấp xã, bảo đảm sẵn sàng đi vào hoạt động từ 1-7. Ban thường vụ các tỉnh, thành ủy trực thuộc Trung ương khẩn trương hoàn thành việc phân công cán bộ, bố trí trụ sở, cơ sở vật chất, phương tiện hoạt động của các cơ quan, tổ chức, đơn vị cấp tỉnh, cấp xã (mới) trước ngày 15-6. Khẩn trương thực hiện chi trả chế độ, chính sách đối với cán bộ, công chức, viên chức, người lao động nghỉ việc do sắp xếp. Quy định mới có hiệu lực từ 1-7 về chức năng, nhiệm vụ, tổ chức bộ máy cơ quan Ủy ban Mặt trận Tổ quốc Việt Nam cấp tỉnh, cấp xã."
Tuoi tre,https://tuoitre.vn/thu-tuong-roi-thuy-dien-ket-thuc-tot-dep-chuyen-cong-tac-3-nuoc-chau-au-20250613235114769.htm,,"Thủ tướng Phạm Minh Chính,Estonia,Liên hợp quốc,Thụy Điển,Pháp",14/06/2025 00:59 GMT+7,"Thủ tướng rời Thụy Điển, kết thúc tốt đẹp chuyến công tác 3 nước châu Âu","Thủ tướng Phạm Minh Chính cùng Phu nhân và đoàn đại biểu cấp cao Việt Nam rời thủ đô Stockholm của Thụy Điển, kết thúc tốt đẹp chuyến công tác tại ba nước châu Âu - Ảnh: VGP Chuyến công tác diễn ra từ ngày 5 đến 14-6.Thủ tướng Phạm Minh Chínhvà Phu nhân cùng đoàn đại biểu cấp cao Việt Nam đã tham dự Hội nghị Đại dương Liên hợp quốc lần thứ 3, tiến hành các hoạt động song phương tại Pháp,  theo lời mời của Tổng thư ký Liên hợp quốc Antonio Guterres và Tổng thống Pháp Emmanuel Macron. Thủ tướng và Phu nhân thăm chính thứcEstoniavà Thụy Điển theo lời mời của Thủ tướng Estonia Kristen Michal và Thủ tướng Thụy Điển Ulf Kristersson. Theo báo điện tửchinhphu.vn, tiễn Thủ tướng và Phu nhân tại sân bay có đại diện Bộ Ngoại giao Thụy Điển, Đại sứ Việt Nam tại Thụy Điển Trần Văn Tuấn cùng cán bộ, nhân viên Đại sứ quán và cộng đồng người Việt Nam tại Thụy Điển. Cán bộ, nhân viên Đại sứ quán và cộng đồng người Việt Nam tại Thụy Điển tiễn Thủ tướng Phạm Minh Chính và Phu nhân - Ảnh: VGP Thủ tướng Phạm Minh Chính và Phu nhân rời Thụy Điển, kết thúc chuyến thăm ba nước châu Âu - Ảnh: VGP Chuyến công tác với 84 hoạt động dày đặc, đạt được nhiều kết quả có ý nghĩa quan trọng, thực chất. Thủ tướng đã thay mặt ASEAN và Việt Nam có các bài phát biểu quan trọng tại Hội nghị Đại dương Liên hợp quốc lần 3. Tại Pháp, Thủ tướng đã có các cuộc hội kiến, gặp gỡ với nhiều nguyên thủ, người đứng đầu chính phủ, lãnh đạo các nước và các tổ chức quốc tế, trong đó có Tổng thống Pháp Emmanuel Macron, Tổng thư ký Liên hợp quốc Antonio Guterres. Trong chuyến công tác, Thủ tướng đã có các cuộc gặp, lắng nghe và chia sẻ với cộng đồng người Việt Nam ở các nước, thể hiện sự quan tâm sâu sắc của Đảng, Nhà nước và nhân dân trong nước với đồng bào Việt Nam ở nước ngoài. Chuyến thăm khẳng định mạnh mẽ đường lối đối ngoại độc lập, tự chủ, đa phương hóa, đa dạng hóa, chủ động, tích cực hội nhập quốc tế toàn diện, sâu rộng của Việt Nam, đồng thời thể hiện quyết tâm, khát vọng phát triển, hội nhập của đất nước, thu hút tối đa các nguồn lực quốc tế phục vụ phát triển đất nước. Thông điệp được Thủ tướng Phạm Minh Chính nêu khi cùng ăn sáng làm việc với các tập đoàn kinh tế hàng đầu Thụy Điển ngày 12-6."
Tuoi tre,https://tuoitre.vn/dam-cuoi-ngay-lut-co-dau-bat-khoc-va-niem-vui-bat-ngo-20250613183041288.htm,,Đám cưới ngày lụt,13/06/2025 18:41 GMT+7,Đám cưới ngày lụt: Cô dâu bật khóc và niềm vui bất ngờ2,"Tú Hảo bật khóc vì sợ không ai tới dự đám cưới trúng ngày lụt - Ảnh: Chụp màn hình Ở thôn Triều Sơn, phường Hương Vinh, quận Phú Xuân (Huế),đám cướicủa cô dâu Tú Hảo và chú rể Hồ Đạt (cùng sinh năm 1997) diễn ra ngày 13-6. Trước khi khách đến, cô dâu Tú Hảo bật khóc khi thấy xung quanh nước dâng lên tới bắp đùi. Chia sẻ vớiTuổi Trẻ Online, Tú Hảo cho biết nước dâng lên quá nhanh, khiến vợ chồng cô phản ứng không kịp. Chưa kể bạn bè vì đường sá khó khăn nên đến trễ. Cô tủi thân nên khóc. ""Không ngờ khách vẫn tới đông đủ, dù hơi trễ hơn tí. Mình cảm thấy rất vui khi mọi người đến ngày vui của tụi mình"", Hảo chia sẻ. Đám cưới vẫn diễn ra sôi nổi - Ảnh: NVCC Đám cưới của Hảo có rất nhiều khoảnh khắc thú vị. Chẳng hạn như khách khứa xắn quần, túm váy lên để đi lại cho dễ, đơn vị cho thuê âm thanh phải… thuê ghe để chở đồ về, nhân viên bữa tiệc phải đi từ từ trong dòng nước để mang thức ăn lên… Thế nhưng không khí vẫn rất náo nhiệt. Anh Phạm Hoài Nam (sinh năm 1992, người đăng tải đoạn clip) bật mí những đoạn clip ghi lại khoảnh khắc trong đám cưới đang được mọi người chia sẻ rần rần lên mạng. Cư dân mạng cho rằng đám cưới này rất đáng nhớ, có một không hai. Khách khứa vẫn rất vui, xắn quần chụp ảnh cùng cô dâu ở xã Hiền Ninh, huyện Quảng Ninh, Quảng Bình (nay là Quảng Trị) ngày 13-6 - Ảnh do nhân vật cung cấp Còn tại xã Hiền Ninh, huyện Quảng Ninh, Quảng Bình (nay là Quảng Trị), chị Trần Tâm (sinh năm 1991) hân hoan đi đám cưới của cô em họ cũng ngày 13-6. Trong ảnh, khách khứa vẫn rất vui, xắn quần chụp ảnh cùng cô dâu.  Chị Tâm nói: ""Đám cưới mùa hè gặp lụt mà vui. Quê mình thường hay lũ lụt, nhưng không ngờ đã chọn mùa hè rồi vẫn không thoát nổi. Chúc hai bạn trẻ luôn hạnh phúc, tiền vào như nước"". Cô dâu Nhật Lễ (sinh năm 1996) chia sẻ cảm xúc của cô lúc đó vừa vui, vừa sợ. Vui là vì đám cưới. Sợ là vì luôn nghĩ lũ lụt không ai tới dự - Ảnh: NVCC Cô dâu Nhật Lễ (sinh năm 1996) chia sẻ cảm xúc của cô lúc đó vừa vui, vừa sợ. Vui là vì đám cưới. Sợ là vì luôn nghĩ lũ lụt không ai tới dự. ""Cảm xúc của tôi vui buồn lẫn lộn. Lúc đầu lo sợ lắm, nhưng sau thấy khách vẫn đi đông đủ nên mừng"", Nhật Lễ nói. Cặp đôi đã mời 350 khách đến dự đám cưới. Kết quả vừa đủ, không dư. ""Đa số khách đều lội giữa dòng nước để đến ngày vui của chúng tôi, điều này khiến hai đứa trân trọng lắm. Đây là kỷ niệm 29 năm cuộc đời của tôi mà không ai đu lại"", cô dâu chia sẻ. Khách vẫn rất vui khi dự đám cưới đặc biệt - Ảnh: Nhân vật cung cấp Trên mạng xã hội, sau khi đoạn clip về đám cưới giữa mùa nước ngập được lan truyền, nhiều người hài hước bình luận rằng chắc hẳn sau tiệc cưới, cô dâu chú rể sẽ phải bận rộn dọn dẹp không kém gì đãi khách. Chia sẻ về điều này, Nhật Lễ cười cho biết: ""Phần dọn dẹp may mắn đã có người nhà hỗ trợ rồi, tụi mình chủ yếu tập trung đón tiếp khách và giữ tinh thần thật vui vẻ trong suốt buổi tiệc"". Lễ cũng gửi gắm một lời nhắn đến các cặp đôi khác: ""Nếu chẳng may gặp sự cố như tụi mình như trời mưa, nước ngập hay những tình huống ngoài ý muốn thì đừng nên buồn hay nản lòng. Hãy giữ tinh thần lạc quan, vì điều quan trọng nhất vẫn là ngày vui được trọn vẹn bên người thân và bạn bè"". Loài cỏ thơm tên là 'thạch xương bồ' không chỉ là loài cây trong truyền thuyết về sông Hương. Nhiều người đã thấy tận mắt thạch xương bồ ngay trên bàn tiệc cưới vừa diễn ra tại Huế ngày 6-8."
Tuoi tre,https://tuoitre.vn/100-thu-tuc-hanh-chinh-ve-doanh-nghiep-se-duoc-ha-noi-tiep-nhan-truc-tuyen-de-tranh-tieu-cuc-20250613160107151.htm,Thời sự,"thủ tục hành chính,trực tuyến,hành chính,Doanh nghiệp",13/06/2025 16:30 GMT+7,100% thủ tục hành chính về doanh nghiệp sẽ được Hà Nội tiếp nhận trực tuyến để tránh tiêu cực,"Người dân ở Hà Nội đi làm thủ tục hành chính - Ảnh: PHẠM TUẤN Theo kế hoạch,Hà Nộisẽ xây dựng và triển khai các giải pháp bảo đảm thực hiện trực tuyến 100% thủ tục hành chính liên quan đến doanh nghiệp thuộc phạm vi giải quyết của UBND các cấp tại TP. Đồng thời đảm bảo tối đa việc nộp, trả kết quả thủ tục được thực hiện trực tuyến hoặc qua dịch vụ bưu chính công ích. Theo đó, Hà Nội sẽ lấy doanh nghiệp thực hiện dịch vụ công làm trung tâm, phương thức thực hiện đảm bảo đơn giản, dễ hiểu, dễ thực hiện, góp phần thực hiện hiệu quả mục tiêu cải cách thủ tục. Song song đó, không yêu cầu doanh nghiệp kê khai, nộp giấy tờ, tài liệu bằng văn bản giấy để xác minh, kiểm tra đối với các thành phần hồ sơ đã được ký số và ghi nhận tính pháp lý trong quá trình tiếp nhận, giải quyết thủ tục, những dữ liệu đang quản lý hoặc đã được các bộ, ngành chia sẻ. ""Đơn giản hóa, tối ưu hóa các bước thực hiện thủ tục trực tuyến để tiết kiệm thời gian, chi phí, công sức của doanh nghiệp và cơ quan có thẩm quyền. Đảm bảo việc doanh nghiệp thực hiện các thủ tục hành chính trực tuyến không làm tăng phí, lệ phí ngoài quy định của pháp luật"" - kế hoạch nêu rõ. Liên quan tới cung cấp dịch vụ công trực tuyến, Hà Nội đặt mục tiêu 100% thủ tục liên quan đến doanh nghiệp thuộc thẩm quyền giải quyết của UBND các cấp trên địa bàn TP ưu tiên thực hiện trực tuyến. Trong đó: - Tối thiểu 95% hồ sơ thủ tục do doanh nghiệp thực hiện được tiếp nhận và xử lý hoàn toàn trên môi trường điện tử. - Tối thiểu 90% phản hồi hài lòng qua khảo sát số (trên Cổng dịch vụ công, ứng dụng khảo sát, iHanoi...). - 100% hồ sơ thủ tục xử lý đúng hạn hoặc sớm hơn hạn so với quy định. - 100% doanh nghiệp có thể nộp hồ sơ, theo dõi và nhận kết quả xử lý thủ tục từ bất kỳ đâu trên địa bàn thành phố hoặc qua môi trường điện tử, không phụ thuộc vào địa giới hành chính, trừ trường hợp pháp luật quy định khác. - Loại bỏ 100% việc nộp hồ sơ bản giấy; toàn bộ thành phần hồ sơ được tiếp nhận dưới hình thức điện tử (trừ giấy chứng nhận quyền sử dụng đất). Về cung cấp dịch vụ công trực tuyến toàn trình, Hà Nội đặt mục tiêu 70% thủ tục liên quan đến doanh nghiệp thuộc thẩm quyền giải quyết của UBND các cấp thực hiện trực tuyến toàn trình trước ngày 30-11-2025. 100% thủ tục hành chính liên quan đến doanh nghiệp thuộc thẩm quyền giải quyết của UBND các cấp thực hiện trực tuyến toàn trình vào năm 2026. Bạn đọc có thể xem phụ lục các thủ tục hành chính liên quan tới doanh nghiệp thuộc thẩm quyền giải quyết của UBND các cấp ở Hà Nộitại đây. Từ ngày 20 đến 26-6, Hà Nội sẽ vận hành các dịch vụ liên quan đến các thủ tục hành chính công phục vụ người dân; vận hành các dịch vụ, nhóm việc liên quan đến các sở, ngành, địa phương, người dân, doanh nghiệp."
Tuoi tre,https://tuoitre.vn/vach-son-thach-do-cao-toc-vinh-hao-phan-thiet-chu-dau-tu-khong-co-quyen-chinh-vay-ai-sua-20250613143330957.htm,Thời sự,"cao tốc Vĩnh Hảo - Phan Thiết,Vi phạm giao thông,tỉnh Bình Thuận,vạch kẻ đường,Tai nạn",13/06/2025 18:18 GMT+7,"Vạch sơn 'thách đố' cao tốc Vĩnh Hảo - Phan Thiết: Chủ đầu tư không có quyền chỉnh, vậy ai sửa?13","Lối ra của cao tốc Vĩnh Hảo - Phan Thiết tại nút giao Ma Lâm vừa có vạch sơn kẻ nét đứt, vừa có nét liền. Nhiều tài xế cho rằng như vậy là giống thách đố, dễ bị vi phạm - Ảnh: ĐỨC TRONG NhưTuổi Trẻ Onlinethông tin, thời gian qua nhiều tài xế chạy xe trên cao tốcVĩnh Hảo - Phan Thiếtphản ánh vạch sơn kẻ đường tại nút giao Ma Lâm như ""thách đố"", dễ bị vi phạm. Các tài xế cho rằng không cố ý vi phạm nhưng do vạch kẻ nét đứt quá ngắn khiến họ đè lên vạch kẻ liền. Trong khi đó chủ đầu tư dự án cao tốc Vĩnh Hảo - Phan Thiết cho rằng đã làm đúng theo thiết kế. Theo đại diện chủ đầu tư, ""lý do kẻ nét liền là để xe đi thẳng làn đường của mình. Ngoài ra, trước khi đến nút giao thì chủ đầu tư đã gắn nhiều bảng hướng dẫn từ cách xa. Với các bức xúc như tài xế phản ánh, đơn vị không có thẩm quyền để điều chỉnh"". Bạn đọc Duan đặt vấn đề: ""Làm đúng thiết kế, nhưng thiết kế đã chắc đúng chưa?"". Tài khoản LocTd có ý kiến: ""Nhìn bản vẽ thì thấy nó đủ dài đủ rộng để rẽ, nhưng thực tế với tốc độ 60km/h thì không thể đi được. Tại sao không kéo dài vạch đứt ra, có ảnh hưởng gì an toàn giao thông đâu?"". Với lập luận của chủ đầu tư về thiết kếvạch kẻsơn nét tại lối ra ở trên chỉ 5,5m, bạn đọc Nguyễn Văn Cường cho rằng những xe lớn như đầu kéo container khó lọt. ""Xe rộng gần 2m, chạy xiên chéo theo lối ra mà kẻ vạch đứt chỉ có chiều dài 5,5m thì phải chạy tốc độ dưới 30km/h mới không đè vạch liền"", bạn đọc Ngoc Ninh phân tích. ""Đường chạy với vận tốc 90km/h mà đoạn rẽ ngắn như thế thì nguy cơtai nạncao nếu tài xế tuân thủ theo vạch kẻ"" - bạn đọc Bá Tài có ý kiến. Bạn đọc Ben nhấn mạnh: ""Chưa thấy lối ra nào mà kẻ vạch đứt ngắn như thế!"". Đồng tình với các phản hồi trên, bạn đọc có địa chỉ ""nguy****@gmail.com"" nhận định rất nguy hiểm khi lái xe sợ vi phạm nên gấp rút nhập làn hayrẽ phảimà không nhường xe đang đi thẳng.  Vì chỉ cần rẽ phải hoặc nhập làn chậm chút là cán vạch liền. ""Xe sẽ mất khoảng 0,396 giây để chuyển làn theo quãng đường dài 5,5m với vận tốc 50km/h. Vậy chạy kiểu gì nhỉ?"" - bạn đọc Tai đặt câu hỏi. Theo bạn đọc Thái Bình, vạch đứt quá ngắn, lúc di chuyển nhanh trên cao tốc thì dù có giảm tốc trước khi rẽ làn cũng khó tránh khỏi cán lên vạch liền. Hy vọng các cơ quan chức năng sớm điều chỉnh cho phù hợp hơn. Và bạn đọc Trung cho rằng không cần phải kéo dài cái vạch đứt quãng, chỉ cần dời nó tiến về phía trước khoảng 5m là được. Bạn đọc Vĩnh Nam có ý kiến: khi nhiều người dân phản ánh khó di chuyển và dễ bị phạt thìcơ quan chức năngcần xem lại. ""Làm đúng thiết kế mới được nghiệm thu để đưa vào sử dụng là đúng. Tuy nhiên trong quá trình vận hành nếu thấy không hợp lý qua ý kiến của người sử dụng thì cần tiếp thu để sửa. Cái chính là an toàn"" - tài khoản xuth****@gmail.com viết. Trao đổi vớiTuổi Trẻ Online, đại diện Đội tuần tra kiểm soát giao thông đường bộ cao tốc số 6 cho biết sẽ phối hợp kiểm tra và đề xuất phương án xử lý cho phù hợp hơn. Cao tốc Vĩnh Hảo - Phan Thiết dài khoảng 100,8km, với tổng vốn đầu từ hơn 10.000 tỉ đồng. Toàn tuyến đi qua địa bàn tỉnh Bình Thuận, được đưa vào khai thác giữa năm 2023. Cao tốc được thiết kế mỗi bên hai làn xe chạy, cứ 4-5km là có một điểm dừng khẩn cấp. Dọc tuyến cao tốc này có 5 nút giao ra vào gồm: Ba Bàu, Ma Lâm, Đại Ninh, Chợ Lầu và Vĩnh Hảo. Thời gian qua, nhiều tài xế chạy xe trên cao tốc Vĩnh Hảo - Phan Thiết phản ánh vạch sơn kẻ đường tại nút giao Ma Lâm như thách đố, dễ bị vi phạm."
