Source,URL,Category,Keyword,Time,Title,Content
VN Express,https://vnexpress.net/bac-ninh-thai-nguyen-quang-tri-co-tan-chu-tich-tinh-4964943.html,Chính trị,,"Thứ hai, 17/11/2025, 16:00 (GMT+7)","Bắc Ninh, Thái Nguyên, Quảng Trị có tân chủ tịch tỉnh","HĐND ba tỉnh Thái Nguyên, Bắc Ninh và Quảng Trị ngày 17/11 đã bầu ông Vương Quốc Tuấn, Phạm Hoàng Sơn và Lê Hồng Vinh giữ chức Chủ tịch UBND tỉnh nhiệm kỳ 2021-2026. Sáng 17/11, HĐNDtỉnh Thái Nguyênbầu ông Vương Quốc Tuấn, Phó bí thư Tỉnh ủy, làm Chủ tịch UBND tỉnh với tất cả đại biểu có mặt tán thành. Phát biểu nhậm chức, ông Tuấn nói sẽ tận tâm vì lợi ích nhân dân, thúc đẩy tinh thần dấn thân, sáng tạo và trách nhiệm trong bộ máy. Ông Vương Quốc Tuấn 48 tuổi, quê Bắc Ninh, tiến sĩ Quản trị kinh doanh, Ủy viên dự khuyết Trung ương khóa 13. Ông từng làm Bí thư Tỉnh đoàn, Bí thư Thành ủy Bắc Ninh (cũ), Phó chủ tịch rồi Chủ tịch UBND tỉnh Bắc Ninh trước khi địa phương này sáp nhập với Bắc Giang. Tháng 7/2025, ông được bổ nhiệm làm Chủ tịch UBND tỉnh Bắc Ninh mới; hai ngày trước khi được bầu ở Thái Nguyên, ông được điều động giữ chức Phó bí thư Tỉnh ủy Thái Nguyên. Tỉnh Thái Nguyên mới được hình thành trên cơ sở sáp nhập Thái Nguyên (cũ) và Bắc Kạn, rộng 8.375 km2, dân số 1,8 triệu. Đại hội Đảng bộ tỉnh cuối tháng 9 đặt mục tiêu đưa Thái Nguyên trở thành trung tâm công nghiệp hiện đại, thu nhập trung bình cao trước 2030 và là tỉnh phát triển, thu nhập cao trước 2045. Cũng trong sáng 17/11, HĐNDtỉnh Bắc Ninhbầu ông Phạm Hoàng Sơn, Phó bí thư Tỉnh ủy, làm Chủ tịch UBND tỉnh với tỷ lệ tán thành tuyệt đối. Nhận nhiệm vụ, ông Sơn nói Bắc Ninh đang đứng trước vận hội lớn song nhiều thách thức. Ông cam kết cải cách mạnh mẽ thủ tục hành chính, cải thiện môi trường đầu tư theo hướng ""nhanh nhất, thực chất nhất"", giảm chi phí cho người dân và doanh nghiệp, phấn đấu đưa Bắc Ninh vào nhóm dẫn đầu cả nước về thu hút đầu tư. Ông Sơn cho biết tỉnh sẽ ưu tiên hạ tầng giao thông kết nối liên tỉnh, liên vùng và quốc gia; đồng thời nâng cao hạ tầng xã hội, y tế, giáo dục, không gian công cộng để xứng tầm đô thị trực thuộc Trung ương. Ông Phạm Hoàng Sơn 49 tuổi, quê Thái Nguyên; thạc sĩ Khoa học nông nghiệp, từng giữ các chức vụ Trưởng ban Tổ chức Tỉnh ủy, Phó bí thư thường trực, Chủ tịch HĐND tỉnh Thái Nguyên (cũ). Khi Thái Nguyên sáp nhập với Bắc Kạn hồi tháng 7, ông được bổ nhiệm làm Chủ tịch UBND tỉnh Thái Nguyên mới; và được điều động giữ chức Phó bí thư Tỉnh ủy Bắc Ninh ba ngày trước. Bắc Ninh mới được hình thành trên cơ sở sáp nhập tỉnh Bắc Giang và Bắc Ninh (cũ), diện tích 4.718 km2, dân số 3,6 triệu. Đại hội Đảng bộ tỉnh cuối tháng 9 đặt mục tiêu đưa địa phương trở thành thành phố trực thuộc Trung ương trước 2030, hướng tới một đô thị xanh, văn minh, đậm bản sắc Kinh Bắc vào 2045. Chiều cùng ngày, HĐNDtỉnh Quảng Trịbầu ông Lê Hồng Vinh (nguyên Chủ tịch UBND tỉnh Nghệ An) giữ chức Chủ tịch UBND tỉnh nhiệm kỳ 2021-2026, với 100% đại biểu có mặt tán thành. Phát biểu sau khi được bầu, ông Vinh cho biết sẽ cùng tập thể UBND tỉnh kế thừa và phát huy kết quả của các thế hệ lãnh đạo, đồng thời nghiên cứu, triển khai hiệu quả các chủ trương của Đảng và chính sách của Nhà nước. Ông khẳng định sẽ làm việc tận tâm, tận lực, đề cao tinh thần đoàn kết và trách nhiệm để hoàn thành nhiệm vụ được giao. Ông Lê Hồng Vinh 51 tuổi, quê Nghệ An, thạc sĩ Quản lý khoa học công nghệ. Ông từng giữ các chức vụ Bí thư Huyện ủy Anh Sơn; Chủ nhiệm Ủy ban Kiểm tra Tỉnh ủy; Trưởng ban Kinh tế - Ngân sách HĐND tỉnh; Phó chủ tịch thường trực, Phó bí thư Tỉnh ủy Nghệ An. Tháng 1/2025, ông được bầu làm Chủ tịch UBND tỉnh Nghệ An. Đại hội Đảng bộ tỉnh Quảng Trị giữa tháng 10 đặt mục tiêu tăng trưởng GRDP 9-10% mỗi năm; thu ngân sách giai đoạn 2026-2030 đạt 75.000-80.000 tỷ đồng. Đến năm 2030, GRDP của tỉnh theo giá hiện hành đạt 227.000-238.000 tỷ đồng, kinh tế số đóng góp 15-20%, GRDP bình quân đầu người 137-145 triệu đồng, 100% người dân tham gia bảo hiểm y tế. Vũ Tuân - Đắc Thành"
VN Express,https://vnexpress.net/chu-tich-ca-mau-lam-chu-tich-dong-thap-4964956.html,Chính trị,"chủ tịch Đồng Tháp,chủ tịch Cà Mau","Thứ hai, 17/11/2025, 15:55 (GMT+7)",Chủ tịch Cà Mau làm Chủ tịch Đồng Tháp,"Ông Phạm Thành Ngại, nguyên Chủ tịch UBND tỉnh Cà Mau được bầu làm Chủ tịch UBND tỉnh Đồng Tháp, nhiệm kỳ 2021-2026, thay ông Trần Trí Quang. Chiều 17/11, ông Phạm Thành Ngại, Phó bí thư Tỉnh ủy Đồng Tháp đã được HĐND tỉnh bầu làm Chủ tịch UBND tỉnh với 100% đại biểu tán thành. Trước đó, cơ quan chức năng đã công bố quyết định của Ban Bí thư điều động, phân công ông ông Ngại giữ chức Phó bí thư Tỉnh ủy Đồng Tháp và giới thiệu để HĐND bầu làm Chủ tịch UBND tỉnh. Ông Phạm Thành Ngại, 54 tuổi, quê tỉnh Cà Mau, trình độ thạc sĩ Luật kinh tế, từng kinh qua chức vụ: Chánh văn phòng Tỉnh ủy, Bí thư Huyện ủy Năm Căn, Bí thư Thành ủy TP Cà Mau, Phó bí thư thường trực Tỉnh ủy, Chủ tịch UBND tỉnh Cà Mau. Việc điều động ông Ngại nhằm thực hiện chủ trương của Bộ Chính trị, Ban Bí thư về bố trí tất cả chủ tịch tỉnh, thành không phải người địa phương. Sau sáp nhập với Tiền Giang, Đồng Tháp rộng 6.000 km2, dân số hơn 4,2 triệu. Nhiệm kỳ vừa qua, tỉnh đạt và vượt 17/23 chỉ tiêu nghị quyết đề ra, GRDP bình quân 5 năm đạt 5,51%, thu nhập bình quân đầu người ước đạt 85,5 triệu đồng, thu ngân sách tăng bình quân hơn 2% mỗi năm. Năng lực cạnh tranh của tỉnh thuộc nhóm dẫn đầu cả nước. Nhiệm kỳ mới, Đồng Tháp đặt mục tiêu tăng trưởng kinh tế bình quân 5 năm đạt từ 9%; thu nhập bình quân đầu người đạt 115-120 triệu đồng, đến năm 2030 không còn hộ nghèo. Hoàng Nam - Ngọc Tài"
VN Express,https://vnexpress.net/tp-hcm-co-tan-chu-nhiem-uy-ban-kiem-tra-thanh-uy-4964998.html,Chính trị,"nhân sự lãnh đạo TP HCM,Uỷ ban Kiểm tra TP HCM","Thứ hai, 17/11/2025, 15:44 (GMT+7)",TP HCM có tân Chủ nhiệm Uỷ ban Kiểm tra Thành ủy,"Ông Dương Trọng Hiếu, Phó ban tổ chức Thành ủy được chuẩn y làm Chủ nhiệm Ủy ban Kiểm tra thay ông Võ Văn Dũng được điều động làm Bí thư phường Vũng Tàu. Các quyết định về cán bộ được Bí thư Thành ủy TP HCM Trần Lưu Quang trao cho ông Hiếu và ông Dũng chiều 17/11. Tân Chủ nhiệm Uỷ ban Kiểm tra Thành ủy Dương Trọng Hiếu, 49 tuổi, quê tỉnh Quảng Nam (cũ), trình độ thạc sỹ Quản lý Tài nguyên và Môi trường. Ông Hiếu từng là Phó bí thư Huyện ủy Đất Đỏ, Bí thư Huyện ủy Xuyên Mộc, Trưởng ban Tổ chức Tỉnh ủy Bà Rịa - Vũng Tàu (cũ). Khi Bà Rịa - Vũng Tàu sáp nhập với TP HCM ngày 1/7, ông Hiếu được chỉ định làm Phó ban Tổ chức Thành ủy TP HCM. Ông Võ Văn Dũng, 51 tuổi, đảm nhiệm chức Chủ nhiệm Ủy ban Kiểm tra Thành ủy hơn 5 tháng, nay được phân công tham gia Ban Chấp hành, Ban Thường vụ và giữ chức Bí thư Đảng ủy phường Vũng Tàu. Ông Dũng quê TP HCM, trình độ kỹ sư Xây dựng, thạc sĩ Luật; từng là Giám đốc Sở Xây dựng tỉnh Bà Rịa - Vũng Tàu (cũ), Bí thư Huyện ủy Long Điền và Chủ nhiệm Ủy ban Kiểm tra Tỉnh ủy. Sau sáp nhập, ông tiếp tục giữ vị trí Chủ nhiệm Ủy ban Kiểm tra Thành ủy trước khi được điều động. Ủy ban Kiểm tra Thành ủy TP HCM là cơ quan chuyên trách ""gác cổng"" về kỷ luật của Đảng bộ thành phố, thực hiện kiểm tra tổ chức Đảng và đảng viên khi có dấu hiệu vi phạm; giám sát việc chấp hành nghị quyết, quy định, phẩm chất, lối sống của cán bộ, kể cả người thuộc diện Thành ủy quản lý. Cơ quan này cũng thẩm tra việc kiểm tra - giám sát của cấp dưới, xem xét tố cáo, giải quyết khiếu nại và quyết định hoặc đề xuất kỷ luật theo thẩm quyền. Ngoài chức năng kiểm tra, cơ quan cũng tham mưu Thành ủy xây dựng chương trình kiểm tra - giám sát hằng năm và tham dự các cuộc họp Ban Thường vụ, Ban Chấp hành Đảng bộ để đưa ra ý kiến chuyên môn. Ủy ban Kiểm tra Thành ủy TP HCM hiện có 16 thành viên, ngoài tân chủ nhiệm vừa được Ban Bí thư chuẩn y, Ủy ban còn 7 cấp phó 8 ủy viên. Lê Tuyết"
VN Express,https://vnexpress.net/hang-rong-new-york-tap-nap-tro-lai-sau-khi-bi-ice-truy-quet-4964979.html,Bắc Mỹ,"Mỹ,thành phố New York,Chinatown,Phố Canal,hàng rong ở Mỹ","Thứ ba, 18/11/2025, 03:00 (GMT+7)",Hàng rong New York tấp nập trở lại sau khi bị ICE truy quét,"Phố Canal ở Chinatown, New York giờ đây tràn ngập người bán hàng rong, chưa đầy một tháng sau chiến dịch truy quét của ICE. Phố Canal ở Chinatown, nơi có ""nền kinh tế vỉa hè"" nở rộ với vô số sạp bán hàng rong, từng trở nên vắng lặng khi các đặc vụ Cơ quan Thực thi Di trú và Hải quan (ICE) tiến hành chiến dịch truy quét lớn hồi cuối tháng 10, khiến các tiểu thương quyết định ""nằm im thở khẽ"". Nhưng chưa đầy một tháng sau, khi mùa lễ Tạ ơn và Giáng sinh đến gần, con phố tấp nập trở lại với hàng loạt sạp bày bán túi xách, đồ điện tử, trang sức nhái ngay trên vỉa hè. Hôm 16/11, hơn 100 tiểu thương bày hàng trên phố, thu hút hàng dài khách mua. ""Họ không sợ hãi nữa, họ phải làm việc để kiếm sống. Tất cả chỉ đang làm công việc của mình"", Diango, 56 tuổi, cựu tiểu thương hiện làm cố vấn cho những người bán hàng trẻ tuổi, nói. Ông Diango cho biết thêm bán rong thời nay khó khăn hơn nhiều so với 20 năm trước, thời điểm ông có thể kiếm được tới 1.000 USD mỗi ngày. ""Khi đó vỉa hè sạch sẽ hơn, hàng hóa cũng chất lượng hơn, còn giờ đã đi xuống. Nhiều tiểu thương, vốn là người nhập cư gốc Phi hoặc Á, hiện kiếm không đến 100 USD một ngày"", ông kể. Khi xe tuần tra của Sở Cảnh sát New York (NYPD) chạy ngang qua, bật còi hụ, hàng chục người đàn ông bắt đầu cuống cuồng gấp bàn ghế, gom hàng hóa vào vải bạt, xe đẩy rồi vội vã tản xuống vỉa hè hoặc lao xuống ga tàu điện Canal Street. Nhưng chỉ vài phút sau khi cảnh sát đi khỏi, các tiểu thương nhanh chóng bày lại hàng như cũ. Sowmmo, nhân viên cửa hàng quà tặng trên con phố, cho rằng hoạt động tuần tra của cảnh sát chỉ như ""bắt cóc bỏ đĩa"" và chính quyền khó có thể làm gì để ngăn chặn hoạt động này. ""Chẳng có cách nào cả. Họ sẽ ở đây mãi, nếu không bị truy quét liên tục"", Sowmmo nói. Bộ An ninh Nội địa Mỹ (DHS) cho biết chính quyền liên bang ""không tiết lộ các chiến dịch truy quét trong tương lai"" với những người bán hàng rong ở New York, song cảnh báo các tiểu thương, đặc biệt là những người nhập cư vào Mỹ bất hợp pháp, ""cứ chờ xem chuyện gì xảy ra"". ""Chúng tôi có thông điệp rõ ràng gửi tới tất cả người nhập cư bất hợp pháp trong nước: Hãy rời đi ngay. Nếu không, chúng tôi sẽ tìm bắt và họ sẽ không bao giờ quay lại Mỹ được nữa"", phát ngôn viên DHS nói. Đức Trung(TheoNY Post, AP)"
VN Express,https://vnexpress.net/my-xac-dinh-nguyen-nhan-gia-dinh-goc-viet-tu-vong-tai-nha-rieng-4964823.html,Bắc Mỹ,"Việt,thành phố San Francisco","Thứ hai, 17/11/2025, 11:24 (GMT+7)",Mỹ xác định nguyên nhân gia đình gốc Việt tử vong tại nhà riêng,"Kết quả khám nghiệm cho thấy bà Truong, người đang điều trị trầm cảm, đã tự sát sau khi bắn chết chồng và hai con gái tại nhà riêng ở California. Truyền thông Mỹ hồi cuối tuần dẫn báo cáo khám nghiệm tử thi từ Văn phòng Giám định Y khoa thành phố San Francisco, xác nhận bà Paula Truong, 52 tuổi, sống tại căn nhà trên đường Monterey, chết do tự sát, trong khi chồng và hai con bị sát hại. Thi thể bà Truong được tìm thấy trong tư thể treo cổ ở garage. Ông Thomas Ocheltree, 57 tuổi, chồng bà Truong, bị bắn hai phát vào ngực và một phát vào cổ. Thi thể ông Ocheltree được tìm thấy phủ chăn, tay phải cầm hờ một khẩu súng. Hai con gái 9 và 12 tuổi của vợ chồng bà Truong thiệt mạng do trúng đạn trong hai phòng ngủ. Giới chức xác định ông Ocheltree và hai con đều bị bắn chết. Kết quả xét nghiệm độc chất cho thấy bà Truong đang sử dụng trazodone, thuốc điều trị trầm cảm nặng, cùng thuốc giảm đau oxycodone. Bé gái 9 tuổi dương tính với thuốc giảm đau buprenorphine. Giới chức cũng phát hiện thuốc kháng histamine có tác dụng an thần trong thi thể bé gái 12 tuổi. Người phát hiện ra thi thể 4 người ngày 8/10 là Robert Ocheltree, anh trai của ông Thomas Ocheltree. Ông Robert cho biết đã không nghe được tin tức gì từ em trai trong 6 ngày, rồi quyết định đến nhà kiểm tra vào ngày 6/10. Bà Truong hôm đó đã mở cửa, nhưng không mời anh rể vào nhà, nói rằng chồng đang đi chơi golf và làm mất điện thoại. Ông Robert nhìn thấy rèm cửa đóng kín. Ngày 7/10, Robert nhận được tin nhắn từ bà Truong, đề nghị ông giúp đỡ Ocheltree. ""Anh ấy không còn là chính mình nữa, em và các cháu đều rất sợ hãi"", Truong nhắn tin cho Robert. Sáng 8/10, Robert gọi cảnh sát, nhưng các sĩ quan đã rời đi khi gõ cửa nhà bà Truong mà không thấy ai phản hồi. Ông Robert đã quyết định quay lại nhà em trai, dùng kìm đập vỡ kính và đột nhập căn nhà, phát hiện thi thể em trai, em dâu cùng hai cháu lúc 13h30. Truyền thông Mỹ cho biết gia đình bà Truong đã phải đối mặt với những khó khăn tài chính nghiêm trọng do loạt thất bại liên tiếp trong hoạt động kinh doanh, có thể lànguyên nhânđẩy gia đình đến đường cùng. Bà Paula Truong di cư từ Việt Nam tới Mỹ, kết hôn với ông Ocheltree năm 2006. Bà từng sở hữu loạt cơ sở cà phê ở Mỹ, nhưng hoạt động kinh doanh không hiệu quả sau Covid-19, khiến bà lâm vào cảnh thua lỗ, vỡ nợ và bị ngân hàng tịch thu nhà. Hai vợ chồng đã phải thuê lại chính căn nhà mà họ từng sở hữu. Đức Trung(TheoKRON 4, KTVU)"
VN Express,https://vnexpress.net/thanh-pho-my-chan-dong-vi-dot-bat-bo-nhap-cu-moi-4964742.html,Bắc Mỹ,"Mỹ,thành phố Charlotte","Thứ hai, 17/11/2025, 09:53 (GMT+7)",Thành phố Mỹ chấn động vì đợt bắt bớ nhập cư mới,"Đặc vụ biên phòng Mỹ mở chiến dịch truy quét nhập cư ở Charlotte, bắt hơn 80 người chỉ trong vài giờ, gây rúng động cư dân thành phố. Gregory Bovino, quan chức Biên phòng Mỹ, ngày 16/11 thông báo các đặc vụ liên bang đã triển khai chiến dịch Mạng lưới Charlotte, bắt 81 người ở thành phố Charlotte, bang Bắc Carolina trong khoảng 5 giờ vào ngày 15/11, ngày đầu tiên hoạt động tại thành phố này. ""Nhiều người bị bắt có tiền án tiền sự, vi phạm luật nhập cư"", ông Bovino, từng chỉ huy các chiến dịch truy quét nhập cư tại Los Angeles và Chicago trước khi được điều đến Charlotte, cho biết. Biên phòng Mỹ cùng Cơ quan Thực thi Di trú và Hải quan (ICE) không trả lời yêu cầu bình luận. Bộ An ninh Nội địa (DHS) cho biết cuộc truy quét diễn ra vì chính quyền địa phương từ chối phối hợp, khi bác bỏ gần 1.400 yêu cầu của ICE để giữ các nghi phạm thêm tối đa 48 giờ so với thời điểm họ đáng lẽ được thả. Thành phố Charlotte có hơn 900.000 dân, trong đó hơn 150.000 người sinh ra ở nước ngoài. Khi tiến hành chiến dịch truy quét, các đặc vụ liên bang bịt mặt xuất hiện trên khắp thành phố và các vùng ngoại ô, bắt người dân dọc theo các tuyến phố, bãi đậu xe, bên ngoài nhà hàng và nhiều nơi khác, thậm chí ở nhà thờ. Chiến dịch truy quét mới gây rúng động khu vực, đánh dấu sự leo thang trong chính sách kiểm soát người nhập cư của chính quyền Tổng thống Mỹ Donald Trump. Hàng loạt doanh nghiệp đã phải đóng cửa vào cuối tuần, người dân tập trung trên đường phố biểu tình, nhiều người thổi còi để cảnh báo hàng xóm về sự hiện diện của các đặc vụ. Tại Camino, khu vực đông đúc người Latin ở Charlotte, nhiều người không rời nhà để đi học, đi làm hay khám bệnh vì quá sợ hãi. Giới chức thành phố cho biết chiến dịch gây sợ hãi, bất ổn ""không cần thiết"", khiến những người ""không có tiền án"" bị bắt giam và kích động xô xát giữa người biểu tình với các đặc vụ liên bang. Thị trưởng Charlotte Vi Lyles, đảng viên Dân chủ, và các ủy viên thành phố đã kêu gọi người dân tìm kiếm giúp đỡ từ Sở Cảnh sát Thành phố Charlotte và Hạt Mecklenburg, những đơn vị không tham gia vào các cuộc đột kích của giới chức liên bang. Willy Aceituno, người Mỹ gốc Honduras 46 tuổi, đang trên đường đi làm vào ngày 15/11 thì thấy ""rất nhiều người Latin đang bỏ chạy, đằng sau là các đặc vụ biên phòng truy đuổi"". Bản thân anh cũng bị các đặc vụ chặn lại hai lần. Trong lần chạm trán thứ hai, anh cho biết các đặc vụ đã đập vỡ kính xe, ép anh rời phương tiện và khống chế anh trên mặt đất. ""Tôi nói với họ: 'Tôi là công dân Mỹ''', Aceituno kể lại. Anh được thả sau khi xuất trình giấy tờ. Kể từ khi lên nắm quyền, Tổng thống Donald Trump đã thúc đẩy chiến dịch truy quét nhập cư quy mô lớn, chủ yếu nhắm vào các thành phố do phe Dân chủ lãnh đạo. Ông Trump ngày 2/11 cho rằng những cuộc đột kích nhập cư vẫn chưa đủ mạnh, cam kết sẽ tiếp tục đẩy mạnh truy quét trên toàn quốc. Đức Trung(TheoReuters, Guardian, CNN)"
