Source,URL,Category,Keyword,Time,Title,Content
Tuoi tre,https://tuoitre.vn/bac-bo-hung-sieu-dong-hiem-xay-ra-quang-ninh-co-gio-giat-cap-10-20250719230553259.htm,,"vịnh Hạ Long,chìm tàu du lịch,mưa dông Hà Nội,Quảng Ninh,Dự báo thời tiết",20/07/2025 00:04 GMT+7,"Bắc Bộ hứng siêu dông hiếm xảy ra, Quảng Ninh có gió giật cấp 10","Một cây cổ thụ đổ chắn ngang đường đè lên ô tô đang di chuyển trên đường phố Hà Nội chiều 19-7 - Ảnh: H.Q. Sau ba ngày nắng nóng khá gay gắt, chiều 19-7, nhiều tỉnh, thành phố ở Bắc Bộ như Quảng Ninh, Hà Nội, Phú Thọ, Lào Cai, Thái Nguyên, Hải Phòng, Bắc Ninh, Hưng Yên, Ninh Bình... đã xuất hiệnmưa dôngdiện rộng, nhiều nơi có dông mạnh, lốc và gió giật mạnh, cục bộ có nơi mưa to đến rất to. Đặc biệt tại Quảng Ninh, vào khoảng 13h30, cơn dông kèm theo gió giật mạnh khiến một tàu du lịch bị lật trên vịnh Hạ Long. Tại Hà Nội cơn dông kéo đến khoảng 16h cũng gây ra gió giật mạnh khiến nhiều cây cối bị đổ, cột điện đổ đè lên nhiều ô tô đang di chuyển, thậm chí một số khu chung cư bị sập trần thạch cao vì gió lùa. Nhiều người đi xe máy trên đường bị gió quật ngã... Đêm 19-7, Trung tâm Dự báo khí tượng thủy văn quốc gia cho biết trong cơn dông chiều nay, một số nơi có gió giật mạnh như trạm Cửa Ông (Quảng Ninh) ghi nhận gió mạnh 16m/s (cấp 7), Bãi Cháy (Quảng Ninh) gió giật 26m/s (cấp 10), Bạch Long Vĩ (Hải Phòng) gió giật 18m/s (cấp 8). Thời điểm này, tâm bão số 3 (Wipha) đang cách vịnh Hạ Long trên 1.000km về phía đông, hoàn lưu tính từ tâm bão khoảng 200 - 300km, sức gió mạnh nhất 102km/h (cấp 10), giật cấp 12 và chưa ảnh hưởng trực tiếp đến vịnh Bắc Bộ. Theo cơ quan khí tượng, nguyên nhân của hiện tượng mưa dông mạnh chiều nay ở Bắc Bộ và vịnh Bắc Bộ là do ảnh hưởng của dải hội tụ nhiệt đới có trục đi qua khu vực Bắc Bộ, kết hợp với điều kiện nhiệt độ ở khu vực Bắc Bộ tăng cao trong 3 ngày qua, khiến dòng thăng mạnh trong điều kiện bất ổn định của khí quyển mạnh mẽ, gây mưa dông mạnh. Đây là một hệ thống siêu dông vùng nhiệt đới (Mesoscale Convective Systems – MCSs trong vùng nhiệt đới) là những tổ hợp mây dông quy mô trung bình, thường gây mưa rất to kèm theo cáchiện tượng thời tiếtnguy hiểm. Hệ thống siêu dông có đường kính từ vài km đến vài trăm km. Gồm nhiều cụm mây dông phát triển kết hợp lại thành một hệ thống lớn. Có thể tồn tại trong nhiều giờ, thậm chí 12 - 24 giờ, mạnh hơn và lâu hơn dông đơn lẻ. Video mưa dông quật ngã nhiều người đi xe máy, xô đổ cây cối, cuốn bay mái tôn ở Hà Nội Liên quan đến công tác dự báo cảnh báo trước những cơn dông, Trung tâm Dự báo khí tượng thủy văn quốc gia cho biết trong bản tin dự báo thời tiết biển cho ngày và đêm 19-7 phát hành lúc 4h30 sáng nay, trung tâm đã dự báo vùng biển vịnh Bắc Bộ ngày có mưa rào và dông vài nơi, đêm có mưa rào và dông rải rác. Trong mưa dông có khả năng xảy ra lốc xoáy và gió giật mạnh. Đài Khí tượng thủy văn tỉnh Quảng Ninh đã thực hiện đầy đủ các quy trình, quy định về dự báo, cảnh báo, ban hành và truyền tin dự báo, cảnh báo dông, lốc, sét, mưa đá và mưa lớn cục bộ kịp thời, đầy đủ đến các địa chỉ theo quy định. Cụ thể, qua theo dõi ảnh radar thời tiết, khi phát hiện có mây đối lưu đang phát triển, đài đã ban hành hai bản tin vào lúc 11h45 và 13h30 ngày 19-7. Đặc biệt, tại bản tin phát lúc 13h30, đài đã cảnh báo có mưa rào và dông cho các phường, xã trong tỉnh, trong đó có phường Hạ Long. Ngoài ra, trong bản tin dự báo, cảnh báo hải văn thời hạn đến 10 ngày phát lúc 15h30 chiều ngày 1-7, đài đã dự báo cho ngày 19-7 ở vùng biển vịnh Bắc Bộ, trong đó có dự báo cho vùng biển Bãi Cháy bao gồm cả vùng biển khu vực vịnh Hạ Long ngày có mưa vài nơi, đêm có mưa rào và dông, dự báo biển động. Do ảnh hưởng của bão số 3, từ đêm ngày 19 và ngày 20-7, khu vực vịnh Bắc Bộ, bắc và giữa Biển Đông (bao gồm vùng biển đặc khu Hoàng Sa) có mưa rào và dông, riêng vùng biển phía bắc khu vực bắc Biển Đông có mưa bão, vịnh Thái Lan có mưa rào và dông rải rác. Từ đêm ngày 20 và ngày 21-7, vùng biển phía bắc khu vực bắc Biển Đông có gió mạnh cấp 8-9, vùng gần tâm bão đi qua cấp 10-12, giật cấp 15, sóng biển cao 4-6m, biển động dữ dội. Vùng biển phía đông khu vực bắc vịnh Bắc Bộ từ ngày 21-7 có gió mạnh dần lên cấp 6-7, sau tăng lên cấp 8-9, vùng gần tâm bão cấp 10-11, giật cấp 13, sóng biển cao từ 2-4m, vùng gần tâm 3-5m, biển động dữ dội. Đến 22h30, cập nhật từ các lực lượng chức năng cho hay đã vớt được hơn 30 thi thể."
Tuoi tre,https://tuoitre.vn/tang-bang-khen-cho-thanh-nien-cuu-chau-be-truoc-mui-tau-hoa-20250719172145819.htm,,"cứu người tự tử,Tàu hoả,Tai nạn đường sắt,hành động dũng cảm,Hải Phòng",19/07/2025 17:49 GMT+7,Tặng bằng khen cho thanh niên cứu cháu bé trước mũi tàu hỏa,"Bí thư Thành Đoàn Hải Phòng trao bằng khen cho anh Trần Văn Nam - Ảnh: Thành đoàn Hải Phòng Chị Nguyễn Thị Thủy - bí thưThành Đoàn Hải Phòng, đã đến nhà thăm hỏi, động viên và trao bằng khen cho thanh niên đã dũng cảm cứu cháu bé đang loạng choạng sát đường ray khi tàu hỏa đang lao đến. Trước đó, chiều tối 9-7, anh Trần Văn Nam (ngụ ở thôn Lôi Xá, xã Tuệ Tĩnh) đi làm về qua ngã tư giao cắt với đường sắt tại phường Việt Hòa (TP Hải Phòng) thì có 1 cháu bé đang loạng choạng trước đường ray. Lúc đó tàu hỏa đang lao đến, Nam bỏ xe máy lao lên kéo cháu bé lùi ra xa, tránh được một tình huống rất nguy hiểm. ""Cháu bé được an toàn là tôi vui rồi. Trong khoảnh khắc như vậy, ai vào trường hợp của tôi cũng sẽ làm như vậy thôi"", anh Nam chia sẻ. Sau khi sự việc xảy ra, người thân của cháu bé đến khu vực giao cắt với đường tàu tại thôn Cao Xá, phường Việt Hòa xin trích xuất lại hình ảnh trong camera an ninh của người dân để tìm ân nhân. Gia đình cháu bé tìm đến nhà anh Trần Văn Nam để cảm ơn. Chị Nguyễn Thị Thủy khẳng định hành động của anh Nam không chỉ cứu một sinh mạng, mà còn góp phần lan tỏa thông điệp về lòng nhân ái, trách nhiệm công dân và tinh thần xả thân vì cộng đồng. Đây là những giá trị rất cần được nhân rộng trong giới trẻ hiện nay. Công an Hà Nội thông tin 9h12 ngày 13-7, cơ quan chức năng nhận được tin báo 2 người đi xe máy mất lái rơi xuống vực tại Vườn quốc gia Ba Vì."
Tuoi tre,https://tuoitre.vn/dan-khong-the-tim-duoc-nhieu-quyet-dinh-phe-duyet-dieu-chinh-quy-hoach-o-nha-trang-20250719201917062.htm,,"Khánh Hòa,Nha Trang,Luật Ban hành văn bản quy phạm pháp luật,sông Quán Trường,dự án Cồn Tân Lập Nha Trang",19/07/2025 21:02 GMT+7,"Dân không thể tìm được nhiều quyết định phê duyệt, điều chỉnh quy hoạch ở Nha Trang","Sơ đồ quy hoạch dự án Khu đô thị hỗn hợp thành phố Nha Trang (khu vực sông Tắc và sông Quán Trường), tỉnh Khánh Hòa (chụp lại hồ sơ quy hoạch dự án) - Ảnh: PHAN SÔNG NGÂN Chiều 19-7, phóng viênTuổi Trẻ Onlineđã gọi điện đến lãnh đạo Trung tâm Công báo và Cổng thông tin điện tử tỉnh Khánh Hòa để tìm hiểu về việc nhiều bạn đọc là công dân, luật sư ở Nha Trang phản ánh thắc mắc về việc không thể tìm được nhiều quyết định, quy hoạch trên các địa bàn Nha Trang mà UBND tỉnh Khánh Hòa và UBND TP Nha Trang (trước khi chấm dứt tồn tại) đã phê duyệt. Còn theo kế hoạch về việc tổ chức công bố công khai các đồ án quy hoạch trên địa bàn thành phố Nha Trang (cũ), do Chủ tịch UBND TP Nha Trang Trần Minh Chiến ký ban hành ngày 20-6-2025, có tất cả 16 đồ án gồm các quy hoạch phân khu (tỉ lệ 1/2000), quy hoạch chi tiết (tỉ lệ 1/500) hoặc các đồ án điều chỉnh quy hoạch phân khu, điều chỉnh quy hoạch chi tiết đã được phê duyệt, ban hành. Đó là 16 đồ án quy hoạch hoặc điều chỉnh các quy hoạch có liên quan đến môi trường, cảnh quan, ảnh hưởng rất nhiều đến quyền lợi, cuộc sống của hàng vạn cư dân, tổ chức, doanh nghiệp... sinh sống, làm ăn tại các khu vực TP Nha Trang cũ. Mục đích của việc công bố công khai các quy hoạch trên để ""cho các tổ chức, cá nhân và cộng đồng dân cư được biết, quản lý, giám sát và triển khai thực hiện theo quy hoạch đã được phê duyệt"". Cũng theo kế hoạch trên của UBND TP Nha Trang, các hình thức công bố đã được quy định, gồm: tổ chức hội nghị công bố các đồ án quy hoạch đã nêu, niêm yết công khai thông tin quy hoạch tại trụ sở UBND các xã, phường và đăng tải thông tin về quy hoạch trên các phương tiện thông tin đại chúng và Cổng thông tin điện tử TP Nha Trang. Tất cả quyết định của UBND tỉnh Khánh Hòa và của UBND TP Nha Trang đã phê duyệt các quy hoạch trên đều là văn bản quy phạm pháp luật, hoàn toàn không phải là văn bản mật. Trả lời cho phóng viênTuổi Trẻ Online,ông Mai Thành Long - giám đốc Trung tâm Công báo và Cổng thông tin điện tử tỉnh Khánh Hòa - cho biết thực tế là khi nhận được các văn bản quy phạm pháp luật do các cơ quan gởi đến thì trung tâm luôn xử lý nhanh và đăng tải công khai ngay trong ngày chứ không đợi đến cuối thời hạn được quy định. Song, đối với các quyết định phê duyệt quy hoạch, điều chỉnh quy hoạch trên địa bàn Nha Trang đã được ban hành nhưng công dân không tìm thấy được là do Trung tâm Công báo và Cổng thông tin điện tử tỉnh Khánh Hòa chưa nhận được các văn bản đó, vì các cơ quan ban hành chưa gởi đến để đăng tải công khai theo quy định. Theo kế hoạch của UBND TP Nha Trang đã ban hành, trong 16 đồ án quy hoạch phân khu (do UBND tỉnh quyết định phê duyệt) và quy hoạch chi tiết (do UBND TP Nha Trang phê duyệt, trước khi chấm dứt hoạt động từ ngày 1-7-2025), có 7 đồ án quy hoạch phân khu (1/2000; theo xã, phường cũ của TP Nha Trang). Đó là  2 đồ án quy hoạch phân khu, gồm: Khu vực núi Chín Khúc TP Nha Trang và huyện Diên Khánh; Khu dân sông Kim Bồng thuộc các phường Phương Sơn - Phương Sài - Vạn Thắng - Ngọc Hiệp. 5 đồ án điều chỉnh quy hoạch phân khu, gồm: Khu dân cư phía Tây đường Lê Hồng Phong, TP Nha Trang; Khu dân cư xã Phước Đồng;Khu dân cư phường Xương Huân - Vạn Thạnh; Khu dân cư Đường Đệ, phường Vĩnh Hòa và khu vực Miếu Cậu - bắc Bãi Dong, xã Phước Đồng. Trong 9 đồ án quy hoạch chi tiết tại Nha Trang đã được phê duyệt, gồm 3 đồ án điều chỉnh quy hoạch chi tiết các dự án Champarama Resort & Spa, phường Vĩnh Hòa, dự án Khu phức hợp Hòn Một, phường Vĩnh Nguyên và dự án Khu biệt thự biển và dịch vụ du lịch Anh Nguyễn - Nha Trang. 6 đồ án quy hoạch tiết của các dự án: Khu trung tâm hành chính tỉnh Khánh Hòa, tại xã Vĩnh Thái; một phần phân khu Vũng Ngán, tại đảo Hòn Tre, phường Vĩnh Nguyên; một phần phân khu Bãi Rạn, tại đảo Hòn Tre; Khu đô thị hỗn hợp thành phố Nha Trang; Khu phức hợp sân golf Vinpearl Hòn Tre; Trụ sở làm việc Công an tỉnh. UBND tỉnh Khánh Hòa quyết định phê duyệt đồ án điều chỉnh quy hoạch phân khu (1/2000) khu dân cư các phường Xương Huân - Vạn Thạnh, TP Nha Trang (cũ), trước 10 ngày sắp xếp lại các phường theo đơn vị hành chính mới. "
Tuoi tre,https://tuoitre.vn/soc-2-tran-dau-giai-u21-quoc-gia-co-21-the-vang-va-3-the-do-20250719172552815.htm,,"u21 sông lam nghệ an,U21 quốc gia,sân bà rịa",19/07/2025 21:14 GMT+7,Sốc: 2 trận đấu Giải U21 quốc gia có 21 thẻ vàng và 3 thẻ đỏ,"Trận đấu căng thẳng giữa U21 SHB Đà Nẵng (trái) và PVF-CAND - Ảnh: VFF Chiều 19-7, Vòng chung kếtGiải U21 quốc gia2025 đã khai mạc tại sân Bà Rịa với hai trận đấu của bảng A. Ở trận đầu tiên, SHB Đà Nẵng đã thắng PVF-CAND 1-0 nhờ bàn thắng duy nhất của Thanh Nhân ở phút 83. Nhưng điều đáng nói hơn cả là trận đấu này có đến 11 thẻ vàng và 2 thẻ đỏ vì sự căng thẳng của cầu thủ hai đội. Ngay phút 27, trọng tài đã phải rút ra 3 thẻ vàng cho Nguyễn Văn Bách, Trần Hoàng Khanh (PVF-CAND) và Trần Nhật Đông (SHB Đà Nẵng). Hay phút 90+5, trọng tài phải rút hai thẻ vàng cho Huỳnh Trần Quốc Bảo và Nguyễn Công Tuấn Anh cùng của đội bóng sông Hàn. Chung cuộc, SHB Đà Nẵng nhận đến 6 thẻ vàng cùng 1 thẻ đỏ. Trận đấu giữa U21 bóng đá TP.HCM (trái) và U21 Sông Lam Nghệ An - Ảnh: VFF Ở trận thứ hai và đồng thời cũng là trận khai mạc,U21 Sông Lam Nghệ Anđã vượt qua chủ nhà U21 bóng đá TP.HCM 2-1. Chơi lấn lướt và tạo nhiều cơ hội ghi bàn trong hiệp một nhưng phải chờ đến phút 63, U21 Sông Lam Nghệ An mới có thể ghi bàn mở tỉ số nhờ công của Duy Hào. Nhưng chỉ 8 phút sau đó, Quang Khôi đã ghi bàn gỡ hòa 1-1 cho U21 bóng đá TP.HCM. Dù vậy, bản lĩnh đã giúp đội bóng trẻ xứ Nghệ có bàn ấn định chiến thắng 2-1 ở phút 81. Thủ môn Hoa Xuân Tín xuất sắc đẩy bóng sau cú sút của một cầu thủ U21 Sông Lam Nghệ An nhưng không thể chặn đứng cú đá bồi cận thành của Trọng Tuấn. Nhưng cũng như trận đầu tiên, trọng tài đã phải rút thẻ ""mỏi tay"" ở trận đấu này. Cụ thể, trọng tài đã rút ra 7 thẻ vàng cho U21 Sông Lam Nghệ An cùng 1 thẻ đỏ gián tiếp dành cho Lê Tấn Dũng. Đội chủ nhà cũng nhận 3 thẻ vàng. Giải U21 quốc gia 2025 diễn ra từ ngày 19 đến 31-7 trên ba sân Bà Rịa, Long Tâm và Tân Hưng. 12 đội bóng tham dự giải được chia làm 3 bảng, thi đấu vòng tròn một lượt tính điểm, xếp hạng. Hai đội dẫn đầu mỗi bảng cùng 2 đội xếp thứ ba có thành tích tốt nhất ở 3 bảng sẽ giành vé vào tứ kết. Bảng A gồm CLB bóng đá TP.HCM, Sông Lam Nghệ An, SHB Đà Nẵng và PVF-CAND. Bảng B gồm TP.HCM, Thể Công - Viettel, PVF, Tây Ninh. Bảng C gồm LPBank Hoàng Anh Gia Lai I, Đồng Tháp, Hà Nội, Đắk Lắk. Đội vô địch nhận cúp, HCV cùng 250 triệu đồng tiền thưởng. U17 là đội tuyển bóng đá trẻ Việt Nam mới nhất cho gọi cầu thủ Việt kiều về, chuẩn bị cho các giải đấu khu vực, châu lục."
Tuoi tre,https://tuoitre.vn/quoc-lo-19-lai-bong-troc-de-nghi-kiem-dinh-doc-lap-chat-luong-mat-duong-20250719172920994.htm,,"tin tức Gia Lai,Quốc lộ 19,dự án cải tạo đường quốc lộ 19,chất lượng mặt đường quốc lộ 19,dự án nâng cấp quốc lộ 19",19/07/2025 18:05 GMT+7,"Quốc lộ 19 lại bong tróc, đề nghị kiểm định độc lập chất lượng mặt đường1","Nhà thầu bóc gỡ một phần mặt đường quốc lộ 19 qua xã Mang Yang để thảm nhựa lại - Ảnh: TẤN LỰC Ngày 19-7, ông Hà Anh Thái - phó giám đốc Sở Xây dựng tỉnh Gia Lai, cho biết đã có nhắc nhở đối với chủ đầu tư dự án nâng cấp quốc lộ 19 giải quyết triệt để các kiến nghị của cử tri và người dân về chất lượng dự án này. Theo ông Thái, hiện nay dự án vẫn chưa bàn giao cho tỉnh quản lý bảo trì nên trách nhiệm thuộcBan quản lý dự án 2, Bộ Xây dựng. Theo ghi nhận của phóng viên, nhiều đoạn tuyến quốc lộ 19 đi qua các xã Mang Yang vàĐak Đoađang bị hư hỏng nặng. Dù mới được thảm nhựa chưa lâu, rất nhiều vị trí nhà thầu phải bóc lên thảm lại làm mặt đường chắp vá chằng chịt, phương tiện lưu thông không êm thuận, tiềm ẩn nguy cơ tai nạn giao thông. Liên quan dự án này, cách đây ít ngày, UBND xãMang Yangcó công văn gửi Sở Xây dựng tỉnh Gia Lai và Ban quản lý dự án 2 phản ánh các bất cập của dự án. Hiện trạng mặt đường quốc lộ 19 qua trung tâm xã Mang Yang chằng chịt dấu vá - Ảnh: L.T. Theo xã Mang Yang, hệ thống thoát nước quốc lộ 19 qua khu vực cầu Linh Nham không thoát được hết lượng nước nên tràn vào nhà dân cùng đất cát, rác thải, làm ảnh hưởng kinh doanh và sinh hoạt một số hộ dân. Tại đoạn ngã 3 thị trấn Kon Dơng, qua các đợt mưa hệ thống thu nước không đảm bảo làm nước tràn vào nhà dân ảnh hưởng đời sống, sinh hoạt. Một số khu vực khác thi công làm đan rãnh, bó vỉa chưa phù hợp gây khó khăn cho người dân trong quá trình đi lại, nguy cơ mất an toàn giao thông. Trong khi đó, UBND xãĐak Đoacũng có văn bản gửi Sở Tài chính và Sở Xây dựng báo cáo tình hình dự án nâng cấp quốc lộ 19 qua địa bàn. Theo báo cáo của xã, một số vị trí lớp thảm nhựa mặt đường chưa đảm bảo kỹ thuật và mỹ thuật công trình. Ngay sau khi thảm mặt đường có mưa đã bắt đầu bong tróc ở rất nhiều vị trí. Mặc dù đã được chủ đầu tư sửa chữa trám vá nhiều lần nhưng tiếp tục hư hỏng, gây mất an toàn giao thông và gây tâm lý bức xúc, phản cảm từ nhân dân. Trước tình trạng trên, UBND xã Đak Đoa đề nghị cơ quan chức năng có kiểm định độc lập chất lượng lớp thảm bê tông nhựa mặt đường. Trường hợp không đạt yêu cầu thì có biện pháp bóc gỡ toàn bộ lớp này để thi công lại. Một vị trí hư hỏng mặt đường trên quốc lộ 19 vừa được bóc gỡ làm lại - Ảnh: TẤN LỰC Dự án nâng cấp, cải tạo quốc lộ 19 qua tỉnh Gia Lai vừa mới hoàn thành, chưa bàn giao nhưng cử tri nhiều địa phương trên tuyến đã tới tấp kiến nghị về những bất cập của dự án."
Tuoi tre,https://tuoitre.vn/hien-thuc-khoc-nhieu-chua-tung-co-khi-hat-nhat-ky-cua-me-ngo-thanh-van-cung-rung-rung-20250719185203059.htm,,"Ngô Thanh Vân,Hiền Thục,nhật ký của mẹ",19/07/2025 19:26 GMT+7,"Hiền Thục khóc nhiều chưa từng có khi hát 'Nhật ký của mẹ', Ngô Thanh Vân cũng rưng rưng","Ngô Thanh Vân bên giám tuyển Trần Trung Lĩnh và diễn viên Tăng Bảo Quyên, những người cùng cô tổ chức sự kiện này - Ảnh: LÊ GIANG Chiều 19-7, diễn viênNgô Thanh Vâncông bố sự kiện nghệ thuật gây quỹ mang tênInitiation (Sự khởi)tại TP.HCM.Người chồng Huy Trần, các bạn bè như người mẫu Xuân Lan, ca sĩ Hiền Thục, Đoan Trang, Hồng Nhung... đến chúc mừng cô. Diễn viên Tăng Bảo Quyên là đại diện không gian nghệ thuật Chillala, cùng họa sĩ Trần Trung Lĩnh là thầy dạy vẽ kiêm giám tuyển cho Ngô Thanh Vân. Tại sự kiện, bên cạnh giới thiệu những bức tranh và hành trình với hội họa của Ngô Thanh Vân, khách mời là ca sĩHiền Thụcgửi tặng mọi người bài hátNhật ký của mẹ. Trong bầu không khí xúc động, Hiền Thục nhiều lần khóc nấc, hát không rõ lời. Dưới phía khán giả, Ngô Thanh Vân cũng liên tục chấm nước mắt khi đứng cạnh chồng.  Đang phát Hiền Thục, Ngô Thanh Vân khóc vì Nhật ký của mẹ - Video: LÊ GIANG Kết thúc bài hát, Hiền Thục lau nước mắt và nói đùa: ""Nếu ai muốn nghe bài này rõ hơn thì hãy lên mạng"". Rồi cô tâm sự với Ngô Thanh Vân: ""Bình thường em hát bài này thì đến đoạn bốn, em mới bắt đầu khóc. Nhưng hôm nay nghe chị Vân tâm sự về một hành trình dài của chị, em xúc động quá chừng. Em hát đến đoạn một đã khóc rồi"". Hiền Thục nói đùa cô mặc bộ áo dài đỏ, trùng màu với những chiếc kim tiêm trong tác phẩm nghệ thuật sắp đặt phía sau cả hai. Đó là tác phẩm ""The making of a mother"" với dáng hình một người mẹ mang thai mặc đầm bầu đứng giữa một mê cung với vô vàn kim tiêm. Tác phẩm mô tả hành trình IVF mà Ngô Thanh Vân đã trải qua, có rất nhiều chiếc kim tiêm, mỗi mũi kim là một vết thương dẫn đường cho sự sống, đã đưa em bé đến với cô. Hiền Thục tự nhận cô cũng nguyện là một chiếc kim tiêm để mang điều tốt đẹp đến với Ngô Thanh Vân. Đáp lại tiết mục cảm xúc, Ngô Thanh Vân chia sẻ: ""Tôi chưa lần nào nghe bàiNhật ký của mẹmàxúc động như hôm nay, nghe tới đâu khóc tới đó. Cảm ơn Hiền Thục vì bài hát của em giúp chị thấy cảm xúc của mình trọn vẹn, buổi chiều hôm nay là kỷ niệm không bao giờ quên được"". Ngô Thanh Vân trước tác phẩm ""The making of a mother"" và bên người chồng Huy Trần, một trong những nguồn cảm hứng vẽ tranh của cô - Ảnh: LÊ GIANG Vẽ tranh trong thai kỳ, Ngô Thanh Vân nói cơ thểmang thaicủa người mẹ vô cùng đẹp đẽ, là những đổi thay kỳ diệu. Trong các bứcTrust your body, Insomnia, Father,cô vẽ hình dáng người mẹ với bụng bầu lớn ở những tháng cuối thai kỳ. Người mẹ sẽ thấy nặng nề nhưng đồng thời cũng rất yêu thương cơ thể mình. Từng thay đổi đều là điều kỳ diệu với người mẹ vì nó đồng nghĩa với việc con đang lớn lên từng ngày. Bức Trust your body vẽ cơ thể người mẹ mang thai và bức Pupps mô tả chứng sần ngứa và nổi mề đay thai kỳ - Ảnh: LÊ GIANG Ngô Thanh Vân cũng tri ân sự đồng hành, chăm sóc, thấu hiểu của người chồng Huy Trần qua bức tranh ""Father"", khi cơ thể người bố ôm chặt và bảo bọc người mẹ. Những nỗi đau và khó khăn trong thai kỳ cũng được cô khắc họa nhưng đều sử dụng màu sắc tươi sáng vì không muốn hành trình này nhuốm màu u ám. Đó là các bứcPupps(sần ngứa và mảng mề đay do thai kỳ),Uterus(tử cung),Pain(nỗi đau) và cũng có những trải nghiệm tuyệt vời như những giấc mơ, tình yêu ngày càng đong đầy, năng lượng hay hình dung về sự sinh nở. Mở sự kiện nghệ thuật gây quỹ, Ngô Thanh Vân sẽ dùng toàn bộ tiền thu được từ các bức tranh cho các em nhỏ mắc bệnh tim bẩm sinh thông qua chương trìnhVết sẹo cuộc đời. Nhân vật của Ngô Thanh Vân và Charlize Theron có mối liên hệ đặc biệt trong The Old Guard 2. Đả nữ Việt Nam cũng có màn thoại tiếng Việt dõng dạc."
