Source,URL,Category,Keyword,Time,Title,Content
ZNews,https://znews.vn/chinh-phu-de-xuat-co-che-dac-biet-lam-giai-doan-2-san-bay-long-thanh-post1608996.html,Kinh doanh,Null,"Thứ hai, 8/12/2025 09:43 (GMT+7)",Chính phủ đề xuất cơ chế 'đặc biệt' làm giai đoạn 2 sân bay Long Thành,"Chính phủ đề xuất cơ chế ""đặc biệt"" để rút ngắn thời gian chuẩn bị thủ tục đầu tư xây dựng giai đoạn 2 dự án sân bay Long Thành. Ảnh:Quỳnh Danh. Sáng 8/12, Bộ         trưởng Xây dựng Trần Hồng Minh thừa ủy quyền của Thủ tướng đã trình Quốc hội tờ         trình về việc điều chỉnh nội dung Nghị quyết số 94/2015/QH13 của Quốc hội về chủ         trương đầu tư Cảng hàng không quốc tế Long Thành. Bộ trưởng Xây     dựng cho biết trước đó, triển khai Nghị quyết số 94/2015/QH13 và Nghị quyết 95/2019/QH14     của Quốc hội về báo cáo nghiên cứu khả thi dự án đầu tư xây dựng sân bay Long     Thành giai đoạn 1, Thủ tướng đã có quyết định phê duyệt dự án giai đoạn 1. Để thuận lợi     cho việc thực hiện đầu tư giai đoạn 2 của dự án, Chính phủ trình Quốc hội xem     xét, chấp thuận điều chỉnh nội dung Nghị quyết số 94/2015 theo hướng cho phép     Chính phủ tổ chức phê duyệt Báo cáo nghiên cứu khả thi giai đoạn 2 của dự án     theo thẩm quyền mà không phải báo cáo Quốc hội thông qua. Bộ trưởng Trần     Hồng Minh trình bày, theo Luật Đầu tư công năm 2014, Thủ tướng được quyết định     đầu tư dự án quan trọng quốc gia đã được Quốc hội quyết định chủ trương đầu tư     mà không cần thông qua Quốc hội. Tuy nhiên, do dự án sân bay Long Thành có quy     mô rất lớn, tính chất phức tạp, lần đầu tiên thực hiện, chưa định hình được     phương án đầu tư nên Quốc hội đã yêu cầu quy định Chính phủ chỉ đạo lập báo cáo     nghiên cứu khả thi đối với từng giai đoạn của dự án và báo cáo Quốc hội thông     qua trước khi quyết định đầu tư. Trong giai đoạn     1 của dự án, Chính phủ đã chỉ đạo tổ chức lập Báo cáo nghiên cứu khả thi giai     đoạn 1, báo cáo và được Quốc hội thông qua. Giai đoạn 1 của dự án được tách thành     4 dự án thành phần và lựa chọn các chủ đầu tư/nhà đầu tư khác nhau thực hiện     cho phù hợp với tính chất của từng công trình, bảo đảm quốc phòng, an ninh và lợi     ích của Nhà nước, lợi ích của Quốc gia… Trong quá     trình triển khai giai đoạn 1, trên cơ sở kiến nghị của Chính phủ về việc điều     chỉnh phân kỳ đầu tư xây dựng đường cất hạ cánh thứ 26 của dự án từ giai đoạn 3     sang giai đoạn 1, Quốc hội đã cho phép Chính phủ tổ chức phê duyệt Báo cáo     nghiên cứu khả thi điều chỉnh giai đoạn 1 theo thẩm quyền mà không phải báo cáo     Quốc hội thông qua. Bộ         trưởng Xây dựng Trần Hồng Minh trình bày tờ         trình đề xuất điều chỉnh nội dung Nghị quyết số 94/2015/QH13 của Quốc hội. Ảnh:Quochoi.vn. Trên cơ sở dự     báo nhu cầu vận tải, Báo cáo nghiên cứu khả thi giai đoạn 1 đã dự kiến thời điểm     nghiên cứu, đầu tư giai đoạn 2 (gồm đường cất hạ cánh thứ 3 và nhà ga hành     khách thứ 2) là từ năm 2028-2032. Tuy nhiên, với kịch bản tăng trưởng GDP được     đề ra từ năm 2026 đạt hai con số, sản lượng hành khách qua các cảng hàng không     nói chung, đặc biệt là sân bay Long Thành nói riêng sẽ tăng nhanh hơn dự báo     trước đây. Vì vậy, cần tổ chức nghiên cứu đầu tư giai đoạn 2 sớm hơn so với dự     kiến. Ngoài ra, việc     nghiên cứu đầu tư ngay đường cất hạ cánh thứ 3 thuộc giai đoạn 2 sẽ tận dụng được     nhân công, máy móc thiết bị sẵn có của các nhà thầu đang thi công, qua đó tiết     kiệm thời gian, chi phí, rút ngắn tiến độ và nâng cao hiệu quả đầu tư xây dựng;     đồng thời góp phần giảm thiểu tác động tới hoạt động khai thác cảng như bụi, tiếng     ồn do hoạt động thi công giai đoạn 2. Trên cơ sở nội     dung phân tích nêu trên, việc Quốc hội cho phép Chính phủ tổ chức phê duyệt Báo     cáo nghiên cứu khả thi giai đoạn 2 của dự án theo thẩm quyền mà không phải báo     cáo Quốc hội thông qua sẽ giúp Chính phủ chủ động tổ chức nghiên cứu, thẩm định,     phê duyệt Báo cáo, phù hợp với chủ trương phân cấp, phân quyền và quy định tại Luật     Đầu tư công năm 2024. Trình bày báo     cáo thẩm tra, Chủ nhiệm Ủy ban Kinh tế và Tài chính Phan Văn Mãi cho biết kiến     nghị của Chính phủ là có cơ sở và cũng phù hợp với các quy định của pháp luật     hiện hành cùng với việc thực hiện chủ trương của Đảng về đẩy mạnh phân cấp,     phân quyền đáp ứng yêu cầu phát triển đất nước trong kỷ nguyên mới. Đề xuất này cũng phù hợp với quy định về     đẩy mạnh phân cấp, phân quyền, đơn giản hóa, rút ngắn thời gian lập Báo cáo     nghiên cứu khả thi, quyết định đầu tư dự án quan trọng quốc gia tại Luật Đầu tư     công năm 2024 (được sửa đổi, bổ sung năm 2025). Chủ nhiệm Ủy ban Kinh tế và Tài chính Phan Văn Mãi cho biết cơ quan thẩm tra thống nhất với đề xuất của Chính phủ. Ảnh:Quochoi.vn. Do đó, cơ     quan thẩm tra thống nhất với đề xuất của Chính phủ, tương tự như các nội dung     điều chỉnh khác có liên quan đến dự án sân bay Long Thành cũng đã được Quốc hội     quyết định trước đó. Ngoài ra, một     số ý kiến đề nghị Chính phủ chịu trách nhiệm về các nội dung đề xuất, bảo đảm     đúng tiến độ, chất lượng, hiệu quả đầu tư của dự án. Dự án đầu tư     xây dựng Cảng hàng không quốc tế Long Thành có tổng mức đầu tư khái toán toàn bộ     là336.630 tỷ đồng(tương đương16,03 tỷ USD, áp dụng đơn giá của năm 2014). Trong     đó, giai đoạn 1 là114.450 tỷ đồng(tương đương5,45 tỷ USD). Dự án có quy     mô sử dụng đất lên tới 5.000 ha, là dự án sân bay lớn nhất Việt Nam hiện nay. Theo kế hoạch,     dự án sẽ được triển khai gồm 3 giai đoạn: Giai đoạn 1 đầu tư xây dựng 2 đường     cất hạ cánh ở phía Bắc và 1 nhà ga hành khách cùng các hạng mục phụ trợ đồng bộ     với công suất 25 triệu lượt hành khách và 1,2 triệu tấn hàng hóa mỗi năm; chậm     nhất đến ngày 31/12/2026 hoàn thành và đưa vào khai thác. Giai đoạn 2     sẽ tiếp tục xây dựng thêm 1 đường cất hạ cánh cấu hình mở và 1 nhà ga hành     khách để đạt công suất 50 triệu lượt hành khách, 1,5 triệu tấn hàng hóa mỗi năm. Giai đoạn 3     sẽ hoàn thành các hạng mục của dự án để đạt công suất 100 triệu lượt hành     khách/năm và 5 triệu tấn hàng hóa/năm. Chính phủ chỉ đạo lập báo cáo nghiên cứu     khả thi đối với từng giai đoạn của Dự án và báo cáo Quốc hội thông qua trước     khi quyết định đầu tư. Tri Thức - Znewsgiới thiệu độc giảTủ sách kiến thức kinh tếvới đa dạng cuốn sách, câu chuyện trong lĩnh vực kinh doanh, kinh tế. Những cuốn sách, câu chuyện trong Tủ sách không đơn thuần là những tác phẩm của tri thức mà còn chứa đựng bí quyết, kinh nghiệm quý báu từ các tác giả, nhà quản lý có uy tín và kinh nghiệm lâu năm trong ngành. Đọc sách không chỉ giúp tiếp cận những kiến thức mới mà còn giúp mở rộng tầm nhìn và phát triển bản thân. Tủ sách kiến thức kinh tế mong muốn lan tỏa tri thức trong lĩnh vực kinh doanh, đồng thời phát triển văn hóa đọc cho người Việt.  Chỉ còn hai tuần nữa, sân bay Long Thành sẽ đón chuyến bay đầu tiên. TP.HCM và Đồng Nai đang dồn lực đẩy nhanh tiến độ các tuyến giao thông chủ chốt kết nối tới sân bay.  Sở Xây dựng TP.HCM cho biết đến năm 2030, TP.HCM phấn đấu hoàn thành 3 tuyến đường sắt kết nối hai sân bay Long Thành và Tân Sơn Nhất.  4 giờ trước06:248/12/2025 0 Các công ty chứng khoán khuyến nghị nhà đầu tư thận trọng khi VN-Index tiến sát vùng kháng cự mạnh, ưu tiên chốt lời từng phần và duy trì tỷ trọng hợp lý trong ngắn hạn."
ZNews,https://znews.vn/3-de-xuat-moi-lien-quan-thue-gia-tri-gia-tang-post1608997.html,Kinh doanh,Null,"Thứ hai, 8/12/2025 10:40 (GMT+7)",3 đề xuất mới liên quan thuế giá trị gia tăng,"Chính phủ đề xuất bỏ quy định về điều kiện hoàn thuế VAT trong Luật Thuế giá trị gia tăng (sửa đổi). Ảnh:Nam Khánh. Sáng 8/12, Bộ trưởng Tài chính Nguyễn Văn Thắng thừa ủy quyền của Thủ tướng đã trình Quốc hội tờ trình về dự án Luật sửa đổi, bổ sung một số điều của Luật Thuế giá trị gia tăng. Theo Bộ trưởng Tài chính, sau khi Luật Thuế giá trị gia tăng hiện hành có hiệu lực từ ngày 1/1/2025, Chính phủ, Bộ Tài chính đã nhận được nhiều kiến nghị của hiệp hội, các doanh nghiệp về vướng mắc của chính sách thuế giá trị gia tăng (VAT) đối với lĩnh vực nông nghiệp, thức ăn chăn nuôi cũng như các điều kiện hoàn thuế. Để góp phần khắc phục hậu quả bão lũ, sớm khôi phục hoạt động sản xuất kinh doanh, đặc biệt là trong lĩnh vực nông nghiệp, tháo gỡ “điểm nghẽn” trong hoàn thuế VAT, Chính phủ đề xuất sửa đổi ngay một số quy định của Luật. Một trong những nội dung được đề xuất sửa đổi tại dự án Luật mới là việc quản lý thuế VAT với các sản phẩm cây trồng, rừng trồng, chăn nuôi, thủy sản nuôi trồng đánh bắt chưa chế biến thành các sản phẩm khác hoặc chỉ qua sơ chế thông thường cho doanh nghiệp hợp tác xã, liên hiệp hợp tác xã khác. Theo đó, cơ quan soạn thảo đề xuất đưa lại nội dung đã được quy định từ năm 2014 về việc doanh nghiệp hợp tác xã, liên hiệp hợp tác xã không phải tính thuế VAT nhưng được khấu trừ thuế VAT đầu vào khi bán các sản phẩm này. Theo Bộ trưởng Tài chính quy định này đã được thực hiện ổn định nhiều năm, bảo đảm không vi phạm nguyên tắc của thuế VAT, đồng thời không làm ảnh hưởng đến số thu ngân sách Nhà nước. Bên cạnh đó, quy định cũng góp phần giảm bớt gánh nặng về thủ tục hành chính cho doanh nghiệp, hỗ trợ hoạt động xuất khẩu nông, lâm, thủy sản khi doanh nghiệp không phải ứng trước tiền để nộp thuế, sau đó lại làm thủ tục hoàn thuế, tránh lãng phí thời gian và chi phí cơ hội của doanh nghiệp. Bộ trưởng Tài chính Nguyễn Văn Thắng trình Quốc hội tờ trình dự án Luật sửa đổi, bổ sung một số điều của Luật Thuế giá trị gia tăng. Ảnh:Quochoi.vn. Cơ quan soạn thảo dẫn số liệu từ một số ngành trong lĩnh vực nông nghiệp cho biết số thuế VAT 5% mà các doanh nghiệp phải nộp trong 6 tháng cuối năm 2025 lên tới5.000 tỷ đồngvới Hiệp hội Cà phê - Ca cao Việt Nam, 2.016 tỷ với Hiệp hội Lương thực Việt Nam,2.162 tỷ đồngvới Hiệp hội Hồ tiêu và cây gia vị Việt Nam. Nội dung sửa đổi thứ hai là lược bỏ nội dung sản phẩm cây trồng, rừng trồng, chăn nuôi, thủy sản nuôi trồng đánh bắt chưa chế biến thành các sản phẩm khác hoặc chỉ qua sơ chế thông thường được sử dụng làm thức ăn chăn nuôi, dược liệu thì áp dụng thuế suất VAT theo quy định cho sản phẩm cây trồng, rừng trồng, chăn nuôi, thủy sản đang quy định tại khoản 5 điều 9 Luật Thuế giá trị gia tăng hiện hành. Đề xuất này là để đảm bảo việc áp dụng thuế VAT đồng bộ về thức ăn chăn nuôi, bảo đảm bình đẳng với thức ăn chăn nuôi nhập khẩu do thức ăn chăn nuôi nhập khẩu không chịu thuế, còn thức ăn chăn nuôi sản xuất trong nước có thuế VAT đầu vào 5% nên phải tính vào chi phí làm tăng giá bán. Nội dung đề xuất sửa đổi thứ ba là lược bỏ quy định về điều kiện hoàn thuế: Người mua chỉ được hoàn thuế khi người bán đã kê khai nộp. Theo cơ quan soạn thảo, trước đó, quy định này được xác định là một trong những giải pháp về quản lý thuế nhằm phòng chống gian lận trong hoàn thuế trong khi chưa sửa đổi các quy định về quản lý thuế. Hiện nay, dự thảo Luật Quản lý thuế sửa đổi đang trình Quốc hội đã bổ sung các quy định nhằm quản lý thuế chặt chẽ hơn đối với người nộp thuế để đảm bảo thu đúng, thu đủ tiền thuế vào ngân sách Nhà nước và quản lý chặt chẽ hơn trong hoàn thuế cũng như là công tác kiểm tra người nộp thuế. Do vậy, không cần quy định nội dung này tại Luật Thuế giá trị gia tăng. Trình bày báo cáo thẩm tra, Chủ nhiệm Ủy ban Kinh tế và Tài chính Phan Văn Mãi cho biết 2 nội dung đầu của đề xuất sửa đổi Luật chủ yếu là vấn đề lựa chọn quan điểm chính sách. Với các mục tiêu và tác động được phân tích, việc lựa chọn chính sách có thể cân nhắc lựa chọn phù hợp bối cảnh thực tế để xác định mục tiêu ưu tiên trong từng thời điểm cụ thể một cách phù hợp. Ngược lại, nội dung 3 (bỏ quy định về điều kiện hoàn thuế VAT) không phải là vấn đề về lựa chọn chính sách mà là nội dung về điều kiện để doanh nghiệp được hoàn thuế với mục tiêu chống gian lận trong hoàn thuế VAT, áp dụng chung cho mọi doanh nghiệp, không chỉ liên quan đến các sản phẩm nông sản. Chủ nhiệm Ủy ban Kinh tế và Tài chính Phan Văn Mãi trình bày báo cáo thẩm tra dự án Luật Thuế giá trị gia tăng (sửa đổi). Ảnh:Quochoi.vn. Bỏ quy định này để tạo thuận lợi cho doanh nghiệp, song đồng thời sẽ tạo rủi ro gây thất thoát ngân sách, rủi ro cho cán bộ thuế khi không có công cụ pháp lý hữu hiệu trong thực hiện hoàn thuế VAT. Theo cơ quan thẩm tra, điều này không bảo đảm quy định tại Quy định số 178-QĐ/TW về kiểm soát quyền lực và phòng chống tham nhũng, tiêu cực trong công tác xây dựng pháp luật. Trong trường hợp các nội dung sửa đổi được Quốc hội thông qua để quay lại như quy định của Luật trước đây, cơ quan thẩm tra đề nghị Chính phủ chịu trách nhiệm đối với các nội dung sửa đổi, bảo đảm giải quyết được các điểm nghẽn trong hoàn thuế VAT và vướng mắc, bất cập phát sinh từ thực tiễn. Đồng thời bảo đảm Quy định số 178-QĐ/TW; không để xảy ra trục lợi chính sách, gian lận hóa đơn gây thất thoát, thiệt hại ngân sách Nhà nước như đã xảy ra trong thời gian vừa qua; không tạo ra các khó khăn, vướng mắc mới cho các đối tượng nộp thuế và các đối tượng khác có liên quan. Ủy ban Kinh tế và Tài chính đề nghị các đại biểu Quốc hội thảo luận cụ thể đối với 3 nội dung sửa đổi của luật, sự cần thiết của từng nội dung và phương án xử lý. Theo kế hoạch, cuối giờ sáng nay, Quốc hội sẽ thảo luận ở tổ về dự án Luật sửa đổi, bổ sung một số điều của Luật Thuế giá trị gia tăng này. Tri Thức - Znewsgiới thiệu độc giảTủ sách kiến thức kinh tếvới đa dạng cuốn sách, câu chuyện trong lĩnh vực kinh doanh, kinh tế. Những cuốn sách, câu chuyện trong Tủ sách không đơn thuần là những tác phẩm của tri thức mà còn chứa đựng bí quyết, kinh nghiệm quý báu từ các tác giả, nhà quản lý có uy tín và kinh nghiệm lâu năm trong ngành. Đọc sách không chỉ giúp tiếp cận những kiến thức mới mà còn giúp mở rộng tầm nhìn và phát triển bản thân. Tủ sách kiến thức kinh tế mong muốn lan tỏa tri thức trong lĩnh vực kinh doanh, đồng thời phát triển văn hóa đọc cho người Việt.  Doanh nghiệp nông sản phản ánh cách tính thuế giá trị gia tăng mới làm đọng vốn, gây lãng phí thời gian. Bộ Tài chính đề xuất quay lại cách thu thuế cũ để gỡ khó cho doanh nghiệp.  Theo quy định tại Luật Thuế giá trị gia tăng 2024, từ năm 2026, hộ, cá nhân kinh doanh có doanh thu từ 200 triệu đồng/năm trở xuống sẽ không thuộc đối tượng chịu thuế giá trị gia tăng và thuế thu nhập cá nhân, gấp đôi mức miễn thuế hiện tại.  4 giờ trước06:248/12/2025 0 Các công ty chứng khoán khuyến nghị nhà đầu tư thận trọng khi VN-Index tiến sát vùng kháng cự mạnh, ưu tiên chốt lời từng phần và duy trì tỷ trọng hợp lý trong ngắn hạn."
ZNews,https://znews.vn/novagroup-thay-ceo-sau-4-thang-post1609330.html,Kinh doanh,Null,"Thứ hai, 8/12/2025 10:04 (GMT+7)",NovaGroup thay CEO sau 4 tháng,"NovaGroup là cổ đông lớn nhất của Novaland, nắm hơn 335 triệu cổ phiếu NVL, tương đương 17,19% vốn điều lệ. Ảnh:S.T. Theo cập nhật thay đổi đăng ký kinh doanh mới nhất, CTCP NovaGroup đã bổ nhiệm bà Trần Thiện Thanh Thùy giữ vị trí Tổng giám đốc, thay thế bà Phạm Thị Hồng Nhung. Trước khi đảm nhiệm vai trò mới, bà Thùy (sinh năm 1982) từng là Thành viên HĐQT tại CTCP Địa ốc Sài Gòn Thương Tín (TTC Land - SCR) và Thành viên Ủy ban Kiểm toán tại CTCP Du lịch Thành Thành Công (TTC Hospitality - VNG). Đáng chú ý, bà Phạm Thị Hồng Nhung - người vừa rời vị trí Tổng giám đốc - mới đảm nhiệm vai trò này từ tháng 8/2025, sau khi tiếp quản từ ông Đoàn Minh Trường. Như vậy, chỉ chưa đầy 4 tháng ngồi ghế điều hành, bà Nhung đã chuyển giao nhiệm vụ cho nhân sự mới. Hiện bà vẫn là Thành viên HĐQT của Tập đoàn Novaland (NVL). Việc thay đổi lãnh đạo cấp cao cũng cho thấy NovaGroup đang đẩy mạnh quá trình tái cơ cấu. Tập đoàn hiện là cổ đông lớn nhất của Novaland, nắm hơn 335 triệu cổ phiếu NVL, tương đương 17,19% vốn điều lệ. Chủ tịch HĐQT NovaGroup - ông Bùi Thành Nhơn - cũng đồng thời là Chủ tịch Novaland. Hệ sinh thái này được phát triển theo mô hình đa ngành với các trụ cột chính gồm bất động sản (Novaland), dịch vụ - du lịch - giải trí (Nova Service Group) và nông nghiệp - tiêu dùng (Nova Consumer Group). Về tình hình kinh doanh của thành viên chủ chốt Novaland, kết thúc quý III, doanh nghiệp ghi nhận doanh thu thuần đạt1.683 tỷ đồng, giảm hơn 16% so với cùng kỳ năm ngoái. Do doanh thu tài chính sụt giảm mạnh, Novaland báo lỗ1.153 tỷ đồng. Lũy kế 9 tháng đầu năm, Novaland ghi nhận tổng doanh thu thuần hợp nhất đạt5.398 tỷ đồngtừ bán hàng và cung cấp dịch vụ. Trong đó, doanh thu thuần từ bán hàng đạt gần4.956 tỷ đồng, tăng 33% so với cùng kỳ năm ngoái, chủ yếu nhờ bàn giao tại các dự án như: NovaWorld Phan Thiet, NovaWorld Ho Tram, Aqua City, Sunrise Riverside, Palm City... Song, lợi nhuận sau thuế hợp nhất ghi nhận khoản lỗ1.820 tỷ đồng, chủ yếu do giảm doanh thu hoạt động tài chính. Tri Thức - Znewsgiới thiệu độc giảTủ sách kiến thức kinh tếvới đa dạng cuốn sách, câu chuyện trong lĩnh vực kinh doanh, kinh tế. Là nguồn tư liệu cho những người quan tâm và muốn nâng cao kiến thức trong lĩnh vực kinh tế. Những cuốn sách, câu chuyện trong Tủ sách không chỉ đơn thuần là những tác phẩm của tri thức mà còn chứa đựng bí quyết, kinh nghiệm quý báu từ các tác giả, nhà quản lý có uy tín và kinh nghiệm lâu năm trong ngành. Đọc sách không chỉ giúp người đọc tiếp cận những kiến thức mới mà còn giúp mở rộng tầm nhìn và phát triển bản thân. Tủ sách kiến thức kinh tế mong muốn lan tỏa tri thức trong lĩnh vực kinh doanh, đồng thời phát triển văn hóa đọc cho người Việt.  Theo VDSC, Novaland sẽ bước vào giai đoạn tăng tốc khi doanh thu và sản phẩm bàn giao dự kiến tập trung mạnh vào năm 2027-2028, nhờ loạt dự án lớn tại Đồng Nai và TP.HCM.  Novaland dự kiến thực hiện 2 động thái cơ cấu lại vốn tại Công ty TNHH Ngôi Nhà Mega: vừa tăng vốn góp, vừa thoái vốn tại công ty này.  Sau những vướng mắc pháp lý, Novaland công bố mục tiêu thi công hoàn thiện dự án Aqua City trong năm 2026 cùng kế hoạch bàn giao nhà, sổ hồng cho khách hàng."
