Source,URL,Category,Keyword,Time,Title,Content
VN Express,https://vnexpress.net/phu-nu-mien-nam-hon-100-nam-truoc-qua-ong-kinh-nguoi-phap-4897570.html,Sân khấu - Mỹ thuật,"Sài Gòn xưa,miền Nam xưa,Di sản Sài Gòn - Thành phố Hồ Chí Minh","Thứ sáu, 13/6/2025, 15:12 (GMT+7)",Phụ nữ miền Nam hơn 100 năm trước qua ống kính người Pháp,"Người đẹp Sài Gòn xưa diện áo ngũ thân, tạo dáng với đờn kìm, được ghi lại qua ống kính các nhiếp ảnh gia đầu thế kỷ 20. Bữa trưa của một gia đình miền Nam. Cảnh sinh hoạt đời thường được đưa vào sách ảnhDi sản Sài Gòn - Thành phố Hồ Chí Minh, với hơn 300 bức hình bao quát lịch sử - văn hóa hơn 300 năm của vùng đất. Bữa trưa của một gia đình miền Nam. Cảnh sinh hoạt đời thường được đưa vào sách ảnhDi sản Sài Gòn - Thành phố Hồ Chí Minh, với hơn 300 bức hình bao quát lịch sử - văn hóa hơn 300 năm của vùng đất. Chân dung phái đẹp Sài Gòn được giới thiệu trong chương về áo dài. Theo nhà báo Nguyễn Hạnh - người biên soạn, suốt một thế kỷ qua, phụ nữ Sài Gòn - Gia Định chọn áo dài làm thường phục vì lịch sự, kín đáo. Chân dung phái đẹp Sài Gòn được giới thiệu trong chương về áo dài. Theo nhà báo Nguyễn Hạnh - người biên soạn, suốt một thế kỷ qua, phụ nữ Sài Gòn - Gia Định chọn áo dài làm thường phục vì lịch sự, kín đáo. Phụ nữ thành thị thường mặc áo dài để phân biệt với tầng lớp lao động nghèo. Xu hướng áo năm thân còn kéo dài từ thế kỷ 19 đến đầu thế kỷ 20, trước khi dần bị thay thế bởi áo dài Le Mur, do họa sĩ Cát Tường sáng tạo. Phụ nữ thành thị thường mặc áo dài để phân biệt với tầng lớp lao động nghèo. Xu hướng áo năm thân còn kéo dài từ thế kỷ 19 đến đầu thế kỷ 20, trước khi dần bị thay thế bởi áo dài Le Mur, do họa sĩ Cát Tường sáng tạo. Một phụ nữ tạo dáng bên đàn tranh. Theo sách, áo dài xưa có loại áo ""chít"" (áo chiếc), tay dài nhưng hơi rộng, gài nút bên. Áo chiếc thường may bằng lụa hay the, dùng mặc trong mùa hè. Ngoài ra còn có loại áo ""lót"" (áo cặp) - kiểu dáng tương tự nhưng may hai lớp. Một phụ nữ tạo dáng bên đàn tranh. Theo sách, áo dài xưa có loại áo ""chít"" (áo chiếc), tay dài nhưng hơi rộng, gài nút bên. Áo chiếc thường may bằng lụa hay the, dùng mặc trong mùa hè. Ngoài ra còn có loại áo ""lót"" (áo cặp) - kiểu dáng tương tự nhưng may hai lớp. Một cô gái chơi đàn kìm - nhạc cụ không thể thiếu của đờn ca tài tử, bên cạnh đàn cò, đàn tranh và đàn bầu (gọi là tứ tuyệt). Một cô gái chơi đàn kìm - nhạc cụ không thể thiếu của đờn ca tài tử, bên cạnh đàn cò, đàn tranh và đàn bầu (gọi là tứ tuyệt). Năm 1937, cuộc thiConcours élégant - Saigontại Vườn Ông Thượng (nay là Công viên Tao Đàn, quận 1) do một số công chức và các nhà kinh doanh tổ chức, có thể được xem là cuộc thi hoa hậu áo dài đầu tiên ở Sài Gòn. Năm 1937, cuộc thiConcours élégant - Saigontại Vườn Ông Thượng (nay là Công viên Tao Đàn, quận 1) do một số công chức và các nhà kinh doanh tổ chức, có thể được xem là cuộc thi hoa hậu áo dài đầu tiên ở Sài Gòn. Phụ nữ xưa thường phối áo dài với kiềng đeo cổ hoặc trang sức chuỗi hạt. Phụ nữ xưa thường phối áo dài với kiềng đeo cổ hoặc trang sức chuỗi hạt. Nhóm tác giả còn giới thiệu hình ảnh đời sống Sài Gòn cuối thế kỷ 19 - đầu thế kỷ 20. Dù sống ở thị thành, một số nơi vẫn còn giữ nếp sinh hoạt như ở nông thôn, đời sống giản dị, mang tính cộng đồng cao. Giai đoạn này, những nhà buôn lớn chủ yếu đến từ nước ngoài, còn người bản xứ thường buôn bán nhỏ. Nhóm tác giả còn giới thiệu hình ảnh đời sống Sài Gòn cuối thế kỷ 19 - đầu thế kỷ 20. Dù sống ở thị thành, một số nơi vẫn còn giữ nếp sinh hoạt như ở nông thôn, đời sống giản dị, mang tính cộng đồng cao. Giai đoạn này, những nhà buôn lớn chủ yếu đến từ nước ngoài, còn người bản xứ thường buôn bán nhỏ. Khung cảnh nhộn nhịp trước khu Chợ Lớn (cũ). Chợ Lớn được hình thành từ thế kỷ 17 đến 19, khi cộng đồng người Hoa đến định cư, xây nên một đô thị sầm uất. Năm 1928, thương gia người Hoa - Quách Đàm xây một khu chợ đông đúc hơn, mang tên Bình Tây (Chợ Lớn mới). Khung cảnh nhộn nhịp trước khu Chợ Lớn (cũ). Chợ Lớn được hình thành từ thế kỷ 17 đến 19, khi cộng đồng người Hoa đến định cư, xây nên một đô thị sầm uất. Năm 1928, thương gia người Hoa - Quách Đàm xây một khu chợ đông đúc hơn, mang tên Bình Tây (Chợ Lớn mới). Trong sáchGia Định thành thông chí(Trịnh Hoài Đức biên soạn khoảng năm 1820), Chợ Lớn (cũ) được mô tả: ""Các đường phố và mái nhà nối tiếp nhau san sát. Các gia đình người Hoa và người Việt sống gần kề nhau trong vòng ba dặm. Người bán hàng rong, bán vải nhung, đồ sứ, giấy, đồ trang sức, sách, thuốc, trà, bột. Tất cả các loại hàng theo nhiều tuyến đường biển và đường sông tới đây"". Trong sáchGia Định thành thông chí(Trịnh Hoài Đức biên soạn khoảng năm 1820), Chợ Lớn (cũ) được mô tả: ""Các đường phố và mái nhà nối tiếp nhau san sát. Các gia đình người Hoa và người Việt sống gần kề nhau trong vòng ba dặm. Người bán hàng rong, bán vải nhung, đồ sứ, giấy, đồ trang sức, sách, thuốc, trà, bột. Tất cả các loại hàng theo nhiều tuyến đường biển và đường sông tới đây"". Mai NhậtẢnh:NXB cung cấp"
VN Express,https://vnexpress.net/sui-mao-ga-sau-oral-sex-4898362.html,Tin tức,"sex,Tình dục,oral sex,quan hệ bằng miệng,Sùi mào gà","Thứ bảy, 14/6/2025, 01:00 (GMT+7)",Sùi mào gà sau oral sex,"Ân ái với bạn tình bằng miệng (oral sex), bộ phận sinh dục nam thanh niên 21 tuổi xuất hiện các nốt sần đỏ hồng, ngứa sâu trong niệu đạo, bác sĩ chẩn đoán sùi mào gà Ngày 13/6, bác sĩ Hà Ngọc Mạnh, Giám đốc Bệnh viện Nam học và Hiếm muộn VIệt Bỉ cho biết vùng sinh dục ngoài của bệnh nhân không phát hiện tổn thương, nội soi niệu đạo mới phát hiện nhiều u sùi kích thước to nhỏ khác nhau, ăn sâu vào trong. Bác sĩ chẩn đoán đây là tổn thương điển hình của sùi mào gà. Niệu đạo là ống dài nối từ bàng quang ra lỗ tiểu (lỗ sáo) để đưa nước tiểu ra bên ngoài. Cơ quan này còn có chức năng dẫn tinh dịch ra ngoài. Bác sĩ nhận định tổn thương niệu đạo là một trong những tổn thương nặng nhất của sùi mào gà do vị trí khó tiếp cận, tỷ lệ tái phát cao. Với bệnh nhân này, nội soi niệu đạo mới có thể xử lý hết thương tổn, bởi niệu đạo của nam giới rất dài, không thể đánh giá bằng các phương pháp thông thường, khó điều trị dứt điểm. Bác sĩ nội soi cắt đốt khối u sùi bằng laser, dùng thuốc chống virus. Sau điều trị, sức khỏe người bệnh ổn định. Anh cho biết đã quan hệ tình dục bằng đường miệng (oral sex), không áp dụng biện pháp bảo vệ. Sùi mào gà là một trong những bệnh lây truyền qua đường tình dục phổ biến nhất, gây ra bởi virus HPV (human papilloma virus). Người có nhiều bạn tình, quan hệ với bạn tình lạ, không sử dụng bao cao su, vệ sinh kém, ẩm ướt, bệnh nhân suy giảm hệ miễn dịch, có nguy cơ cao mắc sùi mào gà. Một trong những tình huống lây lan thường gặp mà nam giới ít ngờ là oral sex. Khi kích thích bằng miệng thì vị trí miệng sáo hay được kích thích nhiều hơn nên dễ gây tổn thương. Triệu chứng ở nam giới là bề mặt các nốt sùi ẩm ướt, ấn vào có mủ, dễ bị chảy máu, dễ tổn thương. Trên thân dương vật xuất hiện các mụn mọc đơn lẻ, nhô cao như những nhú gai, màu hồng, có chân hoặc cuống, không có cảm giác ngứa ngáy, đau hay khó chịu. Các nốt mụn mọc nhiều dần lên rồi liên kết với nhau thành các mảng to có đường kính khoảng vài cm, trông như mào con gà hay cái súp lơ. Nốt sùi có thể lan ra xung quanh cơ quan sinh dục như vùng dưới bìu, xung quanh lỗ hậu môn, bên trong lỗ hậu môn, niệu đạo, bao quy đầu, các nếp gấp bẹn. Một số trường hợp, nốt sùi to bằng nắm tay, tiết ra dịch và máu có mùi hôi thối, tanh. Sùi mào gà xuất hiện ở miệng khi quan hệ tình dục không an toàn bằng đường miệng, hoặc ở mắt, các ngón tay, ngón chân. Các nốt màu hồng trông gần giống mụn cóc, mọc liền kề với nhau thành từng cụm lớn. Sùi ở miệng rất dễ bị nhầm lẫn với bệnh nhiệt miệng, viêm họng, nên cần cảnh giác. Đốt sùi là quá trình trị liệu đau đớn, bệnh nhân phải chịu đựng nhiều bất tiện khi vệ sinh cá nhân, sinh hoạt thường ngày đảo lộn. Thực tế, nhiều người mang tâm lý e ngại nên không tìm hiểu đầy đủ thông tin, bỏ dở phác đồ, khiến bệnh ngày càng nghiêm trọng. Bác sĩ khuyến cáo bệnh nhân sùi mào gà cần nhanh chóng tới bệnh viện điều trị. Cách phòng tránh tốt nhất là quan hệ tình dục chung thủy một vợ một chồng, không quan hệ với người mà bạn không biết rõ về tình trạng sức khỏe. Luôn sử dụng bao cao su đúng cách. Vệ sinh cá nhân sạch sẽ, đặc biệt là bộ phận sinh dục, bằng xà phòng trước và sau khi quan hệ. Khám sức khỏe định kỳ để sớm phát hiện bệnh. Thúy Quỳnh"
VN Express,https://vnexpress.net/thieu-nu-suy-gan-sau-uong-thuoc-giam-can-nghi-chua-chat-cam-4898563.html,Tin tức,"Quảng Ninh,suy gan cấp,thuốc giảm cân,Giảm cân,thuốc giảm cân trên mạng","Thứ sáu, 13/6/2025, 17:41 (GMT+7)",Thiếu nữ suy gan sau uống thuốc giảm cân nghi chứa chất cấm,"Quảng NinhSau khi uống thuốc giảm cân mua trên mạng, thiếu nữ 16 tuổi mệt mỏi, ăn ngủ kém, bác sĩ chẩn đoán suy gan nghiêm trọng. Ngày 13/6, đại diện Bệnh viện Đa khoa khu vực Cẩm Phả cho biết thiếu nữ đã sử dụng thuốc giảm cân này một thời gian, khi vào viện người nhợt nhạt, suy kiệt. Kết quả xét nghiệm và chẩn đoán hình ảnh cho thấy chỉ số men gan tăng rất cao, rối loạn chức năng gan nghiêm trọng. Bác sĩ chẩn đoán bệnh nhân suy gan cấp, phải điều trị tích cực. Hiện, chưa rõ hoạt chất trong thuốc giảm cân người bệnh dùng. Các bác sĩ nghi ngờ thuốc giảm cân không rõ nguồn gốc chứa chất cấm, dùng lâu có nguy cơ ảnh hưởng những chức năng cơ thể, thậm chí gây ngộ độc, ảnh hưởng tính mạng. Mạng xã hội tràn ngập các quảng cáo về thuốc giảm cân ""thần tốc"", ""hiệu quả sau 7 ngày"", ""giảm 5-7 kg mà không cần tập luyện, không ăn kiêng"". Các loại thuốc này đều không nhãn mác rõ ràng, không được kiểm định y tế. Bác sĩ cho biết phần lớn thuốc giảm cân không rõ nguồn gốc đều chứa chất cấm, hoặc các hoạt chất ảnh hưởng trực tiếp đến gan, thận, tim mạch. Người sử dụng có nguy cơ suy gan, suy thận cấp, loạn nhịp tim, đột quỵ, rối loạn tâm thần, trầm cảm, tổn thương hệ tiêu hóa, nội tiết. Bác sĩ khuyến cáo giảm cân là một quá trình đòi hỏi sự kiên trì, khoa học và an toàn, việc tìm đến những giải pháp nhanh - rẻ đôi khi phải trả giá bằng sức khỏe, thậm chí là mạng sống. Đặc biệt với lứa tuổi vị thành niên là độ tuổi đang phát triển mạnh về thể chất và tâm lý, việc sử dụng thuốc giảm cân sai cách sẽ gây ảnh hưởng lâu dài đến hệ nội tiết, xương khớp và khả năng sinh sản về sau. Thúy Quỳnh"
VN Express,https://vnexpress.net/benh-vien-o-nghe-an-tieu-huy-giay-to-rac-thai-sai-cach-4898512.html,Tin tức,"Nghệ An,giấy tờ,bệnh viện đốt hồ sơ","Thứ sáu, 13/6/2025, 17:00 (GMT+7)",Bệnh viện ở Nghệ An tiêu hủy giấy tờ rác thải sai cách,"Bảo vệ và nhân viên Bệnh viện Y học cổ truyền Nghệ An đưa một số hồ sơ bệnh án được phân loại là rác ra bờ kênh để đốt thay vì tiêu hủy đúng quy trình. Chiều 12/6, tại bờ kênh Bắc, TP Vinh, 3 người thuộc Bệnh viện Y học cổ truyền Nghệ An dùng xe kéo rác chở các tập giấy đến tập kết thành 2-3 đống bên bờ kênh rồi châm lửa đốt, khói bốc lên mù mịt cả một vùng. Trong số rác bị đốt có nhiều tờ giấy ghi tên bệnh nhân đang điều trị tại các khoa của bệnh viện. Sau khi người dân phát hiện vụ việc và quay video đăng lên mạng xã hội, bệnh viện cử người đến dập lửa rồi đưa số giấy tờ trên về ""để phối hợp với công ty môi trường tiêu hủy theo đúng quy định"". Trả lờiVnExpresschiều 13/6, một lãnh đạo Bệnh viện Y học cổ truyền Nghệ An giải thích đơn vị thực hiện đợt tiêu hủy rác tái chế, gồm các bệnh án in lỗi tên tuổi, tình trạng bệnh... cùng các loại bìa carton đựng thuốc. Rác này đã được phân loại và bệnh viện đã ký hợp đồng với công ty môi trường để xử lý. Tuy nhiên, trong quá trình vận chuyển rác từ Khoa Kiểm soát Nhiễm khuẩn ra bờ kênh Bắc gần bệnh viện để tập kết, nhân viên bảo vệ hiểu nhầm rằng số giấy tờ này được phép tiêu hủy ngay nên đã châm lửa đốt. Theo đại diện bệnh viện, hồ sơ bệnh án nội trú và ngoại trú phải được lưu trữ 10-20 năm theo Luật Khám bệnh, chữa bệnh. Thời gian lưu trữ phụ thuộc vào số lượng hồ sơ. Thông thường, cứ hai năm một lần, bệnh viện sẽ thành lập hội đồng và gửi thông báo đến Sở Y tế Nghệ An, sau khi Sở đồng ý mới được tiêu hủy. ""Trong đợt này, không có chủ trương tiêu hủy các giấy tờ còn trong thời gian lưu trữ"", ông nói. Sở Y tế đang xác minh vụ việc, hiện chưa có ý kiến. Bệnh viện Y học cổ truyền Nghệ An được thành lập năm 1964, hiện có 23 khoa phòng và trung tâm, với quy mô 750 giường bệnh theo kế hoạch. Số lượng bệnh nhân điều trị nội trú mỗi ngày trung bình từ 1.200 đến 1.400 người. Dự kiến Bệnh viện Y học cổ truyền Nghệ An sẽ triển khai bệnh án điện tử vào tháng 9. Đức Hùng"
VN Express,https://vnexpress.net/be-4-tuoi-ngung-tho-sau-khi-roi-xuong-ao-ca-4898524.html,Tin tức,"TP HCM,té ao,ngạt nước,sơ cứu ngưng tim ngưng thở","Thứ sáu, 13/6/2025, 16:51 (GMT+7)",Bé 4 tuổi ngưng thở sau khi rơi xuống ao cá,"TP HCMBé trai 4 tuổi được gia đình phát hiện nằm sấp xuống nước ở ao cá sau nhà, đưa lên bờ đã mê man, phải ấn tim khoảng 4 phút mới tự thở được. Ngày 13/6, BS.CK2 Nguyễn Minh Tiến, Phó giám đốc Bệnh viện Nhi đồng Thành phố, cho biết bệnh nhi được bệnh viện ở Tiền Giang sơ cứu, cho thở oxy, chuyển đến TP HCM trong tình trạng hôn mê, co giật. Xét nghiệm cho thấy thiếu oxy máu, Xquang phổi thâm nhiễm hai phế trường. Kíp điều trị xác định bệnh nhingạt nướcgiờ thứ 6, thiếu oxy não, viêm phổi hít, được điều trị đặt nội khí quản, chống phù não, chống co giật... Sau gần hai tuần hồi sức tích cực, bé cải thiện dần, cai máy thở, tự thở khí trời. Bác sĩ Tiến khuyến cáo dịp hè, trẻ được nghỉ học ở nhà, phụ huynh lo toan công việc bận bịu, thiếu sự trông nom, quan sát trẻ nên dễ dẫn đến sự cố đáng tiếc. Cần biết cách sơ cứu ấn tim (ấn ngực ½ dưới của xương ức), hà hơi thổi ngạt khi trẻ có biểu hiện tím tái ngưng thở. ""Lưu ý không xốc nước, lăn lu, ấn bụng... làm mất thời gian vàng cứu trẻ"", bác sĩ nói. Những biện pháp này đều không có tác dụng mà còn trì hoãn quá trình cấp cứu ngưng thở ngưng tim, dẫn đến tử vong hoặc cứu sống được trẻ nhưng để lại di chứng não nặng nề. Đồng thời, phụ huynh không cho trẻ tự đi tắm sông, tắm suối mà nên cho đi bơi ở hồ, luôn để mắt theo dõi con ngay cả trong hồ bơi có nhân viên bảo hộ. Các công trình xây dựng công cộng có đào hố khi mưa to ngập nước phải có rào bảo vệ và bảng cấm, tránh trường hợp trẻ đi chơi sẩy chân té hố, hầm cống... gây tai nạn đáng tiếc. Nếu trẻ chưa biết bơi, phụ huynh nên tranh thủ dịp hè cho trẻ học bơi. Các bước cấp cứu ngưng tim, ngưng thở. Video:Trung tâm Cấp cứu 115 TP HCM Lê Phương"
VN Express,https://vnexpress.net/chang-trai-tang-20-cm-chieu-cao-trong-2-nam-4893730.html,Tin tức,"Hà Nội,lùn tuyến yên,cao thêm 20 cm,Mao đệ","Thứ sáu, 13/6/2025, 13:45 (GMT+7)",Chàng trai tăng 20 cm chiều cao trong 2 năm,"Hà NộiNguyễn Văn Dũng, 23 tuổi, mắc bệnh lùn tuyến yên, cơ thể chỉ như trẻ 7 tuổi, sau hai năm đã tăng thêm 20 cm nhờ dùng hormone thay thế. Khi 17 tuổi, Dũng (còn gọi là Mao Đệ), một Youtuber nổi tiếng về ẩm thực, từng được mẹ đưa đến bệnh viện trung ương khám để cải thiện chiều cao. Tuy nhiên, việc điều trị quá muộn (gần 18 tuổi) khiến các bác sĩ không thể can thiệp hiệu quả. Chi phí điều trị ở nước ngoài quá lớn, vượt khả năng của gia đình. Mẹ con anh đành chấp nhận số phận. Ở tuổi 23, khi đã tự lập về tài chính, Dũng khát khao được cao lớn, lập gia đình như những người đàn ông bình thường khác. Anh tìm đến bác sĩ Nguyễn Bá Hưng, chuyên khoa Nam học, thành viên Hội Nam khoa Mỹ và Hội Y học Tình dục Quốc tế, Châu Á Thái Bình Dương. Qua khám và xét nghiệm, Dũng được chẩn đoán suy sinh dục do suy bán phần thùy trước tuyến yên. Đây là một thể bệnh lùn tuyến yên ít gặp, tỷ lệ mắc dưới 1/10.000 dân. Nguyên nhân có thể là bất thường bẩm sinh, gene, chấn thương hoặc tác dụng phụ của một số loại thuốc. Tình trạng này khiến cơ thể không tiết đủ hormone tăng trưởng và hormone hướng sinh dục, dẫn đến không phát triển chiều cao cũng như không dậy thì hoàn toàn. Suy sinh dục do suy tuyến yên có thể ảnh hưởng ở bất kỳ giai đoạn phát triển nào của cơ thể. Nếu mắc bệnh ở thời kỳ bào thai, trẻ sẽ chậm phát triển vận động, chậm dậy thì, thấp lùn toàn diện và không phát dục. Trường hợp mắc bệnh ở tuổi tiền dậy thì, cơ thể và cơ quan sinh dục phát triển dang dở, dậy thì không hoàn toàn. Còn nếu mắc bệnh sau tuổi dậy thì, cơ thể và cơ quan sinh dục đã phát triển trước đó nhưng do thiếu hụt hormone tuyến yên dẫn đến ""thiến sinh học"", cơ quan sinh dục teo dần, vô sinh thứ phát và lão hóa sớm. Bác sĩ Hưng chỉ định liệu pháp hormone thay thế, kèm theo hướng dẫn về chế độ ăn uống, sinh hoạt và tập luyện. Sau 3-6 tháng, cơ thể Dũng thay đổi rõ rệt, cao lớn và khỏe mạnh hơn. Sau hai năm điều trị, chàng trai đã cao thêm 20 cm, đạt 1,4 m. Kích thước các cơ quan đều tăng lên. Hiện tại, Dũng vẫn tiếp tục điều trị với phác đồ kìm hãm sự phát dục để đạt chiều cao tối ưu. Liệu pháp bổ sung hormone là phương pháp duy nhất chữa trị tình trạng này, dựa trên nguyên tắc thiếu hụt hormone nào thì bổ sung loại đó. Tuy nhiên, việc điều trị còn gặp nhiều khó khăn do bệnh hiếm và chi phí thuốc đắt đỏ. Thực tế, phần lớn bệnh nhân thường không được điều trị bằng hormone tăng trưởng vì cho rằng đã qua 18 tuổi. Thay vào đó, họ chỉ được điều trị theo chuyên khoa nam học, dẫn đến phát dục nhanh nhưng chiều cao tăng hạn chế. Nếu không tiếp cận và điều trị đúng, cơ thể sẽ không phát triển được, gây rối loạn nhiều cơ quan khác. Bác sĩ Hưng khuyến cáo suy sinh dục do suy tuyến yên là bệnh lý hiếm gặp và vẫn còn nhiều ""bí ẩn"" trong điều trị, không chỉ ở Việt Nam mà cả trên thế giới. Phát hiện sớm là yếu tố then chốt giúp việc điều trị thuận lợi, có khả năng đạt được chiều cao và phát dục như người bình thường. Thúy Quỳnh"
