Source,URL,Category,Keyword,Time,Title,Content
VN Express,https://vnexpress.net/manulife-hop-tac-dao-tao-nang-cao-kien-thuc-y-te-cho-tu-van-vien-4914415.html,Doanh nghiệp,"Bảo hiểm nhân thọ,Manulife Việt Nam,Manulife","Thứ ba, 15/7/2025, 11:00 (GMT+7)",Manulife hợp tác đào tạo nâng cao kiến thức y tế cho tư vấn viên,"Manulife Việt Nam ký kết hợp tác Trường Đại học Y Hà Nội và Hội Thầy thuốc Trẻ Việt Nam, triển khai chương trình đào tạo sức khỏe cộng đồng cho tư vấn viên bảo hiểm, bắt đầu từ tháng 8. Lễ ký kết diễn ra ngày 11/7 tại Hà Nội. Theo thỏa thuận, Viện Đào tạo Y học Dự phòng và Y tế Công cộng - Trường Đại học Y Hà Nội và Hội Thầy thuốc Trẻ Việt Nam sẽ xây dựng chương trình đào tạo, tập trung vào các bệnh lý truyền nhiễm và bệnh không lây phổ biến trong cộng đồng. Nội dung chú trọng yếu tố chuyên môn và tính thực tiễn. Ngoài nền tảng lý thuyết, tư vấn viên được hướng dẫn đọc hiểu kết quả khám sức khỏe, diễn giải các xét nghiệm thông dụng và tư vấn những vấn đề y tế phù hợp với quyền lợi bảo hiểm. Đội ngũ bác sĩ, chuyên gia từ các đơn vị trực tiếp tham gia giảng dạy. Những học viên hoàn thành khóa học và vượt qua kiểm tra năng lực sẽ được cấp chứng nhận từ Trường Đại học Y Hà Nội. Đại diện Manulife cho biết, đây là bước đi chiến lược nhằm nâng cao chất lượng dịch vụ, đồng thời phát triển đội ngũ tư vấn viên ""thế hệ mới"" - chuyên nghiệp, am hiểu tài chính và sức khỏe. Với kiến thức được trang bị, tư vấn viên sẽ hỗ trợ khách hàng tốt hơn trong việc giải đáp quyền lợi bảo hiểm, hướng dẫn phòng bệnh và xây dựng lối sống tích cực. Theo bà Tina Nguyễn, Tổng giám đốc Manulife Việt Nam, dự án thể hiện cam kết phát triển bền vững với trọng tâm là con người. ""Chúng tôi mong muốn mỗi tư vấn viên không chỉ là chuyên gia tài chính mà còn là người bạn đồng hành cùng khách hàng trên hành trình bảo vệ sức khỏe và tài chính"", bà nói. Theo PGS. TS. BS. Lê Minh Giang, Viện trưởng Viện đào tạo Y học dự phòng, Trường Đại học Y Hà Nội, việc Manulife chủ động phối hợp cơ sở đào tạo chuyên môn y khoa cho thấy tư duy tiên phong, chiến lược dài hạn nhằm nâng cao chất lượng tư vấn sức khỏe trong lĩnh vực bảo hiểm. ""Mô hình liên kết đào tạo này có thể nhân rộng trong tương lai, góp phần chuẩn hóa chất lượng tư vấn bảo hiểm và mở rộng vai trò của bảo hiểm trong hoạt động chăm sóc sức khỏe cộng đồng"", ông Giang nói. Đại diện Manulife cho biết thêm, việc nâng cao kiến thức y khoa cho đội ngũ tư vấn viên là một phần trong tầm nhìn dài hạn của doanh nghiệp, nhằm xây dựng hệ sinh thái bảo hiểm chất lượng, chuyên nghiệp, để mỗi tư vấn viên là một người đồng hành trên hành trình bảo vệ tài chính và sức khỏe cho khách hàng. Hoàng Đan"
VN Express,https://vnexpress.net/chung-khoan-dao-chieu-giam-manh-4914592.html,Chứng khoán,"Chứng khoán,VN-Index,mua bán chứng khoán,Đầu tư chứng khoán","Thứ ba, 15/7/2025, 15:49 (GMT+7)",Chứng khoán đảo chiều giảm mạnh,"Áp lực chốt lời cổ phiếu vốn hóa lớn khiến VN-Index đảo chiều giảm mạnh trong 30 phút cuối, sụt gần 10 điểm và cắt đứt chuỗi tăng 7 phiên liên tục. VN-Index sáng nay tăng mạnh, tiến gần vùng giá 1.480 điểm, đúng với dự đoán của nhiều công ty chứng khoán về nhịp hưng phấn kéo dài. Tuy nhiên, thị trường xoay chiều trong khoảng 30 phút cuối phiên bởi áp lực chốt lời dâng lên đột ngột ở nhiều cổ phiếu trụ. Chỉ số đại diện cho sàn TP HCM vì thế mất gần 10 điểm, đóng cửa tại 1.460 điểm. Lực bán mạnh khiến số lượng cổ phiếu giảm hôm nay xấp xỉ 200 mã, trong khi bên tăng chưa đến 140 mã. Sắc đỏ bao trùm rổ vốn hóa lớn khi 25 trong số 30 mã đóng cửa dưới tham chiếu. Cổ phiếu ngân hàng ghì thị trường xuống mạnh nhất. VCB mất 1,6% xuống 61.400 đồng, đứng đầu danh sách những mã tác động tiêu cực đến VN-Index. BID, TCB, VPB, ACB, HDB và TPB cũng giảm hơn 1% so với tham chiếu. Nhóm dầu khí chịu áp lực chốt lời tương tự, khiến hầu hết cổ phiếu thành phần đảo chiều từ tăng thành giảm. POW mất 1,8%, còn hai mã trụ là GAS và PLX lần lượt mất 0,7% và 0,5%. Nhóm bất động sản có sự phân hóa mạnh với nhiều mã vốn hóa vừa và lớn như VIC, VHM, VRE, KDH, NVL đóng cửa tại giá giảm. Ngược lại, một số mã vốn hóa nhỏ như LDG và HDC vẫn tăng hết biên độ, chốt phiên trong tình trạng không có bên bán. Nhóm chứng khoán có diễn biến tương đồng khi BSI, VCI, VDS giảm 1,2-2,4%, còn SSI, VND, VIX, HCM đều tăng trên 1%. SBS, một cổ phiếu ngành chứng khoán đang giao dịch trên sàn UPCoM, thậm chí tăng hết biên độ 14%. Nhờ hút mạnh dòng tiền của nhà đầu tư nước ngoài, SSI là trụ đỡ quan trọng, giúp thị trường tránh phiên giảm sâu hơn. Mã này có lúc chạm giá trần 31.800 đồng, sau đó thu hẹp biên độ và đóng cửa tại 30.500 đồng, tăng 2,5%. Xếp tiếp theo trong danh sách những cổ phiếu tác động tích cực đến VN-Index là LPB, MWG, SSB và SAB. Các mã tăng mạnh trong phiên sáng, nhưng đến chiều chỉ còn 0,1-2%. Thanh khoản sàn TP HCM đạt hơn 34.500 tỷ đồng, cao hơn phiên trước khoảng 3.000 tỷ đồng. Dòng tiền tỏa đều ở nhiều nhóm ngành nên thị trường có đến 6 mã ghi nhận giá trị giao dịch nghìn tỷ. SSI dẫn đầu trong số này với 62 triệu cổ phiếu được sang tay thành công, trị giá 1.935 tỷ đồng. Những mã xếp sau lần lượt là HPG, SHB, VCI, VND và VIX. Tín hiệu tích cực là khối ngoại miệt mài gom hàng 10 phiên liên tiếp. Nhà đầu tư ngoại hôm nay giải ngân 3.845 tỷ đồng, trong khi bán ra chưa đến 2.730 tỷ đồng. Nhóm này rót tiền nhiều vào cổ phiếu DXG, VPB, SSI và SHB. Theo nhận định của một số công ty chứng khoán, chỉ số rung lắc khi tiến vào vùng kháng cự mạnh (1.480 điểm) là điều tất yếu. Nhà đầu tư được khuyến nghị chốt lời từng phần và hạn chế mua mới trong giai đoạn này. Việc giải ngân có thể được cân nhắc trong các nhịp điều chỉnh tiếp theo, nhưng nên tập trung vào cổ phiếu thuộc những nhóm ngành dẫn dắt như ngân hàng, chứng khoán, bất động sản. Phương Đông"
VN Express,https://vnexpress.net/hai-phong-dang-tro-thanh-trung-tam-logistics-trong-diem-ca-nuoc-4914696.html,Vĩ mô,"Hải Phòng,công nghiệp,logistics,Chủ tịch nước Lương Cường,kinh tế Hải Phòng","Thứ ba, 15/7/2025, 19:10 (GMT+7)",'Hải Phòng đang trở thành trung tâm logistics trọng điểm cả nước',"Chủ tịch nước Lương Cường khẳng định vai trò chiến lược của TP Hải Phòng khi đang trở thành trung tâm kinh tế, công nghiệp và logistics trọng điểm của cả nước. Quan điểm này được Chủ tịch nước Lương Cường nêu khi phát biểu tại Hội nghị Xúc tiến đầu tư Hải Phòng 2025, trong khuôn khổ Tuần lễ Hội nghị ABAC 3, ngày 15/7. Chủ tịch nước đánh giá cao tinh thần chủ động hội nhập, cam kết cải thiện môi trường đầu tư của thành phố. ""Hải Phòng đang trỗi dậy như một trung tâm kinh tế, công nghiệp và logistics trọng điểm của phía bắc và cả nước"", ông đánh giá. Năm 2024, kim ngạch xuất nhập khẩu của Việt Nam đạt hơn 786 tỷ USD, đưa Việt Nam vào top 20 quốc gia thương mại lớn nhất toàn cầu. Trong đó, Hải Phòng là cửa ngõ xuất khẩu lớn nhất miền Bắc, đóng vai trò then chốt trong mạng lưới chuỗi cung ứng toàn cầu. Trong bối cảnh địa chính trị và công nghệ biến động, Chủ tịch nước nhấn mạnh khả năng thích ứng và kiến tạo là yếu tố sống còn, và Hải Phòng là nơi hội tụ các yếu tố này với hệ sinh thái cảng biển, công nghiệp và đô thị thông minh. Ông cho rằng những dự án này giúp nâng cao năng lực thông quan, tạo ra hàng chục nghìn việc làm, và khẳng định vai trò của thành phố như một cực tăng trưởng chiến lược. Theo ông, việc Quốc hội thông qua Nghị quyết cho phép thí điểm khu thương mại tự do đầu tiên tại miền Bắc là ""đường băng thể chế"" để Hải Phòng bứt phá trở thành trung tâm kinh tế năng động, sáng tạo hàng đầu khu vực. Ông kêu gọi cộng đồng doanh nghiệp không chỉ dừng lại ở trao đổi cơ hội đầu tư, mà cùng ""kiến tạo giá trị, lan tỏa tri thức, hướng tới một châu Á – Thái Bình Dương cởi mở, bao trùm và kiên cường"". Tại hội nghị, TP Hải Phòng trao Giấy chứng nhận đăng ký đầu tư, biên bản ghi nhớ hợp tác với tổng số vốn hơn 15,5 tỷ USD. Trong đó có dự án hạ tầng công nghiệp ở Tân Trào, Ngũ Phúc, Thủy Nguyên, Trấn Dương - Hòa Bình và cụm dự án cảng Lạch Huyện (bến số 9 đến 12), cùng dự án FDI công nghệ cao và tăng trưởng xanh. Tuần lễ Hội nghị ABAC 3 năm nay quy tụ hơn 1.000 đại biểu trong nước và quốc tế, lãnh đạo cấp cao của Đảng, Nhà nước, các tổ chức quốc tế, hiệp hội doanh nghiệp và tập đoàn lớn đến từ 21 nền kinh tế APEC. Nhiều đoàn doanh nghiệp quốc tế đã khảo sát thực tế tại các khu công nghiệp và cảng biển của Hải Phòng. Đại diện các nhà đầu tư như Tập đoàn Trakmotive (Mỹ), hiệp hội doanh nghiệp Hàn Quốc, châu Âu... đều bày tỏ mong muốn tiếp tục mở rộng hợp tác, đầu tư tại Hải Phòng. Lãnh đạo thành phố cho biết sẽ xây dựng chính quyền kiến tạo, lấy sự thuận tiện và hài lòng của doanh nghiệp làm thước đo, nhằm tạo mọi điều kiện kinh doanh, môi trường tốt nhất cho các nhà đầu tư. Lê Tân"
VN Express,https://vnexpress.net/trung-tam-tai-chinh-la-kenh-dan-von-tot-cho-tp-hcm-sau-sap-nhap-4914239.html,Vĩ mô,"TP HCM,trung tâm tài chính,kênh dẫn vốn","Thứ ba, 15/7/2025, 06:27 (GMT+7)",'Trung tâm tài chính là kênh dẫn vốn tốt cho TP HCM sau sáp nhập',"Trung tâm tài chính quốc tế sẽ góp phần giải quyết nhu cầu vốn rất lớn cho sự phát triển của TP HCM sau sáp nhập, theo chuyên gia. Nhận định được ông Trương Minh Huy Vũ, Viện trưởng Nghiên cứu phát triển TP HCM (HIDS) nêu tại ""Hội nghị tập huấn Kỹ năng quản lý, điều hành, giám sát và giải quyết tranh chấp hướng đến thành lập Trung tâm Tài chính Quốc tế tại TP HCM"" chiều 14/7. ""TP HCM mới có nhu cầu vốn rất lớn để đầu tư các dự án metro, đường sắt, khu công nghiệp và nhà ở xã hội. Trong đó, trung tâm tài chính quốc tế sẽ là kênh dẫn vốn hiệu quả cho địa phương"", ông Vũ đánh giá. Kể từ 1/7, TP HCM sau sáp nhập với Bình Dương và Bà Rịa - Vũng Tàu đã hình thành một ""siêu đô thị"" với diện tích 6.772 km2 và hơn 14 triệu dân. Đầu tàu kinh tế chiếm 23% GDP cả nước, là trung tâm của nhiều ngành kinh tế trọng điểm như tài chính, công nghệ và dịch vụ. Chỉ tính riêng TP HCM cũ theo quy hoạch công bố đầu năm 2025, ước tính nhu cầu đầu tư giai đoạn 2026-2030 cần 4,4 triệu tỷ đồng. Trong đó vốn từ ngân sách chỉ đảm đương 1,1 triệu tỷ đồng. Điều này cho thấy quy hoạch cũ của đầu tàu kinh tế đã rất ""khát"" vốn thì quy mô mới càng có nhu cầu lớn hơn. Theo Nghị quyết về phát triển trung tâm tài chính quốc tế đã được Quốc hội thông qua, Việt Nam sẽ phát triển một trung tâm tài chính quốc tế, đặt tại TP HCM và Đà Nẵng. Trong đó, TP HCM phát triển thị trường vốn, ngân hàng, thị trường tiền tệ, cơ chế thử nghiệm (sandbox) về fintech, đổi mới sáng tạo lĩnh vực tài chính, các sàn giao dịch chuyên biệt, nền tảng giao dịch mới. Phó chủ tịch UBND TP HCM Nguyễn Văn Dũng nhận định Thành phố nằm ở trung tâm Đông Nam Á, dễ dàng kết nối với các trung tâm tài chính lớn, thuận lợi cho giao thương, trao đổi vốn quốc tế. Địa phương cũng có nền tảng tốt, tập trung nhiều ngân hàng, công ty chứng khoán, tổ chức tài chính. Để trung tâm tài chính quốc tế tại TP HCM phát huy vai trò kênh dẫn vốn hiệu quả, các chuyên gia gợi ý các kinh nghiệm quốc tế từ Trung tâm Tài chính Quốc tế Astana (AIFC) tại Kazakhstan trong việc phát triển sản phẩm, cơ chế tư pháp để thu hút và tạo niềm tin nhà đầu tư. Ông Zharas Mussabekov, Giám đốc Tài chính Sàn Giao dịch Quốc tế Astana (AIX) thuộc AIFC, cho biết sàn này cung cấp nhiều sản phẩm tài chính đa dạng, bao gồm cổ phiếu, trái phiếu và các sản phẩm cấu trúc (quỹ ETF, công cụ ETN). Trong đó, cổ phiếu gồm chào bán lần đầu (IPO), chào bán thêm (SPO) và niêm yết từ thị trường khu vực. Trái phiếu trên sàn trải dài từ trái phiếu lãi suất cố định, miễn thuế, phát hành riêng lẻ cho nhà đầu tư tổ chức, hay trái phiếu hồi giáo (Sukuk, tuân thủ luật Shariah), trái phiếu xanh và trái phiếu xã hội. Vốn hóa thị trường trên AIX đã đạt 82,1 tỷ USD vào cuối năm 2024, tăng 7,7% so với 2023. ""Số lượng niêm yết mới tăng gần gấp đôi trong nửa đầu năm 2025, phản ánh sự tự tin bền vững từ cả bên phát hành và nhà đầu tư"", ông Mussabekov nói. Điểm tạo lợi thế giúp thu hút dòng vốn nước ngoài của AIX còn nhờ khung pháp lý thân thiện, dễ hiểu đối với nhà đầu tư quốc tế, cùng cơ sở hạ tầng công nghệ hỗ trợ bởi NASDAQ. Trong đó, AIFC có tòa án giải quyết tranh chấp thương mại và Trung tâm Trọng tài Quốc tế (CIAC) gồm 61 trọng tài viên và trung gian quốc tế từ EU, Anh, Mỹ, Trung Quốc đại lục, Hong Kong, Nhật Bản và các nước khác. Theo ông Trương Minh Huy Vũ, trước quan ngại về độ vênh giữa hệ thống pháp luật Việt Nam và thông luật (common law) thường được sử dụng bởi các trung tâm tài chính quốc tế, giải pháp của AIFC có thể tham khảo. ""Astano có ví dụ rất hay về thuê ngoài trọng tài từ các đơn vị uy tín từ Anh hoặc Hong Kong, sử dụng các thẩm phán quốc tế nổi tiếng để xây dựng lòng tin cho nhà đầu tư"", ông chỉ ra. Theo Nghị quyết về phát triển trung tâm tài chính quốc tế tại Việt Nam, các bên trong Trung tâm tài chính được sử dụng các phương thức giải quyết tranh chấp theo luật Việt Nam. Họ còn có thể giải quyết tranh chấp bằng trọng tài nước ngoài; trung tâm trọng tài quốc tế thuộc Trung tâm tài chính quốc tế; trọng tài Việt Nam và tòa án nước ngoài, Việt Nam. Ngoài ra, với việc trung tâm tài chính quốc tế tại TP HCM có ranh giới địa lý xác định, gồm một phần quận 1 cũ và gần như toàn bộ bán đảo Thủ Thiêm, việc quản lý hiệu quả cũng là thách thức cần học hỏi thêm kinh nghiệm quốc tế. ""Vấn đề đặt ra là quản lý các hoạt động cả trong và ngoài ranh giới này, đảm bảo các chính sách thúc đẩy sự sáng tạo, dòng vốn chảy vào và tạo nên sự thịnh vượng nhưng quản lý được các rủi ro trong ngành tài chính"", ông Vũ lưu ý. Phó chủ tịch TP HCM Nguyễn Văn Dũng cho biết Thành phố đang tập trung định hướng phát triển các sản phẩm chuyên biệt, phát huy thế mạnh của địa phương, mục tiêu thành trung tâm tài chính quốc tế hàng đầu, nâng tầm vị thế của Việt Nam trong mạng lưới tài chính toàn cầu, gắn với động lực tăng trưởng kinh tế. Ông kỳ vọng quan hệ TP HCM và Trung tâm Tài chính Astana tiếp tục phát triển, tạo điều kiện hai bên chia sẻ kinh nghiệm lẫn nhau. Viễn Thông"
VN Express,https://vnexpress.net/can-giup-nguoi-dan-tu-tin-mua-tien-so-nhu-mua-vang-4914613.html,Hàng hóa,"BTC,Bitcoin,Tiền số,tài sản số,thí điểm tài sản số","Thứ ba, 15/7/2025, 16:36 (GMT+7)",'Cần giúp người dân tự tin mua tiền số như mua vàng',"Lãnh đạo Dragon Capital Việt Nam nói cần tạo ra khung pháp lý sao cho người dân có thể tự tin đầu tư các token như cách mua vàng tích sản. Trong buổi tọa đàm sáng nay doBáo Lao Độngtổ chức, các diễn giả đóng góp ý kiến về việc triển khai Luật Công nghiệp Công nghệ số và dự thảo nghị định thí điểm tài sản số. Ông Will Ross, Giám đốc Tiếp thị và Phân phối của Dragon Capital Việt Nam, nêu quan điểm các nhà làm luật cần tạo ra môi trường sao cho nhà đầu tư có thể tự tin rót vốn vào nhiều loại tài sản khác nhau, thay vì chỉ tập trung vào một số kênh truyền thống, trong đó phổ biến như mua vàng tích trữ. ""Cần tạo ra khung pháp lý để nhà đầu tư tự tin mua một token như mua vàng"", ông nhấn mạnh. Ông Ross chỉ ra lịch sử thương mại quốc tế của Việt Nam xuất phát đầu tiên từ hàng nông sản, tiếp đó đến hàng gia công khi tham gia chuỗi cung ứng toàn cầu. Tuy nhiên, cả hai loại hàng trên đều mang biên lợi nhuận thấp cho đất nước. Ông cho rằng đã đến thời điểm Việt Nam cần tập trung vào mặt hàng thứ ba là sản phẩm công nghệ số, nhóm có thể mang về biên lợi nhuận cao cho nội địa. Tọa đàm còn có sự góp mặt của ông Richard Teng, CEOBinance- sàn giao dịch tiền số lớn nhất thế giới. Tính đến tháng 6, sàn này chiếm hơn 41% tổng thị phần về khối lượng giao dịchtiền sốhàng ngày trên toàn cầu. Ông chỉ ra một sự thật rằng dù có luật hay không, việc áp dụng tài sản số đã diễn ra trên thế giới với tốc độ rất mạnh. Đó là xu hướng tất yếu khó đi ngược. Tại Mỹ - quốc gia có nền kinh tế lớn nhất, các nhà lãnh đạo đã ""đánh cược"" vềblockchain. Ngoài ra, ngày càng nhiều tổ chức và định chế tài chính lớn cũng công nhận tiền số và tham gia tích cực vào thị trường. Điều này càng đòi hỏi các quốc gia khác phải theo kịp. Lãnh đạo Binance đề xuất cần khung pháp lý ""thông minh"", tức vừa quản lý được rủi ro nhưng vẫn tạo ra không gian sáng tạo để doanh nghiệp trong nước cạnh tranh toàn cầu và thu hút vốn nước ngoài. Ông đánh giá cao việc Việt Nam đã có những luật cơ bản để công nhận thị trường tài sản số. Sàn giao dịch này cam kết phối hợp chặt chẽ với cơ quan quản lý, các doanh nghiệp trong ngành và cộng đồng tại Việt Nam nhằm xây dựng một hệ sinh thái tài chính lành mạnh, bền vững, sáng tạo và tuân thủ quy định pháp lý. Tuy nhiên, lãnh đạo sàn giao dịch lớn nhất thế giới nhấn mạnh nếu quản lý quá chặt chẽ, tập trung vào việc kiểm soát tối đa rủi ro, nhà đầu tư sẽ tìm đến các sàn giao dịch hoặc thị trường không hợp pháp. Các sàn này có thể lỏng lẻo về yêu cầu xác thực (KYC), quy định chống rửa tiền hay tài trợ khủng bố... dẫn đến nhiều rủi ro. ""Công nghệ giống như là dòng nước, một khi chúng ta chặn ở đầu này, tự khắc nó sẽ tìm được ngả khác để chảy tiếp"", ông Richard ví von. Đại diện cộng đồng doanh nghiệp trong nước, ông Nguyễn Thành Trung, CEO ""kỳ lân"" tỷ USD Sky Mavis, nói bất ngờ vì các nhà làm luật đã tiếp cận rất sớm với thị trường mới mẻ như tài sản số. Trong bối cảnh Việt Nam là một trong những thị trường phát triển rất nhanh về blockchain, việc có luật công nhận tạo ra ""thời cơ tuyệt vời"" cho các doanh nghiệp. Tuy nhiên, ông Trung cũng chỉ ra một số bất cập về dự thảo thí điểm thị trường tài sản số.Trước đây, tài sản số là ""vùng xám"" trong pháp luật, tức không cấm nhưng chưa công nhận. Còn theo khung pháp lý dự kiến, Nhà nước chỉ cho phép giao dịch tài sản mã hóa trên cơ sở tập trung thông qua các đơn vị được cấp phép. Các hoạt động giao dịch và cung cấp dịch vụ khác không được cấp phép sẽ bị cấm. Phần này có thể bao hàm cả các hoạt động phát triển công nghệ và cung cấp dịch vụ kỹ thuật thuần túy trong lĩnh vực tài sản mã hóa. Theo lãnh đạo Sky Mavis, sẽ chưa hợp lý khi một loại tài sản phi tập trung lại được quản lý theo hướng tập trung. Nếu quản lý tập trung quá nhiều, thị trường có thể mất cạnh tranh với thế giới vì chỉ một số lượng doanh nghiệp nhất định được hoạt động, khó đảm bảo họ có thể đổi mới sáng tạo kịp thế giới. ""Luật có sớm là tốt nhưng nếu không quản lý đúng sẽ làm thụt lùi cơ hội phát triển của các doanh nghiệp"", ông Trung bày tỏ. Mặt khác theo góc nhìn của PGS. TS Bình Nguyễn của Đại học RMIT, khung pháp lý tạm thời vẫn dựa trên nền tảng tập trung do trước mắt, vấn đề cần quan tâm nhất là việc người giao dịch như thế nào. Tuy nhiên, chuyên gia này cũng ủng hộ quan điểm cần khung pháp lý đủ ""mở"" để vừa quản lý tập trung tốt vấn đề giao dịch ban đầu, vừa tạo được không gian phi tập trung cho các đột phá tương lai. Ông gợi ý có thể học hỏi và hợp tác quốc tế trong quá trình tạo ra các quy định pháp luật trên tinh thần tạo ra môi trường cạnh tranh và phát triển dài hơi cho thị trường tài sản số. Tất Đạt"
