Source,URL,Category,Keyword,Time,Title,Content
ZNews,https://znews.vn/my-nhan-200-nam-co-mot-tang-le-sup-do-post1550308.html,Giải trí,Null,"Thứ năm, 1/5/2025 17:04 (GMT+7)",'Mỹ nhân 200 năm có một' Tăng Lê sụp đổ,"Sinađưa tin nữ diễn viên Tăng Lê vốn là một ngôi sao có hình tượng sang trọng, diễn xuất khá tốt, được yêu mến trong giới giải trí Hoa ngữ. Gần đây, cô trở thành tâm điểm công kích của hàng trăm triệu khán giả, danh tiếng sụp đổ chỉ sau một ngày. Cụ thể, một người hâm mộ Tăng Lê từ lâu (tạm gọi là A) vào ngày 26/3 đã phát hiện nhiều món đồ cô dành tặng cho nữ diễn viên đã bị bán lại trên mạng xã hội. Những món quà này có giá trị không nhỏ, vì vậy người này đã lên tiếng chỉ trích Tăng Lê không tôn trọng tình cảm của fan. Phía Tăng Lê cho biết một nhân viên đã lén lấy những vật lưu niệm của nữ diễn viên để đem bán, sự việc không liên quan tới Tăng Lê. Công ty cũng đã hứa sẽ giải quyết vấn đề. Tăng Lê bị fan tố bán đồ lưu niệm. Ảnh: Sina Sau đó, chính công ty của Tăng Lê đã trình báo sự việc với cảnh sát và kết quả là A bị kiện và thua cuộc, buộc phải xin lỗi Tăng Lê. Ngày 29/4, người hâm mộ này đăng lời xin lỗi, kể lại vụ việc và khẳng định sẽ không tiếp tục ủng hộ Tăng Lê nữa. Sự việc nhanh chóng nóng lên khi có rất nhiều người ủng hộ A. Họ cho rằng công ty quản lý của Tăng Lê và bản thân nữ diễn viên lạnh lùng, bạc bẽo, đối xử tệ bạc với chính người hâm mộ của mình. Lỗi sai xuất phát từ chính phía Tăng Lê nhưng cuối cùng fan A lại bị kiện và phải xin lỗi ngược. Không những vậy, khi fan A đăng bài xin lỗi, Tăng Lê còn vào bình luận: ""Từ trước tới nay tôi không thích can thiệp vào tranh chấp hay thị phi nào nhưng tôi thấu hiểu cảm xúc của bạn. Cảm ơn vì đã luôn ủng hộ tôi. Ôm bạn một cái, chúc bạn ngày quốc tế vui vẻ"". Tuy nhiên, thái độ của Tăng Lê đã khiến người hâm mộ chán nản. Sau đó, có rất nhiều chủ đề liên quan tới sự việc trở thành từ khóa nóng trên MXH Weibo như ""Tăng Lê mất đi người hâm mộ"" đạt 65 triệu lượt đọc, ""Thập Tam Châu unfollow Tăng Lê"" đạt hơn 120 triệu lượt đọc, ""Quan hệ công chúng ngạo mạn khiến Tăng Lê mất đi trái tim người hâm mộ"" đạt 170 triệu người xem. Sina đánh giá chỉ trong một ngày danh tiếng của Tăng Lê đã hoàn toàn sụp đổ. Tăng Lê sinh năm 1976, tốt nghiệp Học viện Hý kịch Trung ương và là bạn học cùng khóa với dàn mỹ nhân đình đám Hoa ngữ như Chương Tử Di, Hồ Tịnh, Viên Tuyền, Mai Đình, Tần Hải Lộ… Đây là năm học đào tạo ra nhiều ngôi sao tài năng nhất Trung Quốc. Trong số đó, Tăng Lê được coi là mỹ nhân. Nam diễn viên Bảo Kiếm Phong từng khen ngợi Tăng Lê: ""Cô ấy là mỹ nhân 200 năm mới xuất hiện"". Tăng Lê có nhan sắc ấn tượng.Ảnh: Sina Tăng Lê từng tham gia các phim nhưTân Liêu Trai Chí Dị, Hoàng Đế Truyền Kỳ Chu Nguyên Chương, Xin Đừng Hỏi Em Là Ai, Trai Tài Gái Sắc... và được bình chọn là ""ma nữ đẹp nhất màn ảnh"" thập niên 2000. Tuy nhiên, do tính cách bình thản chậm rãi, sự nghiệp của cô không thành công như các bạn cùng lớp. Cuốn sách đáng đọc về âm nhạc Sách khảo cứu Lịch sử opera Ýdo GS Gianni Kriscak cùng Hiền Nguyễn Soprano (nghiên cứu sinh tại Đại học Sư phạm Nghệ thuật Trung Ương), Trịnh Thị Oanh (giảng viên thanh nhạc tại Đại học Sư phạm Nghệ thuật Trung Ương) thực hiện. Sách ra mắt vào tháng 2 và nhanh chóng được bạn đọc đón nhận. Sách khảo cứu Lịch sử opera Ý là tác phẩm hiếm hoi về opera được thực hiện bằng tiếng Việt. Qua cuốn sách này, các tác giả đưa ra câu chuyện về một thành tựu văn hóa kinh điển của thế giới nhưng bằng góc nhìn nhẹ nhàng, dễ tiếp cận thay vì quá nặng nề, phức tạp. Các tác giả không đề cập quá nhiều tên, chi tiết và chỉ đưa vào cuốn sách những khoảnh khắc quan trọng, thú vị nhất trong giai đoạn đầu tiên của các vở opera.  Triệu Lộ Tư bị công kích Triệu Lộ Tư gây tranh cãi với hình ảnh chống nạng nhưng lại đi giày đế cao. Nhiều người vẫn còn nghi ngờ việc cô dàn dựng, dùng chuyện bệnh tật để thu hút sự chú ý.  Hình ảnh mới nhất của Triệu Lộ Tư Triệu Lộ Tư hứng khởi gặp lại người hâm mộ sau khoảng thời gian sức khỏe sa sút. Tại sự kiện, nữ diễn viên muốn gác lại quãng thời gian đáng quên, hướng tới năm mới tốt đẹp hơn.  4 ngôi sao bị ghét nhất 09:06 3/4/202509:063/4/2025Giải tríGiải trí 0 Dù là ngôi sao hạng A nhưng Dương Dương, Triệu Lộ Tư, Ngu Thư Hân, Thành Nghị đều vướng bê bối, nhiều yêu sách trong quá trình hợp tác đều bị người hâm mộ tẩy chay."
ZNews,https://znews.vn/phim-cua-ma-dong-seok-gay-sot-post1550266.html,Giải trí,Null,"Thứ năm, 1/5/2025 13:31 (GMT+7)",Phim của Ma Dong Seok gây sốt,"Theo tờSports Chosun, bộ phim hành độngHoly Night: Demon Huntersvừa có màn chào sân thành công ở thị trường Hàn Quốc, giành ngôi vương phòng vé ngay trong ngày đầu tiên công chiếu (30/4). Theo thống kê từ hệ thống quản lý vé toàn quốc, phim đã thu hút hơn 117.000 lượt khán giả trong ngày mở màn, nâng tổng số người xem tích lũy lên 121.321, vượt xa các đối thủ ra rạp cùng thời điểm. Đây cũng là thành tích mở màn vượt trội so với nhiều dự án bom tấn khác trong năm nhưHitman 2(100.621),The Match(91.471) hayOpposition Party(85.659). Với tình hình phòng vé hiện tại, bộ phim có Ma Dong Seok được giới quan sát dự đoán sẽ càn quét phòng vé xứ kim chi trong kỳ nghỉ lễ đầu tháng 5. Trong bối cảnh rạp Hàn đang bị cạnh tranh bởi hàng loạt dự án nội địa lẫn quốc tế, với nhiều cái tên sừng sỏ cùng công chiếu nhưThunderbolts,The PeachhayMinecraft: The Movie,Holy Night: Demon Huntersvẫn thu hút đông đảo khán giả nhờ dàn diễn viên thực lực và cốt truyện hấp dẫn, giàu tính giải trí. Sau ngày chiếu đầu tiên, tác phẩm nhận phản hồi khá tích cực về chất lượng. Bộ phim quy tụ dàn diễn viên đình đám xứ Hàn. Ảnh:IMDb. “Lần đầu thấy ác quỷ bị đánh mà thấy tội”, “Cứ có Ma Dong Seok là đảm bảo giải trí”, “Hài hước, hành động mãn nhãn, đúng kiểu dopamine nổ tung”, “Đấm đá đã mắt, diễn xuất của Jung Ji So khiến tôi nổi da gà”… là một số bình luận của khán giả trên mạng xã hội. Holy Night: Demon Huntersthuộc dòng occult action (hành động - trừ tà), kể về nhóm “thanh trừng bóng tối” gồm Ba-u (Ma Dong Seok), Sharon (Seohyun) và Kim Gun (Lee David) - những người sở hữu năng lực đặc biệt chuyên săn lùng và tiêu diệt các thế lực tà ác gieo rắc hỗn loạn trong thành phố. Phim do đạo diễn Lim Dae Hee chỉ đạo, quy tụ dàn sao đình đám. Theo truyền thông xứ Hàn, bộ phim tiếp tục củng cố vị thế của Ma Dong Seok như một ""ông hoàng phòng vé"", khi sở hữu chuỗi phim gây sốt đều đặn qua từng năm. Sau chuỗi thành công củaThe Outlaws 2(2022),The Outlaws 3(2023) vàThe Outlaws 4(2024), nam diễn viên dự kiến sẽ dắt túi thêm 1 bom tấn hành động có doanh thu ấn tượng năm nay. Những cuốn sách hay về ngành Công nghiệp Giải trí Tủ sách Nghệ thuật - Giải trígiới thiệu những cuốn sách hay và mới nhất về nền công nghiệp giải trí và các bộ môn nghệ thuật đại chúng tiêu biểu. Ngoài ra, tủ sách cũng đề xuất loạt tác phẩm đáng đọc về các nghệ sĩ nổi tiếng ở Việt Nam và thế giới, giúp độc giả hiểu hơn và biết thêm về những câu chuyện hậu trường, chưa từng được tiết lộ  Vì sao Brad Pitt chưa cầu hôn bạn gái Sau cuộc hôn nhân tan vỡ với Angelina Jolie, tài tử “F1” được cho là đang sợ hãi chuyện hôn nhân, chưa muốn tái hôn với bạn gái Ines de Ramon.  Thành Long nhận giải Thành tựu trọn đời Tại Locarno International Film Festival 2025, Thành Long được công bố là chủ nhân giải thưởng Thành tựu trọn đời. Nam diễn viên có bài viết dài chia sẻ cảm xúc trên mạng xã hội.  'Lật mặt 8' và nước đi của Lý Hải Phần 8 ""Lật mặt"" tiếp tục là nước đi của Lý Hải với đề tài tâm lý, gia đình. Phim có một số ý tưởng đáng khen, nhưng còn “an toàn” trong ngôn ngữ kể chuyện lẫn đường dây kịch bản."
ZNews,https://znews.vn/thanh-long-nhan-giai-thanh-tuu-tron-doi-post1550248.html,Giải trí,Null,"Thứ năm, 1/5/2025 09:03 (GMT+7)",Thành Long nhận giải Thành tựu trọn đời,"Theo tờSinchew, Liên hoan phim quốc tế Locarno lần thứ 78 (Locarno International Film Festival) ở Thụy Sĩ vừa công bố Thành Long là chủ nhân giải thưởng Thành tựu trọn đời của mùa giải năm nay. Nam diễn viên thông báo tin vui trên mạng xã hội, đồng thời gửi lời cảm ơn tới khán giả và các đồng nghiệp đã hỗ trợ mình trong suốt sự nghiệp, cho biết đây không phải thành tựu của riêng mình. “Từ một võ sinh vô danh trên phim trường, tôi đã đi một chặng đường dài để có được ngày hôm nay. Từ lúc ban đầu đi đóng phim chỉ vì một bữa cơm, đến bây giờ có biết bao người trên thế giới từng xem phim tôi đóng. Tôi luôn giữ cho mình một niềm tin đơn giản, là cố gắng thực hiện thật tốt từng cảnh quay. Những thước phim còn mãi với thời gian ấy không phải là thành tựu của riêng tôi, mà là ký ức của anh em Thành Gia Ban (nhóm diễn viên hành động hỗ trợ do Thành Long thành lập - PV) cùng nhau liều mạng tạo nên. Cảm ơn Liên hoan phim Locarno đã trao cho tôi giải thưởng Thành tựu trọn đời. Cảm ơn tất cả người hâm mộ trên thế giới”, ngôi saoTúy quyềnviết. Thành Long ở tuổi thất tuần vẫn miệt mài đóng phim. Ảnh:Xiaohongshu. Liên hoan phim Locarno lần thứ 78 sẽ diễn ra từ ngày 6 - 16/8. Trong khuôn khổ sự kiện, hai tác phẩm kinh điển của Thành Long làKế hoạch AvàCâu chuyện cảnh sátsẽ được trình chiếu. Ngoài ra, nam diễn viên dự kiến sẽ tham dự buổi thảo luận chuyên đề vào ngày 10/8. Giám đốc nghệ thuật của liên hoan phim, ông Giona A. Nazzaro, nhận định: “Thành Long là một nhân vật chủ chốt của điện ảnh châu Á đương đại, đảm nhiệm rất nhiều vai trò như đạo diễn, nhà sản xuất, diễn viên, biên kịch, ca sĩ, đạo diễn hành động cho tới diễn viên đóng thế. Ảnh hưởng của ông đã làm thay đổi các quy tắc của điện ảnh Hollywood”. Gần đây, Thành Long vướng tin có con ngoài giá thú thứ hai với cố nghệ sĩ Đặng Lệ Quân, có tên là Jaycee Chan. Nhiều nguồn tin khẳng định Jaycee Chan nhận được khoản tiền lớn từ Thành Long, bao gồm100 triệu USDtiền khởi nghiệp và2,7 tỷ USDquyền sở hữu tài sản. Tuy nhiên, Đặng Trường Phú, anh trai của Đặng Lệ Quân, đã phủ nhận thông tin này trong cuộc phỏng vấn vớiTVBS Newshôm 28/4. Ông bức xúc cho rằng đây là sự xúc phạm đến em gái và gia đình, đồng thời không loại trừ khả năng sẽ kiện những người tung tin đồn. Sách hay về tình yêu Đã có nhiều sách, tác phẩm viết về tình yêu - câu chuyện của trái tim ấm nóng, thứ tình cảm thường được cho là phức tạp. Dưới “cái đầu lạnh” của những lý thuyết triết học, góc nhìn tâm lý học, tình yêu hiện lên sáng rõ nhưng cũng không thiếu cảm xúc. Nghệ thuật yêucủa nhà phân tâm học Erich Fromm xuất bản năm 1957. Đến nay, cuốn sách được dịch ra 34 thứ tiếng với hàng triệu bản in. Nó vừa là công trình nghiên cứu lý thuyết, vừa là cuốn sách tâm tình, gợi mở bạn đọc hiểu về bản chất của yêu.  'Lật mặt 8' và nước đi của Lý Hải Phần 8 ""Lật mặt"" tiếp tục là nước đi của Lý Hải với đề tài tâm lý, gia đình. Phim có một số ý tưởng đáng khen, nhưng còn “an toàn” trong ngôn ngữ kể chuyện lẫn đường dây kịch bản.  14 năm đầy thăng trầm của ‘chiến binh mùa đông’ 14 năm kể từ lần đầu xuất hiện với “The First Avenger”, Bucky Barnes tới nay đã trở thành một mảnh ghép bền bỉ, nhưng cũng cô độc nhất trong Vũ trụ Điện ảnh Marvel.  Thành Long bị đồn có con ngoài giá thú Cộng đồng mạng lại lan truyền thông tin Thành Long có con ngoài giá thú thứ hai với cố nghệ sĩ Đặng Lệ Quân. Tuy nhiên, gia đình lên tiếng phủ nhận."
ZNews,https://znews.vn/uyen-an-song-luan-tiep-tuc-vuong-tin-hen-ho-post1550144.html,Giải trí,Null,"Thứ năm, 1/5/2025 05:49 (GMT+7)","Uyển Ân, Song Luân tiếp tục vướng tin hẹn hò","Song Luân và Uyển Ân nhiều lần gây chú ý khi có những hành động tình tứ tại các sự kiện. Thời gian qua, cả hai tiếp tục có nhiều cử chỉ thân mật trong một chương trình truyền hình thực tế, khiến khán giả lần nữa đặt nghi vấn về mối quan hệ tình cảm của họ. Cụ thể, trong những tập phát sóng gần đây củaTổ đội 1 không 2, Song Luân và Uyển Ân thường xuyên đứng sát cạnh nhau, cười đùa thoải mái và có nhiều hành động thân mật ngay trên sóng. Đơn cử, khi nam diễn viên không ngại đặt tay lên vai bạn diễn, Uyển Ân nhanh chóng nắm lấy một cách tự nhiên. Không ít khán giả tinh ý còn nhận ra Song Luân nhiều lần gọi Uyển Ân là ""bé"", cùng với đó là những cử chỉ thân thiết như xoa đầu. Uyển Ân và Song Luân có nhiều hành động thân mật khi tham giaTổ đội 1 không 2. Trước đó, tại buổi ra mắt phimCô Dâu Hào Môn, Song Luân có mặt từ sớm để chúc mừng và đã có nhiều khoảnh khắc gần gũi bên nữ diễn viên sinh năm 1999. Đáng chú ý, trong lúc chụp ảnh cùng các đồng nghiệp, nam diễn viên bất ngờ đưa tay ra như muốn nắm tay Uyển Ân. Nữ diễn viên cũng chủ động đáp lại bằng hành động nghiêng người về phía đàn anh. Gần nhất, tại sự kiện công chiếu sớm bộ phimYêu Nhầm Bạn Thân, cặp đôi diện trang phục cùng tone, thoải mái khoác tay, tươi cười trước ống kính truyền thông. Những hình ảnh này nhanh chóng lan truyền trên mạng xã hội, khiến khán giả tin rằng cả hai đang bí mật hẹn hò. Song Luân và Uyển Ân lần đầu đóng cặp trongNhà bà Nữ– bộ phim do Trấn Thành đạo diễn và ra mắt vào dịp Tết 2023. Tác phẩm kể về những xung đột, bất hòa trong gia đình nhà bà Ngọc Nữ - bà chủ quán bánh canh cua. Trong phim, Uyển Ân đảm nhận vai Ngọc Nhi, cô gái trẻ mang nhiều khát vọng nhưng bị gia đình kiểm soát. Song Luân vào vai John – bạn trai của Nhi, một chàng trai Việt Kiều, từ bỏ mọi thứ để ở bên người mình yêu. Bộ phim đạt doanh thu kỷ lục trong dịp Tết Nguyên đán thời điểm đó. Song Luân là một nghệ sĩ đa năng của làng giải trí Việt, với vai trò ca sĩ, diễn viên. Anh được khán giả biết đến qua nhiều dự án truyền hình và điện ảnh nhưHậu duệ mặt trời(phiên bản Việt),Cây táo nở hoa,Nhà Bà Nữ… Thời gian gần đây, Song Luân gây chú ý khi tham gia chương trình Anh trai ""say hi"". Uyển Ân, em gái ruột của Trấn Thành, là gương mặt trẻ đang dần khẳng định vị trí trong lĩnh vực diễn xuất. Cô bắt đầu được công chúng chú ý khi đảm nhận vai nữ chính trongNhà Bà Nữ(2023), một tác phẩm ăn khách do anh trai cô làm đạo diễn. Sau đó, nữ diễn viên tiếp tục được góp mặt trong những dự án nhưCái giá của hạnh phúc(2023),Cô dâu hào môn(2024) vàBộ tứ báo thủ (2025). Sách hay về tình yêu:Đã có nhiều sách, tác phẩm viết về tình yêu - câu chuyện của trái tim ấm nóng, thứ tình cảm thường được cho là phức tạp. Dưới “cái đầu lạnh” của những lý thuyết triết học, góc nhìn tâm lý học, tình yêu hiện lên sáng rõ nhưng cũng không thiếu cảm xúc.Nghệ thuật yêucủa nhà phân tâm học Erich Fromm xuất bản năm 1957. Đến nay, cuốn sách được dịch ra 34 thứ tiếng với hàng triệu bản in. Nó vừa là công trình nghiên cứu lý thuyết, vừa là cuốn sách tâm tình, gợi mở bạn đọc hiểu về bản chất của yêu.  Đạt G cầu hôn Bảo Ngọc Tối 30/4, Đạt G cho biết đã cầu hôn Bảo Ngọc. Cả hai trải qua 5 năm gắn bó.  Diễn viên Trần Lượng 'Những nẻo đường phù sa' qua đời Diễn viên Trần Lượng qua đời lúc 21h50 ngày 29/4. Ông được biết đến với các bộ phim ""Dốc tình"", ""Những nẻo đường phù sa""...  Katy Perry sau những 'trái đắng' Katy Perry chấp nhận những lời chỉ trích nhắm vào bản thân suốt thời gian qua. Nữ ca sĩ nói cô có cách riêng để vượt qua tranh cãi."
ZNews,https://znews.vn/kanye-west-gian-du-vi-khong-duoc-gap-con-post1550254.html,Giải trí,Null,"Thứ năm, 1/5/2025 10:52 (GMT+7)",Kanye West giận dữ vì không được gặp con,"TheoPage Six, Kanye West thể hiện sự bức xúc khi đề cập quyền nuôi con trong một buổi livestream. Rapper sinh năm 1977 che kín khuôn mặt bằng mặt nạ đen, liên tục phát ngôn thiếu chuẩn mực. Việc Kim Kardashian hạn chế Kanye West gặp gỡ North, Saint, Chicago và Psalm khiến mâu thuẫn càng khó hòa giải. Kanye West và Kim Kardashian mâu thuẫn vì quyền nuôi con. Ảnh:@kimkardashian. ""Tôi sẽ đi đón bọn trẻ. Tôi đang nói chuyện với luật sư. Hiện tại, tôi phải cố giữ cho mình không phát điên lên vì phải quen với việc không được gặp các con"", Kanye West nói. Page Sixcho biết đã liên hệ với đại diện của Kim nhưng chưa nhận được phản hồi. Hồi tháng 3, Kanye West cáo buộc Kim Kardashian và gia đình cô đã hạn chế anh tiếp xúc, nuôi dưỡng các con. Thậm chí, giọng caGold Diggercòn so sánh thỏa thuận nuôi con hiện tại như quyền thăm viếng trong nhà tù. Tuần trước, Kanye West tuyên bố vợ cũ đã ""cướp"" các con khỏi anh: “Tại sao thế giới người nổi tiếng lại như vậy. Tại sao các người có thể ung dung theo dõi và để Kim cướp con khỏi tôi. Mọi người nói rằng tôi hành động như vậy là do những chuyện hồi nhỏ nhưng giờ đây tôi đâu có được làm bố"". Nam rapper khẳng định anh  không gặp con trai lớn Saint bấy lâu nay.  Tuy nhiên,Page Sixcó được những bức ảnh Kanye West đi mua sắm cùng Saint, Chicago và Psalm tại một cửa hàng tiện lợi ở Nhật Bản hồi tháng 1. TheoDaily Mail, nguồn tin thân cận với Kim Kardashian tiết lộ: ""Kanye có thể gặp lũ trẻ bất cứ khi nào anh muốn, không có bất kỳ hạn chế nào cả. Song, Kim cũng rất cẩn thận để không đặt chúng vào những tình huống khó xử. Bảo vệ con cái là ưu tiên hàng đầu của cô ấy"". Chuyên mục giải trígiới thiệuTỷ phú Taylor Swift đọc sách gì?Nữ ca sĩ chia sẻ, nhiều bài hát cô tự sáng tác được lấy cảm hứng từ những cuốn sách yêu thích của mình. Một số cuốn sách được Taylor Swift yêu thích như Harry Potter, The Great Gatsby, The Beautiful and Damned hay To Kill a Mockingbird.  Kế hoạch hàn gắn gia đình của David Beckham David Beckham tổ chức tiệc sinh nhật nhằm xóa tan bầu không khí lạnh lẽo trong gia đình. Hơn hết, cựu danh thủ muốn hóa giải mâu thuẫn giữa Brooklyn và Romeo.  Con gái ngôi sao 'Bố già' công khai là người chuyển giới Airyn De Niro vừa công khai là người chuyển giới nữ. Cô hy vọng câu chuyện của mình sẽ truyền cảm hứng đến những người thuộc cộng đồng giống mình.  Em gái Kim Kardashian khoe cơ bụng săn chắc Bước sang tuổi tứ tuần, Khloé Kardashian vẫn giữ được vóc dáng nóng bỏng, quyến rũ. Song việc cô mặc bikini chụp cùng con nhỏ gây tranh luận."
