Source,URL,Category,Keyword,Time,Title,Content
ZNews,https://lifestyle.znews.vn/vu-no-sung-o-vinh-long-khoi-to-vu-an-hinh-su-giet-nguoi-post1549917.html,Pháp luật,Null,"Thứ sáu, 2/5/2025 12:13 (GMT+7)",Vụ nổ súng ở Vĩnh Long: Khởi tố vụ án hình sự 'Giết người',"Ngày 2/5, Bộ Công an cho biết, đối với vụ việc nổ súng xảy ra tại huyện Trà Ôn vào ngày 28/4, Cơ quan CSĐT Công an tỉnh Vĩnh Long đã ra quyết định khởi tố vụ án hình sự “Giết người” để điều tra, xử lý theo quy định của pháp luật. Theo thông tin ban đầu, khoảng 7h30 ngày 28/4, Nguyễn Văn Bảo Trung (33 tuổi, quê xã Tam Ngãi, huyện Cầu Kè, Trà Vinh) đang đứng trong nhà ở ấp La Ghì (xã Vĩnh Xuân, huyện Trà Ôn, Vĩnh Long) thì bị Nguyễn Vĩnh Phúc (42 tuổi, ngụ ấp Bang Chang, xã Trà Côn, huyện Trà Ôn) dùng súng tự chế loại Rulo bắn 1 phát vào đầu. Hiện trường nơi xảy ra vụ việc.camera an ninh Đoạn clip do camera an ninh ghi lại cho thấy, Phúc đội mũ bảo hiểm, đeo khẩu trang, mặc áo dài tay màu sẫm, bất ngờ đi vào nhà Trung, rút khẩu súng ngắn từ túi quần rồi bắn vào đầu khiến nạn nhân gục tại chỗ. Theo cơ quan công an, sau khi gây án, Phúc đi bộ ra Quốc lộ 54, cách nơi xảy ra sự việc khoảng 200 m rồi dùng súng bắn vào đầu tự sát. Công an xã Vĩnh Xuân nhanh chóng có mặt bảo vệ hiện trường, đưa Phúc và Trung đi cấp cứu ở TP Cần Thơ. Sau đó, Phúc được chuyển lên Bệnh viện Chợ Rẫy (TP.HCM) nhưng đã tử vong; còn Trung được mổ lấy viên đạn ra, dấu hiệu sinh tồn ổn định. Qua xác minh ban đầu từ cơ quan công an, nguyên nhân của vụ nổ súng nói trên do mâu thuẫn trong xử lý vụ va chạm giao thông xảy ra ngày 4/9/2024 giữa cháu Nguyễn Ngọc Bảo Trân (SN 2010; con của Phúc) với xe tải do Trung điều khiển làm cháu Trân tử vong. Ngay sau khi nhận được báo cáo về vụ việc, lãnh đạo Bộ Công an đã chỉ đạo Công an tỉnh Vĩnh Long tập trung khẩn trương xác minh, điều tra làm rõ diễn biến hành vi gây án của Nguyễn Vĩnh Phúc và các tình tiết liên quan, làm rõ nguồn gốc hung khí gây án, nguyên nhân, động cơ, mục đích gây án, có hay không đối tượng khác liên quan vụ việc. Đồng thời, giao Văn phòng Cơ quan CSĐT Bộ Công an khẩn trương thẩm tra toàn bộ hồ sơ vụ tai nạn giao thông xảy ra ngày 4/9/2024 làm cháu Trân tử vong và quá trình giải quyết khiếu nại trong vụ việc. Thực hiện chỉ đạo của lãnh đạo Bộ Công an, ngày 29/4/2025, Văn phòng Cơ quan CSĐT Bộ Công an đã rút toàn bộ hồ sơ vụ việc để kiểm tra, xử lý theo quy định. Cơ quan CSĐT Bộ Công an đã khẩn trương kiểm tra toàn bộ hồ sơ giải quyết vụ tai nạn giao thông làm cháu Trân tử vong. Qua đó, Cơ quan CSĐT Bộ Công an có căn cứ xác định hành vi điều khiển ô tô BKS: 84C - 102.77 của Nguyễn Văn Bảo Trung có dấu hiệu phạm tội “Vi phạm quy định về tham gia giao thông đường bộ” quy định tại khoản 1, Điều 260, Bộ luật Hình sự năm 2015. Ảnh hiện trường vụ tai nạn. Ảnh:Facebook luật sư Nguyễn Văn Quynh Bộ Công an cho biết, quyết định không khởi tố vụ án hình sự của Cơ quan CSĐT Công an huyện Trà Ôn, các quyết định giải quyết khiếu nại của VKSND huyện và VKSND tỉnh Vĩnh Long đã có hiệu lực pháp luật. Do đó, để giải quyết vụ việc khách quan, toàn diện, triệt để, xử lý nghiêm người vi phạm đúng quy định của pháp luật, Cơ quan CSĐT Bộ Công an đã có văn bản đề nghị Viện trưởng VKSND tối cao ra quyết định hủy bỏ và chỉ đạo hủy bỏ các quyết định giải quyết khiếu nại liên quan đến vụ việc. Đồng thời, hủy bỏ quyết định không khởi tố vụ án hình sự số 73 ngày 23/1/2025 của Thủ trưởng Cơ quan CSĐT Công an huyện Trà Ôn. Cơ quan CSĐT Bộ Công an yêu cầu Cơ quan CSĐT Công an tỉnh Vĩnh Long khẩn trương tiến hành kiểm tra, xác minh giải quyết vụ tai nạn giao thông nêu trên theo quy định của pháp luật. Bộ Công an giao Văn phòng Cơ quan CSĐT của Bộ tiếp tục theo dõi, chỉ đạo, hướng dẫn Cơ quan CSĐT Công an tỉnh Vĩnh Long kịp thời kiểm tra, xác minh giải quyết vụ việc khách quan, toàn diện, triệt để, xử lý nghiêm các cá nhân vi phạm theo đúng quy định của pháp luật. Yêu cầu Công an tỉnh Vĩnh Long khẩn trương rà soát, xử lý nghiêm cán bộ vi phạm, sai phạm trong quá trình xử lý vụ việc theo quy định của pháp luật và của ngành Công an. Sách về Pháp luật Cuốn sách""Trình tự, thủ tục giải quyết khiếu nại, quy trình tiếp công dân""giúp độc giả nắm bắt được những nội dung chủ yếu của Luật Khiếu nại, Luật Tiếp công dân, cũng như giúp người làm công tác giải quyết khiếu nại áp dụng chính xác, hiệu quả các quy định của luật trong giải quyết khiếu nại.  Bộ Công an đề nghị hủy quyết định không khởi tố vụ tai nạn tại Trà Ôn Thực hiện chỉ đạo của lãnh đạo Bộ Công an, Cơ quan Cảnh sát điều tra Bộ Công an đã khẩn trương kiểm tra toàn bộ hồ sơ giải quyết vụ tai nạn giao thông xảy ra ngày 04/9/2024 tại ấp Vĩnh Lợi, xã Vĩnh Xuân, huyện Trà Ôn, tỉnh Vĩnh Long làm cháu Nguyễn Ngọc Bảo Trân (sinh ngày 27/7/2010, trú tại ấp Bang Chang, xã Trà Côn, huyện Trà Ôn, tỉnh Vĩnh Long) tử vong.  Bộ Công an chỉ đạo xử lý nghiêm vụ nổ súng xảy ra tại Vĩnh Long Lãnh đạo Bộ Công an chỉ đạo xử lý nghiêm vụ nổ súng xảy ra tại Vĩnh Long, đồng thời giao Văn phòng Cơ quan CSĐT Bộ Công an khẩn trương thẩm tra toàn bộ hồ sơ vụ tai nạn giao thông làm cháu Nguyễn Ngọc Bảo Trân tử vong.  Bắt tài xế xe đầu kéo gây tai nạn làm 2 người tử vong trên quốc lộ 51 Công an tỉnh Bà Rịa - Vũng Tàu khởi tố bị can, bắt tạm giam tài xế 36 tuổi lái xe đầu kéo gây tai nạn trên Quốc lộ 51, khiến 2 người đi xe máy tử vong."
ZNews,https://lifestyle.znews.vn/200-canh-sat-triet-pha-tu-diem-su-dung-ma-tuy-quy-mo-lon-post1550191.html,Pháp luật,Null,"Thứ sáu, 2/5/2025 13:24 (GMT+7)",200 cảnh sát triệt phá tụ điểm sử dụng ma túy quy mô lớn,"Cơ quan Cảnh sát điều tra Công an tỉnh Bình Thuận khám xét quán Paris Night tại thành phố Phan Thiết (Bình Thuận). Ảnh:TTXVN. Sáng 2/5, Cơ quan Cảnh sát điều tra Công an tỉnh Bình Thuận cho biết, hiện cơ quan vẫn đang tiếp tục triển khai lực lượng khám xét nơi ở; khám nghiệm hiện trường; phân loại đối tượng trong vụ triệt phá tụ điểm sử dụng ma túy quy mô lớn ở quán Paris Night tại thành phố Phan Thiết. Trước đó vào khoảng 23 giờ ngày 1/5, Công an tỉnh Bình Thuận huy động hơn 200 cảnh sát được chia làm 3 mũi bao vây toàn bộ quán Paris Night. Lực lượng chức năng khống chế 154 khách đang có mặt tại quán, trong đó cảnh sát đã khống chế 5 bàn VIP bắt quả tang 42 thanh niên nam, nữ đang sử dụng ma túy, thu giữ nhiều tang vật như ma túy và các tài liệu liên quan. Rạng sáng 2/5, cơ quan điều tra đã khám xét khẩn cấp nơi ở của Mạnh Trọng Toản (sinh năm 1968, quê quán Nghệ An), tạm trú thành phố Phan Thiết, là chủ quán Paris Night. Bước đầu lực lượng chức năng xác định Mạnh Trọng Toản không trực tiếp ra mặt kinh doanh mà làm thủ tục sang tên cho cháu là Trần Mạnh Anh (sinh năm 1993, ngụ thành phố Phan Thiết) làm điều hành. Toản kiểm soát qua hệ thống camera, chỉ đạo từ xa. Trần Mạnh Anh đã cấu kết với nhiều đối tượng khác thực hiện hành vi phạm tội. Sử dụng hơn 80 nhân viên làm vệ sĩ, tiếp tân, phục vụ… canh gác, giám sát nghiêm ngặt từ cổng vào đến phòng vệ sinh. Trần Mạnh Anh sử dụng hầu hết là những đối tượng đầu gấu, có sử dụng công cụ hỗ trợ, hung khí chống trả khi chúng thấy nghi ngờ. Chúng phân chia các khu vực bảo vệ như: Tủ điều khiển thiết bị điện, cầu dao tổng, trổ các lối thoát hiểm để khi có bất kỳ biến động, lập tức chúng sập nguồn cầu dao điện, nhanh chóng tẩu tán ma túy và thoát ra ngoài. Quán Paris Night từ lâu được biết đến là quán bar trá hình, thu hút rất đông đảo thành phần nghiện ngập, hút chích tập trung tại đây. Công an tỉnh Bình Thuận đã đưa tụ điểm phức tạp này vào tầm ngắm để đấu tranh triệt xóa. Đại tá Lê Quang Nhân, Giám đốc Công an tỉnh cho biết, đơn vị đã trực tiếp chỉ đạo, xây dựng kế hoạch bằng mọi cách tập trung triệt xóa tụ điểm này trong thời gian sớm nhất. Theo Cơ quan Cảnh sát điều tra Công an tỉnh Bình Thuận, toàn bộ đối tượng có hành vi tổ chức, sử dụng trái phép chất ma túy quán Paris Night đã bị bắt; các đối tượng đã thừa nhận hành vi phạm tội. Cơ quan Cảnh sát điều tra đang tập trung củng cố tài liệu, hồ sơ về hành vi mua bán, tổ chức sử dụng ma túy trái phép theo Bộ luật hình sự. Sách về Pháp luật Cuốn sách""Cuộc chiến cam go""ghi nhận những câu chuyện khi Trung tá Phạm Cánh Quân chuyển công tác sang Công an quận Hoàn Kiếm để điều tra các vụ án về ma túy. Trong cuốn sách hơn 300 trang, tác giả khái quát các chất gây nghiện lâu đời cho đến những loại ma túy tổng hợp thế hệ mới và phần sau là chi tiết các vụ án ma túy.  Phát hiện người phụ nữ mang theo 800 viên hồng phiến Ngày 30/4/2025, Phòng Cảnh sát giao thông Công an tỉnh Nghệ An cho biết vừa bắt giữ Hà Thị Đào (sinh năm 1967), trú tại bản Ná Ca, xã Mường Nọc, huyện Quế Phong về hành vi mua bán trái phép chất ma túy, thu giữ 800 viên hồng phiến.  Triệt xóa tụ điểm mua bán, sử dụng ma túy ở quán karaoke Phòng CSĐT tội phạm về ma túy Công an TP Cần Thơ cho biết đã khởi tố 12 đối tượng để điều tra về các tội ""Mua bán trái trái phép chất ma túy"" và ""Tổ chức sử dụng trái phép chất ma túy"".  Vận chuyển hơn 4 kg ma túy qua đường hàng không Cơ quan chức năng đã phát hiện Nguyễn Tiến Đạt vận chuyển trái phép hơn 4 kg ma túy tổng hợp loại MDMA qua đường hàng không."
ZNews,https://lifestyle.znews.vn/bo-cong-an-de-nghi-huy-quyet-dinh-khong-khoi-to-vu-tai-nan-tai-tra-on-post1550131.html,Pháp luật,Null,"Thứ sáu, 2/5/2025 10:20 (GMT+7)",Bộ Công an đề nghị hủy quyết định không khởi tố vụ tai nạn tại Trà Ôn,"Hiện trường vụ tai nạn giao thông. Ảnh:E.X. Kết quả kiểm tra, có căn cứ xác định hành vi điều khiển xe ôtô BKS: 84C - 102.77 của Nguyễn Văn Bảo Trung (sinh năm 1992, ngụ tại xã Tam Ngãi, huyện Cầu Kè, tỉnh Trà Vinh) có dấu hiệu phạm tội “Vi phạm quy định về tham gia giao thông đường bộ” quy định tại khoản 1 Điều 260 Bộ luật Hình sự năm 2015. Do Quyết định không khởi tố vụ án hình sự của Cơ quan Cảnh sát điều tra Công an huyện Trà Ôn, các Quyết định giải quyết khiếu nại của Viện kiểm sát nhân dân huyện Trà Ôn và Viện kiểm sát nhân dân tỉnhVĩnh Longđã có hiệu lực pháp luật; Để giải quyết vụ việc khách quan, toàn diện, triệt để, xử lý nghiêm người vi phạm đúng quy định của pháp luật, Cơ quan Cảnh sát điều tra Bộ Công an đã có văn bản đề nghị đồng chí Viện trưởng Viện kiểm sát nhân dân tối cao: ra Quyết định hủy bỏ và chỉ đạo huỷ bỏ các quyết định giải quyết khiếu nại liên quan đến vụ việc; hủy bỏ Quyết định không khởi tố vụ án hình sự số 73/QĐ-ĐTTH ngày 23/01/2025 của Thủ trưởng Cơ quan Cảnh sát điều tra Công an huyện Trà Ôn, tỉnh Vĩnh Long. Cơ quan Cảnh sát điều tra Bộ Công an yêu cầu Cơ quan Cảnh sát điều tra Công an tỉnh Vĩnh Long khẩn trương tiến hành kiểm tra, xác minh giải quyết vụ tai nạn giao thông nêu trên theo quy định của pháp luật. Bộ Công an giao Văn phòng Cơ quan Cảnh sát điều tra Bộ công an tiếp tục theo dõi, chỉ đạo, hướng dẫn Cơ quan Cảnh sát điều tra Công an tỉnh Vĩnh Long kịp thời kiểm tra, xác minh giải quyết vụ việc khách quan, toàn diện, triệt để, xử lý nghiêm các cá nhân vi phạm theo đúng quy định của pháp luật; yêu cầu Công an tỉnh Vĩnh Long khẩn trương rà soát, xử lý nghiêm cán bộ vi phạm, sai phạm trong quá trình xử lý vụ việc theo quy định của pháp luật và của ngành Công an. * Đối với vụ việc nổ súng xảy ra tại Vĩnh Long sáng 28/4/2025, ngày 29/4/2025, Cơ quan Cảnh sát điều tra Công an tỉnh Vĩnh Long đã ra quyết định khởi tố vụ án hình sự “Giết người” để điều tra, xử lý theo quy định của pháp luật. Sách về Pháp luật Cuốn sách""Trình tự, thủ tục giải quyết khiếu nại, quy trình tiếp công dân""giúp độc giả nắm bắt được những nội dung chủ yếu của Luật Khiếu nại, Luật Tiếp công dân, cũng như giúp người làm công tác giải quyết khiếu nại áp dụng chính xác, hiệu quả các quy định của luật trong giải quyết khiếu nại.  Bắt tài xế xe tải gây tai nạn khiến nữ sinh lớp 12 tử vong Duy lái ôtô tải gây tai nạn với 2 xe máy, khiến nữ sinh lớp 12 (thị xã Phú Mỹ, tỉnh Bà Rịa - Vũng Tàu) tử vong trên đường đi học, một người khác bị thương nặng.  Công an Vĩnh Long nêu khuyến cáo liên quan vụ nữ sinh tử vong Công an tỉnh Vĩnh Long vừa đăng bài viết về việc sử dụng mạng xã hội an toàn, trong đó dẫn chứng vụ nữ sinh tử vong do tai nạn và vụ dùng súng tự chế bắn người tại xã Vĩnh Xuân, huyện Trà Ôn.  Những khiếu nại của người cha vụ nữ sinh tử vong ở Vĩnh Long Ông Phúc đã nhiều lần khiếu nại gửi cơ quan chức năng huyện Trà Ôn và tỉnh Vĩnh Long, đề nghị khởi tố vụ án, khởi tố bị can với tài xế xe tải va chạm làm con gái ông tử vong."
ZNews,https://lifestyle.znews.vn/khoi-to-nhom-doi-tuong-buon-lau-10-tan-duong-va-van-chuyen-hang-cam-post1550187.html,Pháp luật,Null,"Thứ sáu, 2/5/2025 19:09 (GMT+7)",Khởi tố nhóm đối tượng buôn lậu 10 tấn đường và vận chuyển hàng cấm,"Ngày 2/5, Công an tỉnh An Giang cho biết đã khởi tố vụ án, khởi tố 7 bị can liên quan đến buôn lậu đường và vận chuyển hàng cấm từ Campuchia về Việt Nam. Tống Thị Mỹ Linh khai nhận tại Cơ quan điều tra. Các đối tượng bị tạm giam gồm Trần Đức Hào (SN 2006), Trần Minh Phước (SN 2002), Nguyễn Văn Long (SN 1981) cùng bị khởi tố về hành vi “Buôn lậu” và “Vận chuyển hàng cấm”; Tống Thị Mỹ Linh (SN 1979), Nguyễn Thanh Quân (SN 1994), Võ Văn Quốc (SN 1992) bị khởi tố để điều tra về hành vi “Buôn lậu”. Riêng Hồ Đức Lợi (SN 1999) bị áp dụng biện pháp cấm đi khỏi nơi cư trú để điều tra về hành vi buôn lậu. Các bị can cùng ngụ tại phường Tịnh Biên, thị xã Tịnh Biên. Trước đó, tối 19/4, lực lượng chức năng bắt quả tang Phước và Hào dùng vỏ lãi vận chuyển 2.000 bao thuốc lá lậu (nhãn hiệu 555, Hero, Jet) từ Campuchia về Việt Nam. Bị can Nguyễn Thanh Quân. Ảnh:Tiến Tầm. Mở rộng điều tra, cơ quan chức năng xác định, một ngày trước đó, Quân đặt mua 200 bao đường (mỗi bao 50 kg) qua Linh, hàng được giao sát biên giới. Sau khi nhận thông tin, Quân thuê nhóm Phước, Hào, Long và Quốc dùng vỏ lãi vận chuyển về Việt Nam. Long còn thuê thêm Lợi làm nhiệm vụ cảnh giới. Hiện vụ việc đang được Văn phòng Cơ quan Cảnh sát điều tra Công an tỉnh An Giang tiếp tục điều tra, làm rõ. Sách về Pháp luật Cuốn sách""Công tác thi hành án hình sự thuộc trách nhiệm của Ủy ban nhân dân cấp xã""giới thiệu phạm vi nghiên cứu về 3 vấn đề: Thi hành án treo, thi hành hình phạt cải tạo không giam giữ và áp dụng biện pháp tái hòa nhập cộng đồng tại địa phương. Cuốn sách đánh giá toàn diện cơ sở pháp lý về thi hành án hình sự, trọng tâm là về hình phạt và trách nhiệm của UBND cấp xã.  Khởi tố 7 đối tượng vụ buôn lậu, vận chuyển trái phép qua biên giới Cục Cảnh sát điều tra tội phạm về tham nhũng, kinh tế, buôn lậu, Bộ Công an triển khai các biện pháp nghiệp vụ làm rõ dấu hiệu buôn lậu, vận chuyển trái phép hàng hóa qua biên giới Việt Nam - Trung Quốc tại khu vực các tỉnh Cao Bằng, Lạng Sơn, Quảng Ninh.  Cho đồng nghiệp vay lãi, nam công nhân kiếm hàng chục triệu mỗi tháng Phòng CSĐT tội phạm về tham nhũng, kinh tế và buôn lậu Công an Đồng Nai phối hợp cùng Đồn Công an KCN Nhơn Trạch truy xét, bắt giữ Tạ Văn Cảo (SN 1998, quê Đắk Nông) để điều tra về hành vi cho vay lãi nặng.  Hơn 300 cảnh sát đột kích quán bar Paris Night Club ở Bình Thuận 10 giờ trước17:142/5/2025Pháp luậtPháp luật 0 Tại quán bar Paris Night Club, lực lượng chức năng đã bắt quả tang 5 vụ tổ chức sử dụng trái phép chất ma tuý với 35 đối tượng tại 5 bàn VIP của quán bar này."
ZNews,https://lifestyle.znews.vn/hon-300-canh-sat-dot-kich-quan-bar-paris-night-club-o-binh-thuan-post1550188.html,Pháp luật,Null,"Thứ sáu, 2/5/2025 17:14 (GMT+7)",Hơn 300 cảnh sát đột kích quán bar Paris Night Club ở Bình Thuận,"Sáng 2/5, Cơ quan CSĐT Công an tỉnh Bình Thuận vẫn đang tiếp tục chia ra nhiều tổ công tác khám xét nơi ở, khám nghiệm hiện trường, phân loại đối tượng trong vụ triệt xóa tụ điểm bay lắc ở quán bar Paris Night ở TP. Phan Thiết. Hơn 300 cán bộ, chiến sĩ Công an tỉnh Bình Thuận đồng loạt kiểm tra quán bar Paris Night Club. Trước đó, vào 23h ngày 1/5, hơn 300 cán bộ, chiến sĩ Công an tỉnh Bình Thuận được huy động đã đồng loạt triển khai một đợt kiểm tra quy mô lớn tại quán bar Paris Night Club (khu phố 14, phường Phú Thủy, TP. Phan Thiết), phát hiện nhiều vi phạm liên quan đến ma tuý. Chuyên án được Đại tá Huỳnh Ngọc Liêm, Phó Giám đốc Công an tỉnh Bình Thuận - Thủ trưởng Cơ quan CSĐT trực tiếp chỉ đạo, chỉ huy tại hiện trường. Các đơn vị tham gia trong chuyên gồm nhiều lực lượng như Phòng Cảnh sát điều tra tội phạm về ma túy, Cảnh sát hình sự, Cảnh sát cơ động, Cảnh sát Quản lý hành chính về trật tự xã hội, lực lượng an ninh cùng nhiều lực lượng khác cũng được điều động để hỗ trợ. Phương án triển khai được xây dựng kỹ càng, đảm bảo yếu tố bất ngờ, khống chế nhanh gọn và tuyệt đối an toàn cho lực lượng và người dân. Cảnh sát kiểm soát hiện trường. Sau khi có lệnh, các mũi trinh sát đã hoàn toàn kiểm soát hiện trường. Âm thanh lớn tắt lịm, nhường chỗ cho công tác nghiệp vụ của các lực lượng kiểm tra hành chính, phân loại đối tượng, thu giữ tang vật và test nhanh chất ma túy đối với những người có mặt tại hiện trường. Kết quả bước đầu của cuộc đột kích cho thấy mức độ phức tạp và nguy hiểm của quán bar Paris Night Club. Tại đây, lực lượng chức năng đã bắt quả tang 5 vụ tổ chức sử dụng trái phép chất ma tuý với 35 đối tượng tại 5 bàn VIP của quán bar này. Qua test nhanh ma túy đối với 154 người có mặt trong quán bar, có đến 42 người dương tính với chất ma túy (gồm một chủ quán, 4 nhân viên và 37 khách). Trong số đó, có nhiều thanh niên từ nhiều địa phương khác tụ tập về Phan Thiết để tham gia “bay lắc”, sử dụng chất kích thích và tìm kiếm “trải nghiệm cảm giác mạnh”. Từ 1/3 đến nay, quán bar Paris Night Club có dấu hiệu hoạt động trở nên lộng hành. Lực lượng chức năng cũng thu giữ nhiều tang vật liên quan đến hành vi tổ chức sử dụng trái phép chất ma túy như ma túy tổng hợp, dụng cụ sử dụng ma túy, sổ sách hoạt động kinh doanh, camera giám sát, điện thoại di động cùng nhiều tang vật khác có liên quan để phục vụ công tác điều tra. Theo tìm hiểu của cơ quan chức năng, từ 1/3 đến nay, quán bar Paris Night Club có dấu hiệu hoạt động trở nên lộng hành, công khai và liều lĩnh hơn, thường xuyên mở cửa từ tối đến rạng sáng, tập trung số lượng lớn thanh niên, tổ chức các “đêm nhạc”, DJ, tiệc sinh nhật và các hoạt động dễ phát sinh tệ nạn. Đặc biệt, qua công tác trinh sát, lực lượng nghiệp vụ phát hiện một số đối tượng cầm đầu hoạt động bên trong có liên hệ với các nhóm thanh niên có tiền án, tiền sự, có biểu hiện tổ chức hoặc tiếp tay cho việc sử dụng trái phép chất ma túy. Chó nghiệp vụ được huy động để tìm kiếm tang vật. Sau khi khống chế và lập biên bản hiện trường, các lực lượng đã tiến hành phân loại các đối tượng dương tính với ma túy, thu thập lời khai, xác minh nhân thân và điều tra hành vi có dấu hiệu tổ chức, chứa chấp sử dụng trái phép chất ma túy. Đồng thời, toàn bộ hồ sơ pháp lý hoạt động của cơ sở cũng đang được rà soát, đối chiếu với các quy định pháp luật hiện hành. Hiện tại, Công an tỉnh Bình Thuận đang tiếp tục điều tra mở rộng, đấu tranh làm rõ vai trò của các đối tượng tổ chức, quản lý quán bar, các cá nhân có hành vi tổ chức sử dụng ma túy hoặc liên quan đến các hoạt động tội phạm khác. Sách về Pháp luật Cuốn sách""Công tác thi hành án hình sự thuộc trách nhiệm của Ủy ban nhân dân cấp xã""giới thiệu phạm vi nghiên cứu về 3 vấn đề: Thi hành án treo, thi hành hình phạt cải tạo không giam giữ và áp dụng biện pháp tái hòa nhập cộng đồng tại địa phương. Cuốn sách đánh giá toàn diện cơ sở pháp lý về thi hành án hình sự, trọng tâm là về hình phạt và trách nhiệm của UBND cấp xã.  Hỗn chiến cạnh quán bar lúc nửa đêm, một người tử vong Công an tỉnh Hà Tĩnh đang điều tra vụ hỗn chiến giữa hai nhóm người cạnh quán bar, khiến một người đàn ông bị đâm tử vong.  Bạn gái Bùi Đình Khánh bị bắt về tội gì? Công an tỉnh Quảng Ninh vừa khởi tố thêm 8 người liên quan đến vụ án mua bán, vận chuyển ma túy số lượng lớn vừa xảy ra, trong đó có bạn gái của đối tượng Bùi Đình Khánh.  Xử lý 2 người bình luận tiêu cực liên quan vụ bắt ma túy ở Quảng Ninh Công an tỉnh Lạng Sơn đã lập hồ sơ xử lý 2 trường hợp có hành vi bình luận nội dung tiêu cực trên mạng xã hội liên quan tới vụ bắt ma túy ở Quảng Ninh."
