Source,URL,Category,Keyword,Time,Title,Content
ZNews,https://znews.vn/tphcm-dung-ai-quan-hang-cam-hang-gia-tren-mang-xa-hoi-post1561940.html,Kinh doanh,Null,"Thứ tư, 18/6/2025 23:05 (GMT+7)","TP.HCM dùng AI quản hàng cấm, hàng giả trên mạng xã hội","Theo ông Nguyễn Quang Huy - Phó chi cục trưởng Chi cục Quản lý thị trường TP.HCM (QLTT), sau tháng cao điểm điểm kiểm tra, xử lý quyết liệt gian lận thương mại, hàng gian hàng giả… (15/5-15/6), lực lượng QLTT sẽ tiếp tục phối hợp với các đơn vị liên quan truy vết, quản lý chất lượng hàng hóa trên không gian mạng, đặc biệt là các sàn thương mại điện tử và mạng xã hội. Sau cao điểm kiểm tra, nhiều gian hàng tại Saigon Square mở bán nhưng không bày hàng hóa. Ảnh:H. Linh. Ông Huy đánh giá việc xử lý hàng giả trên nền tảng số gặp nhiều khó khăn, do người bán hàng thường giấu danh tính, không để lại thông tin giao dịch rõ ràng, khó xác minh, truy vết. Trong khi đó, kinh tế khó khăn, một bộ phận người tiêu dùng đã quen với chọn lựa sản phẩm giá rẻ, hàng nhái với chi phí thấp, mà chưa đánh giá đầy đủ nguy cơ về an toàn và chất lượng khi sử dụng hàng giả, hàng nhái. Điều này vô tình tạo điều kiện để hàng giả, hàng nhái, hàng không rõ nguồn gốc, chất lượng kém tiếp tục len lỏi và lưu thông trên thị trường. Ngoài ra, hàng giả ngày càng tinh vi, gây nhầm lẫn với hàng thật, cần sự hỗ trợ từ thiết bị kỹ thuật và đồng hành của doanh nghiệp chủ sở hữu quyền. Thời gian qua, việc xử lý ở một số địa bàn gặp khó do đối tượng kinh doanh thiếu hợp tác, né tránh, đối phó đủ hình thức khi lực lượng chức năng kiểm tra. Thực tế, việc kiểm tra, xử lý vi phạm trong lĩnh vực thương mại điện tử gặp nhiều khó khăn, do việc bảo quản, lưu giữ tang vật vi phạm, đặc biệt là thực phẩm tươi sống để thẩm tra, xác minh khó thực hiện, do thiếu kho bảo quản chuyên dụng. Đủ cách né tránh, đối phó với lực lượng kiểm tra. Ảnh:H. Linh. Phó chi cục trưởng Chi cục QLTT TP.HCM cho biết cán bộ QLTT đang được đào tạo chuyên sâu kỹ năng giám sát, truy vết và thu thập thông tin trên môi trường mạng, đặc biệt là các nền tảng thương mại điện tử, mạng xã hội, bao gồm cả việc nắm bắt được các thủ đoạn mới, cách thức ẩn danh và giao dịch xuyên biên giới. QLTT cũng triển khai các công cụ AI để tự động phát hiện các hành vi rao bán hàng giả, hàng cấm trên mạng xã hội, sàn thương mại điện tử. Đồng thời sử dụng công nghệ để phân tích quy luật, thủ đoạn của người kinh doanh, đưa ra dự báo và xây dựng kế hoạch kiểm tra, kiểm soát. Ông Nguyễn Nguyên Phương, Phó giám đốc Sở Công Thương TP.HCM, cho biết để quản lý chất lượng, giá cả hàng hóa, ngăn hàng gian hàng giả trên không gian mạng, Sở chuẩn bị phát động chương trình ""Tick xanh trách nhiệm thương mại điện tử"". Từ đây thiết lập chuẩn mực kinh doanh cho ba nhóm đối tượng chính: sàn thương mại điện tử, nhà bán hàng, các doanh nghiệp tiếp thị liên kết, KOL/KOC. Hàng hóa gắn tick xanh cũng sẽ giúp người tiêu dùng dễ dàng nhận diện các đơn vị kinh doanh uy tín, sản phẩm chất lượng. Thống kê của cơ quan QLTT TP.HCM, trong tháng cao điểm từ ngày 15/5-15/6, cơ quan chức năng đã kiểm tra 137 vụ, tất cả 137 vụ kiểm tra đều phát hiện vi phạm và bị xử lý. Với số tiền xử lý vi phạm hành chính4,68 tỷ đồng; thu nộp ngân sách1,33 tỷ đồng. Táo đỏ là mặt hàng thực phẩm liên tục phát hiện kém chất lượng, không rõ nguồn gốc. Ảnh:QLTT. Tính chung 6 tháng đầu năm, QLTT đã kiểm tra 533 vụ, phát hiện, xử lý 526 vụ vi phạm. Tổng số tiền xử lý vi phạm hành chính là19,93 tỷ đồng. Có 4 vụ chuyển cơ quan điều tra vì có dấu hiệu hình sự. Ngành hàng thực phẩm, thực phẩm chức năng, mỹ phẩm ảnh hưởng trực tiếp đến sức khỏe, tính mạng người tiêu dùng đang nổi cộm với nhiều vi phạm. Như tại quận Bình Tân, QLTT phát hiện hơn 28.000 gói kẹo dẻo không rõ nguồn gốc, hơn 2 tấn táo đỏ sấy khô. Tại Hóc Môn phát hiện hơn 19.000 đơn vị sản phẩm bảo vệ sức khỏe. TP.Thủ Đức phát hiện 6 tấn gà ủ muối, chân gà rút xương không rõ nguồn gốc xuất xứ…  Hàng giả bán đầy trên sàn thương mại điện tử, vì sao khó xử lý? Chi cục QLTT TP.HCM cho rằng việc xử lý hàng giả trên nền tảng số gặp nhiều khó khăn do đối tượng thường giấu danh tính, không để lại thông tin giao dịch rõ ràng, khó xác minh, truy vết.  Đại biểu: 'Vì sao hàng trăm tấn thuốc giả lại được bày bán công khai' Nhiều đại biểu Quốc hội cảnh báo tình trạng hàng giả, hàng nhái ngày càng tinh vi, đe dọa sức khỏe cộng đồng và đề xuất nâng công tác chống hàng giả thành chiến lược quốc gia.  CEO Mekong Capital làm sếp Bệnh viện TNH 3 giờ trước00:3219/6/2025Kinh doanhKinh doanh 0 Ông Christopher E. Freund, nhà sáng lập kiêm CEO Mekong Capital, vừa gia nhập HĐQT TNH giữa lúc quỹ đầu tư này mở rộng danh mục sang ngành y tế tư nhân."
ZNews,https://znews.vn/viet-nam-la-khach-hang-lon-cua-dau-nanh-my-post1561750.html,Kinh doanh,Null,"Thứ tư, 18/6/2025 21:39 (GMT+7)",Việt Nam là khách hàng lớn của đậu nành Mỹ,"Nhu cầu nhập khẩu đậu nành của Việt Nam chủ yếu đến từ các ngành sản xuất thức ăn chăn nuôi và nuôi trồng thủy sản. Ảnh:USSEC. Ngày 18/6, Hội đồng Xuất khẩu Đậu nành Mỹ (USSEC) tổ chức lễ kỷ niệm 30 năm thiết lập quan hệ hợp tác giữa ngành đậu nành Mỹ và Việt Nam. Cơ quan này cho biết theo số liệu thống kê sơ bộ từ Tổng cục Hải quan, trong 4 tháng đầu năm, Việt Nam đã chi hơn318 triệu USDđể nhập khẩu hơn 703.000 tấn đậu nành, giảm 7,8% về lượng và 22% về giá trị so với cùng kỳ. Trong đó, Mỹ hiện là nhà cung cấp đậu nành lớn nhất cho Việt Nam, với hơn 414.000 tấn, trị giá hơn186 triệu USD. Đối với thị trường Mỹ, Việt Nam là quốc gia nhập khẩu đậu nành lớn thứ 3 tại Đông Nam Á và đứng thứ 13 toàn cầu. USSEC nhận định nhu cầu nhập khẩu đậu nành của Việt Nam chủ yếu đến từ các ngành sản xuất thức ăn chăn nuôi và nuôi trồng thủy sản trong nước. ""Thật ấn tượng khi chứng kiến sự phát triển mạnh mẽ của ngành thực phẩm và thức ăn chăn nuôi tại Việt Nam"", ông Timothy Loh, Giám đốc khu vực Đông Nam Á và châu Đại Dương của USSEC chia sẻ. Theo ông Loh, Việt Nam hiện là quốc gia sản xuất thịt heo lớn thứ 6 và sản xuất thủy sản lớn thứ 4 thế giới. Ngành thủy sản đóng góp 4-5% GDP quốc gia. Trong khi đó, đậu nành đã trở thành nguyên liệu thiết yếu trong thức ăn thủy sản, cung cấp nguồn protein thực vật chất lượng cao để hỗ trợ đà tăng trưởng ổn định của ngành. Với tiềm năng này, dự kiến đến hết năm nay, lượng tiêu thụ khô đậu nành sẽ tăng lên mức 6 triệu tấn. Đại diện USSEC nhấn mạnh trong bối cảnh người tiêu dùng Việt Nam ngày càng quan tâm đến các sản phẩm có nguồn gốc thực vật và thực phẩm từ đậu nành, nông dân trồng đậu nành ở Mỹ luôn cam kết cải tiến liên tục thông qua đổi mới và công nghệ. Đồng thời, họ cũng áp dụng các mục tiêu cải thiện bền vững cấp quốc gia mới nhất, hướng tới sản xuất nhiều hơn nhưng sử dụng tài nguyên ít hơn và áp dụng các phương pháp canh tác giúp giảm dấu chân carbon. Chia sẻ tại sự kiện, ông Đỗ Nguyễn Anh Tuấn, Vụ trưởng Vụ Hợp tác quốc tế, Bộ Tài nguyên và Môi trường nhận định Việt Nam và Mỹ đều có thế mạnh riêng trong nông nghiệp và mang tính bổ trợ lẫn nhau, không cạnh tranh trực tiếp, từ đó hình thành nên chuỗi cung ứng chung. Cụ thể, Mỹ có lợi thế về nông nghiệp ôn đới và sản xuất quy mô lớn với các sản phẩm như ngô, đậu nành, lúa mì, thịt và trái cây ôn đới, trong khi Việt Nam có thế mạnh về các loại cây công nghiệp (cà phê, điều, tiêu, cao su) và trái cây nhiệt đới. Do đó, theo ông Tuấn, bất kỳ biện pháp can thiệp thương mại nào, đặc biệt là áp thuế, đều gây ra tác động tiêu cực cho cả hai bên. ""Nếu Mỹ áp thuế đối ứng cao với nông nghiệp Việt Nam, khiến các sản phẩm này giảm sức cạnh tranh hoặc khó xuất khẩu thì phía Mỹ cũng sẽ bị ảnh hưởng tương ứng"", ông Tuấn nói. Ông dẫn chứng kim ngạch xuất khẩu nông sản giữa hai nước đã tăng trưởng đều đặn ở mức 10% mỗi năm từ 2016 đến nay. Nếu chỉ xét riêng nhóm hàng nông sản trồng trọt và chăn nuôi (không tính thủy sản và gỗ nội thất), Mỹ đang có thặng dư thương mại với Việt Nam. ""Năm 2024, Mỹ xuất khẩu khoảng3,4 tỷ USDsản phẩm nông nghiệp sang Việt Nam, trong khi Việt Nam chỉ xuất khẩu khoảng2,8 tỷ USDsang Mỹ, chênh lệch600 triệu USD"", ông Tuấn bổ sung. Ông Đỗ Nguyễn Anh Tuấn, Vụ trưởng Vụ Hợp tác quốc tế Bộ Tài nguyên và Môi trường cùng các đại diện từ USSEC trong buổi chia sẻ với báo chí ngày 18/6. Ảnh:BTC. Trước đó, đầu tháng 6, Bộ trưởng Tài nguyên và Môi trường Đỗ Đức Duy cùng đoàn công tác đã có chuyến thăm và làm việc tại Mỹ. Trong khuôn khổ chuyến đi, các doanh nghiệp Việt Nam đã ký kết 20 biên bản ghi nhớ, với tổng trị giá3 tỷ USDđể nhập khẩu các mặt hàng nông sản từ Mỹ như ngô, đậu nành, thịt và nguyên liệu gỗ... Ông Tuấn nhấn mạnh chuyến thăm đã được phía Mỹ đón tiếp nồng nhiệt và đánh giá cao. Bà Kim Reynolds, Thống đốc bang Iowa cũng chia sẻ công khai trên mạng xã hội X về cuộc gặp với Bộ trưởng Đỗ Đức Duy và bày tỏ sự trân trọng đối với hợp tác song phương. Các đối tác phía Mỹ nhìn nhận Việt Nam là một nền kinh tế năng động và đáng tin cậy tại khu vực châu Á - Thái Bình Dương, đồng thời bày tỏ sự ủng hộ đối với những nỗ lực để đạt được một thỏa thuận thuế quan công bằng cho Việt Nam và sẽ có tiếng nói mạnh mẽ để tác động đến các cơ quan hữu quan của Mỹ. Tri Thức - Znewsgiới thiệu độc giảTủ sách kiến thức kinh tếvới đa dạng cuốn sách, câu chuyện trong lĩnh vực kinh doanh, kinh tế. Là nguồn tư liệu cho những người quan tâm và muốn nâng cao kiến thức trong lĩnh vực kinh tế. Những cuốn sách, câu chuyện trong Tủ sách không chỉ đơn thuần là những tác phẩm của tri thức mà còn chứa đựng bí quyết, kinh nghiệm quý báu từ các tác giả, nhà quản lý có uy tín và kinh nghiệm lâu năm trong ngành. Đọc sách không chỉ giúp người đọc tiếp cận những kiến thức mới mà còn giúp mở rộng tầm nhìn và phát triển bản thân. Tủ sách kiến thức kinh tế mong muốn lan tỏa tri thức trong lĩnh vực kinh doanh, đồng thời phát triển văn hóa đọc cho người Việt.  Vàng vượt USD và trái phiếu Mỹ, thành nơi trú ẩn hàng đầu Trong khi USD, trái phiếu Mỹ và đồng yen lao đao trước bất ổn toàn cầu và chính sách thuế mới, vàng đã tăng vọt 30% từ đầu năm và trở thành tài sản trú ẩn hàng đầu.  Cảng biển lớn nhất nước Mỹ ảm đạm vì thuế quan Mức thuế quan 145% của ông Trump khiến lượng hàng Trung Quốc qua cảng Los Angeles chạm đáy trong hơn 2 năm, kéo theo lo ngại về suy giảm nhập khẩu suốt năm 2025.  Đàm phán thương mại Việt - Mỹ đạt nhiều tiến bộ, thu hẹp khoảng cách Trong 4 ngày đàm phán, Đoàn đàm phán Việt Nam và Mỹ đã đạt được nhiều tiến bộ, thu hẹp khoảng cách trong tất cả lĩnh vực đàm phán, theo thông tin từ Bộ Công Thương."
ZNews,https://znews.vn/chon-cong-nghe-an-toan-nhat-cho-2-nha-may-dien-hat-nhan-dau-tien-post1561662.html,Kinh doanh,Null,"Thứ tư, 18/6/2025 22:15 (GMT+7)",Chọn công nghệ an toàn nhất cho 2 nhà máy điện hạt nhân đầu tiên,"Phó thủ tướng Bùi Thanh Sơn yêu cầu phải nghiên cứu, đánh giá và lựa chọn công nghệ tốt nhất, tin cậy nhất, an toàn nhất, đã được kiểm chứng trên thực tế cho hai nhà máy điện hạt nhân đầu tiên của Việt Nam. Ảnh:VGP/Hải Minh. Chiều 18/6, tại Trụ sở Chính phủ, Phó thủ tướng Bùi Thanh Sơn chủ trì cuộc họp rà soát tiến độ Dự án điện hạt nhân Ninh Thuận. Tham dự cuộc họp có Bộ trưởng Công Thương Nguyễn Hồng Diên, lãnh đạo các bộ, ngành Trung ương, tỉnh Ninh Thuận và các Tập đoàn Công nghiệp - Năng lượng Quốc gia Việt Nam (PVN), Tập đoàn Điện lực Việt Nam (EVN). Dự án điện hạt nhân Ninh Thuận gồm 2 nhà máy, mỗi nhà máy gồm 2 tổ máy. Nhà máy Ninh Thuận 1 đặt tại xã Phước Dinh, huyện Thuận Nam. Nhà máy Ninh Thuận 2 đặt tại xã Vĩnh Hải, huyện Ninh Hải. Thủ tướng Chính phủ đã giao EVN làm chủ đầu tư Dự án Nhà máy điện hạt nhân Ninh Thuận 1, trong khi PVN được giao làm chủ đầu tư Dự án Nhà máy điện hạt nhân Ninh Thuận 2. Sau khi nghe lãnh đạo tỉnh Ninh Thuận và các tập đoàn báo cáo về tiến độ của dự án, các ý kiến phát biểu tại cuộc họp, Phó thủ tướng Bùi Thanh Sơn đánh giá cao các bộ, ngành, địa phương và các tập đoàn đã nỗ lực triển khai những nhiệm vụ được giao trong thời gian vừa qua. Nhấn mạnh với Việt Nam, đây là lĩnh vực mới với yêu cầu rất khắt khe về độ an toàn, Phó thủ tướng yêu cầu các bộ, ngành, địa phương và các tập đoàn, qua thực tiễn nghiên cứu, tìm hiểu, làm việc với các đối tác, tập trung rà soát, hoàn thiện thể chế, trong đó có Luật Năng lượng nguyên tử sửa đổi, phục vụ việc phát triển ngành công nghiệp năng lượng nguyên tử nói chung và Dự án nhà máy điện hạt nhân nói riêng. Về công nghệ, Phó thủ tướng yêu cầu phải nghiên cứu, đánh giá và sử dụng công nghệ tốt nhất, tin cậy nhất, an toàn nhất, đã được kiểm chứng trên thực tế cho hai nhà máy điện hạt nhân đầu tiên của Việt Nam. Phó thủ tướng Bùi Thanh Sơn chủ trì cuộc họp rà soát tiến độ Dự án điện hạt nhân Ninh Thuận. Ảnh:VGP/Hải Minh. Về đào tạo nguồn nhân lực, Phó thủ tướng cho rằng đây là trách nhiệm chung, không chỉ của Bộ Giáo dục và Đào tạo, mà còn của các bộ, ngành và tập đoàn liên quan, cần được triển khai sớm; chuẩn bị sẵn sàng cho việc tiếp nhận chuyển giao công nghệ và vận hành các nhà máy điện hạt nhân. Các bộ, ngành, địa phương và các tập đoàn phải tiếp tục chủ động triển khai những nhiệm vụ được giao, không chờ đợi; trong quá trình triển khai, nếu phát sinh những vấn đề vượt thẩm quyền thì báo cáo ngay về Bộ Công Thương để tổng hợp báo cáo cấp có thẩm quyền xem xét, giải quyết. Phó thủ tướng giao Bộ Công Thương, là cơ quan Thường trực của Ban Chỉ đạo xây dựng nhà máy điện hạt nhân và chủ trì đàm phán với các đối tác chủ động kiến nghị kiện toàn hoặc nâng cấp đoàn đàm phán nếu cần thiết; phối hợp với Bộ Nội vụ kiện toàn Ban Chỉ đạo xây dựng nhà máy điện hạt nhân. Bộ Công Thương khẩn trương phối hợp với các bộ, cơ quan ban hành kế hoạch triển khai Nghị quyết 189/2025/QH15 của Quốc hội về một số cơ chế, chính sách đặc biệt đầu tư xây dựng Dự án Nhà máy điện hạt nhân Ninh Thuận; đề xuất cơ chế điều chỉnh chủ trương đầu tư; phối hợp với các bộ, ngành liên quan nghiên cứu, đề xuất hướng giải quyết các kiến nghị của tỉnh Ninh Thuận, hoàn thành trước ngày 30/6/2025. Bộ Khoa học và Công nghệ chủ trì rà soát, thống nhất lại ranh giới, khoảng cách an toàn từ hàng rào các nhà máy điện hạt nhân đến khu dân cư, hướng dẫn UBND tỉnh Ninh Thuận triển khai, hoàn thành trước ngày 25/6/2025. Bộ Khoa học và Công nghệ chủ trì, phối hợp với Bộ Công Thương, các bộ, ngành liên quan và Ủy ban Khoa học, Công nghệ và Môi trường tiếp tục rà soát, khẩn trương hoàn thiện dự án Luật Năng lượng nguyên tử sửa đổi, trình Quốc hội thông qua. Dự thảo Luật cần có điều khoản giao Chính phủ, Thủ tướng Chính phủ xử lý những vấn đề chưa có trong quy định của Luật; khẩn trương hoàn thành Báo cáo đánh giá cơ sở hạ tầng điện hạt nhân của Việt Nam theo đúng tiêu chuẩn của Cơ quan Năng lượng nguyên tử Quốc tế (IAEA), hoàn thành báo cáo chậm nhất trong tháng 8/2025. Bộ Tài chính khẩn trương hoàn thiện hồ sơ, trước mắt phân bổ3.236 tỷ đồngtừ ngân sách Trung ương cho tỉnh Ninh Thuận thực hiện dự án di dân, tái định cư, báo cáo Thủ tướng Chính phủ, hoàn thành nhiệm vụ này trước ngày 30/6. Bộ Tài chính phối hợp với các bộ, cơ quan liên quan chủ động đàm phán với các đối tác về thoả thuận cung cấp tín dụng cho các dự án nhà máy điện hạt nhân, trong đó cần làm rõ trách nhiệm của các bên và cơ chế thanh toán. Bộ Nông nghiệp và Môi trường hướng dẫn tỉnh Ninh Thuận triển khai công tác tái định cư trong phạm vi Khu dự trữ sinh quyển thế giới Núi Chúa. Tỉnh Ninh Thuận phải hoàn thành công tác giải phóng mặt bằng trong năm 2025; tiếp tục làm việc với Bộ Công Thương để thống nhất những kiến nghị về thể chế liên quan đến công tác giải phóng mặt bằng, tái định cư, để trình cấp có thẩm quyền xem xét, quyết định; tăng cường kiểm tra, giám sát, không để xảy ra tiêu cực, tham nhũng, lãng phí, bảo đảm người dân đến nơi ở mới có cuộc sống ổn định, bảo đảm nguyên tắc người dân có điều kiện sống bằng hoặc tốt hơn nơi ở cũ. Các tập đoàn EVN, PVN tích cực tham gia các đoàn đàm phán, phối hợp chặt chẽ với tỉnh Ninh Thuận trong công tác giải phóng mặt bằng, tái định cư. Phó thủ tướng đề nghị các bộ, ngành, địa phương và các chủ đầu tư dồn toàn lực để triển khai xây dựng hai nhà máy điện hạt nhân đầu tiên có ý nghĩa rất quan trọng về lâu về dài đối với sự nghiệp công nghiệp hoá, hiện đại hoá của nước ta. Tri Thức - Znewsgiới thiệu độc giảTủ sách kiến thức kinh tếvới đa dạng cuốn sách, câu chuyện trong lĩnh vực kinh doanh, kinh tế. Là nguồn tư liệu cho những người quan tâm và muốn nâng cao kiến thức trong lĩnh vực kinh tế. Những cuốn sách, câu chuyện trong Tủ sách không chỉ đơn thuần là những tác phẩm của tri thức mà còn chứa đựng bí quyết, kinh nghiệm quý báu từ các tác giả, nhà quản lý có uy tín và kinh nghiệm lâu năm trong ngành. Đọc sách không chỉ giúp người đọc tiếp cận những kiến thức mới mà còn giúp mở rộng tầm nhìn và phát triển bản thân. Tủ sách kiến thức kinh tế mong muốn lan tỏa tri thức trong lĩnh vực kinh doanh, đồng thời phát triển văn hóa đọc cho người Việt.  Thủ tướng được quyết chủ trương xây nhà máy điện hạt nhân Ủy ban Khoa học, Công nghệ và Môi trường của Quốc hội tán thành việc Thủ tướng sẽ quyết định chủ trương đầu tư đối với dự án xây dựng nhà máy điện hạt nhân.  Việt Nam hợp tác với tập đoàn Mỹ để phát triển điện hạt nhân Trong ngày đầu tiên của phiên đàm phán thứ 2 giữa Việt Nam và Mỹ, Bộ trưởng Công Thương Nguyễn Hồng Diên đã làm việc với Westinghouse, tập đoàn hàng đầu về công nghệ điện hạt nhân.  Tỷ trọng điện hạt nhân trong quy hoạch điện Việt Nam năm 2030-2050 Quy hoạch điện VIII điều chỉnh đề ra lộ trình phát triển điện hạt nhân, kỳ vọng chiếm 1,7-2,2% tổng công suất phát điện giai đoạn 2030-2035 và 1,4-1,7% vào năm 2050."
