Source,URL,Category,Keyword,Time,Title,Content
ZNews,https://lifestyle.znews.vn/meo-mieng-lech-mat-sau-khi-nam-lau-trong-phong-may-lanh-post1564937.html,Sức khỏe,Null,"Thứ ba, 1/7/2025 14:51 (GMT+7)","Méo miệng, lệch mặt sau khi nằm lâu trong phòng máy lạnh","Mới đây, các bác sĩ khoa Phục hồi chức năng, Bệnh viện Y Dược cổ truyền và Phục hồi chức năng tỉnh Phú Thọ, đã tiếp nhận điều trị cho em L.K.V. (14 tuổi) trong tình trạng liệt dây thần kinh số VII ngoại biên. Trước đó, em xuất hiện tình trạng méo miệng sau khi nằm lâu trong phòng điều hòa. Nhân trung lệch sang trái, ăn uống dễ rơi vãi về bên phải, mắt phải không thể nhắm kín. Bệnh nhi liệt dây thần kinh số VII, buộc phải điều trị tại bệnh viện. Ảnh:BVCC. Tại bệnh viện, em được áp dụng các phương pháp vật lý trị liệu như điện châm, thủy châm, điện xung, chiếu hồng ngoại, xoa bóp bấm huyệt… Sau hai tuần điều trị tích cực, tình trạng cải thiện rõ rệt: mắt đã có thể nhắm kín, miệng đỡ lệch và việc ăn uống trở lại bình thường, không còn rơi vãi. Theo bác sĩ chuyên khoa I Nguyễn Thị Hải Phương, khoa Phục hồi chức năng, Bệnh viện Y Dược cổ truyền và Phục hồi chức năng tỉnh Phú Thọ, dây thần kinh số VII có đoạn dài nằm ngoài sọ, rất dễ tổn thương khi gặp lạnh đột ngột hoặc nhiễm viêm. Việc nằm trong môi trường điều hòa quá lâu có thể khiến các mạch máu nuôi dây thần kinh mặt co thắt, gây thiếu máu cục bộ hoặc phù nề, dẫn đến rối loạn dẫn truyền và tổn thương dây thần kinh. Ngoài ra, việc hít thở luồng khí lạnh liên tục cũng dễ dẫn đến các vấn đề như viêm mũi dị ứng, khô họng, tạo điều kiện để virus hoặc vi khuẩn vùng tai mũi họng phát triển và tấn công dây thần kinh mặt. Tình trạng liệt dây thần kinh VII thường xảy ra đột ngột, nhất là về đêm, sau khi ngủ trong phòng điều hòa. Người bệnh khi tỉnh dậy có thể thấy mắt một bên nhắm không kín, nhân trung lệch sang bên lành, nếp nhăn trán và rãnh mũi má bên liệt mờ hoặc mất, kèm theo cảm giác khô mắt, giảm tiết nước mắt, giảm vị giác ở 2/3 trước lưỡi bên bị ảnh hưởng. Dù không nguy hiểm đến tính mạng, bệnh lý này lại ảnh hưởng rõ rệt đến thẩm mỹ khuôn mặt cũng như các hoạt động sinh hoạt thường ngày như ăn uống, nói chuyện, giao tiếp… Để phòng tránh tình trạng này, bác sĩ khuyến cáo người dân nên sử dụng điều hòa hợp lý: Trong trường hợp xuất hiện các dấu hiệu như méo miệng, mắt nhắm không kín, nói khó, người bệnh cần nhanh chóng đến cơ sở y tế để được chẩn đoán và điều trị kịp thời, tránh để lại di chứng kéo dài. Cuốn sáchBệnh của thời thức ăn tiện lợigiải thích nguyên nhân gây ra tất cả bệnh mạn tính, cách thực phẩm tiện lợi đã tác động đến chúng dẫn đến tổn hại cho sức khỏe, nền kinh tế và môi trường, từ đó đề xuất giải pháp để chữa lành cho con người.  Căn bệnh quen thuộc có thể cướp sinh mạng trẻ sơ sinh trong vài ngày Tại Bệnh viện Sản Nhi Nghệ An, các bác sĩ vừa cứu bé trai 15 ngày tuổi mắc thủy đậu bẩm sinh và gặp biến chứng suy hô hấp cấp - viêm phổi nặng, tràn khí màng phổi.  Nữ sinh 18 tuổi bị thận 'hóa đá' vì thói quen phổ biến Nữ sinh 18 tuổi phải nhập viện cấp cứu giữa đêm vì cơn đau dữ dội vùng thắt lưng kèm buồn nôn, tiểu buốt.  Đau sau zona làm sao để phòng ngừa? Đau sau zona khiến nhiều người phải khiếp sợ. Đến nay, việc điều trị dứt điểm vẫn là thách thức."
ZNews,https://znews.vn/nhan-to-dang-gom-cua-em-xinh-post1564987.html,Giải trí,Null,"Thứ ba, 1/7/2025 06:26 (GMT+7)",Nhân tố đáng gờm của Em xinh,"Sau 2 tiết mục trình diễn ở live stage 2, đội 52Hz giành tổng 339 điểm, nhiều hơn 7 điểm so với đội Bích Phương, để giành chiến thắng. Đó là kết quả từ sự thăng hoa của tiết mụcKhông đau nữa rồi,giúp đội 52Hz dẫn đầu lượt diễn một. Đến lượt diễn thứ 2, màn “chế biến” ca khúcGã săn cácủa đội 52Hz không bùng nổ như kỳ vọng nhưng chất lượng tổng thể vẫn đủ để đứng nhì. Nắm trong tay đội hình chắp vá và bị hoài nghi, các toan tính chuẩn xác của 52Hz giúp cô vượt qua những cái đầu mưu mẹo và lọc lõi của 3 đội trưởng còn lại. Chiến thắng của 52Hz có phần quan trọng của yếu tố may mắn, khi đội của cô được thuận lợi ở vòng đấu giá bài hát và trước đó “bóc” về 2 nghệ sĩ hỗ trợ đặc biệt hiệu quả là Pháp Kiều và Quang Hùng MasterD. 52Hz khởi đầu vòng lập đội live stage 2 bằng việc thuyết phục thành công Orange. Sau đó, nữ ca sĩ đưa về đội Châu Bùi, Lâm Bảo Ngọc, Mỹ Mỹ, MaiQuinn, Quỳnh Anh Shyn và Saabirose. Tổng điểm của các Em xinh trong đội 52Hz khá cao nhưng các mảnh ghép khá rời rạc nhau. Điển hình là 52Hz nắm trong tay đến 2 Fashionista, là Châu Bùi và Quỳnh Anh Shyn vốn không giỏi hát. Đội 52Hz chạy đà thuận lợi từ vòng đấu giá bài hát cân não. Các cô gái, cùng khách mời Pháp Kiều và Quang Hùng MasterD đều ấn định từ đầu phải lấy về ca khúc balladKhông đau nữa rồi. Trong khi đó, 3 đội còn lại đều hời hợt trong cuộc cạnh tranh bản ballad duy nhất trong các demo. Để rồi, đội 52Hz mua thành công ca khúc với cái giá rẻ bất ngờ, chỉ 900 điểm. 52Hz và các thành viên trong team trình diễnKhông đau nữa rồi. Sang lượt đấu thứ 2, đội 52Hz nắm “thế cờ” trong tay khi đã lấy về một bài như ý muốn và vẫn còn quỹ điểm lớn. Các cô gái nhắmGã săn cálà mục tiêu số 1 ở vòng này. Trong cuộc chiến giànhGã săn cá, Bích Phương bất ngờ bỏ cuộc. 52Hz đấu Phương Mỹ Chi và với lợi thế sẵn có, nhóm dễ dàng lấy về bản demo được khán giả chờ đợi nhất ở live stage này. Các đội Phương Mỹ Chi, Miu Lê và Bích Phương đều nhắm đến một ca khúc mang tính khuấy động sân khấu. 52Hz đi ngược phần còn lại khi cầm trên tay một bản ballad thuần túy và một ca khúc hơi hướm dân gian đương đại ma mị. Lựa chọn của 52Hz là giữ nguyên màu nhạc của demo, tập trung đào sâu chất ballad củaKhông đau nữa rồiđể cùng Pháp Kiều tái hiện bản hitHào quangở chương trình. 52Hz không tập trung tổng lực sức mạnh vào một sân khấu. Với ca khúc ballad, khán giả dự đoán đội hình một của 52Hz không thể thiếu Lâm Bảo Ngọc. Song, thực tế là Lâm Bảo Ngọc được điều chuyển sang đội hình 2. 52Hz chọn Orange, Mỹ Mỹ và Châu Bùi cho sân khấu đầu tiên, trong khi Lâm Bảo Ngọc là trụ cột của tiết mụcGã săn cáđể hát đoạn hook được khán giả chờ đợi nhiều nhất ở bản demo này. Với thành tích củaKhông đau nữa rồivàGã săn cá, lựa chọn phân chia 2 đội hình cân bằng sức mạnh của 52Hz đã đúng. Hai đội hình của đội 52Hz đều có thành viên mạnh và yếu nhưng màn trình diễn tổng thể vẫn đảm bảo tròn vai trở lên. Như Châu Bùi và Quỳnh Anh Shyn, ở 2 thái cực đều bị lu mờ, nhưng chiến thắng là của cả tập thể và tất cả Em xinh trong đội 52Hz được an toàn sau live stage 2. Trước khi Em xinh “say hi” lên sóng, 52Hz là tân binh sáng giá của thị trường. Nữ ca sĩ được nhiều khán giả chú ý từ ca khúc Đợi. Sau đó, 52Hz có nhiều sản phẩm triệu view. Đặt lên bàn cân cùng 30 Em xinh, tính từ vạch xuất phát, 52Hz vẫn được xem là người mới. Thực tế là ở những tập đầu tiên, 52Hz chưa được chú ý quá nhiều nhưng càng về sau, giọng ca sinh năm 1999 càng bứt phá. Khởi đầu cho sự bứt phá của 52Hz là được gọi tên trong nhóm 4 đội trưởng của live stage 2. Để xảy ra điều này, 52Hz nắm trong tay điểm số chỉ xếp sau Phương Mỹ Chi. Sau vòng lập đội của live stage 2, 52Hz cũng được khán giả khen ngợi vì sự dứt khoát trong các quyết định, ra chất thủ lĩnh nhất trong 4 đội trưởng. 52Hz đang là nhân tố đáng gờm nhất tại Em xinh ""say hi"". 52Hz có chiến lược rõ ràng và sự thẳng thắn cần thiết để nói ra “có” hoặc “không”. Trong khoảnh khắc chọn thành viên ở lượt 2, vòng lập đội, 52Hz nhanh chóng chọn người về đội. Cô mạnh dạn lấy về Mỹ Mỹ và Châu Bùi, 2 Em xinh thuộc diện rủi ro cao. Về Mỹ Mỹ, 52Hz nói cô biết đồng đội của mình còn nhiều tiềm năng bứt phá. Với Châu Bùi, 52Hz nhìn ra khả năng gây bùng nổ của một fashionista chuẩn bị hát một cách nghiêm túc sau tuyên bố “đã học hát 6 năm”. 52Hz khiến Bảo Anh chạnh lòng với lời từ chối thẳng thừng. Trước đó, 52Hz bỏ qua MAIQUINN, một Em xinh toàn năng, đứng hạng 10, vì không hợp. Tương tự, quyết định từ chối của 52Hz với trường hợp của Yeolan cũng được đưa ra dễ dàng. Quá trình chuẩn bị cho 2 sân khấu biểu diễn của đội 52Hz diễn ra trơn tru. Vai trò thủ lĩnh của 52Hz được thể hiện khi cô từ chối đề nghị vào tiết mục Gã săn cá của Châu Bùi. Mỹ Mỹ có thể mạnh vũ đạo, trên lý thuyết sẽ hợp với tiết mục nặng về sân khấu hơn nhưGã săn cá, nhưng 52Hz muốn Em xinh này thử sức hát ballad. Đứng sau hỗ trợ 52Hz là Rio, người chồng và cũng là producer đứng sau tất cả thành công của nữ ca sĩ. Dấu ấn của 52Hz và ê-kíp là những người xung quanh cô trong tiết mụcKhông đau nữa rồiđã thể hiện rõ. Bố cục bài hát là lựa chọn của 52Hz. Ê-kíp sản xuất âm nhạc là của 52Hz với Rio, Đoàn Minh Vũ. Phương án múa đương đại để bổ trợ ca khúc cũng là quyết định của 52Hz. Các khán giả so sánh sự tỏa sáng của 52Hz với Quang Hùng MasterD, Rhyder ở Anh trai “say hi”. Có một điểm chung giữa 52Hz và hai nam nghệ sĩ là tham gia game show với tinh thần tự thân vận động rất cao. Nghĩa là chính họ đã có nền tảng tốt về sáng tác, hát, rap, sản xuất nhạc. Chiến thắng ở live stage 2 là sự khẳng định cho khả năng của 52Hz, khi nhiều người vẫn hoài nghi cô trong khoảnh khắc công bố đội trưởng. Với bước đệm là đội trưởng dẫn dắt các thành viên về đích an toàn một vòng, cánh cửa ở Em xinh “say hi” đã mở toang cho 52Hz bứt phá. Sự lôi cuốn của thanh âm Cuốn sách Lược sử âm nhạc của nhà nghiên cứu âm nhạc bậc thầy thế giới Robert Philip, dẫn dắt độc giả trên hành trình khám phá cực kỳ lôi cuốn mọi hình thái âm nhạc. 40 chương sách đưa người đọc đi từ dạng thức sơ khai của âm nhạc đến khi con người sử dụng âm nhạc, qua giai đoạn sự lên ngôi của các nhạc cụ, dàn nhạc, đến khi âm nhạc tạo ra những cơn bão trong tâm trí con người thời cách mạng, cuối cùng là âm nhạc trong nhịp sống hiện đại và âm nhạc hướng về tương lai. Cuốn sách làm nổi bật rằng, âm nhạc không chỉ là một hình thức nghệ thuật mà còn là một hiện tượng xã hội phức tạp. Nó phản ánh cấu trúc xã hội, các mối quan hệ quyền lực và những thay đổi trong xã hội. Âm nhạc phát triển theo nhiều chiều hướng khác nhau trong các nền văn hóa."
ZNews,https://znews.vn/brooklyn-tiep-tuc-khien-david-beckham-that-vong-post1565227.html,Giải trí,Null,"Thứ ba, 1/7/2025 20:15 (GMT+7)",Brooklyn tiếp tục khiến David Beckham thất vọng,"Sau nhiều lần khiến truyền thông đặt dấu hỏi về mối quan hệ rạn nứt với gia đình, Brooklyn Beckham tiếp tục nối dài chuỗi im lặng và vắng bóng trong mọi hoạt động của nhà Beckham. TheoDaily Mail, gần đây, trong khi vợ chồng David và Victoria Beckham chia sẻ những hình ảnh bên các con tại Anh, Brooklyn lại xuất hiện bên gia đình vợ trong loạt ảnh thân mật ở Mỹ. Cụ thể, anh vui vẻ chụp hình cùng tỷ phú Nelson Peltz - cha của Nicola - và các anh em nhà vợ trong tiệc sinh nhật lần thứ 83 của ông, được tổ chức tại biệt thự của gia đình Peltz ở Bedford, New York. Nicola Peltz dành những lời có cánh cho cha, gọi ông là “người cha yêu thương và ủng hộ nhất”, trong khi Brooklyn cũng chia sẻ lời chúc ngắn gọn: “Chúc mừng sinh nhật Nelson. Chúng con yêu bố”. Brooklyn thân thiết với gia đình vợ. Ảnh: @nicolapeltz. Đáng chú ý, hình ảnh Brooklyn  bên gia đình Peltz diễn ra sau khi David Beckham nhập viện để tháo bỏ phần kim loại còn sót lại trong cổ tay - hậu quả từ một ca phẫu thuật chấn thương năm 2003. Tuy nhiên, Brooklyn không hề có bất kỳ phản ứng công khai nào về tình hình sức khỏe của cha. Anh không gửi lời hỏi thăm, cũng không đăng tải bất kỳ dòng trạng thái nào liên quan. Trước đó, Brooklyn cũng không xuất hiện tại bất kỳ hoạt động nào mừng sinh nhật lần thứ 50 của David Beckham, bao gồm tiệc gia đình ở Cotswolds, chuyến đi câu cá cùng các anh em trai, hay bữa tiệc tại nhà hàng Core ở Notting Hill. Thậm chí, cả lời chúc mừng sinh nhật trên mạng xã hội dành cho cha cũng không có. Các nguồn tin cho biết, người thân cận với Brooklyn đã phủ nhận thông tin anh cắt liên lạc với gia đình và cho rằng truyền thông đang “bóp méo sự thật”. Dù vậy, theo truyền thông, sự xa cách đang thể hiện rõ ràng qua hành động, đặc biệt là khi Brooklyn thân thiết với cha vợ Nelson, trong khi hoàn toàn phớt lờ cha ruột David giữa lúc đang nhập viện. Sự quan tâm duy nhất mà Brooklyn dành cho gia đình gần đây là việc anh chúc mừng sinh nhật bà nội - mẹ của David Beckham. Cụ thể, anh đăng một bức ảnh cũ chụp cùng bà Sandra và viết ngắn gọn: “Chúc mừng sinh nhật nanny xx, yêu bà nhiều”. Trong khi đó, ở bài đăng riêng của David nhân sinh nhật mẹ, cựu danh thủ vẫn gắn thẻ tên Brooklyn cùng các con Romeo, Cruz và em gái Joanne. Sự lôi cuốn của thanh âm Cuốn sách Lược sử âm nhạc của nhà nghiên cứu âm nhạc bậc thầy thế giới Robert Philip, dẫn dắt độc giả trên hành trình khám phá cực kỳ lôi cuốn mọi hình thái âm nhạc. 40 chương sách đưa người đọc đi từ dạng thức sơ khai của âm nhạc đến khi con người sử dụng âm nhạc, qua giai đoạn sự lên ngôi của các nhạc cụ, dàn nhạc, đến khi âm nhạc tạo ra những cơn bão trong tâm trí con người thời cách mạng, cuối cùng là âm nhạc trong nhịp sống hiện đại và âm nhạc hướng về tương lai. Cuốn sách làm nổi bật rằng, âm nhạc không chỉ là một hình thức nghệ thuật mà còn là một hiện tượng xã hội phức tạp. Nó phản ánh cấu trúc xã hội, các mối quan hệ quyền lực và những thay đổi trong xã hội. Âm nhạc phát triển theo nhiều chiều hướng khác nhau trong các nền văn hóa.  Nguyên nhân nữ diễn viên Ấn Độ đột tử ở tuổi 42 Shefali Jariwala qua đời đột ngột ở tuổi 42 vào tối 27/6 tại Mumbai. Theo truyền thông Ấn Độ, lý do có thể là nữ diễn viên dùng thuốc khi đang đói.  Tin đồn bủa vây sau khi nhà văn Thái Lan qua đời ""Tứ đại tài tử Hong Kong"" Thái Lan vướng tin đồn từng ép buộc cố diễn viên Trần Bảo Liên đóng phim khiêu dâm. Ngay lập tức, trợ lý lên tiếng phủ nhận sự việc.  Minh tinh Thái Lan đi tu Janie Tienphosuwan xuống tóc đi tu ở tỉnh Saraburi. Nhiều bạn bè xúc động, bật khóc khi chứng kiến khoảnh khắc nữ diễn viên cạo trọc đầu."
ZNews,https://znews.vn/lee-hyeri-co-ban-trai-moi-post1565042.html,Giải trí,Null,"Thứ ba, 1/7/2025 10:23 (GMT+7)",Lee Hyeri có bạn trai mới,"Ngày 1/7,My Dailyđưa tin một người làm việc trong ngành giải trí xác nhận Lee Hyeri đang hẹn hò với Chae Woo Tae, cặp đôi đã bên nhau được gần một năm. Lần đầu tiên hai người gặp gỡ  là khi hợp tác trong bộ phimVictoryra mắt năm ngoái. Trong phim, Lee Hyeri vào vai thủ lĩnh Millennium Girls - một câu lạc bộ cổ vũ mới vào nghề. Để thực hiện phần vũ đạo cho ca khúcWhy Are You CallingvàLook Back At Me, Lee Hyeri có cơ hội hợp tác cùng Woo Tae và Kinky - hai vũ công đảm nhận vai trò biên đạo cho bộ phim. ""Bộ phim được quay tại Geoje, Gyeongnam và họ gặp nhau lần đầu tiên khi đang tập luyện vũ đạo ở đó. Cả hai tiếp tục hẹn hò và thể hiện cử chỉ tình cảm tại Seoul. Họ không kể với mọi người xung quanh trong thời gian dài, song hai người đã hẹn hò được gần một năm"", một người trong cuộc cho biết. Một người khác tiết lộ Hyeri và Woo Tae quan tâm đến nhau, cặp đôi nảy sinh tình cảm vì giúp đỡ nhau trong những thời điểm khó khăn. Lee Hyeri và Chae Woo Tae hẹn hò được gần một năm. Ảnh:My Daily. Lee Hyeri sinh năm 1994, ra mắt trong nhóm nhạc gồm bốn thành viên Girl’s Day vào năm 2010. Nữ ca sĩ nổi tiếng sau khi tham gia chương trình Real Men và đảm nhận vai chính trong phim truyền hìnhReply 1988. Đây là bộ phim có tỷ suất người xem cao nhất trong lịch sử truyền hình cáp tvN tính tới năm 2015. Thành công củaReply 1988giúp cô lọt vào top 3 người nổi tiếng quyền lực do Forbes Hàn Quốc bình chọn năm 2016 và là một trong những nghệ sĩ có cát-xê đóng quảng cáo cao nhất nước này. Ngoài ra, Lee Hyeri từng hẹn hò Ryu Jun Yeol, bạn diễn trongReply 1988. Trong khi đó, Chae Woo Tae là vũ công chuyên nghiệp với sở trường là bộ môn Krumping. Sau khi tham gia Street Man Fighter năm 2022 giúp tên tuổi nam vũ công tạo dựng chỗ đứng trong làng giải trí. Năm 2024, Woo Tae đảm nhận vai trò giám khảo cùng Hari Won, Diệp Lâm Anh trong chương trình Nữ hoàng vũ đạo đường phố (mùa 1) - phiên bản Việt của chương trình Street Woman Fighter. Chuyên mục giải trígiới thiệu cuốnNghệ thuật yêucủa nhà phân tâm học Erich Fromm xuất bản năm 1957. Đến nay, cuốn sách được dịch ra 34 thứ tiếng với hàng triệu bản in. Nó vừa là công trình nghiên cứu lý thuyết, vừa là cuốn sách tâm tình, gợi mở bạn đọc hiểu về bản chất của yêu.  Sao 'Những bà nội trợ kiểu Mỹ' gợi cảm Eva Longoria vướng lịch ghi hình cho dự án mới nên không thể tham dự đám cưới xa hoa giữa Lauren Sánchez và Jeff Bezos. Nữ diễn viên đã gửi lời chúc phúc cho đôi uyên ương trước đó.  Mẹ Kim 'siêu vòng ba' bên bạn trai kém 25 tuổi Kris Jenner xuất hiện thanh lịch trong bộ váy đen trắng tại đám cưới 20 triệu USD của Jeff Bezos và Lauren Sánchez. Bà được bạn trai kém 25 tuổi hộ tống.  Vẻ ngoài của BTV vừa cưới HLV Vũ Hồng Việt HLV Vũ Hồng Việt và Thùy Anh tổ chức lễ cưới vào ngày 30/6 tại Hà Nội. Vợ của HLV hiện là BTV của Đài truyền hình Việt Nam."
ZNews,https://znews.vn/nguyen-tran-trung-quan-xin-loi-post1565257.html,Giải trí,Null,"Thứ ba, 1/7/2025 23:09 (GMT+7)",Nguyễn Trần Trung Quân xin lỗi,"Chiều 1/7, trong buổi họp báo giới thiệu MVTự nhiên thất tìnhdiễn ra tại TP.HCM, Nguyễn Trần Trung Quân nhắc đến vụ lùm xùm trước đây. Nam ca sĩ cúi đầu xin lỗi khán giả và bày tỏ sự hối hận. “Tại đây, ở thời điểm này, tôi muốn cúi đầu xin lỗi, thẳng thắn chia sẻ những gì đã xảy ra một cách trực diện nhất, không giấu bất kỳ điều gì”, Trung Quân mở đầu. Trung Quân xin lỗi về ồn ào trước đây. Ảnh:NVCC. Nam ca sĩ cho biết bài viết gây tranh cãi xuất phát từ một dòng trạng thái anh đăng trên fanpage cá nhân từ năm 2012. Khi thấy khán giả Việt Nam và quốc tế tranh cãi quá gay gắt, anh mới chọn cách xoá bài đăng, không phải vì sợ mất fan Trung Quốc hay có tư duy lệch lạc. Tuy nhiên, nam ca sĩ thừa nhận đó là hành động hồ đồ, thiếu kinh nghiệm và là “quyết định ngu ngốc nhất” mà anh từng đưa ra. Trung Quân chia sẻ đáng lý khi mọi việc xảy ra, anh không nên im lặng mà cần lên tiếng bảo vệ chính kiến, khẳng định lập trường và chủ quyền biển đảo Việt Nam. Anh cho biết ồn ào kể trên là bài học lớn trong hành trình sống và làm nghề của mình. “Tôi không mong khán giả dễ dàng bỏ qua. Tôi chỉ mong mọi người sẽ thấy mình sẽ thay đổi theo hướng tích cực, bằng âm nhạc và sự chân thành. Tôi tự hào là người con của Tổ quốc Việt Nam”, Trung Quân khẳng định. MVTự nhiên thất tìnhđánh dấu sự trở lại của Trung Quân trên đường đua Vpop sau nhiều năm. Theo nam ca sĩ, sản phẩm là chương tiếp theo trong vũ trụTự Tâm. MV lần này tiếp nối mạch truyện còn dang dở mà anh và Denis Đặng  từng tạo ra cách đây 5 năm. Nguyễn Trần Trung Quân sinh năm 1992 và được khán giả biết đến sau khi tham gia cuộc thi Sao mai điểm hẹn năm 2012. Anh lọt top 4 ca sĩ xuất sắc và có nhiều tiết mục nhận được đánh giá cao từ ban giám khảo cũng như khán giả. Nam ca sĩ từng đỗ thủ khoa trung cấp thanh nhạc và giành giải nhất trong nhiều cuộc thi như Giọng hát hay Hà Nội, Tiếng hát tuổi hồng TP Hà Nội. Nhiều năm qua, Trung Quân phát hành các MV với sự đầu tư lớn. Năm 2021, nam ca sĩ và Denis Đặng từng gây chú ý khi chia sẻ thông tin chi10 tỷ đồnglàm MVNước chảy hoa trôi. Sự lôi cuốn của thanh âm Cuốn sách Lược sử âm nhạc của nhà nghiên cứu âm nhạc bậc thầy thế giới Robert Philip, dẫn dắt độc giả trên hành trình khám phá cực kỳ lôi cuốn mọi hình thái âm nhạc. 40 chương sách đưa người đọc đi từ dạng thức sơ khai của âm nhạc đến khi con người sử dụng âm nhạc, qua giai đoạn sự lên ngôi của các nhạc cụ, dàn nhạc, đến khi âm nhạc tạo ra những cơn bão trong tâm trí con người thời cách mạng, cuối cùng là âm nhạc trong nhịp sống hiện đại và âm nhạc hướng về tương lai. Cuốn sách làm nổi bật rằng, âm nhạc không chỉ là một hình thức nghệ thuật mà còn là một hiện tượng xã hội phức tạp. Nó phản ánh cấu trúc xã hội, các mối quan hệ quyền lực và những thay đổi trong xã hội. Âm nhạc phát triển theo nhiều chiều hướng khác nhau trong các nền văn hóa.  Diễn viên Thanh Trúc công khai chồng Châu Khải Phong Tại tiệc thôi nôi con gái, diễn viên Thanh Trúc và ca sĩ Châu Khải Phong lần đầu tiên công khai chuyện tình cảm.  Lee Seo Yi qua đời ở tuổi 43 Diễn viên Hàn Quốc Lee Seo Yi qua đời ở tuổi 43. Cô mất từ ngày 20/6, nhưng đến nay thông tin mới được công bố.  Ca sĩ Hàn phẫu thuật khẩn cấp khi đang đi du lịch Joo Young Hoon phải phẫu thuật khẩn cấp khi du lịch tại đảo Jeju. Vợ anh, diễn viên Lee Yoon Mi, cho biết chồng cô nhập viện sau cơn đau bụng và sốt cao giữa đêm."
