Source,URL,Category,Keyword,Time,Title,Content
ZNews,https://znews.vn/ong-trump-do-loi-cho-ong-biden-khi-kinh-te-my-chung-lai-post1550153.html,Kinh doanh,Null,"Thứ tư, 30/4/2025 21:43 (GMT+7)",Ông Trump đổ lỗi cho ông Biden khi kinh tế Mỹ chững lại,"Ông Trump kêu gọi mọi người kiên nhẫn và khẳng định chính sách thuế quan sẽ sớm phát huy hiệu quả. Ảnh:Reuters. Nền kinh tế Mỹ được cho là đã chững lại, thậm chí có thể suy giảm trong quý I. Giới chuyên gia cảnh báo những rối loạn do chính sách thuế quan thiếu nhất quán từ chính quyền Tổng thống Donald Trump đang gây ra thiệt hại thực sự đối với tăng trưởng, theoReuters. Báo cáo ước tính sơ bộ về GDP của Bộ Thương mại Mỹ sẽ được công bố vào thứ Tư (giờ Mỹ) - trùng thời điểm ông Trump tròn 100 ngày tại nhiệm kỳ hai. Dữ liệu này được dự báo sẽ khiến mức tín nhiệm của ông trong xử lý vấn đề kinh tế tiếp tục sụt giảm, trong bối cảnh người tiêu dùng và doanh nghiệp đều đang bi quan. Theo khảo sát củaReuters, GDP quý I có thể chỉ tăng 0,3% theo tốc độ hàng năm - mức thấp nhất kể từ quý II/2022. Tuy nhiên, con số này có thể còn tệ hơn sau khi dữ liệu hôm thứ Ba cho thấy thâm hụt thương mại hàng hóa của Mỹ đã tăng lên mức kỷ lục trong tháng 3, chủ yếu do nhập khẩu tăng mạnh, đặc biệt là vàng phi tiền tệ. Goldman Sachs dự báo GDP quý I có thể giảm tới 0,8%. Ước tính, thâm hụt thương mại đã lấy đi tới 1,9 điểm phần trăm khỏi tăng trưởng GDP. Trước đó, kinh tế Mỹ tăng trưởng 2,4% trong quý IV/2024. Một số nhà kinh tế khuyến nghị không nên quá lo lắng về con số tăng trưởng, do phần lớn nhập khẩu tăng đến từ vàng - yếu tố không phản ánh đúng sức khỏe thực của nền kinh tế. Tuy nhiên, các mô hình dự báo đang đưa ra nhiều kết quả trái ngược: Fed Atlanta dự báo GDP giảm 1,5%, còn nhóm nghiên cứu của Fed New York lại kỳ vọng tăng trưởng đạt 2,6%. Trước thông tin nói trên, Tổng thống Donald Trump đã lên tiếng bảo vệ chính sách thuế quan của mình và đổ lỗi cho người tiền nhiệm, theoCNBC. “Đây là thị trường chứng khoán của ông Biden, không phải của tôi. Tôi mới tiếp quản từ ngày 20/1”, ông Trump viết trên mạng xã hội Truth Social. Ông khẳng định thuế quan sẽ sớm phát huy hiệu quả và hàng loạt doanh nghiệp đang chuyển nhà máy về Mỹ. “Nền kinh tế của chúng ta sẽ bùng nổ, nhưng trước hết cần gạt bỏ 'gánh nặng Biden'. Điều này sẽ cần thời gian, không liên quan gì đến thuế quan. Chỉ là ông ấy để lại những con số tồi tệ. Nhưng khi cú bùng nổ bắt đầu, nó sẽ chưa từng có trong tiền lệ. Hãy kiên nhẫn!”, ông Trump viết. Chỉ số niềm tin tiêu dùng đã giảm xuống mức thấp nhất trong gần 5 năm. Tâm lý doanh nghiệp cũng sụt giảm rõ rệt, đặc biệt trong ngành hàng không khi nhiều hãng đã rút lại dự báo tài chính cho năm 2025 do lo ngại chi tiêu đi lại không thiết yếu sẽ bị cắt giảm. “Cú sốc thương mại hiện tại đang che mờ mọi nỗ lực khác của Nhà Trắng”, ông Joe Brusuelas, kinh tế trưởng tại RSM US, nhận định. “Chúng ta đã đi từ cú sốc thương mại sang tài chính và giờ là nguy cơ suy thoái - tất cả chỉ trong chưa đầy 100 ngày"", vị chuyên gia nói thêm. Nhiều doanh nghiệp Mỹ ""đau đầu"" vì chính sách thuế quan của ông Trump. Ảnh: Reuters. Áp lực giá cả vẫn chưa có dấu hiệu hạ nhiệt. Chỉ số giá tiêu dùng cá nhân (PCE) loại trừ thực phẩm và năng lượng được dự báo tăng 3,3% trong quý I, cao hơn mức 2,6% của quý IV/2024. Với lạm phát còn dai dẳng, nhiều chuyên gia dự đoán Fed sẽ tiếp tục cắt giảm lãi suất trong năm nay, dù chưa rõ thời điểm. Chi tiêu tiêu dùng - chiếm hơn 2/3 nền kinh tế - được dự đoán chậm lại đáng kể. Nhiều hộ gia đình đã mua sắm sớm để né giá tăng, trong khi thị trường lao động đang dần nguội. Xu hướng tiết kiệm lên ngôi, khiến sức mua suy yếu. Dù nhập khẩu tăng mạnh, tồn kho doanh nghiệp không tăng đáng kể. Đây là điều khiến nhiều chuyên gia cho rằng nên thận trọng khi diễn giải các con số GDP, đặc biệt khi thâm hụt thương mại phần lớn đến từ nhập vàng. Một số chuyên gia khuyến nghị nên tập trung vào doanh số cuối cùng của các đối tượng tiêu dùng nội địa tư nhân - chỉ số loại trừ các yếu tố như thương mại, tồn kho và chi tiêu chính phủ - để phản ánh chính xác hơn nhịp đập của nền kinh tế. Tuy nhiên, chỉ số này cũng bị bóp méo bởi tác động của việc người dân và doanh nghiệp đẩy mạnh chi tiêu trước khi thuế được áp dụng. Tri Thức - Znewsgiới thiệu độc giảTủ sách kiến thức kinh tếvới đa dạng cuốn sách, câu chuyện trong lĩnh vực kinh doanh, kinh tế. Là nguồn tư liệu cho những người quan tâm và muốn nâng cao kiến thức trong lĩnh vực kinh tế. Những cuốn sách, câu chuyện trong Tủ sách không chỉ đơn thuần là những tác phẩm của tri thức mà còn chứa đựng bí quyết, kinh nghiệm quý báu từ các tác giả, nhà quản lý có uy tín và kinh nghiệm lâu năm trong ngành. Đọc sách không chỉ giúp người đọc tiếp cận những kiến thức mới mà còn giúp mở rộng tầm nhìn và phát triển bản thân. Tủ sách kiến thức kinh tế mong muốn lan tỏa tri thức trong lĩnh vực kinh doanh, đồng thời phát triển văn hóa đọc cho người Việt.  Trung Quốc lần đầu lên tiếng về vụ trả máy bay Boeing Bắc Kinh kêu gọi Washington tạo dựng môi trường thương mại ổn định, đồng thời cho biết các hãng hàng không Trung Quốc và Boeing đang chịu tổn thất nặng nề do thuế quan của Mỹ.  Thủ tướng: Hoàn thiện phương án đàm phán thuế với Mỹ trong ngày mai Thủ tướng yêu cầu từng bộ, ngành liên quan phải xây dựng phương án đàm phán cụ thể, Bộ Công Thương tập hợp và sớm hoàn thiện phương án đàm phán trong ngày mai (30/4).  Ngân hàng lớn nhất châu Âu lãi tăng 'sốc' hơn 300% HSBC vừa công bố kết quả kinh doanh quý I/2025 với lợi nhuận trước thuế tăng gần 317% so với quý trước, vượt xa kỳ vọng của thị trường."
ZNews,https://znews.vn/coteccons-giam-lai-post1550030.html,Kinh doanh,Null,"Thứ tư, 30/4/2025 17:43 (GMT+7)",Coteccons giảm lãi,"Coteccons ghi nhận tổng giá trị backlog (giá trị hợp đồng đã ký) từ quý III năm tài chính 2025 chạm mức 37.000 tỷ đồng. Ảnh:CTD. CTCP Xây dựng Coteccons (HoSE: CTD) vừa công bố kết quả kinh doanh quý III năm tài chính 2025 (từ ngày 1/7/2024 đến 30/6/2025, tương ứng với kết quả kinh doanh 3 quý đầu năm 2025) với doanh thu hợp nhất đạt hơn5.000 tỷ đồng, tăng 7% so với cùng kỳ niên độ trước. Trong đó, doanh thu từ hợp đồng xây dựng tiếp tục đóng vai trò chủ lực, đạt trên4.900 tỷ đồng. Đáng chú ý, doanh thu bán hàng đạt hơn53 tỷ đồng, trong khi cùng kỳ không ghi nhận khoản thu nào từ hoạt động này. Doanh thu tài chính cũng cải thiện từ 42 tỷ lên56 tỷ đồng. Về chi phí, Coteccons đã chủ động tiết giảm chi phí bán hàng và chi phí khác, tuy nhiên, khoản thu nhập khác trong kỳ lại sụt giảm mạnh từ69 tỷ đồngxuống còn hơn 106 triệu đồng. Điều này dẫn đến lợi nhuận sau thuế 3 tháng đầu năm nay của công ty chỉ đạt57 tỷ đồng, giảm gần 50% so với cùng kỳ năm ngoái. Lũy kế 9 tháng niên độ tài chính 2025, Coteccons ghi nhận doanh thu hợp nhất16.647 tỷ đồng, tăng 15% so với cùng kỳ và lợi nhuận sau thuế đạt255 tỷ đồng, tăng 6%. So với kế hoạch cả niên độ là25.000 tỷ đồngdoanh thu và430 tỷ đồnglợi nhuận sau thuế, công ty mới hoàn thành lần lượt 67% và 59% mục tiêu đề ra. Mới đây, trong kỳ cơ cấu tháng 4, cổ phiếu CTD đã lần đầu tiên được đưa vào rổ chỉ số VNDiamond của HoSE - nhóm đại diện cho các cổ phiếu bluechip có giới hạn tỷ lệ sở hữu nước ngoài cao, thường được các quỹ đầu tư và ETF theo dõi sát sao. Coteccons cho biết trong 9 tháng của niên độ tài chính 2025, công ty đã ghi nhận giá trị trúng thầu đạt khoảng23.000 tỷ đồng, nâng tổng giá trị backlog (giá trị hợp đồng đã ký) chạm mức37.000 tỷ đồng. Trong 3 tháng đầu năm, Coteccons tiếp tục mở rộng danh mục dự án, với nhiều công trình lớn như: The 9 Stellars của Sơn Kim Land, Cảng hàng không quốc tế Gia Bình, tổ hợp du lịch Hòn Thơm - Phú Quốc (Làng Tây), Khu du lịch trung tâm Cát Bà của Sun Group, dự án Olalani Riverside Tower, các Khu đô thị tại Phú Quốc, cũng như hàng loạt công trình tại Hà Nội và TP.HCM. Ngoài ra, doanh nghiệp cũng đẩy mạnh hợp tác với nhiều chủ đầu tư mới như Masterise Homes (The Global City, The Lake Masteri Lakeside), Ray River Estates, KCN Việt Nam, Greencans Industries... Đặc biệt, Coteccons còn đạt bước tiến mới trong lĩnh vực hạ tầng, đầu tư công khi tham gia thi công Nhà để xe sân bay Long Thành (giai đoạn 1) thuộc Dự án Cảng hàng không quốc tế Long Thành, cùng với liên danh CC1 và FECON. Tri Thức - Znewsgiới thiệu độc giảTủ sách kiến thức kinh tếvới đa dạng cuốn sách, câu chuyện trong lĩnh vực kinh doanh, kinh tế. Là nguồn tư liệu cho những người quan tâm và muốn nâng cao kiến thức trong lĩnh vực kinh tế. Những cuốn sách, câu chuyện trong Tủ sách không chỉ đơn thuần là những tác phẩm của tri thức mà còn chứa đựng bí quyết, kinh nghiệm quý báu từ các tác giả, nhà quản lý có uy tín và kinh nghiệm lâu năm trong ngành. Đọc sách không chỉ giúp người đọc tiếp cận những kiến thức mới mà còn giúp mở rộng tầm nhìn và phát triển bản thân. Tủ sách kiến thức kinh tế mong muốn lan tỏa tri thức trong lĩnh vực kinh doanh, đồng thời phát triển văn hóa đọc cho người Việt.  Vinaconex 'đối đầu' Coteccons tại gói thầu 4.000 tỷ sân bay Long Thành Coteccons, Vinaconex và Hancorp từng cạnh tranh gói thầu 35.000 tỷ đồng sân bay Long Thành.  Nối gót loạt đại gia, Coteccons tham gia dự án hơn 10.000 tỷ ở Long An Bên cạnh Coteccons, thị trường bất động sản Long An gần đây càng trở nên sôi động nhờ loạt dự án lớn từ Ecopark, Vingroup... với tổng vốn đầu tư hàng tỷ USD.  Cổ phiếu Coteccons phá đỉnh Cổ phiếu CTD của Coteccons tiếp tục thiết lập mức kỷ lục mới ở mốc 95.000 đồng/cổ phiếu. Đây cũng là thị giá cao nhất kể từ khi ông Bolat Duisenov ngồi ghế Chủ tịch."
ZNews,https://znews.vn/vietjet-hoan-thanh-chuyen-giao-dich-vu-mat-dat-o-san-bay-tan-son-nhat-post1550146.html,Kinh doanh,Null,"Thứ tư, 30/4/2025 20:20 (GMT+7)",Vietjet hoàn thành chuyển giao dịch vụ mặt đất ở sân bay Tân Sơn Nhất,"Bước phát triển và hoàn thiện chuỗi dịch vụ hàng không của Vietjet cho thấy hãng đã sẵn sàng phục vụ người dân và du khách trên những chuyến bay phủ khắp Việt Nam và quốc tế. Trang thiết bị hiện đại tại sân bay Tân Sơn Nhất. Tại sân bay có lưu lượng khách cao nhất cả nước mỗi dịp lễ, Tết, từ ngày 20/4, tất cả chuyến bay Vietjet đi từ và đến sân bay Tân Sơn Nhất đã được hãng triển khai công tác tự phục vụ, từ làm thủ tục, các dịch vụ vận chuyển hành khách, hành lý trong sân bay cũng như các dịch vụ khác trong sân bay… Hoạt động thông suốt tại sân bay dù lưu lượng khách tăng cao. Với kinh nghiệm triển khai công tác tự phục vụ mặt đất tại sân bay Nội Bài, Hà Nội từ năm 2020 và đạt chứng nhận tiêu chuẩn an toàn trong lĩnh vực khai thác mặt đất của IATA (ISAGO) từ năm 2024, Vietjet đã chuẩn bị hơn 1.000 nhân sự phục vụ công tác chuyển giao tại Tân Sơn Nhất, bên cạnh đầu tư hệ thống xe thang, xe đẩy, xe kéo, các trang thiết bị mặt đất… để phục vụ thông suốt cho các chuyến bay. Hàng trăm chuyến bay mỗi ngày trong dịp cao điểm lễ 30/4 phục vụ nhu cầu khách hàng. Các quy trình vận hành khai thác, phối hợp giữa các bộ phận liên quan tại sân bay, phân luồng cất, hạ cánh, phân luồng hành lý… cũng được hãng hàng không rà soát, cập nhật để phù hợp với lưu lượng hành khách tăng mạnh, đảm bảo an toàn tuyệt đối cho các chuyến bay, hành khách. Những trang thiết bị, tàu bay với hai sắc đỏ - vàng của cờ Tổ quốc phủ khắp sân bay, mang đến những hình ảnh ấn tượng với người dân và du khách đến với TP.HCM trong dịp kỷ niệm 50 năm Giải phóng miền Nam, thống nhất đất nước. Những vị khách quốc tế đến TP.HCM dịp này cũng đặc biệt ấn tượng với các dịch vụ thuận tiện tại sân bay, các quy trình phục vụ thông suốt và hiệu quả dù mỗi ngày có hàng trăm chuyến bay được khai thác. Hành khách bất ngờ với những món quà mừng đại lễ 30/4 từ phi hành đoàn Vietjet. Hình ảnh phi hành đoàn Vietjet với trang phục mang hình ảnh cách điệu của cờ đỏ - sao vàng Việt Nam cũng lan toả hình ảnh tự hào, góp phần quảng bá hình ảnh Việt Nam tươi đẹp, hiếu khách. Vietjet cho biết đã tăng số chuyến bay đi, đến TP.HCM trong thời gian từ 29/4 đến 5/5 lên 1.400 chuyến bay để phục vụ nhu cầu đến với thành phố trong dịp kỷ niệm đặc biệt ý nghĩa này. Được biết, trong kỳ nghỉ lễ 30/4 - 1/5, Vietjet cung ứng gần 620.000 ghế, tăng khoảng 100.000 ghế, tương đương với gần 500 chuyến bay khắp Việt Nam phục vụ nhu cầu người dân về quê thăm thân và đi du lịch… Với việc đưa vào ứng dụng công nghệ, hành khách bay cùng Vietjet có thể thực hiện hoàn toàn các quy trình từ đặt vé đến làm thủ tục cho chuyến bay trực tuyến, thông qua hệ thống website và ứng dụng điện thoại Vietjet Air. Để rút ngắn thời gian làm thủ tục và tránh tình trạng ùn tắc tại các nhà ga, Vietjet cũng đã bố trí thêm các nhân viên hỗ trợ hành khách làm thủ tục tại các kiosk checkin tự động đặt tại sân bay… Hành khách trải nghiệm làm thủ tục thông qua nhận diện sinh trắc học. Trước đó, Vietjet cũng tiên phong phối hợp cùng triển khai ứng dụng định danh, xác thực điện tử và nhận diện sinh trắc học phục vụ làm thủ tục lên tàu bay thông qua ứng dụng VneID do Bộ Công an phát triển tại hai sân bay lớn nhất cả nước là Nội Bài và Tân Sơn Nhất. Với lượng khách qua các cảng sân bay 109 triệu khách năm 2024, giải pháp này không chỉ mang tính cách mạng về trải nghiệm hành khách, mà còn giúp rút ngắn hàng triệu giờ làm thủ tục mỗi năm, tăng năng suất vận hành của các cảng hàng không, mang tới giá trị kinh tế lên tới hàng chục nghìn tỷ đồng mỗi năm cho nền kinh tế. Sau hơn 1 tuần triển khai tự phục vụ tại sân bay Tân Sơn Nhất và cũng đúng dịp cao điểm lễ 30/4 - 1/5, các chuyến bay đi, đến từ TP.HCM đã vận hành hiệu quả, nâng cao hiệu suất hoạt động, mang tới trải nghiệm tốt đẹp hơn cho người dân, du khách trong dịp này và mùa hè sắp tới.  Vietjet ứng dụng AI trong hoạt động tuyển dụng tiếp viên hàng không 15:00 26/4/202515:0026/4/2025Kinh doanhKinh doanh 0 AI đang trở thành “cánh tay đắc lực” ở nhiều hoạt động, ngành nghề. Tại Việt Nam, một hãng hàng không vừa tiên phong ứng dụng AI vào quy trình tuyển dụng và đạt hiệu quả ấn tượng.  Những chuyến bay Vietjet rực rỡ cờ đỏ - sao vàng trong dịp đại lễ 30/4 12 giờ trước14:0030/4/2025Kinh doanhKinh doanh 0 Hòa chung niềm vui kỷ niệm 50 năm ngày Giải phóng miền Nam, thống nhất đất nước 30/4, Vietjet dành tặng du khách những chuyến bay ngập không khí tự hào cùng màu cờ Tổ quốc.  Ông Trump đổ lỗi cho ông Biden khi kinh tế Mỹ chững lại 5 giờ trước21:4330/4/2025Kinh doanhKinh doanh 0 Tổng thống Donald Trump lên tiếng bảo vệ chính sách thuế quan của mình và đổ lỗi cho người tiền nhiệm khi kinh tế Mỹ chững lại trong quý I."
ZNews,https://znews.vn/trung-quoc-lan-dau-len-tieng-ve-vu-tra-may-bay-boeing-post1550033.html,Kinh doanh,Null,"Thứ tư, 30/4/2025 17:36 (GMT+7)",Trung Quốc lần đầu lên tiếng về vụ trả máy bay Boeing,"Đã có 3 chiếc Boeing 737 MAX bị Trung Quốc trả về Mỹ. Ảnh:Reuters. TheoReuters, Bộ Thương mại Trung Quốc mới đây đã lên tiếng     cho biết các hãng hàng không Trung Quốc và Boeing đang chịu ảnh hưởng nghiêm trọng     từ chính sách thuế quan mới do Mỹ áp đặt, đồng thời bày tỏ hy vọng Washington sẽ     lắng nghe mối quan ngại của doanh nghiệp và tạo dựng một môi trường thương mại ổn     định. Tuyên bố này đánh dấu lần đầu tiên chính quyền Bắc Kinh lên     tiếng về tác động của thuế quan đối với ngành hàng không kể từ khi Boeing đưa 3     chiếc 737 MAX vốn chờ bàn giao tại Trung Quốc trở lại Mỹ. Tuần trước, Boeing cho biết một số khách hàng tại Trung Quốc đã từ chối tiếp nhận máy bay mới do ảnh hưởng của thuế và nhà sản xuất máy bay này đang xem xét bán     lại hàng chục chiếc máy bay cho bên khác. Trả lời câu hỏi của truyền thông về việc các máy bay bị trả     lại, Bộ Thương mại Trung Quốc nói sẵn sàng ủng hộ hợp tác kinh doanh bình thường     giữa 2 nước, đồng thời kêu gọi Washington tạo môi trường đầu tư và thương mại     có thể dự đoán được. “Các hãng hàng không bị ảnh hưởng của Trung Quốc và Boeing đều     đã chịu thiệt hại nặng nề”, cơ quan quản lý thương mại Trung Quốc nhận định, đồng thời nhấn     mạnh các mức thuế của Mỹ đã làm gián đoạn chuỗi cung ứng toàn cầu, hoạt động     vận tải hàng không và đầu tư. Bắc Kinh đang thể hiện lo ngại về hệ lụy từ cuộc chiến     thương mại. Các doanh nghiệp cho biết Trung Quốc đã miễn thuế cho một số mặt     hàng nhập khẩu từ Mỹ vốn bị đánh thuế lên đến 125%, đồng thời yêu cầu các công     ty xác định các loại hàng hóa thiết yếu cần được nhập khẩu mà không bị áp thuế. Hôm 25/4, Safran - tập đoàn sản xuất động cơ máy bay của     Pháp - nhận được thông báo rằng Trung Quốc đã cấp đặc quyền miễn thuế cho một số     linh kiện thiết bị hàng không, bao gồm động cơ và bộ càng đáp. Trong môi trường kinh tế hiện nay, đầu tư đã trở thành khái niệm không mấy xa lạ với hầu hết mọi người. Để độc giả có thể tiếp cận những xu hướng đầu tư mới nhất,Tri Thức - Znewsxây dựng chủ đềĐầu tư qua sách- nơi ghi lại những cuốn sách, câu chuyện, xu hướng đầu tư đã và đang diễn ra. Trong đó, các lĩnh vực đầu tư phổ biến bao gồm bất động sản, chứng khoán, ngoại hối và tiền ảo... Ngoài các câu chuyện về đầu tư, Đầu tư qua sách còn bao gồm các kiến thức về quản lý gia sản, tài chính cá nhân.  Boeing nói về thương vụ Việt Nam mua 250 máy bay Boeing cho biết hai đơn hàng của Vietnam Airlines và Vietjet cho thấy Việt Nam là thị trường tiềm năng của Boeing. Tuy nhiên, tiến độ các đơn hàng còn phụ thuộc vào khách hàng.  CEO Boeing: 'Trung Quốc đã ngừng nhận máy bay của chúng tôi' Boeing đang tìm cách chuyển hướng một số máy bay dự kiến giao cho Trung Quốc sang khách hàng khác, trong bối cảnh Bắc Kinh ngừng nhận hàng do căng thẳng thương mại với Mỹ.  Thêm máy bay Boeing bị Trung Quốc 'trả' về Mỹ Trung Quốc đã trả lại 2 chiếc Boeing trở về cơ sở sản xuất của hãng tại Seattle (Mỹ) trong bối cảnh cuộc chiến thuế quan giữa 2 nền kinh tế lớn nhất thế giới chưa hạ nhiệt."
