Source,URL,Category,Keyword,Time,Title,Content
ZNews,https://znews.vn/gia-vang-the-gioi-bat-tang-sau-quyet-dinh-cua-fed-post1610200.html,Kinh doanh,Null,"Thứ năm, 11/12/2025 09:42 (GMT+7)",Giá vàng thế giới bật tăng sau quyết định của Fed,"Chốt phiên giao dịch 10/12, giá vàng thế giới tăng lên 4.227,5 USD/ounce. Ảnh:Reuters. Chốt phiên giao dịch 10/12,giá vàngthế giới giao ngay tăng20,4 USDlên4.227,5 USD/ounce. Trong khi đó, hợp đồng vàng tương lai giao tháng 2 tại Mỹ giảm nhẹ 0,3% còn4.224,7 USD/ounce. Diễn biến này xuất hiện trong bối cảnh Ủy ban Thị trường Mở Liên bang (FOMC) hạ lãi suất qua đêm thêm 0,25%, xuống phạm vi 3,5-3,75%, sau cuộc họp chính sách kéo dài 2 ngày,  theoCNBC. Với tỷ lệ 9 phiếu thuận và 3 phiếu chống, điều chưa từng xảy ra kể từ tháng 9/2019, quyết định trên tiếp tục phản ánh sự đối lập quan điểm giữa phe ""diều hâu"" và ""bồ câu"". Cụ thể, Thống đốc Stephen Miran muốn giảm mạnh hơn 0,5%, trong khi hai Chủ tịch Fed khu vực Jeffrey Schmid (Kansas City) và Austan Goolsbee (Chicago) lại muốn giữ nguyên mức lãi suất. Chủ tịch Fed Jerome Powell cho biết chính sách lãi suất hiện ở vị thế tốt để ứng phó với những diễn biến sắp tới của nền kinh tế, đồng thời từ chối đưa ra gợi ý thêm về khả năng cắt giảm tiếp theo. Ông Tai Wong, nhà giao dịch kim loại độc lập, nhận định giới giao dịch vàng rất hài lòng với kết quả ngày hôm nay. Lãi suất thấp hơn khiến các tài sản không sinh lời như vàng trở nên hấp dẫn hơn đối với nhà đầu tư. ""Chủ tịch Powell đã khéo léo dẫn dắt một nội bộ đầy chia rẽ để có thêm một lần cắt giảm, với chỉ 3 phiếu chống và thị trường đang hưởng lợi từ kết quả này"", ông Wong nói thêm. Ở diễn biến khác, giá bạc giao ngay đạt đỉnh mọi thời đại ở mức61,85 USD/ounce. Giá bạc đã tăng 113% từ đầu năm đến nay, được hỗ trợ bởi nhu cầu công nghiệp tăng mạnh, tồn kho suy giảm và việc Mỹ xếp bạc vào nhóm khoáng sản quan trọng. ""Chúng tôi cho rằng mức tăng vượt trội của bạc phản ánh dòng tiền đầu cơ chảy vào tài sản mang tính 'đòn bẩy' ngày một lớn, đặc biệt sau các nhịp điều chỉnh của vàng"", các nhà phân tích tại SP Angel nhìn nhận. Bên cạnh dòng tiền đầu cơ, bạc còn hưởng lợi từ thị trường vật chất khan hiếm khi nguồn cung bị siết mạnh trong tháng 10. Đối với các kim loại khác, bạch kim giảm 2,4% xuống1.654,55 USD/ounce, trong khi palladium giảm 2% còn1.475,94 USD/ounce. Không phải ai cũng có cơ hội gặp gỡ, trò chuyện với những doanh nhân, tỷ phú, những nhà quản lý doanh nghiệp nổi tiếng thế giới. Tuy nhiên, vẫn có cách để chúng ta tiếp cận, tìm hiểu về câu chuyện kinh doanh, cuộc đời, kinh nghiệm của các doanh nhân, tỷ phú nổi tiếng thông qua sách. Tri Thức - Znewsgiới thiệu độc giảTủ sách doanh nhân- nơi chia sẻ những cuốn sách, câu chuyện về cuộc đời và kinh nghiệm của các tỷ phú, nhà quản lý nổi tiếng thế giới. Tủ sách không chỉ bao gồm các cuốn sách, câu chuyện từ tác giả độc lập mà còn bao gồm những cuốn sách do chính các tỷ phú viết về cuộc đời mình. Tủ sách doanh nhân mong muốn gửi tới độc giả các câu chuyện, góc nhìn về những cá nhân thành công nhất trong lĩnh vực kinh doanh, đồng thời mong muốn lan tỏa tri thức, phát triển văn hóa đọc cho người Việt.  Mỗi lượng vàng miếng và vàng nhẫn cùng giảm gần nửa triệu đồng/lượng trong phiên giao dịch sáng nay (9/12) kéo giá bán về sát mốc 154 triệu đồng/lượng.  Giá vàng thế giới tăng mạnh khi giới đầu tư chờ đợi loạt dữ liệu kinh tế mới của Mỹ, đồng thời họ cũng đặt kỳ vọng lớn vào việc Fed sẽ cắt giảm lãi suất vào tháng tới.  Sau giai đoạn biến động mạnh, giá vàng thế giới duy trì vùng 4.000 USD/ounce. Hiện các chuyên gia Phố Wall tỏ ra thờ ơ còn nhà đầu tư vẫn trông chờ cú hích mới cho giá vàng."
ZNews,https://znews.vn/chot-them-3-truong-hop-nha-nuoc-dung-ra-thu-hoi-dat-post1610210.html,Kinh doanh,Null,"Thứ năm, 11/12/2025 10:03 (GMT+7)",Chốt thêm 3 trường hợp Nhà nước đứng ra thu hồi đất,"Quốc hội thống nhất bổ sung 3 trường hợp Nhà nước đứng ra thu hồi đất cho nhà đầu tư. Ảnh:Đinh Hà. Sáng 11/12,         với đa số đại biểu tham gia biểu quyết tán thành, Quốc hội đã thông qua Nghị         quyết quy định về một số cơ chế, chính sách tháo gỡ khó khăn, vướng mắc trong tổ         chức thi hành Luật Đất đai. Một trong những     nội dung đáng chú ý của Nghị quyết này là bổ sung 3 trường hợp Nhà nước thu hồi     đất để phát triển kinh tế xã hội vì lợi ích quốc gia, công cộng. Một là, Nhà     nước sẽ đứng ra thu hồi đất để thực hiện dự án trong khu thương mại tự do, dự     án trong trung tâm tài chính quốc tế. Hai là, trường     hợp sử dụng đất để thực hiện dự án thông qua thỏa thuận về nhận quyền sử dụng đất     đã hết thời hạn phải hoàn thành thỏa thuận hoặc hết thời gian gia hạn hoàn     thành thỏa thuận mà đã thỏa thuận được trên 75% diện tích đất và trên 75% số lượng     người sử dụng đất thì HĐND cấp tỉnh xem xét, thông qua việc thu hồi phần đất     còn lại để giao đất, cho thuê đất cho chủ đầu tư. Nếu số tiền     theo phương án bồi thường tính trên một đơn vị diện tích đất thấp hơn trung     bình của giá đất đã thỏa thuận thì người có đất thu hồi được nhận thêm số tiền     còn thiếu so với mức trung bình đó. Chủ đầu tư ứng trước kinh phí để trả số tiền     chênh lệch này, và được tính vào chi phí đầu tư của dự án. Bà là, thu hồi     để tạo quỹ đất thanh toán dự án theo Hợp đồng Xây dựng - Chuyển giao (Hợp đồng     BT), để cho thuê đất tiếp tục sản xuất, kinh doanh đối với trường hợp tổ chức     đang sử dụng đất mà Nhà nước thu hồi đất quy định tại Điều 78, Điều 79 Luật Đất     đai, Nhà nước cũng sẽ đứng ra thu hồi đất. Ngoài 3 trường     hợp kể trên, Nghị quyết mới cũng bổ sung trường hợp Nhà nước thu hồi đất vì mục     đích quốc phòng, an ninh làm cơ sở cai nghiện ma túy do lực lượng vũ trang nhân     dân quản lý. Điều kiện để     Nhà nước đứng ra thu hồi đất với các trường hợp kể trên là phải hoàn thành việc     phê duyệt phương án bồi thường, hỗ trợ, tái định cư và việc bố trí tái định cư     theo quy định của Luật Đất đai, trừ một số trường hợp như: Thu hồi đất     trong trường hợp phương án bồi thường, hỗ trợ, tái định cư không có bố trí tái     định cư đã được niêm yết công khai nhưng chưa được phê duyệt đối với các dự án     quan trọng quốc gia, dự án đầu tư công khẩn cấp theo quy định của pháp luật; đối     với dự án khác nếu được trên 75% người sử dụng đất đồng ý thu hồi đất trước khi     phê duyệt phương án bồi thường, hỗ trợ, tái định cư; Thu hồi đất     trước khi hoàn thành việc bố trí tái định cư đối với trường hợp dự án đầu tư     công khẩn cấp theo quy định của pháp luật, dự án thực hiện tái định cư tại chỗ,     dự án mà việc bố trí tái định cư theo tuyến công trình chính; Chính phủ     quy định chi tiết việc thu hồi đất trước khi phê duyệt phương án bồi thường, hỗ     trợ, tái định cư và thu hồi đất trước khi hoàn thành việc bố trí tái định cư. Nghị quyết     yêu cầu UBND cấp tỉnh quy định việc bố trí tạm cư, thời gian và kinh phí tạm cư     đối với trường hợp thu hồi đất trước khi hoàn thành bố trí tái định cư. Giá đất tính     tiền bồi thường và tại nơi tái định cư thực hiện theo quy định tại Luật Đất đai,     tính theo giá đất trong bảng giá đất và hệ số điều chỉnh quy định tại Nghị quyết     này. Trường hợp bồi     thường bằng đất ở tại chỗ mà giá đất tại vị trí được bồi thường chưa có trong bảng     giá đất thì cơ quan, người có thẩm quyền căn cứ vào giá đất trong bảng giá tại     vị trí tương tự để quyết định giá đất tại nơi tái định cư trong phương án bồi     thường. UBND cấp xã     có trách nhiệm báo cáo UBND cấp tỉnh để trình HĐND cấp tỉnh bổ sung vào bảng     giá đất trong kỳ họp gần nhất. Liên quan     các trường hợp không được bồi thường về đất khi Nhà nước thu hồi đất, ngoài 6     trường hợp không được bồi thường đã quy định tại khoản 1 Điều 107 của Luật đất     đai, Nghị quyết đã bổ sung thêm một số trường hợp cũng không được bồi thường về     đất khi Nhà nước thu hồi đất gồm: Đất do cơ quan, tổ chức của Nhà nước quản lý     quy định tại Điều 217 của Luật Đất đai; Đất thu hồi trong trường hợp quy định tại     Điều 81, khoản 1 và khoản Điều 82 của Luật Đất đai; và các trường hợp khác do     Chính phủ quy định. Tri Thức - Znewsgiới thiệu độc giảTủ sách kiến thức kinh tếvới đa dạng cuốn sách, câu chuyện trong lĩnh vực kinh doanh, kinh tế. Những cuốn sách, câu chuyện trong Tủ sách không đơn thuần là những tác phẩm của tri thức mà còn chứa đựng bí quyết, kinh nghiệm quý báu từ các tác giả, nhà quản lý có uy tín và kinh nghiệm lâu năm trong ngành. Đọc sách không chỉ giúp tiếp cận những kiến thức mới mà còn giúp mở rộng tầm nhìn và phát triển bản thân. Tủ sách kiến thức kinh tế mong muốn lan tỏa tri thức trong lĩnh vực kinh doanh, đồng thời phát triển văn hóa đọc cho người Việt.  Quốc hội đã nghe Tờ trình và Báo cáo thẩm tra về dự thảo Nghị quyết của Quốc hội quy định một số cơ chế, chính sách tháo gỡ khó khăn, vướng mắc trong tổ chức thi hành Luật Đất đai.  Có 443 vướng mắc liên quan đến thực hiện mô hình chính quyền địa phương 2 cấp; 835 kiến nghị, vướng mắc liên quan đến quá trình triển khai thi hành pháp luật đất đai.  18 phút trước10:2611/12/2025 0 Áp lực thanh khoản mùa cao điểm cuối năm khiến nhiều ngân hàng đồng loạt đẩy lãi suất huy động dưới 6 tháng lên mức kịch trần 4,75%/năm theo quy định của Ngân hàng Nhà nước (NHNN)."
ZNews,https://znews.vn/quoc-hoi-dong-y-xay-san-bay-gia-binh-lon-hon-noi-bai-tan-son-nhat-post1610209.html,Kinh doanh,Null,"Thứ năm, 11/12/2025 09:30 (GMT+7)","Quốc hội đồng ý xây sân bay Gia Bình, lớn hơn Nội Bài, Tân Sơn Nhất","Khu đất gần 2.000 ha xây dựng sân bay Gia Bình (ảnh chụp tháng 8/2025). Ảnh:Đinh Hà. Sáng 11/12, với đa số đại biểu tham gia biểu quyết tán thành, Quốc hội đã chính         thức thông qua Nghị quyết chủ trương đầu tư Dự án đầu tư xây dựng Cảng hàng         không quốc tế Gia Bình (sân bay Gia Bình). Theo đó, Quốc hội chấp     thuận chủ trương đầu tư xây dựng dự án sân bay Gia Bình theo các chuẩn mực quốc tế, trở thành cảng hàng không thông minh, xanh, bền vững,     thế hệ mới đẳng cấp quốc tế, đáp ứng nhu cầu phát triển kinh tế - xã hội, phục     vụ khai thác lưỡng dụng, đảm bảo hoạt động an ninh - quốc phòng và các sự kiện     đối ngoại quan trọng, trong đó có Hội nghị Cấp cao APEC năm 2027. Theo kế hoạch, nhu cầu sử dụng đất của dự án khoảng 1.885 ha, là sân bay có diện tích lớn thứ hai của Việt Nam, chỉ sau sân bay Long Thành và lớn hơn sân bay Nội Bài, Tân Sơn Nhất hiện tại. Địa điểm thực         hiện tại các xã Gia Bình, Lương Tài, Nhân Thắng, Lâm Thao, tỉnh Bắc Ninh, thời hạn hoạt động         của dự án là 70 năm. Dự án đạt tiêu     chuẩn dịch vụ cảng hàng không quốc tế 5 sao, thuộc nhóm 10 cảng hàng không 5     sao hàng đầu thế giới theo tiêu chí của Skytrax và nằm trong nhóm sân bay có trải     nghiệm hành khách xuất sắc theo đánh giá của Hội đồng Cảng hàng không Quốc tế;     hướng tới là cửa ngõ hàng không của miền Bắc, là cảng hàng không trung chuyển     hành khách, hàng hóa và cơ sở bảo dưỡng, sửa chữa, đại tu máy bay của khu vực châu Á - Thái Bình Dương. Về     quy mô, sân bay Gia Bình đạt cấp 4F (theo tiêu chuẩn của Tổ chức     Hàng không Dân dụng Quốc tế - ICAO); đáp ứng nhu cầu khai     thác giai đoạn đến năm 2030 khoảng 30 triệu lượt hành khách/năm và 1,6 triệu tấn     hàng hóa/năm. Giai đoạn đến năm 2050 công suất khoảng 50 triệu lượt hành khách/năm và 2,5 triệu     tấn hàng hóa/năm. Tổng vốn đầu tư     của dự án khoảng196.378 tỷ đồng, trong đó vốn chủ     sở hữu của nhà đầu tư phải đảm bảo không thấp hơn 15% tổng vốn đầu tư của dự     án. Vị trí xây dựng sân bay Gia Bình (tỉnh Bắc Ninh). Theo Nghị quyết,     hình thức lựa chọn nhà đầu tư thực hiện theo quy định tại Nghị quyết số     03/2025/NQ-CP củaChính phủvề cơ chế, chính sách đặc thù đầu tư xây dựng Cảng     hàng không quốc tế Gia Bình. Về tiến độ thực     hiện dự án chia làm 2 giai đoạn. Giai đoạn 1 (2025-2030), trong đó, các năm 2025-2027 hoàn thành xây dựng các công trình cần thiết để phục vụ Hội     nghị Cấp cao APEC năm 2027; các năm 2026-2030 hoàn thành xây dựng các     công trình còn lại của giai đoạn 1 bảo đảm đồng bộ vận hành, khai thác đáp ứng     công suất 30 triệu lượt hành khách/năm và 1,6 triệu tấn hàng hóa/năm. Giai đoạn 2 (2031-2050) hoàn thành xây dựng các công trình đáp ứng     công suất 50 triệu lượt hành khách/năm và 2,5 triệu tấn hàng hóa/năm. Nghị         quyết giao UBND tỉnh Bắc Ninh được phép di chuyển các di tích lịch sử - văn hóa         (các cấp) trong quá trình triển khai công tác bồi thường, hỗ trợ, tái định cư         và thực hiện đầu tư dự án. Việc     di chuyển được thực hiện trên cơ sở phương án do UBND tỉnh Bắc Ninh quyết định,     bảo đảm bảo tồn tối đa và phát huy giá trị của các di tích,     bảo đảm công khai, minh bạch, có tham vấn ý kiến của người dân. Trong     quá trình thực hiện, nếu phát sinh vướng mắc, Chính phủ hướng dẫn thực hiện. Tri Thức - Znewsgiới thiệu độc giảTủ sách kiến thức kinh tếvới đa dạng cuốn sách, câu chuyện trong lĩnh vực kinh doanh, kinh tế. Những cuốn sách, câu chuyện trong Tủ sách không đơn thuần là những tác phẩm của tri thức mà còn chứa đựng bí quyết, kinh nghiệm quý báu từ các tác giả, nhà quản lý có uy tín và kinh nghiệm lâu năm trong ngành. Đọc sách không chỉ giúp tiếp cận những kiến thức mới mà còn giúp mở rộng tầm nhìn và phát triển bản thân. Tủ sách kiến thức kinh tế mong muốn lan tỏa tri thức trong lĩnh vực kinh doanh, đồng thời phát triển văn hóa đọc cho người Việt.  Bí thư Tỉnh ủy Nguyễn Hồng Thái yêu cầu cơ quan chức năng tập trung cao độ giải phóng mặt bằng dự án sân bay Gia Bình, các phương án, phần việc làm công khai, minh bạch, vì lợi ích nhân dân.  Đại biểu Quốc hội cho rằng việc xây dựng sân bay Gia Bình giai đoạn 2 kéo dài đến năm 2050 là quá dài, cần khẩn trương hơn.  16 phút trước10:2611/12/2025 0 Áp lực thanh khoản mùa cao điểm cuối năm khiến nhiều ngân hàng đồng loạt đẩy lãi suất huy động dưới 6 tháng lên mức kịch trần 4,75%/năm theo quy định của Ngân hàng Nhà nước (NHNN)."
ZNews,https://znews.vn/bill-gates-canh-bao-ve-ai-post1610171.html,Công nghệ,Null,"Thứ năm, 11/12/2025 09:56 (GMT+7)",Bill Gates cảnh báo về AI,"Bill Gates cho rằng một số công ty AI đang được định giá phi thực tế. Ảnh:Bloomberg. Phát biểu tại Tuần lễ Tài chính Abu Dhabi,Bill Gatesnhận định AI hiện là “điều quan trọng nhất đang diễn ra”, trong bối cảnh đầu tư cho lĩnh vực này tăng mạnh và hàng loạt thương vụ liên tiếp khiến thị trường trở nên nhạy cảm. Tuy nhiên, ông cho rằng điều đó không đảm bảo mọi công ty được định giá cao sẽ chiến thắng. “Cuộc đua sẽ rất khốc liệt”, Gates nói. Ông mô tả AI là “một bong bóng” theo nghĩa không phải mọi mức định giá đều tăng lên theo thời gian. Dù vậy, vị tỷ phú khẳng định AI vẫn là công nghệ rất sâu sắc và có khả năng định hình lại thế giới. Nhiều doanh nghiệp AI hiện có giá trị ở mức định giá vượt xa mặt bằng chung. Palantir và Tesla có hệ số P/E, tỷ lệ giữa giá cổ phiếu và lợi nhuận trên mỗi cổ phiếu trên 200, so với mức khoảng 25 của các công ty thuộc S&P 500. Thị trường toàn cầu đã ghi nhận đợt giảm trong tháng 11 khi lo ngại về bong bóng công nghệ gia tăng. Gates cho rằng một phần đáng kể trong số các công ty này sẽ không có giá trị thực tế trong dài hạn. Tuy nhiên, ông vẫn giữ quan điểm AI sẽ mang lại thay đổi tích cực và sâu rộng. “Không ai nên nghi ngờ những lợi ích mà AI có thể đem lại, từ y tế, giáo dục đến nông nghiệp”, Bill Gates nói. Đồng sáng lập Microsoft cho rằng AI sẽ mở ra nhiều cơ hội mới. Ảnh:Bloomberg. Theo đó, năm 2026 được dự đoán là giai đoạn quan trọng với lĩnh vực y tế toàn cầu. Đầu tháng 12, Quỹ Gates cùng các lãnh đạo và nhà từ thiện quốc tế đã cam kết1,9 tỷ USDđể chống bệnh bại liệt. Khoản hỗ trợ nhằm cung cấp vắc xin cho hàng triệu trẻ em và củng cố hệ thống y tế, góp phần phòng ngừa các dịch bệnh khác. Ông cho biết nhiều ứng dụng AI mới sẽ được triển khai trong năm tới, đặc biệt ở châu Phi để giúp cải thiện tình hình y tế tại đây. “Chúng ta sẽ thử nghiệm nhiều công cụ AI, từ bác sĩ ảo đến trợ lý hỗ trợ các phương ngữ tại châu Phi”, Gates nhấn mạnh. Bill Gates - Tham vọng lớn lao và quá trình hình thành đế chế Microsoft Cuốn sáchmở ra một câu chuyện sinh động và chân thực về sự nổi lên của một thiên tài, cách thức ông làm thay đổi cả một nền công nghiệp máy tính.  Alexandr Wang, người lãnh đạo đội ngũ AI tại Meta, cho rằng những người trẻ ngày nay nên dành nhiều thời gian thử nghiệm AI, thay vì tập trung vào các sở thích khác.  Dù là hai cái tên lâu năm trong lĩnh vực công nghệ, Bill Gates và Linus Torvalds mới có lần đầu tiên dùng bữa cùng nhau.  Phản pháo Bill Gates, CEO Tesla yêu cầu bằng chứng cho cáo buộc cắt giảm viện trợ gây tử vong, khơi mào cuộc tranh luận nảy lửa về hiệu quả chính phủ Mỹ."
