Source,URL,Category,Keyword,Time,Title,Content
Tuoi tre,https://tuoitre.vn/rose-blackpink-la-nghe-si-han-quoc-dau-tien-lam-duoc-dieu-nay-tai-grammy-20251108092451199.htm,Giải trí,"Grammy,Rosé (Blackpink),Lady Gaga,Kendrick Lamar,Billie Eilish",08/11/2025 09:46 GMT+7,Rosé BlackPink là nghệ sĩ Hàn Quốc đầu tiên làm được điều này tại Grammy,"Đúng như dự đoán của giới chuyên môn, siêu ""hit"" APT. đã mang về cho Rosé (cùng Bruno Mars) 3 đề cử quan trọng tại Grammy 2026 - Ảnh: chartdata Đáng chú ý,APT.của Rosé xuất hiện ở hai hạng mục quan trọng nhất ""Big four"" (Tứ đại) là ""Bản thu âm của năm"" (Record of the Year) và ""Bài hát của năm"" (Song of the Year). Đề cử còn lại là ""Trình diễn pop theo cặp/nhóm xuất sắc nhất"". Thành tích này giúpRoséthiết lập cột mốc lịch sử, trở thành nghệ sĩ solo K-pop đầu tiên và cũng là nghệ sĩ nữ K-pop đầu tiên lọt vào vòng đề cử của ""Big four"". Tuy nhiên đường đua năm nay được đánh giá là vô cùng khốc liệt với sự thống trị của các tên tuổi lớn như Kendrick Lamar, Lady Gaga, Billie Eilish và Sabrina Carpenter... Việc ""APT."" nhận được 3 đề cử, trong đó có 2 đề cử tại ""Big Four"", không chỉ là một chiến thắng cá nhân cho Rosé mà còn là một cột mốc lịch sử ""vô tiền khoáng hậu""cho K-pop. Trước đây BTS đã nhiều lần ""chạm ngõ"" Grammy ở các hạng mục pop, nhưng việc một nghệ sĩ solo K-pop (và là nghệ sĩ nữ K-pop đầu tiên) phá vỡ được ""bức tường"" của Tứ đại, đặc biệt là ở ""Bản thu âm của năm"" và ""Bài hát của năm"", là một sự công nhận từ viện hàn lâm. Cơn bão APT. đã càn quét các bảng xếp hạng toàn cầu suốt năm 2025, và việc ca khúc này có mặt tại Grammy là điều được dự đoán - Ảnh: X Tuy nhiên đường đua năm nay khốc liệt hơn bao giờ hết. Tại cả hai hạng mục ""Bản thu âm của năm"" và ""Bài hát của năm"", Rosé và Bruno Mars sẽ đối đầu trực tiếp với những đối thủ ""nặng ký"" nhất: luther(Kendrick Lamar ft. SZA),WILDFLOWER(Billie Eilish),Manchild(Sabrina Carpenter),Abracadabra(Lady Gaga),Anxiety(Doechii),DtMF(Bad Bunny) vàGolden(HUNTR/X). Ở hạng mục Trình diễn pop theo cặp/nhóm xuất sắc nhất,APT.cũng gặp phải thử thách lớn từ bản nhạc phimWickedđang ""làm mưa làm gió"" làDefying Gravity(Cynthia Erivo & Ariana Grande),Goldencủa HUNTR/X và30 For 30(SZA ft. Kendrick Lamar). Dẫn đầu danh sách đề cử năm nay không ai khác ngoài rapperKendrick Lamar. Album ""GNX"" của anh nhận được đề cử quan trọng nhất là ""Album của năm"". Đây là sự trở lại được giới phê bình ca ngợi hết lời sau albumMr. Morale & the Big Steppers. Đĩa đơn ""luther"" (hợp tác với SZA) cũng góp mặt ở cả ""Bản thu âm của năm"" và ""Bài hát của năm"", biến anh thành ứng cử viên sáng giá nhất. Hai ""quái vật"" Grammy, Kendrick Lamar và Lady Gaga là đối thủ trực tiếp của Rosé (BlackPink) tại các hạng mục quan trọng nhất ""Big four"" năm nay Lady Gaga cũng có màn trở lại ngoạn mục. AlbumMayhemcủa cô được đề cử hạng mục ""Album của năm"" và ca khúcAbracadabracũng cạnh tranh trực tiếp với Rosé ở ""Bản thu âm của năm"" và ""Bài hát của năm"". ""Album của năm"" là hạng mục quan trọng và danh giá nhất, đây là cuộc chiến ""cân tài cân sức"" của 8 album: DeBÍ TiRAR MáS FOToS(Bad Bunny),SWAG(Justin Bieber),Man's Best Friend(Sabrina Carpenter),Let God Sort Em Out(Clipse),Mayhem(Lady Gaga),GNX(Kendrick Lamar),MUTT(Leon Thomas),CHROMAKOPIA(Tyler, The Creator) Hạng mục ""Nghệ sĩ mới xuất sắc nhất"" năm nay quy tụ nhiều gương mặt mới nổi bật: KATSEYE (Nhóm nhạc nữ toàn cầu của HYBE và Geffen Records), Olivia Dean, The Marías, Addison Rae, sombr, Leon Thomas, Alex Warren, Lola Young. Lễ trao giải Grammy lần thứ 68 dự kiến diễn ra vào tháng 2-2026 tại Los Angeles, Mỹ. Mùa giải Grammy 2026 đang đến gần với nhiều dự đoán kịch tính, nếu năm ngoái là cuộc đối đầu nảy lửa giữa những siêu sao như Taylor Swift, Beyoncé, Billie Eilish và Chappell Roan, thì năm nay bức tranh có phần khác biệt. "
Tuoi tre,https://tuoitre.vn/9-nha-thiet-ke-quoc-te-den-viet-nam-trinh-dien-thoi-trang-2025110810424882.htm,Giải trí,"Tuần lễ Thời Trang Quốc tế,nhà thiết kế,Tuần lễ thời trang quốc tế Việt Nam,Vietnam International Fashion Week",08/11/2025 11:14 GMT+7,9 nhà thiết kế quốc tế đến Việt Nam trình diễn thời trang,"Nhà thiết kế Priyo Oktavino (Indonesia) trình diễn đêm khai mạc Tuần lễ thời trang quốc tế Việt Nam 2024 - Ảnh: BTC Đó là cácnhà thiết kếđến từ Singapore, Philippines, Malaysia, Tây Ban Nha, Trung Quốc, Ấn Độ,  Indonesia, Lào và Campuchia. Bà Trang Lê - nhà sáng lậpTuần lễ thời trang quốc tế Việt Nam- cho biếtTuần lễ thời trang quốc tế Việt Nammùa này có 9 nhà thiết kế quốc tế, 9 nhà thiết kế Việt Nam cùng 2 trường đào tạo về thời trang tham gia. Năm nay số lượng nhà thiết kế quốc tế nhiều hơn các mùa trước. Các nhà thiết kế quốc tế quay lại sàn diễn Việt như: nhà thiết kế Frederick Lee (Singapore) được xem là bậc thầy của thiết kế haute couture cảm xúc; nhà thiết kế Priyo Oktavino (Indonesia) gây chú ý với khả năng kết hợp giữa truyền thống và hiện đại. Nhà thiết kế Laura Fontan Pardo, đồng sáng lập thương hiệu thời trangChula(Tây Ban Nha), tiếp tục trở lại Việt Nam trình diễn bộ sưu tập mới. Thương hiệu Behati (Malaysia) với phong cách cá tính cũng sẽ xuất hiện trên sàn diễn Việt Nam. Đặc biệt nhà thiết kế Francis Libiran (Philippines) trở lại sau nhiều năm vắng bóng. Các thiết kế của anh thể hiện tinh thần pop culture couture, phóng khoáng, hiện đại. Hai đại diện đến từ thương hiệu thời trang Tây Ban Nha - Chula Fashion trình diễn tại Việt Nam năm 2024 - Ảnh: BTC Theo ban tổ chức, bên cạnh những nhà thiết kế tên tuổi còn có những gương mặt mới lần đầu góp mặt, góp phần tạo làn gió mới chosàn diễn Việt. Đó là nhà thiết kế Bandid Lasavong đến từ Lào, được mệnh danh là “phù thủy” của pha trộn chất liệu tạo nên phom dáng hiện đại. Ajay Kumar (Ấn Độ) sở hữu phong cách thiết kế phóng khoáng nhưng vẫn giữ đậm bản sắc truyền thống. Anh từng trình diễn tại Lakme Fashion Week, Swim Week Colombo và Harbin Fashion Week. Nhà thiết kế Natacha Van (Campuchia) với thế mạnh phong cách táo bạo, cá tính, đề cao tinh thần sáng tạo tự do. Cô từng là giám khảo Cambodia’s Next Top Model. Với thông điệpBản sắc riêng tạo phong cách,Tuần lễ thời trang quốc tế Việt Nam 2025 (Vietnam International Fashion Week)diễn ra từ ngày 11 đến 15-11, tại Cung thể thao Quần Ngựa, Hà Nội. Nhà thiết kếVũ Việt Hàtrình diễn mở màn và nhà thiết kế Cao Minh Tiến diễn kết màn. Thiết kế độc đáo của nhà thiết kế Francis Libiran (Philippines) - biểu tượng của tinh thần pop culture couture hiện đại - Ảnh: BTC Thiết kế thể hiện phong cách mạnh mẽ, phóng khoáng của nhà thiết kế Ajay Kumar (Ấn Độ) - Ảnh: BTC Nhà thiết kế Natacha Van (Campuchia) với thiết kế tinh tế, tôn vinh giá trị văn hóa bản địa - Ảnh: BTC Những thiết kế đầy sắc màu của nhà thiết kế Frederick Lee (Singapore) - Ảnh: BTC Thương hiệu Behati (Malaysia) với phong cách cá tính, thể hiện tinh thần mạnh mẽ - Ảnh: BTC Thương hiệu Trip & Co (Trung Quốc) thể hiện tinh thần sáng tạo hiện đại, mang tính ứng dụng cao - Ảnh: BTC Tuần lễ thời trang quốc tế Việt Nam Xuân Hè 2025 chính thức khai mạc. Nhà thiết kế Lê Thanh Hòa diễn mở màn."
Tuoi tre,https://tuoitre.vn/noi-dung-gia-dinh-lan-dau-duoc-dua-vao-giai-pickleball-bao-phu-nu-tp-hcm-20251108104836469.htm,Thể thao,"báo Phụ Nữ TP.HCM,pickleball,Giải Pickleball Báo Phụ nữ TPHCM",08/11/2025 11:38 GMT+7,Nội dung 'Gia đình' lần đầu được đưa vào Giải pickleball báo Phụ Nữ TP.HCM,"Nội dung Gia đình được đưa vào Giải pickleball báo Phụ Nữ TP.HCM, nhằm tăng cường sự gắn kết giữa các thành viên trong cùng một nhà - Ảnh: BPN Giảipickleballdo báoPhụ Nữ TP.HCMtổ chức lần này mang chủ đề ""Tăng yêu thương - Thêm vui khỏe"". Theo bà Lý Việt Trung - Tổng biên tập báoPhụ Nữ TP.HCM, chủ đề lần này nhằm hướng đến người chơi là các thành viên trong gia đình. Bà chia sẻ: ""Ở những giải lần trước, chúng tôi nhận thấy có rất nhiều VĐV đi thi đấu mà mang cả gia đình theo cổ vũ. Nhờ vậy mà không khí rất là sôi nổi, nhộn nhịp, tràn đầy niềm vui. Do đó lần này, báoPhụ Nữ TP.HCMtổ chức giải với chủ đề 'Tăng yêu thương - Thêm vui khỏe' là hướng đến việc tạo ra sân chơi chung cho các thành viên trong gia đình, giúp mọi người không chỉ có một sân chơi thể thao mà còn là nơi kết nối, mang lại những kỷ niệm đẹp"". Cũng trên tinh thần đó, Giải pickleball của báoPhụ Nữ TP.HCMlần thứ 3 tổ chức đã lần đầu có nội dung thi đấu đồng đội ""Gia đình"", bên cạnh các nội dung Vợ - Chồng, Mẹ - Con, Cha - Con đã xuất hiện ở 2 lần trước. Bà Lý Việt Trung - Tổng biên tập báo Phụ Nữ TP.HCM - phát biểu khai mạc - Ảnh: BPN Nội dung Gia đình được kỳ vọng sẽ tạo ra dấu ấn đặc biệt, tăng gắn kết tình cảm giữa các thành viên trong cùng một nhà. Giải đấu lần này quy tụ tổng cộng 294 VĐV. Bên lề giải đấu là nhiều hoạt động ý nghĩa, thiết thực. Trong đó lực lượng cán bộ, phóng viên, biên tập viên và nhân viênbáoPhụ Nữ TP.HCMủng hộ 100 triệu đồng vì bão lũ miền Trung. Ngoài ra còn có chương trình quà tặng hỗ trợ VĐV của CLB pickleball dành cho người khuyết tật. Giải pickleball tranh Cúp báoPhụ Nữ TP.HCMlần 3 năm 2025 nhằm hưởng ứng cuộc vận động ""Toàn dân rèn luyện thân thể theo gương Bác Hồ vĩ đại"", thực hiện Thông tri 32 của Thường trực Thành ủy TP.HCM về thực hiện Kết luận số 70 của Bộ Chính trị về tăng cường thể dục thể thao trong tình hình mới. Chào mừng Đại hội Đảng các cấp nhiệm kỳ 2025-2030. Tăng cường đoàn kết, giao lưu cổ vũ phong trào rèn luyện, nâng cao sức khỏe thể chất và đời sống văn hóa tinh thần của phụ nữ, chào mừng kỷ niệm 95 năm Ngày Phụ nữ Việt Nam 20-10-1930 - 20-10-2025. Pickleball có rất nhiều điểm tương đồng với nhóm các môn cầm vợt là quần vợt, cầu lông và bóng bàn. Trong số đó, cầu lông thường được so sánh về mức độ dễ chơi, phù hợp với nữ giới."
Tuoi tre,https://tuoitre.vn/vi-sao-vua-het-nuoc-di-trong-co-vua-thi-lai-hoa-trong-khi-co-tuong-duoc-xu-thang-20251108091340279.htm,Thể thao,"cờ vua,cờ tướng,World Cup cờ vua,triết lý,chiến thuật",08/11/2025 09:59 GMT+7,"Vì sao vua hết nước đi trong cờ vua thì lại hòa, trong khi cờ tướng được xử thắng?4","Triết lý chiến thắng của cờ tướng rộng hơn so với cờ vua - Ảnh: Thăng Long Kỳ Đạo Trong khi cờ vua xử hòa (Stalemate), cờ tướng lại xử thua cho bên bị hết nước đi hợp lệ. Tại sao lại có sự phân định đối lập này? Trong cờ vua, trường hợp vua không bị chiếu nhưng không còn nước đi hợp lệ nào được gọi là Stalemate và ván đấu kết thúc với tỉ số hòa. Luật cờ vua được xây dựng dựa trên mục tiêu duy nhất là chiếu bí. Đây là điều kiện thắng duy nhất và không thể thay thế. Đối với cờ vua, khi một bên có lợi thế lớn về quân (ví dụ: hậu và vua đối đầu vua đơn độc) dồn được vua đối phương vào thế hết nước đi nhưng lại quên chiếu vua để tạo ra nước chiếu bí, điều đó được xem là thất bại về mặt kỹ thuật trong việc hoàn thành mục tiêu chiến thắng. Ngoài ra, việc xử hòa trong trường hợp này nhằm đảm bảo tính công bằng. Bên mạnh hơn, dù có lợi thế quân số, đã không thể thực hiện đòn kết liễu theo luật. Do đó không xứng đáng được trao chiến thắng trọn vẹn. Đến lượt đen đi nhưng hết nước đi hợp lệ, ván cờ sẽ được xử hòa vì trắng không thực hiện nước chiếu bí - Ảnh: chụp màn hình Ngược lại trong cờ tướng, khi quân tướng của một bên hết nước đi hợp lệ và các quân khác cũng không thể di chuyển để cứu vãn thế cờ, tình huống này được gọi là bí tướng và bên đó bị xử thua. Triết lý chiến thắng của cờ tướng rộng hơn so với cờ vua. Chiến thắng không chỉ đến từ việc tấn công trực tiếp (chiếu), mà còn đến từ việc vây hãm và kiểm soát tuyệt đối mọi đường di chuyển của đối phương. Việc dồn tướng đối phương vào thế hoàn toàn bí, không còn khả năng phòng thủ hay phản công đã được xem là sự thể hiện của một chiến thắng chiến thuật toàn diện. Bên mạnh hơn đã thành công khóa chặt khả năng hoạt động của tướng đối thủ. Điểm đặc biệt khác của cờ tướng chính là do các quân như sĩ và tượng luôn phải bảo vệ tướng và luật ""Tướng không được đối mặt tướng"". Vậy nên việc làm tướng bị bí mà không bị chiếu vẫn là một thành tựu chiến thuật rất khó đạt được. Nó tương đương với việc chiếu hết trong cờ vua. Sự khác biệt này không chỉ là luật lệ, mà còn là linh hồn của từng trò chơi, đòi hỏi người chơi cờ vua phải tập trung vào đòn kết liễu sắc bén, trong khi người chơi cờ tướng phải làm chủ nghệ thuật kiểm soát và vây hãm không gian. Tối 5-11, đại kiện tướng Lê Quang Liêm đã giành chiến thắng trước kỳ thủ đến từ Georgia - Baadur Jobava, qua đó giành quyền tiến vào vòng tiếp theo tại World Cup cờ vua 2025."
Tuoi tre,https://tuoitre.vn/ngoi-sao-nhap-tich-malaysia-mat-viec-o-clb-tay-ban-nha-2025110810400098.htm,Thể thao,"nhập tịch,FAM,FIFA,kháng cáo,Asian Cup",08/11/2025 11:08 GMT+7,Ngôi sao nhập tịch Malaysia mất việc ở CLB Tây Ban Nha,"Gabriel Palmero trong màu áo Malaysia - Ảnh: FAM Trong lúc Liên đoàn Bóng đá Malaysia (FAM) vẫn đang nỗ lực kháng cáo, các cầu thủ dính vào bê bối nhập tịch của họ đã bắt đầu nhận lãnh hậu quả nặng nề. Mới đây, CLB Unionistas Salamanca ở Giải hạng nhì Tây Ban Nha đã thông báo chấm dứt hợp đồng với Gabriel Palmero - người được họ mượn từ Tenerife. Palmero năm nay 23 tuổi, chơi vị trí hậu vệ cánh trái. Anh là 1 trong 7 cầu thủ dính bê bối nhập tịch gian dối của bóng đá Malaysia. Hậu vệ cánh trái này sinh trưởng tại Tây Ban Nha, trưởng thành từ lò đào tạo của CLB Las Palmas khá nổi tiếng, nhưng không chứng tỏ được năng lực. Nhiều năm qua, anh trôi dạt sang nhiều đội bóng ở các giải hạng dưới của Tây Ban Nha, trước khi nhập tịch Malaysia vào tháng 3-2025. Cũng trong mùa hè rồi, Palmero chuyển đến Salamanca chơi bóng dưới dạng cho mượn, và đang có những bước tiến đáng kể trong sự nghiệp. Truyền thông Tây Ban Nha từng nhận định Palmero đủ sức để chơi cho các đội Giải hạng nhất Tây Ban Nha (Segunda). Nhưng rồi hy vọng đó giờ đây đã tan tành, khi Palmero - cùng 6 người còn lại trong vụ bê bối nhập tịch - bị FIFA đình chỉ thi đấu 1 năm. Hôm 7-11, Salamanca đã thông báo chấm dứt hợp đồng với Palmero, trả anh về Tenerife. Palmero vốn không có chỗ đứng tại đội bóng này và cho dù có được FIFA miễn giảm án phạt trong tương lai, vẫn rất khó để anh có thể hồi phục sự nghiệp. Ngoài Palmero, nhiều ngôi sao nhập tịch khác của Malaysia cũng đứng trước nguy cơ bị thanh lý hợp đồng. Truyền thông Colombia cho biết Rodrgio Holgado, người đang chơi bóng ở quốc gia này trong màu áo CLB America de Cali, có thể cũng sẽ sớm rơi vào cảnh thất nghiệp. Trong khi đó CLB Velez (Argentina) ban đầu thể hiện sự ủng hộ với Imanol Machuca, người mới ra sân 1 lần cho tuyển Malaysia. Còn Facundo Garces cũng từng được CLB Alaves ở La Liga lên tiếng bảo vệ khi xì căng đan này nổ ra. Dù vậy sau khi FIFA bác bỏ đơn kháng cáo của FAM, các đội bóng nước ngoài này không đưa ra thêm thông báo nào khác. Hy vọng lật ngược tình thế của Liên đoàn Bóng đá Malaysia (FAM) trong vụ bê bối nhập tịch đột ngột được thắp lên, khi họ tìm ra nhiều điểm tương đồng với một vụ việc tương tự trong làng bóng đá đỉnh cao."
Tuoi tre,https://tuoitre.vn/chu-nha-thai-lan-dat-chi-tieu-doat-164-huy-chuong-vang-o-sea-games-33-20251108105758796.htm,Thể thao,"SEA GAMES,Thái Lan,Việt Nam,huy chương vàng sea games",08/11/2025 11:37 GMT+7,Chủ nhà Thái Lan đặt chỉ tiêu đoạt 164 huy chương vàng ở SEA Games 33,"Các quan chức thể thao Thái Lan đặt chỉ tiêu đoạt 164 huy chương vàng ở SEA Games 33 - Ảnh: Nation Thailand Hiệp hội Các nhà báo thể thao Thái Lan đã tổ chức buổi họp báo thảo luận xung quanh các vấn đề vềSEA Games 33vào ngày 6-11 vừa qua, với sự tham dự của nhiều quan chức thể thao Thái Lan. Trong buổi nói chuyện này, Thái Lan đã công bố kỳ vọng về huy chương của họ đối với SEA Games 33 diễn ra từ ngày 9 đến 20-12. Cụ thể mục tiêu của đoàn thể thao Thái Lan là giành tổng cộng 164 huy chương vàng. Trong đó quyền anh tự tin sẽ giành được ít nhất 9 huy chương vàng ở 17 hạng cân tham gia thi đấu. Jujitsuđặt mục tiêu giành ít nhất 10 huy chương vàng trong tổng số 18 nội dung tranh tài. Muay Thái đặt mục tiêu giành 10 huy chương vàng. Trưởng đoàn muay Thái Boonsong tin tưởng với các nhà vô địch thế giới và châu lục, họ có cơ hội lớn giành được tới 10 huy chương vàng từ 18 nội dung thi đấu. Môn petanquecũng kỳ vọng sẽ giành 4 huy chương vàng... Các môn thể thao biểu diễn như thể thao trên không, võ thuật tổng hợp (MMA), kéo co và ném đĩa cũng được chờ đợi sẽ giành 4 huy chương vàng cho Thái Lan. Đặc biệt Hiệp hội Bóng đá Thái Lan (FAT) đặt mục tiêu thâu tóm toàn bộ 4 huy chương vàng bóng đá cả nam lẫn nữ, trên sân cỏ lẫn futsal. TạiSEA Games 32ở Campuchia, đoàn Thái Lan xếp thứ 2 chung cuộc với 108 huy chương vàng, 96 huy chương bạc và 108 huy chương đồng. Việt Nam đứng đầu với 136 huy chương vàng, 105 huy chương bạc và 114 huy chương đồng. Gabriel Palmero, 1 trong 7 cầu thủ dính bê bối nhập tịch của bóng đá Malaysia, đã phải nhận hậu quả nặng nề sau khi bị FIFA trừng phạt."
Tuoi tre,https://tuoitre.vn/choi-thang-hoa-thuy-linh-vao-chung-ket-giai-cau-long-han-quoc-20251108123734271.htm,Thể thao,"Thùy Linh,Hina Akechi,Cầu lông,Giải cầu lông",08/11/2025 12:50 GMT+7,"Chơi thăng hoa, Thùy Linh vào chung kết giải cầu lông Hàn Quốc","Thùy Linh tiến vào chung kết Hàn Quốc Masters - Ảnh: BWF Thùy Linhđã chơi thăng hoa, có nhiều đường cầu đẹp mắt, những pha xử lý táo bạo, kể cả trong những lúc khó khăn. Vì vậy mà tay vợt cầu lông nữ số 1 Việt Nam hiện tại đã để lại một trận đấu mãn nhãn cho người xem. Cũng cần nhắc lại rằng cô là hạt giống số 2 ở Hàn Quốc Masters, và hiện đang đứng hạng 24 thế giới. Ngược lại, Hina Akechi chỉ đang đứng hạng 57 thế giới. Nhưng tay vợt người Nhật lại có một hành trình gây bất ngờ khi lần lượt đánh bại hạt giống số 4 Nozomi Okuhara và hạt giống số 6 Pitchamon Opathniputh để góp mặt ở bán kết. Với sự tự tin lên cao, Akechi đã gây ra không ít khó khăn cho Thùy Linh. Tay vợt người Nhật sở hữu lối đánh tốc độ, khả năng di chuyển linh hoạt. Nhằm đối phó với thế mạnh này, Thùy Linh sử dụng sở trường cầu bền với những pha điều cầu chính xác. Ở ván 1, ""hot girlcầu lông"" Việt Nam mạnh dạn dồn ép và giành thắng lợi 21-11. Mọi thử thách chỉ bắt đầu xuất hiện với Thùy Linh trong ván 2, khi Akechi bắt nhịp tốt hơn. Mới 20 tuổi, Akechi cho thấy sự dẻo dai, linh hoạt cùng tốc độ xử lý nhanh. Hai tay vợt có những pha cầu giằng co kéo dài đầy kịch tính. Thùy Linh nắm thế chủ động, nhưng có lúc bị gỡ hòa 14-14. Trước sự hưng phấn của đối thủ, tay vợt Việt Nam vẫn giữ được sự tập trung. Cô duy trì khả năng phòng thủ cực hay, nhiều lần hóa giải các pha đập khó. Cô cũng chủ động đưa cầu lên lưới nhiều hơn nhằm tránh những bước chân đầy tốc độ của đối phương. Điều này càng khiến Akechi nôn nóng và bắt đầu mắc lỗi. Khi cơ hội đến, Thùy Linh gần như không bỏ lỡ. Ngày thăng hoa của cô khép lại bằng chiến thắng 21-17 ở ván 2, qua đó giành vé vào chung kết. Đây là lần thứ 4 trong sự nghiệp mà Thùy Linh tiến vào trận chung kết một giải đấu Super 300. Ở 3 lần trước đó, cô đều chưa có duyên khi phải nhận thất bại. Lần này ở Hàn Quốc Masters, cô sẽ chạm trán với hạt giống số 1 Chiu Pin-Chian (Đài Bắc Trung Hoa). Tay vợt nữ số 1 Việt Nam Nguyễn Thùy Linh sẽ tham dự Giải cầu lông đồng đội BDMNTN-XL (viết tắt: BXL), với thể thức mà trên thế giới chưa bao giờ được áp dụng."
