Source,URL,Category,Keyword,Time,Title,Content
Tuoi tre,https://tuoitre.vn/khuat-van-khang-mong-cai-duyen-thang-lao-giup-u23-viet-nam-vo-dich-20250719191023244.htm,,"U23 VIỆT NAM,U23 Lào,U23 Đông Nam Á,Khuất Văn Khang,u23 việt nam đấu với u23 lào",19/07/2025 19:43 GMT+7,Khuất Văn Khang mong cái duyên thắng Lào giúp U23 Việt Nam vô địch,"Khuất Văn Khang (phải) thi đấu nổi bật trong vai trò đội trưởng U23 Việt Nam - Ảnh: ANH KHOA ""Gặp Lào ở các trận đầu tiên là một điều ngẫu nhiên đem lại may mắn cho đội tuyển Việt Nam. Hy vọng điều đó sẽ giúp U23 Việt Nam bảo vệ thành công chức vô địch U23 Đông Nam Á"",Khuất Văn Khangchia sẻ sau trận thắng U23 Lào tối 19-7. Ở trận ra quân bảng B vòng chung kết U23 Đông Nam Á 2025, U23 Việt Nam thắng U23 Lào 3-0. Trong đó, Khuất Văn Khang ghi bàn mở tỉ số trong hiệp 1. Là cầu thủ dự nhiều giải trẻ châu Á và đang thi đấu cho đội tuyển quốc gia, Văn Khang là một trong số nhân sự giàu kinh nghiệm trận mạc nhất đội hình U23 Việt Nam hiện tại. Tiền vệ sinh năm 2003 là thành viên vô địch ASEAN Cup 2024, giải đấu mà tuyển Việt Nam gặp Lào ở trận ra quân (thắng 4-1). Trước đó vào năm 2018, tuyển Việt Nam cũng gặp Lào trận mở màn chiến dịch AFF Cup (thắng 3-0) rồi sau đó lên ngôi vô địch Đông Nam Á. Thắng Lào rồi vô địch Đông Nam Á là cái duyên của đội tuyển Việt Nam mà Khuất Văn Khang mong muốn diễn ra với đội U23. Trở lại với trận thắng U23 Lào trên sân của Indonesia, Văn Khang được tín nhiệm đeo băng đội trưởng, thi đấu trọn vẹn cả trận. Không chỉ sắm vai người hùng với bàn mở tỉ số đẹp mắt giúp U23 Việt Nam khai thông thế bế tắc ở phút 19, anh còn tạo ra nhiều cơ hội cho đồng đội. Với chiến thắng đậm trước U23 Lào, U23 Việt Nam chỉ cần không thua U23 Campuchia ở trận tới là chắc suất giành vé vào bán kết giảiU23 Đông Nam Á 2025với ngôi đầu bảng B. Ở trận tiếp theo (cũng là trận cuối bảng B), U23 Việt Nam sẽ đấu U23 Campuchia lúc 20h tối  22-7. Với việc chủ nhà U23 Indonesia đánh bại Philippines 1-0 ở lượt trận thứ 2 bảng A Giải U23 Đông Nam Á 2025 vào tối 18-7, cục diện bảng đấu này đang trở nên cực kỳ phức tạp. "
Tuoi tre,https://tuoitre.vn/petrolimex-co-tan-tong-giam-doc-56-tuoi-20250719210608371.htm,,"bảo hiểm xe cơ giới,PLX,Lưu Văn Tuyển,Petrolimex",19/07/2025 22:33 GMT+7,Petrolimex có tân tổng giám đốc 56 tuổi,"Ông Lưu Văn Tuyển, tổng giám đốc Petrolimex - Ảnh: PLX Ông Lưu Văn Tuyển sinh năm 1969 tại tỉnh Hưng Yên, có trình độ thạc sĩ kinh tế. Trước khi trở thành tổng giám đốc, ông Tuyển từng giữ nhiều vị trí quản lý chủ chốt tại Petrolimex như thành viên ban kiểm soát, trưởng phòng tổng hợp, kế toán trưởng và phó tổng giám đốc từ năm 2019. Ông hiện đại diện phần vốn Nhà nước do Bộ Tài chính quản lý, với 7,23% vốn Petrolimex. Năm 2025, ban lãnh đạoPetrolimexcho biết sẽ tập trung sắp xếp tinh gọn bộ máy, gắn với cắt giảm chi phí; nâng cao hiệu quả quản trị, đặt mục tiêu tăng trưởng tối thiểu 8% trong năm và phấn đấu tăng trưởng 2 con số giai đoạn 2026 - 2030. Thời gian qua, tập đoàn này đã triển khai một số hoạt động tái cơ cấu đầu tư ở nước ngoài, như thông báo bán đấu giá phần vốn góp tại Công ty TNHH MTV Petrolimex Lào, chấm dứt hoạt động của văn phòng đại diện tại Campuchia. Tính theo sản lượng xăng dầu thực xuất bán ra tại thị trường nội địa, Petrolimex chiếm khoảng 50% thị phần cả nước. Trước đó, vào ngày 6-5, Bộ Tài chính ra quyết định tạm đình chỉ chức vụ đại diện vốn nhà nước tại Petrolimex với ôngĐào Nam Hải, người giữ chức tổng giám đốc tập đoàn từ tháng 3-2022. Ông Hải sinh năm 1974, cũng từng giữ chức thành viên hội đồng quản trị kiêm tổng giám đốc Tổng công ty cổ phần Bảo hiểm Petrolimex (PJICO). Đến cuối tháng 5, Petrolimex miễn nhiệm chức vụ tổng giám đốc và tạm dừng tư cách thành viên hội đồng quản trị đối với ông Hải. Đến ngày 7-7, Bộ Công an thông tin đã khởi tố, bắt tạm giam ông Hải, nguyên tổng giám đốc PJICO, để điều tra về tội nhận hối lộ. Đây là một trong những doanh nghiệp bảo hiểm phi nhân thọ lớn tại Việt Nam, với bảo hiểm xe cơ giới là mảng kinh doanh chủ lực. Dù có biến động nhân sự cấp cao, nhưng khá lạ, cổ phiếu PLX của Petrolimex vẫn có thời điểm tăng hết biên độ trong phiên giao dịch ngày 8-5."
Tuoi tre,https://tuoitre.vn/hezbollah-tuyen-bo-khong-gia-tu-vu-khi-to-my-va-israel-bat-tay-gay-suc-ep-2025071919511707.htm,,"Hezbollah,Lebanon,vũ trang,Trung Đông,Israel",19/07/2025 20:24 GMT+7,"Hezbollah tuyên bố không giã từ vũ khí, tố Mỹ và Israel bắt tay gây sức ép","Thủ lĩnh Hezbollah, ông Naim Qassem - Ảnh: REUTERS Theo Đài Al Jazeera và TTXVN, Tổng thư ký Phong trào Hồi giáoHezbollahở Lebanon, ông Naim Qassem, đã bác bỏ đề xuất mà Mỹ đưa ra với giới lãnh đạo Lebanon hồi tháng trước, trong đó kêu gọi lực lượng của ông giải giáp vũ khí. Trong tuyên bố hôm 18-7, ông Qassem lập luận rằng quân đội Israel sẽ mở rộng hiện diện tại Lebanon nếu không có ""sự kháng cự"" nào ở nước này. ""Chúng tôi sẽ không đầu hàng hay nhượng bộ Israel. Israel sẽ không thể tước vũ khí của chúng tôi"" - ông nói trong thông điệp qua video. Những phát biểu của ông Qassem giáng một đòn vào nỗ lực của nhà ngoại giao Mỹ Thomas Barrack hồi tháng trước khi Washington thúc đẩy thỏa thuận giữa Lebanon và Israel, trong đó có việc giải giáp Hezbollah. ""Mỹ muốn áp đặt một thỏa thuận mới nhằm xóa bỏ trách nhiệm của Israel đối với các hành vi vi phạm trong suốt 8 tháng qua, và giải giáp chính là bước khởi đầu"" - vị thủ lĩnh Hezbollah nói. Ông cũng cáo buộc Washington ""phối hợp chiến tranh với Israel"" và đang tìm cách mở rộng ảnh hưởng của mình tại khu vực Trung Đông. Phát biểu này được đưa ra trong bối cảnh Hezbollah đang tổ chức lễ tưởng niệm cho chỉ huy cấp cao Fuad Shukr. Người này thiệt mạng trong một cuộc không kích của Israel ngày 2-8-2024 tại khu vực ngoại ô phía nam thủ đô Beirut. Ông Qassem nhấn mạnh Hezbollah đã tuân thủ các điều khoản củalệnh ngừng bắn, trong khi cáo buộc Israel không thực hiện bất kỳ cam kết nào. ""Sẵn sàng tự vệ nếu Israel phát động tấn công mà chúng tôi cho là buộc phải đáp trả, không để bị khuất phục. Khi chúng tôi còn tồn tại, Israel sẽ không thể đạt được mục tiêu"" - ông Qassem nêu rõ. Thỏa thuận ngừng bắn giữa Israel và Lebanon yêu cầu Hezbollah - cũng như bất kỳ nhóm vũ trang nào - phải chấm dứt toàn bộ hoạt động quân sự tại miền nam Lebanon. Tuy nhiên, với tuyên bố cứng rắn mới nhất từ phía Hezbollah, tương lai của lệnh ngừng bắn đang trở nên ngày càng bất định. Thời gian qua Mỹ yêu cầu giải giáp Hezbollah để mở đường cho viện trợ kinh tế và hỗ trợ chính trị đối với Chính phủ Lebanon, giữa lúc nước này đang lâm vào khủng hoảng toàn diện. Chính phủ Lebanon đang soạn thảo phản hồi chính thức đối với yêu cầu này nhưng vấp phải sự phản đối mạnh mẽ từ Hezbollah, vốn là lực lượng chính trị và quân sự có ảnh hưởng lớn trong nước. Cơ quan tình báo Mossad của Israel đã bắt đầu vũ khí hóa các bộ đàm mà Hezbollah sử dụng từ hơn 1 thập niên trước khi kích nổ các thiết bị này vào tháng 9 năm nay."
Tuoi tre,https://tuoitre.vn/phat-ngon-tu-thu-gia-mao-ceo-astronomer-lan-truyen-tren-mang-20250719124447668.htm,,"Coldplay,New York Times,CEO,ngoại tình,Phát hiện",19/07/2025 19:09 GMT+7,Phát ngôn 'tự thú' giả mạo CEO Astronomer lan truyền trên mạng,"Andy Byron - giám đốc điều hành (CEO) của Công ty công nghệ Astronomer - và tình nhân ôm nhau tình tứ, rồi vội che mặt khi máy quay lia tới - Ảnh: Instagram Nội dung tuyên bố được cho là của ông Andy Byron như sau: ""Tôi muốn thừa nhận khoảnh khắc đang lan truyền trên mạng cùng nỗi thất vọng mà nó gây ra. Một đêm nhạc lẽ ra đầy niềm vui đã trở thành một sai lầm nghiêm trọng diễn ra trước bàn dân thiên hạ. Ngoài ra, tôi cũng muốn bày tỏ sự khó chịu khi một khoảnh khắc cá nhân lại bị công khai hóa mà không có sự đồng thuận của tôi"". Thông điệp được chia sẻ dài nhiều đoạn, trong đó ông Andy Byron còn gửi lời xin lỗi tới vợ, gia đình và đội ngũ tại Astronomer. Phần cuối tuyên bố trích lời ca khúc nổi tiếngFix Youcủa Coldplay. Bài viết nhanh chóng lan rộng trên các nền tảng mạng xã hội như X và Instagram từ ngày 17-7, được dịch sang nhiều thứ tiếng và chia sẻ bởi nhiều nhân vật nổi tiếng, bao gồm cả người dẫn podcast Keith Olbermann. Không chỉ trên các diễn đàn mạng xã hội, tờThe Mirror(Anh) cũng đăng tải tuyên bố được cho là của CEO Andy Byron (nhưng sau đó đã gỡ bài). Nội dung tuyên bố xin lỗi của ông Andy Byron được lan truyền với tốc độ chóng mặt trên các nền tảng mạng xã hội - Ảnh: X/@TaraBull808 Trước làn sóng lan truyền, Hãng tin AFP đã tiến hành kiểm chứng và xác nhận tài khoản đăng tải tuyên bố là giả mạo. AFP cho biết không có bất kỳ tài liệu chính thức nào cho thấy ông Andy Byron từng đưa ra phát ngôn như vậy. Đáng chú ý, tài khoản LinkedIn của ông cũng đã biến mất. Ngoài ra, trong email gửi AFP ngày 18-7, ông Mark Wheeler-phó chủ tịch cấp cao phụ trách marketing của Astronomer-khẳng định tuyên bố đang lan truyền là ""hoàn toàn bịa đặt và bắt nguồn từ một tài khoản chế"". Cùng thời điểm, cựu CEO của Astronomer, ông Ry Walker, cũng đăng trên nền tảng X, nhấn mạnh rằng tuyên bố nói trên là ""hoàn toàn giả mạo"". Ông Ry Walker, cựu CEO của Astronomer, lên tiếng khẳng định tuyên bố đang lan truyền là ""Super fake"" (hoàn toàn giả mạo) - Ảnh: AFP Qua xác minh, AFP đã tìm thấy tài khoản phát tán tuyên bố giả mạo mang tên @PeterEnisCBS (hiện đã bị nền tảng X khóa do vi phạm chính sách). Tài khoản này tự xưng là phóng viên Peter Enis của Đài CBS News. Tuy nhiên khi kiểm tra trên trang chính thức của CBS, không tìm thấy bài viết nào do người này thực hiện. Đáng chú ý, hồ sơ tài khoản X của người này còn từng được gắn nhãn ""tài khoản parody"" (tài khoản chế). Trong phần tiểu sử, tài khoản này khẳng định từng làm việc tại tờNew York Timesvà Đài NPR, đồng thời sử dụng ảnh đại diện là một người đàn ông đeo huy hiệu giống biểu tượng của Đài NBC News. Tuy nhiên, cái tên này không xuất hiện trên bất kỳ nền tảng chính thức nào của 3 tổ chức truyền thông lớn kể trên. Hiện AFP đã liên hệ với Đài CBS News để xác minh danh tính người này, nhưng chưa nhận được phản hồi. Tài khoản @PeterEnisCBS đăng tải tuyên bố giả mạo ông Andy Byron vào ngày 17-7 - Ảnh: AFP Tài khoản X tên Peter Enis CBS News là tài khoản đăng tải tuyên bố sai sự thật - Ảnh: X Bằng công cụ xác minh hình ảnh VeraAIvà InVID-WeVerify, AFP khẳng định ảnh đại diện của tài khoản có khả năng được tạo ra bằng trí tuệ nhân tạo (AI). Ngoài ra, công cụ phát hiện AI Hive Moderation cũng nhận định hình ảnh này ""có khả năng là sản phẩm deepfake hoặc do AI tạo ra"". Bị ""kiss cam"" bắt trúng tại concert Coldplay, CEO một công ty công nghệ và nữ giám đốc nhân sự lộ mối quan hệ ngoài luồng trước hàng chục nghìn khán giả."
Tuoi tre,https://tuoitre.vn/xe-lao-vao-dam-dong-o-hollywood-nhieu-nguoi-nguy-kich-20250719190908099.htm,,"Mỹ,California,Los Angeles,Đâm xe,đám đông",19/07/2025 19:24 GMT+7,"Xe lao vào đám đông ở Hollywood, nhiều người nguy kịch","Lực lượng ứng cứu khẩn cấp có mặt tại hiện trường vụ tai nạn - Ảnh: NEW YORK POST/AXN NEWS Theo Hãng tin AFP, Sở Cứu hỏa Los Angeles (Mỹ) cho biết ""chiếc xe không rõ danh tính"" đã lao vào đám đông ởHollywoodvào sáng sớm 19-7 (giờ địa phương), khiến 28 người bị thương, nhưng không cung cấp thông tin về nguyên nhân vụ việc. Họ thông tin 100 lính cứu hỏa đã có mặt tại hiện trường ở khu East Hollywood, hỗ trợ 3 nạn nhân trong tình trạng nguy kịch, 6 người trong tình trạng nghiêm trọng và 19 người khác trong tình trạng nhẹ hơn. Các video được chia sẻ trên nền tảng X cho thấy cảnh đường phố bị phong tỏa và nạn nhân được đưa đi bằng xe cứu thương. Vụ tai nạn xảy ra vào khoảng 2h sáng 19-7 (giờ địa phương), bên ngoài câu lạc bộ The Vermont Hollywood trên đại lộ Santa Monica. ĐàiABC Newsdẫn lời một quan chức sở cứu hỏa địa phương cho biết cuộc điều tra sơ bộ xác định: một tài xế được cho là bị bất tỉnh đã khiến xe đâm vào đám đông bên ngoài một hộp đêm. Tuy nhiên, thông tin này chưa thể được xác minh ngay lập tức. Khu vực xảy ra vụ việc nằm gần các địa danh nổi tiếng của Hollywood, bao gồm Sunset Boulevard và Đại lộ Danh vọng - vỉa hè được gắn các ngôi sao vinh danh những nhân vật trong ngành điện ảnh. Hiện trường vụ tai nạn - Ảnh: NEW YORK POST/AXN NEWS Ít nhất 1 người chết và 6 người bị thương trong vụ xả súng tại thành phố Indianapolis, bang Indiana vào rạng sáng 5-7, chỉ một ngày sau Quốc khánh Mỹ 4-7."
Tuoi tre,https://tuoitre.vn/han-quoc-hung-mua-xoi-xa-ngay-thu-tu-lien-tiep-it-nhat-8-nguoi-chet-20250719155401958.htm,,"Hàn Quốc,mưa lũ,thời tiết cực đoan,gây thiệt hại",19/07/2025 16:33 GMT+7,"Hàn Quốc hứng mưa xối xả ngày thứ tư liên tiếp, ít nhất 8 người chết","Một người dân chật vật chống chọi giữa dòng nước lũ tại thành phố Gwangju vào ngày 17-7 - Ảnh: Segye Ilbo Hãng tin Yonhap ngày 19-7 dẫn thông tin từ Cơ quan Phòng chống thiên tai và an toàn trung ươngHàn Quốc(CDSCHQ) cho biết mưa lớn kéo dài nhiều ngày qua đã khiến ít nhất 8 người thiệt mạng, bao gồm 3 người ở thành phố Seosan, thuộc tỉnh Chungcheong Bắc, 2 người ở thành phố Gwangju và 3 người ở tỉnh Chungcheong Nam. Do ảnh hưởng của thời tiết cực đoan, chính quyền các địa phương đã ban hành lệnh sơ tán khẩn cấp cho tổng cộng 7.029 người thuộc 4.995 hộ gia đình. Trong số này có hơn 2.800 người vẫn chưa thể quay trở lại nhà do mưa lớn gây nguy hiểm. Mưa như trút nước trong nhiều ngày qua đã làm ngập lụt hàng loạt tuyến đường, gây nhiều vụ sạt lở đất và khiến nước tràn vào nhà dân tại nhiều khu vực trên khắp Hàn Quốc. Đặc biệt trong đêm 18-7, mưa lớn kéo dài tại nhiều địa phương khiến tình hình thêm phức tạp và nguy cơ thiệt hại tiếp tục tăng. Đảo Yeongheung thuộc thành phố Incheon ghi nhận lượng mưa đạt 98,5mm chỉ trong một giờ. Tại huyện Boseong thuộc tỉnh Jeolla Nam, lượng mưa cũng đạt tới 88mm trong khoảng thời gian ngắn. Người dân phải trú tạm trong lều dựng ở trường tiểu học do mưa lớn kéo dài - Ảnh: Yonhap News Thành phố Seosan là một trong những khu vực chịu ảnh hưởng nặng nề nhất, với tổng lượng mưa lên tới 558,6mm trong vòng từ ngày 16 đến sáng 18-7, tương đương 45% tổng lượng mưa trung bình cả năm của khu vực. Một số địa phương khác cũng ghi nhận lượng mưa trong bốn ngày qua vượt quá 40% lượng mưa trung bình năm, ảnh hưởng nghiêm trọng đến đời sống người dân. Tính đến thời điểm hiện tại, Hàn Quốc đã ghi nhận 729 vụ hư hại cơ sở hạ tầng công cộng, trong đó có 388 tuyến đường bị ngập nước, 133 vụ sạt lở đất và 57 công trình ven sông bị sập. Thiệt hại tài sản tư nhân cũng ở mức đáng báo động với tổng cộng 1.014 trường hợp.  Trong đó có 64 ngôi nhà bị ngập nước và 59 khu đất canh tác bị ngập úng. Trước tình hình thời tiết tiếp tục diễn biến xấu, giới chức Hàn Quốc cảnh báo khả năng lượng mưa trong ngày sẽ tăng thêm tới 250mm, khiến nguy cơ xảy ra thêm thiệt hại và thương vong. Một đợt nắng nóng kéo dài đang diễn ra trên toàn Hàn Quốc đã gây ra mức thiệt hại nghiêm trọng chưa từng có đối với ngành chăn nuôi nước này."
Tuoi tre,https://tuoitre.vn/man-united-lai-day-rashford-sang-barca-dang-cho-muon-20250719230958444.htm,,"Marcus Rashford,Man United,HLV Amorim,Manchester United,Rashford",19/07/2025 23:19 GMT+7,Man United lại đẩy Rashford sang Barca dạng cho mượn,"Marcus Rashford được Man United chấp nhận chuyển sang Barca theo dạng cho mượn - Ảnh: REUTERS Khuya 19-7, nhà báo chuyển nhượng Fabrizio Romano xác nhậnRashfordsẽ gia nhập Barca. Theo nhà báo người Ý, Man United đã chấp nhận đề nghị cho mượn kèm điều khoản tùy chọn mua đứt Rashford của Barca. Các chi tiết cuối cùng về lương và các điều khoản thanh toán tùy chọn mua đứt tiền đạo người Anh vẫn chưa được tiết lộ. Nhưng theo tờThe Athletic, Barca sẽ trả toàn bộ 12 triệu euro tiền lương của Rashford. Theo báo chí Anh, tiền đạo sinh năm 1997 là một trong năm cầu thủMan Unitedđược thông báo là không còn tương lai tại ""nhà hát của những giấc mơ"". This is a modal window. Beginning of dialog window. Escape will cancel and close the window. End of dialog window. Trước đó, “quỷ đỏ” đã đẩy Rashford theo dạng cho mượn sang Aston Villa vào nửa sau mùa giải vừa rồi. Đây được xem là sự bổ sung cần thiết cho hàng công củaBarca. HLV Flick muốn có thêm tiền đạo đa năng vào đội hình mùa hè này. Đội bóng Tây Ban Nha từng quan tâm đến cầu thủ chạy cánh Luis Diaz của Liverpool nhưng bất thành. Rashford có thời gian chơi khá thăng hoa khi được cho mượn tại Aston Villa - Ảnh: AFP Rashford đã gắn bó khoảng 20 năm với Man United, ghi được 138 bàn thắng sau 426 lần ra sân. Nhưng anh đã không ra sân kể từ khi bị HLV Amorim loại khỏi trận derby Manchester vào tháng 12 năm ngoái. Thời điểm đó, anh tuyên bố rằng mình sẵn sàng cho một thử thách mới bên ngoài Old Trafford. HLV Ruben Amorim và Marcus Rashford hiện không còn có thể nói chuyện được với nhau."
Tuoi tre,https://tuoitre.vn/kien-nghi-bo-muc-tran-thu-nhap-de-thu-hut-nhan-tai-ve-nuoc-20250719154652894.htm,,"thu hút nhân tài,nhân tài,người trẻ,Bộ Ngoại giao,chế độ",19/07/2025 16:35 GMT+7,Kiến nghị bỏ mức trần thu nhập để thu hút nhân tài về nước1,"Thứ trưởng Bộ Ngoại giao Lê Thị Thu Hằng kiến nghị bỏ mức trần thu nhập để thu hút nhân tài - Ảnh: ĐĂNG HẢI Tại Diễn đàn Trí thức trẻ Việt Nam toàn cầu lần thứ VI khai mạc sáng nay 19-7 tại Hà Nội, Thứ trưởng Bộ Ngoại giao Lê Thị Thu Hằng đã thẳng thắn đề xuất cần xóa bỏ quy định “trần lương” trong các đơn vị công lập, đặc biệt là trường đại học, viện nghiên cứu để thu hút và giữ chân trí thức Việt Nam ở nước ngoài quay về đóng góp cho đất nước. “Cần có cơ chế tự chủ tài chính và đãi ngộ linh hoạt, không giới hạn ‘trần lương’ để thu hút nhân tài”, Thứ trưởng Lê Thị Thu Hằng nêu ý kiến. Theo Thứ trưởng Hằng, muốn đột phá trong khoa học, giáo dục và chuyển đổi số, Việt Nam cần có cơ chế tuyển dụng và đãi ngộ mới - không gò bó theo ngạch, bậc, hệ số mà phải linh hoạt, cạnh tranh. Bà Hằng cho rằng các đơn vị công lập, đặc biệt là trường đại học, viện nghiên cứu cần có môi trường làm việc lành mạnh, cạnh tranh công bằng dựa trên năng lực và đóng góp. Bà cũng kiến nghị khuyến khích không phân biệt giữa khu vực công và tư, bởi cả hai đều đóng góp cho sự phát triển chung của đất nước. ""Nhiều trí thức Việt Nam tại nước ngoài, đặc biệt là các nhà khoa học, mong muốn đóng góp cho đất nước nhưng gặp khó khăn do thiếu cơ sở vật chất và phòng thí nghiệm hiện đại"" - Thứ trưởng Hằng nói. Diễn đàn Trí thức trẻ Việt Nam toàn cầu lần thứ VI tập trung vào các chủ đề trí tuệ nhân tạo, chuyển đổi số để phát triển đất nước - Ảnh: ĐĂNG HẢI  Bên cạnh đó, Thứ trưởng Lê Thị Thu Hằng kiến nghị hoàn thiện khung pháp lý, trong đó là các quy định liên quan đến quốc tịch. Theo bà, Luật Quốc tịch Việt Nam sửa đổi đã mang lại những thay đổi tích cực, cho phép người Việt Nam ở nước ngoài giữ hoặc phục hồi quốc tịch Việt Nam mà không vi phạm pháp luật của nước sở tại. Mặt khác, quy trình đăng ký quốc tịch hiện nay đã được đơn giản hóa, chỉ cần nộp hồ sơ tại đại sứ quán, sau đó chuyển trực tiếp đến Bộ Tư pháp với thời hạn xử lý rõ ràng. Đặc biệt, các thế hệ thứ hai, thứ ba sinh ra ở nước ngoài cũng được quyền lựa chọn quốc tịch Việt Nam. Với quốc tịch Việt Nam, trí thức Việt kiều sẽ được hưởng đầy đủ quyền lợi như công dân trong nước, bao gồm quyền sở hữu nhà đất và kinh doanh bất động sản, xóa bỏ những rào cản trước đây như phải nhờ người khác đứng tên. Ông Nguyễn Khắc Lịch - cục trưởng Cục Công nghiệp công nghệ thông tin, khẳng định trong Luật Công nghiệp công nghệ số sẽ có chính sách thu hút nhân tài, với mức lương cạnh tranh sòng phẳng với các nước trên thế giới."
