Source,URL,Category,Keyword,Time,Title,Content
VN Express,https://vnexpress.net/130-xa-phuong-cua-nghe-an-sau-sap-xep-4899725.html,Chính trị,,"Thứ tư, 18/6/2025, 02:00 (GMT+7)","130 xã, phường của Nghệ An sau sắp xếp","Nghệ An sau sắp xếp có 119 xã, 11 phường, trong đó xã Thông Thụ rộng nhất tới 706,75 km2, phường Đức Châu nhỏ nhất 20,97 km2. Nghị quyết về việc sắp xếp đơn vị hành chính tỉnh Nghệ An được Ủy ban Thường vụ Quốc hội thông qua ngày 16/6. Cụ thể tên các xã, phường, mới như sau: Theo Nghị quyết 60 của Trung ương, Nghệ An cùng 10 tỉnh, thành giữ nguyên trạng gồm Hà Nội, Huế, Lai Châu, Điện Biên, Sơn La, Lạng Sơn, Quảng Ninh, Thanh Hóa, Hà Tĩnh, Cao Bằng. 52 địa phương sáp nhập còn 23 tỉnh, thành. Tỉnh ủy Nghệ An sẽ tổ chức vận hành thử nghiệm mô hình bộ máy chính quyền hai cấp vào ngày 20/6, với điểm cầu trung tâm đặt tại xã Đông Lộc (đơn vị hành chính mới được thành lập trên cơ sở sáp nhập ba xã Khánh Hợp, Nghi Thạch và Thịnh Trường của huyện Nghi Lộc), kết nối đến 129 xã, phường trên toàn tỉnh. Trên cơ sở hoàn thành vận hành thử nghiệm tại xã Đông Lộc, các địa phương còn lại sẽ vận hành mô hình mới tại đơn vị mình trước khi chính thức đi vào hoạt động cấp xã mới. Trước sắp xếp, Nghệ An có diện tích lớn nhất cả nước với 16.486 km2 và hơn 3,8 triệu dân. Tỉnh có 17 huyện, 2 thị xã, một thành phố, tổng số đơn vị hành chính cấp xã là 412. Năm 2024, tốc độ tăng trưởng của Nghệ An đạt 9,01%, thu ngân sách 25.096 tỷ đồng. Cơ cấu kinh tế chuyển dịch theo hướng từ tỉnh thuần nông sang trung tâm kinh tế năng động. Trong đó, khu vực nông, lâm, thủy sản ước tăng 4,14%; công nghiệp - xây dựng tăng 13,61%; dịch vụ tăng 7,88%. Về đầu tư nước ngoài, lũy kế đến hết năm 2024, Nghệ An có 151 dự án FDI với tổng vốn đầu tư 5,871 tỷ USD, xếp thứ 22/63 địa phương về tổng vốn đăng ký. Trong hai tháng đầu năm nay, tỉnh cấp mới một dự án với tổng vốn đăng ký 1,5 triệu USD, điều chỉnh tăng vốn cho hai dự án với tổng mức đầu tư tăng thêm 8 triệu USD. Tổng vốn cấp mới và điều chỉnh đạt 9,5 triệu USD. Các khu công nghiệp lớn như VSIP, WHA, Hoàng Mai đang trở thành điểm đến hấp dẫn cho các nhà đầu tư trong lĩnh vực chế tạo, công nghệ cao, năng lượng và điện tử. Nằm trên trục giao thông huyết mạch Bắc Nam, Nghệ An sở hữu hạ tầng kết nối đồng bộ gồm cảng hàng không quốc tế Vinh, cảng biển Cửa Lò, quốc lộ 1, đường sắt Bắc Nam, đường ven biển và các tuyến cao tốc Bắc Nam. Những tuyến giao thông đồng bộ, xuyên quốc gia này giúp tỉnh rút ngắn thời gian kết nối với các trung tâm kinh tế lớn như Hà Nội, Hải Phòng, Đà Nẵng và TP HCM. Trung tâm hành chính - chính trị của tỉnh Nghệ An sẽ đặt tại phường Trường Vinh, có hệ thống hạ tầng giao thông đồng bộ, kết nối với các vùng lân cận. Đây cũng là nơi tập trung nhiều cơ quan đầu não, khu đô thị mới, trường đại học, bệnh viện lớn, được quy hoạch là hạt nhân phát triển hành chính, dịch vụ và đô thị của Nghệ An trong giai đoạn mới. Đức Hùng"
VN Express,https://vnexpress.net/nghi-huu-truoc-tuoi-do-tinh-gian-bien-che-co-the-nhan-hai-khoan-tro-cap-4899941.html,Chính trị,,"Thứ tư, 18/6/2025, 00:00 (GMT+7)",Nghỉ hưu trước tuổi do tinh giản biên chế có thể nhận hai khoản trợ cấp,"Cán bộ, công chức nghỉ hưu trước tuổi do tinh giản biên chế sẽ không bị trừ tỷ lệ lương hưu, có thể được nhận hai khoản trợ cấp theo số năm nghỉ sớm và thời gian công tác. Nghị định 154/2025vừa được Chính phủ ban hành, quy định các khoản trợ cấp cho cán bộ, công chức, viên thuộc diện tinh giản biên chế. Người nghỉ hưu trước tuổinếu có tuổi đời còn từ 2 đến 5 năm mới đến tuổi nghỉ hưu, có đủ thời gian công tác đóng bảo hiểm xã hội để hưởng lương hưu, trong đó 15 năm làm công việc nặng nhọc, độc hại, nguy hiểm hoặc đặc biệt nặng nhọc, độc hại, nguy hiểm, hoặc ở vùng điều kiện kinh tế xã hội đặc biệt khó khăn (bao gồm cả thời gian làm việc ở nơi có phụ cấp khu vực hệ số 0,7 trước 1/1/2021), ngoài chế độ hưu trí theo quy định về bảo hiểm xã hội sẽ không bị trừ tỷ lệ lương hưu do nghỉ trước tuổi. Những người này được nhận 5 tháng tiền lương hiện hưởng cho mỗi năm nghỉ hưu trước tuổi. Khoản trợ cấp theo thời gian công tác có đóng bảo hiểm xã hội được tính trên cơ sở người có từ 20 năm công tác thì 20 năm đầu được trợ cấp 5 tháng tiền lương hiện hưởng; từ năm 21 mỗi năm được trợ cấp 0,5 tháng tiền lương hiện hưởng. Người có từ 15 đến dưới 20 năm công tác được trợ cấp 5 tháng tiền lương hiện hưởng. Người còn đủ 2 đến đủ 5 năm đến tuổi nghỉ hưu, có đủ thời gian đóng bảo hiểm xã hội để hưởng lương hưu, ngoài chế độ hưu trí sẽ không bị trừ tỷ lệ lương hưu do nghỉ trước tuổi. Họ được trợ cấp 5 tháng tiền lương hiện hưởng cho mỗi năm nghỉ hưu trước tuổi. Khoản trợ cấp theo thời gian công tác với người từ 20 năm thì 20 năm đầu được trợ cấp 5 tháng tiền lương hiện hưởng; từ năm 21 mỗi năm được 0,5 tháng tiền lương hiện hưởng. Người từ 15 đến 20 năm công tác được trợ cấp 5 tháng tiền lương hiện hưởng. Người còn dưới 2 năm đến tuổi nghỉ hưu, có đủ thời gian công tác có đóng bảo hiểm xã hội để hưởng lương hưu, trong đó đủ 15 năm làm nghề, công việc nặng nhọc, độc hại, nguy hiểm, hoặc đặc biệt nặng nhọc, độc hại, nguy hiểm, hoặc ở vùng đặc biệt khó khăn sẽ được hưởng chế độ hưu trí theo quy định về bảo hiểm xã hội và không bị trừ tỷ lệ lương hưu do nghỉ trước tuổi. Người còn dưới 2 năm đến tuổi nghỉ hưu, có đủ thời gian công tác để hưởng lương hưu, sẽ được hưởng chế độ hưu trí theo quy định về bảo hiểm xã hội và không bị trừ tỷ lệ lương hưu do nghỉ trước tuổi. Người chuyển sang làm việctại các tổ chức không hưởng kinh phí thường xuyên từ ngân sách nhà nướcsẽ được trợ cấp 3 tháng tiền lương hiện hưởng; 5 tháng tiền lương hiện hưởng cho mỗi năm công tác có đóng bảo hiểm xã hội. Chính sách này không áp dụng với những người đã làm việc tại đơn vị sự nghiệp công lập khi chuyển đổi sang đảm bảo chi thường xuyên hoặc cả chi thường xuyên và chi đầu tư hoặc ở doanh nghiệp cổ phần hóa vẫn được giữ lại làm việc. Cán bộ, công chức, viên chức thuộc diện tinh giản biên chế, còn đủ 3 năm trở xuống đến tuổi nghỉ hưu, có đủ thời gian đóng bảo hiểm xã hội bắt buộc, trong đó 15 năm làm nghề nặng nhọc, độc hại, nguy hiểm, hoặc đặc biệt nặng nhọc, độc hại, nguy hiểm, hoặc ở vùng đặc biẹt khó khăn; người còn đủ 3 năm đến tuổi nghỉ hưu, cũng không được hưởng chính sách chuyển sang làm việc tại tổ chức không hưởng kinh phí thường xuyên từ ngân sách nhà nước. Người thôi việc ngaydo tinh giản biên chế nhưng chưa đến tuổi nghỉ hưu và không đủ điều kiện hưởng chính sách về hưu trước tuổi sẽ được trợ cấp 3 tháng tiền lương hiện hưởng để tìm việc làm; 1,5 tháng tiền lương hiện hưởng cho mỗi năm công tác đóng bảo hiểm xã hội. Họ cũng được bảo lưu thời gian đóng bảo hiểm xã hội hoặc hưởng bảo hiểm xã hội một lần. Người dưới 45 tuổi, có sức khỏe, tinh thần trách nhiệm, ý thức tổ chức kỷ luật nhưng đảm nhiệm công việc không phù hợp, có nguyện vọng thôi việc thì được đơn vị tạo điều kiện cho học nghề trước khi giải quyết thôi việc. Họ cũng được hưởng nguyên tiền lương hiện hưởng và được đơn vị đóng bảo hiểm xã hội, bảo hiểm y tế, bảo hiểm thất nghiệp trong thời gian học nghề, tối đa 6 tháng. Nhóm này còn được hưởng trợ cấp khoản kinh phí học nghề tối đa bằng 6 tháng mức lương hiện hưởng. Kết thúc khóa học nghề, họ được trợ cấp thêm 3 tháng tiền lương hiện hưởng để tìm việc làm. Ngoài ra, họ được trợ cấp 0,5 tháng tiền lương hiện hưởng cho mỗi năm công tác và bảo lưu thời gian đóng bảo hiểm xã hội. Vũ Tuân"
VN Express,https://vnexpress.net/bi-thu-gia-lai-lam-thu-truong-dan-toc-va-ton-giao-4902977.html,Chính trị,"Bộ Dân tộc và Tôn giáo,Bí thư Gia Lai,Hồ Văn Niên","Thứ ba, 17/6/2025, 22:42 (GMT+7)",Bí thư Gia Lai làm Thứ trưởng Dân tộc và Tôn giáo,"Ông Hồ Văn Niên, Bí thư Tỉnh ủy Gia Lai, được Thủ tướng điều động giữ chức Thứ trưởng thường trực Bộ Dân tộc và Tôn giáo, thời hạn 5 năm. Quyết định bổ nhiệm ông Niên được Thủ tướng ký ngày 17/6. Ông Niên 50 tuổi, người Ba Na, quê Gia Lai, trình độ cử nhân Luật. Năm 2010, ông làm Bí thư Huyện ủy Đăk Pơ, ba năm sau giữ chức Trưởng ban Nội chính Tỉnh ủy. Năm 2015, ông Niên làm Phó bí thư Tỉnh ủy Gia Lai. Tháng 6/2020, ông được bầu giữ chức Bí thư Tỉnh ủy và đảm nhiệm cương vị này đến nay. Bộ Dân tộc và Tôn giáo được thành lập tháng 2/2025, trên cơ sở Ủy ban Dân tộc, tiếp nhận chức năng, nhiệm vụ và bộ máy của Ban Tôn giáo Chính phủ từ Bộ Nội vụ. Bộ là cơ quan của Chính phủ thực hiện chức năng quản lý nhà nước về công tác dân tộc, tín ngưỡng, tôn giáo. Bộ trưởng Dân tộc và Tôn giáo hiện là ông Đào Ngọc Dung, 5 Thứ trưởng giúp việc là các ông Y Vinh Tơr, Y Thông, Nông Thị Hà, Nguyễn Hải Trung, Hồ Văn Niên. Ngày 12/6, Quốc hội thông qua Nghị quyết, giảm số tỉnh, thành phố trên toàn quốc từ 63 xuống còn 34, trong đó tỉnh Gia Lai sáp nhập với Bình Định thành tỉnh Gia Lai mới. Vũ Tuân"
VN Express,https://vnexpress.net/bi-thu-hai-duong-lam-pho-tong-thanh-tra-chinh-phu-4902975.html,Chính trị,"Thanh tra Chính phủ,Bí thư Hải Dương,ông Trần Đức Thắng","Thứ ba, 17/6/2025, 22:23 (GMT+7)",Bí thư Hải Dương làm Phó tổng Thanh tra Chính phủ,"Ông Trần Đức Thắng, Bí thư Tỉnh ủy Hải Dương, được Thủ tướng điều động giữ chức Phó tổng Thường trực Thanh tra Chính phủ, ngày 17/6. Theo quyết định bổ nhiệm của Thủ tướng, ông Trần Đức Thắng sẽ làm Phó tổng Thanh tra Chính phủ từ ngày 1/7, thời hạn 5 năm. Ông Thắng 52 tuổi, quê Vĩnh Phúc, trình độ tiến sĩ, là Ủy viên Trung ương Đảng khóa 13. Ông từng đảm nhận vị trí Phó cục trưởng rồi Cục trưởng Quản lý công sản, Bộ Tài chính, đến tháng 10/2018 được bầu làm Ủy viên Ủy ban Kiểm tra Trung ương, đến năm 2020 là Phó chủ nhiệm Ủy ban. Tháng 10/2022, ông Thắng được Bộ Chính trị điều động, chỉ định giữ chức Bí thư Tỉnh ủy Hải Dương nhiệm kỳ 2020-2025 và đảm nhiệm chức vụ đến nay. Thanh tra Chính phủ là cơ quan ngang bộ, thực hiện chức năng quản lý nhà nước và hoạt động chuyên môn về thanh tra, tiếp công dân, giải quyết khiếu nại, tố cáo, phòng chống tham nhũng, lãng phí, tiêu cực trên phạm vi toàn quốc. Hiện, ông Đoàn Hồng Phong làm Tổng Thanh tra Chính phủ, với 5 cấp phó giúp việc là các ông Lê Sỹ Bảy, Dương Quốc Huy, Nguyễn Văn Cường, Lê Tiến Đạt, Trần Đức Thắng. Theo nghị quyết được Quốc hội thông qua ngày 12/6, tỉnh Hải Dương sẽ sáp nhập với TP Hải Phòng thành TP Hải Phòng."
VN Express,https://vnexpress.net/benh-vien-trung-uong-qua-tai-do-thieu-thiet-bi-hay-nguoi-dan-mat-niem-tin-vao-y-te-co-so-4902911.html,Chính trị,"bệnh viện quá tải,bệnh viện trung ương,PGS Nguyễn Lân Hiếu","Thứ ba, 17/6/2025, 18:24 (GMT+7)",Bệnh viện trung ương quá tải do thiếu thiết bị hay người dân mất niềm tin vào y tế cơ sở?,"Đại biểu Đỗ Thị Lan nói bệnh viện tuyến trung ương quá tải do thiếu trang thiết bị và nhân lực, nhưng bác sĩ Nguyễn Lân Hiếu cho rằng do người dân mất niềm tin vào tuyến cơ sở. Chiều 17/6, tại phiên thảo luận về tình hình kinh tế xã hội, nhiều đại biểu Quốc hội tranh luận xoay quanh nguyên nhân dẫn đến tình trạng quá tải tại các bệnh viện chuyên sâu tuyến trung ương. Phó Chủ nhiệm Ủy ban Văn hóa - Xã hội Đỗ Thị Lan cho biết tình trạng quá tải ở các bệnh viện như K, Bạch Mai, Việt Đức... chủ yếu do thiếu thiết bị, vật tư y tế và nhân lực, đến nay vẫn chưa có giải pháp giải quyết dứt điểm. ""Nhiều bệnh nhân phải nằm ghép, chờ đợi lâu vì thiếu máy móc, đặc biệt là thiết bị xạ trị khiến người bệnh ung thư lỡ mất thời gian vàng điều trị"", bà nói. Bà Lan chia sẻ từng đến bệnh viện K và chứng kiến cảnh người bệnh ung thư mòn mỏi chờ đến lượt khám cũng như xạ trị. Nhiều người trong số đó hoàn cảnh khó khăn, thời gian điều trị bệnh kéo dài làm tăng chi phí. Phần đông bệnh nhân ung thư từ các tỉnh về Hà Nội để khám chữa. Theo thống kê, mỗi ngày bệnh viện K tiếp nhận hơn 2.000 người đến khám chữa, nhưng lại thiếu nhiều thiết bị như máy siêu âm, máy chụp CT (cắt lớp vi tính). Thực trạng này khiến bệnh nhân vừa phải chờ đợi khám vừa phải chờ đợi kết quả. Đặc biệt, vì thiếu máy xạ trị nên nhiều bệnh nhân ung thư không được điều trị kịp thời, làm lỡ cơ hội chữa trị trong thời gian vàng để kéo dài sự sống. Bà Lan cho rằng nguyên nhân của những bất cập nêu trên là nhu cầu chi đầu tư cho y tế tăng cao, nhất là nhân lực, thiết bị, hạ tầng, công nghệ. Tuy nhiên, giá dich vụ y tế chưa được tính đúng, tính đủ. Trong khi đó, nhiều bệnh viện công lập tự chủ vẫn chưa đảm bảo nguồn thu để chi trả lương, đảm bảo thu nhập cho y bác sĩ, nhân viên bệnh viện. Nếu bệnh viện chi trả đủ thu nhập cho đội ngũ y bác sĩ thì lại không đáp ứng được yêu cầu thu đủ cho các khoản chi thường xuyên khác. Bên cạnh đó, cơ chế đấu thầu mua sắm trang thiết bị, xã hội hóa đầu tư công trong bệnh viện công lập còn vướng mắc, không đáp ứng được yêu cầu về trang thiết bị cho khám chữa bệnh. Đại biểu tỉnh Quảng Ninh đề nghị Chính phủ rà soát tổng thể thực trạng quá tải tại các bệnh viện chuyên sâu, trong đó cần đánh giá riêng tình hình tiếp nhận và điều trị bệnh nhân ung thư tại Bệnh viện K. Một trong những giải pháp quan trọng là tăng đầu tư cho y tế dự phòng, chăm sóc sức khỏe ban đầu; đồng thời, hỗ trợ bệnh viện về trang thiết bị, nhân lực và chi trả lương hợp lý để giữ chân bác sĩ làm việc trong khu vực công. ""Chính phủ cần rà soát cơ chế tự chủ bệnh viện công lập cũng như cơ chế hợp tác công tư để để khắc phục tình trạng thiếu thiết bị, vật tư y tế, nhân lực, nhằm nâng cao chất lượng khám chữa bệnh"", bà nói. Người dân mất niềm tin vào y tế tuyến dưới Tham gia tranh luận, đại biểu Nguyễn Quang Huân (Phó chủ tịch Hội Nước sạch và Môi trường Việt Nam) đồng tình với ý kiến của đại biểu Đỗ Thị Lan về tình trạng quá tải tại các bệnh viện tuyến trung ương. Ông cho rằng các bệnh viện lớn, nơi có năng lực cứu chữa cao, đều đang rơi vào tình trạng quá tải nghiêm trọng. Tuy nhiên theo ông Huân, thiếu thiết bị hay giá dịch vụ y tế thấp chỉ là một phần nguyên nhân. Sau đại dịch Covid-19, do vướng các sai phạm trong đấu thầu, nhiều thiết bị tại bệnh viện bị niêm phong phục vụ điều tra, thanh tra nên không thể sử dụng. Thậm chí, thiết bị do doanh nghiệp tư nhân tài trợ cũng không được đưa vào vận hành vì vướng cơ chế. ""Bệnh viện đã được đầu tư không đầy đủ, lại còn bị hạn chế bởi các thủ tục kiểm tra, điều tra, khiến năng lực khám chữa bệnh càng thêm bị bóp nghẹt"", ông Huân nói. Ông đề xuất có cơ chế đặc thù cho ngành y tế, cho phép sử dụng thiết bị trong quá trình thanh tra, điều tra, đồng thời cần chính sách động viên, hỗ trợ y bác sĩ tuyến đầu vốn đang làm việc trong môi trường nhiều áp lực. Trong khi đó, PGS Nguyễn Lân Hiếu, Giám đốc Bệnh viện Đại học Y Hà Nội, không đồng tình với lập luận rằng thiếu thiết bị là nguyên nhân chính gây quá tải. Nguyên nhân sâu xa là ""người dân mất niềm tin vào y tế tuyến cơ sở"" nên đổ dồn về tuyến trung ương, kể cả với những bệnh lý đơn giản. Ông Hiếu cho rằng muốn giải quyết tình trạng này cần tập trung nâng cao chất lượng y tế cơ sở. Từ ngày 1/7, khi không còn chính quyền cấp huyện, việc phát triển hệ thống y tế tuyến xã càng trở nên cấp thiết. ""Cần tổ chức lại trạm y tế xã theo mô hình phòng khám của tuyến huyện, định kỳ có bác sĩ từ tuyến tỉnh, huyện về khám chữa bệnh, từ đó tạo dựng lại niềm tin của người dân"", ông nói. Giám đốc Bệnh viện Đại học Y Hà Nội cũng đề nghị dừng cơ chế tự chủ với bệnh viện tuyến huyện - vốn khiến họ gánh nặng chi thường xuyên, nhất là tiền lương - để họ tập trung vào chuyên môn, phát triển kỹ thuật và nâng cao đời sống cán bộ y tế. Bên cạnh đó, bệnh viện tuyến tỉnh nên tập trung điều trị các bệnh thông thường, còn tuyến trung ương cần tổ chức theo mô hình viện chuyên khoa trong bệnh viện đa khoa để đáp ứng toàn diện hơn nhu cầu người bệnh. ""Chỉ khi nâng cao chất lượng khám chữa bệnh ở tuyến cơ sở thì mới có thể giải quyết tận gốc tình trạng quá tải ở tuyến trên"", ông Hiếu khẳng định. Vũ Tuân"
