Source,URL,Category,Keyword,Time,Title,Content
ZNews,https://znews.vn/mien-bac-don-dot-mua-lon-keo-dai-3-ngay-post1566596.html,Xã hội,Null,"Thứ ba, 8/7/2025 20:55 (GMT+7)",Miền Bắc đón đợt mưa lớn kéo dài 3 ngày,"Điểm tin thời tiết nổi bật trong chiều tối và đêm 8/7, ngày 9/7 Chiều tối và đêm nay (8/7), vùng núi Bắc Bộ, cao nguyên Trung Bộ và Nam Bộ mưa rào và dông rải rác, cục bộ mưa to với lượng mưa 10-30mm, có nơi trên 80mm. Trong mưa dông khả năng xảy ra lốc, sét, mưa đá và gió giật mạnh. Mưa lớn cục bộ có thể gây ra lũ quét trên các sông, suối nhỏ, sạt lở đất trên sườn dốc và tình trạng ngập úng tại các vùng trũng, thấp. Từ đêm mai, miền Bắc hứng đợt mưa lớn diện rộng. Ảnh minh hoạ:Ngô Nhung. Ngày 9/7, Đông Bắc Bộ và phía Tây tỉnh Phú Thọ nắng nóng với nhiệt độ cao nhất phổ biến 35-37 độ C, có nơi trên 37 độ C. Tây Bắc Bộ nắng nóng cục bộ với nhiệt độ cao nhất trên 35 độ C. Đêm 9/7 đến ngày 10/7, vùng núi và trung du Bắc Bộ khả năng xảy ra mưa vừa, mưa to và dông, cục bộ mưa rất to với lượng mưa phổ biến 30-70 mm, có nơi trên 150 mm. Nguy cơ mưa cường suất lớn với lượng mưa trên 100mm chỉ trong 3 giờ. Từ 10/7, nắng nóng phía Đông Bắc Bộ và phía Tây tỉnh Phú Thọ giảm dần. Từ tối và đêm cùng ngày, mưa lớn xu hướng mở rộng ra toàn bộ Bắc Bộ, có thể kéo dài đến hết ngày 12/7. Dự báo ngày 9-10/7, Thanh Hóa đến Đà Nẵng, phía Đông các tỉnh từ Quảng Ngãi đến Đắk Lắk và phía Bắc tỉnh Khánh Hòa nắng nóng với nhiệt độ cao nhất dao động 35-37 độ C, có nơi trên 37 độ C. Từ 11/7, nắng nóng ở Trung Bộ dịu dần. Nhiệt độ dự báo trong các bản tin nắng nóng và nhiệt độ cảm nhận thực tế ngoài trời có thể chênh lệch 2-4 độ C, thậm chí cao hơn phụ thuộc vào các điều kiện mặt đệm như bê tông, đường nhựa. Dự báo thời tiết các vùng trên cả nước trong chiều tối và đêm 8/7, ngày 9/7 Hà Nộichiều tối và đêm mưa rào và dông vài nơi, ngày nắng nóng. Gió nhẹ. Nhiệt độ thấp nhất 26-28 độ C. Nhiệt độ cao nhất 35-37 độ C. Tây Bắc Bộchiều tối và đêm mưa rào và dông rải rác, cục bộ mưa to. Ngày nắng, có nơi nắng nóng. Gió nhẹ. Trong mưa dông đề phòng lốc, sét, mưa đá và gió giật mạnh. Nhiệt độ thấp nhất 25-28 độ C, có nơi dưới 25 độ C. Nhiệt độ cao nhất 33-36 độ C. Đông Bắc Bộchiều tối và đêm mưa rào và dông vài nơi, vùng núi mưa rào và dông rải rác, cục bộ mưa to. Ngày nắng nóng. Gió nhẹ. Trong mưa dông dự báo xảy ra lốc, sét và gió giật mạnh. Nhiệt độ thấp nhất 25-28 độ C, vùng núi có nơi dưới 25 độ C. Nhiệt độ cao nhất 34-37 độ C, có nơi trên 37 độ C. Thanh Hóa đến Huếchiều tối và đêm mưa rào và dông vài nơi, ngày nắng nóng. Gió tây nam cấp 2-3. Trong mưa dông cảnh báo lốc, sét và gió giật mạnh. Nhiệt độ thấp nhất 26-29 độ C. Nhiệt độ cao nhất 34-37 độ C, có nơi trên 37 độ C. Duyên hải Nam Trung Bộchiều tối và đêm mưa rào và dông vài nơi, ngày nắng. Phía Bắc nắng nóng. Gió tây nam cấp 2-3. Trong mưa dông khả năng xảy ra lốc, sét và gió giật mạnh. Nhiệt độ thấp nhất 26-29°C. Nhiệt độ cao nhất 33-36 độ C. Cao nguyên Trung Bộmưa rào và dông vài nơi. Chiều và tối mưa rào và dông rải rác, cục bộ mưa to. Gió tây nam cấp 2-3. Trong mưa dông có thể xảy ra lốc, sét và gió giật mạnh. Nhiệt độ thấp nhất 20-23 độ C. Nhiệt độ cao nhất 27-30 độ C, có nơi trên 30 độ C. Nam Bộmưa rào và dông vài nơi. Chiều và tối mưa rào và dông rải rác, cục bộ mưa to. Gió tây nam cấp 2-3. Trong mưa dông nguy cơ xảy ra lốc, sét và gió giật mạnh. Nhiệt độ thấp nhất 23-26 độ C. Nhiệt độ cao nhất 31-34 độ C. TP.HCMmưa rào và dông vài nơi. Chiều và tối mưa rào và dông rải rác, cục bộ mưa to. Gió tây nam cấp 2-3. Trong mưa dông đề phòng lốc, sét và gió giật mạnh. Nhiệt độ thấp nhất 24-26 độ C. Nhiệt độ cao nhất 32-34 độ C. Sách hay về môi trường How to Save Our Planet- Mark Maslin: Tác phẩm được ví như cuốn cẩm nang về các vấn đề còn tồn tại và các giải pháp khả thi để cứu Trái Đất; trang bị cho người đọc những kiến ​​thức khoa học mới nhất về biến đổi khí hậu, tính bền vững và các vấn đề mà chúng ta đang phải đối mặt.  Miền Bắc đầu tuần nắng mạnh, giữa tuần mưa lớn 09:06 6/7/202509:066/7/2025Xã hộiXã hội 0 Dự báo thời tiết 10 ngày tới, miền Bắc đầu tuần nắng mạnh, có nơi nắng nóng với nhiệt độ cao nhất trên 35 độ C, đến giữa tuần trời mưa lớn, cục bộ mưa to đến rất to.  Chi tiết kế hoạch diễu binh, diễu hành kỷ niệm Quốc khánh 2/9 6 giờ trước20:348/7/2025Xã hộiXã hội 0 UBND TP Hà Nội ban hành kế hoạch chương trình lễ kỷ niệm, diễu binh, diễu hành dịp 80 năm Cách mạng tháng Tám thành công và Quốc khánh 2/9.  Gần 2 giờ nghẹt thở cứu bé trai 5 tuổi bị kẹt chân vào ống thoát nước 7 giờ trước20:138/7/2025Xã hộiXã hội 0 Sau gần 2 giờ nỗ lực, lực lượng chức năng giải cứu thành công bé trai 5 tuổi bị kẹt chân vào ống thoát nước ở sân nhà."
ZNews,https://znews.vn/gan-2-gio-nghet-tho-cuu-be-trai-5-tuoi-bi-ket-chan-vao-ong-thoat-nuoc-post1566602.html,Xã hội,Null,"Thứ ba, 8/7/2025 20:13 (GMT+7)",Gần 2 giờ nghẹt thở cứu bé trai 5 tuổi bị kẹt chân vào ống thoát nước,"Phòng Cảnh sát Phòng cháy chữa cháy và cứu nạn cứu hộ Công an tỉnh Quảng Trị vừa giải cứu thành công cháu bé mắc kẹt trong ống thoát nước ở xã Lao Bảo. Trước đó, 16h ngày 7/7, Trần Tiến (5 tuổi, ngụ TP Huế) trong lúc chơi tại nhà cậu ruột ở khóm Trung Chín (xã Lao Bảo) thì không may bị kẹt chân vào ống thoát nước bằng nhựa dưới nền sân. Sau gần 2 giờ đồng hồ, lực lượng chức năng giải cứu thành công bé Trần Tiến. Ảnh:Phòng Cảnh sát PCCC&CNCH Công an Quảng Trị. Người nhà tìm mọi cách nhưng không thể rút chân bé ra ngoài nên gọi điện cầu cứu lực lượng chức năng trong tình thế nguy cấp. Đội Chữa cháy và cứu nạn, cứu hộ khu vực số 2 thuộc Phòng Cảnh sát Phòng cháy chữa cháy và cứu nạn cứu hộ Công an tỉnh Quảng Trị nhanh chóng điều động nhiều cán bộ, chiến sĩ cùng phương tiện chuyên dụng đến hiện trường. Các chiến sĩ liên tục trấn an, động viên cháu bé, đồng thời dùng các thiết bị chuyên dụng như máy đục bê tông, kìm cắt để cẩn thận phá vỡ lớp bê tông và cắt ống nhựa xung quanh chân bé. Sau gần 2 giờ đồng hồ, đến 17h34 cùng ngày, lực lượng cứu nạn đưa được chân bé Tiến ra ngoài an toàn. Bé hoàn toàn khỏe mạnh, không bị chấn thương. Tủ sách Xã hộigiới thiệu những cuốn sách hay và mới về các chủ đề từ thời sự, chính trị, đến giao thông, hạ tầng... Tủ sách đồng thời cung cấp nhiều kiến thức, dữ liệu để độc giả hiểu nhiều lĩnh vực khác nhau của đời sống xã hội.  Cứu bé 8 tuổi kẹt tay trong ống hút nước ở khu đô thị Hà Nội 06:45 1/6/202506:451/6/2025Xã hộiXã hội 0 Bé 8 tuổi bị kẹt tay trong đường ống hút nước áp lực cao tại khu vực đài phun nước thuộc khu đô thị huyện Gia Lâm (Hà Nội) được cảnh sát giải cứu an toàn.  Xe tải tông nhau, 2 tài xế mắc kẹt trong cabin 17:59 21/6/202517:5921/6/2025Xã hộiXã hội 0 Sau tai nạn, 2 tài xế xe tải bị thương, kẹt trong cabin và được lực lượng chức năng giải cứu đưa ra ngoài.  Cảnh sát giải cứu công nhân bị khối bê tông đổ sập, đè lên người 14:28 5/7/202514:285/7/2025Xã hộiXã hội 0 Một vụ tai nạn lao động xảy ra tại ngõ 324 Thụy Khuê (phường Tây Hồ, Hà Nội) khiến anh N.V.T. (SN 1994, quê quán Sơn Dương, Tuyên Quang) bị khối bê tông đè trúng."
ZNews,https://znews.vn/chu-tich-ha-noi-yeu-cau-xu-ly-vi-pham-xay-mo-gia-trong-nghia-trang-post1566933.html,Xã hội,Null,"Thứ ba, 8/7/2025 16:00 (GMT+7)",Chủ tịch Hà Nội yêu cầu xử lý vi phạm xây mộ giả trong nghĩa trang,"Ngày 7/7, Chủ tịch UBND TP. Hà Nội Trần Sỹ Thanh ban hành hai công văn yêu cầu xử lý vi phạm về đất đai sau khi báo chí phản ánh. Cụ thể, một số cơ quan báo chí phản ánh tại khu vực nghĩa trang nhân dân phường Đại Mỗ, xuất hiện nhiều đối tượng có dấu hiệu tổ chức san lấp mặt bằng, đào xới, xây dựng hàng loạt ngôi mộ giả để bán cho những gia đình có nhu cầu đưa xương cốt người thân về an táng. Về việc này, Chủ tịch UBND TP. Hà Nội Trần Sỹ Thanh giao UBND phường Đại Mỗ chủ trì, phối hợp với các cơ quan, đơn vị liên quan kiểm tra, làm rõ thông tin các cơ quan báo chí nêu trên phản ánh; xử lý nghiêm vi phạm (nếu có) theo quy định pháp luật, báo cáo UBND TP. Hà Nội trước ngày 10/7. Những ngôi mộ mới xây được gắn bia mộ nghi là tạo danh tính giả để tránh sự nghi ngờ của người dân địa phương. Ảnh:PNVN. Báo chí cũng phản ánh về dãy nhà liền kề xây dựng trên đất phi nông nghiệp ngoài đê sông Đuống tại đầu ngõ 95 đường Gia Thượng. Bên thi công che chắn kín mít bằng những miếng tôn để hoàn thiện các hạng mục để tránh bị phát hiện. Công trình được cho là xây dựng trên đất phi nông nghiệp tại phường Việt Hưng. Chủ tịch UBND TP Hà Nội Trần Sỹ Thanh giao UBND phường Việt Hưng chủ trì, phối hợp với các đơn vị liên quan khẩn trương kiểm tra, làm rõ thông tin Báo Tri thức và Cuộc sống phản ánh, xử lý nghiêm vi phạm (nếu có) theo quy định pháp luật; báo cáo UBND TP.Hà Nội kết quả thực hiện trước ngày 15/7. Những cuốn sách hay về đô thị Hà Nội Hà Nội chuyện xưa phố cũgồm 39 đoản văn biên khảo về các hoạt động ở Hà Nội giữa thế kỷ XX trở về trước, từ chuyện phố xá, quy hoạch, đến chuyện ăn, chuyện mặc,... của người Hà thành. Mùa đi qua phố- bạn đọc sẽ rung động theo những cảm nhận riêng, đôi khi rất khác nhau về Hà Nội trong bốn mùa xuân, hạ, thu, đông.  Người bán trà đá đuổi cô gái đứng trên vỉa hè Hà Nội bị phạt 2,5 triệu 17 giờ trước10:048/7/2025Xã hộiXã hội 0 Không chỉ lấn chiếm vỉa hè để bán trà đá, người phụ nữ còn có hành động xấu xí khi xua đuổi, đá vào vali của cô gái đang đứng đợi xe.  Công an Hà Nội cứu nữ sinh nhảy cầu Vĩnh Tuy tự tử 18:00 7/7/202518:007/7/2025Xã hộiXã hội 0 Nhận được tin báo cô gái trẻ nhảy xuống sông Hồng tự tử, cảnh sát lập tức triển khai đội hình cứu hộ, nhanh chóng tiếp cận và đưa nạn nhân vào bờ an toàn.  Hà Nội kỷ luật 24 cán bộ vi phạm tham nhũng, tiêu cực 16:04 7/7/202516:047/7/2025Xã hộiXã hội 0 Trong 6 tháng qua, đã có 24 cán bộ, công chức, viên chức, người lao động của Hà Nội bị xử lý kỷ luật hành chính do có hành vi tham nhũng, tiêu cực, trong đó có 17 người bị xử lý kỷ luật đảng."
ZNews,https://znews.vn/doi-nam-nu-bi-nhom-doi-tuong-phuc-kich-tan-cong-trong-hem-vang-post1566606.html,Xã hội,Null,"Thứ ba, 8/7/2025 16:11 (GMT+7)",Đôi nam nữ bị nhóm đối tượng phục kích tấn công trong hẻm vắng,"Sáng 8/7, ông Nguyễn Thừa Đoàn, Chủ tịch UBND phường Cam Ly - Đà Lạt, tỉnh Lâm Đồng, cho biết Công an phường Cam Ly - Đà Lạt đang phối hợp cùng các đơn vị nghiệp vụ liên quan khẩn trương truy xét nhóm thanh niên phục kích hành hung dã man người phụ nữ xảy ra trên địa bàn. Hình ảnh nhóm thanh niên hành hung người phụ nữ. Ảnh:Camera an ninh. Theo hình ảnh trích xuất từ camera an ninh, thời điểm xảy ra vụ việc là vào rạng sáng 7/7. Khi đó, một người đàn ông đang điều khiển xe gắn máy chở theo một phụ nữ lớn tuổi rẽ vào con hẻm nhỏ nằm trên đường Hai Bà Trưng, phường Cam Ly - Đà Lạt thì bất ngờ bị một nhóm thanh niên (khoảng 2-3 người) từ trong bóng tối lao ra tấn công. Nhóm đối tượng này được cho là đã mai phục sẵn, sử dụng hung khí đánh liên tiếp vào hai người trên xe. Trong lúc hoảng loạn, người phụ nữ chỉ biết la hét cầu cứu rồi chạy xuôi theo hẻm để thoát thân. May mắn, bà chạy được một đoạn thì người dân gần đó hỗ trợ, đưa đi cấp cứu trong tình trạng đa chấn thương. Người phụ nữ nhập viện với nhiều vết thương. Ảnh:CACC. Nạn nhân được xác định là bà Lê Thị T. (SN 1967, ở phường Cam Ly - Đà Lạt), nhập viện với nhiều vết thương ở vùng trán, cổ và tai. Người đàn ông đi cùng bà may mắn không bị thương nặng. Sau khi tiếp nhận thông tin, Công an phường Cam Ly - Đà Lạt đã phối hợp với các đơn vị nghiệp vụ Công an tỉnh Lâm Đồng tiến hành khám nghiệm hiện trường, trích xuất camera và khẩn trương truy tìm nhóm đối tượng gây án. Hiện vụ việc đang được cơ quan chức năng điều tra làm rõ động cơ và danh tính những người liên quan. Sách hay về xã hội Văn minh Việt Nam- nhà dân tộc học Georges Condominas từng nhận xét tác phẩm này là “Cửa sổ để thế giới hiểu về Việt Nam”. SáchBàn về Quốc hội - những thách thức của những khái niệmlà kết quả của cả một quá trình tích lũy và suy ngẫm của tiến sĩ Nguyễn Sĩ Dũng, nguyên Phó chủ nhiệm Văn phòng Quốc hội.  Xác minh clip người đàn ông chặn ôtô đập phá, đòi hành hung tài xế Dù chưa va chạm, người đàn ông đi xe máy vẫn chặn taxi công nghệ, đập kính và đòi hành hung tài xế trên đường Lê Hồng Phong (quận 5, TP.HCM).  Thầy giáo ở Quảng Nam bị chặn xe, hành hung Trên đường về nhà, thầy giáo ở Quảng Nam bị người đàn ông chặn xe, đánh tới tấp.  Điều tra vụ shipper bị đánh gãy mũi vì đơn hàng 64.000 đồng ở TP.HCM Cơ quan chức năng đang xác minh vụ việc nam nhân viên giao hàng bị hành hung bởi đòi tiền đơn hàng 64.000 đồng từ khách."
ZNews,https://znews.vn/chay-nha-tro-o-tphcm-5-phong-bi-thieu-rui-post1566605.html,Xã hội,Null,"Thứ ba, 8/7/2025 15:40 (GMT+7)","Cháy nhà trọ ở TP.HCM, 5 phòng bị thiêu rụi","Đến hơn 11h trưa 8/7, lực lượng chức năng vẫn phong tỏa hiện trường, điều tra nguyên nhân vụ hỏa hoạn xảy ra tại dãy phòng trọ trên đường Đỗ Mười, phường Tân Thới Hiệp, TP.HCM. Lực lương chức năng điều nhiều xe chữa cháy cùng cán bộ chiến sĩ đến hiện trường khống chế ngọn lửa. Theo thông tin ban đầu, khoảng 9h sáng cùng ngày, người dân phát hiện khói lửa bốc lên từ một căn nhà có nhiều phòng trọ cho thuê tại khu vực này. Người dân sống gần đó đã tìm cách tiếp cận hiện trường và dùng các biện pháp chữa cháy tại chỗ, song ngọn lửa lan nhanh và bao trùm toàn bộ khu trọ. Ngay sau khi nhận tin báo, lực lượng Cảnh sát phòng cháy chữa cháy đã điều nhiều xe chữa cháy cùng cán bộ chiến sĩ đến hiện trường triển khai công tác dập lửa và ngăn cháy lan. Đám cháy được khống chế trong thời gian ngắn, không để lan sang các công trình lân cận. Theo người dân địa phương, thời điểm xảy ra cháy, nhiều người thuê trọ đã đi làm nên không có ai bên trong. Một số vật dụng, đồ đạc của người thuê được đưa ra ngoài kịp thời, tuy nhiên bên trong dãy trọ nhiều tài sản đã bị lửa thiêu rụi hoàn toàn. Đại diện UBND phường Tân Thới Hiệp cho biết khu nhà xảy ra hoả hoạn gồm 5 phòng trọ với tổng diện tích khoảng 50 m². Vụ hỏa hoạn không gây thiệt hại về người nhưng làm hư hỏng toàn bộ 5 phòng, ảnh hưởng đến sinh hoạt của nhiều người lao động thuê trọ tại đây. Hiện nguyên nhân đang được lực lượng chức năng điều tra. Thành phố Hồ Chí Minh qua hơn 300 ảnh tư liệu quý Hơn 300 năm qua, những công trình kiến trúc, những nét sinh hoạt văn hóa tại vùng đất này đã lắng đọng vào phố thị và tâm hồn của cộng đồng dân cư nơi đây, kết tinh thành di sản văn hóa vật thể và phi vật thể của Sài Gòn - Gia Định - Thành phố Hồ Chí Minh. Cuốn sáchDi Sản Sài Gòn - Thành Phố Hồ Chí Minhdo Nhà xuất bản Tổng hợp Thành phố Hồ Chí Minh và Tạp chíXưa và Nayphối hợp thực hiện tập hợp hơn 300 bức ảnh quý hiếm của Sài Gòn - Thành phố Hồ Chí Minh, bao quát lịch sử - văn hóa - xã hội vùng đất này.  Xe tải chở tôm đâm xe máy rồi bốc cháy, hai người tử vong Vụ tai nạn xảy ra trên tuyến Quốc lộ 1 qua Cà Mau làm hai người tử vong tại chỗ, xe tải và xe máy bị cháy rụi. Tai nạn làm tắc đoạn đường dài khoảng 3 km ở cả hai chiều.  Công an TP.HCM thông tin về vụ cháy cư xá Độc Lập làm 8 người tử vong Vụ cháy ở cư xá Độc Lập (TP.HCM) làm 8 người tử vong. Lực lượng chức năng giải cứu được 3 người đưa ra ngoài an toàn.  Chủ tịch TP.HCM Nguyễn Văn Được xuống hiện trường vụ cháy 8 người chết Chủ tịch UBND TP.HCM Nguyễn Văn Được đã trực tiếp xuống hiện trường vụ cháy làm 8 người chết xảy ra tại cư xá Độc Lập (phường Phú Thọ Hòa) để thăm hỏi, động viên."
ZNews,https://znews.vn/va-cham-xe-tai-chong-tu-vong-tai-cho-vo-nguy-kich-post1566603.html,Xã hội,Null,"Thứ ba, 8/7/2025 17:00 (GMT+7)","Va chạm xe tải, chồng tử vong tại chỗ, vợ nguy kịch","Ngày 8/7, lãnh đạo UBND xã Cẩm Bình (Hà Tĩnh) xác nhận trên địa bàn vừa xảy ra vụ tai nạn giao thông khiến một người tử vong tại chỗ, một người bị thương nặng phải nhập viện cấp cứu. Hiện trường vụ tai nạn khiến hai vợ chồng thương vong. Theo thông tin ban đầu, khoảng 10h cùng ngày, tài xế H.N.K. (SN 1985, trú xã Cẩm Trung, tỉnh Hà Tĩnh) điều khiển xe tải BKS 38C - 203.xx di chuyển trên đường tỉnh 553 theo hướng từ quốc lộ 1 đi đường ven biển. Khi di chuyển đến khu vực ngã tư giao đường tỉnh 553 với đường huyện 131 thì xảy ra va chạm với xe máy BKS 38X1 - 450.xx do hai vợ chồng ông Phan Xuân Th. (SN 1968) và bà Trần Thị T. (SN 1968, vợ ông T., cùng trú xã Cẩm Dương) điều khiển. Vụ va chạm mạnh khiến xe máy bị xe tải kéo lê chừng 30m, ông Th. tử vong tại chỗ, còn người vợ bị thương nặng, được đưa tới bệnh viện cấp cứu. Nhận tin báo, Phòng CSGT Công an Hà Tĩnh phối hợp với Công an xã Cẩm Bình đã có mặt tại hiện trường phân luồng giao thông, làm rõ nguyên nhân vụ tai nạn. Thực trạng giao thông, văn hóa ứng xử của người tham gia, văn hóa quản lý, điều hành giao thông, các vấn đề liên quan tới quy hoạch và giải pháp xây dựng giao thông Việt Nam trong tương lai đều được PGS.TS. Phạm Ngọc Trung đề cập tới trong cuốnVăn hóa giao thông ở Việt Nam hiện nay.  Xe tải chở tôm đâm xe máy rồi bốc cháy, hai người tử vong Vụ tai nạn xảy ra trên tuyến Quốc lộ 1 qua Cà Mau làm hai người tử vong tại chỗ, xe tải và xe máy bị cháy rụi. Tai nạn làm tắc đoạn đường dài khoảng 3 km ở cả hai chiều.  Tài xế xe tải bị xử phạt vì chạy chậm trên cao tốc Tài xế lái xe tải trên cao tốc Vân Phong - Nha Trang bị CSGT xử phạt vì nghĩ chạy nhanh mới nguy hiểm, chạy chậm là an toàn nên đã vi phạm.  Xe con tông đuôi xe tải, 5 người cùng gia đình thương vong Xe con đang chạy trên đường ở Hải Dương thì va chạm với ôtô tải dừng đỗ ven đường, khiến bé gái 13 tuổi thiệt mạng, 4 người còn lại bị thương."
ZNews,https://znews.vn/phat-hien-thi-the-nguoi-dan-ong-trong-vuon-sau-rieng-post1566611.html,Xã hội,Null,"Thứ ba, 8/7/2025 06:51 (GMT+7)",Phát hiện thi thể người đàn ông trong vườn sầu riêng,"Chiều 7/7, một người dân trong lúc đánh bắt cá tại khu vực suối gần cầu Thanh Hải (thôn 4, xã Đạ Huoai 2, tỉnh Lâm Đồng) đã phát hiện thi thể một người đàn ông trong tư thế treo cổ tại một căn chòi giữa vườn sầu riêng. Khu vực phát hiện thi thể người đàn ông trong tư thế treo cổ. Theo thông tin ban đầu, khoảng 16h cùng ngày, người này ngửi thấy mùi lạ phát ra từ khu vực vườn liền tiến đến kiểm tra thì bàng hoàng phát hiện vụ việc và lập tức báo chính quyền địa phương. Nhận tin báo, lực lượng chức năng xã Đạ Huoai 2 phối hợp với cơ quan điều tra Công an tỉnh Lâm Đồng nhanh chóng có mặt tại hiện trường, phong tỏa khu vực để khám nghiệm, điều tra nguyên nhân tử vong. Nạn nhân được xác định là ông Nguyễn Thanh Q. (51 tuổi, trú tại thôn 4, xã Đạ Huoai 2). Hiện vụ việc đang được cơ quan chức năng điều tra, làm rõ. Tủ sách Xã hộigiới thiệu những cuốn sách hay và mới về các chủ đề từ thời sự, chính trị, đến giao thông, hạ tầng... Tủ sách đồng thời cung cấp nhiều kiến thức, dữ liệu để độc giả hiểu nhiều lĩnh vực khác nhau của đời sống xã hội.  Tìm thấy thi thể bé trai mất tích khi tắm biển ở Bãi Cháy Lực lượng Cảnh sát Phòng cháy chữa cháy và Cứu nạn cứu hộ (PCCC&CNCH), Công an tỉnh Quảng Ninh vừa phối hợp tìm thấy thi thể cháu bé mất tích khi tắm biển tại TP Hạ Long.  Đi giăng lưới, phát hiện thi thể nam giới bị trói tay trôi sông Người dân xã Đức Liễu (huyện Bù Đăng, tỉnh Bình Phước) phát hiện thi thể một người đàn ông bị trói tay, trôi trên sông. Vụ việc đang được cơ quan công an điều tra làm rõ.  Danh tính thi thể người phụ nữ trôi dạt vào đảo Cồn Cỏ Danh tính thi thể người phụ nữ trôi dạt vào bờ đảo Cồn Cỏ vào chiều 14/6 được xác định là một ngư dân quê ở huyện Bố Trạch, tỉnh Quảng Bình."
