Source,URL,Category,Keyword,Time,Title,Content
VN Express,https://vnexpress.net/ty-phu-jeff-bezos-se-ton-vinh-van-hoa-venice-trong-le-cuoi-4899780.html,Giới sao,"Lauren Sanchez,tỷ phú Jeff Bezos,đám cưới tỷ phú Jeff Bezos","Thứ ba, 17/6/2025, 13:03 (GMT+7)",Tỷ phú Jeff Bezos sẽ 'tôn vinh văn hóa Venice' trong lễ cưới,"Tỷ phú Jeff Bezos và cựu MC Lauren Sánchez dự kiến đặt bánh, đồ dùng lễ cưới từ các thương hiệu của Venice khi tổ chức lễ cưới ở đây. TheoAPngày 14/6, những người thân cặp sao cho biết khoảng 80% vật dụng trong lễ cưới do các cơ sở tại Venice cung cấp. Cặp uyên ương chọn hàng địa phương cho ngày vui như một cách bày tỏ trân trọng đến thành phố. Lễ cưới sẽ diễn ra ba ngày cuối tháng 6, dự kiến có khoảng 200 khách mời. Rosa Salva - một trong những tiệm bánh lâu đời nhất thành phố, ra đời năm 1876 là một trong những đơn vị đồng hành cặp sao. Ông Antonio Rosa Salva - chủ nhân đời thứ sáu của hãng - cho biết tỷ phú và vợ sắp cưới đặt nhiều loại bánh bất ngờ cho túi quà tặng khách mời. Theo ông, đơn đặt hàng này chứng tỏ truyền thống làm bánh đặc sản gần 150 năm của gia đình đã được công nhận. APnhận định các sản phẩm của Rosa Salva vừa phù hợp khách VIP lẫn người bình thường. Thực đơn của tiệm thường có bánh quy bơ bussola - món ăn chính lâu đời của ngư dân, bánh quy zaletti làm từ bột bắp của vùng Veneto mang hương vị nho khô và vỏ chanh. ""Chúng tôi cố gắng giữ nguyên các công thức xưa. Chúng tôi chế biến bằng cả trái tim. Đây là niềm vui và vinh dự của mọi người"", ông Antonio nói thêm. Xưởng chế tác Laguna B là nhà cung cấp khác của lễ cưới. Công ty do nghệ nhân Marie Brandolini, có biệt danh là ""nữ bá tước thủy tinh"", thành lập năm 1994. Hãng chuyên sản xuất các sản phẩm từ thủy tinh Murano - loại được giới thời trang và thiết kế yêu thích. Hiện con trai của bà là Marcantonio Brandolini giữ quyền điều hành. Theo các chuyên trang địa phương, nghệ thuật làm thủy tinh Murano ra đời vào khoảng thế kỷ 13 trên đảo Murano, Italy. Nghề này đòi hỏi kỹ thuật thổi thủy tinh có tuổi đời hơn 1.000 năm, phát triển từ phương pháp của người La Mã cổ đại. Sau khi thổi bằng miệng, họ dùng các công cụ chuyên đúc, tạo hình và đánh bóng tác phẩm. Chúng có nhiều hình dạng, kích thước từ đơn giản đến phức tạp. Giới chuyên gia đánh giá đây là một trong những loại thủy tinh có tính thẩm mỹ cao, được nhiều người ưa chuộng. Giá dao động của chúng từ hàng trăm đến hàng nghìn euro. Ông Marcantonio không tiết lộ yêu cầu đặt hàng của cặp sao. TheoAP, Laguna B nổi tiếng với các mẫu thiết kế độc đáo, không trùng lặp. Ông nói với hãng tin: ""Tôi hy vọng họ thích những thứ chúng tôi làm. Với chúng tôi, đây là cơ hội lớn giúp doanh nghiệp phát triển"". Từ khi có thông tin đám cưới của tỷ phú Bezos diễn ra tại Venice, sự kiện của ông bị nhiều người dânphản đối. Họ cho rằng chuỗi ngày vui của ông sẽ làm xáo trộn thành phố, tăng thêm lượng người đến thành phố vốn rất đông. Một số nhà hoạt động tổ chức biểu tình, cho biết lễ cưới không mang nhiều lợi ích cho dân địa phương trừ các bên đối tác kinh doanh. Chính quyền địa phương cam kết mọi dịch vụ công cộng hoạt động bình thường suốt lúc làm lễ, phủ nhận tin đồn cặp sao đặt trước nửa số taxi nước và các phòng khách sạn sang trọng. Thị trưởng Luigi Brugnaro nói vớiAP: ""Chúng tôi rất tự hào. Tôi không chắc liệu có đủ thời gian bắt tay với tỷ phú Jeff Bezos hay không, nhưng việc họ chọn Venice là một vinh dự. Venice một lần nữa khẳng định vị thế sân khấu quốc tế của mình"". TheoTelegraph,hôn lễ của Lauren Sánchez và Jeff Bezos sẽ diễn ra trên siêu du thuyền Koru trị giá 500 triệu USD, có thể tốn khoảng 10 triệu USD. Hiện chưa có thông tin về địa điểm làm lễ, nhưng người dân tin rằng cả hai sẽ tổ chức trên đảo San Giorgio - nằm ở cửa kênh đào Grand Canal. Danh sách khách mời dự kiến toànsao hạng Avà các nhân vật quyền lực. Cặp sao công khai mối quan hệ vào năm 2019, sau khi Bezos tuyên bố ly hôn nhà văn MacKenzie Scott. Cùng thời điểm, Sánchez chia tay người chồng chung sống 13 năm, Patrick Whitesell. Cặp sao tổ chức đính hôn trên du thuyền Koru bên bờ biển Amalfi, Italy tháng 8/2023. TheoL'OfficielMỹ, Bezos cầu hôn Sánchez với chiếc nhẫn kim cương 20 carat trị giá 2,5 triệu USD. Jeff Bezossinh năm 1964, là ông trùm truyền thông và nhà đầu tư người Mỹ. Ông nổi tiếng khi sáng lập và xây dựng Amazon như một cửa hàng sách trực tuyến, sau đó mở rộng thêm các sản phẩm, dịch vụ thương mại điện tử. Trong 27 năm nắm quyền lãnh đạo, ông đưa Amazon trở thành đế chế bán lẻ lớn nhất thế giới. Năm 2021, ông thôi chức Giám đốc điều hành. TheoForbes, Jeff Bezos hiện là người giàu thứ ba trên thế giới với 221 tỷ USD, xếp sau ""trùm công nghệ"" Elon Musk và nhà sáng lậpFacebook- Mark Zuckerberg. Lauren Sánchezsinh năm 1969, là người dẫn chương trình gốc Mexico từng đoạt giải Emmy, thực hiện nhiều show nổi tiếng trên kênh KTTV Fox-11 nhưGood Day LA. Cô còn là diễn viên, chủ hãng phim Black Ops Aviation và tác giả truyện thiếu nhi. Tháng 4, cô gây chú ý khi thực hiện chuyến bay vào rìa vũ trụ cùng phi hành đoàn toàn nữ, trong đó có Katy Perry. Ngoài ra, cô có một con trai với bạn trai cũ - cầu thủ bóng bầu dục Tony Gonzalez. Phương Thảo(theoAP)"
VN Express,https://vnexpress.net/phuong-my-chi-ngoi-sao-giai-tri-da-nang-4899452.html,Giới sao,"Phương Mỹ Chi,cô bé dân ca","Thứ ba, 17/6/2025, 10:55 (GMT+7)",Phương Mỹ Chi - ngôi sao giải trí đa năng,"Phương Mỹ Chi theo đuổi nhạc dân ca, trữ tình gần 10 năm trước khi trở thành ngôi sao giải trí năng động ở lĩnh vực âm nhạc, phim ảnh. Giọng ca 22 tuổi cùng lúc tham gia cuộc thi của Việt Nam -Em xinh say hivà quốc tế -Sing! Asia.Trên hai sân khấu, cô đều có dấu ấn về phong cách trình diễn. Giọng ca 22 tuổi cùng lúc tham gia cuộc thi của Việt Nam -Em xinh say hivà quốc tế -Sing! Asia.Trên hai sân khấu, cô đều có dấu ấn về phong cách trình diễn. ỞSing! Asia, Phương Mỹ Chi gây chú ý với ba tiết mục dân gian đương đại gồmBuôn trăng, Rock hạt gạo, Lý Bắc bộ, tô đậm nét văn hóa Việt. Cô đầu tư nhiều kỹ năng biểu diễn như múa trống cơm, võ Vovinam, gây hiệu ứng. Ca sĩ giành được suất vào tứ kết ghi hình tại Hong Kong sắp tới vì là người chiến thắng ở vòng thi tại Việt Nam. ỞSing! Asia, Phương Mỹ Chi gây chú ý với ba tiết mục dân gian đương đại gồmBuôn trăng, Rock hạt gạo, Lý Bắc bộ, tô đậm nét văn hóa Việt. Cô đầu tư nhiều kỹ năng biểu diễn như múa trống cơm, võ Vovinam, gây hiệu ứng. Ca sĩ giành được suất vào tứ kết ghi hình tại Hong Kong sắp tới vì là người chiến thắng ở vòng thi tại Việt Nam. Tiết mụcBuôn trăng. Video:FPT Play Tiết mụcLý Bắc Bộ. Video:Ban tổ chức cung cấp Tại vòng sân khấu thứ nhấtEm xinh say hi, cô tham gia viết thêm lời cho nhạc phẩmCầm kỳ thi họa(Tuấn Cry),cùng đồng đội trong nhóm biểu diễn kết hợp vũ đạo. Sau tám ngày phát sóng, tiết mục đạt 2,6 triệu lượt xem, hiện dẫn đầu xu hướng thịnh hành trên YouTube. Tại vòng sân khấu thứ nhấtEm xinh say hi, cô tham gia viết thêm lời cho nhạc phẩmCầm kỳ thi họa(Tuấn Cry),cùng đồng đội trong nhóm biểu diễn kết hợp vũ đạo. Sau tám ngày phát sóng, tiết mục đạt 2,6 triệu lượt xem, hiện dẫn đầu xu hướng thịnh hành trên YouTube. Tiết mụcCầm kỳ thi họa. Video:Ban tổ chức cung cấp Phương Mỹ Chi được khán giả nhận xét là nghệ sĩ đa tài bởi có giọng hát hay, nhảy tốt, biết sáng tác. Người xem dự đoán cô vào sâu, thuộc nhóm chiến thắng trong chương trình. ""Tham gia hai cuộc thi cùng lúc là thử thách, cũng là cơ hội để tôi học hỏi và va chạm. Đích đến của tôi là chiến thắng bản thân"", ca sĩ cho biết. Phương Mỹ Chi được khán giả nhận xét là nghệ sĩ đa tài bởi có giọng hát hay, nhảy tốt, biết sáng tác. Người xem dự đoán cô vào sâu, thuộc nhóm chiến thắng trong chương trình. ""Tham gia hai cuộc thi cùng lúc là thử thách, cũng là cơ hội để tôi học hỏi và va chạm. Đích đến của tôi là chiến thắng bản thân"", ca sĩ cho biết. Trong dịpĐại lễ50 năm thống nhất đất nước, Phương Mỹ Chi cùng Double2T là hai gương mặt gen Z được chọn trình diễnRạng rỡ non sông Việt Namtrước giờ lễ diễu binh, diễu hành. Cô cho biết đây là vinh dự không thể nào quên trong chặng đường ca hát đến nay. Trong dịpĐại lễ50 năm thống nhất đất nước, Phương Mỹ Chi cùng Double2T là hai gương mặt gen Z được chọn trình diễnRạng rỡ non sông Việt Namtrước giờ lễ diễu binh, diễu hành. Cô cho biết đây là vinh dự không thể nào quên trong chặng đường ca hát đến nay. Giọng ca gốc TP HCM được cô út trong gia đình - Phương Quế Như (vốn là một ca sĩ hát nhạc dân ca) - dạy hát từ nhỏ. Năm 12 tuổi, cô được công chúng biết đến qua cuộc thi âm nhạc nhí, hát nhạc trữ tình. Năm 2023, ca sĩ quyết định ""lột xác"" về hình ảnh, bỏ cặp mắt kính quen thuộc với khán giả nhiều năm, theo đuổi phong cách nhạc hiện đại. Giọng ca gốc TP HCM được cô út trong gia đình - Phương Quế Như (vốn là một ca sĩ hát nhạc dân ca) - dạy hát từ nhỏ. Năm 12 tuổi, cô được công chúng biết đến qua cuộc thi âm nhạc nhí, hát nhạc trữ tình. Năm 2023, ca sĩ quyết định ""lột xác"" về hình ảnh, bỏ cặp mắt kính quen thuộc với khán giả nhiều năm, theo đuổi phong cách nhạc hiện đại. Giọng ca gen Z chứng minh sự trưởng thành qua nhiều vai trò trong dự án, mở công ty giải trí riêng. Cô là đồng tác giả ca khúc với nhóm thực tập sinh của DTAP trong albumVũ trụ cò bay,thực hiện showcase cùng tên tạo tiếng vang. Ca sĩ nhận được giải ""Gương mặt mới xuất sắc"" của Làn Sóng Xanh 2023. Giọng ca gen Z chứng minh sự trưởng thành qua nhiều vai trò trong dự án, mở công ty giải trí riêng. Cô là đồng tác giả ca khúc với nhóm thực tập sinh của DTAP trong albumVũ trụ cò bay,thực hiện showcase cùng tên tạo tiếng vang. Ca sĩ nhận được giải ""Gương mặt mới xuất sắc"" của Làn Sóng Xanh 2023. Phương Mỹ Chi cũng là ""Gương mặt trẻ triển vọng 2024"" do Thành Đoàn bình chọn, ghi nhận những nỗ lực của cô dành cho nghệ thuật. Phương Mỹ Chi cũng là ""Gương mặt trẻ triển vọng 2024"" do Thành Đoàn bình chọn, ghi nhận những nỗ lực của cô dành cho nghệ thuật. Ca sĩ định hướng phát triển âm nhạc không chỉ mang tính giải trí mà còn là phương tiện kết nối, lan tỏa giá trị văn hóa truyền thống. Các dự án của cô hai năm qua đều khai thác chất liệu dân gian, kết hợp yếu tố hiện đại, phù hợp thị hiếu khán giả trẻ. Ca sĩ định hướng phát triển âm nhạc không chỉ mang tính giải trí mà còn là phương tiện kết nối, lan tỏa giá trị văn hóa truyền thống. Các dự án của cô hai năm qua đều khai thác chất liệu dân gian, kết hợp yếu tố hiện đại, phù hợp thị hiếu khán giả trẻ. Trích MVVũ trụ cò bay. Video:Nhân vật cung cấp Phương Mỹ Chinổi tiếng trong làng nhạc từ cuộc thi Giọng hát Việt nhí với ca khúcQuê em mùa nước lũ(Tiến Luân), đoạt danh hiệu á quân. 12 năm theo đuổi ca hát, cô ra mắt nhiều MV, từng phát hành albumThương về miền Trung(2017),16 xuân trăng(2019),Bát nhã thuyền(2020). Cô còn tham gia diễn xuất qua các dự án điện ảnhHai lúa(2014),Mùa hè 1999(chưa phát hành),Nhà gia tiên(2024), web dramaTiệm hoa dì ghẻ. Phương Mỹ Chinổi tiếng trong làng nhạc từ cuộc thi Giọng hát Việt nhí với ca khúcQuê em mùa nước lũ(Tiến Luân), đoạt danh hiệu á quân. 12 năm theo đuổi ca hát, cô ra mắt nhiều MV, từng phát hành albumThương về miền Trung(2017),16 xuân trăng(2019),Bát nhã thuyền(2020). Cô còn tham gia diễn xuất qua các dự án điện ảnhHai lúa(2014),Mùa hè 1999(chưa phát hành),Nhà gia tiên(2024), web dramaTiệm hoa dì ghẻ."
VN Express,https://vnexpress.net/dan-sao-tieu-ngao-giang-ho-sau-30-nam-4899461.html,Phim,"Tiếu ngạo giang hồ,Lữ Tụng Hiền,Lệnh Hồ Xung,Lương Nghệ Linh,Trần Thiếu Hà,Hà Mỹ Điền,Tiếu ngạo giang hồ 1996,Lỗ Chấn Thuận","Thứ tư, 18/6/2025, 00:00 (GMT+7)",Dàn sao 'Tiếu ngạo giang hồ' sau 30 năm,"Tài tử đóng Lâm Bình Chi bỏ thừa kế để xuất gia, diễn viên đóng Lệnh Hồ Xung sống tiêu dao với thú vui lặn biển, đua xe. Sau khi hãng phim TVB công bốquay bản mớichuyển thể tiểu thuyết Kim Dung, nhiều khán giả chia sẻ lại trích đoạn trong bản ghi hình năm 1995, phát lần đầu năm 1996, đánh giá đây là tác phẩm thành công nhất trong khoảng 10 phim truyền hình cùng đề tài. Phim xoay quanh cuộc đời Lệnh Hồ Xung - đại đệ tử phái Hoa Sơn với tính lãng tử. Anh bị cuốn vào âm mưu đen tối, thâm hiểm của những kẻ muốn thống trị giang hồ. Chủ đề chính của tiểu thuyết là phê phán tham vọng quá mức của con người, trong truyện, những cao thủ giang hồ bất chấp thủ đoạn trở thành ""đệ nhất thiên hạ"" cuối cùng đều nhận kết cục cay đắng. *Ảnh: Hậu trường, cảnh phim ""Tiếu ngạo giang hồ"" Như AnhẢnh:TVB"
VN Express,https://vnexpress.net/phim-bi-xoa-khoi-internet-vi-tinh-tiet-me-sinh-99-nguoi-con-4902944.html,Phim,"Trung Quốc,Phim ngắn,Phim hoang đường","Thứ ba, 17/6/2025, 20:00 (GMT+7)",Phim bị xóa khỏi Internet vì tình tiết 'mẹ sinh 99 người con',"Trung Quốc68 tập của series phim ngắn biến mất khỏi tất cả nền tảng sau khi khán giả phản đối tình tiết phụ nữ một lần sinh 99 em bé. TheoChina Business Network, ngày 16/6, phimKỳ lân tống tử: Thiên giáng hỷ phúc(gọi tắt làKỳ lân) không còn hiển thị trên các trang từng chiếu trước đó nhưDouyin, Weibo, Kuaishou.Nội dung xoay quanh nữ chính mang thai ngoài ý muốn, sinh 99 đứa trẻ. TrangXinhuachỉ trích êkíp ""câu view bất chấp"". Hàng nghìn khán giả cho biết phim có các tình tiết ""điên loạn, hoang đường"" liên quan trẻ sơ sinh. Trước khi bị gỡ, Kỳ lân đạt hơn 45 triệu lượt xem. Giới chuyên gia nhận định sự việc cho thấy nhiều vấn đề trong ngành sản xuất phim ngắn của Trung Quốc.Nhiều nhà sáng tạo tập trung vào việc câu view bằng nội dung giật gân, bỏ qua định hướng giá trị nghệ thuật. Các nhà sản xuất chỉ quan tâm đến lợi nhuận ngắn hạn mà không đầu tư vào kịch bản và chất lượng. Cơ chế kiểm duyệt và giám sát của nền tảng cũng còn nhiều lỗ hổng, chưa ngăn chặn kịp thời những nội dung vô lý. Một tên tuổi trong lĩnh vực video ngắn ở nước này cho rằng trường hợp củaKỳ lâncho thấy việc giám sát nội dung ngắn vẫn chưa triệt để. Việc phim chỉ bị gỡ bỏ sau khi khán giả phản ánh cho thấy sự chậm trễ trong công tác quản lý. Các cơ quan chức năng và nền tảng cần sớm hoàn thiện cơ chế kiểm duyệt và điều chỉnh nội dung không lành mạnh. Trang này nhận định việc xây dựng môi trường phim ngắn lành mạnh, tích cực còn chặng đường dài phía trước. Năm 2024, Tổng cục Phát thanh Truyền hình Trung Quốc từng yêu cầu các nền tảng mạng xã hội tăng cường quản lý, kiểm duyệt nội dung với mảng phim ngắn, trong đó có dòng phim ""tổng tài bá đạo"" - series về các chủ doanh nghiệp yêu những người nhỏ bé, bình thường tại nơi làm việc. Tổng cục quy định phim ngắn được phân loại thành ba nhóm dựa trên mức đầu tư. Nhóm Phim trọng điểm do Tổng cục quản lý, mức đầu tư trên một triệu nhân dân tệ (3,6 tỷ đồng). Nhóm Phim phổ thông có vốn 300 nghìn đến một triệu tệ, do cơ quan cấp tỉnh quản lý. Nhóm còn lại có vốn đầu tư dưới 300 nghìn tệ, do nền tảng phát sóng tự quản lý. Trung tâm An toànDouyintừng gỡ hàng trăm phim vi phạm quy định, cho biết động thái trên nhằm xây dựng môi trường tích cực, cởi mở và thân thiện. Nền tảng ""không chấp nhận"" các phim ngắn ""nội dung độc hại, định hướng lệch lạc"". phạm quy định. Theo trang21st Century Business Herald, phim ngắn bùng nổ tại Trung Quốc, quy mô thị trường năm ngoái đạt 50,5 tỷ nhân dân tệ (6,9 tỷ USD), tăng gần 35% so với năm 2023. Dự tính đến năm 2027, thị trường phim ngắn Trung Quốc vượt 100 tỷ nhân dân tệ (13,7 tỷ USD). Các doanh nghiệp đăng ký kinh doanh mảng phim ngắn trên đà tăng trưởng mạnh, trong đó, hơn 36% người dùng xem phim ngắn mỗi ngày. Tính đến tháng 6/2024, số lượng tài khoản xem phim ngắn ở Trung Quốc đạt 570 triệu người. Như Anh(theoCBN, Xinhua)"
VN Express,https://vnexpress.net/brad-pitt-sanh-doi-ban-gai-ra-mat-phim-4899760.html,Phim,"Mỹ,Brad Pitt,phim F1,Idris de Ramon","Thứ ba, 17/6/2025, 10:08 (GMT+7)",Brad Pitt sánh đôi bạn gái ra mắt phim,"MỹBrad Pitt tay trong tay với nhà thiết kế Ines de Ramon ra mắt phim ""F1"" có anh đóng chính, tại New York. Trên thảm đỏ tối 16/6 giờ địa phương (sáng 17/6 giờ Hà Nội), Pitt ôm eo người yêu, tươi cười nhìn vào ống kính máy ảnh. Tài tử diện bộ vest màu xanh navy với sơ mi trắng và khăn lụa. Ines de Ramon chọn áo cổ yếm, váy dài, xách túi Chanel trắng. Nhiều khán giả khen cả hai đẹp đôi: ""Anh ấy rất phong độ, mong hai người hạnh phúc"", ""Họ thật rạng rỡ"". TheoPeople, lần thứ hai cặp sao xuất hiện cùng nhau trên thảm đỏ. F1do Joe Kosinski đạo diễn, Brad Pitt thủ vai tay đua đã giải nghệ Sonny Hayes. Nhân vật bất ngờ nhận được lời mời từ Ruben (Javier Bardem đóng) trở lại giải F1 để cố vấn cho Joshua (Damson Idris). Tuy nhiên, Sonny và Joshua nảy sinh mâu thuẫn. Phần lớn cảnh quay ghi hình tại đường đua F1, có sự góp mặt của những vận động viên đua xe. Pitt và các diễn viên dành nhiều tháng huấn luyện tại đường đua. Đạo diễn Kosinski nhận xét tài lái xe của Pitt giúp bộ phim trở nên hấp dẫn. Brad Pitt, 62 tuổi, là tài tử hàng đầu Hollywood suốt ba thập niên qua. TheoThe Numbers, các phim anh đóng vai chính kiếm khoảng 5 tỷ USD tại phòng vé. Ngôi sao đoạt nhiều giải uy tín như Oscar, Quả Cầu Vàng, BAFTAs. Tài tử trải qua hai cuộc hôn nhân vớiJennifer Aniston(2000-2005) vàAngelina Jolie(2014-2019). Năm 2022, Brad Pitt vàInes de Ramon- bạn gái kém anh 29 tuổi - vướng tin hẹn hò khi cùng xuất hiện tại buổi hòa nhạc Bono ở Los Angeles. Nhiều trang tin quốc tế xác định cả hai sống cùng nhau từ tháng 2/2024. Ở Giải Grand Prix (Anh) tháng 7/2024, tài tử và Ramontay trong tayđến sự kiện, trong đó anh thực hiện một số phân cảnh cho dự án. Hôm 13/6, Pitt đưa Ramon điăn tốicùng cặp sao Bradley Cooper, siêu mẫu Gigi Hadid tại New York. Quế Chi(theoPeople)"
