Source,URL,Category,Keyword,Time,Title,Content
ZNews,https://znews.vn/gia-vang-lien-tuc-tang-nguoi-dan-nen-mua-hay-ban-post1568242.html,Kinh doanh,Null,"Chủ nhật, 13/7/2025 16:15 (GMT+7)","Giá vàng liên tục tăng, người dân nên mua hay bán?","Lúc 6h ngày 13/7, giá vàng miếng tại Doji và SJC cùng niêm yết ở mức 119,5 - 121,5 triệu đồng/lượng (mua vào - bán ra), tăng 600.000 đồng/lượng so với 1 tuần trước (ngày 7/7). Trong khi đó, giá vàng nhẫn 116 - 119 triệu đồng/lượng (mua vào - bán ra), tăng 1,5 triệu đồng/lượng ở cả 2 chiều so với 1 tuần trước. Đây cũng là phiên tăng giá thứ 4 liên tiếp. Nhận định về diễn biến giá vàng, ông Nguyễn Quang Huy, CEO Khoa Tài chính - Ngân hàng, Trường Đại học Nguyễn Trãi cho rằng thời gian tới giá vàng sẽ có thể tiếp tục tăng. ""Giá vàng thế giới sẽ tiếp tục tăng và chinh phục ở đỉnh cao mới, có thể ở mốc 3.600-3.700 USD/ounce, kéo theo giá vàng trong nước có thể vượt mốc 130 triệu đồng/lượng"", ông Huy nhận định. Giá vàng liên tục tăng khiến nhà đầu tư băn khoăn nên mua vào hay bán ra. Ảnh minh họa:Công Hiếu. Theo chuyên gia Nguyễn Quang Huy, 4 nguyên nhân khiến giá vàng thời gian tới tăng mạnh. Thứ nhất, thị trường đang đặt cược cao vào khả năng Cục Dự trữ Liên bang Mỹ (Fed) giảm lãi suất vào tháng 9, tạo áp lực giảm lên đồng USD và lợi suất trái phiếu. Điều này khiến vàng - tài sản phi lợi suất trở nên cực kỳ hấp dẫn. Thứ hai, căng thẳng địa chính trị toàn cầu, trong đó có chiến sự Nga - Ukraine, xung đột Israel - Iran, những bất ổn tiềm ẩn ở Đông Á... đang kích hoạt nhu cầu trú ẩn an toàn vào vàng. Thứ ba, ngân hàng trung ương các nước tiếp tục mua vào vàng. Trong đó Trung Quốc, Nga, Thổ Nhĩ Kỳ vẫn mua ròng vàng hàng tháng như cách để giảm phụ thuộc vào đồng USD và gia tăng dự trữ chiến lược. Thứ tư, tâm lý phòng thủ và chuyển dịch tài sản khi bất ổn tăng, tâm lý đầu tư vào vàng như một tài sản phòng thủ đang quay trở lại mạnh mẽ, thay thế cho tiền kỹ thuật số, cổ phiếu hay bất động sản. Ông Huy cũng cho biết trước tình trạng giá vàng trong nước cách biệt quá xa với thế giới, Chính phủ đang nghiên cứu khả năng cho phép thành lập sàn vàng nhằm tăng tính minh bạch, cạnh tranh và kéo giá vàng Việt Nam tiệm cận với giá thế giới. “Đây sẽ là bước ngoặt lớn giúp điều tiết thị trường hiệu quả, giảm đầu cơ và bảo vệ nhà đầu tư chân chính”, ông Huy nhận định. Đưa ra lời khuyên về việc nên mua hay bán vàng vào thời điểm này, chuyên gia Trần Duy Phương nói nếu người mua vàng trước kia với mục đích tích trữ tài sản thì không cần quá lo lắng để bán tháo vàng trong thời điểm này. Theo thời gian, giá vàng sẽ tăng. Còn với những người mua vàng đầu tư thì vùng giá hiện tại tuy không quá cao nhưng vẫn là lý tưởng để bán vàng thu lời. “Để xác định được thời điểm bán vàng, nhà đầu tư cần lên kế hoạch về mức kỳ vọng lợi nhuận của mình và nên hài lòng với mức lợi nhuận theo kế hoạch chứ không nên tiếc nuối vì cho rằng giá vàng sẽ tiếp tục tăng. Ví dụ, chúng ta mua vàng ở mức 100 triệu đồng/lượng và đặt mục tiêu lãi 10 triệu đồng mỗi lượng. Vậy, khi giá vàng lên mức 110 triệu đồng hoặc 118 triệu đồng/lượng như hiện nay, mục tiêu lợi nhuận đã được đảm bảo, thậm chí còn vượt thì nhà đầu tư nên bán để chốt lời. Không nên nghĩ rằng giá vàng sẽ tăng mà tiếc không bán, như vậy rất rủi ro trong bối cảnh đầy biến động”, ông Phương phân tích. Chuyên gia cũng khuyến cáo người đầu tư vàng cần cẩn trọng, tìm hiểu thật kỹ thị trường để có thể đảm bảo mua vàng khi giá ở mức thấp nhất có thể và bán ra khi giá ở mức cao nhất hoặc đạt kỳ vọng lãi suất của mình. Trong khi đó, chuyên gia kinh tế Nguyễn Trí Hiếu cho rằng thời gian qua, vàng đem lại lợi nhuận cao nhất trong các kênh đầu tư, tính đến tại thời điểm này. “Đầu tư vào vàng là kênh kiếm lời nhiều trong thời gian qua, nhưng cũng tiềm ẩn nhiều rủi ro rất lớn cho thị trường vàng. Do vậy, việc đầu tư vào vàng trong thời gian ngắn để mua đi bán lại kiếm lời cần thận trọng. Nếu mua vàng thì nên mua để đầu tư dài hạn, còn nếu đầu tư ngắn hạn, lướt sóng thì không nên. Nhất là tại thời điểm này, nhà đầu tư không nên vay tiền để đầu tư vàng vì nó vừa tiềm ẩn rủi ro, vừa tạo ra gánh nặng nợ nần rất lớn”, TS Nguyễn Trí Hiếu nói. Chuyên gia Nguyễn Trí Hiếu lưu ý nhà đầu tư có tiền nhàn rỗi cũng không nên tập trung hết vào vàng mà nên phân bổ ra nhiều kênh khác nhau như chứng khoán, bất động sản, tiền gửi ngân hàng. Ngược lại, với những người có vàng tích trữ, muốn bán đi để chốt lời thì có thể tính toán xem mức lợi nhuận hiện tại đã phù hợp với mục tiêu mình đề ra hay chưa. “Nếu đầu tư vàng để kiếm lời, cần phải đặt mục tiêu mỗi năm lãi bao nhiêu phần trăm. Như vậy, mình có thể tính toán được mức giá vàng muốn bán ra, khi đã đạt mục tiêu lợi nhuận thì có thể bán chốt lời”, ông Hiếu tư vấn.  Giá vàng miếng tăng lên 121,5 triệu đồng/lượng Trong phiên giao dịch cuối tuần (12/7), giá bán vàng miếng tăng lên 121,5 triệu/lượng, trong khi vàng nhẫn chạy quanh mốc 117,5 triệu/lượng.  Giá vàng thế giới cao nhất 3 tuần Ngày 11/7, giá vàng thế giới tăng hơn 31 USD/ounce do nhu cầu trú ẩn tăng cao sau khi ông Trump công bố loạt thuế quan mới. Trong nước, giá vàng miếng tăng lên mốc 121 triệu/lượng.  Bánh mì 208.000 đồng ở sân bay: Cần làm rõ, không để khách bị bắt chẹt 5 giờ trước21:2113/7/2025Kinh doanhKinh doanh 0 Nhiều ý kiến cho rằng nên công khai, minh bạch giá cho thuê mặt bằng ở khu vực sân bay để các dịch vụ tại đây không có cớ ""tát nước theo mưa"", bắt chẹt hành khách."
ZNews,https://znews.vn/banh-mi-208000-dong-o-san-bay-can-lam-ro-khong-de-khach-bi-bat-chet-post1568240.html,Kinh doanh,Null,"Chủ nhật, 13/7/2025 21:21 (GMT+7)","Bánh mì 208.000 đồng ở sân bay: Cần làm rõ, không để khách bị bắt chẹt","Gần đây, dư luận xôn xao việc hành khách than trời khi một chiếc bánh mì có giá lên tới 208.000 đồng ở sân bay Nội Bài. Mạng xã hội cũng chia sẻ thêm nhiều câu chuyện về đồ ăn ở một số sân bay Việt Nam quá đắt đỏ, thường “đội giá” lên gấp 2-3, thậm chí 4-5 lần so với bên ngoài. Nhiều ý kiến cho rằng ""câu chuyện quen thuộc"" này khó có thể xử lý dứt điểm vì giá thuê mặt bằng ở sân bay vốn rất cao, kéo giá hàng hóa đắt đỏ theo. Một chuyên gia hàng không bày tỏ quan điểm: Việc đồ ăn trong sân bay đắt hơn bên ngoài là dễ hiểu vì các doanh nghiệp kinh doanh F&B (đồ ăn và thức uống) phải chịu chi phí vận hành cao hơn. Cơ cấu giá hàng hoá trong khu vực sân bay cũng cần phải tính đến chi phí đầu tư của doanh nghiệp vào trong cảng, thuê mặt bằng, thuê gian hàng, đầu tư gian hàng, nhân công, điện, nước... Ngoài ra, khi hàng hóa vào sân bay thì đã được giám sát kỹ lưỡng về vấn đề an ninh, an toàn, vì thế đương nhiên cơ cấu giá phải chênh lệch hơn so với giá thị trường. Chiếc bánh mì có giá 208.000 đồng mà một khách hàng đã mua ở sân bay Nội Bài. Ảnh:Dân Trí. Tuy nhiên, để làm rõ nghi vấn giá hàng hóa trong sân bay đang phải ""gánh"" chi phí thuê mặt bằng quá cao thì Tổng Công ty Cảng hàng không Việt Nam (ACV) cần lên tiếng trả lời câu hỏi mặt bằng cho thuê như thế nào, cơ chế giá để xác định giá sản phẩm dịch vụ trong khu vực sân bay ra sao? ""ACV là đơn vị quản lý mặt bằng, thực hiện nhượng quyền, cho thuê nên ACV cũng phải chịu trách nhiệm trước cơ quan quản lý Nhà nước, trước người tiêu dùng nếu khách thuê mặt bằng để kinh doanh có vi phạm. Câu chuyện giá cả các mặt hàng trong sân bay đắt đỏ đã được phản ánh nhiều năm nay, không phải bây giờ mới diễn ra.ACV là người khai thác, cho thuê mặt bằng thì phải kiểm soát được việc buôn bán ở trong đó chứ không thể để doanh nghiệp, tiểu thương muốn đẩy giá lên thế nào cũng được"", vị chuyên gia nói. Đồng quan điểm, PGS.TS. Nguyễn Thiện Tống cho rằng cần làm rõ câu chuyện này, vừa để rộng đường dư luận, vừa để các dịch vụ trong sân bay không thể lấy cớ giá mặt bằng quá cao để ""tát nước theo mưa"", bắt chẹt hành khách. ""Khi thông tin chưa chi tiết, cụ thể, công khai thì nguy cơ còn có tình trạng mập mờ, ""làm giá"" với người mua. Rất có thể các doanh nghiệp lợi dụng vị trí trong sân bay để bán hàng đắt đỏ, đẩy giá lên cao"", ông Tống nói. “Ngoài ra theo tôi, để giá cả trong khu vực sân bay không bị đẩy lên quá cao thì các cơ quan chức năng cần xác định được giá cốt các mặt hàng, chi phí mặt bằng, lợi nhuận cần đạt và cho ra mức giá chính xác, yêu cầu doanh nghiệp tuân thủ”, chuyên gia Nguyễn Thiện Tống nói. Ông Tống cũng cho rằng khi xác định có sai phạm trong hoạt động buôn bán thì cần phải làm rõ trách nhiệm quản lý thuộc về ai, từ đó mới có hướng xử lý dứt điểm. Trong khi đó, trả lời Báo Điện tử VTC News, một lãnh đạo Cục Hàng không Việt Nam cho biết, sau khi nhận được phản ánh, Cục Hàng không đã đi kiểm tra thì nhận thấy các doanh nghiệp kinh doanh trong sân bay đều niêm yết giá công khai. Tuy vậy, Cục Hàng không vẫn ra văn bản yêu cầu các cơ quan liên quan báo cáo cụ thể, trong đó có ACV. ""ACV là đơn vị kinh doanh cảng hàng không nhằm phục vụ tổ chức hàng không, cá nhân nên ACV có trách nhiệm giám sát chất lượng, giá cả các dịch vụ phi hàng không để tạo thuận lợi cho hành khách"", vị lãnh đạo nói. Vị này cũng cho biết thêm Cục Hàng không chỉ quản lý giá dịch vụ hàng không như giá thuê ống lồng, giá thuê quầy check-in, giá thuê băng chuyền hành lý, an ninh…Còn những giá dịch vụ phi hàng không thì không phải là trách nhiệm trực tiếp. “Cục không có chức năng tính toán, quyết định về cơ cấu giá thành những dịch vụ phi hàng không. Vì thế, để đảm bảo giá cả phù hợp, đảm bảo quyền lợi của người tiêu dùng mà vẫn đáp ứng được yêu cầu của các bên khai thác dịch vụ, khả năng chi trả của người sử dụng dịch vụ thì ngoài Cục Hàng không, rất cần sự cùng vào cuộc của các đơn vị khác như: Cục quản lý giá, Cục Quản lý thị trường, Hội bảo vệ người tiêu dùng…”, vị này nói thêm. Trước đó, Cục Hàng không Việt Nam đã có văn bản yêu cầu xác minh, làm rõ và kịp thời chấn chỉnh các hành vi vi phạm (nếu có) trước thông tin một hành khách cho biết đã phải bỏ ra 208.000 đồng để mua một chiếc bánh mì tại sân bay Nội Bài. Theo đó, Cục Hàng không Việt Nam yêu cầu Cảng hàng không quốc tế Nội Bài, trên cơ sở khoản 1 Điều 68 quy định ""Doanh nghiệp cảng hàng không quyết định cho tổ chức, cá nhân thuê mặt bằng thuộc quyền quản lý, sử dụng của mình để cung cấp dịch vụ hàng không, phi hàng không theo quy định"" phối hợp với Cảng vụ hàng không miền Bắc xác minh, làm rõ các nội dung phản ánh. Cảng hàng không quốc tế Nội Bài kiểm tra việc tuân thủ các quy định tại khoản 5 Điều 70 Nghị định 05/2021/NĐ- CP của Chính phủ về quản lý, khai thác cảng hàng không, sân bay của các tổ chức, cá nhân cung cấp dịch vụ phi hàng không tại nhà ga hành khách. Đồng thời, kịp thời chấn chỉnh ngay các nội dung bất cập, ảnh hưởng đến chất lượng cung cấp dịch vụ, quyền lợi chính đáng của khách hàng. Đối với ACV, Cục Hàng không Việt Nam yêu cầu tăng cường công tác chỉ đạo hoạt động cung cấp dịch vụ phi hàng không tại các cảng hàng không; rà soát giá hàng hóa, dịch vụ đặc biệt là dịch vụ ăn, uống để đảm bảo giá bán tương xứng với chất lượng và không quá cao so mặt bằng chung của hàng hóa, dịch vụ cùng loại. ACV kịp thời chấn chỉnh ngay các nội dung bất cập, ảnh hưởng đến chất lượng cung cấp dịch vụ tại nhà ga hành khách, quyền lợi chính đáng của khách hàng; niêm yết công khai giá; bảo đảm văn minh, lịch sự, chu đáo. Cảng vụ hàng không miền Bắc chủ trì, phối hợp với Cảng hàng không quốc tế Nội Bài xác minh, làm rõ các nội dung phản ánh; xử lý nghiêm các tổ chức, cá nhân có hành vi vi phạm (nếu có) theo quy định. Đồng thời tăng cường công tác kiểm tra, giám sát, tiếp nhận các phản ánh, kiến nghị của khách hàng, chủ trì giải quyết các phản ánh, kiến nghị theo theo trách nhiệm của Cảng vụ hàng không được quy định tại khoản 4, khoản 8 Điều 9, khoản 4 Điều 70 Nghị định 05/2021/NĐ-CP ngày 25/01/2021.  'Siêu' lợi nhuận từ bán bánh mì, phở tại sân bay Cứ mỗi 1.000 đồng doanh thu ở các nhà hàng sân bay, CTCP Dịch vụ Hàng không Sân bay Nội Bài (Nasco) lại lãi 724 đồng. Biên lợi nhuận của Sasco, Taseco Air cũng ở mức ấn tượng.  Đề xuất làm metro nhanh nối sân bay Long Thành với Tân Sơn Nhất Chuyên gia enCity cho rằng việc xây dựng tuyến metro nhanh nối sân bay Tân Sơn Nhất và Long Thành có thể rút ngắn thời gian di chuyển còn 30-40 phút, thay vì 1,5-5 giờ như hiện nay.  Ngân hàng, doanh nghiệp nào đủ điều kiện được sản xuất vàng miếng? 7 giờ trước19:0813/7/2025Kinh doanhKinh doanh 0 NHNN đang xem xét cấp giấy phép sản xuất vàng miếng cho doanh nghiệp phải có vốn điều lệ từ 1.000 tỷ đồng trở lên; còn ngân hàng thì phải có vốn từ 50.000 tỷ đồng trở lên."
ZNews,https://znews.vn/gia-han-thoi-gian-nhan-ho-so-mua-du-an-nha-o-xa-hoi-hot-nhat-da-nang-post1568243.html,Kinh doanh,Null,"Chủ nhật, 13/7/2025 16:09 (GMT+7)",Gia hạn thời gian nhận hồ sơ mua dự án nhà ở xã hội 'hot' nhất Đà Nẵng,"Ngày 12/7, Sở Xây dựng TP Đà Nẵng cho biết vừa có văn bản thông báo về thời gian tiếp nhận hồ sơ đăng ký mua nhà ở xã hội tại Khối nhà A, B thuộc dự án Chung cư cho người thu nhập thấp tại Khu dân cư An Trung 2. Đà Nẵng gia hạn thời gian tiếp nhận hồ sơ mua nhà ở xã hội ở dự án An Trung 2. Theo đó, vì số lượng người dân liên hệ nộp hồ sơ còn nhiều nên chủ đầu tư dự án sẽ gia hạn thời gian tiếp nhận hồ sơ. Cụ thể, chủ đầu tư sẽ bố trí phát phiếu thứ tự hẹn nộp hồ sơ đến hết 17h ngày 22/7. Đồng thời, thời gian tiếp nhận hồ sơ cũng được gia hạn đến khi giải quyết hết số phiếu hẹn được phát ra. Thời gian phát phiếu thứ tự hẹn nộp hồ sơ và tiếp nhận hồ sơ là từ 8h15 đến 11h45 và 13h45 đến 17h hàng ngày. Trước đó, chiều 11/7, nhiều người dân đến lấy phiếu thứ tự hẹn nộp hồ sơ tá hỏa khi đọc được thông báo ""hết số"". Người dân bức xúc bởi còn hơn 10 ngày nữa mới tới hạn chót nộp hồ sơ theo thông báo của Sở Xây dựng. Người dân xếp hàng chờ nộp hồ sơ dự án nhà ở xã hội An Trung 2. Được biết, Sở Xây dựng TP Đà Nẵng thông báo thời gian tiếp nhận hồ sơ đăng ký mua nhà ở xã hội tại dự án Khu dân cư An Trung 2 là từ ngày 30/6 đến 22/7. Ngay từ ngày đầu tiếp nhận hồ sơ, hàng trăm người dân đã ""đội nắng"" xếp hàng hàng giờ đồng hồ để nhận phiếu thứ tự hẹn nộp hồ sơ. Dự án chung cư cho người thu nhập thấp tại Khu dân cư An Trung 2 nằm ở vị trí đắc địa ở Đà Nẵng, nhận được sự quan tâm của đông đảo người dân. Dự án gồm 3 khối nhà chung cư cao tầng với tổng cộng 957 căn hộ. Trong đợt này, có 633 căn hộ được mở bán ra thị trường, gồm 288 căn tại khối A và 345 căn tại khối B.  Đà Nẵng đấu giá lô đất vàng liên quan 'Vũ nhôm' thu gần 360 tỷ đồng Khu đất 16 Bạch Đằng (phường Hải Châu, TP Đà Nẵng) đã được đấu giá thành công, với mức giá hơn 359 tỷ đồng.  Hàng trăm người xếp hàng mua nhà ở xã hội tại TP Đà Nẵng Hàng trăm người dân đội nắng xếp hàng mua dự án nhà ở xã hội An Trung (quận Sơn Trà, TP Đà Nẵng). Nhiều người cho biết đã xếp hàng từ chiều hôm qua (29/6) để được vào bốc số.  Bánh mì 208.000 đồng ở sân bay: Cần làm rõ, không để khách bị bắt chẹt 5 giờ trước21:2113/7/2025Kinh doanhKinh doanh 0 Nhiều ý kiến cho rằng nên công khai, minh bạch giá cho thuê mặt bằng ở khu vực sân bay để các dịch vụ tại đây không có cớ ""tát nước theo mưa"", bắt chẹt hành khách."
ZNews,https://znews.vn/de-xuat-mien-thue-6-12-thang-cho-ho-kinh-doanh-chuyen-doi-hoa-don-post1568315.html,Kinh doanh,Null,"Chủ nhật, 13/7/2025 17:23 (GMT+7)",Đề xuất miễn thuế 6-12 tháng cho hộ kinh doanh chuyển đổi hóa đơn,"VCCI đề xuất xem xét miễn hoặc giảm thuế trong 6-12 tháng đầu nhằm hỗ trợ giai đoạn chuyển đổi cho hộ kinh doanh. Ảnh:Việt Hùng. Theo kết quả khảo sát do Ban Pháp chế, Liên đoàn Thương mại và Công nghiệp Việt Nam (VCCI) thực hiện trong giai đoạn ngày 7-30/6 với 1.368 hộ kinh doanh trên toàn quốc cho thấy 94% số hộ được khảo sát đã biết đến Nghị định 70. Tuy nhiên, chỉ 11% hiểu rõ nghĩa vụ của mình, 68% chỉ hiểu sơ bộ và 21% hoàn toàn không nắm rõ. Đáng chú ý, hơn 50% số hộ kinh doanh cho biết chưa nhận được sự hỗ trợ cụ thể từ cơ quan thuế địa phương. Tỷ lệ hộ nhận được hướng dẫn “rất rõ ràng” chỉ đạt 14%. Có tới 60% hộ kinh doanh trong lĩnh vực dịch vụ ăn uống được khảo sát cho biết chưa được liên hệ hoặc hỗ trợ. VCCI cũng ghi nhận những mối lo ngại phổ biến của hộ kinh doanh, trong đó 57% lo ngại chi phí đầu tư ban đầu, 54% lo chi phí vận hành hàng tháng, 51% lo áp lực cạnh tranh và 49% lo ngại về thời gian, công sức quản lý hóa đơn, chứng từ. Thậm chí tới 63% số hộ dự kiến phải thu hẹp quy mô hoạt động, 21% có thể tạm ngừng kinh doanh và 3% đang cân nhắc khả năng đóng cửa. Theo đánh giá của VCCI, các yếu tố như thiếu hiểu biết về công nghệ, thủ tục khó khăn, gánh nặng tài chính và thiếu hỗ trợ từ cơ quan chức năng đang là rào cản lớn với nhóm hộ kinh doanh, vốn là đối tượng dễ bị tổn thương khi có thay đổi chính sách. Để chính sách mới được thực thi hiệu quả và bền vững, VCCI kiến nghị các cơ quan quản lý cần tăng cường hướng dẫn bằng các hình thức dễ tiếp cận như sổ tay, infographic, video, tập huấn thực tế và thiết lập đường dây nóng hoạt động thực chất để hỗ trợ kịp thời. Đồng thời, cần thống nhất sử dụng một số phần mềm quản lý đạt chuẩn nhằm tránh tình trạng phân mảnh, tốn kém. VCCI cũng đề xuất xem xét miễn hoặc giảm thuế trong 6-12 tháng đầu nhằm hỗ trợ giai đoạn chuyển đổi. Bên cạnh đó, không nên truy thu hay xử phạt các sai sót không cố ý trong thời gian đầu áp dụng chính sách; đồng thời nên miễn yêu cầu cung cấp căn cước công dân trong hóa đơn đối với các giao dịch nhỏ lẻ, thường xuyên như tại quán ăn, cửa hàng tạp hóa. VCCI nhấn mạnh cần tăng cường vai trò của các hiệp hội doanh nghiệp trong việc phổ biến chính sách và hỗ trợ hộ kinh doanh tiếp cận, triển khai hiệu quả. “Hộ kinh doanh là lực lượng kinh tế quan trọng nhưng cũng là nhóm dễ bị tổn thương nhất khi chính sách thay đổi đột ngột, vì vậy rất cần sự hỗ trợ thích đáng. Lực lượng này đang được xác định là nền tảng phát triển hàng triệu doanh nghiệp quy mô nhỏ, vừa và thậm chí lớn trong thời gian tới. Do đó, nuôi dưỡng khu vực hộ kinh doanh cũng chính là tạo động lực cho việc thực hiện thành công Nghị quyết 68 của Bộ Chính trị”, Phó tổng thư ký VCCI Đậu Anh Tuấn khẳng định. Tri Thức - Znewsgiới thiệu độc giảTủ sách kiến thức kinh tếvới đa dạng cuốn sách, câu chuyện trong lĩnh vực kinh doanh, kinh tế. Những cuốn sách, câu chuyện trong Tủ sách không đơn thuần là những tác phẩm của tri thức mà còn chứa đựng bí quyết, kinh nghiệm quý báu từ các tác giả, nhà quản lý có uy tín và kinh nghiệm lâu năm trong ngành. Đọc sách không chỉ giúp tiếp cận những kiến thức mới mà còn giúp mở rộng tầm nhìn và phát triển bản thân. Tủ sách kiến thức kinh tế mong muốn lan tỏa tri thức trong lĩnh vực kinh doanh, đồng thời phát triển văn hóa đọc cho người Việt.  Những trường hợp nào bị từ chối cấp đăng ký hộ kinh doanh? Từ 1/7, hai trường hợp sẽ bị cơ quan đăng ký kinh doanh cấp xã từ chối cấp đăng ký hộ kinh doanh theo quy định tại Nghị định 168/2025/NĐ-CP.  Cục Thuế nêu loạt giải pháp tăng quản lý với hộ kinh doanh Cục Thuế tham mưu Bộ Tài chính ban hành nhiều văn bản chỉ đạo; đề xuất sửa đổi, hoàn thiện một loạt chính sách pháp luật thuế... nhằm tăng quản lý thuế đối với hộ kinh doanh.  Trăm nghìn tiểu thương đăng ký hộ kinh doanh trong một tháng Báo cáo mới nhất của Bộ Tài chính ghi nhận chỉ trong tháng 6 đã có trên 124.300 hộ kinh doanh đăng ký mới, tương ứng mức tăng tới 118% so với cùng kỳ năm ngoái."
