Source,URL,Category,Keyword,Time,Title,Content
ZNews,https://znews.vn/lee-kang-in-quyet-den-premier-league-post1563230.html,Thể thao,Null,"Thứ ba, 24/6/2025 07:24 (GMT+7)",Lee Kang-in quyết đến Premier League,"Lee Kang-in đứng trước ngã rẽ quan trọng trong sự nghiệp. TheoFootball Asian, tiền vệ người Hàn Quốc gần như không còn khả năng chuyển đếnNapoli, dù viễn cảnh anh rời Paris Saint-Germain đã rất gần. Lee Kang-in muốn chuyển đếnPremier Leaguethi đấu, thay vì sangSerie A. Về phần Paris Saint-Germain, CLB nước Pháp sẵn sàng để Lee Kang-in rời đội nếu thu về được khoản tiền từ 30-40 triệu euro. Số tiền này không lớn, hoàn toàn nằm trong khả năng chi trả của các CLB Premier League. Yêu cầu tài chính cao của PSG lẫn Lee Kang-in khiến Napoli, AC Milan hayJuventuskhả năng cao phải bỏ cuộc trong thương vụ này. Các yếu tố về tài chính và tham vọng thể thao của ba câu lạc bộ Italy không đủ sức cạnh tranh với sức mạnh kinh tế và tầm vóc của các đội bóng tại Premier League. Arsenal, Manchester United và Aston Villa được cho là những ứng cử viên hàng đầu cho cuộc đua giành chữ ký của Lee Kang-in. Các nguồn tin tiết lộ vớiLe Parisienrằng đại diện của Lee Kang-in tiến hành thảo luận với nhiều đội bóng tại Premier League, và cầu thủ này cũng hào hứng với khả năng chuyển đến Anh chơi bóng. Lee Kang-in ký hợp đồng 5 năm với PSG vào mùa hè năm 2023, giành được hai danh hiệu Ligue 1, nhiều thời điểm gây ấn tượng ở vai trò tiền vệ công hoặc ""tiền đạo ảo"". Tuy nhiên, mũi nhọn người Hàn Quốc gặp khó khăn trong việc tìm kiếm thời gian thi đấu ở nửa sau mùa giải năm nay. Đặc biệt khi PSG chơi bùng nổ ở giai đoạn loại trực tiếpChampions Leaguemùa này, dấu ấn của Lee Kang-in ngày càng mờ nhạt. Sự xuất hiện của Desire Doué và bản hợp đồng tháng 1, Khvicha Kvaratskhelia, khiến Lee Kang-in không thể cạnh tranh cho vị trí đá chính trên hàng công. Ở băng ghế dự bị, HLV Luis Enrique cũng thích sử dụng Gonçalo Ramos và Bradley Barcola. Tại hàng tiền vệ, Lee Kang-in cũng không thể cạnh tranh với Fabian Ruiz, Vitinha và João Neves hay Warren Zaïre-Emery. Tủ             sách thể thaomang tới những câu chuyện thể thao quá khứ và         hiện tại, những bí mật hậu trường, những giải đấu, ký ức của         những cựu danh thủ, HLV, các huyền thoại như Sir Alex Ferguson,         Steven Gerrard, Park Hang-seo, Lê Công Vinh...  Số phận quá tàn nhẫn với Atletico Madrid Atletico
Madrid rời FIFA
Club World Cup 2025™ trong một kịch bản cay đắng đến lạ
lùng.  Atletico và cú trượt giá 17,5 triệu euro 6 giờ trước20:2824/6/2025Thể thaoThể thao 0 Atletico Madrid rời FIFA
Club World Cup 2025™ với vẻn vẹn 22,7 triệu euro tiền
thưởng -
con số không nhỏ, nhưng vẫn là một thất bại nếu nhìn vào tiềm năng tài chính và
thể thao mà giải đấu này có thể mang lại.  'Hazard mới' khiến Barcelona mê mẩn 7 giờ trước20:0024/6/2025Thể thaoThể thao 0 Barcelona chuẩn bị ký hợp đồng với tài năng trẻ Roony Bardghji từ Copenhagen với mức phí 2,5 triệu euro."
ZNews,https://znews.vn/messi-gian-du-du-inter-miami-di-tiep-post1563302.html,Thể thao,Null,"Thứ ba, 24/6/2025 13:28 (GMT+7)",Messi giận dữ dù Inter Miami đi tiếp,"Lionel Messi bực bội vì Inter Miami đánh rơi chiến thắng. Sáng 24/6, Messi rời sân Hard Rock với vẻ mặt không hài lòng sau khi Inter Miami đánh rơi chiến thắng từ thế dẫn trước hai bàn, để Palmeiras gỡ hòa 2-2 trong trận đấu có ý nghĩa quyết định ngôi đầu bảng A. Siêu sao người Argentina bực bội ra mặt, cởi áo bước đi với tâm trạng không vui. TheoMiami Herald,Leo không hài lòng khi đội bóng để tuột cơ hội giành ngôi đầu bảng. Inter Miami bước vào trận đấu cuối vòng bảng FIFA Club World Cup với quyết tâm cao. Ngay phút 16, Tadeo Allende mở tỷ số, giúp đội bóng giảm bớt áp lực. Đến phút 65, Luis Suárez nhân đôi cách biệt, mang lại cảm giác an toàn cho Inter Miami và khiến người hâm mộ tin rằng suất đi tiếp đã nằm chắc trong tay. Với lợi thế hai bàn, đội bóng của huấn luyện viên Javier Mascherano dường như nắm quyền kiểm soát trận đấu. Tuy nhiên, trong 7 phút định mệnh cuối trận, Palmeiras tạo nên một cuộc rượt đuổi tỷ số ngoạn mục. Paulinho rút ngắn tỷ số ở phút 80, trước khi Mauricio gỡ hòa 2-2 ở phút 87, đẩy Inter Miami vào tình thế khó. May mắn thay, tỷ số hòa được giữ đến hết trận, đảm bảo cho Inter Miami tấm vé vào vòng 16 đội với tư cách nhì bảng A, dù họ bỏ lỡ cơ hội đứng đầu. Sự bực tức củaLionel Messiđược ghi nhận ngay sau tiếng còi mãn cuộc. Sự thất vọng của Messi không khó hiểu, bởi việc để thủng lưới hai bàn chỉ trong 7 phút cuối trận khiến Inter Miami phải đối mặt với Paris Saint-Germain – nhà vô địch châu Âu và ứng viên hàng đầu của giải – ở vòng 16 đội. Trong khi đó, Palmeiras sẽ gặp Botafogo, đối thủ nhẹ nhàng hơn ở cặp đấu còn lại. Tủ             sách thể thaomang tới những câu chuyện thể thao quá khứ và         hiện tại, những bí mật hậu trường, những giải đấu, ký ức của         những cựu danh thủ, HLV, các huyền thoại như Sir Alex Ferguson,         Steven Gerrard, Park Hang-seo, Lê Công Vinh...  Atletico và cú trượt giá 17,5 triệu euro 6 giờ trước20:2824/6/2025Thể thaoThể thao 0 Atletico Madrid rời FIFA
Club World Cup 2025™ với vẻn vẹn 22,7 triệu euro tiền
thưởng -
con số không nhỏ, nhưng vẫn là một thất bại nếu nhìn vào tiềm năng tài chính và
thể thao mà giải đấu này có thể mang lại.  'Hazard mới' khiến Barcelona mê mẩn 7 giờ trước20:0024/6/2025Thể thaoThể thao 0 Barcelona chuẩn bị ký hợp đồng với tài năng trẻ Roony Bardghji từ Copenhagen với mức phí 2,5 triệu euro.  Dàn tài năng trẻ tỏa sáng ở FIFA Club World Cup 7 giờ trước20:0024/6/2025Thể thaoThể thao 0 Những ngôi sao trẻ như Igor Jesus, Estevao Willian, và Jhon Arias dần khẳng định giá trị tại FIFA Club World Cup 2025™."
ZNews,https://znews.vn/gareth-bale-khien-xu-wales-ngo-ngang-post1563306.html,Thể thao,Null,"Thứ ba, 24/6/2025 13:27 (GMT+7)",Gareth Bale khiến xứ Wales ngỡ ngàng,"Gareth Bale muốn đầu tư vào bóng đá. Đầu tuần này, Bale xác nhận đang dẫn đầu một nhóm nhà đầu tư với tham vọng mua lại Cardiff City, đội bóng gắn bó với tuổi thơ của mình. Mục tiêu của Bale là đưa “Bluebirds” trở lại Premier League, đánh dấu chương mới trong sự nghiệp kinh doanh và làm bóng đá sau khi giải nghệ. Thông tin về kế hoạch mua lại Cardiff City của Bale được anh chia sẻ công khai lần đầu tiên tại sự kiện ra mắt bộ phim F1 The Movie. Đây là lần hiếm hoi cựu cầu thủ Real Madrid lên tiếng về ý định sở hữu Cardiff City, đội bóng anh luôn dành tình yêu đặc biệt. Bale bày tỏ sự lạc quan về khả năng đạt được thỏa thuận với chủ sở hữu hiện tại của Cardiff, ông Vincent Tan. Tuần trước,Wales Onlineđưa tin nhóm đầu tư của Bale đưa ra một lời đề nghị mua lại Cardiff City, nhưng bị ông Tan từ chối. Tuy nhiên, việc Bale công khai tuyên bố về thương vụ này cho thấy cựu danh thủ Real Madrid sẽ không bỏ cuộc. “Chúng tôi rất quan tâm đến việc sở hữu Cardiff”, Bale tuyên bố. “Đó là đội bóng quê hương của tôi, nơi tôi lớn lên, và chú tôi, Chris Pike, từng thi đấu cho họ. Được tham gia vào nhóm cổ đông sở hữu CLB sẽ là giấc mơ thành hiện thực”. Bale thể hiện tình cảm đặc biệt cho Cardiff City, đội bóng anh xem như một phần không thể tách rời trong cuộc đời mình: “Đó là câu lạc bộ gần gũi với trái tim tôi. Tôi muốn góp phần đưa Cardiff phát triển và trở lại Premier League, nơi đội bóng thuộc về”. Bale cũng ca ngợi người hâm mộ Cardiff và xứ Wales, nhấn mạnh rằng việc cùng họ xây dựng một tương lai tươi sáng cho đội bóng sẽ là điều “tuyệt vời”. Với tài sản khổng lồ và kinh nghiệm kinh doanh, Bale có thể là nhân tố thay đổi vận mệnh Cardiff City. Cardiff City sa sút dưới thời tỷ phú Vincent Tan. CLB này vừa trải qua mùa giải Championship 2024/25 đáng thất vọng, dẫn đến việc họ xuống hạng và phải thi đấu ở League One – thuộc hạng ba bóng đá Anh. Trong bối cảnh khó khăn này, kế hoạch của Bale mang đến hy vọng cho người hâm mộ về một sự hồi sinh. Bale, với tư cách là huyền thoại bóng đá xứ Wales, đang tìm cách để lại dấu ấn ngoài sân cỏ sau khi giải nghệ, và Cardiff City có thể là điểm khởi đầu cho di sản mới của anh. Trước đó, có tin đồn Bale quan tâm đến việc đầu tư vào Plymouth Argyle, nhưng kế hoạch này không thành hiện thực. Thực tế, Bale cũng chỉ muốn dồn tâm huyết cho Cardiff City, tập trung vào việc xây dựng đội bóng này trở thành thế lực trong tương lai của Premier League. Xứ Wales chỉ có hai CLB bóng đá lớn nhất hiện tại là Swansea và Cardiff. Tuy nhiên, hai CLB này sa sút và không còn chơi ở Ngoại hạng Anh từ lâu. Kế hoạch mua lại Cardiff City của Gareth Bale không chỉ là một thương vụ kinh doanh mà còn là câu chuyện về tình yêu quê hương và khát vọng để lại di sản. Với tư cách là biểu tượng bóng đá xứ Wales, Bale đang nỗ lực biến giấc mơ đưa Cardiff trở lại Premier League thành hiện thực. Dù con đường phía trước còn nhiều thử thách, sự quyết tâm và tầm nhìn của Bale đã thắp lên hy vọng cho người hâm mộ Cardiff City. Tủ             sách thể thaomang tới những câu chuyện thể thao quá khứ và         hiện tại, những bí mật hậu trường, những giải đấu, ký ức của         những cựu danh thủ, HLV, các huyền thoại như Sir Alex Ferguson,         Steven Gerrard, Park Hang-seo, Lê Công Vinh...  Ansu Fati kết thúc chuỗi ngày ác mộng Ansu Fati có thể rời Barcelona ngay trong tuần này, khi cầu thủ đạt thỏa thuận cá nhân với AS Monaco.  Atletico và cú trượt giá 17,5 triệu euro 6 giờ trước20:2824/6/2025Thể thaoThể thao 0 Atletico Madrid rời FIFA
Club World Cup 2025™ với vẻn vẹn 22,7 triệu euro tiền
thưởng -
con số không nhỏ, nhưng vẫn là một thất bại nếu nhìn vào tiềm năng tài chính và
thể thao mà giải đấu này có thể mang lại.  'Hazard mới' khiến Barcelona mê mẩn 7 giờ trước20:0024/6/2025Thể thaoThể thao 0 Barcelona chuẩn bị ký hợp đồng với tài năng trẻ Roony Bardghji từ Copenhagen với mức phí 2,5 triệu euro."
ZNews,https://znews.vn/jonny-evans-tiep-tuc-gan-bo-voi-mu-post1563224.html,Thể thao,Null,"Thứ ba, 24/6/2025 06:39 (GMT+7)",Jonny Evans tiếp tục gắn bó với MU,"Theo tiết lộ từTheAthletic, ban lãnh đạo ""Quỷ đỏ"" muốn giữ chân cựu trung vệ 37 tuổi bằng một vị trí trong bộ phận hậu trường, sau khi anh hết hạn hợp đồng thi đấu vào hè này. Dù không còn góp mặt trên sân, Evans vẫn sẽ đóng vai trò quan trọng trong việc định hình tương lai CLB. Anh sẽ phụ trách công tác cho mượn cầu thủ trẻ. ""Đây là lĩnh vực cần sự tinh tế và hiểu biết sâu sắc về phát triển tài năng trẻ"", nguồn tin viết. Ban lãnh đạo MU đặc biệt ấn tượng với tầm ảnh hưởng của Evans trong phòng thay đồ. Anh thường xuyên đưa ra lời khuyên quý giá cho các cầu thủ trẻ và nhấn mạnh tầm quan trọng của việc hiểu và gìn giữ bản sắc MU. Trong chuyến du đấu hè tại Mỹ năm ngoái, Evans cũng từng lên tiếng bảo vệ các nhân viên CLB khi họ đối mặt với làn sóng sa thải. Evans ra sân 107 lần cho tuyển quốc gia, ghi 6 bàn và là trụ cột của đội hình Bắc Ireland tại Euro 2016. Ở cấp CLB, Evans gia nhập MU mùa 2008/09 và phải cạnh tranh với Rio Ferdinand và Nemanja Vidic. Anh gắn bó với CLB trong 9 mùa giải, giành 3 chức vô địchPremier League. Năm 2023, Erik ten Hag đưa Evans trở lại MU dưới dạng chuyển nhượng miễn phí. Quyết định ban đầu bị hoài nghi nhưng cuối cùng lại là đúng đắn khi anh góp phần giúp đội bóng vô địch FA Cup 2024, với chiến thắng 2-1 trước Man City. MU cũng chia tay Christian Eriksen và Victor Lindelof khi mùa giải 2024/25 khép lại. Riêng thủ môn số 3 Tom Heaton được đề nghị gia hạn thêm một năm. Cuốn sách “Fear and Loathing in La Liga”của nhà báo thể thao nổi tiếng Sid Lowe, một chuyên gia về bóng đá Tây Ban Nha trênGuardian, xuất bản năm 2014, kể về những chuyện trong và ngoài sân cỏ xoay quanh các trận El Clasico xuyên suốt lịch sử.  3 cầu thủ rời Manchester United Tối 9/6 (giờ Hà Nội), MU xác nhận chia tay cùng lúc Christian Eriksen, Victor Lindelof và Jonny Evans do hết hợp đồng.  Jonny Evans giải nghệ Theo The Athletic, Jonny Evans có trận đấu cuối cùng với Manchester United khi góp mặt 45 phút trong chiến thắng 3-1 trước tuyển Hong Kong (Trung Quốc) hôm 30/5.  Điều chưa từng xảy ra với MU suốt hơn 50 năm Jonny Evans chia tay MU đồng nghĩa lần đầu tiên kể từ mùa giải 1973/74, đội hình MU sẽ không còn một cầu thủ nào từng thi đấu dưới thời Sir Alex Ferguson."
ZNews,https://znews.vn/mbappe-tai-xuat-post1563218.html,Thể thao,Null,"Thứ ba, 24/6/2025 06:11 (GMT+7)",Mbappe tái xuất,"Mbappe trở lại tập luyện. Ảnh:Reuters. Tiền đạo người Pháp nở nụ cười trên sân tập của Real Madrid hôm 23/6, cho thấy chân sút này khỏi bệnh và có thể ra sân ở trận cuối cùng tại bảng H gặp Salzburg vào ngày 27/6. Trước đó, Mbappe vắng mặt trong trận hòa 1-1 với Al Hilal hôm 18/6, sau khi phải nhập viện trong tuần này. Tiền đạo người Pháp không cùng đội bóng di chuyển đến Charlotte, Bắc Carolina để đối đầu với Pachuca trong trận đấu rạng sáng 23/6. HLV Xabi Alonso cho biết Mbappe bị viêm dạ dày cấp nghiêm trọng tại Miami, khiến anh phải nhập viện. Sau khi xuất viện, anh phải ở lại khách sạn để hồi phục và tập điều trị. Chân sút này phải dùng thực đơn riêng theo chỉ định của bác sĩ để đẩy nhanh quá trình hồi phục. Truyền thông Tây Ban Nha cho biết Mbappe bị sụt cân đáng kể. Do đó, buổi tập được thiết kế nhằm giúp anh bù nước, hồi phục thể trạng và trở về trạng thái ổn định. Mbappe xuất hiện tươi tắn trên sân tập. Ảnh:Reuters. Sự trở lại của Mbappe đúng vào thời điểm Real Madrid sắp vượt qua vòng bảng và góp mặt tại lượt trận knock-out. ""Los Blancos"" đang dẫn đầu bảng H với 4 điểm, ngang Salzburg nhưng hơn hiệu số. Để đảm bảo suất vào vòng tiếp theo, Real cần tránh thất bại trước Salzburg. Nếu để thua, số phận của họ sẽ phụ thuộc vào kết quả trận Al Hilal gặp Pachuca. Chỉ cần Al Hilal không thắng, đội bóng của HLV Xabi Alonso vẫn sẽ tiến vào vòng knock-out. Mbappe là nhân tố quan trọng trong đội hình của Real Madrid, với 43 bàn sau 56 lần ra sân ở mùa 2024/25. Sự vắng mặt của anh đã gây ảnh hưởng lớn đến sức mạnh hàng công của đội bóng ở hai trận đầu FIFA Club World Cup 2025™. Xem FIFA Club World Cup 2025™ trực tiếp và duy nhất tại Việt Nam trên FPT Play, tại http://fptplay.vn Mục Thể thao giới thiệu cuốn“Death or Glory: The Dark History of the World Cup”của tác giả Jon Spurling vào năm 2010. Cuốn sách viết về những chuyện hậu trường xung quanh các đội bóng lớn như Brazil, Argentina, Italy, Đức... xuyên suốt các kỳ World Cup từ 1930 đến 2006.  Casemiro sắp rời MU 21 giờ trước05:4524/6/2025Thể thaoThể thao 0 Manchester United đang tiến rất gần tới việc chia tay tiền vệ kỳ cựu Casemiro.  Bàn thắng gây sốt của Hakimi 21 giờ trước05:5824/6/2025Thể thaoThể thao 0 Hậu vệ Achraf Hakimi để lại màn trình diễn ấn tượng trong chiến thắng 2-0 của PSG trước Seattle Sounders tại lượt cuối bảng B, FIFA Club World Cup 2025™ rạng sáng 24/6.  Santos ra phán quyết tương lai Neymar 21 giờ trước05:5924/6/2025Thể thaoThể thao 0 Chủ tịch CLB Santos, Marcelo Teixeira, hy vọng gia hạn hợp đồng thành công với Neymar trong mùa hè này."
ZNews,https://znews.vn/inter-miami-kiem-bon-tien-nho-lam-nen-lich-su-post1563294.html,Thể thao,Null,"Thứ ba, 24/6/2025 12:45 (GMT+7)",Inter Miami kiếm bộn tiền nhờ làm nên lịch sử,"Inter Miami trở thành lá cờ đầu cho MLS tại FIFA Club World Cup 2025. Dù không thể giữ ngôi đầu bảng A, thành tích này vẫn mang lại nguồn tài chính đáng kể và đánh dấu bước tiến quan trọng của đại diện MLS trên đấu trường quốc tế. TheoAS, với việc góp mặt tại FIFA Club World Cup 2025™, Inter Miami đã nhận9,5 triệu USDtiền thưởng tham dự. Với một chiến thắng và hai trận hòa ở vòng bảng, họ kiếm thêm4,2 triệu USD. Quan trọng hơn, việc lọt vào vòng 16 đội đảm bảo cho Inter Miami thêm7,9 triệu USD, nâng tổng số tiền thưởng tại giải lên mức tổng21,6 triệu USD. Con số này đủ để chi trả phần lớn khoản lương hàng năm của Lionel Messi, cầu thủ có thu nhập cao nhất MLS. So với các đại diện khác của MLS như LAFC và Seattle Sounders, những đội bóng đã bị loại, Inter Miami đang là niềm tự hào của giải đấu nhà nghề Mỹ. Khoản tiền thưởng khổng lồ từ FIFA không chỉ giúp Inter Miami cải thiện tài chính mà còn tạo động lực để họ tiếp tục đầu tư vào đội hình và cơ sở hạ tầng. Inter Miami trở thành đội bóng đầu tiên của MLS tiến vào vòng knock-out của FIFA Club World Cup. Thậm chí, họ còn trở thành đội đầu tiên của khu vực CONCACAF bất bại tới 3 trận liên tiếp ở một kỳ FIFA Club World Cup. Trước Inter Miami, các đội của CONCACAF hầu như chơi rất tệ tại giải vô địch thế giới các CLB. Trước đó, đoàn quân của huấn luyện viên Javier Mascherano trở thành đội bóng MLS đầu tiên giành chiến thắng tại FIFA Club World Cup. Họ cũng là câu lạc bộ đầu tiên của CONCACAF đánh bại một đối thủ từ châu Âu trong một giải đấu chính thức. Bị đánh giá thấp nhất trong số các đội của khu vực CONCACAF dự FIFA Club World Cup 2025, nhưng Inter Miami làm đảo lộn mọi dự đoán. Tủ             sách thể thaomang tới những câu chuyện thể thao quá khứ và         hiện tại, những bí mật hậu trường, những giải đấu, ký ức của         những cựu danh thủ, HLV, các huyền thoại như Sir Alex Ferguson,         Steven Gerrard, Park Hang-seo, Lê Công Vinh...  Ansu Fati kết thúc chuỗi ngày ác mộng Ansu Fati có thể rời Barcelona ngay trong tuần này, khi cầu thủ đạt thỏa thuận cá nhân với AS Monaco.  Atletico và cú trượt giá 17,5 triệu euro 6 giờ trước20:2824/6/2025Thể thaoThể thao 0 Atletico Madrid rời FIFA
Club World Cup 2025™ với vẻn vẹn 22,7 triệu euro tiền
thưởng -
con số không nhỏ, nhưng vẫn là một thất bại nếu nhìn vào tiềm năng tài chính và
thể thao mà giải đấu này có thể mang lại.  'Hazard mới' khiến Barcelona mê mẩn 7 giờ trước20:0024/6/2025Thể thaoThể thao 0 Barcelona chuẩn bị ký hợp đồng với tài năng trẻ Roony Bardghji từ Copenhagen với mức phí 2,5 triệu euro."
ZNews,https://znews.vn/sancho-dong-y-toi-ben-do-moi-post1563404.html,Thể thao,Null,"Thứ ba, 24/6/2025 19:54 (GMT+7)",Sancho đồng ý tới bến đỗ mới,"Sancho đồng ý gia nhập Fenerbahce. Jadon Sancho đang tiến gần hơn bao giờ hết tới cánh cửa rời Manchester United, với điểm đến khả thi là Thổ Nhĩ Kỳ. Dù trước đó nhận được sự quan tâm từJuventusvàNapoli, ngôi sao người Anh đạt thỏa thuận cá nhân với Fenerbahce, theo xác nhận đồng loạt từ truyền thông Thổ Nhĩ Kỳ. Cựu cầu thủDortmundđược cho là sẽ nhận mức lương khoảng 8,5 triệu bảng mỗi mùa tại đội bóng mới. Dù con số này thấp hơn so với những gì anh đang hưởng tại MU, việc chuyển sang thi đấu tại Thổ Nhĩ Kỳ - nơi có mức thuế thu nhập thấp hơn nhiều so với Anh - sẽ giúp Sancho vẫn “giữ nguyên” thu nhập ròng sau thuế. Hiện tại, Fenerbahce chuẩn bị bắt đầu đàm phán với Manchester United. Trong bối cảnh “Quỷ đỏ” rất muốn thanh lý Sancho để tái cấu trúc đội hình dưới thời HLV Ruben Amorim, một thỏa thuận hoàn tất có thể diễn ra trong vài tuần tới. MU ban đầu đặt kỳ vọng thu về khoảng 25 triệu bảng - mức giá tương đương với điều khoản mua đứt màChelseatừng chấp nhận. Tuy nhiên, không loại trừ khả năng họ sẽ nhượng bộ, giảm giá để chốt thương vụ càng sớm càng tốt. Sancho được MU chiêu mộ với giá 73 triệu bảng từ Dortmund vào mùa hè 2021. Thế nhưng, sự nghiệp của anh tại Old Trafford chưa bao giờ khởi sắc như kỳ vọng. Sau 83 lần ra sân cho đội bóng thành Manchester, cầu thủ sinh năm 2000 chỉ ghi được 12 bàn và có 6 pha kiến tạo - những con số không tương xứng với giá trị và tiềm năng của anh. Mâu thuẫn với HLV Erik ten Hag gần như đặt dấu chấm hết cho tương lai của Sancho tại MU. Anh bị đẩy trở lại Dortmund theo dạng cho mượn ở nửa sau mùa giải 2023/24, trước khi trở lại sân Old Trafford hè vừa rồi. Tuy nhiên, việc Ten Hag tiếp tục không đưa Sancho vào kế hoạch khiến MU tiếp tục đẩy cầu thủ sang Chelsea cũng theo dạng cho mượn, kèm điều khoản mua đứt trị giá 25 triệu bảng. Cuốn tự truyện “Basta: My Life, My Truth” xuất bản năm 2019của kể lại sự nghiệp Marco van Basten dưới góc nhìn thứ nhất. Huyền thoại người Hà Lan khép lại sự nghiệp ở tuổi 28 khi dính chấn thương mắt cá.  MU và Juve thảo luận trao đổi Sancho, Vlahovic Juventus và MU đang thương thảo về một thương vụ đổi người, qua đó có thể giải quyết vấn đề liên quan đến cả Dusan Vlahovic và Jadon Sancho.  Mourinho muốn giải cứu Sancho Fenerbahce và HLV Jose Mourinho hỏi mua Jadon Sancho sau khi Napoli từ bỏ thương vụ này vì mức lương quá cao của tiền đạo người Anh.  Napoli có thể đón 2 tân binh từ MU Napoli đẩy mạnh kế hoạch chiêu mộ Rasmus Hojlund sau khi đạt được thỏa thuận cá nhân với Jadon Sancho."
