Source,URL,Category,Keyword,Time,Title,Content
Tuoi tre,https://tuoitre.vn/tuyen-bong-da-nu-viet-nam-duy-tri-hang-6-chau-a-20250613203300387.htm,,"đội tuyển nữ Việt Nam,Bảng xếp hạng FIFA,Huỳnh Như,Thái Lan,Philippines",13/06/2025 20:51 GMT+7,Tuyển bóng đá nữ Việt Nam duy trì hạng 6 châu Á,"Huỳnh Như cùng đội tuyển Việt Nam đang đặt mục tiêu vào top 5 châu Á - Ảnh: N.K Ở khu vực châu Á, đội tuyển nữ Việt Nam xếp hạng 6 châu Á sau Nhật Bản, CHDCND Triều Tiên, Úc, Trung Quốc và Hàn Quốc. Thầy trò HLVMai Đức Chungcũng tiếp tục giữ vị trí số 1 khu vực Đông Nam Á, trên Philippines (hạng 7 châu Á) và Thái Lan (hạng 9 châu Á). Vị trí này giúp đội tuyển nữ Việt Nam duy trì lợi thế trong các giải đấu quốc tế sắp tới, đồng thời khẳng định sự hiện diện ổn định của bóng đá nữ Việt Nam trên đấu trường châu lục. Ở thế giới, đội tuyển nữ Việt Nam xếp hạng 37. Philippines và Thái Lan lần lượt xếp hạng 41 và 46. Ba vị trí dẫn đầu bóng đá nữ thế giới vẫn thuộc về Mỹ, Tây Ban Nha - đương kim vô địch thế giới và Đức. Đáng chú ý khi Brazil tăng đến 4 bậc trên bảng xếp hạng FIFA để lần đầu trở lại top 4 kể từ năm 2013 nhờ chuỗi trận giao hữu thành công. Cụ thể, các cô gái xứ samba có đến 3 trận thắng trước Mỹ 2-1, Nhật 2-1 và 3-1 để được cộng đến 26,92 điểm. Đội tuyển nữ Việt Nam đang tập huấn tại Osaka (Nhật Bản) nhằm chuẩn bị cho vòng loại Giải bóng đá nữ châu Á 2026, diễn ra tại Việt Trì (Phú Thọ) từ ngày 29-6 tới. Trong khuôn khổ chuyến tập huấn, thầy trò HLV Mai Đức Chung đã đá 2/3 trận giao hữu để hoàn thiện đội hình. Cụ thể, đội tuyển nữ Việt Nam thắng CLB Iga Kunoichi Mie FC 3-2 hôm 11-6 và vừa thắng Đại học Tezukayama Gakuin 3-1 vào chiều 13-6. Huỳnh Như và các đồng đội sẽ tiếp tục thi đấu trận giao hữu cuối cùng với Đại học Khoa học thể thao và sức khỏe Osaka vào ngày 15-6. 2 bàn thắng của tiền đạo Hải Yến và 1 bàn của Nguyễn Thị Vạn giúp đội tuyển nữ Việt Nam lội ngược dòng trước CLB Iga Kunoichi Mie trong trận giao hữu chiều 11-6."
Tuoi tre,https://tuoitre.vn/truy-xet-nhanh-nguoi-phu-nu-cuop-ve-so-tre-tu-tay-tre-em-nguoi-tan-tat-o-phan-thiet-20250613191057597.htm,,"TP Phan Thiết,cướp tiền vé số,Bình Thuận",13/06/2025 20:30 GMT+7,"Truy xét nhanh người phụ nữ cướp vé số từ tay trẻ em, người tàn tật ở Phan Thiết","Công an đưa Nguyễn Thị Kim Ánh ra hiện trường xảy ra vụ cướp giật - Ảnh: Công an Bình Thuận Trước đó, sáng 12-6, bà Lê Thị Thu Hà ở phường Đức Long, TP Phan Thiết đến Công an xã Tiến Lợi trình báo về việc con trai 9 tuổi của bà bị kẻ gian giật tiền và vé số trị giá khoảng 500.000 đồng. Cụ thể, con trai bà Hà đang bán vé số trên đường Trần Quý Cáp, xã Tiến Lợi thì có một phụ nữ chạy xe máy đến hỏi mua 2 tờ. Người này cầm 500.000 đồng trên tay và yêu cầu cháu chuẩn bị 480.000 đồng để thối lại. Sau khi nhận được vé số và tiền thối lại từ cháu, người phụ nữ trên liền tăng ga xe bỏ chạy. Tiếp nhận thông tin, Công an xã Tiến Lợi triển khai lực lượng để truy xét. Qua đó, đơn vị xác định Nguyễn Thị Kim Ánh (37 tuổi, ở xã Hàm Thắng, huyện Hàm Thuận Bắc) là nghi phạm gây ra vụ việc. Lực lượng công an đã nhanh chóng bắt giữ Ánh tại nhà riêng chỉ sau vài giờ tiếp nhận trình báo. Ánh khai nhận do cần tiền tiêu xài nên đã nảy sinh ý định cướp giật tài sản. Để dễ dàng thực hiện hành vi, mục tiêu Ánh nhắm đến chính là những người hạn chế khả năng lao động như người già, trẻ em, người tàn tật đang bán vé số. Ánh cũng thừa nhận đã thực hiện trót lọt nhiều vụ tương tự trong 2 tháng qua. Sau khi chiếm đoạt vé số của nạn nhân, Ánh mang đi bán cho người khác, nếu bán không hết thì dò cầu may. Cơ quan công an đang củng cố hồ sơ, xử lý theo quy định. Sau hơn 2 tiếng truy xét, lực lượng Công an Đồng Nai đã bắt giữ nghi can cướp giật tài sản của người bán vé số đi xe lăn."
Tuoi tre,https://tuoitre.vn/tin-tuc-sang-14-6-tu-1-7-la-cao-diem-tran-ap-toi-pham-lua-dao-nguoi-di-lam-viec-nhe-luong-cao-20250613212614368.htm,,"Bệnh viện Bệnh nhiệt đới,sốt xuất huyết Dengue",14/06/2025 01:09 GMT+7,Tin tức sáng 14-6: Từ 1-7 là cao điểm trấn áp tội phạm lừa đảo người đi làm 'việc nhẹ lương cao',"Các chiến sĩ tham gia diễu binh kỷ niệm 50 năm ngày thống nhất đất nước 30-4 vừa qua - Ảnh: TTO Phó thủ tướng Mai Văn Chính vừa yêu cầu UBND thành phố Hà Nội chủ trì, phối hợp với các bộ: Quốc phòng, Công an, Văn hóa, Thể thao và Du lịch và các cơ quan liên quan khẩn trương hoàn thiện kế hoạch tổ chức Lễ kỷ niệm, diễu binh, diễu hành, báo cáo xin ý kiến Thường trực Ban Chỉ đạo Trung ương trước khi ban hành kế hoạch tổ chức80 năm Quốc khánh; Tập trung chỉ đạo giải phóng mặt bằng để chỉnh trang, mở rộng khu vực Quảng trường Ba Đình tổ chức Lễ kỷ niệm, diễu binh, diễu hành; báo cáo Phó thủ tướng Chính phủ tình hình triển khai thực hiện trước ngày 15-7-2025. Giao Bộ Nội vụ chủ trì, phối hợp với các cơ quan liên quan xây dựng kế hoạch phát động phong trào thi đua yêu nước và hướng dẫn về công tác thi đua, khen thưởng nhân dịp kỷ niệm 80 năm Cách mạng Tháng Tám thành công (19-8-1945 - 19-8-2025) và Quốc khánh nước Cộng hòa xã hội chủ nghĩa Việt Nam (2-9-1945 - 2-9-2025); khẩn trương trình cấp có thẩm quyền khen thưởng tập thể, cá nhân có thành tích phục vụ Lễ kỷ niệm, diễu binh, diễu hành 50 năm Ngày Giải phóng miền Nam, thống nhất đất nước (30-4-1975 - 30-4-2025). Đài Truyền hình Việt Nam chủ trì, phối hợp với các bộ: Quốc phòng, Công an, Văn hóa, Thể thao và Du lịch, UBND thành phố Hà Nội và các cơ quan liên quan chuẩn bị tổ chức tốt truyền hình trực tiếp Lễ kỷ niệm, diễu binh, diễu hành; cầu truyền hình trực tiếp; Chương trình nghệ thuật đặc biệt và một số hoạt động kỷ niệm khác; tập trung nâng cao hơn nữa chất lượng hình ảnh trong truyền hình trực tiếp các hoạt động trọng tâm, nhất là Lễ kỷ niệm, diễu binh, diễu hành. Bộ Quốc phòng chủ trì, phối hợp với các bộ: Công an, Văn hóa, Thể thao và Du lịch và các cơ quan liên quan khẩn trương hoàn thiện và ban hành đề án diễu binh, diễu hành trong tháng 6-2025; tổ chức tốt việc tập luyện, hợp luyện, diễu binh, diễu hành và các nhiệm vụ liên quan; báo cáo Phó thủ tướng Chính phủ tình hình triển khai thực hiện trước ngày 15-7-2025. Theo báo cáo từ VIS Rating,thị trường trái phiếudoanh nghiệp tiếp tục ghi nhận sự sôi động trong tháng 5-2025 với tổng giá trị phát hành mới đạt khoảng 66.000 tỉ đồng, tăng 35% so với tháng trước. Đáng chú ý, toàn bộ lượng phát hành trong tháng đều thuộc hình thức trái phiếu riêng lẻ. Tính chung 5 tháng đầu 2025, tổng lượng phát hành mới đạt 137.000 tỉ, tăng mạnh 79% so với cùng kỳ năm trước. Động lực chính của sự gia tăng này đến từ khối ngân hàng thương mại, với tổng giá trị phát hành đạt khoảng 100.000 tỉ đồng, tương đương mức tăng 193% so với cùng kỳ. Xem tin tức giá vàng mới nhất hôm naytại đây VIS Rating nhận định trong bối cảnh tăng trưởng tín dụng vượt xa huy động, các ngân hàng đang có xu hướng đẩy mạnh phát hành trái phiếu dài hạn để bổ sung nguồn vốn. Dự kiến nửa cuối năm 2025, khối ngân hàng sẽ tiếp tục dẫn dắt thị trường trái phiếu, với kế hoạch phát hành tổng cộng gần 200.000 tỉ. Trong 6 tháng cuối năm 2025, có 474 trái phiếu với tổng dư nợ 150.000 tỉ đồng trái phiếu sẽ đáo hạn, trong đó 148 trái phiếu (tổng dư nợ 25.800 tỉ đồng) đang ở tình trạng chậm trả. Khối bất động sản chiếm một nửa trong tổng giá trị đáo hạn. Trong đó VIS Rating đánh giá có 26 trái phiếu sắp đáo hạn (dư nợ 19.000 tỉ đồng) phát hành bởi 15 công ty bất động sản có nguy cơ chậm trả lần đầu. Một ca sốt xuất huyết nặng điều trị tại cấp cứu nhi Bệnh viện Tiền Giang - Ảnh: BS ÚC NGUYỄN Sở Y tế TP.HCM cho hay theo hệ thống giám sát bệnh truyền nhiễm của TP, từ đầu năm đến tuần 23 (2 đến 8-6), TP đã ghi nhận 8.595 ca mắc sốt xuất huyết Dengue, tăng 131,2% so với cùng kỳ năm 2024 (3.718 ca). Riêng từ 1-5 đến ngày 12-6, TP ghi nhận 766 trường hợp mắc sốt xuất Dengue nhập viện và điều trị (có 324 trường hợp có địa chỉ tại TP, 422 trường hợp là các tỉnh, thành khác đến khám, điều trị). Hiện tổng số bệnh nặng là 291 ca (105 ca tại TP, 186 ca từ các tỉnh, thành khác chuyển đến), tăng so với cùng kỳ năm 2024 là 77 trường hợp bệnh nặng. Hiện chưa ghi nhận trường hợp tử vong do sốt xuất huyết Dengue. Sở Y tế đã chỉ đạo các cơ sở khám chữa bệnh củng cố quy trình tiếp nhận, sàng lọc điều trị ngoại trú nhập viện, phân tuyến điều trị cụ thể đối với từng ca bệnh sốt xuất huyết Dengue, sẵn sàng hội chẩn chuyên gia, kích hoạt quy trình báo động đỏ bảo đảm người bệnh được tư vấn, cấp cứu, điều trị và chuyển viện an toàn. Sở Y tế phân công cho 3 Bệnh viện Nhi đồng thành phố và Bệnh viện Bệnh nhiệt đới tổ chức tập huấn lại hướng dẫn chẩn đoán, điều trị sốt xuất huyết Dengue của Bộ Y tế cho toàn bộ nhân viên y tế, đặc biệt về việc nhận biết kịp thời các dấu hiệu cảnh báo của sốt xuất huyết Dengue, dấu hiệu chuyển độ nặng để điều trị tích cực, hạn chế tử vong. Phó thủ tướng Nguyễn Hòa Bình vừa ký quyết định số 1137 triển khai hoạt động hưởng ứng ""Ngày thế giới phòng, chống mua bán người"" và ""Ngày toàn dân phòng, chống mua bán người 30-7"" năm 2025. Kế hoạch được ban hành nhằm đẩy mạnh tuyên truyền phòng, chống mua bán người, nhất là mua bán người dưới hình thức lừa đảo đưa người lao động đi làm việc ở nước ngoài, ""việc nhẹ lương cao""; tăng cường đấu tranh, trấn áp tội phạm mua bán người, nhất là tội phạm mua bán người dưới 16 tuổi. Bộ Công an có nhiệm vụ chủ động nắm chắc tình hình, giải quyết tình hình từ sớm, từ xa, từ cơ sở. Triển khai hiệu quả các kế hoạch, phương án nghiệp vụ phòng ngừa, đấu tranh, trấn áp tội phạm mua bán người, nhất là đường dây tội phạm mua bán người. Đồng thời, mở đợt cao điểm tấn công, trấn áp tội phạm mua bán người trên phạm vi toàn quốc, thời gian từ ngày 1-7 đến 30-9. Bộ Quốc phòng chỉ đạo lực lượng chức năng mở đợt cao điểm tấn công, trấn áp tội phạm mua bán người tại địa bàn biên giới, cửa khẩu, biển, hải đảo và các khu vực thuộc trách nhiệm quản lý, tập trung đấu tranh quyết liệt đường dây tội phạm mua bán người. Bộ Y tế hỗ trợ nạn nhân. Chỉ đạo triển khai thực hiện hiệu quả công tác tiếp nhận, bảo vệ và hỗ trợ nạn nhân và người đang trong quá trình xác định là nạn nhân tại các cơ sở trợ giúp xã hội. Tin tức đáng chú ý trên Tuổi Trẻ nhật báo ngày 14-6. Để đọc Tuổi Trẻ báo in phiên bản E-paper, mời bạn đăng ký Tuổi Trẻ SaoTẠI ĐÂY Tin tức thời tiết đáng chú ý hôm nay 14-6 - Đồ họa: NGỌC THÀNH  Tin tức đáng chú ý: Quốc hội thảo luận lần 2 về sửa Hiến pháp 2013; VNG của ông Lê Hồng Minh muốn đổi tên; Ngân hàng giảm hàng ngàn nhân sự; Cổ phiếu đại gia xăng dầu miền Tây buộc phải rời sàn..."
Tuoi tre,https://tuoitre.vn/du-khach-chay-het-minh-voi-dem-khai-mac-le-hoi-du-lich-he-binh-dinh-20250613213253395.htm,,"UBND tỉnh Bình Định,Liz Kim Cương,Quy Nhơn,Bình Định,du lịch hè",13/06/2025 21:46 GMT+7,Du khách 'cháy' hết mình với đêm khai mạc Lễ hội du lịch hè Bình Định,"Các đại biểu nhấn nút khai mạc Lễ hội du lịch hè Bình Định - Ảnh: B.N Tối 13-6, chương trình khai mạc Lễ hội du lịch hè Bình Định 2025 đã diễn ra tại quảng trường Nguyễn Tất Thành, TPQuy Nhơn. Lễ hội năm nay có chủ đề “Quy Nhơn - Thiên đường biển - Khát vọng vươn xa”, đây là sự kiện mở màn cho chuỗi hoạt động du lịch, văn hóa mùa hè tại Bình Định. Mục đích của lễ hội nhằm mang đến cho công chúng những trải nghiệm nghệ thuật đặc sắc khi kết hợp hài hòa giữa truyền thống và hiện đại. Chương trình mở đầu với tiết mục nghệ thuật với đại cảnh kết hợp múa võ và trống hội, tái hiện hình ảnh thành phố biển Quy Nhơn vươn mình mạnh mẽ… Tiếp nối là chuỗi tiết mục biểu diễn phong phú, từ dân ca bài chòi đặc trưng vùng đất võ đến các bản phối EDM hiện đại, mang đến trải nghiệm âm nhạc đa chiều… Ngoài ra còn có các ca sĩ tham gia như Quang Hùng MasterD, Quân AP, Liz Kim Cương, DJ Victor Bailey… Cùng phần trình diễn thời trang đến từ các thí sinh Mr & Miss Fitness Supermodel World 2025. Phần biểu diễn của ca sĩ Liz Kim Cương - Ảnh: B.N Các điệu bài chòi được đưa lên sân khấu đầy hấp dẫn - Ảnh: B.N Nhiều bạn trẻ livestream, quay lại phần biểu diễn của thần tượng mà bản thân yêu thích - Ảnh: B.N Nhiều người dân, du khách thích thú với những phần trình diễn ấn tượng. Bạn Lê Hữu Tài - sinh viên năm 3 ĐH Quy Nhơn - cho hay bạn đã đến khu vực quảng trường từ 17h để chọn vị trí đẹp, xem các ca sĩ. “Các tiết mục được đầu tư rất công phu, đúng chất mùa hè. Tại chương trình, ban tổ chức còn giới thiệu các hoạt động hè sắp đến; chắc chắn tôi sẽ đến trải nghiệm”, Tài nói. Chị Nguyễn Lệ Thu - du khách Hà Nội - thích thú nói: “Tôi cho các con đi Bình Định du lịch sau khi kết thúc năm học. Các bé rất thích các tiết mục nghệ thuật tại đây, chúng tôi sẽ lưu trú khoảng 4 ngày để khám phá hết vẻ đẹp Bình Định”. Phát biểu tại chương trình, ông Lâm Hải Giang - phó chủ tịchUBND tỉnh Bình Định- cho hay chỉ còn ít ngày nữa, theo nghị quyết của Quốc hội, Bình Định và Gia Lai sẽ sáp nhập, tạo nên vùng du lịch mới giàu bản sắc, kết nối biển xanh với đại ngàn. Vì vậy, tỉnh xác định rõ chiến lược phát triển du lịch mới với tầm nhìn dài hạn là lấy du lịch xanh, du lịch thân thiện và du lịch an toàn làm định hướng. Xây dựng hình ảnh du lịch với thông điệp “3K: Không nâng giá, ép giá; Không tranh giành, lôi kéo khách; Không ô nhiễm tiếng ồn và rác thải” và “3A: An toàn giao thông; An toàn vệ sinh thực phẩm; An toàn tính mạng và tài sản” để Bình Định hôm nay và Gia Lai ngày mai trở thành điểm đến hấp dẫn. “Lễ hội du lịch năm nay là dịp để Bình Định khẳng định vị thế là điểm đến hấp dẫn, năng động và thân thiện, nơi du khách được khám phá thiên nhiên, văn hóa và con người một cách chân thực. Chúng tôi kêu gọi doanh nghiệp, người dân và du khách cùng xây dựng thương hiệu du lịch Bình Định, góp phần đưa tỉnh trở thành trung tâm dịch vụ, du lịch và văn hóa phía nam của vùng theo quy hoạch đã được Thủ tướng Chính phủ phê duyệt”, ông Giang nói. Trong dịp này, rất nhiều sự kiện hấp dẫn được tổ chức như cuộc thi Hoa hậu và Nam vương Siêu mẫu thể hình thế giới năm 2025 với sự tham gia của 36 thí sinh đến từ 25 quốc gia và vùng lãnh thổ; Giải chạy VnExpress Marathon Quy Nhơn 2025 với gần 12.000 vận động viên… UBND tỉnh Bình Định vừa ban hành kế hoạch tổ chức chương trình Lễ hội du lịch hè Bình Định năm 2025 vào ngày 13-6 tới đây."
Tuoi tre,https://tuoitre.vn/lu-di-thuong-gay-thiet-hai-nang-4-nguoi-tu-vong-4-nguoi-dang-mat-tich-20250613181610117.htm,,"mưa lũ,QUảng Trị,Huế,Biến đổi khí hậu",13/06/2025 19:15 GMT+7,"Lũ dị thường gây thiệt hại nặng, 4 người tử vong, 4 người đang mất tích","Đã có 2 người ở Quảng Trị tử vong do mưa lũ - Ảnh: HOÀNG TÁO Chiều 13-6, theo Ban Chỉ huy phòng chống thiên tai và tìm kiếm cứu nạn tỉnh Quảng Trị, trong 24 giờ qua, Quảng Trị đã hứng chịu mưa rất to, có nơi mưa đặc biệt to như Hướng Sơn 401,6mm và Lao Bảo 407,6mm. Theo nhiều người dân, việc lũ xuất hiện vào đầu mùa hè tháng 6 là dị thường. Bà Nguyễn Thị Mai ở thôn Thượng Nguyên (xã Hải Lâm, Hải Lăng, Quảng Trị) chia sẻ: ""Chưa thấy năm nào lụt vào tháng này, không bao giờ"". Ông Trần Thanh Lộc (60 tuổi, trú tại thị trấn Lao Bảo) cho biết từ khi ông đến Lao Bảo sinh sống cách đây hơn 50 năm, chưa bao giờ ông chứng kiến một trận lũ giữa tháng 6 như thế này. Hiện nay, lũ ở thượng lưu các sông đã đạt đỉnh và đang xuống chậm, tuy nhiên đã gây ra những thiệt hại nghiêm trọng về người vàtài sảntrên toàn tỉnh. Về người, có 2 ngườitử vongtrong lũ. Trong đó, ông Hồ Viết Kỉnh (71 tuổi, trú thôn Dương Văn Lộc, xã Triệu Thuận, huyện Triệu Phong) tử vong do điện giật khi phòng chống lụt bão. Gió mạnh làm đứt dây điện rơi giữa nước lũ khiến nạn nhân bị điện giật tử vong. Cháu H.N.T.P. (7 tuổi, trú thôn Thượng Nguyên, xã Hải Lâm, huyện Hải Lăng), là trẻ em khuyết tật, không may sẩy chân chết đuối trước nhà. Ngoài ra, một người đàn ông ở thị trấn Lao Bảo, huyện Hướng Hóa, bị ngã vỡ bánh chè phải nhập viện điều trị trong quá trình dọn dẹp đồ đạc, tài sản gia đình đến nơi an toàn để phòng chống lũ lụt. Lũ lụt đã nhấn chìm 21.191ha lúa và 3.717ha rau màu. Về thủy sản, 745ha hồ nuôi tôm, cá nước ngọt cũng bị thiệt hại nặng nề. Toàn tỉnh đã thực hiện sơ tán, di dời 653 hộ với 2.405 nhân khẩu đến nơi an toàn. Ước tính có khoảng 2.000 hộ bị ngập sâu dưới 1m. Chính quyền và các lực lượng chức năng đang tiếp tục theo dõi sát diễn biến mưa lũ, triển khai các biện pháp ứng phó và hỗ trợ người dân khắc phục hậu quả, ổn định đời sống. Chiều 13-6, ông Đặng Văn Hòa, chánh văn phòng Ban Chỉ huy phòng chống thiên tai và tìm kiếm cứu nạn TP Huế, xác nhận vừa có một vụ đuối nước thương tâm xảy ra. Theo đó hai anh em ruột (một người 22 tuổi, một người 24 tuổi, chưa xác minh được danh tính) ở xã Vinh Hưng (huyện Phú Lộc, TP Huế) đi bỏ lừ bắt cá trên khu vực đầm phá. Lúc này nước lũ đổ về khá lớn, nước chảy xiết nên ghe của hai anh em gặp sự cố, cả hai bị đuối nước thương tâm. Trước đó vào sáng cùng ngày, 6 người đi trên một chiếc ghe băng qua dòng lũ dữ thì bị lật tại xã Hương Toàn (thị xã Hương Trà, TP Huế). May mắn cả 6 người đều được cứu giúp kịp thời. Hai anh em ruột tử vong khi đi đánh cá - Ảnh: NHẬT HOÀNG Tại Quảng Bình cũng có 4 người mất tích do ảnh hưởng của mưa lũ. Đã có thêm hai vợ chồng ở Quảng Bình mất tích khi đi bắt cá trên sông Dinh trong đợt mưa lũ dị thường. Trước đó hai chị em cũng tại tỉnh này đi soi ếch bị nước cuốn vẫn chưa tìm được."
Tuoi tre,https://tuoitre.vn/thoi-tiet-hom-nay-14-6-mien-trung-nang-lai-sau-mua-bao-mien-bac-mua-rao-20250613161805965.htm,,"mưa rào,Bắc bộ,Dự báo thời tiết,thời tiết hôm nay,Thời tiết",14/06/2025 01:07 GMT+7,"Thời tiết hôm nay 14-6: Miền Trung nắng lại sau mưa bão, miền Bắc mưa rào","Sau mưa bão, thời tiết miền Trung sẽ nắng trở lại - Ảnh: T.L Trung tâm Dự báo khí tượng thủy văn quốc gia cho biết hôm nay 14-6, thời tiết Bắc Bộ mưa rào và dông, vùng ven biển có nơi mưa to. Trung Bộ ngày nắng, có nơi nắng nóng. Lưu ý  dù trời nắng nhưng do mưa lớn kéo dài, đất cát bão hòa độ ẩm, nguy cơ sạt lở vẫn chực chờ. Nam Bộ ngày nhiều mây, chiều tối mưa rào và dông. Ban ngày nắng nhiều hơn, nhiệt độ trong ngày tăng phổ biến 31-34 độ C. Về thời tiết biển, ngày 14-6, vịnh Bắc Bộ, vùng biển phía tây bắc của bắc Biển Đông có mưa bão. Phía đông của khu vực bắc Biển Đông mưa rào và dông. Đêm nay vịnh Bắc Bộ, phía tây bắc khu vực bắc Biển Đông gió mạnh cấp 6-7, giật cấp 8. Biển động mạnh, sóng biển cao 2 - 4,5m, tàu thuyền cần chú ý. Hà Nộicó mây, mưa rào và dông rải rác. Nhiệt độ thấp nhất 25-27 độ C, cao nhất 32-34 độ C. Phía Tây Bắc Bộcó mây, mưa rào và dông vài nơi. Nhiệt độ thấp nhất 23-27 độ C, cao nhất 31-34 độ C. Phía Đông Bắc Bộcó mây, mưa rào và dông rải rác, có nơi mưa to. Nhiệt độ thấp nhất 23-27 độ C, cao nhất 31-34 độ C. Thanh Hóa đến Huếngày có mây, trời nắng, có nơi nắng nóng. Nhiệt độ thấp nhất 23-26 độ C, cao nhất 31-35 độ C. Đà Nẵng đến Bình Thuậnngày có mây, trời nắng, có nơi nắng nóng. Nhiệt độ thấp nhất 24-27 độ C, cao nhất 32-35 độ C. Tây Nguyêncó mây, mưa rào và dông vài nơi. Nhiệt độ thấp nhất 20-23 độ C, cao nhất 28-31 độ C. Nam Bộcó mây, chiều tối mưa rào và dông rải rác. Nhiệt độ thấp nhất 24-27 độ C, cao nhất 30-33 độ C. Dự báo thời tiết hôm nay 14-6 - Đồ họa: NGỌC THÀNH Một chiếc ghe chở 6 người bị lật khi đang băng qua dòng nước lũ ở TP Huế. May mắn cả 6 người được cứu."
