Source,URL,Category,Keyword,Time,Title,Content
VN Express,https://vnexpress.net/de-xuat-cam-phat-trien-tri-tue-nhan-tao-co-kha-nang-gia-mao-con-nguoi-4965096.html,Chính trị,,"Thứ hai, 17/11/2025, 20:56 (GMT+7)",Đề xuất cấm phát triển trí tuệ nhân tạo có khả năng giả mạo con người,"Chính phủ đề xuất cấm phát triển các hệ thống trí tuệ nhân tạo (AI) có khả năng giả mạo người, thao túng nhận thức và hành vi, gây tổn hại đến quyền và lợi ích hợp pháp của con người. Tối 17/11, Bộ trưởng Bộ Khoa học và Công nghệ Nguyễn Mạnh Hùng trình Ủy ban Thường vụ Quốc hội dự án Luật Trí tuệ nhân tạo. Dự thảo lần đầu xác lập khái niệm ""hệ thống AI có rủi ro không chấp nhận được"" - tức những hệ thống có thể gây tổn hại nghiêm trọng, không thể khắc phục đối với quyền con người, an ninh quốc gia, trật tự, an toàn xã hội hoặc được tạo ra để thực hiện hành vi bị pháp luật cấm. Các hệ thống thuộc nhóm này bị cấm phát triển, cung cấp, triển khai hoặc sử dụng dưới mọi hình thức tại Việt Nam. Những dấu hiệu nhận biết gồm: hệ thống được thiết kế phục vụ hành vi bị cấm; sử dụng yếu tố giả mạo hoặc mô phỏng người, sự kiện thật nhằm lừa dối, thao túng nhận thức và hành vi có chủ đích, gây tổn hại nghiêm trọng đến quyền lợi người dùng; lợi dụng điểm yếu của nhóm dễ tổn thương; tạo hoặc lan truyền nội dung giả mạo có nguy cơ cao đối với an ninh quốc gia, trật tự, an toàn xã hội. Theo tờ trình, AI phát triển quá nhanh kéo theo nhiều rủi ro mới về an ninh. Công nghệ deepfake có thể bị lợi dụng để tạo tin giả, bôi nhọ, lừa đảo, gây bất ổn xã hội. Các hệ thống vũ khí tự động cũng đặt ra nhiều vấn đề đạo đức và pháp lý quốc tế. Trong khi đó, tốc độ hoàn thiện pháp luật lại chậm hơn công nghệ, khiến khoảng trống quản lý ngày càng lớn. Vì vậy, Chính phủ cho rằng cần sớm xây dựng khung pháp lý để vừa kiểm soát rủi ro, vừa thúc đẩy nghiên cứu và ứng dụng AI tại Việt Nam. Bộ trưởng Nguyễn Mạnh Hùng cho biết dự luật nhằm tạo khung pháp lý thống nhất bảo đảm AI phát triển an toàn, có trách nhiệm, vì con người. AI được xác định là hạ tầng trí tuệ quốc gia, là động lực của tăng trưởng năng suất, đổi mới sáng tạo và nâng cao năng lực tự chủ công nghệ, cạnh tranh quốc gia. Dự thảo Luật AI gồm 8 chương, 36 điều; nhấn mạnh chính sách phát triển AI lấy con người làm trung tâm, làm rõ vai trò quản lý và kiến tạo của Nhà nước. Luật thiết lập cơ chế quản lý theo mức độ rủi ro, bảo đảm việc ứng dụng AI minh bạch, an toàn, có kiểm soát và trách nhiệm giải trình; bảo vệ an ninh, an toàn, chủ quyền dữ liệu và quyền dự trữ công nghệ quốc gia. Dự luật cũng yêu cầu hệ thống AI phải không gây hại, không thiên lệch, tôn trọng giá trị nhân văn; có cơ chế giám sát, thanh tra, xử lý vi phạm nhằm bảo đảm răn đe và củng cố niềm tin xã hội. Chính phủ sẽ thúc đẩy hệ sinh thái đổi mới sáng tạo và phát triển nhân lực chất lượng cao thông qua cơ chế hỗ trợ nghiên cứu, đầu tư, đào tạo cho viện nghiên cứu, doanh nghiệp và cá nhân tham gia phát triển AI. Ủy ban Khoa học - Công nghệ cơ bản đồng tình với chính sách của dự thảo, song đề nghị làm rõ tiêu chí định lượng hoặc định tính để phân loại AI theo mức độ rủi ro. Cơ quan thẩm tra đề xuất bổ sung hành vi cấm nhằm tăng tính răn đe và thống nhất trong áp dụng pháp luật, như cấm sử dụng AI tạo deepfake để lừa đảo, xúc phạm nhân phẩm, gây rối chính trị, thao túng bầu cử hoặc xâm phạm an ninh quốc gia. Chính phủ sẽ trình Quốc hội dự án Luật Trí tuệ nhân tạo vào ngày 21/11, các đại biểu thảo luận tại hội trường ngày 27/11. Sơn Hà"
VN Express,https://vnexpress.net/bo-truong-cong-an-ghi-hinh-tren-xe-khach-phai-bao-dam-an-ninh-du-lieu-4965067.html,Chính trị,"thiết bị giám sát,tài xế,Bộ Công An,lắp camera hình ảnh","Thứ hai, 17/11/2025, 20:18 (GMT+7)",Bộ trưởng Công an: Ghi hình trên xe khách phải bảo đảm an ninh dữ liệu,"Bộ trưởng Lương Tam Quang cho biết việc lắp camera trong khoang hành khách để tăng an toàn, nhưng dữ liệu thu được phải quản lý chặt chẽ, tuân thủ quy định về bảo vệ thông tin cá nhân. Chiều 17/11, Quốc hội thảo luận dự án luật sửa đổi, bổ sung một số điều của 10 luật liên quan đến an ninh, trật tự, trong đó có Luật Trật tự, an toàn giao thông đường bộ. Dự thảo quy định ôtô kinh doanh vận tải từ 8 chỗ trở lên phải lắp thiết bị giám sát hành trình và ghi nhận hình ảnh người lái xe, hình ảnh trong khoang hành khách. Bộ trưởng Công an Lương Tam Quang cho biết quy định nhằm phòng ngừa vi phạm pháp luật, bảo đảm an ninh, an toàn xã hội và bảo vệ hành khách trên xe. ""Dữ liệu ghi nhận sẽ được bảo vệ nghiêm ngặt, hành vi sử dụng sai phạm đều bị xử lý"", Bộ trưởng nói. Theo ông, việc ghi hình chỉ áp dụng với khoang hành khách - không gian công cộng - và không điều chỉnh đối với khoang riêng tư hay xe không hoạt động vì mục đích công cộng. Cơ quan soạn thảo sẽ tiếp tục nghiên cứu, đánh giá tác động kỹ lưỡng trước khi hoàn thiện quy định. Trước đó, đại biểu Chu Thị Hồng Thái (đoàn Lạng Sơn) cho rằng hình ảnh hành khách là dữ liệu cá nhân nhạy cảm, ở nhiều quốc gia được bảo vệ rất chặt chẽ về mục đích sử dụng, thời gian lưu trữ và phạm vi truy cập. Dù dự thảo đã quy định về thu thập, lưu trữ và bảo đảm an toàn dữ liệu, nhưng bà cho rằng vẫn còn khoảng trống quan trọng là chưa xác định rõ ai có quyền truy cập, truy cập trong điều kiện nào, cơ chế kiểm soát ra sao và nguyên tắc cấm chia sẻ dữ liệu ngoài phạm vi pháp luật cho phép. Bà lo ngại khoảng trống này có thể dẫn tới lạm dụng, sử dụng dữ liệu sai mục đích hoặc chia sẻ trái phép hình ảnh hành khách, ảnh hưởng quyền và lợi ích hợp pháp của công dân. Vì vậy nữ đại biểu đề nghị dự thảo quy định rõ việc thu thập, lưu trữ, khai thác và chia sẻ dữ liệu, trong đó có hình ảnh khoang hành khách, phải phục vụ đúng mục đích bảo đảm trật tự an toàn giao thông và xử lý vi phạm, đúng thẩm quyền, được kiểm soát chặt chẽ, và không được sử dụng hay cung cấp ngoài phạm vi pháp luật cho phép. Đại biểu Phạm Văn Hòa cũng cho rằng cần đánh giá tác động đầy đủ vì quy định này liên quan trực tiếp đến quyền nhân thân. Ông đề nghị khảo sát thực tiễn, lấy ý kiến rộng rãi và làm rõ lý do cần thiết phải lắp thiết bị ghi hình trong khoang hành khách. Trao đổi với báo chí, TS Trần Hữu Minh, Chánh văn phòng Ủy ban An toàn giao thông quốc gia, dẫn số liệu từ các vụ tai nạn cho thấy nhiều trường hợp xảy ra do vi phạm quy tắc cơ bản của lái xe, trong đó có những vụ nghiêm trọng liên quan đến xe khách, xe tải và xe dưới 8 chỗ. Việc lắp camera giám sát tài xế ở nhóm xe lớn thời gian qua đã giúp phát hiện hàng trăm hành vi nguy hiểm, góp phần phòng ngừa tai nạn. Ông cho rằng mở rộng yêu cầu lắp camera cho xe kinh doanh vận tải dưới 8 chỗ là cần thiết, giúp quản lý hành vi lái xe, cung cấp bằng chứng khi xảy ra sự cố và nâng cao an toàn giao thông. Sơn Hà"
VN Express,https://vnexpress.net/chinh-phu-de-xuat-chuong-trinh-dau-tu-cho-giao-duc-tri-gia-hon-580-000-ty-dong-4965085.html,Chính trị,,"Thứ hai, 17/11/2025, 19:36 (GMT+7)",Chính phủ đề xuất chương trình đầu tư cho giáo dục trị giá hơn 580.000 tỷ đồng,"Tối 17/11, Chính phủ trình chủ trương đầu tư Chương trình mục tiêu quốc gia hiện đại hóa, nâng cao chất lượng giáo dục giai đoạn 2026-2035 với tổng nguồn lực dự kiến 580.133 tỷ đồng. Ngay sau phiên họp Quốc hội, Ủy ban Thường vụ Quốc hội đã họp, cho ý kiến về chương trình. Bộ trưởng Giáo dục và Đào tạo Nguyễn Kim Sơn cho biết chương trình có mục tiêu chuẩn hóa, hiện đại hóa toàn diện hệ thống giáo dục quốc dân, tạo chuyển biến mạnh về chất lượng và mở rộng cơ hội học tập suốt đời, đáp ứng nhu cầu nhân lực, nhất là nhân lực chất lượng cao. Theo mục tiêu cụ thể, đến năm 2030, chương trình hướng tới kiên cố hóa 100% trường lớp mầm non và phổ thông; bảo đảm cơ sở vật chất, thiết bị đạt chuẩn; xây dựng không gian học tập hiện đại như phòng bộ môn, phòng thực hành, không gian STEM/STEAM. Chính phủ cũng muốn hoàn thành phổ cập mầm non cho trẻ 3-5 tuổi, giáo dục bắt buộc đến hết THCS và mở rộng dạy học bằng tiếng Anh tại tối thiểu 30% cơ sở phổ thông. Đối với phổ thông, chương trình phấn đấu 50% cơ sở xây dựng hệ sinh thái ươm mầm tài năng, tạo môi trường phát hiện, bồi dưỡng học sinh năng khiếu, hỗ trợ tham gia dự án khoa học - công nghệ và khởi nghiệp sáng tạo. Học sinh, sinh viên được khuyến khích phát triển toàn diện, với tối thiểu 70% tham gia hoạt động thể thao, văn hóa, nghệ thuật và 50% tham gia dự án phục vụ cộng đồng, nhằm góp phần hình thành phẩm chất, năng lực và trách nhiệm xã hội. Tổng nguồn vốn 580.133 tỷ đồng gồm ngân sách Trung ương khoảng 349.113 tỷ đồng, ngân sách địa phương 115.773 tỷ; phần còn lại là vốn đối ứng của các cơ sở giáo dục nghề nghiệp, giáo dục đại học và nguồn huy động hợp pháp khác. Bộ trưởng Nguyễn Kim Sơn cho rằng 580.000 tỷ đồng là rất lớn, nhưng so với nhu cầu kiên cố hóa toàn bộ trường lớp, hiện đại hóa đại học trọng điểm và phục vụ 52.000 trường học, 1,6 triệu nhà giáo, 24 triệu người học thì vẫn rất nhỏ bé. Bộ Tài chính đã tính toán kỹ nguồn lực và Chính phủ sẽ báo cáo Quốc hội cụ thể. Ủy ban Văn hóa và Xã hội tán thành mục tiêu nhưng đề nghị đầu tư trọng tâm, trọng điểm, bố trí vốn sát khả năng giải ngân; làm rõ căn cứ xác định tỷ lệ vốn đối ứng của địa phương và khuyến khích nơi có nguồn thu cao chủ động đầu tư giáo dục. Cơ quan thẩm tra cũng đề nghị xác định rõ tính khả thi của các nguồn vốn huy động khác để giảm áp lực ngân sách. Phó chủ tịch Quốc hội Trần Quang Phương nhấn mạnh chủ trương đầu tư công phải dẫn dắt đầu tư tư, nhưng cơ cấu vốn hiện vẫn lệ thuộc lớn vào ngân sách Trung ương. Với tổng vốn hơn 580.000 tỷ đồng, ông đề nghị Chính phủ có giải pháp thu hút khu vực tư nhân, đặc biệt hệ thống giáo dục tư thục. Chủ tịch Quốc hội Trần Thanh Mẫn góp ý chương trình phải xác định diện ưu tiên để phân bổ nguồn lực phù hợp, tập trung cho vùng khó khăn, dân tộc thiểu số, giáo dục mầm non và giáo dục đại học. Ông băn khoăn về khả năng bố trí vốn trong 5-10 năm tới khi nhiều dự án quan trọng khác cũng đang cần nguồn lực, đề nghị Chính phủ làm rõ phương án nguồn vốn, ưu tiên dự án khả thi và cho phép địa phương linh hoạt theo điều kiện thực tế. Chính phủ dự kiến trình chủ trương đầu tư chương trình vào ngày 25/11, Quốc hội thảo luận ngày 2/12. Sơn Hà"
VN Express,https://vnexpress.net/phuong-an-nhan-su-lanh-dao-chu-chot-dang-nha-nuoc-la-tuyet-mat-4965080.html,Chính trị,"lãnh đạo chủ chốt,văn bản mật","Thứ hai, 17/11/2025, 19:12 (GMT+7)","Phương án nhân sự lãnh đạo chủ chốt Đảng, Nhà nước là tuyệt mật","Phương án chuẩn bị, đề án và văn bản trình Trung ương xem xét bầu các chức danh Tổng Bí thư, Chủ tịch nước, Thủ tướng, Chủ tịch Quốc hội và Thường trực Ban Bí thư được xác định thuộc độ ""tuyệt mật"". Ngày 17/11, Thủ tướng Phạm Minh Chính ban hành danh mục bí mật nhà nước trong lĩnh vực tổ chức, cán bộ, lao động và xã hội. Quy định này kế thừa danh mục bí mật nhà nước của Đảng ban hành hồi tháng 7, đồng thời cụ thể hóa phạm vi bí mật nhà nước trong quản lý cán bộ thuộc thẩm quyền Chính phủ. Theo danh mục mới, mọi văn bản liên quan quá trình chuẩn bị và trình Trung ương xem xét bầu 5 chức danh lãnh đạo chủ chốt của Đảng và Nhà nước đều thuộc nhóm ""tuyệt mật"" khi chưa được công bố. Nhóm ""tối mật"" gồm các đề án về cơ cấu tổ chức của Chính phủ; đề án thành lập, sáp nhập, chia tách, giải thể bộ và cơ quan ngang bộ trước khi được Quốc hội thông qua. Văn bản liên quan xây dựng và quản lý đội ngũ cán bộ thuộc diện Bộ Chính trị, Ban Bí thư quản lý; các chủ trương, báo cáo, tờ trình về bầu, bổ nhiệm, điều động, luân chuyển, miễn nhiệm, từ chức hoặc kỷ luật cán bộ cấp cao, khi chưa công khai, cũng thuộc diện này. Ngoài ra, báo cáo về tình hình lao động phức tạp tại doanh nghiệp có thể tác động đến chính trị, an ninh quốc gia cũng được xếp ""tối mật"". Nhóm ""mật"" gồm chín loại thông tin, trong đó có văn bản xin ý kiến, báo cáo về biên chế cán bộ làm việc ở nước ngoài; đề án thành lập, tổ chức lại, giải thể cơ quan hành chính và đơn vị sự nghiệp công lập trước khi phê duyệt. Các báo cáo về công tác cán bộ có ảnh hưởng đến chính trị - kinh tế - xã hội; các quyết định về bổ nhiệm, điều động, luân chuyển, miễn nhiệm, từ chức đối với lãnh đạo cấp trưởng hoặc cấp phó của cơ quan thuộc Chính phủ, bộ, ngành; hồ sơ về phong, thăng, giáng, tước quân hàm cấp tướng chưa công khai đều nằm trong danh mục ""mật"". Thông tin về thi tuyển chức danh lãnh đạo, tuyển dụng công chức, viên chức chưa công khai; đề án cải cách tiền lương chưa được Quốc hội thông qua cũng được xác định thuộc phạm vi bí mật nhà nước. Quyết định có hiệu lực từ ngày 17/11. Vũ Tuân"
VN Express,https://vnexpress.net/khong-nen-bat-buoc-taxi-lap-ghe-an-toan-tre-em-4965011.html,Chính trị,,"Thứ hai, 17/11/2025, 17:26 (GMT+7)",'Không nên bắt buộc taxi lắp ghế an toàn trẻ em',"Yêu cầu taxi và xe công nghệ trang bị ghế an toàn trẻ em từ ngày 1/1/2026 bị nhiều đại biểu đánh giá là khó khả thi, có thể gây thêm áp lực chi phí và phát sinh rủi ro. Chiều 17/11, Quốc hội thảo luận dự án Luật sửa đổi 10 luật về an ninh, trật tự, trong đó có nội dung liên quan đến Luật Trật tự an toàn giao thông đường bộ. Theo quy định hiện hành, tất cả ôtô chở trẻ em, kể cả taxi, phải có thiết bị an toàn phù hợp; vi phạm sẽ bị phạt 800.000 đến một triệu đồng. Đại biểu Hà Sỹ Đồng cho rằng quy định này phù hợp với các nước có tỷ lệ sử dụng ôtô cao, song điều kiện ở Việt Nam khác biệt khi phần lớn người dân đi xe máy. Nếu yêu cầu ghế trẻ em quá cứng nhắc, nhiều gia đình có thể buộc phải chở trẻ bằng xe máy thay vì taxi, khiến mức độ rủi ro còn lớn hơn. Ông dẫn kinh nghiệm Indonesia và Philippines, nơi quy định bắt buộc ghế trẻ em đã khiến tỷ lệ phụ huynh chở trẻ bằng xe máy tăng 15-30%. Theo quy chuẩn 123/2024, ghế an toàn trẻ em có 4-5 kích cỡ tùy cân nặng. Nếu bắt buộc, mỗi taxi phải mang theo đủ số ghế này, điều ông Đồng đánh giá là ""không thể thực hiện"". Với du khách, việc mang ghế theo suốt hành trình là bất tiện; còn yêu cầu taxi chuẩn bị sẵn sẽ không đáp ứng được khi gia đình có hai trẻ trở lên. Ông Đồng cũng nêu thực tế nhiều gia đình không có ôtô riêng, phải gọi taxi đưa trẻ đi khám, tiêm chủng hoặc khi mưa rét. Số taxi có ghế trẻ em rất hạn chế, khiến họ khó đặt xe, thời gian chờ kéo dài và chi phí tăng. ""Giới trẻ hiện nay vốn đã e ngại sinh con vì nhiều áp lực. Nếu quy định này giữ nguyên, gánh nặng sẽ càng lớn hơn"", ông nói, đề nghị điều chỉnh để giảm áp lực cho phụ huynh. Các doanh nghiệp vận tải cho biết xe khách và xe hợp đồng không phù hợp để lắp thêm ghế trẻ em; dây an toàn hiện nay là giải pháp duy nhất đáp ứng cho nhiều nhóm hành khách. Nhà xe chỉ biết trẻ em đi cùng khi khách lên xe, nên không thể chuẩn bị thiết bị an toàn trước. TS Trần Hữu Minh, Chánh văn phòng Ủy ban An toàn giao thông quốc gia, cho rằng các loại hình vận tải cần lộ trình dài hơn để đáp ứng yêu cầu mới. Ông đề nghị Nhà nước quy định doanh nghiệp công khai số lượng thiết bị an toàn trẻ em trên từng chuyến để hành khách có thể lựa chọn khi đặt chỗ online, nhất là đối với xe hợp đồng và tuyến cố định. Cần biển báo giao thông kèm chỉ dẫn mức ngập úng Đại biểu Nguyễn Văn Cảnh cho rằng tình trạng ngập lụt ở đô thị ngày càng phổ biến, gây ùn tắc, thiệt hại phương tiện và đảo lộn sinh hoạt của người dân. Ở nông thôn, nhiều ngầm tràn có cột báo mực nước để cảnh báo an toàn và đô thị ""cũng cần mô hình tương tự"". Ông đề nghị vẽ mức ngập lên cột biển báo giao thông tại các điểm ngập, giúp lái xe căn cứ vào chiều cao gầm và khả năng vượt nước của xe để quyết định có nên đi qua hay không. Cùng với đó, ngành giao thông cần tổ chức điều tiết tùy mức độ ngập như dùng biển báo điện tử hướng dẫn xe đủ khả năng đi qua, ưu tiên xe vận tải công cộng, còn các phương tiện khác được phân luồng đi đường vòng hoặc quay đầu để tránh ùn tắc và hư hỏng. Ông Cảnh cũng đề nghị Bộ Xây dựng bổ sung hệ thống biển báo giao thông tạm thời, tương tự nhiều nước dùng biển nền nâu hoặc cam, để áp dụng khi sửa đường, có tai nạn hoặc cần phân luồng khẩn cấp. Sơn Hà"
VN Express,https://vnexpress.net/chu-tich-tp-hue-phan-thien-dinh-lam-pho-bi-thu-tinh-uy-ha-tinh-4964988.html,Chính trị,,"Thứ hai, 17/11/2025, 16:38 (GMT+7)",Chủ tịch TP Huế Phan Thiên Định làm Phó bí thư Tỉnh ủy Hà Tĩnh,"Chiều 17/11, ông Phan Thiên Định, Chủ tịch UBND TP Huế, được điều động giữ chức Phó bí thư Tỉnh ủy Hà Tĩnh nhiệm kỳ 2025-2030. Sau khi hoàn tất thủ tục tham gia Ban Chấp hành và Ban Thường vụ, ông Định trở thành một trong ba thành viên Thường trực Tỉnh ủy Hà Tĩnh cùng Bí thư Nguyễn Duy Lâm và Phó bí thư thường trực, Chủ tịch HĐND tỉnh Nguyễn Hồng Lĩnh. Cũng trong chiều nay, Chủ tịch UBND tỉnh Hà Tĩnh Võ Trọng Hải đã được điều chuyển làm Phó bí thư Tỉnh ủy Nghệ An. Ông Phan Thiên Định quê phường Thuận An, TP Huế; cử nhân Kinh tế, cử nhân Luật, thạc sĩ Quản lý hành chính công. Hơn 30 năm công tác, ông từng giữ các chức vụ Giám đốc Sở Kế hoạch và Đầu tư; Phó chủ tịch UBND tỉnh Thừa Thiên Huế; Bí thư Thành ủy Huế; Bí thư quận Thuận Hóa; Trưởng ban Kinh tế - Ngân sách HĐND TP Huế. Ngày 4/10, ông được bầu làm Phó bí thư Thành ủy Huế nhiệm kỳ 2025-2030 và 13 ngày sau được bầu làm Chủ tịch UBND thành phố. Hà Tĩnh rộng gần 6.000 km2, dân số hơn 1,6 triệu. 9 tháng đầu năm 2025, thu ngân sách của tỉnh ước đạt 15.677 tỷ đồng, đạt 88% dự toán và tăng 12% so với cùng kỳ. Giai đoạn 2026-2030, Hà Tĩnh đặt mục tiêu tăng GRDP bình quân từ 10% trở lên, thu nhập năm 2030 đạt 80 triệu đồng, xuất khẩu 4 tỷ USD, có 18.000-20.000 doanh nghiệp. Tỉnh ưu tiên chuyển đổi số, phát triển nhân lực chất lượng cao, xây dựng hạ tầng hiện đại, thu hút dự án chiến lược, đưa Vũng Áng thành trung tâm công nghiệp - năng lượng - logistics; đồng thời phát triển công nghiệp, nông nghiệp thông minh, dịch vụ chất lượng cao và chú trọng môi trường, thích ứng biến đổi khí hậu. Phó bí thư Điện Biên làm Phó bí thư Lai Châu Sáng cùng ngày, ông Hà Quang Trung, Phó bí thư Tỉnh ủy Điện Biên, được Ban Bí thư điều động, chỉ định giữ chức Phó bí thư Tỉnh ủy Lai Châu nhiệm kỳ 2025-2030. Ông Hà Quang Trung 49 tuổi, quê Hưng Yên, tốt nghiệp cử nhân Tài chính - Tín dụng và thạc sĩ Kinh doanh và Quản lý. Ông từng giữ các vị trí quan trọng tại Điện Biên như Giám đốc Sở Tài chính, Bí thư Thành ủy và Chủ tịch HĐND TP Điện Biên Phủ, Phó ban Tổ chức Tỉnh ủy, Phó bí thư Tỉnh ủy. Một ngày trước đó, ông Lê Văn Lương, Chủ tịch UBND tỉnh Lai Châu, được Ban Bí thư điều động giữ chức Phó bí thư Tỉnh ủy Điện Biên. Lai Châu là tỉnh miền núi Tây Bắc, giáp Vân Nam (Trung Quốc), Lào Cai, Điện Biên và Sơn La; diện tích khoảng 9.000 km2, dân số gần 500.000. Tỉnh có hơn 265 km đường biên giới với Trung Quốc và sở hữu cửa khẩu quốc gia Ma Lù Thàng. Đại hội Đảng bộ tỉnh giữa tháng 10 đặt mục tiêu đưa Lai Châu trở thành tỉnh phát triển mức trung bình của vùng trung du và miền núi phía Bắc vào năm 2030 và đạt mức trung bình cả nước vào 2045. Tuần qua, nhiều tỉnh thành tiếp tục có điều chỉnh nhân sự chủ chốt để thực hiện chủ trương của Bộ Chính trị, Ban Bí thư về bố trí chủ tịch UBND tỉnh không là người địa phương. Đức Hùng - Vũ Tuân"
