Source,URL,Category,Keyword,Time,Title,Content
Tuoi tre,https://tuoitre.vn/thu-truong-phung-duc-tien-neu-giai-phap-ung-pho-voi-ngap-lut-thien-tai-khoc-liet-bat-thuong-20251108174705797.htm,,"Mưa lũ,thiên tai,miền trung,biến đổi khí hậu,họp Chính phủ thường kỳ",08/11/2025 18:34 GMT+7,"Thứ trưởng Phùng Đức Tiến nêu giải pháp ứng phó với ngập lụt, thiên tai khốc liệt, bất thường","Thứ trưởng Bộ Nông nghiệp và Môi trường Phùng Đức Tiến - Ảnh: HỒNG QUANG Theo ông Tiến, các giải pháp để giải quyết vấn đề phòngchống ngậpúng cho sản xuất nông nghiệp và tại các đô thị khu dân cư hiện nay được xác định trong các quy hoạch, các chỉ đạo về phòng chống thiên tai và một số đề án tại các vùng, địa phương. Về tình trạng ngập úng vừa qua diễn ra ở các tỉnh, thành trên cả nước, ông Tiến cho hay đối với khu vực miền Bắc và một số tỉnh Bắc Trung Bộ có tình trạng lũ lụt và ngập, chủ yếu là do nước tập trung ở các vùng núi cao chảy tràn bờ vào các dòng sông gây ngập trên diện rộng. Do vậy, giải pháp tập trung chủ yếu là việc tăng khả năng tiêu thoát lũ và đắp đê bảo vệ các vùng khu đô thị quan trọng. Đặc biệt là khu vực Thái Nguyên, Bắc Giang… đã đưa ra các giải pháp phù hợp với điều kiện địa hình miền núi phía Bắc. Tại Đồng bằng sông Hồng, ngập úng chủ yếu là do mưa. Vì vậy giải pháp chính là xây dựng nâng cấp các trạm bơm, ống tiêu thoát nước chủ động bơm từ nội vùng ra sông. Tăng cường gia cố hệ thống đê điều. Thực tế tại Hà Nội và một số tỉnh đã quyết liệt vấn đề này để giảm ngập úng. Cùng đó, bộ đang triển khai đề án phát triển tổng thể hệ thống thủy lợi Bắc Hưng Hải phục vụ đa mục tiêu, bảo vệ môi trường bền vững, theo hướng hiện đại. Đề án sẽ có các giải pháp giải quyết tình trạng ngập úng liên quan tới các địa phương như Bắc Ninh, Hưng Yên, TP Hải Phòng. Tại Đồng bằng sông Cửu Long, Thứ trưởng cho hay các điểm ngập chủ yếu do lũ trên thượng nguồn. Do đó, giải pháp tập trung kiểm soát lũ tại các trạm từ biên giới Campuchia và hoàn thiện hệ thống thủy lợi để kiểm soát lũ. Hiện các biện pháp này đã được triển khai nhiều năm và phù hợp thực tiễn, đúng quy hoạch của Thủ tướng. Cùng đó là đề án phòng chống sụt lún, sạt lở, ngập úng, hạn hán và xâm nhập mặn của vùng, Đảng ủy bộ có tờ trình gửi Đảng ủy Chính phủ, xác định các công trình đa mục tiêu. Cùng đó, xây dựng cơ sở dữ liệu, nâng cao năng lực dự báo, cảnh báo; nguồn lực xác định cụ thể trong quy hoạch, kế hoạch đầu tư công trung hạn…. Lãnh đạo Bộ Nông nghiệp và Môi trường khẳng định đã báo cáo Thủ tướng Chính phủ về thực hiện đề án, giao nhiệm vụ cho các bộ ngành và địa phương, đề xuất đầu tư dự án trong kế hoạch đầu tư công. Nguồn vốn sẽ huy động từ ngân sách nhà nước, nguồn hỗ trợ quốc tế và vốn vay thương mại, nguồn vốn từ cộng đồng và xã hội. Về diễn biến thiên tai xảy ra liên tiếp trong thời gian qua, Thứ trưởng Phùng Đức Tiến cho hay từ đầu năm 2025 đến nay thiên tai diễn ra dồn dập, khốc liệt trên phạm vi rộng và mang nhiều yếu tố bất thường, vượt mốc lịch sử. Đặc biệt là ba cơn bão rất mạnh đổ bộ vào miền Trung, mưa lớn cực đoan, lũ lụt vượt lịch sử trên nhiều sông Bắc Bộ, Trung Bộ, ngập lụt nghiêm trọng tại nhiều địa phương, đô thị, vùng trũng, trong đó có Hà Nội. Thiên tai đã khiến hơn 305 người chết, thiệt hại 69.000 tỉ đồng. Do đó, Thủ tướng đã giao Bộ Nông nghiệp và Môi trường chuẩn bị tổ chức hội nghị toàn quốc về công tác phòng chống, khắc phục hậu quảthiên tai. Hội nghị nhằm đánh giá toàn diện và rút ra kinh nghiệm, bài học, có các giải pháp cấp bách trước mắt và lâu dài nhằm chủ động phòng ngừa hạn chế tối đa thiệt hại do thiên tai. Thứ trưởng Bộ Nông nghiệp và Môi trường khẳng định với việc chủ động tích cực trong phòng chống, ứng phó thiên tai, đã giúp ngành nông nghiệp nhiều năm duy trì tăng trưởng. Trong 10 tháng đầu năm, sản xuất lương thực 39 triệu tấn lúa, đạt 99,2%. Đặc biệt xuất khẩu 58,13 tỉ USD, tăng 12,9%. Cùng đó, Thủ tướng cũng giao nhiệm vụ tăng cường công tác dự báo, cảnh báo sớm, xây dựng kịch bản ứng phó với các cấp rủi ro thiên tai, dự báo và triển khai ứng phó quyết liệt từ sớm, từ xa. Điều này, theo ông Tiến, góp phần làm giảm tối đa thiệt hại. Đơn cử như cơn bão số 13 vào Philippines đã làm 323 người chết và mất tích nhưng vào Việt Nam, cập nhật đến hôm nay có 8 người chết và mất tích tại các tỉnh Quảng Ngãi, Gia Lai và Đắk Lắk. Hình ảnh người dân vùng nguy cơ được sơ tán đến nơi an toàn, được cứu trợ lương thực, thực phẩm chứng tỏ những cố gắng của xã toàn xã hội trong công tác ứng phó với thiên tai. Tuy nhiên công tác 'phòng ngừa' còn chưa được quan tâm đúng mức."
Tuoi tre,https://tuoitre.vn/ngap-nang-trung-tam-tp-hcm-sau-mua-nguoi-di-duong-giat-dien-nghi-tu-moi-noi-ho-nha-dan-20251108180413471.htm,,"Đặng Thùy Trâm,ngập nước,ngập sau mưa",08/11/2025 18:55 GMT+7,"Ngập nặng trung tâm TP.HCM sau mưa, người đi đường giật điện nghi từ mối nối hở nhà dân2","Đường Đặng Thùy Trâm và Lương Ngọc Quyến ở phường Bình Lợi Trung, TP.HCM mưa ngập lênh láng chiều 8-11 - Ảnh: CHÂU TUẤN Khoảng 16h30 chiều 8-11, mưa lớn bất ngờ đổ xuống nhiều nơi ở TP.HCM. Tại phường Bình Lợi Trung (khu vực quận Bình Thạnh cũ), nước nhanh chóng dâng cao khiến đường Đặng Thùy Trâm chỉ sau 15 phút đã biến thành ""dòng sông"" giữa khu dân cư. Đặc biệt đoạn cuối tuyến, gần khu công viên và sông,ngập sâulút bánh xe máy. Nhiều người đi đường phải dắt bộ, dựng xe lên vỉa hè chờ nước rút. ""Mưa không lớn mà ngập nhanh lắm, xe tôi chết máy giữa đường, phải dắt cả cây số mới ra được chỗ khô"", anh Văn Vĩnh, tài xế xe công nghệ, chia sẻ. Nước thoát chậm do hệ thống cống cũ, mặt đường thấp và bị triều cường dồn ngược. Khi mưa nhỏ dần, nhiều người dân vẫn phải bì bõm lội nước về nhà, trẻ nhỏ đi học về được phụ huynh cõng qua đoạn ngập. Mới đây,UBND TP.HCMđã chấp thuận chủ trương đầu tư hơn 90 tỉ đồng để nâng cấp mặt đường, hệ thống cống, và ngày 17-10 vừa qua, thiết kế cải tạo cũng đã được phê duyệt. Tuy nhiên ngày dự án khởi công vẫn còn chờ, trong khi người dân vẫn phải ""chạy ngập"" mỗi khi mưa hoặc triều cường. Trong khi đó theo ghi nhận, một số tuyến đường khu vực trung tâm cũng bị ngập trong cơn mưa chiều ngày 8-11. Cụ thể khoảng 18h, đường Cống Quỳnh (phường Bến Thành) ngập gần nửa bánh xe, đặc biệt ở đoạn rẽ qua Bùi Viện. Nước ngập khiến nhiều xe chết máy, người dân dắt bộ giữa dòng nước giờ tan tầm, giao thông hỗn loạn. Vừa qua đoạn nước ngập, nhiều xe chết máy, người dân đứng đợi trên đường Cống Quỳnh gây ảnh hưởng giao thông - Ảnh: KỲ PHONG Nhiều người dân vất vả đi qua đoạn đường ngập nước trên đường Cống Quỳnh - khu vực trung tâm TP - Ảnh: KỲ PHONG Người dân dẫn bộ xe máy về nhà giờ tan tầm - Ảnh: KỲ PHONG Theo ghi nhận của Tuổi Trẻ Online vào lúc 21h ngày 8-11, nhiều tuyến đường trung tâm TP.HCM vẫn còn ngập nặng do cơn mưa lớn kết hợp triều cường. Trên đường Đề Thám (phường Cầu Ông Lãnh, TP.HCM) cơ quan chức năng phải ngắt điện chủ động để ngăn tai nạn. Một người dân sống tại hẻm 145 đường Đề Thám cho biết, vào khoảng 20h, khi nước vẫn còn ngập sâu, có một thanh niên đang đi trên đường bất ngờ bị giật ngã. Do bị cắt điện trong khi nước ngập vẫn chưa rút, cả tuyến đường Đề Thám chìm trong bóng tối, khiến việc đi lại của người dân gặp nhiều khó khăn. Có người phải tấp vào lề đợi nước rút bớt. Một số người dân cho biết đi qua đoạn ngập phải dò dẫm từng bước. Cuộc sống sinh hoạt của người dân bị đảo lộn, nhiều nhà phải dùng đèn pin để chiếu sáng, vài người khác phải ra trước nhà xem tình hình. Đến 21h30 cùng ngày, khu vực này vẫn chưa có điện trở lại. Theo Tổng công ty Điện lực TP.HCM, chiều cùng ngày do ngập cao nên đơn bị có chỉ đạo nhân viên chủ động ngắt điện để ngăn sự cố tai nạn. Các tủ điện của đơn vị hiện nay đều tự động hóa nên sẽ tự ngắt khi có sự cố. Tối nay toàn bộ các tủ điện trong khu ngập nước đều vận hành tốt, không xảy ra sự cố nào. Về việc có người bị giật điện là nghi do rò rỉ từ một điểm đấu nối của nhà dân. Nguyên nhân cụ thể vẫn đang được điều tra làm rõ. Nhân viên điện lực có mặt tại điểm ngập - Ảnh: HUỲNH ANH Nước dâng cao cộng cúp điện khiến xe và người đi chuyển gặp nhiều khó khăn - Ảnh: HUỲNH ANH Vị trí nghi ngờ rò rỉ điện gây sự cố tối 8-11 - Ảnh: EVNHCMC Triều cường kèm mưa lớn gần đây đang khiến nhiều khu vực trũng thấp của TP.HCM ""chìm trong nước"". Riêng bán đảo Thanh Đa (phường Bình Quới) hai ngày qua triều cường lập đỉnh, nước tràn xộc thẳng vào nhà khiến người dân không kịp trở tay."
Tuoi tre,https://tuoitre.vn/tac-duong-khien-tran-dau-cua-the-cong-viettel-lui-1-tieng-20251108193649092.htm,,"Thể Công - Viettel,PVF-CAND,Vleague",08/11/2025 20:12 GMT+7,Tắc đường khiến trận đấu của Thể Công - Viettel lùi 1 tiếng,"Trận đấu của Thể Công - Viettel bị ảnh hưởng bởi tác nhân bên ngoài - Ảnh: BTC Tối 8-11,CLB Thể Công - Viettelcó lịch đấu với PVF-CAND thuộc vòng 11 V-League 2025 - 2026. Theo lịch, trận đấu diễn ra lúc 18h tại sân Trung tâm PVF - Bộ Công an (tỉnh Hưng Yên). Thể Công - Viettel đã di chuyển rất sớm từ bản doanh đặt ở Hòa Lạc (Hà Nội), từ khoảng 3 tiếng trước trận (tức 15h). Theo quy định, các đội phải có mặt tại sân thi đấu 90 phút trước trận để khởi động và làm các thủ tục. Tuy nhiên chiều cùng ngày đã xảy ra tắc đường diện rộng do nhạc hội của G-Dragon. Điều này khiến cho chiếc xe chở thầy trò CLB Thể Công - Viettel không thể có mặt tại sân thi đấu đúng giờ. CLB PVF-CAND đã tổ chức khởi động nhưng sau đó phải cho cầu thủ vào nghỉ vì đối thủ chưa có mặt. Phía CLB Thể Công - Viettel, PVF-CAND và Công ty cổ phần Bóng đá chuyên nghiệp Việt Nam (VPF) đã nhanh chóng trao đổi với nhau và đề ra phương án ứng biến linh hoạt trước tình hình bất khả kháng. Ba bên thống nhất lùi giờ thi đấu 1 tiếng. Thể Công - Viettel cuối cùng cũng kịp có mặt để khởi động và thi đấu. Rất may cho hai CLB và ban tổ chức khi trận đấu có thể diễn ra bình thường. Trước vòng 11, Thể Công - Viettel đứng thứ 3 trên bảng xếp hạngV-League 2025 - 2026, còn PVF-CAND đứng chót. PVF-CAND rất quyết tâm tìm lại chiến thắng sau suốt 8 vòng toàn hòa và thua. Cầu thủ nhập tịch Đỗ Hoàng Hên lập cú đúp trong chiến thắng 4-0 của CLB Hà Nội trước PVF-CAND, thuộc vòng 10 V-League 2025-2026."
Tuoi tre,https://tuoitre.vn/nguoi-phat-ngon-bo-cong-an-thong-tin-ve-vu-an-hoang-huong-va-ngan-98-20251108145050027.htm,,"Hoàng Hường,Ngân 98,Lương Bằng Quang,Bộ Công an,Hàng giả",08/11/2025 16:23 GMT+7,Người phát ngôn Bộ Công an thông tin về vụ án Hoàng Hường và Ngân 98,"Thiếu tướng Nguyễn Quốc Toản - Chánh văn phòng, người phát ngôn Bộ Công an - trả lời tại họp báo - Ảnh: HỒNG QUANG Tại họp báo Chính phủ thường kỳ chiều 8-11,Tuổi Trẻ Onlineđặt câu hỏi liên quan tới vụ án của Hoàng Hường, Ngân 98 và Lương Bằng Quang cùng nhiều người nổi tiếng, người có ảnh hưởng xã hội bán các sản phẩm kém chất lượng, thậm chí là hàng giả, trốn thuế. Trả lời, thiếu tướng Nguyễn Quốc Toản - Chánh văn phòng, người phát ngôn Bộ Công an - cho biết liên quan vụ án Hoàng Hường, vào tháng 10, cơ quan cảnh sát điều tra đã có quyết định khởi tố vụ án, khởi tố bị can đối với 6 trường hợp. Tới ngày 27-10, qua công tác điều tra mở rộng, cơ quan điều tra đã khởi tố thêm 1 bị can là Nguyễn Thị Tường An (sinh năm 1993) về tội danh ""vi phạm quy định về kế toán gây hậu quả nghiêm trọng"". Ông Toản cho biết đối tượng này giúp sức cho Hoàng Hường che giấu doanh thu, giảm tiền phải nộp. Cơ quan điều tra đã kê biên 2 tài sản của Hoàng Hường ước tính trị giá trên 300 tỉ đồng, nhằm khắc phục hậu quả, thiệt hại. Vụ án này tiếp tục trong quá trình điều tra. Đối với vụ án Ngân 98 và Lương Bằng Quang, thiếu tướng Nguyễn Quốc Toản cho biết cơ quan điều tra đã khởi tố 3 bị can để điều tra về 3 hành vi ""sản xuất, buôn bán hàng giả là thực phẩm"", ""đưa hối lộ"" và ""môi giới hối lộ"". Vụ án này tiếp tục trong quá trình điều tra, thiếu tướng Nguyễn Quốc Toản cho hay Bộ Công an sẽ tiếp tục thông tin khi có kết quả. Bức ảnh chung khung của Trương Ngọc Ánh, Ngân 98 và Lương Bằng Quang bất ngờ 'gây bão' mạng xã hội, khi cả ba đều là những cái tên vướng vòng lao lý chỉ trong tháng 10-2025."
Tuoi tre,https://tuoitre.vn/bao-tuoi-tre-cung-hoi-golf-tp-da-nang-tang-qua-cuu-tro-cho-ba-con-vung-lu-202511082045166.htm,,"Mặt trận Tổ quốc Việt Nam,Hòa Vang,báo Tuổi Trẻ,golf,Đại Lộc",08/11/2025 21:13 GMT+7,Báo Tuổi Trẻ cùng Hội Golf TP Đà Nẵng tặng quà cứu trợ cho bà con vùng lũ,"Ông Mai Minh Vương (đại diện Hội Golf TP Đà Nẵng, áo trắng) và nhà báo Trường Trung (Bí thư Chi đoàn Văn phòng miền Trung, báo Tuổi Trẻ, áo đỏ) trao quà cho người dân - Ảnh: THANH THÙY Sau nhiều ngày mưa to, ngập lụt, TP Đà Nẵng bắt đầu hửng nắng, chuyến xe cứu trợ của Hội Golf TP Đà Nẵng và Chi đoàn Văn phòng miền Trung, báo Tuổi Trẻ lại tiếp tục lăn bánh, trao quà cho những hộ dân bị ảnh hưởng nặng do lũ lụt. Lần này, Hội Golf TP Đà Nẵng và Chi đoàn Văn phòng miền Trung, báo Tuổi Trẻ chọn xã Hòa Vang và xã Đại Lộc là địa điểm trao quà cho người dân. Đây là những nơi chịu ảnh hưởng nặng nề của lũ lụt. Tại xã Hòa Vang có 10 thôn ngập sâu, xã Đại Lộc có 30/33 thôn chìm trong nước lũ với mực nước cao từ 1-2m. Vài ngày trước, nước lũ dâng cao, chia cắt nhiều thôn xóm, hàng trăm hộ dân phải sơ tán khẩn cấp. Khi nước rút, người dân trở về trong cảnh tài sản hư hỏng, đồ đạc trôi dạt, ruộng vườn tan hoang. Giữa lúc ấy, những phần quà cứu trợ kịp thời như tiếp thêm động lực để bà con ổn định cuộc sống. 200 suất quà, 20 bình tích điện được gửi đến bà con xã Đại Lộc và xã Hòa Vang, tổng trị giá 140 triệu đồng. Mỗi suất trị giá 500.000 đồng bao gồm 300.000 đồng tiền mặt và các nhu yếu phẩm như dầu ăn, nước mắm, cá hộp… Từ rất sớm, bà con đã tụ về các điểm trao quà để nhận quà của đoàn cứu trợ - Ảnh: TRƯỜNG TRUNG Ông Mai Minh Vương, Phó chủ tịch kiêm Tổng thư ký Hội Golf TP Đà Nẵng, chia sẻ: ""Với tinh thần ""lá lành đùm lá rách"", Hội Golf TP Đà Nẵng cùng toàn thể hội viên đã nhanh chóng phát động quyên góp, chung tay hỗ trợ để san sẻ phần nào mất mát, giúp bà con sớm ổn định cuộc sống sau bão lũ. Chúng tôi chung tay, góp sức nhỏ bé với tấm lòng chia sẻ, luôn đồng hành cùng thành phố và bà con trong những lúc khó khăn"". Đầu giờ chiều, khi đoàn cứu trợ đến, rất đông bà con đã tụ về hội trường Ban Chỉ huy quân sự xã Hòa Vang. Những phần quà cứu trợ kịp thời như tiếp thêm động lực để bà con ổn định cuộc sống - Ảnh: THANH THÙY Vội vàng dựng chiếc xe đạp còn dính bùn đất sau trận lũ lịch sử, bà Nguyễn Thị Thám (67 tuổi, trú xã Hòa Vang) liền vào hội trường để kịp nhận quà. Bà Thám cho biết đợt lũ vừa qua khiến gà vịt trong nhà bà chết sạch, tủ lạnh, máy giặt và các đồ điện tử khác cũng bị ngâm nước nhiều ngày. ""Nghe tin có quà cứu trợ, tôi mừng lắm chớ. Họ bảo một miếng khi đói bằng một gói khi no mà. Trong những lúc khó khăn như vậy, những phần quà của mạnh thường quân thật sự rất trân quý, tôi rất cảm ơn tấm lòng của mọi người"", bà Thám nói. Khi biết đoàn cứu trợ tặng bình tích điện cho bà con, ông Đặng Cam (Trưởng Ban công tác Mặt trận thôn Thạch Bồ, xã Hòa Vang) rất tâm đắc, vì ông thấu hiểu sự khó khăn, bất tiện khi không có điện trong những lúc lũ bão. ""Bình tích điện là một món quà ý nghĩa, thiết thực mà mạnh thường quân gửi tặng đến bà con. Những lúc lũ lụt, không có điện nhiều ngày, có bình tích điện, chúng tôi có thể sinh hoạt, nấu nước sôi để ăn mì tôm, sạc điện thoại để liên lạc với người nhà. Đây là một món quà rất hữu ích, cảm ơn Hội Golf Đà Nẵng và báo Tuổi Trẻ đã kịp thời gửi những phần quà đến bà con"", ông Cam nói. 200 suất quà đã kịp gửi đến bà con xã Hòa Vang và xã Đại Lộc (TP Đà Nẵng) - Ảnh: TRƯỜNG TRUNG  Trước đó, để chia sẻ với những mất mát của bà con, Hội Golf TP Đà Nẵng đã trao số tiền 100 triệu đồng ủng hộ đồng bào bị thiệt hại do mưa lũ trên địa bàn thành phố và các khu vực lân cận, thông qua Ủy ban Mặt trận Tổ quốc Việt Nam TP Đà Nẵng. Đại diện Hội Golf TP Đà Nẵng trao tiền ủng hộ cho Ủy ban Mặt trận Tổ quốc Việt Nam TP Đà Nẵng - Ảnh: THANH THÙY  Những suất quà trao tay là tấm lòng, sự sẻ chia của Hội Golf TP Đà Nẵng và Chi đoàn Văn phòng miền Trung, báo Tuổi Trẻ gửi đến người dân vùng lũ - Ảnh: THANH THÙY Lần này, Hội Golf TP Đà Nẵng và Chi đoàn Văn phòng miền Trung, báo Tuổi Trẻ chọn xã Hòa Vang và xã Đại Lộc là địa điểm trao quà cho người dân - Ảnh: THANH THÙY Ông Mai Minh Vương, Phó chủ tịch kiêm Tổng thư ký Hội Golf TP Đà Nẵng, trao bình tích điện cho đại diện các thôn - Ảnh: TRƯỜNG TRUNG Tình nguyện viên bê quà ra xe giúp người dân - Ảnh: THANH THÙY Chiều 31-10, phóng viên báo Tuổi Trẻ tiếp tục trao 200 phần quà cứu trợ cho bà con vùng ngập sâu nhất tại thôn Trung Phước 2, xã Nông Sơn (Quảng Nam cũ). "
Tuoi tre,https://tuoitre.vn/dau-long-cay-si-hon-100-tuoi-tren-di-tich-thap-nhan-bi-bao-kalmaegi-danh-nga-no-luc-cuu-20251108191245391.htm,,"tháp Nhạn,phường Tuy Hòa,bão Kalmaegi,Đắk Lắk,bão số 13",08/11/2025 20:28 GMT+7,Đau lòng cây si hơn 100 tuổi trên di tích Tháp Nhạn bị bão Kalmaegi đánh ngã: Nỗ lực cứu!,"Cây si hơn 100 năm tuổi tại khuôn viên Tháp Nhạn bị bão Kalmaegi đánh bật gốc - Ảnh: MINH CHIẾN Ngày 8-11, ghi nhận củaTuổi Trẻ Online,cây si bị bật gốc ngay khuôn viênTháp Nhạnkhiến một phần tường rào, nền gạch sân tháp bị hư hại. Cây si bật gốc do bão số 13 - Ảnh: MINH CHIẾN Trước đó trên mạng xã hội đăng tải nhiều clip bày tỏ sự tiếc nuối khi cây si đổ ngã. Bạn Nguyễn Christina chia sẻ: ""Lên Tháp Nhạn mà không có cây này thì nắng không biết núp chỗ nào luôn. Quá tiếc cây cổ thụ cả trăm năm này"". Bạn Huy Thành chia sẻ: ""Cây si này không chỉ lâu năm mà còn là nơi gắn với nhiều kỷ niệm đi đôi với sự lâu đời của di tích. Thời cấp 2, cấp 3 tôi thường đến đây ngồi dưới gốc cây hóng mát, ngắm toàn cảnh Tuy Hòa"". Cô Mận là người bán nước dưới gốc cây si, cho hay: ""Bão lớn quá, hôm qua tôi lên thấy cây si bật gốc mà muốn khóc theo luôn. Cây phải hơn 100 tuổi, trên cây có nhiều tổ chim và sóc nữa, tôi cũng nhờ bóng râm của cây mà bán nước phục vụ khách tham quan"". Ông Nguyễn Văn Phúc, Tổ trưởng Tổ quản lý di tích Tháp Nhạn, cho hay đơn vị đã báo cáo thiệt hại đến UBND phường Tuy Hòa. Ông nói cây si bị bật gốc trong khuôn viên Tháp Nhạn sẽ được công nhân môi trường cắt tỉa cành và cho dựng lại, trồng tại nơi vị trí cây ngã đổ. Theo báo cáo của UBND phường Tuy Hòa, có 80 cây xanh đô thị bị ngã đổ, 7 căn nhà bị sập một phần, 44 căn nhà bị tốc mái... Nhiều bài đăng trên mạng xã hội tiếc nuối khi cây si bật gốc - Ảnh chụp màn hình Lối đi bộ lên Tháp Nhạn bị cây đổ chắn đường - Ảnh: MINH CHIẾN Cây si với kích thước khủng bật gốc xuống bên dưới núi - Ảnh: MINH CHIẾN Những chiếc xuồng chèo vào xóm Đồng Cháy - Ảnh: MINH CHIẾN Sau bão số 13, nước lũ dâng cao khiến xóm Đồng Cháy (thôn Phước Lương, xã Ô Loan, Đắk Lắk, trước thuộc tỉnh Phú Yên) bị cô lập hoàn toàn. Hiện nước vẫnngập sâu1 - 2m, đường độc đạo dẫn vào xóm vẫn chìm trong dòng lũ khiến các hộ dân bị cô lập hoàn toàn gần 2 ngày nay. Họ hầu như trông chờ vào các lực lượng cứu trợ và người dân tình nguyện chèo xuồng mang mì gói, nước, bánh mì đến từng nhà... Bà Đặng Thị Hân (53 tuổi) chia sẻ: ""Bão đã làm tốc mái tôn nhà tôi, chưa kịp sửa chữa thì nước lũ ập đến không biết xoay xở làm sao. Giếng cũng bị ngập, không có nước sạch để dùng. Đường sá ngập nên dân không đi chợ mua được đồ ăn. Nhiều nhà phải trông chờ hoàn toàn vào đoàn từ thiện, các đội tiếp tế"". Theo người dân, xóm Đồng Cháy nằm ở vùng trũng, xung quanh là ruộng lúa rộng và một con sông nhỏ chảy qua. Mỗi khi mưa lớn kéo dài, nước đổ về khiến khu vực này nhanh chóng bị ngập. Ông Nguyễn Văn Tú - Trưởng Ban công tác mặt trận thôn Phước Lương - cho biết 218 hộ ở khu Đồng Cháy đang bị cô lập hoàn toàn. Đến trưa nay nước đã rút bớt nhưng bà con vẫn chưa thể ra ngoài được, việc tiếp tế hỗ trợ người dân sẽ được duy trì đến khi nước rút hoàn toàn. Các đội tiếp tế xếp hàng cứu trợ lên xuồng - Ảnh: MINH CHIẾN Chèo xuồng chở hàng để tiếp tế cho bà con vùng lũ - Ảnh: MINH CHIẾN Các đội nhóm thiện nguyện nấu cơm gửi đến bà con vùng lũ - Ảnh: MINH CHIẾN Hàng vạn lồng bè tan hoang, người dân vùng biển phía đông Đắk Lắk vật lộn khôi phục sinh kế sau bão số 13 (Kalmaegi)."
