Source,URL,Category,Keyword,Time,Title,Content
ZNews,https://lifestyle.znews.vn/da-lat-lot-top-diem-den-gia-re-bac-nhat-chau-a-dip-he-post1565461.html,Du lịch,Null,"Thứ năm, 3/7/2025 15:55 (GMT+7)",Đà Lạt lọt top điểm đến giá rẻ bậc nhất châu Á dịp hè,"Du khách chụp ảnh tại đồi ""uyên ương"" - ngọn đồi nằm trong khu vực hồ Suối Vàng (hồ Dankia) tại tỉnh Lâm Đồng, cách Đà Lạt khoảng 12 km, tháng 5/2024. Ảnh:Quỳnh Danh. Ngày 2/7, nền tảng du lịch kỹ thuật số Agoda công bố danh sách các điểm đến tiết kiệm nhất tại châu Á trong giai đoạn tháng 6-8, tức mùa hè 2025. Bảng xếp hạng ""Điểm đến mùa hè tiết kiệm nhất"" dựa trên mức giá phòng trung bình tại 10 điểm đến phổ biến nhất thuộc 9 thị trường du lịch châu Á, giúp du khách đưa ra lựa chọn hợp túi tiền cho kỳ nghỉ hè. Đáng chú ý, Đà Lạt (Lâm Đồng) lấy lại vị thế là điểm đến có chi phí hợp lý bậc nhất, sau khi vắng mặt khỏi bảng xếp hạng vào mùa xuân năm nay. Thành phố đứng ở vị trí thứ 5, mang đến cho du khách một kỳ nghỉ dưỡng lý tưởng giữa không gian núi rừng thơ mộng với chi phí phải chăng. Việc Đà Lạt xuất hiện nổi bật trong top 5 điểm đến giá rẻ cho thấy sức hút ngày càng lớn của Việt Nam với vai trò là điểm đến vừa tiết kiệm, vừa giàu trải nghiệm, ông Vũ Ngọc Lâm, Giám đốc Quốc gia Agoda Việt Nam, nhận định. Nữ du khách check-in tại dốc Sương Nguyệt Anh (TP Đà Lạt) vào chiều 2/5. Ảnh:Tường Vi. Dẫn đầu bảng xếp hạng là thành phố Surabaya (Indonesia), theo sau là Tirupati (Ấn Độ) và đứng vị trí thứ 3 là Hat Yai (Thái Lan) với mức giá phòng trung bình lần lượt là 920.000 đồng/đêm, 972.000 đồng/đêm và hơn 1 triệu đồng/đêm. Được biết đến với bề dày lịch sử và nền văn hóa sống động, Surabaya mang đến cho du khách hành trình khám phá kiến trúc cổ kính, những khu chợ sầm uất và ẩm thực đường phố. Khi ghé thăm nơi đây, bạn có thể khám phá các danh thắng lân cận như núi lửa Bromo kỳ vĩ và đảo Madura. Thành phố Nagoya, địa danh chinh phục du khách nhờ trải nghiệm liên quan đến lịch sử, lâu đài, cũng nằm trong danh sách trên, ở vị trí thứ 7. Mức giá phòng trung bình tại đây là 2,4 triệu đồng/đêm. Ngoài ra, các tín đồ ẩm thực khi đến Nagoya có thể thưởng thức món hitsumabushi (lươn nướng) trứ danh. Trong khi đó, những du khách yêu thích mua sắm có thể tìm những món đồ độc đáo tại các quận mua sắm tấp nập. Danh sách 9 điểm đến có chi phí tiết kiệm nhất mùa hè 2025 của Agoda: 1. Surabaya (Indonesia) - mức giá phòng trung bình là 920.000 đồng/đêm 2. Tirupati (Ấn Độ) - 972.000 đồng/đêm 3. Hat Yai (Thái Lan) - 1 triệu đồng/đêm 4. Đà Lạt (Việt Nam) - 1,1 triệu đồng/đêm 5. Iloilo (Philippines) - 1,2 triệu đồng/đêm 6. Kuching (Malaysia) - 1,9 triệu đồng/đêm 7. Nagoya (Nhật Bản) - 2,4 triệu đồng/đêm 8. Cao Hùng (Đài Loan) - 2,4 triệu đồng/đêm 9. Daejeon (Hàn Quốc) - 2,44 triệu đồng/đêm Du lịch là để tận hưởng hay sống ảo? Theo TS Đặng Hoàng Giang - tác giả cuốn sáchVẻ đẹp của cảnh sắc tầm thường- việc chạy theo những gì được cho là đẹp theo tiêu chuẩn số đông đang phá vỡ sự nguyên sơ, gây tổn hại nghiêm trọng đến hệ sinh thái tự nhiên. MụcDu lịch - Ẩm thựcgiới thiệu nội dung buổi chia sẻ của tác giả Đặng Hoàng Giang về quan điểm du lịch đang khiến con người quên đi việc tận hưởng vẻ đẹp của thiên nhiên. > Đọc tiếp:Hệ luỵ của du lịch 'sống ảo'  Tại sao khách ngoại chưa 'phát cuồng' vì Đà Lạt? Được mệnh danh là ""thủ phủ chữa lành"" đối với khách nội địa, Đà Lạt lại chưa chứng tỏ sức hút với khách quốc tế mặc cho có nét tương đồng với Bali, Chiangmai.  Tôi lần đầu đưa bà ngoại 88 tuổi du lịch Đà Lạt Bà ngoại ít khi rời khỏi quê, nhưng lại đồng ý cùng tôi đến TP Đà Lạt (Lâm Đồng). Bà đã lớn tuổi, nhưng vẫn thích thú khi ngắm hoàng hôn, ăn khoai lang nướng và chụp ảnh khắp nơi.  Khách Anh 'phát cuồng' thử bánh tráng nướng ở chợ đêm Đà Lạt 06:04 3/5/202506:043/5/2025Ẩm thựcẨm thực 0 Jack Pates thưởng thức 3 chiếc bánh tráng nướng/lần tại chợ đêm Đà Lạt. Nam du khách quốc tịch Anh ghé đến 2-3 quầy hàng tương tự để so sánh độ ngon."
ZNews,https://lifestyle.znews.vn/tai-xe-tra-lai-1-5-trieu-dong-sau-vu-chat-chem-khach-philippines-post1565718.html,Du lịch,Null,"Thứ năm, 3/7/2025 14:02 (GMT+7)","Tài xế trả lại 1,5 triệu đồng sau vụ 'chặt chém' khách Philippines","Quảng trường Đông Kinh Nghĩa Thục nơi nhóm du khách bắt taxi. Ảnh:Việt Hà. Chiều 3/7, chỉ huy Công an phường Hoàn Kiếm (TP Hà Nội) cho biết đơn vị đã triệu tập tài xế taxi trong vụnhóm du khách Philippines bị ép trả 1,5 triệu đồng cho cuốc xe 2 km. ""Tài xế đã thừa nhận hành vi sai phạm và hoàn trả lại số tiền 1,5 triệu đồng cho nhóm khách"", vị đại diện cho hay. Cơ quan chức năng đang lập hồ sơ để xử lý theo quy định, đồng thời liên hệ nhóm du khách để trao lại số tiền trên. Trước đó, hướng dẫn viên tên H. cho biết nhóm khách Philippines, chủ yếu là sinh viên, đã chọn di chuyển bằng taxi do mưa lớn bất ngờ khi đang đi bộ đến nhà hàng tối 30/6. Dù đã cung cấp địa chỉ rõ ràng, tài xế không đi đúng tuyến, viện lý do ""trời mưa và đường một chiều"", sau đó thu phí 1,5 triệu đồng cho chặng đường từ quảng trường Đông Kinh Nghĩa Thục đến nút giao phố Hàng Tre - Lò Sũ dài khoảng 2 km. Do lo ngại và bất đồng ngôn ngữ, nhóm khách không phản ứng tại chỗ mà thông báo lại cho hướng dẫn viên. Hôm sau, sự việc được chia sẻ lên mạng xã hội, thu hút sự quan tâm của cộng đồng mạng. Đây không phải lần đầu du khách tố bị ""chặt chém"" tiền taxi tại Hà Nội. Nhiều chuyên gia du lịch cho rằng những hành vi này ảnh hưởng tiêu cực đến hình ảnh du lịch Hà Nội nói riêng và Việt Nam nói chung trong mắt bạn bè quốc tế. Cơ quan chức năng khuyến cáo du khách nên sử dụng dịch vụ taxi có thương hiệu uy tín hoặc đặt xe qua ứng dụng để tránh bị thu phí không minh bạch. Đồng thời, chính quyền sẽ tiếp tục tăng cường kiểm tra, xử lý các trường hợp vi phạm, góp phần xây dựng hình ảnh thủ đô văn minh, thân thiện và an toàn với du khách. Du lịch là để tận hưởng hay sống ảo? Theo TS Đặng Hoàng Giang - tác giả cuốn sáchVẻ đẹp của cảnh sắc tầm thường- việc chạy theo những gì được cho là đẹp theo tiêu chuẩn số đông đang phá vỡ sự nguyên sơ, gây tổn hại nghiêm trọng đến hệ sinh thái tự nhiên. MụcDu lịch - Ẩm thựcgiới thiệu nội dung buổi chia sẻ của tác giả Đặng Hoàng Giang về quan điểm du lịch đang khiến con người quên đi việc tận hưởng vẻ đẹp của thiên nhiên. > Đọc tiếp:Hệ luỵ của du lịch 'sống ảo'  Khách Philippines bị ép trả 1,5 triệu đồng cuốc xe 2 km ở Hà Nội Nhóm du khách Philippines phản ánh bị tài xế taxi thu 1,5 triệu đồng cho chặng đường chưa đến 2 km trong khu vực phố cổ Hà Nội.  Khách Đài Loan bị thu 900.000 đồng từ sân bay Nội Bài về khách sạn Sau khi rời sân bay Nội Bài, du khách Đài Loan bị tài xế ""chặt chém"" 900.000 đồng cho quãng đường về trung tâm Hà Nội. Cơ quan chức năng nhanh chóng xử lý sự việc.  Phạt gần 100 triệu đồng nhà hàng 'chặt chém' khách Trung ở Nha Trang Sau thời hạn 7 ngày giải trình, chủ quán Aroma Beach bị xử phạt 15 triệu đồng vì hành vi bán cao so với giá niêm yết. Tổng cộng, đơn vị này bị phạt 5 lỗi với số tiền 96,5 triệu đồng."
ZNews,https://lifestyle.znews.vn/khong-nhan-ra-phu-quy-vung-tau-qua-lich-su-anh-google-maps-post1565430.html,Du lịch,Null,"Thứ năm, 3/7/2025 16:26 (GMT+7)","Không nhận ra Phú Quý, Vũng Tàu qua lịch sử ảnh Google Maps","Chỉ trong vòng vài năm (2019-2025), khu vực Bãi Sau Vũng Tàu (TP.HCM) ""thay da đổi thịt"" với hàng loạt khách sạn, cao ốc mọc lên san sát, khiến diện mạo du lịch nơi đây có nhiều khác biệt so với hình ảnh trước kia. Hàm Cá Mập - một biểu tượng quen thuộc nằm ngay quảng trường Đông Kinh Nghĩa Thục (Hà Nội) - từng là nơi tụ họp lý tưởng để ngắm phố đi bộ Hồ Gươm từ trên cao. Tuy nhiên, đến tháng 6 năm nay, tòa nhà đang từng bước được tháo dỡ. Từ bãi đất hoang ven sông vắng bóng người qua lại, khu vực Thủ Thiêm (TP.HCM) nay đã khoác lên mình diện mạo mới với Công viên bờ sông Sài Gòn hiện đại, nhiều mảng xanh, lối đi bộ và không gian mở hướng thẳng về trung tâm quận 1. Nơi đây nhanh chóng trở thành điểm check-in yêu thích của giới trẻ nhờ view ""triệu đô"" - đặc biệt lúc hoàng hôn (ảnh 2018-2023). Qua ảnh Google Maps giai đoạn 2017-2024, khu vực công viên Bến Bạch Đằng (TP.HCM) ghi nhận nhiều thay đổi với thảm cỏ xanh, lối đi bộ ven sông được quy hoạch gọn gàng. Xa xa, cầu Ba Son - cây cầu biểu tượng nối trung tâm thành phố với Thủ Thiêm - vắt ngang dòng sông như một dấu ấn hiện đại. Phía bên kia sông, khu đô thị Thủ Thiêm cũng dần thành hình với những khối nhà cao tầng, công viên mới. Chỉ trong vòng 4 năm (2019-2023), ""cây cô đơn"" nổi tiếng trên đảo Phú Quý (Lâm Đồng) đã vươn tán rất rộng, che phủ một khoảng đất trống. Từ chỗ là nơi nghỉ mát quen thuộc của người dân địa phương, gốc cây đơn độc nay trở thành điểm check-in ""phải ghé"" với hàng trăm lượt khách mỗi ngày. Tại Dốc Phượt đảo Phú Quý (Lâm Đồng), bờ kè mới được xây dựng, thay thế hình ảnh trơ trụi, hoang sơ trước kia. Địa điểm này vẫn giữ nguyên sức hút với du khách, đặc biệt là giới trẻ, nhờ khung cảnh biển trời thoáng đãng và cung đường uốn lượn đặc trưng (ảnh 2019-2023). Tháp Trầm Hương - biểu tượng du lịch quen thuộc tại Nha Trang (Khánh Hòa) - đã có sự thay đổi về diện mạo trong giai đoạn 2017-2025. Theo ảnh tư liệu trên Google Maps, công trình này từng mang tông hồng cam đặc trưng nhưng hiện nay đã được sơn lại toàn bộ bằng màu trắng. Ở vịnh Vĩnh Hy (Khánh Hòa), số lượng nhà bè, ca nô neo đậu và nhà cửa tăng lên thấy rõ trong giai đoạn 2019-2023. Từ một vùng vịnh còn hoang sơ, yên ả, khu vực này ngày càng trở nên sầm uất hơn dưới tác động của hoạt động du lịch và khai thác ven biển. Chợ Đà Lạt (Lâm Đồng) ngày càng sầm uất hơn trong giai đoạn 2017-2025. So với vẻ thông thoáng trước kia, hình ảnh từ Google Maps cho thấy số lượng gian hàng tăng lên đáng kể, nhiều khu vực được bổ sung mái che. Với các món ăn phong phú và đặc sắc, Việt Nam được xếp vào danh sách những quốc gia có nền ẩm thực tuyệt vời của thế giới. Mục Du lịch - Ẩm thực giới thiệu hai cuốn sáchLê la quà vặtvàĂn quà xuyên Việt.Xuất bản năm 2017, đây có lẽ là những cuốn sách tranh ẩm thực đầu tiên của một tác giả Việt được xuất bản. Bằng những hình vẽ dễ thương và sinh động, vui tươi và hài hước, những trang vẽ của Đặng Hồng Quân khiến người xem như có thể mường tượng ra khung cảnh náo nhiệt của các hàng quà, thậm chí có đôi khi lộn xộn, nhôm nhoam như ngoài đời thực ta có thể vẫn bắt gặp. > Đọc tiếp:'Từ điển' món ngon nước Việt bằng tranh"
ZNews,https://lifestyle.znews.vn/du-lich-nhat-ban-lao-dao-vi-loi-don-dong-dat-post1565664.html,Du lịch,Null,"Thứ năm, 3/7/2025 12:42 (GMT+7)",Du lịch Nhật Bản lao đao vì lời đồn động đất,"Thảm họa động đất ngày 1/1/2024 tại bán đảo Noto (Nhật Bản) khiến ít nhất 616 người thiệt mạng, hơn 1.300 người bị thương, 190.000 công trình bị hư hại, nhiều khu vực bị cô lập do sạt lở. Ảnh:Kim Kyung-Hoon/Reuters. Ngành du lịch Nhật Bản đang đối mặt với khủng hoảng khi tin đồn về một thảm họa động đất và sóng thần được dự đoán xảy ra vào đầu tháng 7, gây nên làn sóng lo ngại trên mạng xã hội. Nỗi sợ hãi này đang làm tê liệt hoạt động du lịch, đặc biệt tại các tỉnh phía Nam như Kagoshima và Kumamoto - những điểm đến vốn phụ thuộc nhiều vào du khách mùa hè. Tin đồn bắt nguồn từ mộtlời tiên tri được cho là của họa sĩ manga Ryo Tatsuki, người từng gây chú ý sau khi dự đoán đúng thảm họa động đất và sóng thần năm 2011. Cảnh báo mới nhất trong phiên bản sách phát hành năm 2021 nhắc đến “thảm họa thực sự” sẽ xảy ra cụ thể vào ngày 5-7/7/2025, liên quan tới một trận động đất và sóng thần lớn tại Nhật Bản. Mạng xã hội nhanh chóng trở thành “điểm nóng” với những cuộc bàn tán, chia sẻ thông tin về lời tiên đoán này. Không ít người kêu gọi tránh du lịch đến Nhật Bản trong khoảng thời gian nói trên. Sự lo lắng càng tăng cao khi nhiều “chuyên gia tâm linh” tự xưng cùng tham gia lan truyền dự đoán thảm họa. Khách hàng hoảng hốt cúi người tìm chỗ an toàn trong siêu thị ở Toyama, Nhật Bản, sau trận động đất ngày 1/1/2024. Ảnh:Reuters. Hậu quả đến rất nhanh. Nhiều du khách, đặc biệt từ Hong Kong (Trung Quốc) và các nước châu Á, đồng loạt hủy chuyến. Hong Kong Airlines thông báo hủy toàn bộ các chuyến bay đến Kagoshima và Kumamoto (Nhật Bản) trong tháng 7 và 8 do nhu cầu giảm mạnh. Các công ty lữ hành cũng ghi nhận lượng đặt tour lao dốc, buộc phải tung ra các chương trình giảm giá và khuyến mãi để kéo khách du lịch, theoTravel And Tour World. Tình hình càng đáng lo ngại khi các điểm du lịch, khách sạn, nhà hàng ở khu vực phía nam Nhật Bản vốn đã chật vật phục hồi sau đại dịch Covid-19, nay tiếp tục đối mặt thêm cú giáng mới. Mùa hè vốn là thời điểm “vàng” cho du lịch địa phương, nay lại phủ bóng lo âu và sụt giảm doanh thu. Trước làn sóng hoảng loạn, chính phủ Nhật Bản lên tiếng trấn an, khẳng định ""không có bất kỳ cơ sở khoa học nào cho những lời tiên tri này"". Ban Phòng chống Thảm họa thuộc Văn phòng Nội các tuyên bố: “Với kiến thức khoa học hiện nay, không thể dự đoán chính xác ngày, giờ và địa điểm xảy ra động đất”. Các nhà địa chấn học cũng đồng tình, nhấn mạnh chưa có bất kỳ phương pháp nào cho phép dự báo cụ thể về thời gian và nơi chốn của một trận động đất. Cơ quan Khí tượng Nhật Bản. Ảnh:Kyodo. Dẫu vậy, tác động lên ngành du lịch Nhật Bản là rất rõ ràng. Theo Tổ chức Du lịch Quốc gia Nhật Bản (JNTO), du lịch nội địa vẫn giữ được sức hút đầu năm nay, song tâm lý e ngại thảm họa đã khiến lượng khách giảm đột ngột, đặc biệt tại các điểm du lịch phía Nam. Sau đại dịch Covid-19, ngành du lịch Nhật Bản vẫn đang trên đà phục hồi, nên cú sốc này khiến nhiều doanh nghiệp địa phương thêm lao đao. Chính phủ đang tăng cường truyền thông để xoa dịu tâm lý du khách, kêu gọi mọi người tiếp cận thông tin qua các nguồn chính thức. Bên cạnh đó, JNTO cũng đẩy mạnh quảng bá các điểm đến văn hóa, cảnh quan thiên nhiên và thành phố sôi động để khôi phục niềm tin vào du lịch Nhật Bản. Nhật Bản vẫn được đánh giá là quốc gia có hệ thống phòng chống thiên tai hàng đầu thế giới, với các công nghệ cảnh báo sớm và quy trình ứng phó khẩn cấp rất bài bản. Tuy nhiên, thách thức lớn nhất lúc này không phải thiên tai, mà chính là tin đồn thất thiệt, gây hoang mang và kéo lùi đà phục hồi du lịch. Travel blogger truyền cảm hứng du lịch qua những câu chuyện đầy màu sắc về những điểm đến mới lạ, những trải nghiệm độc đáo mà họ khám phá được trong hành trình. Những bài viết, video hay hình ảnh của họ không chỉ mang lại kiến thức về địa lý, mà còn khơi gợi niềm đam mê khám phá thế giới. Đọc sách là một phần không thể thiếu trong hành trình này, giúp họ tìm hiểu sâu sắc hơn về văn hóa, lịch sử và con người ở mỗi nơi. MụcDu lịch - Ẩm thựcgiới thiệu chân dung travel blogger kiêm tác sách, những con người lan tỏa nguồn cảm hứng xê dịch và tiếp nạp tri thức. > Xem thêm:Travel blogger Đinh Hằng: Thật khó để cô đơn khi du lịch một mình  Khách Hong Kong kéo đến Việt Nam vì lo ngại động đất Nhật Bản Mối lo ngại gia tăng về động đất khiến du khách Hong Kong chuyển hướng sang Hàn Quốc, Việt Nam và các thành phố phía tây Trung Quốc đại lục cho kỳ nghỉ hè năm nay.  Nhân viên sở thú đóng giả hổ, diễn tập động đất ở Nhật Bản Nhằm đảm bảo an toàn cho du khách, sở thú ở Nhật Bản tập huấn xử lý giả định có động đất. Một nhân viên tại đây gây chú ý với màn hóa trang hổ trắng.  Nhật Bản 'cấm cửa' khách không có bảo hiểm y tế 08:20 8/6/202508:208/6/2025Du lịchĐịa điểm du lịch 01 Du khách quốc tế chưa thanh toán viện phí sẽ bị cấm rời khỏi Nhật Bản. Ngoài ra, những ai muốn nhập cảnh nước này buộc mua bảo hiểm y tế, theo SCMP."
ZNews,https://lifestyle.znews.vn/khach-hut-thuoc-chay-dem-khach-san-cua-lo-yeu-cau-den-4-8-trieu-dong-post1565731.html,Du lịch,Null,"Thứ năm, 3/7/2025 15:03 (GMT+7)","Khách hút thuốc cháy đệm, khách sạn Cửa Lò yêu cầu đền 4,8 triệu đồng","Du khách Hà Nội hút thuốc lá gây cháy ga giường và đệm. Ảnh:T.T. Ngày 2/7, tài khoản T.T. chia sẻ trên một hội nhóm đông thành viên về việc bị một khách sạn tại Cửa Lò (Nghệ An) yêu cầu bồi thường 4,8 triệu đồng vì hút thuốc lá làm cháy đệm và ga giường trong phòng. Người này thừa nhận sai phạm, song cho rằng mức bồi thường quá nhiều. ""Tôi hút thuốc, có làm cháy chút ga giường phòng nghỉ. Chủ khách sạn bắt đền 4,8 triệu đồng. Tôi sai thì chấp nhận nhưng vết cháy như kia thì hơi gắt"", tài khoản này viết. Bài đăng nhanh chóng nhận về hàng nghìn lượt bình luận, phần lớn đồng tình với cách xử lý của khách sạn. Nhiều ý kiến nhấn mạnh việc hút thuốc trong không gian kín không chỉ ảnh hưởng đến người khác mà còn tiềm ẩn nguy cơ hỏa hoạn. ""Khách sạn nào cũng quy định cấm hút thuốc. Mùi bám vào nệm rất khó xử lý, chưa kể lỡ bắt lửa thì thiệt hại lớn hơn nhiều. Bồi thường thế là còn nhẹ"", một người dùng mạng bình luận. Tàn thuốc lá gây cháy xuống bề mặt đệm. Ảnh:T.T. Chiều 3/7, trao đổi vớiTri Thức - Znews, ông Nguyễn Thế Hiển, Giám đốc điều hành khách sạn, xác nhận sự việc. Ông cho biết du khách Hà Nội lưu trú tại phòng ở tầng 6 từ ngày 29/6 đến 2/7. Trong thời gian đó, người này đã hút thuốc trong phòng làm cháy 2 tấm ga và một chiếc đệm. Khách sạn yêu cầu khách bồi thường theo đúng giá trị gốc của đồ vật bị hỏng, bao gồm: một ga giường 450.000 đồng, một ga chống thấm 450.000 đồng và một tấm đệm 3,9 triệu đồng. Tổng cộng 4,8 triệu đồng. Du khách có quyền mang đồ về, nhưng họ không tiện mang, nên khách sạn mua lại với giá 800.000 đồng. ""Chúng tôi không đưa ra bất kỳ mức phạt nào ngoài việc yêu cầu bồi thường đúng giá trị tài sản bị hư hỏng. Dù chưa xử lý theo quy định phòng cháy chữa cháy, hành vi hút thuốc trong không gian kín vẫn tiềm ẩn nguy cơ cháy nổ nghiêm trọng"", ông Hiển nói. Đại diện khách sạn cũng cho biết đây là mùa cao điểm du lịch, phòng thường xuyên kín khách, nên đơn vị phải khắc phục sự cố ngay để tiếp tục phục vụ khách sau. Cùng ngày, Phòng Văn hóa - Xã hội phường Cửa Lò đã cử cán bộ đến xác minh sự việc. Qua kiểm tra, cơ quan chức năng xác nhận nhân viên khách sạn đã xử lý đúng quy định. Nội quy cấm hút thuốc được thông báo rõ ràng, việc yêu cầu bồi thường là hợp lý và có cơ sở. Travel blogger truyền cảm hứng du lịch qua những câu chuyện đầy màu sắc về những điểm đến mới lạ, những trải nghiệm độc đáo mà họ khám phá được trong hành trình. Những bài viết, video hay hình ảnh của họ không chỉ mang lại kiến thức về địa lý, mà còn khơi gợi niềm đam mê khám phá thế giới. Đọc sách là một phần không thể thiếu trong hành trình này, giúp họ tìm hiểu sâu sắc hơn về văn hóa, lịch sử và con người ở mỗi nơi. MụcDu lịch - Ẩm thựcgiới thiệu chân dung travel blogger kiêm tác sách, những con người lan tỏa nguồn cảm hứng xê dịch và tiếp nạp tri thức. > Xem thêm:Travel blogger Đinh Hằng: Thật khó để cô đơn khi du lịch một mình  Khách liên tục bị lừa đặt phòng ở Cửa Lò Rất nhiều người bị kẻ mạo danh khách sạn ở Cửa Lò lừa lấy tiền đặt cọc ăn nghỉ, chính quyền địa phương đã đề nghị công an vào cuộc. Nhiều khách sạn lớn cũng đã làm đơn tố giác tội phạm.  Cửa Lò chật kín du khách tắm biển chiều cuối tuần Ngay khi trẻ em kết thúc năm học, nhiều gia đình đã đưa con đến bãi biển Cửa Lò (Nghệ An) du lịch, tắm mát. Bãi tắm dài hơn 10 km với bãi cát mịn chật kín du khách.  Môtô nước đe dọa khách tắm biển ở Cửa Lò Du khách khi đến tắm biển Cửa Lò (Nghệ An), tỏ ra khiếp sợ khi chứng kiến môtô nước chạy bát nháo vào khu vực người dân đang tắm, đón trả khách không đúng nơi quy định."
