Source,URL,Category,Keyword,Time,Title,Content
ZNews,https://znews.vn/26-quan-ngon-dia-phuong-duoc-vinh-danh-quan-tru-danh-xu-hue-post1550498.html,Kinh doanh,Null,"Thứ sáu, 2/5/2025 18:00 (GMT+7)",26 quán ngon địa phương được vinh danh Quán ‘Trứ danh’ xứ Huế,"Tối ngày 29/4, lễ khai mạc Chương trình “Huế - Kinh đô ẩm thực” đã được diễn ra tại Công viên Thương Bạc (quận Phú Xuân, TP Huế) nhằm trình diễn, giới thiệu và quảng bá các loại hình ẩm thực Việt nói chung và ẩm thực Huế nói riêng đến với du khách và nhân dân trên địa bàn thành phố. Trong khuôn khổ của buổi lễ khai mạc, Grab Việt Nam cùng với sự đồng hành của Sở Du lịch TP Huế lần đầu tiên tổ chức Lễ trao giải “Quán ‘Trứ danh’ xứ Huế” nhằm chung tay tôn vinh, bảo tồn và lan tỏa giá trị ẩm thực độc đáo của đất cố đô. Giải thưởng “Quán ‘Trứ Danh’ xứ Huế” được xét chọn dựa trên bộ tiêu chí rõ ràng, kết hợp hài hòa giữa hai nguồn đánh giá đáng tin cậy, bao gồm nguồn dữ liệu - đánh giá khách quan từ cộng đồng người dùng Grab và từ Sở Du lịch TP Huế, dựa trên quá trình tham vấn ý kiến chuyên gia, các hội lữ hành cũng như khảo sát thực tế từ du khách. Các giải thưởng được chia làm ba hạng mục chính, với sáu danh hiệu bao gồm: Hạng mục “Hương vị trứ danh” gồm giải “Biểu tượng ẩm thực địa phương” và giải “Tinh hoa gia truyền”, hạng mục “Được yêu thích nhất” gồm giải “Được khách hàng Grab yêu thích nhất” và giải “Dịch vụ xuất sắc”, hạng mục “Ngôi sao tăng trưởng” gồm giải “Ngôi sao triển vọng” và giải “Đột phá sáng tạo”. Phát biểu tại buổi lễ trao giải, bà Đặng Thùy Trang, Giám đốc Đối ngoại Grab Việt Nam chia sẻ: “Sáng kiến Lễ trao giải thưởng Quán ‘Trứ Danh’ xứ Huế này trở thành hiện thực chính là nhờ sự ủng hộ quý báu và hợp tác chặt chẽ từ Sở Du lịch TP Huế. Chúng tôi tin tưởng rằng hoạt động này sẽ tiếp tục đóng góp thêm vào sự hợp tác giữa Grab với TP Huế nói chung và Sở Du lịch nói riêng trong việc quảng bá mạnh mẽ hình ảnh Huế như “Kinh đô ẩm thực” đặc sắc, nổi bật trên bản đồ du lịch Việt”. Lễ trao giải “Quán ‘Trứ danh’ xứ Huế” đồng thời thể hiện cam kết của Grab Việt Nam trong việc đồng hành cùng TP Huế trong việc thúc đẩy chuyển đổi số trong lĩnh vực du lịch, tận dụng thế mạnh công nghệ để quảng bá di sản, văn hoá và ẩm thực. Đây cũng là một trong những lĩnh vực then chốt nằm trong biên bản thỏa thuận hợp tác ba năm giữa Grab Việt Nam và TP Huế ký kết đầu năm nay. Trong khuôn khổ của Chương trình “Huế - Kinh đô ẩm thực”, gần 70 gian hàng ẩm thực sẽ mang đến nhiều hoạt động quảng diễn, chế biến, trưng bày ẩm thực còn đan xen các tiết mục biểu diễn nghệ thuật hấp dẫn, các trò chơi tại các gian hàng ẩm thực... Chương trình sẽ tiếp tục diễn ra đến hết ngày 2/5 tại Công viên Thương Bạc. GrabThừa Thiên HuếGrabquán ngon trứ danhmón ngon Huế"
ZNews,https://znews.vn/cu-san-gia-re-beo-dem-xuat-khau-thu-gan-400-trieu-usd-mot-quy-post1550423.html,Kinh doanh,Null,"Thứ sáu, 2/5/2025 10:06 (GMT+7)","Củ sắn giá rẻ 'bèo', đem xuất khẩu thu gần 400 triệu USD một quý","Trung Quốc vẫn là thị trường lớn nhất của sắn Việt Nam. Ảnh:TTXVN. Theo Cục Xuất nhập khẩu (Bộ Công Thương) và Cục Hải quan, Việt Nam đã xuất khẩu 487.670 tấn sắn và các sản phẩm từ sắn trong tháng 3, đạt kim ngạch139,19 triệu USD. So với cùng kỳ năm ngoái, sản lượng sắn xuất khẩu đã tăng gần 56% nhưng giá trị lại giảm nhẹ hơn 1%. Tính chung quý I, xuất khẩu sắn và sản phẩm từ sắn đạt 1,21 triệu tấn, trị giá372,88 triệu USD, tăng 28% về lượng nhưng giảm 13% về trị giá so với cùng kỳ năm 2024. Nguyên nhân chủ yếu là do giá xuất khẩu bình quân sụt giảm mạnh. Cụ thể, giá xuất khẩu sắn trung bình trong tháng 3 chỉ đạt285,4 USD/tấn, giảm tới 37% so với tháng 3 năm trước. Tính bình quân cả 3 tháng đầu năm, giá xuất khẩu loại nông sản này đạt307,8 USD/tấn, thấp hơn 32% so với cùng kỳ. Trung Quốc tiếp tục là thị trường lớn nhất của sắn Việt Nam với sản lượng nhập khẩu 1,15 triệu tấn trong quý I, tương đương349,48 triệu USD. Đáng chú ý, mặt hàng tinh bột sắn đang được thị trường này đẩy mạnh thu mua, chiếm tới 48,49% trong tổng lượng tinh bột sắn nhập khẩu của Trung Quốc. Bên cạnh đó, một số thị trường khác như Malaysia, Philippines, Nhật Bản và Pakistan cũng gia tăng nhập khẩu sắn từ Việt Nam trong tháng 3. Riêng thị trường Malaysia ghi nhận mức tăng trưởng đột biến 140% về lượng và 64% về trị giá so với cùng kỳ năm ngoái. Mặt khác, xuất khẩu sắn sang Đài Loan (Trung Quốc) và Hàn Quốc lại giảm rõ rệt. Theo Bộ Nông nghiệp và Môi trường, cả nước hiện có trên 40 tỉnh/thành trồng sắn, tập trung ở 5 vùng trọng điểm: Trung du miền núi phía Bắc, Bắc Trung Bộ, Duyên hải Nam Trung Bộ, Tây Nguyên và Đông Nam Bộ. Tổng diện tích trồng sắn vào khoảng 520.000-550.000 ha với năng suất 19-20 tấn/ha và tổng sản lượng hơn 10 triệu tấn củ tươi. Cả nước hiện có hơn 140 nhà máy chế biến tinh bột sắn, tổng công suất thiết kế 13,4 triệu tấn củ tươi/năm. Nhưng công suất thực tế mới đạt khoảng 9,3 triệu tấn. Riêng khu vực Đông Nam Bộ chiếm hơn một nửa số nhà máy với khoảng 70 cơ sở chế biến. Theo đề án “Phát triển bền vững ngành hàng sắn đến năm 2030, tầm nhìn đến 2050”, mục tiêu đặt ra là nâng sản lượng sắn tươi cả nước lên khoảng 11,5-12,5 triệu tấn vào năm 2030. Trong đó, khoảng 85% sẽ được dùng để chế biến sâu thành tinh bột, mì chính và các sản phẩm khác. Ngoài ra, diện tích trồng sắn bằng giống đạt chuẩn chất lượng được kỳ vọng đạt 40-50%; diện tích áp dụng quy trình canh tác bền vững đạt 50%; kim ngạch xuất khẩu sắn cùng các sản phẩm từ sắn sẽ chạm mốc 1,8-2 tỷ USD. Trong môi trường kinh tế hiện nay, đầu tư đã trở thành khái niệm không mấy xa lạ với hầu hết mọi người. Để độc giả có thể tiếp cận những xu hướng đầu tư mới nhất,Tri Thức - Znewsxây dựng chủ đềĐầu tư qua sách- nơi ghi lại những cuốn sách, câu chuyện, xu hướng đầu tư đã và đang diễn ra. Trong đó, các lĩnh vực đầu tư phổ biến bao gồm bất động sản, chứng khoán, ngoại hối và tiền ảo... Ngoài các câu chuyện về đầu tư, Đầu tư qua sách còn bao gồm các kiến thức về quản lý gia sản, tài chính cá nhân.  Trung Quốc tăng mua tôm Việt Nam Quý I, xuất khẩu tôm Việt Nam đạt 939 triệu USD, tăng 37% so với cùng kỳ năm 2024, chủ yếu đến từ đà phục hồi nhu cầu tại nhiều thị trường lớn như Trung Quốc, Mỹ, Nhật Bản.  Người Mỹ chuộng cá rô phi Việt Nam, 'chốt đơn' hàng chục triệu USD Xuất khẩu cá rô phi Việt Nam đang bứt tốc với kim ngạch năm 2024 tăng 138%. Trong đó, Mỹ đang vươn lên thành thị trường tiêu thụ cá rô phi Việt Nam lớn nhất.  Cổ phiếu công ty bầu Đức 'tím trần' Cổ phiếu HAG của Hoàng Anh Gia Lai được gom mạnh, ghi nhận thanh khoản tăng vọt 370 tỷ đồng và tăng kịch trần. Mã này cũng có mặt trong top 10 cổ phiếu bảo vệ VN-Index hôm nay."
ZNews,https://znews.vn/5-ty-phu-giau-nhat-viet-nam-cam-ket-gi-voi-co-dong-post1550476.html,Kinh doanh,Null,N/A,5 tỷ phú giàu nhất Việt Nam cam kết gì với cổ đông,"Các tỷ phú USD giàu nhất Việt Nam đã đưa ra hàng loạt cam kết mạnh     mẽ trước cổ đông trong mùa Đại hội đồng cổ đông thường niên 2025. Những kế hoạch đầy tham vọng cho thấy     khối doanh nghiệp tư nhân đang kỳ vọng lớn chu kỳ tăng trưởng mới sau giai đoạn     phòng thủ. Trước những băn khoăn của cổ đông về mục tiêu doanh thu300.000 tỷ đồngnăm 2025, Chủ tịch Phạm Nhật Vượng thừa nhận đây là kế hoạch     rất lớn và không dễ đạt được, song ông khẳng định ban lãnh đạo sẽ nỗ lực tối đa để     không chỉ hoàn thành mà còn vượt mục tiêu đề ra. Theo ông Vượng, cơ sở cho kỳ vọng này là thị trường bất động     sản đang cho thấy tín hiệu phục hồi rất rõ, hứa hẹn mang lại tăng trưởng doanh     thu đột phá cho Vingroup trong năm nay. Ông nhấn mạnh các kế hoạch hiện tại đều mang tính thách thức     cao, đòi hỏi quyết tâm và sự bền bỉ từ ban điều hành. Khác biệt lớn nhất của     Vingroup so với phần còn lại của thị trường là ở tinh thần nỗ lực và đổi mới     không ngừng của đội ngũ lãnh đạo và nhân sự. Các kế hoạch kinh doanh của Vingroup đều rất thách thức, không phải dễ dàng đạt được nhưng chúng tôi sẽ cố gắng đạt và vượt mục tiêu Chủ tịch Tập đoàn Vingroup Phạm Nhật Vượng Với VinFast, ông Vượng cho biết công ty đặt mục tiêu tiêu thụ     hơn 200.000 xe điện năm nay, tương đương khoảng 40% thị phần ôtô nội địa -     mức cao nhất của bất kỳ hãng xe nào tại Việt Nam. Nếu đạt được mục tiêu     này, VinFast cũng sẽ hòa vốn tại Việt Nam. Ngoài các 3 trụ cột hiện tại, ông chủ Vingroup cũng cho biết sẽ đẩy mạnh đầu tư vào năng     lượng và hạ tầng. Theo kế hoạch, tập đoàn dự kiến phát triển khoảng 25,5     GW điện tái tạo và LNG đến năm 2030, sau đó nâng tổng công suất lên 52,5 GW vào     năm 2035. Trước mắt, tập đoàn đặt mục tiêu triển khai sớm 1 nhà máy LNG. Ở mảng hạ tầng, Vingroup đã đăng ký với Chính phủ để tự đầu     tư hai tuyến đường sắt tốc độ cao gồm Phú Mỹ Hưng - Cần Giờ và Hà Nội - Quảng     Ninh, đồng thời đề xuất nghiên cứu phát triển thêm một số cảng biển. Ông Vượng cũng cho biết về tiến độ niêm yết Vinpearl, với mục tiêu hoàn thành các thủ tục trong tháng 4 và chính thức niêm yết công ty con này trong tháng 5. Tại ĐHĐCĐ thường niên 2025 ngày 17/4, Tập đoàn Hòa Phát đặt mục     tiêu doanh thu170.000 tỷ đồng, tăng 21% so với năm ngoái. Lợi nhuận sau thuế kỳ vọng 15.000 tỷ, tăng 25%. Nếu đạt được, đây sẽ là mức doanh thu cao nhất từ trước     đến nay của tập đoàn. Tuy nhiên, Chủ tịch Trần Đình Long cho rằng kinh tế toàn cầu     vẫn còn nhiều bất ổn khiến việc dự báo xu hướng trở nên khó khăn. Trong bối cảnh     đó, Hòa Phát duy trì tinh thần thận trọng và phòng thủ, vận hành theo nguyên tắc     bài bản. “Quân tử phải phòng thân. Phải tính đến cả những kịch bản xấu,     thậm chí rất xấu”, ông nói, đồng thời kỳ vọng nếu đàm phán về thuế đối ứng đạt     kết quả và kinh tế có dấu hiệu phục hồi, Hòa Phát sẽ có cơ hội bứt phá. Trong quý I, Hòa Phát đã ghi nhận doanh thu 37.000 tỷ, lợi     nhuận sau thuế đạt3.300 tỷ đồng. Để hoàn thành kế hoạch năm, trung bình mỗi     quý còn lại, tập đoàn cần lãi khoảng4.000 tỷ đồng. Dù đây là mục tiêu không dễ     dàng, ông Long khẳng định không điều chỉnh kế hoạch, coi đây vừa là     thử thách vừa là cơ hội. Chủ tịch Trần Đình Long tỏ ra thận trọng với kế hoạch năm nay. Ảnh:Minh Khánh. Về sản xuất, Hòa Phát đã hoàn thành giai đoạn 1 dự án Dung     Quất 2. Trước áp lực thép giá rẻ từ Trung Quốc và Ấn Độ, ông Long trấn an cổ     đông rằng Hòa Phát vẫn tiêu thụ hết hàng, không gặp tình trạng tồn kho. Ngoài thép xây dựng, tập đoàn đã quyết định triển khai dự án     sản xuất đường ray tại Dung Quất 2 với tổng vốn đầu tư khoảng14.000 tỷ đồngnhằm     đón đầu nhu cầu từ các tuyến tàu cao tốc tương lai. Lễ động thổ dự kiến diễn ra     trong tháng 5 và sản phẩm đầu tiên sẽ được xuất xưởng vào tháng 5/2027. “Chúng tôi tự tin có thể làm chủ công nghệ và sản xuất được     dòng sản phẩm này”, ông Long nhấn mạnh. Một tín hiệu tích cực khác là Bộ Xây dựng đang trình Chính     phủ cơ chế giao đơn hàng và nhiệm vụ cụ thể cho một số doanh nghiệp lớn, trong     đó có Hòa Phát. Năm nay, Masan đặt mục tiêu doanh thu hợp nhất 80.000-85.500     tỷ đồng, tăng tương ứng 7-14% so với năm trước, tùy thuộc vào điều kiện kinh tế     vĩ mô, sự phục hồi của thị trường tiêu dùng và các phê duyệt nội bộ. Mức doanh     thu này đã được điều chỉnh sau khi tập đoàn không còn hợp nhất kết quả kinh     doanh của H.C. Starck Holding GmbH - công ty con thuộc Masan High-Tech     Materials. Lợi nhuận sau thuế dự kiến đạt từ 4.875 tỷ đến6.500 tỷ đồng,     tương ứng mức tăng trưởng 14-52% so với năm 2024. Chủ tịch Masan kỳ vọng vươn     lên trở thành một nền tảng tiêu dùng tích hợp giống như Walmart, Amazon,     Alibaba. Ảnh:MSN. Chủ tịch Nguyễn Đăng Quang cho biết Masan đã hoàn tất giai     đoạn đầu tiên trong chiến lược 5 năm xây dựng nền tảng tiêu dùng - bán lẻ tích     hợp. Giai đoạn 2 sẽ tập trung vào việc củng cố thị phần chi tiêu của người tiêu     dùng và tạo ra lợi nhuận. Theo ông, con đường duy nhất để hiện thực hóa điều này là     chuyển đổi số. “Chuyển đổi số chính là mảnh ghép cuối cùng để Masan vượt khỏi     hình ảnh của một tập đoàn truyền thống, xóa bỏ định kiến về đa ngành và vươn     lên trở thành một nền tảng tiêu dùng tích hợp giống như Walmart, Amazon,     Alibaba, Reliance hay Apple đã làm”, ông Quang nhấn mạnh. Ông cũng chia sẻ với cổ đông rằng dù thế giới biến đổi rất     nhanh, vẫn có những nguyên lý bất biến như một nền tảng kinh doanh bền vững sở     hữu khả năng tăng trưởng và lợi nhuận cao. Theo ông, đó là phần thưởng dành cho     những tổ chức biết tạo ra giá trị tiêu dùng vượt trội với ít tài nguyên nhất nếu     dựa vào trí sáng tạo, công nghệ và năng lực xây dựng thương hiệu. Tại ĐHĐCĐ thường niên 2025, bà Nguyễn Thị Phương Thảo nhận định giá     cổ phiếu HDBank hiện chưa phản ánh đúng giá trị thực của ngân hàng. Do đó, kế     hoạch kinh doanh năm nay được đặt ra là hoàn toàn có cơ sở. Cụ thể, HDBank đặt mục tiêu lợi nhuận trước thuế đạt21.179     tỷ đồng, tăng 27% - thuộc nhóm cao nhất ngành. Tỷ phú Nguyễn Thị Phương Thảo cho biết HDBank đang hướng đến tổng tài sản1 triệu tỷ đồng. Ảnh:HDB. Bà Thảo cho biết HDBank đang tiệm cận mốc1 triệu tỷ đồngtổng     tài sản, phản ánh đà phát triển ổn định và bền vững. Tính từ thời điểm trước     IPO cách đây 7 năm, bà cho biết nhà đầu tư nắm giữ cổ phần HDBank đã chứng kiến     giá trị tài sản tăng gấp 4,4 lần, tức khoản đầu tư 100 triệu đồng khi đó hiện     có thể tương đương gần 500 triệu đồng. “Chúng tôi không chỉ muốn trở thành ngân hàng dẫn đầu về quy     mô, mà còn là lựa chọn hàng đầu về chất lượng, sự nhân văn và sự tử tế trong từng     quyết sách chiến lược”, nữ tỷ phú USD duy nhất của Việt Nam nhấn mạnh. Tại phiên họp năm nay, nhiều nhà đầu tư đặt câu hỏi về mục tiêu vốn     hóa20 tỷ USDmà Techcombank đặt ra đến cuối năm 2025, tức tăng gần gấp 3 lần     so với hiện tại. Chủ tịch Hồ Hùng Anh khẳng định ban lãnh đạo vẫn kiên định     với mục tiêu này, dựa trên những tín hiệu tích cực từ thị trường trái phiếu, bất     động sản cùng đà tăng trưởng tốt từ các phân khúc khách hàng SME và micro SME. “Chúng tôi rất tin tưởng rằng khi thời điểm đến, giá trị của     Techcombank sẽ bùng nổ”, ông nói. Dẫn lại quá khứ năm 2017-2018, khi giá cổ phiếu     TCB tăng gần 10 lần trong vòng một năm, ông Hùng Anh nhấn mạnh ngân hàng hôm     nay đang có nền tảng vững chắc để tạo ra cú nhảy vọt mới dù vẫn phụ thuộc vào     tình hình kinh tế vĩ mô và thị trường vốn. Chủ tịch Hồ Hùng Anh hé lộ có 2 nhà đầu tư đang quan tâm đến Công ty Chứng khoán Techcombank. Ảnh:TCB. Liên quan đến kế hoạch IPO Công ty Chứng khoán TCBS, Chủ tịch     Techcombank cho biết đang làm việc với 2 nhà đầu tư lớn. Tiềm năng của TCBS được     đánh giá cao, nhưng thời điểm và mức định giá cụ thể sẽ chỉ được công bố sau     khi hoàn tất đàm phán. Dự kiến IPO diễn ra cuối năm, song vẫn còn phụ thuộc vào thị     trường và diễn biến chính sách thuế đối ứng từ Mỹ cũng như tiến độ nâng hạng thị     trường chứng khoán Việt Nam. Năm nay, ngân hàng đặt mục tiêu lợi nhuận đạt31.500 tỷ đồng,     tăng hơn 14% so với năm trước. Theo ông Hùng Anh, đây là kế hoạch được tính     toán thận trọng trong bối cảnh còn nhiều bất ổn toàn cầu. “Nếu điều kiện thị trường tốt hơn, chúng tôi kỳ vọng kết quả     năm nay cũng sẽ tốt hơn”, ông Hồ Hùng Anh nhấn mạnh. Trong môi trường kinh tế hiện nay, đầu tư đã trở thành khái niệm không mấy xa lạ với hầu hết mọi người. Để độc giả có thể tiếp cận những xu hướng đầu tư mới nhất,Tri Thức - Znewsxây dựng chủ đềĐầu tư qua sách- nơi ghi lại những cuốn sách, câu chuyện, xu hướng đầu tư đã và đang diễn ra. Trong đó, các lĩnh vực đầu tư phổ biến bao gồm bất động sản, chứng khoán, ngoại hối và tiền ảo... Ngoài các câu chuyện về đầu tư, Đầu tư qua sách còn bao gồm các kiến thức về quản lý gia sản, tài chính cá nhân."
ZNews,https://znews.vn/shb-lai-cao-ky-luc-nho-mang-dich-vu-va-dau-tu-chung-khoan-post1550361.html,Kinh doanh,Null,"Thứ sáu, 2/5/2025 11:00 (GMT+7)",SHB lãi cao kỷ lục nhờ mảng dịch vụ và đầu tư chứng khoán,"Chủ tịchSHBĐỗ Quang Hiển. Ảnh:SHB. Ngân hàng TMCP Sài Gòn - Hà Nội (HoSE:SHB) - vừa công bố báo cáo tài chính quý I hợp nhất và riêng lẻ. Theo đó, lợi nhuận hợp nhất trước thuế quý đầu năm của ngân hàng này đạt4.371 tỷ đồng, tăng 9% so với cùng kỳ năm trước. Trong đó, lợi nhuận riêng từ ngân hàng mẹ đóng góp gần 99%. Với kết quả này, ngân hàng cũng lập kỷ lục lợi nhuận quý cao nhất lịch sử. Đáng chú ý, mảng dịch vụ và đầu tư chứng khoán bất ngờ là động lực tăng trưởng mới trong kỳ này của SHB. Lãi thuần từ hoạt động dịch vụ đã tăng vọt 122% so với cùng kỳ, mang về329 tỷ đồng. Lãi thuần từ mua bán chứng khoán đầu tư cũng tăng mạnh để đạt56 tỷ đồng, tức gấp 11 lần cùng kỳ năm ngoái. Cùng với đó, thu nhập lãi thuần tăng 7%, đã mang về5.544 tỷ đồngcho ngân hàng. Ở chiều ngược lại, lãi thuần từ hoạt động khác giảm mạnh, chỉ đạt gần72 tỷ đồngso với mức hơn 456 tỷ của quý I/2024. Lợi nhuận từ góp vốn, mua cổ phần của ngân hàng cũng sụt giảm chỉ bằng 1/4 năm ngoái. Trong quý I, chi phí hoạt động của SHB được kiểm soát tốt, giảm 5%, nhờ cắt giảm đáng kể chi phí nhân sự. Trong khi chi phí dự phòng rủi ro tín dụng cũng giảm hơn 12%. Đây là nguyên nhân chính giúp SHB báo lãi ròng trong quý I đạt3.496 tỷ đồng, tăng 9%. Tính đến hết tháng 3, tổng tài sản của SHB đạt hơn790.742 tỷ đồng, tăng 6% so với đầu năm. Dư nợ cho vay khách hàng tăng 9%, lên567.948 tỷ đồng; tiền gửi khách hàng đạt gần530.116 tỷ đồng, tăng 6%. Nợ xấu của ngân hàng cũng tăng 8%, khiến tỷ lệ nợ xấu/tổng dư nợ ở mức 2,87%. Trong khi đó, dự phòng rủi ro cho vay tăng 10%, lên9.652 tỷ đồng. Tính đến ngày 31/3, SHB có 6.703 nhân sự, tăng hơn 50 người so với đầu năm. Tuy nhiên, chi phí nhân viên lại giảm 17% xuống còn569 tỷ đồng, tương đương chi phí bình quân mà nhà băng đã trả là hơn 28 triệu đồng/người/tháng. Năm 2025, SHB đặt mục tiêu lợi nhuận trước thuế đạt14.500 tỷ đồng, tăng 25% so với năm 2024. Ngân hàng cũng hướng đến tổng tài sản832.000 tỷ đồng, vốn điều lệ gần46.000 tỷ đồng, tăng trưởng tín dụng 16% và kiểm soát tỷ lệ nợ xấu dưới 2%. SHB đồng thời kỳ vọng cán mốc1 triệu tỷ đồngtổng tài sản vào năm 2026. Trong môi trường kinh tế hiện nay, đầu tư trở thành khái niệm phổ biến. Để độc giả có thể tiếp cận những xu hướng đầu tư mới nhất,Tri Thức - Znewsxây dựng chủ đềĐầu tư qua sách- nơi ghi lại những cuốn sách, câu chuyện, xu hướng đầu tư đã và đang diễn ra trong nước và thế giới. Không chỉ tập trung vào các lĩnh vực đầu tư phổ biến như bất động sản, chứng khoán, trái phiếu, ngoại hối, tiền ảo... Đầu tư qua sách còn bao gồm các kiến thức về quản lý gia sản, tài chính cá nhân.  CEO Yeah1 nhận gần 300 triệu đồng mỗi tháng Yeah1 ghi nhận quý đầu năm kinh doanh khởi sắc với doanh thu 218 tỷ đồng, lợi nhuận trước thuế đạt 24 tỷ đồng, đều tăng trưởng vượt trội so với cùng kỳ năm ngoái.  Chuỗi nghỉ dưỡng Vinpearl lãi 90 tỷ đồng quý I Vinpearl ghi nhận lợi nhuận gộp từ hoạt động cốt lõi tăng 83% nhờ nhu cầu du lịch phục hồi mạnh.  Vietcombank 'cô đơn' cùng khoản lãi chục nghìn tỷ Trong quý I, Vietcombank ghi nhận lợi nhuận hợp nhất trước thuế đạt 10.860 tỷ đồng, chủ yếu nhờ kiểm soát rủi ro hiệu quả cùng sự phục hồi ở nhiều mảng kinh doanh cốt lõi."
