Source,URL,Category,Keyword,Time,Title,Content
ZNews,https://lifestyle.znews.vn/so-ca-lien-cau-lon-tang-vot-bac-si-chi-cach-ngan-ngua-post1566969.html,Sức khỏe,Null,"Thứ ba, 8/7/2025 14:03 (GMT+7)","Số ca liên cầu lợn tăng vọt, bác sĩ chỉ cách ngăn ngừa","Khoa Bệnh Nhiệt đới (Bệnh viện Trung ương Huế) hiện điều trị nhiều bệnh nhân dương tính với vi khuẩn Streptococcus suis (liên cầu lợn). Hầu hết bệnh nhân vào khoa với triệu chứng khởi phát như sốt cao, đau đầu, buồn nôn, đau nhức xương... Khoa Bệnh Nhiệt đới hiện điều trị nhiều bệnh nhân mắc liên cầu lợn. Bệnh nhân nữ Đ.T.T.L. (36 tuổi, trú tại phường Dương Nỗ) vào viện với triệu chứng sốt liên tục, đau nhức đốt sống lưng. Sau khi xét nghiệm, bệnh nhân được xác định mắc liên cầu lợn. Qua vài ngày được điều trị tích cực, bệnh nhân tỉnh táo và nhận thức rõ. Theo điều tra dịch tễ, gia đình bệnh nhân không nuôi lợn, tuy nhiên thường xuyên tham gia chế biến thịt (phân chia thịt) để người nhà đem đi bán tại chợ. Hiện tại sức khỏe những người trong nhà bệnh nhân đều bình thường. ThS.BSCKII Hoàng Thị Lan Hương, Phó Giám đốc Bệnh viện Trung ương Huế, cho biết, thời gian qua bệnh viện tiếp nhận nhiều bệnh nhân mắc liên cầu lợn. Trong đó, không ít ca diễn tiến nặng với các biểu hiện như viêm màng não mủ, nhiễm trùng huyết, sốc nhiễm khuẩn, thậm chí suy đa cơ quan. ""Ngay khi tiếp nhận, chúng tôi kích hoạt quy trình báo động đỏ nội viện để huy động các chuyên khoa liên quan như hồi sức tích cực, truyền nhiễm, thần kinh cùng phối hợp điều trị. Kinh nghiệm điều trị là phát hiện sớm, điều trị kháng sinh kịp thời và đúng phác đồ. Theo dõi sát các biến chứng thần kinh và nhiễm trùng huyết, điều trị hồi sức tích cực khi cần thiết"", ThS.BSCKII Hoàng Thị Lan Hương nói. Một bệnh nhân mắc liên cầu lợn đang điều trị tại Bệnh viện Trung ương Huế. Lãnh đạo Bệnh viện Trung ương Huế cho biết, tình hình bệnh liên cầu lợn diễn biến phức tạp, một số ca không rõ yếu tố dịch tễ. Đến sáng 8/7, bệnh viện đang điều trị cho 14 bệnh nhân trú tại các địa phương ở TP Huế. Trong đó, 13 trường hợp đang tiếp tục điều trị, riêng một bệnh nhân nam điều trị tại Khoa Hồi sức tích cực trong tình trạng hôn mê, tiên lượng không qua khỏi. PGS.TS Trần Kiêm Hảo, Giám đốc Sở Y tế TP Huế cho biết, từ đầu năm 2025 đến nay Huế ghi nhận 31 ca dương tính với Streptococcus Suis, trong đó, 1 ca tử vong vào ngày 2/7. Riêng từ tháng 6/2025, có 25 ca liên cầu lợn, tăng 4,2 lần so với 5 tháng trước đó. Tất cả các ca bệnh đều nhập viện và điều trị tại Bệnh viện Trung ương Huế. Lãnh đạo Bệnh viện Trung ương Huế cho biết, liên cầu lợn là bệnh truyền nhiễm lây từ lợn sang người, chủ yếu qua tiếp xúc với lợn bệnh hoặc thịt lợn chưa nấu chín. Bệnh có xu hướng gia tăng vào mùa hè, đặc biệt trong thời tiết nắng nóng. Mặc dù bệnh có thể xảy ra quanh năm, nhưng các yếu tố môi trường và sinh hoạt trong mùa hè có thể làm tăng nguy cơ mắc bệnh. Theo các chuyên gia dịch tễ, liên cầu lợn là vi khuẩn có thể tồn tại trong đường hô hấp trên của lợn, kể cả những con lợn khỏe mạnh và có khả năng lây sang người trong những điều kiện nhất định. Ngành y tế xử lý môi trường tại nhà dân có người mắc liên cầu lợn. Một số yếu tố nguy cơ điển hình được xác định rõ, bao gồm: Hai thể bệnh nguy hiểm nhất gồm: Để ngăn ngừa bệnh liên cầu lợn, các chuyên gia khuyến cáo: Lãnh đạo Bệnh viện Trung ương Huế cho biết liên cầu lợn có thể lây truyền từ lợn sang người khi tiếp xúc với lợn bệnh hay lợn mang vi khuẩn qua các tổn thương nhỏ, trầy xước trên da của những người giết mổ, chế biến và ăn thịt lợn bệnh hay lợn mang vi khuẩn nấu không chín. Hiện nay, chưa có bằng chứng bệnh liên cầu lợn có thể lây trực tiếp từ người sang người. Ngành y tế tuyên truyền, hướng dẫn người dân biện pháp phòng mắc liên cầu lợn. Bệnh liên cầu lợn ở người có thể gây ra các triệu chứng lâm sàng đa dạng, thường gặp nhất là viêm màng não mủ và nhiễm khuẩn huyết. Các triệu chứng có thể bao gồm sốt cao, đau đầu, nôn, ù tai, điếc, cứng gáy, rối loạn tri giác, và xuất huyết dưới da. Trường hợp nặng có thể dẫn đến sốc nhiễm độc, suy đa tạng và tử vong. Lãnh đạo Bệnh viện Trung ương Huế khuyến cáo, cần tăng cường giám sát phát hiện các trường hợp bị bệnh nghi nhiễm liên cầu lợn ở người, nên đưa ngay đến bệnh viện để tổ chức cứu chữa kịp thời. Đặc biệt chú ý giám sát những đối tượng có tiếp xúc gần với lợn bị bệnh như người chăn nuôi, giết mổ và buôn bán lợn. Không giết mổ, vận chuyển lợn bệnh, lợn chết phải tiêu hủy đúng cách. Lợn ốm, chết phải chôn, đổ thuốc sát khuẩn và tiêu huỷ. Chuồng trại và môi trường chăn nuôi phải phun thuốc sát khuẩn, khử khuẩn, để trống chuồng 2 tuần mới nuôi lợn trở lại. Bộ sách “Bí ẩn hướng nội” chứa đựng nhiều thông tin và kiến thức rất hữu ích giúp bạn thấu hiểu chính mình, thoát khỏi vòng luẩn quẩn tự nghi ngờ và đánh đồng bản thân với những định kiến rập khuôn của xã hội. Để từ đó bạn học cách yêu thương và trân trọng con người hướng nội của mình.  5 thực phẩm có thể giúp ngăn ngừa ung thư dạ dày Ung thư dạ dày là loại ung thư được chẩn đoán phổ biến thứ năm trên toàn cầu, thường được chẩn đoán ở giai đoạn muộn, khi đã di căn và tiên lượng kém...  Thiếu máu thiếu sắt đe dọa sức khỏe phụ nữ thế nào? Thiếu máu thiếu sắt là bệnh lý thường gặp, đặc biệt ở phụ nữ trong độ tuổi sinh đẻ và trẻ em. Tuy nhiên, nhiều người vẫn chưa nhận thức đúng mức về bệnh.  Nốt sưng nhỏ ở mắt khi nào có thể thành biến chứng lớn? Nhiều người chủ quan với nốt sưng đỏ trên mi mắt, tự ý nặn mủ hoặc để tự khỏi, điều này có thể khiến viêm lan rộng, thậm chí phải phẫu thuật nếu không điều trị sớm."
ZNews,https://lifestyle.znews.vn/thieu-mau-thieu-sat-de-doa-suc-khoe-phu-nu-the-nao-post1552704.html,Sức khỏe,Null,"Thứ ba, 8/7/2025 10:23 (GMT+7)",Thiếu máu thiếu sắt đe dọa sức khỏe phụ nữ thế nào?,"Thiếu mát thiếu sắt có thể là dấu hiệu của nhiều bệnh lý phụ khoa. Ảnh:Freepik. Ghi nhận tại khoa Nội tổng hợp, Bệnh viện TP Thủ Đức (TP.HCM) cho thấy mỗi tháng đơn vị tiếp nhận hơn 50 trường hợp mới được chẩn đoán mắc thiếu máu thiếu sắt, phần lớn ở mức độ nhẹ. Trong đó, phụ nữ trong độ tuổi 18-45 chiếm đến 50% số ca bệnh, phản ánh đúng xu hướng chung trên toàn cầu. Bác sĩ chuyên khoa I Bành Phúc Hậu, khoa Nội tổng hợp, cho biết nguyên nhân chủ yếu đến từ chế độ ăn kiêng thiếu khoa học, rong kinh hoặc các vấn đề phụ khoa ở phụ nữ trẻ. Thiếu máu thiếu sắt thường diễn tiến âm thầm với các triệu chứng không đặc hiệu như mệt mỏi, hoa mắt, khó tập trung. Khi bệnh tiến triển, người bệnh có thể gặp các biểu hiện rõ rệt hơn như da xanh xao, niêm mạc nhợt, móng tay dễ gãy hoặc có hình thìa, rụng tóc, tim đập nhanh, khó thở khi gắng sức. Một số trường hợp còn xuất hiện hội chứng pica - cảm giác thèm ăn những thứ không phải thực phẩm như đất, đá. Việc chẩn đoán thiếu máu thiếu sắt cần thông qua các xét nghiệm chuyên biệt như công thức máu, ferritin huyết thanh và độ bão hòa transferrin (TSAT) để đánh giá mức độ thiếu máu, dự trữ và khả năng vận chuyển sắt trong cơ thể. Tùy từng trường hợp, bác sĩ sẽ cá thể hóa phác đồ điều trị. Đối với phụ nữ mang thai, khuyến cáo nên bổ sung 30-60 mg sắt mỗi ngày kết hợp acid folic. Trong khi đó, người cao tuổi cần được kiểm tra kỹ nguy cơ xuất huyết tiêu hóa trước khi điều trị. Để phòng ngừa, bác sĩ Hậu khuyến cáo người dân cần xây dựng chế độ ăn uống hợp lý, tăng cường thực phẩm giàu sắt như thịt đỏ, gan, trứng và kết hợp bổ sung vitamin C để tăng hấp thu. Đồng thời, người dân nên hạn chế dùng trà, cà phê ngay sau bữa ăn vì có thể cản trở quá trình hấp thu sắt. “Người dân không nên chủ quan với các dấu hiệu ban đầu của bệnh. Đặc biệt, phụ nữ mang thai và cho con bú cần tuân thủ chế độ bổ sung sắt theo chỉ định. Khi có triệu chứng nghi ngờ, cần đến cơ sở y tế để được thăm khám và điều trị kịp thời”, bác sĩ Hậu nhấn mạnh. Cuốn sách ""Cơ thể phi tuổi tác tâm trí phi thời gian"" mang đến cho độc giả nhiều kiến thức hữu ích liên quan đến quá trình lão hóa của con người. Chúng ta có thể làm chậm quá trình lão hóa bằng những phương pháp rất đơn giản.  Dấu hiệu suy tim cấp cần nhập viện ngay Suy tim cấp là nguyên nhân hàng đầu nhập viện ở những người bệnh trên 65 tuổi, tỷ lệ tử vong khi nhập viện 4-10%.  Lòng xe điếu không còn là chuyện 'nói quá' trên mạng Theo luật sư Cường, thực phẩm hay sản phẩm quảng cáo sai sự thật có thể không gây ảnh hưởng tính mạng nhưng sử dụng lâu dần sẽ ảnh hưởng nghiêm trọng đến sức khỏe của người tiêu dùng.  Loại giun nhỏ nhưng dai, chữa xong vẫn dễ tái nhiễm Con tôi vừa được chẩn đoán nhiễm giun kim. Tôi được biết bệnh rất dễ lây và tái nhiễm. Xin hỏi làm thế nào để điều trị bệnh này và tránh lây lan cho người trong gia đình?"
ZNews,https://lifestyle.znews.vn/nguoi-dan-ong-bi-dia-chui-vao-nieu-dao-khi-dang-lam-viec-ngoai-dong-post1566976.html,Sức khỏe,Null,"Thứ ba, 8/7/2025 14:27 (GMT+7)",Người đàn ông bị đỉa chui vào niệu đạo khi đang làm việc ngoài đồng,"Đỉa có khả năng xâm nhập vào cơ thể thông qua mũi, miệng, tai... Ảnh:Freepik. Các bác sĩ khoa Cấp cứu, Bệnh viện Đa khoa Thống Nhất Đồng Nai, vừa tiếp nhận ca bệnh hy hữu. Anh P.V.A. bị một con đỉa chui vào niệu đạo trong lúc làm việc ngoài đồng. Khi phát hiện, bệnh nhân nhanh trí dùng tay ép chặt niệu đạo, ngăn đỉa tiếp tục chui sâu vào bên trong. Ngay sau đó, anh được đưa đến bệnh viện để xử trí. Qua thăm khám lâm sàng, bác sĩ xác định con đỉa vẫn còn mắc kẹt tại đoạn niệu đạo trước, chưa kịp đi vào bàng quang. Đây là vị trí khá hẹp, xử trí sai cách có thể dẫn đến tổn thương niệu đạo, nhiễm trùng, thậm chí chảy máu hoặc thủng ống dẫn tiểu. Ê-kíp đã hướng dẫn bệnh nhân nới lỏng vùng bị ép để tránh gây tổn thương mô mềm, đồng thời khuyến khích anh đi tiểu tiện. Sau khoảng 15 phút, con đỉa tự động rơi ra ngoài mà không cần can thiệp xâm lấn. Đỉa là loại động vật ký sinh thường sống ở ao, hồ, ruộng nước hoặc khe suối. Chúng có khả năng xâm nhập vào cơ thể người qua các hốc tự nhiên như mũi, miệng, tai... nếu người lao động không có biện pháp bảo hộ phù hợp khi tiếp xúc trực tiếp với môi trường nước bẩn. Khi chui vào cơ thể, đỉa bám chặt vào niêm mạc, hút máu liên tục khiến vùng tổn thương dễ chảy máu, viêm nhiễm, sưng tấy, gây đau đớn và có nguy cơ biến chứng nếu không xử trí kịp thời. Các chuyên gia khuyến cáo khi đi làm đồng, lội ruộng hoặc làm việc ở khu vực có nước đọng, bùn lầy, người dân nên mặc quần áo bảo hộ, đặc biệt là quần dài, dày, không để vùng kín tiếp xúc trực tiếp với nguồn nước. Ngoài ra, vào mùa hè, các gia đình thường đi chơi, bơi lội ở nơi có sông, suối nên cảnh giác tình trạng đỉa, vắt chui vào và ký sinh trong cơ thể. Người dân tuyệt đối không uống nước tại các khe, suối. Nếu nghi ngờ bị đỉa chui vào người, cần đến cơ sở y tế càng sớm càng tốt để được xử lý đúng cách, tránh dùng vật cứng hoặc chất hóa học tự ý lấy ra vì có thể khiến đỉa vỡ, gây nhiễm trùng hoặc để lại dị vật trong cơ thể. Cuốn sách""Ăn thông minh, sống bình yên""của tác giả Makita Zenji giải thích về lý do càng nhiều tuổi càng cần hạn chế đường một cách nghiêm ngặt. Ngoài ra, cuốn sách cũng thông tin về các vấn đề lớn của chỉ số đường huyết; về cơ chế của các vấn đề béo phì, lão hóa và bệnh tật, cung cấp chế độ ăn uống hợp lý giúp bạn đảm bảo chỉ số đường huyết, tránh các bệnh liên quan đến đường huyết.  Số ca liên cầu lợn tăng vọt, bác sĩ chỉ cách ngăn ngừa Bệnh viện Trung ương Huế đang có 14 bệnh nhân mắc liên cầu lợn. Một trong số đó đang trong tình trạng hôn mê, tiên lượng dè dặt. Trước đó, một người đã không qua khỏi.  5 thực phẩm có thể giúp ngăn ngừa ung thư dạ dày Ung thư dạ dày là loại ung thư được chẩn đoán phổ biến thứ năm trên toàn cầu, thường được chẩn đoán ở giai đoạn muộn, khi đã di căn và tiên lượng kém...  Thiếu máu thiếu sắt đe dọa sức khỏe phụ nữ thế nào? Thiếu máu thiếu sắt là bệnh lý thường gặp, đặc biệt ở phụ nữ trong độ tuổi sinh đẻ và trẻ em. Tuy nhiên, nhiều người vẫn chưa nhận thức đúng mức về bệnh."
ZNews,https://lifestyle.znews.vn/mot-benh-vien-tiep-nhan-gan-1000-ca-nhiem-giun-san-post1567037.html,Sức khỏe,Null,"Thứ ba, 8/7/2025 16:03 (GMT+7)",Một bệnh viện tiếp nhận gần 1.000 ca nhiễm giun sán,"Giun sán ký sinh gây ảnh hưởng đến cuộc sống và sức khỏe trẻ em. Ảnh:Adobe Stock. Bé N.Q.T. (9 tuổi, trú tại xã Tam Hợp) được đưa đến Bệnh viện Sản Nhi Nghệ An  trong tình trạng nổi mẩn ngứa dai dẳng ở tay, bụng và mông, không rõ nguyên nhân. Dù đã thoa thuốc điều trị da liễu hơn hai tuần, triệu chứng vẫn không thuyên giảm, thậm chí, bệnh nhi còn có biểu hiện đau bụng âm ỉ. Gia đình lo lắng nên quyết định đưa bé đến bệnh viện để kiểm tra. Tương tự, bé N.Đ.A. (4 tuổi) được người nhà đưa đến bệnh viện vì bị ngứa da, nổi mề đay, mất ngủ ban đêm và đau bụng kéo dài. Các bác sĩ nghi ngờ trẻ nhiễm ký sinh trùng nên đã chỉ định xét nghiệm máu và chẩn đoán hình ảnh chuyên sâu. Kết quả cho thấy cả hai bệnh nhi đều có chỉ số bạch cầu ái toan tăng cao và dương tính với giun đũa chó mèo (Toxocara spp.) và sán dây chó (Echinococcus granulosus). Trẻ được điều trị bằng thuốc đặc hiệu kết hợp kiểm soát triệu chứng. Từ đầu năm đến nay, Bệnh viện Sản Nhi Nghệ An đã ghi nhận khoảng 900 trường hợp trẻ em dương tính với các loại ký sinh trùng như giun đũa chó mèo và sán dây. Theo bác sĩ chuyên khoa II Vương Thị Minh Nguyệt, Trưởng khoa Khám bệnh, Bệnh viện Sản Nhi Nghệ An, hầu như ngày nào bệnh viện cũng tiếp nhận trẻ đến khám với các biểu hiện như ngứa, nổi mẩn, đau bụng, biếng ăn… Tuy nhiên, nhiều phụ huynh còn chủ quan, thường nhầm lẫn các triệu chứng với bệnh ngoài da thông thường nên tự điều trị tại nhà hoặc đưa trẻ đến các phòng khám da liễu. Điều này khiến việc phát hiện và điều trị bệnh bị chậm trễ. Bác sĩ Nguyệt cho biết giun sán có thể ký sinh không chỉ trong đường ruột mà còn ở nhiều cơ quan khác như phổi, gan, mắt, thậm chí là hệ thần kinh. Nếu không được phát hiện và điều trị kịp thời, ký sinh trùng có thể gây tổn thương đa cơ quan và để lại biến chứng lâu dài. Thống kê từ khoa Huyết học - Vi sinh, Bệnh viện Sản nhi Nghệ An, cho thấy tỷ lệ dương tính với sán dây chó (Echinococcus granulosus) chiếm gần 35%, trong khi giun đũa chó mèo (Toxocara spp.) có tỷ lệ gần 45%. Có thể thấy, nguy cơ nhiễm ký sinh trùng từ môi trường sống và thú nuôi là không nhỏ. Các bác sĩ khuyến cáo khi trẻ có các biểu hiện như ngứa da, nổi mẩn kéo dài, đau bụng âm ỉ, biếng ăn, chậm tăng cân, rối loạn giấc ngủ, hay có biểu hiện thay đổi hành vi như lo âu, mệt mỏi, thờ ơ… phụ huynh cần đưa trẻ đến cơ sở y tế để được xét nghiệm ký sinh trùng kịp thời. Để phòng ngừa, ba mẹ cần tẩy giun định kỳ cho trẻ và thú cưng, hạn chế cho trẻ tiếp xúc với đất cát không đảm bảo vệ sinh, rửa tay sạch trước khi ăn và sau khi chơi, không để thú nuôi liếm tay, mặt trẻ. Đặc biệt, nên đưa trẻ đi kiểm tra sức khỏe định kỳ, nhất là khi có những dấu hiệu nghi ngờ nhiễm ký sinh trùng. Bộ sách “Bí ẩn hướng nội” chứa đựng nhiều thông tin và kiến thức rất hữu ích giúp bạn thấu hiểu chính mình, thoát khỏi vòng luẩn quẩn tự nghi ngờ và đánh đồng bản thân với những định kiến rập khuôn của xã hội. Để từ đó bạn học cách yêu thương và trân trọng con người hướng nội của mình.  Người đàn ông bị đỉa chui vào niệu đạo khi đang làm việc ngoài đồng Khi đang làm việc ngoài đồng, người đàn ông bất ngờ bị một con đỉa chui vào niệu đạo. Anh phải đến bệnh viện để được can thiệp kịp thời.  Số ca liên cầu lợn tăng vọt, bác sĩ chỉ cách ngăn ngừa Bệnh viện Trung ương Huế đang có 14 bệnh nhân mắc liên cầu lợn. Một trong số đó đang trong tình trạng hôn mê, tiên lượng dè dặt. Trước đó, một người đã không qua khỏi.  5 thực phẩm có thể giúp ngăn ngừa ung thư dạ dày Ung thư dạ dày là loại ung thư được chẩn đoán phổ biến thứ năm trên toàn cầu, thường được chẩn đoán ở giai đoạn muộn, khi đã di căn và tiên lượng kém..."
ZNews,https://lifestyle.znews.vn/tphcm-ra-soat-khan-hang-gia-trong-y-te-sau-vu-dau-gio-con-o-gia-post1567079.html,Sức khỏe,Null,"Thứ ba, 8/7/2025 18:03 (GMT+7)",TP.HCM rà soát khẩn hàng giả trong y tế sau vụ dầu gió Con Ó giả,"Những sản phẩm bị làm giả. Ảnh:CACC. Sở Y tế TP.HCM vừa phát đi văn bản khẩn gửi UBND 168 phường, xã, đặc khu, các bệnh viện, phòng khám và nhà thuốc trên địa bàn, yêu cầu kiểm tra toàn bộ sản phẩm đang sử dụng và kinh doanh. Động thái này diễn ra sau khi Cơ quan Cảnh sát điều tra Công an TP.HCM triệt phá đường dây làm giả nhiều sản phẩm y tế và chăm sóc sức khỏe như dầu gió Con Ó, kem dưỡng ẩm Thái Lan, dầu Ông Già Thái Lan và dầu lăn Hàn Quốc. Sở Y tế cảnh báo tình trạng buôn bán hàng giả, hàng không rõ nguồn gốc đang diễn biến phức tạp, có nguy cơ xâm nhập vào cả các cơ sở y tế, ảnh hưởng nghiêm trọng đến sức khỏe người dân. Sở Y tế yêu cầu tất cả bệnh viện công, tư, các phòng khám, nhà thuốc... rà soát lại danh mục sản phẩm đang lưu hành trong khuôn viên đơn vị, kể cả sản phẩm sử dụng nội bộ hoặc kinh doanh tại nhà thuốc bệnh viện. Các đơn vị phải đảm bảo chỉ sử dụng hàng hóa hợp pháp, có hóa đơn, chứng từ đầy đủ. Trong trường hợp phát hiện sản phẩm nghi ngờ giả, hàng kém chất lượng hoặc chưa được cấp phép, cơ sở cần lập tức báo cho cơ quan chức năng. Ngay cả khi không phát hiện sản phẩm vi phạm, các cơ sở vẫn phải nộp báo cáo theo quy định. Ngoài các cơ sở y tế, Sở Y tế cũng đề nghị UBND 168 phường, xã, đặc khu thông báo công khai đến người dân và doanh nghiệp trên địa bàn về các sản phẩm giả đã bị triệt phá, đồng thời hướng dẫn người dân chỉ mua bán tại các địa chỉ kinh doanh dược hợp pháp. Kho hàng ở thời điểm công an khám xét đột xuất. Ảnh: CACC. Lãnh đạo ngành y tế TP.HCM nhấn mạnh vai trò của UBND cơ sở trong việc giám sát, tuyên truyền để người dân “trở thành người tiêu dùng thông thái”, không tiếp tay cho việc tiêu thụ hàng giả. ""Việc sử dụng sản phẩm giả trong lĩnh vực y tế không chỉ gây nguy hiểm cho người bệnh mà còn làm suy giảm niềm tin vào hệ thống chăm sóc sức khỏe"", đại diện Sở Y tế nhấn mạnh trong công văn. Đây không phải lần đầu ngành y tế TP.HCM lên tiếng sau các vụ triệt phá đường dây hàng giả. Tuy nhiên, lần này, việc hàng loạt sản phẩm y tế bị làm giả tinh vi khiến ngành y tế địa phương cảnh giác cao độ. Hiện các bệnh viện và nhà thuốc trên địa bàn đang khẩn trương rà soát và lập danh sách sản phẩm theo yêu cầu. Trước đó, Công an TP.HCM cho biết đã bắt giữ nhiều đối tượng liên quan đến đường dây sản xuất, buôn bán hàng giả quy mô lớn. Nhóm này đã thuê nhà xưởng tại nhiều quận, huyện trên địa bàn TP.HCM để sản xuất các sản phẩm dầu gió Con Ó nhãn hiệu “Eagle Brand Medicated Oil”, kem dưỡng ẩm Thái Lan, dầu Ông già Thái Lan và dầu lăn Hàn Quốc giả. Các sản phẩm được làm nhái tinh vi, đóng gói gần giống sản phẩm thật, sau đó phân phối ra thị trường với giá rẻ hơn, gây nguy cơ ảnh hưởng nghiêm trọng đến sức khỏe người tiêu dùng. Công an TP.HCM đang tiếp tục điều tra, mở rộng vụ án để xử lý các đối tượng liên quan. Cuốn sách ""Ăn chuẩn ít bệnh"" (tập 1) được viết ra từ những kinh nghiệm chuyên môn của vị bác sĩ này, nó sẽ mang đến cho người bệnh những kiến thức hữu ích về dinh dưỡng, để xây dựng chế độ ăn hợp lý.  Một bệnh viện tiếp nhận gần 1.000 ca nhiễm giun sán Nhiều trẻ bị ngứa, nổi mề đay, đau bụng kéo dài nhưng chỉ được điều trị ngoài da. Tại bệnh viện, kết quả xét nghiệm cho thấy các em đã nhiễm giun sán từ thú nuôi.  Người đàn ông bị đỉa chui vào niệu đạo khi đang làm việc ngoài đồng Khi đang làm việc ngoài đồng, người đàn ông bất ngờ bị một con đỉa chui vào niệu đạo. Anh phải đến bệnh viện để được can thiệp kịp thời.  Số ca liên cầu lợn tăng vọt, bác sĩ chỉ cách ngăn ngừa Bệnh viện Trung ương Huế đang có 14 bệnh nhân mắc liên cầu lợn. Một trong số đó đang trong tình trạng hôn mê, tiên lượng dè dặt. Trước đó, một người đã không qua khỏi."
