Source,URL,Category,Keyword,Time,Title,Content
ZNews,https://znews.vn/cong-ty-cua-elon-musk-cay-chip-vao-nao-nguoi-chi-mat-1-5-giay-post1610166.html,Công nghệ,Null,"Thứ năm, 11/12/2025 10:26 (GMT+7)","Công ty của Elon Musk chỉ mất 1,5 giây để cấy chip vào não người","Công ty của elon musk đạt đột phá công nghệ với thời gian cấy ghép không tưởng. Ảnh:Wccftech. Neuralink cho biết hiện đã có hơn 10.000 người trên toàn thế giới đã đăng ký và đang chờ đợi trong danh sách bệnh nhân của Neuralink để tham gia thử nghiệm. Công ty kỳ vọng sẽ hoàn thành 20 ca phẫu thuật cấy ghép trên người vào cuối năm nay. Trong khi đó, Science Corp, do cựu đồng sáng lập Neuralink là Max Hordak thành lập, cũng giới thiệu công nghệ được cho là có khả năng ""khôi phục thị giác cho người mù"". Công ty cho biết robot phẫu thuật của họ đã rút ngắn đáng kể thời gian cấy ghép một sợi điện cực từ 17 giây xuống chỉ còn 1,5 giây. Robot này sử dụng kim cấy ghép siêu nhỏ, mảnh hơn tế bào hồng cầu để chèn các sợi điện cực dẻo vào não một cách chính xác và tránh các mạch máu dày đặc. Để giải quyết thách thức ở cấp độ micromet này, Neuralink đã tự phát triển một hệ thống kết hợp 6 kính hiển vi với công nghệ Chụp cắt lớp quang học (OCT). Điều này cho phép robot đồng bộ hóa chuyển động của mô não và dự đoán đường đi với tốc độ mili giây. Ngoài ra, bộ phận giữ kim dùng một lần được sử dụng trong robot phẫu thuật của Neuralink có chi phí sản xuất giảm tới 95%. Những bộ phận từng rất đắt đỏ này nay được cho là đã sẵn sàng để sản xuất hàng loạt. Các thử nghiệm ban đầu của Neuralink đã cho phép bệnh nhân liệt điều khiển cánh tay robot bằng ý nghĩ. Bệnh nhân dùng ý nghĩ để điều khiển cánh tay robot đưa thức ăn vào miệng. Ảnh:Neuralink. Trong một video đăng tải trên mạng xã hội, Rocky Stottenberg, một bệnh nhân bị liệt từ cổ trở xuống, đã chứng minh hiệu quả của sản phẩm. Video cho thấy ông dùng ý nghĩ điều khiển tay robot để tự đưa thức ăn vào miệng. Trước đây, ông phải dựa vào ống ngậm để thực hiện các tác vụ như chơi game. Một người tham gia thử nghiệm khác là Nick Ray, mắc bệnh xơ cứng teo cơ một bên (ALS), cũng đã thành công thử nghiệm chức năng mới, sử dụng tay robot để cầm cốc và uống nước. Musk tuyên bố các phiên bản Neuralink trong tương lai không chỉ cho phép người dùng truyền nhạc trực tiếp vào não, tạo ra mối quan hệ ""cộng sinh"" với trí tuệ nhân tạo, mà thậm chí còn có thể phát triển đến giai đoạn ""tải lên ký ức."" ""Điều này nghe có vẻ giống khoa học viễn tưởng, nhưng tôi nghĩ chúng ta có thể lưu một 'phiên bản khác' và sau đó tải nó xuống một cơ thể robot hoặc một bản sao, điều này sẽ mang lại cho con người một hình thức bất tử”, tỷ phú cho biết. Max Hordak, người từng là đồng sáng lập kiêm Chủ tịch của Neuralink, trở thành đối thủ cạnh tranh lớn củaElon Musk. Ông Hordak, người đóng vai trò quan trọng trong những đột phá kỹ thuật ban đầu của Neuralink, rời công ty vào năm 2021 và thành lập Science Corp, mang theo 3 đồng nghiệp cũ. Công ty mới này đang nhanh chóng vươn lên và được xem là đối thủ trực tiếp, thách thức vị thế của Neuralink. Các bệnh nhân đã đeo kính thông minh được kết nối với thiết bị cấy ghép võng mạc trong mắt. Ảnh:Science Corp. Science Corp đã làm chủ một công nghệ cấy ghép võng mạc có trên ""Prima"". Thiết bị cấy ghép nhỏ bằng hạt gạo này được thiết kế để khôi phục ""thị giác hình thức"" cho bệnh nhân bị thoái hóa điểm vàng nặng. Công nghệ này ban đầu được công ty Pixium Vision của Pháp phát triển và sau đó được Science Corp tinh chỉnh, thu hút sự chú ý. Với sự hỗ trợ của kính camera được thiết kế đặc biệt, Prima đã đạt được kết quả khả quan trong thử nghiệm. Trong số 38 người khiếm thị tham gia, 80% đã lấy lại được khả năng đọc, mặc dù tốc độ hiện tại chỉ có thể nhận dạng được 2 chữ cái cùng một lúc, đây vẫn là một bước đột phá đáng kể. Hordak cho biết Science Corp đã huy động được260 triệu USDvốn đầu tư và tạo doanh thu bằng cách bán các công cụ khoa học thần kinh cho các nhà nghiên cứu. Công ty không chỉ hoàn thành thử nghiệm ở châu Âu mà còn lên kế hoạch chính thức ra mắt sản phẩm thương mại vào mùa hè năm sau. Elon Musk khi thiết kế Cybertruck: 'Đừng trái ý tôi!' Trong cuốnTiểu sử Elon Musk, tác giả Walter Isaacson đưa người đọc đến những câu chuyện đằng sau vị tỷ phú phức tạp, như cách ông cùng lúc điều hành loạt doanh nghiệp Tesla, SpaceX và Twitter. Nguồn cảm hứng để thiết kế ra chiếc xe Cybertruck cũng được nhắc đến. Việc Elon Musk kiên định với thiết kế lạ lùng của mẫu xe bán tải, thậm chí đến mức cực đoan, cho thấy tính cách của vị tỷ phú.  Elon Musk tiếp tục tạo tranh luận khi hé lộ thông tin mới về đời sống gia đình, cho thấy cách ông nhìn nhận vấn đề về con cái.  Trong cuộc họp với các cổ đông, vị CEO của Tesla chia sẻ tầm nhìn đầy tích cực về tương lai của robot hình người với đời sống con người.  Khi Tesla đối mặt áp lực từ cổ đông và doanh số lao dốc, Elon Musk lại dành phần lớn thời gian cho xAI, thể hiện niềm tin rằng tương lai nằm ở trí tuệ nhân tạo."
ZNews,https://znews.vn/co-gai-treo-tuong-chung-cu-de-tron-vo-tinh-nhan-gay-soc-o-trung-quoc-post1610226.html,Đời sống,Null,"Thứ năm, 11/12/2025 09:46 (GMT+7)",Cô gái trèo tường chung cư để trốn vợ tình nhân gây sốc ở Trung Quốc,"Người phụ nữ đang bám vào một tấm rèm khi ở ngoài tường một tòa nhà. Ảnh:ettoday.net. Hình ảnh cho thấy cô mặc váy ngắn màu trắng, bám vào tường và ống nước bên ngoài tòa nhà, bất chấp nguy hiểm. Cảnh tượng ""nín thở"" này khiến cộng đồng mạng choáng váng. Sự việc xảy ra ngày 30/11 tại một khu dân cư ở tỉnh Quảng Đông, miền Nam Trung Quốc. Cô gái, chưa rõ danh tính, tóc dài, được ghi lại đang bám bên ngoài tầng 10 của tòa nhà. TheoETtoday, cô được cho là có quan hệ tình cảm với một người đàn ông sống trong căn hộ. Khi người vợ bất ngờ trở về nhà, người đàn ông này được cho là đã giục cô chạy ra ban công hoặc trèo xuống để tránh bị phát hiện. Đoạn video trốn vợ người tình lan truyền mạnh trên mạng xã hội. Cô gái vừa cầm điện thoại một tay, vừa tìm cách di chuyển dọc theo mặt tường. Ở một thời điểm, cô còn trao đổi nhanh qua cửa sổ với người đàn ông trần trụi phía trong trước khi anh này rời khỏi khung hình. Người phụ nữ leo qua một căn hộ khác để được giúp đỡ. Ảnh:ettoday.net. Sau đó, cô cố bám vào đường ống nước để tụt xuống nhưng trượt chân, rơi xuống một tầng. May mắn, cô kịp chống chân vào mép ban công tầng 9 và siết chặt ống nước để giữ người. Nhận ra mình đang mắc kẹt, cô di chuyển ngang sang cửa sổ căn hộ bên cạnh và đập mạnh cầu cứu. Chủ nhà đã mở cửa sổ kéo cô vào trong, cứu cô khỏi nguy cơ rơi từ độ cao có thể gây tử vong. Hiện chưa rõ người vợ có phát hiện chuyện ngoại tình hay không. Cảnh sát địa phương cũng chưa đưa ra thông tin chính thức. Đoạn video gây sốc và tạo làn sóng bình luận hài hước trên mạng xã hội Trung Quốc. Một người viết: ""Chuyện vốn chỉ ba người biết, giờ cả khu phố đều biết"". Người khác đùa: ""Bảo cô ấy nhát thì cô leo được cả tòa nhà; bảo cô ấy gan thì lại không dám đối mặt với vợ chính thức của người tình"". Một người thứ ba bình luận: ""Cô ấy liều mạng vì điều gì? Một người đàn ông không dám bỏ tiền thuê phòng, và sợ vợ đến mức để cô gánh hết nguy hiểm"". Có người châm biếm thêm: ""Bây giờ ngoại tình cũng thành nghề đòi hỏi kỹ thuật"". Quan hệ độc hại 'núp bóng' tình yêu Nhiều người khăng khăng họ làm điều gì đó vì ""muốn tốt cho bạn"", nhưng lại đòi hỏi bạn phải thỏa mãn yêu cầu của họ. Đó là tình yêu ""cấp thấp"", tồn tại ở nhiều loại quan hệ như bạn bè, người yêu, vợ chồng, cha mẹ và con cái. Nếu chấp nhận, bạn sẽ bị ràng buộc bởi sự hẹp hòi của đối phương, mất đi sự tự do, luôn chìm đắm trong muộn phiền, u sầu.  Mới đây, ""nữ vệ sĩ đẹp nhất Trung Quốc"" Yan Yuexi gây chú ý khi xuất hiện để bảo vệ phu nhân Tổng thống Pháp. Những thông tin về cô một lần nữa gây tò mò.  17 giờ trước17:4610/12/2025 0 Đương kim vô địch thế giới hạng cân 56 kg của Việt Nam khiến nhiều khán giả bất ngờ khi để thua VĐV Thái Lan ở tứ kết ju-jitsu hạng cân 62 kg nam.  18 giờ trước16:3810/12/2025 0 Từ ồn ào xoay quanh dự án Nuôi Em, chuyên gia cho rằng nhà hảo tâm Việt Nam cần bước ra khỏi tư duy thiện nguyện tự phát, tiến đến sự chuyên nghiệp với quy trình quản trị, tài chính minh bạch."
ZNews,https://znews.vn/thanh-nien-bi-chi-trich-khap-mxh-vi-bo-mac-co-gai-khi-gap-cuop-post1610242.html,Đời sống,Null,"Thứ năm, 11/12/2025 10:41 (GMT+7)",Thanh niên bị chỉ trích khắp MXH vì bỏ mặc cô gái khi gặp cướp,"Trong video trích xuất từ camera an ninh đang lan truyền, cặp du khách đang trò chuyện trước lối vào một nơi giống như ngân hàng hoặc điểm đổi tiền ở Colombia. Bất ngờ, một tên côn đồ xuất hiện với vũ khí giống như dao, nhắm đến hai người. Kẻ cướp cố gắng cắt quai balo khỏi người cô gái song bị cô chống trả quyết liệt, cào cấu và xô đẩy, trong khi thanh niên đi cùng sợ hãi lùi lại, theoTheNew York Post. Dù vài lần nhấp nhổm muốn tiến lên hỗ trợ cô gái, thanh niên vẫn không dám xông vào. Cuối cùng, một người đàn ông lao tới, dùng mũ bảo hiểm đập vào tên cướp. Một số nam giới gần đó phát hiện sự việc cũng nhanh chóng chạy tới. Đáng nói, ngay cả khi tên cướp dần bị khống chế, thanh niên vẫn không tham gia hỗ trợ. Đến lúc tên cướp bị nhóm người lôi khỏi hiện trường, anh mới quay lại hỏi han bạn đồng hành. Thấy tên cướp cầm hung khí, nam thanh niên (đeo kính, góc phảo) sợ hãi bỏ chạy.Ảnh cắt từ clip. Hiện vẫn chưa có nhiều thông tin chi tiết về vụ việc cũng như mối quan hệ của cặp đôi. Tuy nhiên, video ghi lại cảnh tượng lan truyền trên mạng xã hội và hành động của thanh niên bị nhiều dân mạng chế giễu, chỉ trích. ""Hắn ta chỉ đứng đó như kẻ ngốc và chẳng làm gì cả"", một người bình luận. ""Nếu hắn là bạn trai của cô gái, thì cô ấy nên đổi người khác đi"", một người khác viết. Nhiều người cũng khen ngợi những người đàn ông nhanh chóng tham gia hỗ trợ và sự dũng cảm của cô gái trẻ. “Tôi thích cách mọi chuyện xoay chuyển khi nửa con phố cùng kéo đến để thể hiện sự không khoan nhượng với mấy trò tào lao như thế”, một người nhận xét. Năm 2022, mạng xã hội cũng từng lan truyền video tương tự, ghi lại cảnh nam thanh niên bỏ lại bạn gái, chạy thục mạng khi gặp cướp ở Ecatepec, Mexico. Bị bạn trai bỏ rơi, cô gái chỉ biết nhìn theo bất lực, không dám phản kháng và để mặc tên cướp lấy đi chiếc điện thoại trong túi. Toàn bộ cảnh tượng diễn ra trong chưa tới 6 giây. Đoạn video ngắn được Jorge Becerril, một nhà báo người Mexico, chia sẻ lên X và chê trách cách xử trí của nam thanh niên. Cẩm nang 'sống sót' nơi công sở TrongMENTOR - Từ sinh viên chất đến nhân sự chiến, tác giả Lê Công Minh chia sẻ trải nghiệm vượt qua và học hỏi từ thất bại: Từ nam sinh thi trượt đại học đến giám đốc truyền thông kỹ thuật số, nhân viên Big 4 kiểm toán, sáng lập trung tâm tiếng Anh… Đây là nơi những bạn trẻ ""lênh đênh"" chốn công sở dễ tìm thấy mình và học hỏi để vươn lên trên con đường sự nghiệp.  Trước khi bị bắt tạm giam vì vụ hành hung người ở quán cà phê, Nguyễn Văn Thiên xây dựng hình ảnh doanh nhân, nói đạo lý và vướng nhiều ồn ào khác trên mạng xã hội.  21:23 9/12/202521:239/12/2025 0 Giữa các nghi vấn về cách thức hoạt động và ồn ào xoay quanh nhà sáng lập Hoàng Hoa Trung, đội ngũ dự án Nuôi Em tiếp tục lên tiếng giải thích.  17 giờ trước17:4610/12/2025 0 Đương kim vô địch thế giới hạng cân 56 kg của Việt Nam khiến nhiều khán giả bất ngờ khi để thua VĐV Thái Lan ở tứ kết ju-jitsu hạng cân 62 kg nam."
ZNews,https://znews.vn/haaland-khien-ban-gai-met-moi-post1610221.html,Thể thao,Null,"Thứ năm, 11/12/2025 09:30 (GMT+7)",Haaland khiến bạn gái 'mệt mỏi',"Bạn gái Haaland chán bóng đá. Chuyện bắt đầu trong một buổi tối bình yên khi Haaland phát hiện trận MU - West Ham đang được phát sóng trực tiếp và hí hửng muốn bật lên xem. Nhưng bạn gái Isabel thì không. ""Cô ấy nói: 'Em chán bóng đá lắm rồi, ngày nào cũng xem'"", Haaland kể trên podcastThe Rest is Football. ""Tôi bảo: 'Chính bóng đá là lý do chúng ta đang ngồi đây đấy'. Cuối cùng thì vẫn xem cùng nhau thôi"". Trước đó, Haaland tiết lộ chuyện tình của anh khá giản dị và gần gũi: ""Tôi nấu ăn. Nghe có vẻ hơi buồn cười nhưng cô ấy thích chơi game. Chúng tôi chơi Minecraft với nhau, xây nhà và làm đủ thứ. Hoặc chúng tôi trở về Bryne và gọi kebab"". Hiện tại, Haaland tận hưởng cuộc sống bình yên bên Isabel. Cô chủ động bắt chuyện với anh từ ngày cả hai còn là cầu thủ trẻ ở Bryne. Isabel cũng chơi bóng và luôn là chỗ dựa tinh thần quan trọng. Cặp đôi đón con trai đầu lòng vào tháng 12/2024, mở ra chương mới trong cuộc sống gia đình. Từ khi gia nhập Man City năm 2022, Haaland vô địch Premier League 2 lần, lên ngôi ở Champions League vàFA Cup. Cá nhân tiền đạo người Na Uy phá loạt kỷ lục với 36 bàn ở Premier League trong một mùa, 52 bàn trên mọi đấu trường, và gần nhất là cầu thủ nhanh nhất chạm mốc 100 bàn ở Premier League chỉ sau 111 trận. Cuối tuần này, Man City hành quân đến sân Crystal Palace. Đội bóng thành London đang có khởi đầu tốt nhất lịch sử Premier League với 26 điểm sau 15 trận. Dù vậy, Man City vẫn rất tự tin sau màn ngược dòng thắng Real Madrid 2-1 ở Champions League rạng sáng 11/12. Cuốn sách“Leading: Learning from Life and My Years at Manchester United”được Sir Alex Ferguson viết chung với Michael Moritz xuất bản năm 2015 đem tới kinh nghiệm sống quý báu cho bất kỳ ai.  Rạng sáng 11/12, Erling Haaland tiếp tục ghi dấu ấn tại Champions League trong chiến thắng 2-1 của Man City tại Bernabeu thuộc vòng phân hạng.  Tiền đạo Erling Haaland trải qua tình huống dở khóc dở cười trong trận Man City gặp Real Madrid ở vòng phân hạng Champions League rạng sáng 11/12.  Tiền đạo Erling Haaland gây tranh cãi với pha phạm lỗi thô thiển với trung vệ Raul Asencio ở trận đấu tại vòng phân hạng Champions League rạng sáng 11/12."
ZNews,https://znews.vn/bong-da-campuchia-lai-rut-khoi-giai-khu-vuc-post1610238.html,Thể thao,Null,"Thứ năm, 11/12/2025 10:32 (GMT+7)",Bóng đá Campuchia lại rút khỏi giải khu vực,"Futsal Campuchia rút lui khỏi giải U19. Quyết định được đưa ra chỉ vài tuần trước khi giải khởi tranh, tạo ra sự xáo trộn lớn trong công tác tổ chức cũng như cục diện cạnh tranh của sân chơi trẻ trong khu vực. Giải đấu diễn ra tại Thái Lan từ ngày 23 đến 29/12, được xem là nơi các đội futsal trẻ Đông Nam Á cọ xát và chuẩn bị cho nhiệm vụ quốc tế trong năm tới. Việc Campuchia bất ngờ rút lui khiến số đội tham dự giảm còn 6, buộc ban tổ chức phải điều chỉnh lại thể thức phân nhóm. Bảng A còn lại chủ nhà Thái Lan, Việt Nam và Brunei. Bảng B quy tụ Indonesia, Myanmar và Malaysia. Dù số lượng đội giảm, các cuộc đối đầu vẫn hứa hẹn căng thẳng khi những nền futsal mạnh như Thái Lan, Việt Nam và Indonesia được đánh giá cao trong cuộc đua vô địch. Hiện tại, Campuchia gần như đóng băng mọi hoạt động thể thao. Hồi cuối tháng 11, Ủy ban Olympic Campuchia (NOCC) đưa ra quyết định rút lui khỏi 9 môn thể thao, trong đó có bóng đá nam. Khi đó, Campuchia chỉ còn tham dự 12 môn thi đấu. Đến sáng 10/12, Campuchia rút lui khỏi toàn bộ 12 môn đăng ký thi đấu tại SEA Games 33. Phía Phnom Penh lo ngại nguy cơ mất an toàn cho vận động viên ở kỳ đại hội diễn ra trên đất Thái Lan. Trước đó ở lễ khai mạc SEA Games 33, có 30 VĐV Campuchia tham dự diễu hành. Cuốn sách“Leading: Learning from Life and My Years at Manchester United”được Sir Alex Ferguson viết chung với Michael Moritz xuất bản năm 2015 đem tới kinh nghiệm sống quý báu cho bất kỳ ai.  Ủy ban Olympic Quốc gia Thái Lan (NOCT) cho biết việc đoàn thể thao Campuchia rút toàn bộ khỏi 12 nội dung thi đấu tại SEA Games 33 gây ảnh hưởng trực tiếp đến lịch thi đấu của đại hội.  Truyền thông Thái Lan tiết lộ chính các quan chức nước chủ nhà cũng bày tỏ sự lo ngại về an toàn của các vận động viên Campuchia tại SEA Games 33.  Sáng 10/12, Campuchia quyết định rút lui khỏi toàn bộ 12 môn đăng ký thi đấu, chỉ một ngày sau khi Đoàn thể thao nước này tham dự lễ khai mạc tại sân vận động Rajamangala (Bangkok)."
ZNews,https://znews.vn/chua-phai-luc-salah-roi-anfield-post1610205.html,Thể thao,Null,"Thứ năm, 11/12/2025 09:24 (GMT+7)",Chưa phải lúc Salah rời Anfield,"Salah có thể chia tay Liverpool. Liverpool bước vào cuối tuần với một nghịch lý kỳ lạ: Mohamed Salah muốn nói lời tạm biệt tại Anfield, nhưng CLB lại cố giữ mọi cánh cửa mở. Không phải vì họ kỳ vọng ngôi sao 33 tuổi sẽ thay đổi ý định, mà vì một cái vẫy tay sai thời điểm có thể khiến giá trị chuyển nhượng của anh lập tức giảm xuống. Trong thời đại mà từng chi tiết nhỏ đều bị đặt lên bàn cân, Liverpool hiểu họ không thể tự làm suy yếu vị thế của mình trước khi thị trường mùa đông mở cửa. Salah vẫn còn hợp đồng đến năm 2027 và đó là lợi thế lớn nhất của Liverpool. Họ không muốn gửi tín hiệu rằng tiền đạo này “hết đường quay lại” ngay tại Anfield. Một màn chia tay cảm động, nếu diễn ra vào cuối tuần này, sẽ trở thành bằng chứng không thể chối cãi rằng Salah và Liverpool đã bước tới điểm kết thúc. Khi đó, Saudi Arabia, vốn đang sẵn sàng trả bất cứ giá nào, sẽ trở thành bên nắm đằng chuôi. Liverpool không thể chấp nhận điều đó. Đây không phải là câu chuyện tình cảm. Đây là bài toán kinh tế và quyền lực. Salah bị loại khỏi danh sách thi đấu trận gặp Inter Milan thuộc League Phase, Champions League. Anh tập cùng đội một buổi, và tập một mình buổi sau đó. HLV Arne Slot chưa quyết định liệu có đưa Salah vào danh sách trận gặp Brighton hay không. Nhưng một điều chắc chắn: các cầu thủ không thi đấu vẫn phải xuất hiện tại Anfield. Salah vẫn sẽ có mặt, nhưng Liverpool không muốn biến buổi tối đó thành một buổi “chia tay công khai”. Trong cuộc phỏng vấn cuối tuần trước, Salah nói sẽ tới Anfield để “chào tạm biệt người hâm mộ” trước khi dự CAN 2025. Phát ngôn này chính là mồi lửa khiến mọi việc bùng lên. Với Liverpool, đó là sai nhịp. CLB mất Trent Alexander-Arnold gần như theo dạng tự do mùa trước và chỉ kịp thu về 10 triệu bảng phí phá vỡ sớm. Họ không muốn rơi vào thế bị động thêm lần nữa. Điều Liverpool cần là mức phí chuyển nhượng xứng đáng cho cầu thủ ghi hơn 200 bàn, trở thành biểu tượng của kỷ nguyên Klopp và là một trong những gương mặt Hồi giáo nổi tiếng nhất thế giới. Salah đang đánh mất chính mình. Bốn CLB thuộc sở hữu PIF, Al-Hilal, Al-Nassr, Al-Ittihad, Al-Ahli, đều sẵn sàng nhảy vào thương vụ. Nhưng nhóm ngoài PIF, như Al Qadsiah, cũng theo đuổi quyết liệt với hậu thuẫn của những tập đoàn khổng lồ như Aramco. Một nguồn tin mô tả cuộc đua này là “làm mọi cách”, bởi Salah không chỉ mang giá trị chuyên môn mà còn là biểu tượng văn hóa. Trong bối cảnh đó, một cái vẫy tay tạm biệt tại Anfield có thể khiến Liverpool mất hàng chục triệu bảng. Jamie Carragher, người từng gọi Salah là “nỗi ô nhục” sau cuộc phỏng vấn gây tranh cãi, phải nói lời xin lỗi trên sóng CBS. Đây là sự việc hiếm hoi cho thấy nội bộ Liverpool không còn giữ được sự thống nhất tuyệt đối như trước. Jurgen Klopp, người hiểu Salah hơn bất kỳ ai, cũng mô tả chân sút Ai Cập là cầu thủ “không dễ nhưng cũng không khó quản lý”, và rắc rối chỉ xuất hiện khi anh bị thay ra hoặc không được đá chính. Đó là bản chất của một siêu sao: khao khát xuất hiện trên sân luôn vượt quá mọi giới hạn. Virgil van Dijk không đứng về phía ai. Anh nhấn mạnh đây là chuyện giữa CLB và Salah, và phòng thay đồ không can thiệp. Dominik Szoboszlai cũng nói thẳng: mỗi cầu thủ có cuộc đời và sự nghiệp riêng, và họ không có quyền phán xét. Những phản ứng này mang màu sắc trung lập nhưng cũng đầy tinh tế. Tập thể Liverpool hiểu họ không được phép đổ thêm dầu vào cuộc khủng hoảng lớn nhất mùa giải. Tất cả đều cảm nhận được rằng Salah đang ở đoạn cuối hành trình tại Liverpool. Nhưng thời khắc đó chưa thể đến vào thứ Bảy này. Không phải vì tình cảm chưa đủ, mà vì Liverpool cần bảo toàn lợi ích cho giai đoạn đàm phán có thể định hình lại thị trường chuyển nhượng châu Âu mùa đông. Salah muốn nói lời tạm biệt. Liverpool muốn hoãn nó. Và Anfield, dù quen với những khoảnh khắc đẹp, sẽ phải chờ để chứng kiến lần cuối cùng số 11 bước ra trong sắc đỏ."
