Source,URL,Category,Keyword,Time,Title,Content
VN Express,https://vnexpress.net/apple-don-iphone-san-xuat-tai-an-do-sang-my-4898378.html,Quốc tế,"iPhone,Foxconn,Apple Inc.,Ấn Độ,Mỹ,Trung Quốc,thuế nhập khẩu","Thứ sáu, 13/6/2025, 15:41 (GMT+7)",Apple dồn iPhone sản xuất tại Ấn Độ sang Mỹ,"Vài tháng qua, gần như toàn bộ iPhone lắp ráp tại Ấn Độ được xuất khẩu sang Mỹ, khi thuế áp với nước này chỉ bằng một phần ba Trung Quốc. Ngày 13/6,Reuterstrích số liệu của hải quan cho thấy giai đoạn tháng 3-5, khoảng 97% iPhone do Foxconn lắp ráp tại Ấn Độ đã được xuất khẩu sang Mỹ. Tỷ lệ này cao hơn nhiều so với mức trung bình năm ngoái là 50%. Đây là dấu hiệu cho thấy Apple cố gắng né thuế nhập khẩu ở mức cao mà Mỹ áp lên hàng Trung Quốc. Ấn Độ, cũng như hầu hết các đối tác thương mại, hiện chịu mức thuế chung 10% khi xuất khẩu sang Mỹ. Nước này đang đàm phán để tránh bị nâng lên 26% sau khi thời hạn hoãn thuế 90 ngày kết thúc vào đầu tháng tới. Trong khi đó, Trung Quốc hiện chịu thuế 30% với tất cả sản phẩm bán sang Mỹ. Cộng với thuế từ nhiệm kỳ trước của Tổng thống Mỹ Donald Trump, một số thậm chí bị áp thuế tới 55%. Trung bình mỗi năm, Apple bán hơn 60 triệu iPhone tại Mỹ, trong đó khoảng 80% được sản xuất ở Trung Quốc. Tổng giá trị số iPhone mà Foxconn xuất khẩu từ Ấn Độ sang Mỹ giai đoạn tháng 3-5 là 3,2 tỷ USD. Riêng trong tháng 5, số liệu này là gần 1 tỷ USD - mức cao thứ hai từ trước đến nay, chỉ sau kỷ lục 1,3 tỷ USD ghi nhận vào tháng 3. Trước đó, hồi tháng 3, hãng đã thuê máy bay vận chuyển các mẫu iPhone 13, 14, 16 và 16e, trị giá khoảng 2 tỷ USD sang Mỹ. Apple có thể đang tái định hướng hoạt động xuất khẩu từ Ấn Độ, để gần như chỉ phục vụ thị trường Mỹ. Trước đây, iPhone sản xuất tại đây được phân phối sang các nước như Hà Lan, Cộng hòa Czech và Anh. Táo Khuyết cũng vận động giới chức sân bay tại thành phố Chennai - trung tâm xuất khẩu iPhone quan trọng của Apple - giảm thời gian thông quan tại đây từ 30 giờ xuống còn 6 giờ. ""Chúng tôi dự báo iPhone sản xuất tại Ấn Độ sẽ chiếm 25-30% tổng lượng loại smartphone này trên toàn cầu trong năm nay, tăng so với mức 18% năm 2024"", Prachir Singh, nhà phân tích cấp cao tại Counterpoint Research nhận xét. Vài năm qua, Thủ tướng Ấn Độ Narendra Modi thúc đẩy nước này thành trung tâm sản xuất smartphone. Tuy nhiên, thuế nhập khẩu linh kiện cao so với các nước khiến chi phí sản xuất thiết bị tại đây vẫn lớn. Bên cạnh đó, việc Apple đẩy mạnh sản xuất tại Ấn Độ từng bị ông Trump chỉ trích gay gắt hồi tháng trước. ""Chúng tôi không muốn các ông sản xuất ở Ấn Độ. Ấn Độ có thể tự lo được, họ đang làm rất tốt. Chúng tôi muốn các ông sản xuất ở đây"", ông Trump nói với CEO Tim Cook. Hà Thu(theo Reuters)"
VN Express,https://vnexpress.net/ong-trump-noi-chu-tich-fed-la-ke-ngoc-4898224.html,Quốc tế,"lạm phát,Donald Trump,lãi suất,thuế nhập khẩu,FED,Jerome Powell","Thứ sáu, 13/6/2025, 08:37 (GMT+7)",Ông Trump nói Chủ tịch Fed là 'kẻ ngốc',"Tổng thống Mỹ tiếp tục công kích Chủ tịch Fed Jerome Powell và gợi ý cơ quan này giảm lãi suất thêm 2 điểm phần trăm. Tại Nhà Trắng ngày 12/6, Tổng thống Mỹ Donald Trump cho biết việc giảm lãi suất tổng cộng 2 điểm phần trăm sẽ giúp Mỹ tiết kiệm 600 tỷ USD một năm. ""Nhưng chúng tôi không thể khiến ông ta làm điều đó"", ông nói, ám chỉ Chủ tịch Cục Dự trữ liên bang Mỹ Jerome Powell. ""Chúng ta sẽ phải chi thêm 600 tỷ USD một năm, vì có một kẻ ngốc ngồi đó và nói: ‘Tôi chưa thấy đủ lý do để giảm lãi bây giờ’"", ông Trump chỉ trích. Tổng thống Mỹ sau đó nói thêm rằng ông đồng ý tăng lãi suất nếu lạm phát lên cao, nhưng khẳng định ""chỉ số này đang giảm"" và ông ""có thể buộc phải làm điều gì đó"". Phát biểu này được đưa ra chỉ vài giờ sau khi Bộ Lao động Mỹ công bố chỉ số giá sản xuất (PPI) của Mỹ tăng chậm hơn dự báo trong tháng 5. Một số báo cáo trước đó cũng đã xoa dịu lo ngại về lạm phát đột ngột tăng tốc do thuế nhập khẩu. Điều này khiến chính quyền Trump càng tăng sức ép lên Fed. Đây là lần thứ ba chỉ trong 2 ngày, Powell bị chính quyền Trump nhắc tới. Ngày 11/6, Bộ trưởng Thương mại Mỹ Howard Lutnick trả lờiFox News: ""Bạn sẽ không thể tin được chúng ta sẽ tiết kiệm được nhiều đến mức nào nếu Powell làm đúng phận sự và giảm lãi suất. Nền kinh tế đã sẵn sàng rồi. Việc này rất đơn giản. Lạm phát đang thấp mà"". Cùng ngày, Phó Tổng thống Mỹ JD Vance viết trên mạng xã hội: ""Việc Fed từ chối cắt giảm lãi suất là sai lầm trong điều hành tiền tệ"". Dù vậy, thị trường tài chính Mỹ ngày 12/6 gần như không chịu tác động từ các bình luận của ông Trump. Vài tháng qua, ông vẫn liên tiếp công kích Powell, thậm chí đặt biệt danh cho Chủ tịch Fed là ""Powell chậm chạp"". Nhà đầu tư hiện dự báo Fed không giảm lãi suất trong cuộc họp chính sách tuần tới. Cuộc họp tháng 7 cũng có rất ít hy vọng. Họ cho rằng phải tới tháng 9, Fed mới làm điều này. Hồi tháng 4, thị trường từng chao đảo khi Trump được cho là đang tìm cách sa thải Powell trước khi nhiệm kỳ kết thúc năm tới. Sau đó, ông Trump rút lại ý định này do lo ngại thị trường biến động, và đến nay vẫn chưa nhắc lại ý định này. Trong phát biểu ngày 12/6, Trump vẫn khẳng định: ""Tôi sẽ không sa thải Powell"", nhưng nói thêm: ""Tôi cũng không hiểu vì sao việc đó lại bị coi là tệ"". Powell từng khẳng định luật pháp không cho phép Tổng thống bãi nhiệm Chủ tịch Fed. Tòa án Tối cao Mỹ hồi tháng 5 cũng cho biết các thành viên Hội đồng Thống đốc Fed có mức bảo vệ pháp lý cao hơn so với lãnh đạo nhiều cơ quan liên bang khác. Hà Thu(theo CNBC, Reuters)"
VN Express,https://vnexpress.net/gia-vang-dau-tang-vot-vi-israel-khong-kich-iran-4898301.html,Quốc tế,"Iran,Israel,Trung Đông,giá vàng,giá vàng hôm nay,giá dầu,dầu thô","Thứ sáu, 13/6/2025, 10:08 (GMT+7)","Giá vàng, dầu tăng vọt vì Israel không kích Iran","Giá vàng tăng hơn 50 USD một ounce, trong khi dầu thô WTI và Brent đều lên hơn 11% vì xung đột mới nhất tại Trung Đông. Mở cửa phiên giao dịch sáng 13/6, giá vàng thế giới giao ngay tăng gần 54 USD lên 3.437 USD. Đây là mức cao nhất 1 tháng. Tổng cộng tuần này, giá đã tăng 3,5%. Giá đi lên do nhà đầu tư tìm đến tài sản an toàn sau xung đột mới nhất tại Trung Đông. Ngày 13/6, Bộ trưởng Quốc phòng Israel Katz tuyên bố quân đội Israel đãtấn công phủ đầunhằm vào Iran, đồng thời ban bố tình trạng khẩn cấp trên toàn quốc. Cuộc tấn công có thể đã khiến tổng tham mưu trưởng và tư lệnh vệ binh Iran thiệt mạng. ""Diễn biến mới nhất tại Trung Đông khiến nhà đầu tư chuyển hướng chú ý khỏi các cuộc đàm phán thương mại. Hiện tại, họ cần tài sản trú ẩn"", Tim Waterer – nhà phân tích tại KCM Trade cho biết trênReuters. Vì giá vàng đã vượt ngưỡng cản 3.400 USD sau tin tức này, Waterer dự báo giá còn lên cao nữa nếu căng thẳng tiếp tục leo thang. Kỷ lục hiện tại là 3.500 USD một ounce, xác lập hồi tháng 4. Ngoài vàng, giá dầu thô sáng nay cũng tăng vọt vì căng thẳng Trung Đông. Dầu Brent hiện tăng 11% lên 77 USD một thùng. Dầu WTI tăng 10,8% lên 75,3 USD. Nhà đầu tư lo ngại việc này sẽ làm gián đoạn nguồn cung dầu toàn cầu. Tính đến cuối năm ngoái, Iran là nước sản xuất dầu mỏ lớn thứ 3 trong OPEC (Tổ chức Các nước xuất khẩu dầu mỏ), với sản lượng 3,2 triệu thùng một ngày, tương đương 3% toàn cầu. ""Cuộc tấn công của Israel vào Iran đã khiến rủi ro tiếp tục tăng"", Saul Kavonic, chuyên gia phân tích năng lượng cấp cao tại MST Marquee, nhận định. Dù vậy, Kavonic cho rằng xung đột sẽ phải leo thang đến mức khiến Iran đáp trả vào cơ sở hạ tầng dầu mỏ trong khu vực thì nguồn cung dầu mới thực sự bị ảnh hưởng đáng kể. Trong kịch bản tệ nhất, Iran có thể khiến cung dầu toàn cầu giảm 20 triệu thùng một ngày nếu tấn công vào cơ sở dầu mỏ hoặc hạn chế giao thông tại Eo biển Hormuz. Các thị trường chứng khoán lớn tại châu Á sáng nay đồng loạt đi xuống. Chỉ số Nikkei 225 (Nhật Bản) hiện giảm 1,3%, Kospi (Hàn Quốc) mất 1,2. Tại Trung Quốc, Shanghai Composite giảm 0,6%, Hang Seng Index (Hong Kong) mất 0,7%. Trong khi đó, các đồng tiền nổi tiếng an toàn như franc Thụy Sĩ và yen Nhật đều đang tăng giá 0,3-0,4% so với USD. Hiện mỗi USD chỉ đổi được 0,8 CHF và 143 JPY. Hà Thu(theo Reuters)"
VN Express,https://vnexpress.net/chu-tich-mobifone-chuyen-sang-ban-chinh-sach-chien-luoc-trung-uong-4898630.html,Doanh nghiệp,"Mobifone,Chủ tịch MobiFone,khcn","Thứ sáu, 13/6/2025, 21:01 (GMT+7)","Chủ tịch MobiFone chuyển sang Ban Chính sách, chiến lược Trung ương","Ông Nguyễn Hồng Hiển, Chủ tịch Hội đồng thành viên Mobifone, được bổ nhiệm làm Vụ trưởng Khoa học công nghệ, đổi mới sáng tạo và chuyển đổi số của Ban Chính sách, chiến lược Trung ương. Quyết định bổ nhiệm được Ban Chính sách, chiến lược Trung ương công bố tại hội nghị ngày 13/6. Phó trưởng ban Phạm Đại Dương đã trao quyết định của Trưởng Ban Chính sách, chiến lược Trung ương về tiếp nhận và bổ nhiệm ông Nguyễn Hồng Hiển. Theo đó, ông Nguyễn Hồng Hiển sẽ giữ chức Vụ trưởng Vụ Khoa học công nghệ, đổi mới sáng tạo và chuyển đổi số, Ban Chính sách, chiến lược Trung ương. Ông Hiển giữ vai trò Chủ tịch MobiFone từ tháng 6/2022. Ông sinh năm 1974, là thạc sĩ Luật Tài chính Ngân hàng tại trường Queen Mary, Đại học Tổng hợp London (Vương quốc Anh). Trước khi về MobiFone, ông Hiển từng giữ vị trí Vụ trưởng Công nghệ và Hạ tầng thuộc Uỷ ban Quản lý vốn Nhà nước tại doanh nghiệp. Ngoài ra, ông cũng làm việc tại Tổng công ty Đầu tư và Kinh doanh vốn Nhà nước (SCIC) từ năm 2007 và trở thành phó tổng giám đốc năm 2014. Ông Hiển từng được SCIC giao làm đại diện phần vốn tại nhiều doanh nghiệp như FPT Telecom, Vinamilk... Phương Dung"
VN Express,https://vnexpress.net/pjico-co-tong-giam-doc-moi-4898400.html,Doanh nghiệp,"PJICO,bảo hiểm phi nhân thọ,bảo hiểm PJICO","Thứ sáu, 13/6/2025, 12:20 (GMT+7)",Bảo hiểm PJICO có tổng giám đốc mới,"Tổng công ty cổ phần Bảo hiểm Petrolimex (PJICO) vừa bổ nhiệm ông Trần Anh Tuấn làm Tổng giám đốc trong 5 năm, kể từ 16/6. Trước khi được giao vị trí này, ông Tuấn là Phó tổng giám đốc PJICO. Ông gia nhập bảo hiểm PJICO từ năm 1995, với hơn 30 năm quản lý và điều hành doanh nghiệp trong lĩnh vực bảo hiểm. Ông từng đảm nhận nhiều vị trí tại PJICO như Phó trưởng phòng Tài chính kế toán, Trưởng phòng Đầu tư tài chính. Giữa tháng trước, PJICO cùng lúc miễn nhiệm Tổng giám đốc Nguyễn Thị Hương Giang và Phó tổng giám đốc Trần Hoài Nam. Đồng thời, công ty cũng bổ nhiệm ông Phạm Thanh Hải - Chủ tịch PJICO - làm người đại diện pháp luật, thay cho bà Nguyễn Thị Hương Giang. Cả hai lãnh đạo PJICO miễn nhiệm lần này đều là những nhân sự gắn bó gần 30 năm tại doanh nghiệp. Tính đến cuối năm ngoái, thị trường Việt Nam có 32 doanh nghiệp bảo hiểm phi nhân thọ. Trong đó, PJICO chiếm 5,5% thị phần doanh thu phí bảo hiểm gốc năm 2024, tương đương với thị phần của Tổng công ty bảo hiểm Quân đội (MIC) hay Công ty bảo hiểm Ngân hàng Đầu tư Phát triển Việt Nam (BIC). PJICO có vốn điều lệ hơn 1.100 tỷ đồng, quy mô tổng tài sản hơn 8.400 tỷ, tính đến hết 2024. Ba cổ đông chiến lược của doanh nghiệp này gồm Tập đoàn Xăng dầu Việt Nam (Petrolimex), Samsung Firre & Marine Insurance - là hãng bảo hiểm hàng đầu của Hàn Quốc và Ngân hàng Ngoại thương Việt Nam (Vietcombank). Mảng kinh doanh mạnh nhất của PJICO là bảo hiểmxe cơ giới. Năm 2024, doanh thu phí của bảo hiểm xe cơ giới tại doanh nghiệp này đạt 1.641 tỷ đồng, chiếm hơn 35% tổng doanh thu phí bảo hiểm gốc. Quỳnh Trang"
VN Express,https://vnexpress.net/trum-lau-nuong-golden-gate-dat-muc-tieu-lai-gap-doi-4898335.html,Doanh nghiệp,"Golden Gate,GoGi House,The Coffee House,Kichi Kichi,Manwah","Thứ sáu, 13/6/2025, 12:12 (GMT+7)",'Trùm lẩu nướng' Golden Gate đặt mục tiêu lãi gấp đôi,"Năm nay, Golden Gate - đơn vị vận hành Kichi Kichi, Gogi House, Manwah và vừa mua The Coffee House - dự kiến lãi tăng gấp đôi lên 205 tỷ đồng. Theo tài liệu họp thường niên sắp tới, Công ty cổ phần Tập đoànGolden Gateđặt mục tiêu có gần 8.124 tỷ đồng doanh thu thuần và gần 205 tỷ đồng lợi nhuận sau thuế. So với năm trước, chỉ tiêu doanh thu nâng lên 22,5% nhưng lợi nhuận có thể tăng hơn gấp đôi. Nếu hoàn thành, Golden Gate sẽ lãi lớn nhất 3 năm qua. Tuy nhiên, mức này vẫn chưa thể ngang với giai đoạn trước dịch và lợi nhuận 659 tỷ đồng hồi năm 2022. Ban lãnh đạo cho biết năm nay họ tiếp tục tập trung gia tăng trải nghiệm khách hàng và mở rộng kinh doanh tại các địa bàn mới ""một cách có chọn lọc"". Golden Gate cũng sẽ khai thác thế mạnh của các thương hiệu mũi nhọn, phát triển các nhãn mới, xây dựng hệ thống quản trị doanh nghiệp và áp dụng công nghệ nhằm tối ưu vận hành. Ngoài ra, công ty lên kế hoạch cụ thể và quyết liệt triển khai để cải thiện kết quả kinh doanh của các nhà hàng yếu kém. Năm trước, Golden Gate mang về 6.633 tỷ đồng doanh thu, tăng 5,5% so với cùng kỳ năm trước. Tuy nhiên, lợi nhuận sau thuế giảm 28% còn hơn 100 tỷ đồng. Đây là năm thứ hai liên tiếp doanh nghiệp này báo lãi giảm. Chi phí bán hàng tăng là nguyên nhân chính dẫn đến lợi nhuận tiếp tục giảm. Kết quả trên chưa đạt kế hoạch đề ra khi doanh thu hoàn thành gần 94% chỉ tiêu, lợi nhuận chỉ đạt khoảng 62%. Ban lãnh đạo cho biết 2024 là một năm có nhiều thử thách bởi các biến động của kinh tế vĩ mô khiến người tiêu dùng có xu hướng thắt chặt chi tiêu. Nhu cầu ăn uống, tụ tập, giải trí từ đó suy giảm đáng kể, gây ảnh hưởng đến cơ cấu lợi nhuận của Golden Gate. Tuy nhiên, doanh nghiệp này vẫn ra mắt thêm 3 thương hiệu mới và duy trì mạng lưới khoảng 500 nhà hàng. Năm nay, công ty dự kiến tập trung vào cốt lõi kinh doanh vận hành nhằm tạo nền tảng cho tương lai. Để đảm bảo nguồn lực tối ưu, việc tập trung vốn là vô cùng quan trọng. Hội đồng quản trị công ty lên kế hoạch sẽ không thực hiện chi trả cổ tức bằng tiền mặt. Như vậy, đây sẽ là năm thứ 3 liên tiếp, doanh nghiệp này muốn giữ lại lợi nhuận thay vì chia cho cổ đông. Thành lập từ năm 2005, Golden Gate là một trong những đơn vị đầu tiên áp dụng mô hình chuỗi nhà hàng tại Việt Nam. ﻿Khởi đầu với thương hiệu lẩu nấm Ashima, đến hết năm 2024, công ty này sở hữu hơn 40 thương hiệu cùng gần 500 nhà hàng tại 42 tỉnh thành, phục vụ 18 triệu lượt khách hàng mỗi năm. Một số chuỗi nhà hàng tiêu biểu của Golden Gate là Manwah, Kichi Kichi, iSushi, Durama, Icook, Gogi House, Sumo BBQ, Cowboy Jack's, Vuvuzela... Cuối năm trước, họ cũng thâu tóm thêmThe Coffee Housevới giá 270 tỷ đồng từ Seedcom. Đây là chuỗi cà phê từng nổi đình đám một thời nhưng thời gian qua phải đóng nhiều cửa hàng, đến nay chỉ còn gần 100 điểm bán, chủ yếu ở các thành phố lớn. Tất Đạt"
VN Express,https://vnexpress.net/loat-hoat-dong-ghi-dau-an-nutifood-sau-25-nam-4898624.html,Doanh nghiệp,"xuất khẩu,hoạt động cộng đồng,Nutifood,mô hình nông nghiệp bền vững","Thứ sáu, 13/6/2025, 20:00 (GMT+7)",Loạt hoạt động ghi dấu ấn Nutifood sau 25 năm,"Nutifood hỗ trợ dinh dưỡng cho trẻ em, tiếp sức tuyến đầu, phát triển vùng nguyên liệu, xuất khẩu sữa và theo đuổi mô hình nông nghiệp bền vững ""từ trang trại đến bàn ăn"". Những ngày đầu tháng 6, Nutifood đồng hành cùng chương trình ""Vinh quang Công an nhân dân Việt Nam"" tại TP HCM, chào mừng kỷ niệm 77 năm ngày Chủ tịch Hồ Chí Minh ra lời kêu gọi thi đua ái quốc. Tại sự kiện, ngoài các hoạt động trải nghiệm, nhãn hàng còn phát hơn 25.000 sản phẩm dinh dưỡng miễn phí cho người dân và lực lượng chiến sĩ. Tổ chức loạt chương trình vì cộng đồng Doanh nghiệp cho biết, mỗi năm triển khai hơn 20 chương trình thiện nguyện lớn, góp phần thay đổi cho nhiều lĩnh vực: an sinh xã hội, nâng cao giáo dục, cải thiện môi trường... Trong đó, chiến dịch ""Hành trình 1 triệu ly sữa mỗi ngày, vì một Việt Nam thoát khỏi suy dinh dưỡng, thấp còi"", khởi động vào năm 2019, đã đi qua 12 tỉnh thành, đem cơ hội tư vấn dinh dưỡng đến với hơn 30.000 trẻ và giấc mơ có sữa đến hơn 200 trẻ thông qua việc tài trợ dinh dưỡng mỗi năm. Đại diện doanh nghiệp cho biết trên mỗi hành trình đi qua, Nutifood luôn đặt trọng trách vì cộng đồng lên hàng đầu. Hãng từng chi hàng trăm tỷ đồng tiền mặt, hàng triệu sản phẩm dinh dưỡng, thiết bị y tế trong đại dịch Covid-19; hỗ trợ thực phẩm dinh dưỡng cho hơn 10.000 người bệnh khó khăn mỗi năm. Đơn vị cũng chi hàng chục tỷ đồng cho người nghèo, ngư dân, người cao tuổi khó khăn hay mới nhất là dành ngân sách gần 1.000 tỷ đồng xây cầu đi bộ bắc qua sông Sài Gòn. Theo đại diện nhãn, mỗi hành động đều xuất phát từ cam kết phụng sự cộng đồng, cống hiến lâu dài cho đất nước. Khẩu hiệu ""Nutifood yêu Việt Nam"" không chỉ là khẩu hiệu mà là hành trình bền bỉ suốt 25 năm, được nuôi dưỡng từ tâm huyết, trách nhiệm và cam kết phụng sự cộng đồng. Hỗ trợ chăm sóc sức khỏe người Việt Từ ngày đầu mới ra mắt, Nutifood đã thể hiện khát vọng cải thiện thể trạng người Việt. Đội ngũ sáng lập vào năm 2000 là những người có chuyên môn sâu về y học và dinh dưỡng, tạo ra những sản phẩm dựa trên nhu cầu thực tế của người bệnh và cộng đồng. Đơn vị còn chủ động xây dựng chuỗi giá trị dinh dưỡng khép kín từ vùng nguyên liệu tại Gia Lai, 4 nhà máy tại Việt Nam, một nhà máy tại Thụy Điển, một nhà máy sản xuất tại Singapore, hai viện nghiên cứu dinh dưỡng cùng hệ thống kiểm soát nghiêm ngặt chất lượng từ nguyên liệu đến sản phẩm cuối cùng. Với sự am hiểu của đội ngũ chuyên gia, kinh nghiệm lâm sàng sâu rộng và sự thấu hiểu thể trạng đặc thù của người Việt Nam, hàng loạt sản phẩm dinh dưỡng đặc trị Nutifood lên kệ. Các sản phẩm được ""đo ni đóng giày"" để phù hợp nhất với nhu cầu dinh dưỡng của từng đối tượng: GrowPLUS+, Värna cho người trưởng thành... Ngoài ra, Nutifood hiện còn sở hữu những thương hiệu kem được nhiều người yêu thích như: Celano, Merino, Bliss... Ngoài chất lượng, nhãn còn sáng tạo một số sản phẩm mới, đáp ứng đa dạng nhu cầu người dùng như sữa tươi trái cây, sữa chua uống có thạch và sản phẩm thạch trong bao bì Ecoclean. Nutifood đặt mục tiêu chinh phục thị trường quốc tế, gửi gắm khát vọng đưa thương hiệu Việt ra toàn cầu. Năm 2019, đơn vị trở thành doanh nghiệp Việt sở hữu nhà máy tại Thụy Điển. Hai năm sau, công ty thành lập Viện Nghiên cứu dinh dưỡng Nutifood Thụy Điển (NNRIS), hợp tác với nhiều tập đoàn dinh dưỡng lớn như: BASF (Đức), DuPont (Mỹ), DSM (Thụy Sĩ)... Gần nhất, Nutifood hợp tác chiến lược với ViPlus Dairy, hình thành liên doanh ViPlus Nutritional Australia. Qua đó, Nutifood trở thành doanh nghiệp Việt đồng sáng lập thương hiệu sữa Australia cao cấp Gipps Nature. Thương hiệu này kế thừa di sản 130 năm của ViPlus Dairy với quy trình khép kín từ trang trại đến nhà máy tại Australia. Sản phẩm đạt nhiều chứng nhận về chất lượng và an toàn. Hải My"
