Source,URL,Category,Keyword,Time,Title,Content
znews,https://znews.vn/khoi-san-xuat-van-hanh-vung-vi-the-trung-tam-an-toan-cua-pv-gas-post1610746.html,Kinh doanh,Null,,Khối Sản xuất - Vận hành vững vị thế 'trung tâm an toàn' của PV GAS,"Năm 2025 được đánh giá là một năm ""lửa thử vàng"" đối với ngành khí khi phải đối diện với ""tác động kép"": Sự suy giảm nhanh của các nguồn khí nội địa và áp lực cạnh tranh gay gắt từ năng lượng tái tạo. Tuy nhiên, với vai trò là xương sống trong chuỗi giá trị khí, các đơn vị trong Khối Sản xuất - Vận hành của PV GAS đã biến thách thức thành động lực để bứt phá. Sự kiện hợp nhất Công ty Vận chuyển Khí Đông Nam Bộ và Công ty Chế biến Khí Vũng Tàu thành Chi nhánh Khí Đông Nam Bộ là dấu ấn lớn nhất trong công tác tái cấu trúc. Việc hình thành một đầu mối quản lý xuyên suốt chuỗi giá trị từ tiếp nhận, vận chuyển đến chế biến đã tối ưu hóa nguồn lực, khẳng định vị thế chủ lực tại khu vực kinh tế trọng điểm phía Nam. Đơn vị đã khẳng định vị thế tiên phong trong chiến lược khí thiên nhiên hóa lỏng (LNG) khi hoàn thành tiếp nhận an toàn 6 chuyến tàu LNG, nâng công suất tái hóa khí tại kho cảng Thị Vải lên 233 tấn/h và sẵn sàng cho các kịch bản cấp khí mùa cao điểm. Đoàn Chủ tịch điều hành Hội nghị tại Chi nhánh Khí Đông Nam Bộ. Tại Công ty Đường ống Khí Nam Côn Sơn (PV GAS NCSP), ""đổi mới sáng tạo"" đã trở thành từ khóa chủ đạo. Bằng việc áp dụng các giải pháp kỹ thuật tối ưu, đơn vị đã hoàn thành kế hoạch sản lượng sớm hơn 34 ngày so với tiến độ. Kết quả này đã khẳng định hiệu quả của tư duy đột phá trong vận hành. Lãnh đạo PV GAS chụp ảnh lưu niệm cùng tập thể lãnh đạo, người lao động PV GAS NCSP. Nhận thức rõ vai trò là ""trái tim"" của hệ thống khí quốc gia, các đơn vị trong Khối đã đặt yếu tố an toàn lên hàng đầu, duy trì kỷ luật vận hành nghiêm ngặt để đảm bảo dòng khí liên tục, thông suốt. Chi nhánh Khí Bắc Bộ đã vận hành hệ thống với độ tin cậy và độ sẵn sàng đạt xấp xỉ 100%, không để xảy ra bất kỳ sự cố dừng khí nào do lỗi chủ quan, góp phần quan trọng giúp đơn vị vượt các chỉ tiêu quan trọng về sản lượng và tài chính. Công tác an ninh, an toàn hành lang tuyến ống được kiểm soát chặt chẽ dù địa bàn trải dài và phức tạp. Lãnh đạo PV GAS chụp ảnh lưu niệm cùng lãnh đạo và người lao động tại Chi nhánh Khí Bắc Bộ. Tương tự, tại khu vực địa đầu cực Nam Tổ quốc, Chi nhánh Khí Tây Nam Bộ tiếp tục duy trì thành tích vận hành an toàn tuyệt đối hệ thống đường ống PM3 và Nhà máy Xử lý Khí Cà Mau. Lãnh đạo đơn vị cam kết giữ vững tinh thần ""nói được - làm được"", xem an toàn là sinh mệnh và văn hóa doanh nghiệp là nền tảng. Việc không để xảy ra sự cố mất an toàn trong năm 2025 tại tất cả đơn vị  chính là minh chứng rõ nét nhất cho kỷ luật thép trong vận hành của Khối. Không chỉ hoàn thành nhiệm vụ sản xuất, Khối Sản xuất - Vận hành còn được xác định phải phát huy mạnh mẽ vai trò dẫn dắt trong các hoạt động khoa học công nghệ và đổi mới sáng tạo. Đây được xem là ""mũi nhọn"" để PV GAS gia tăng năng lực cạnh tranh trong dài hạn. Lãnh đạo PV GAS và lãnh đạo Chi nhánh Khí Tây Nam Bộ chụp ảnh lưu niệm tại hội nghị. Các đơn vị trong Khối luôn là điểm sáng điển hình tại PV GAS khi xác định ""đổi mới sáng tạo"" là động lực tăng trưởng vượt bậc. Các đơn vị đã áp dụng hàng loạt sáng kiến cải tiến kỹ thuật, số hóa quy trình và ứng dụng công nghệ tiên tiến trong các hoạt động giám sát, điều khiển hệ thống. Điển hình tại Chi nhánh Khí Đông Nam Bộ, năng lực công nghệ được thể hiện qua việc làm chủ hệ thống kho cảng LNG hiện đại. Đơn vị đã tự chủ thực hiện các giải pháp kỹ thuật để nâng công suất tái hóa khí từ 171 tấn/h lên 233 tấn/h, đồng thời đẩy mạnh chuyển đổi số với hệ thống quản trị nguồn lực ERP. Bước sang năm 2026, Khối Sản xuất - Vận hành xác định tiếp tục đối mặt với nhiều thách thức từ sự chuyển dịch năng lượng. Tuy nhiên, với tâm thế chủ động, các đơn vị đã vạch rõ lộ trình phát triển dựa trên hai trụ cột: Chuyển đổi số và Chuyển đổi xanh. Các kế hoạch chiến lược đã được kích hoạt, bao gồm nghiên cứu sản xuất hydrogen xanh từ điện gió ngoài khơi, triển khai các dự án tách ethane, sản xuất hydro xanh, và tìm kiếm cơ hội đầu tư hạ tầng kho LNG/LPG lạnh tại phía Bắc. Ông Phạm Văn Phong, Phó bí thư Đảng ủy, Thành viên HĐQT, Tổng giám đốc PV GAS phát biểu chỉ đạo tại hội nghị. Phát biểu chỉ đạo tại các hội nghị, lãnh đạo PV GAS nhấn mạnh để hoàn thành thắng lợi nhiệm vụ năm 2026, Khối Sản xuất - Vận hành phải tiếp tục là tấm khiên vững chắc về an toàn, là bệ phóng vững vàng về tài chính và là mũi nhọn tiên phong trong đổi mới sáng tạo. Đó chính là công thức để PV GAS phát triển bền vững trong kỷ nguyên năng lượng mới. Trên cơ sở các kết quả đã đạt được và phát huy các lợi thế hiện có, Khối Sản xuất - Vận hành tiếp tục duy trì tinh thần đoàn kết, chủ động, sáng tạo và trách nhiệm cao trong mọi hoạt động quản lý, vận hành, sản xuất kinh doanh; đồng thời nâng cao hiệu quả phối hợp, tối ưu hóa quy trình, phát huy năng lực từng cá nhân và bộ phận, kết hợp ứng dụng công nghệ, đổi mới phương thức quản trị và đảm bảo an toàn - liên tục - hiệu quả vận hành các công trình khí. Với quyết tâm cao, các đơn vị của Khối Sản xuất - Vận hành cam kết hoàn thành và hoàn thành vượt mức các mục tiêu, nhiệm vụ sản xuất kinh doanh năm 2026, góp phần nâng cao hiệu quả củng cố vị thế và tạo nền tảng vững chắc cho sự phát triển lâu dài của PV GAS trong thời gian tới.  Trong tháng 11, ông Nguyễn Thanh Bình, Bí thư Đảng ủy, Chủ tịch HĐQT PV GAS đã làm việc với các đơn vị thuộc Khối Kinh doanh, Khối Sản xuất - Vận hành và Khối Dự án - Dịch vụ.  Năm 2025 ghi dấu một bước phát triển bứt phá của Công ty Kinh doanh Sản phẩm Khí (PV GAS TRADING), khi hàng loạt kỷ lục về sản lượng, doanh thu và thị phần được thiết lập.  Tổng công ty Khí Việt Nam (PV GAS) vừa công bố báo cáo tài chính hợp nhất quý III với kết quả tăng trưởng ấn tượng, tạo đà vững chắc cho năm 2026 và giai đoạn phát triển tiếp theo."
znews,https://znews.vn/vang-rot-gia-nguoi-mua-hom-qua-lo-nang-post1611854.html,Kinh doanh,Null,,"Vàng rớt giá, người mua hôm qua lỗ nặng","Sáng 16/12, giá vàng miếng trong nước rơi khỏi mốc kỷ lục 157,2 triệu đồng/lượng. Ảnh:Thế Bằng. Sau khi vượt mốc 157 triệu đồng/lượng vào chiều qua (15/12),giá vàngmiếng trong nước đã nhanh chóng lao dốc trong phiên sáng nay, kéo giá về dưới ngưỡng lịch sử này. Cụ thể, sáng nay (16/12), Công ty Vàng bạc Đá quý Sài Gòn (SJC) đã giảm 1 triệu đồng/lượng với giá giao dịch vàng miếng so với cuối ngày hôm qua, về mức 154,2 - 156,2 triệu đồng/lượng (mua - bán). Chênh lệch giữa hai chiều mua - bán vẫn được giữ ở mức 2 triệu đồng mỗi lượng. Cùng thời điểm, các doanh nghiệp vàng lớn khác như CTCP Vàng bạc đá quý Phú Nhuận (PNJ), Tập đoàn DOJI, Tập đoàn Phú Quý, Bảo Tín Minh Châu, Bảo Tín Mạnh Hải, Công ty Mi Hồng... cũng đồng loạt giảm giá mặt hàng này về vùng trên 156 triệu đồng/lượng, tương đương Công ty SJC. Phiên giảm 1 triệu đồng/lượng sáng nay không chỉ kéo giá vàng miếng rơi khỏi đỉnh lịch sử mà còn khiến người lỡ ""đủ đỉnh"" vàng miếng hôm qua lỗ nặng chỉ sau một đêm. Theo đó, mức giảm 1 triệu đồng cộng với chênh lệch giá mua - bán 2 triệu đồng/lượng đã khiến người mua vàng chiều qua đến nay lỗ tới 3 triệu đồng/lượng. Cũng chung xu hướng giảm, giá vàng nhẫn SJC 99,99% loại 1-5 chỉ cũng đã giảm 1 triệu đồng so với phiên hôm qua, hiện được mua vào ở mức 150,6 triệu đồng/lượng và bán ra ở 153,4 triệu đồng. Với chênh lệch giá mua - bán lên tới 2,8 triệu đồng/lượng, phiên giảm giá sáng nay đã khiến người mua vàng nhẫn SJC chiều qua lỗ 3,8 triệu đồng mỗi lượng. Hiện tại, giá giao dịch vàng nhẫn tại hầu hết doanh nghiệp cũng đồng loạt giảm. PNJ, DOJI cùng chấp nhận giao dịch vàng nhẫn ở mức 151,5 - 154,5 triệu đồng/lượng; Bảo Tín Minh Châu và Bảo Tín Mạnh Hải cùng đưa ra mức 151,8 - 154,8 triệu đồng/lượng; còn Mi Hồng niêm yết giá vàng nhẫn 999 ở 155,5 - 156,2 triệu/lượng, tức giảm đến 2 triệu đồng ở chiều mua và 600.000 đồng ở chiều bán so với phiên chiều hôm qua. Những ngày qua, giá vàng miếng trong nước liên tục lập kỷ lục. Đáng chú ý, đà tăng trong phiên chiều 15/12 cũng chính thức kéo giá vàng miếng SJC trong nước lần đầu vượt mốc 157 triệu đồng/lượng, thiết lập đỉnh lịch sử mới. Đà giảm của giá vàng trong nước chủ yếu do tác động của giá vàng thế giới. Chốt phiên giao dịch 15/12 (giờ Mỹ), giá kim quý thế giới giao ngay đã tăng5,6 USDlên4.304,3 USD/ounce, tuy nhiên, so với vùng giá cao nhất trong ngày, mức đóng cửa kể trên vẫn thấp hơn gần50 USD, tạo áp lực đáng kể lên giá vàng trong nước. Vào ngày 10/12 (giờ địa phương), Cục Dự trữ Liên bang Mỹ (Fed) đã quyết định cắt giảm lãi suất 0,25% trong một cuộc bỏ phiếu có nhiều ý kiến trái chiều, đồng thời cho biết các đợt nới lỏng tiếp theo sẽ phụ thuộc vào diễn biến của thị trường lao động và lạm phát, theoReuters. Thị trường hiện định giá khả năng cơ quan này sẽ cắt giảm lãi suất thêm 2 lần vào năm tới, đồng thời các nhà đầu tư đang theo dõi sát nhiều số liệu kinh tế khác để tìm thêm manh mối về định hướng chính sách tiền tệ. Tri Thức - Znewsgiới thiệu độc giảTủ sách kiến thức kinh tếvới đa dạng cuốn sách, câu chuyện trong lĩnh vực kinh doanh, kinh tế. Là nguồn tư liệu cho những người quan tâm và muốn nâng cao kiến thức trong lĩnh vực kinh tế. Những cuốn sách, câu chuyện trong Tủ sách không chỉ đơn thuần là những tác phẩm của tri thức mà còn chứa đựng bí quyết, kinh nghiệm quý báu từ các tác giả, nhà quản lý có uy tín và kinh nghiệm lâu năm trong ngành. Đọc sách không chỉ giúp người đọc tiếp cận những kiến thức mới mà còn giúp mở rộng tầm nhìn và phát triển bản thân. Tủ sách kiến thức kinh tế mong muốn lan tỏa tri thức trong lĩnh vực kinh doanh, đồng thời phát triển văn hóa đọc cho người Việt.  Trong phiên giao dịch chiều nay, giá vàng miếng SJC đã chính thức vượt 157 triệu đồng/lượng, tiếp tục thiết lập đỉnh lịch sử mới.  Mỗi lượng vàng miếng và vàng nhẫn cùng giảm gần nửa triệu đồng/lượng trong phiên giao dịch sáng nay (9/12) kéo giá bán về sát mốc 154 triệu đồng/lượng.  Giá vàng miếng tiếp đà tăng thêm 400.000 đồng trong phiên giao dịch sáng nay (11/12), hiện đã vượt mốc 155 triệu đồng/lượng."
znews,https://znews.vn/nguoi-dau-tien-tren-the-gioi-so-huu-600-ty-usd-post1611853.html,Kinh doanh,Null,,Người đầu tiên trên thế giới sở hữu 600 tỷ USD,"Tỷ phú Elon Musk trở thành người đầu tiên thế giới sở hữu 600 tỷ USD. Ảnh:Reuters. Ngày 15/12,Elon Musktrở thành người đầu tiên trên thế giới sở hữu khối tài sản trị giá600 tỷ USD, sau khi xuất hiện thông tin startup hàng không vũ trụ SpaceX của ông nhiều khả năng sẽ lên sàn với mức định giá khoảng800 tỷ USD, theoForbes. Musk - người đã lần đầu vượt mốc tài sản500 tỷ USDvào tháng 10 - hiện nắm khoảng 42% cổ phần SpaceX. TheoReuters, công ty này đang chuẩn bị cho kế hoạch phát hành cổ phiếu lần đầu ra công chúng (IPO) vào năm tới. Tính đến 12h trưa 15/12 (giờ Mỹ), tổng giá trị tài sản ròng của Musk đượcForbesước tính đạt677 tỷ USD, tăng thêm khoảng168 tỷ USDsau một ngày.  Đây được cho là bước tiến lớn của Musk, hướng tới danh hiệu người sở hữu1.000 tỷ USDđầu tiên trên thế giới. Trong khi đó, danh sách tỷ phú thế giới củaBloomberg Billionaires Indexghi nhận khối tài sản của Elon Musk tăng vọt167 tỷ USDtrong ngày 15/12, lên mức638 tỷ USD. Tính từ đầu năm đến nay, tài sản của ông đã tăng thêm205 tỷ USD, tiếp tục củng cố vị thế người giàu nhất hành tinh. Khối tài sản của tỷ phú công nghệ này còn được thúc đẩy nhờ khoảng 12% cổ phần tại hãng xe điện Tesla. Dù doanh số có dấu hiệu chững lại, cổ phiếu Tesla vẫn tăng 13% từ đầu năm đến nay. Riêng trong phiên ngày 15/12, mã này bật tăng gần 4% sau khi Musk cho biết Tesla đang thử nghiệm dịch vụ robotaxi không cần giám sát an toàn ở ghế phụ phía trước. Tháng 11 vừa qua, các cổ đông Tesla đã thông qua gói thù lao trị giá1.000 tỷ USDdành cho Musk. Đây được xem là gói lương thưởng doanh nghiệp lớn nhất lịch sử, qua đó thể hiện sự ủng hộ đối với tầm nhìn biến Tesla thành ""gã khổng lồ"" về trí tuệ nhân tạo và robot. Bên cạnh đó, startup trí tuệ nhân tạo xAI của Musk được cho là đang trong giai đoạn đàm phán nâng cao để huy động15 tỷ USDvốn mới, với mức định giá khoảng230 tỷ USD, theo một báo cáo truyền thông. Hiện, Musk cùng các công ty Tesla, SpaceX và xAI chưa đưa ra phản hồi trước yêu cầu bình luận củaReuters. Tri Thức - Znewsgiới thiệu độc giảTủ sách kiến thức kinh tếvới đa dạng cuốn sách, câu chuyện trong lĩnh vực kinh doanh, kinh tế. Những cuốn sách, câu chuyện trong Tủ sách không đơn thuần là những tác phẩm của tri thức mà còn chứa đựng bí quyết, kinh nghiệm quý báu từ các tác giả, nhà quản lý có uy tín và kinh nghiệm lâu năm trong ngành. Đọc sách không chỉ giúp tiếp cận những kiến thức mới mà còn giúp mở rộng tầm nhìn và phát triển bản thân. Tủ sách kiến thức kinh tế mong muốn lan tỏa tri thức trong lĩnh vực kinh doanh, đồng thời phát triển văn hóa đọc cho người Việt.  Tỷ phú Elon Musk đang chuẩn bị cho thương vụ IPO ""bom tấn"" với SpaceX, với định giá có thể lên đến 1.500 tỷ USD. Khi startup này lên sàn, tài sản của Musk có thể bật tăng mạnh.  Cổ đông Tesla sắp bỏ phiếu về gói thưởng kỷ lục cho Elon Musk. Nếu không chấp thuận, họ có thể mất vị CEO được cho là ""không thể thay thế"" cùng toàn bộ giá trị thương hiệu Tesla.  Vượt qua SpaceX của tỷ phú Elon Musk, OpenAI, công ty sở hữu phần mềm ChatGPT, đã trở thành công ty khởi nghiệp lớn nhất thế giới với mức định giá 500 tỷ USD."
znews,https://znews.vn/bai-dang-tuyen-vo-gay-tranh-cai-cua-ty-phu-trung-quoc-post1611857.html,Đời sống,Null,,Bài đăng tuyển vợ gây tranh cãi của tỷ phú Trung Quốc,"Ngày 27/11, Liu Xin đăng bài quảng cáo tìm vợ qua tài khoản mạng xã hội có tên ""yiwanxin"". Anh cho biết bản thân thuộc thế hệ 9X, là nhà đầu tư chuyên nghiệp và nằm trong top 10 cổ đông lớn nhất của hơn 10 công ty niêm yết, trong đó có Dajin Heavy Industry Co, Ltd và Grand Sunergy Tech Co, Ltd. Liu cũng cho biết mình có tài sản ròng hơn 10 tỷ nhân dân tệ (khoảng1,4 tỷ USD) và nuôi tham vọng vượt qua thần tượng của mình là nhà đầu tư Mỹ Warren Buffett, theoSouth China Morning Post. Trong quảng cáo tìm vợ, anh cũng trích dẫn lời Buffett rằng lựa chọn quan trọng nhất và có tính thay đổi cuộc đời của một người chính là người bạn đời. Anh cho biết mình từng quá tập trung vào công việc và có rất ít trải nghiệm yêu đương sau một biến cố gia đình vào năm 2018. Nam doanh nhân cũng tự nhận là kiểu người si tình đến mức thiếu lý trí, cho rằng đây là phẩm chất hình thành từ công việc đầu tư, bởi anh thường ưu tiên lợi ích của khách hàng. Liu trong bức ảnh không lộ mặt, tuyên bố sở hữu xe sang và biệt thự phía sau. Ảnh:Sohu. Anh cũng mô tả bản thân ""cực kỳ yêu nước và mang tinh thần dân tộc"". Liu hy vọng người bạn đời tương lai cũng si tình, biết quan tâm đến người khác và mong muốn có con. Theo anh, việc tìm kiếm một người bạn đời có điều kiện tài chính tương xứng với mình là “không thực tế”. Liu cho biết mình có bằng cử nhân từ một trường đại học hàng đầu tại Đức, sở hữu bất động sản tại quê nhà Yên Đài (tỉnh Sơn Đông) và Hàng Châu (tỉnh Chiết Giang). Anh còn khoe bản thân sở hữu hơn một chiếc xe Rolls-Royce. Trong một bức ảnh lan truyền trên mạng, nam doanh nhân đứng trước một chiếc Rolls-Royce, mặc áo của thương hiệu xa xỉ nhưng không lộ rõ mặt. Anh khẳng định mình “chắc chắn không xấu, dù hơi béo”. Trong quảng cáo, Liu công khai tên tài khoản mạng xã hội và cho biết nhận được hàng trăm lời mời kết bạn mỗi ngày. Quảng cáo tìm vợ và một bài đăng tiếp theo của anh cũng hút khoảng 1.000 bình luận, trong đó một số phụ nữ còn gửi lại thông tin cá nhân và hình ảnh của mình. Một số dân mạng cho rằng Liu có thể tìm vợ qua sự kiện mai mối chuyên nghiệp thay vì đăng tin trên mạng. Ảnh:Michelle Ng. Tuy nhiên, một số dân mạng cảnh báo về nguy cơ lừa đảo. Một người nói rằng Liu vốn có tiếng trong giới vì dụ dỗ nhà đầu tư rót tiền vào thị trường đang suy thoái. Người này suy đoán rằng quảng cáo tìm vợ chỉ là một chiêu trò của Liu nhằm gia tăng sức ảnh hưởng. Một người khác cho rằng Liu hoàn toàn có thể dễ dàng tìm được người phù hợp tại các sự kiện mai mối cao cấp, và rằng anh có động cơ khác. Liu phủ nhận những cáo buộc này, nói rằng thao túng thị trường là hành vi trái pháp luật. Anh nói thêm rằng mình đang nghiêm túc tìm vợ và sẽ công khai mối quan hệ khi có kết quả. Một cư dân mạng khác bình luận: “Những yêu cầu của anh ta đối với người vợ tương lai có vẻ hợp lý nhưng thực chất lại mâu thuẫn. Anh ta muốn một người phụ nữ xinh đẹp, toàn tâm toàn ý vì mình nhưng đồng thời cũng xuất sắc trong sự nghiệp riêng. Anh ta đang tìm kiếm một người phụ nữ hoàn hảo không tồn tại"". Phong cách phỏng vấn lập dị của Steve Jobs Jobs đặt ra những khuôn phép chặt chẽ trong quy trình tuyển dụng. Ông thường hỏi những câu kỳ cục sở trường để xem xét ứng cử viên phản ứng thế nào trong tình huống bất ngờ. Mục tiêu là thu nhận đúng người, những con người sáng tạo, thông minh tinh quái và một chút nổi loạn.  Sớm lập gia đình ở tuổi 21, cầu thủ Nguyễn Thanh Nhàn hiện có mái ấm hạnh phúc bên bà xã xinh đẹp và con gái đầu lòng Sunny.  21:23 9/12/202521:239/12/2025 0 Giữa các nghi vấn về cách thức hoạt động và ồn ào xoay quanh nhà sáng lập Hoàng Hoa Trung, đội ngũ dự án Nuôi Em tiếp tục lên tiếng giải thích.  15:00 6/12/202515:006/12/2025 0 Thấy chiếc xe hơi 4 chỗ mắc kẹt trên lối đi tự mở ở Nghệ An, một người dân nhanh chóng báo hiệu cho chiếc tàu hỏa đang lao tới để kịp thời dừng lại."
