Source,URL,Category,Keyword,Time,Title,Content
tuoitre,https://tuoitre.vn/vien-kiem-sat-de-nghi-ap-dung-tinh-tiet-giam-nhe-dac-biet-doi-voi-ba-nguyen-thi-thanh-nhan-20251210143625445.htm,Pháp luật,"Sở Giáo dục và đào tạo TP.HCM,Nguyễn Thị Thanh Nhàn,Hoàng Thị Thúy Nga,bà Lê Phương Nga",2025-12-10 15:11:00,Viện Kiểm sát đề nghị áp dụng tình tiết giảm nhẹ đặc biệt đối với bà Nguyễn Thị Thanh Nhàn,"Các bị cáo trong vụ án xảy ra tại Công ty AIC, Sở Giáo dục và đào tạo TP.HCM tại tòa - Ảnh: HỮU DUY Theo Viện kiểm sát, bà Nguyễn Thị Thanh Nhàn là chủ mưu, chỉ đạo thành lập nhóm công ty ""quân xanh"" tham gia các gói thầu trong cả nước, nhằm thực hiện các hành vi thông thầu, gian lận trong đấu thầu để giúpCông ty AICtrúng thầu. Để thực hiện các gói thầu tại TP.HCM, từ năm 2012 - 2017, bà Nhàn đã ủy quyền và phân công bà Hoàng Thị Thúy Nga phụ trách các gói thầu thuộc lĩnh vực giáo dục, và Trần Đăng Tấn phụ trách các gói thầu thuộc lĩnh vực y tế, sử dụng pháp nhân của các công ty trong hệ sinh thái làm ""quân xanh"", thông đồng với nhóm công ty thẩm định giá, công ty tư vấn và thành viên các đơn vị là chủ đầu tư. Hồ sơ dự thầu của các công ty ""quân xanh"" được bộ phận AIC ở Hà Nội chuẩn bị sẵn, trong đó cố ý để nhiều tiêu chí không đạt theo yêu cầu, bỏ giá cao để bị chấm loại thầu. Riêng báo cáo tài chính của Công ty AIC được chỉnh sửa, nâng khống các tiêu chí bắt buộc để được trúng thầu. Để Công ty AIC trúng 134 gói thầu thuộc lĩnh vực giáo dục, phía chủ đầu tư là lãnh đạoSở Giáo dục và Đào tạogồm ông Lê Hồng Sơn (Giám đốc), ông Lê Hoài Nam (Phó giám đốc), bà Lê Phương Nga (Chánh văn phòng) và lãnh đạo Phòng Giáo dục và Đào tạo quận 5, gồm bà Võ Ngọc Thu (Trưởng phòng), bà Nguyễn Thị Mai Hương (Phó trưởng phòng) và ông Vũ Quốc Cường (chuyên viên) đã không thực hiện đúng quy định của Luật Đấu thầu trong quá trình tổ chức đấu thầu, tạo điều kiện cho Công ty AIC trúng thầu, gây thiệt hại cho Nhà nước tổng số tiền là 142 tỉ đồng. Theo Viện kiểm sát, có 4 bị cáo bà Nguyễn Thị Thanh Nhàn, bà Nguyễn Thị Tích, ông Trần Đăng Tấn, bà Lê Thanh Thy đã xuất cảnh ra nước ngoài trước khi khởi tố. Tuy cơ quan chức năng đã truy nã, phát thư kêu gọi ra đầu thú nhưng các bị cáo vẫn không ra trình diện. Xét thấy các bị cáo Nguyễn Thị Thanh Nhàn, Lê Hồng Sơn, Lê Hoài Nam, Võ Ngọc Thu, Lê Phương Nga... có nhiều bằng khen, thành tích trong công tác. Các bị cáo tự nguyện nộp một phần tiền để khắc phục hậu quả mình gây ra. Trong đó bà Nguyễn Thị Thanh Nhàn khắc phục 66 tỉ nên Viện kiểm sát đề nghị áp dụng tình tiết giảm nhẹ đặc biệt đối với bà Nhàn. Viện kiểm sát nhân dân TP.HCM đề nghị mức án đối với các bị cáo như sau: BàNguyễn Thị Thanh Nhàn(Chủ tịch HĐQT kiêm Tổng giám đốc Công ty AIC) 8-9 năm tù, tổng hợp hình phạt là 30 năm tù. BàHoàng Thị Thúy Nga(Trưởng ban quản lý dự án 1 Công ty AIC) 7-8 năm tù, tổng hợp hình phạt là 30 năm tù. ÔngTrần Đăng Tấn(Trưởng văn phòng đại diện AIC tại TP.HCM) 4-5 năm tù, tổng hợp hình phạt từ 22-23 năm tù. ÔngTạ Hải Anh(Tổng giám đốc Công ty cổ phần Công nghệ cao) 3-4 năm tù. BàNguyễn Thị Tích(Tổng giám đốc Công ty Mopha, Trưởng phòng Công ty AIC) 5-6 năm tù, tổng hợp hình phạt là 9-10 năm tù. BàHoàng Ngọc Hồng Phúc(nhân viên Công ty AIC) 6-7 năm tù, tổng hợp hình phạt từ 11-12 năm tù. ÔngTrương Sĩ Hiệp(Giám đốc Công ty thiết bị Phú Bình) 3-4 năm tù. BàLê Thanh Thy(Tổng giám đốc Công ty CP thông tin và thẩm định giá Tây Nam Bộ - SIAC) 3-4 năm tù. ÔngHồ Tấn Mạnh(Chủ tịch HĐQT Công ty Thẩm định giá Đông Nam Á) 2-3 năm tù. ÔngNguyễn Minh Tâm(Tổng giám đốc Công ty Thẩm định giá Đông Nam Á) 3 năm tù nhưng cho hưởng án treo. ÔngLê Hoài Nam(cựu Phó giám đốc Sở Giáo dục và Đào tạo TP.HCM) 2 năm 6 tháng - 3 năm tù. ÔngLê Hồng Sơn(cựu Giám đốc Sở Giáo dục và Đào tạo TP.HCM) 3 năm tù nhưng cho hưởng án treo. BàLê Phương Nga(cựu Chánh Văn phòng Sở Giáo dục và Đào tạo TP.HCM) 2-3 năm tù nhưng cho hưởng án treo. BàVõ Ngọc Thu(cựu Trưởng Phòng Giáo dục và Đào tạo quận 5) 3 năm tù nhưng cho hưởng án treo. BàNguyễn Thị Mai Hương(cựu Phó trưởng Phòng Giáo dục và Đào tạo quận 5) 2 năm 6 tháng - 3 năm tù nhưng cho hưởng án treo. ÔngVũ Quốc Cường(cựu chuyên viên Phòng Giáo dục và Đào tạo quận 5) 2 năm 6 tháng - 3 năm tù. Chiều 9-12, phiên tòa xét xử vụ vi phạm quy định về đấu thầu xảy ra tại Công ty AIC, Sở Giáo dục và Đào tạo TP.HCM và các đơn vị liên quan bắt đầu xét hỏi. Tại tòa, anh trai bà Thanh Nhàn cho biết gia đình đã nộp 66 tỉ để khắc phục hậu quả của vụ án."
tuoitre,https://tuoitre.vn/vinfast-ban-giao-23-186-o-to-dien-trong-thang-11-2025-sap-tung-them-mau-xe-moi-20251210145945931.htm,Kinh doanh,"Limo Green,VF 9,VF 7,EC,VINFAST",2025-12-10 15:11:00,"VinFast bàn giao 23.186 ô tô điện trong tháng 11-2025, sắp tung thêm mẫu xe mới","VinFast bàn giao 23.186 ô tô điện trong tháng 11-2025, tiếp tục giữ vững vị trí số 1 thị trường - Ảnh: VF Ngày 10-12,VinFastcủa tỉ phú Phạm Nhật Vượng, cho biết mức tăng trưởng mạnh trong tháng 11 cho thấy nhu cầu xe điện tại Việt Nam tiếp tục duy trì đà tăng, đồng thời phản ánh xu hướng dịch chuyển từ xe xăng sang xe điện đang diễn ra rõ rệt. Dòng xe đóng góp lớn nhất trong tháng 11 làLimo Greenvới9.642 xe, trở thành mẫu xe có doanh số tháng cao nhất của hãng từ trước đến nay. Mẫu MPV 7 chỗ này được người dùng ưa chuộng nhờ không gian rộng, khả năng vận hành ổn định, chi phí sử dụng thấp và loạt ưu đãi như hỗ trợ chuyển đổi từ xe xăng sang xe điện, miễn phí sạc công cộng, miễn lệ phí trước bạ… Sau 4 tháng bán ra, Limo Green đã đạt tổng lũy kế16.146 xe. Các mẫu xe còn lại của VinFast cũng ghi nhận doanh số cao trong tháng 11 nhưVF 3 với4.655 xe;VF 5 với3.072 xe;VF 6 có doanh số2.801 xe; theo sau là VF7 với 1.225 xe. Mẫu xe VF7 của VinFast thuộc nhóm bán chạy trong các phân khúc C-SUV - Ảnh: VF Tính từ đầu năm 2025,VF 3tiếp tục là mẫu xe bán chạy nhất thị trường với40.660 xe. CònVF 5đạt38.478 xe, chưa tính12.354 xe Herio Green,phiên bản tối ưu cho dịch vụ vận tải.VF 6dẫn đầu phân khúc B-SUV với19.750 xe. CònVF 7, VF 8, VF 9cũng thuộc nhóm bán chạy trong các phân khúc C-SUV, D-SUV và E-SUV với doanh số lần lượt8.292,3.172và1.755 xe. Tổng cộng, VinFast đã bàn giao147.450 ô tô điệntại Việt Nam từ đầu năm đến nay, đóng góp vào mục tiêu tăng gấp đôi doanh số toàn cầu so với 2024. Song song tăng trưởng doanh số, VinFast cho biết đã khai trươngxưởng dịch vụ thứ 350trong tháng 11. Hãng đặt mục tiêu nâng con số này lên400 xưởngvào cuối năm, qua đó duy trì mạng lưới hậu mãi lớn nhất thị trường ô tô Việt Nam. BàDương Thị Thu Trang, Phó tổng giám đốc Kinh doanh và Marketing VinFast toàn cầu, nhận định việc người dân chủ động chuyển đổi sang xe điện chịu tác động từ vấn đề ô nhiễm không khí ngày càng nghiêm trọng. Bà Trang cho biết các mẫu xe điện của VinFast được người dùng lựa chọn bởi ba yếu tố ""Xe tốt - Giá tốt - Hậu mãi tốt"", cùng dải sản phẩm đa dạng phục vụ nhiều nhu cầu khác nhau. Trong tháng 12-2025, VinFast dự kiến bàn giao thêm haimẫu xe mớigồmEC Vanmẫu xe chở hàng cỡ nhỏ vàMinio Greenmẫu xe mini 4 chỗ dành cho đô thị. Ngày 9-12, mẫu SUV điện VinFast VF 7 được xướng tên ở hạng mục “Thiết kế của năm” tại Zee Media Auto Summit 2025, trở thành điểm nhấn mới của thương hiệu xe điện Việt Nam tại thị trường Ấn Độ."
znews,https://znews.vn/phan-rang-mua-trang-troi-lu-nuot-chung-duong-pho-post1610030.html,Đời sống,Null,,"Phan Rang mưa trắng trời, lũ 'nuốt chửng' đường phố","Khu vực Phan Rang - Tháp Chàm (Khánh Hòa) ghi nhận cơn mưa lớn kéo dài 3 tiếng vào sáng 10/12 khiến nhiều nơi bị ngập cục bộ. Mức nước tại tuyến đường Ngô Gia Tự, Thống Nhất, Nguyễn Thị Minh Khai, 21 Tháng 8, 16 Tháng 4, Nguyễn Văn Cừ, Trường Chinh rơi vào khoảng 10-20 cm, trong khi khu vực vùng trũng như chợ Phan Rang, điểm giao Nguyễn Tuân và Chu Huy Mân chứng kiến mức ngập cao hơn khoảng 50 cm. Riêng khu vực xã Vĩnh Hải, đường phố biến thành sông gây khó khăn khi di chuyển. Hiện, trường THPT Phan Chu Trinh là một trong số điểm ngập nặng trên địa bàn. Người dân xã Vĩnh Hải gặp khó khăn khi di chuyển qua vùng ngập sâu. Ảnh:CA xã Vĩnh Hải. Theo đại diện Công an xã Vĩnh Hải, đơn vị buộc huy động 100% cán bộ, chiến sĩ khẩn trương hỗ trợ văng dây giúp đỡ, hướng dẫn người dân, học sinh, phương tiện di chuyển qua các điểm xung yếu. Ông Nguyễn Văn Quế, Chủ tịch UBND xã Vĩnh Hải, cho biết học sinh trên địa bàn được phép nghỉ học từ chiều 10/12 để đảm bảo an toàn. Chị Hoàng Mai (31 tuổi, sống tại khu Đô thị mới Đông Bắc (khu K1), Phan Rang bày tỏ sự bất ngờ khi lần đầu chứng kiến khu K1 bị ngập. ""Sáng nay mưa khá to, tôi chưa từng thấy cảnh ngập tại đây (khu K1-PV) bao giờ. Đến khoảng 10h thì nước dâng khoảng 30 cm, tôi hốt hoảng phải quay về nhà kê đồ đạc, phòng trường hợp lũ về bất ngờ"", chị Mai nói. Thông tin từ Đài Khí tượng thủy văn Khánh Hòa, tối 10/12, địa phương tiếp tục có mưa lớn. Tổng lượng mưa từ 20-60 mm, phía tây có nơi 90 mm. Đơn vị dự báo mưa lớn có thể gây nguy cơ lũ quét, sạt lở đất tại một số xã, phường. Đường Nguyễn Thị Minh Khai ngập nửa bánh xe sáng 10/12. Ảnh:Phan Rang - Khánh Hòa. Cẩm nang 'sống sót' nơi công sở TrongMENTOR - Từ sinh viên chất đến nhân sự chiến, tác giả Lê Công Minh chia sẻ trải nghiệm vượt qua và học hỏi từ thất bại: Từ nam sinh thi trượt đại học đến giám đốc truyền thông kỹ thuật số, nhân viên Big 4 kiểm toán, sáng lập trung tâm tiếng Anh… Đây là nơi những bạn trẻ ""lênh đênh"" chốn công sở dễ tìm thấy mình và học hỏi để vươn lên trên con đường sự nghiệp.  Mưa lớn kéo dài khiến nhiều khu vực tại Lâm Đồng và dọc Quốc lộ 1 ngập sâu chưa từng thấy, giao thông tê liệt, hàng nghìn người dân phải sơ tán khẩn cấp trong đêm 3-4/12.  Đợt mưa lớn ngày 4/12 tại Lâm Đồng gây ngập trên diện rộng, khiến hàng nghìn m2 thanh long của nông hộ bị hư hại nặng. Người dân ôm ruột xe tải vớt vát hoa quả chìm trong nước.  5 giờ trước10:0810/12/2025 0 Wolfgang Porsche (82 tuổi), Chủ tịch hãng xe thể thao hạng sang Porsche của Đức, vừa kết hôn với người vợ thứ 4 kém ông 20 tuổi."
znews,https://znews.vn/de-nhat-phu-nhan-phap-gay-tranh-cai-vi-miet-thi-nguoi-bieu-tinh-post1609905.html,Thế giới,Null,,Đệ nhất phu nhân Pháp gây tranh cãi vì miệt thị người biểu tình,"Đệ nhất phu nhân, bà Brigitte Macron TheoGuardian, một đoạn video ngày 7/12 cho thấy bà Macron trò chuyện hậu trường với diễn viên hài Ary Abittan tại nhà hát Folies Bergère, ngay trước khi ông lên sân khấu. Tối hôm trước đó, một nhóm hoạt động nữ quyền đã làm gián đoạn buổi diễn, hô vang “Abittan, kẻ hiếp dâm!” để phản đối cáo buộc tấn công tình dục từng nhắm vào ông. Vụ điều tra cáo buộc hiếp dâm năm 2021 nhằm vào Abittan đã bị đình chỉ năm 2024 do thiếu chứng cứ; quyết định này được xác nhận lại vào tháng 1/2025, theo truyền thôngPháp. Trong cuộc trò chuyện, khi Abittan nói rằng ông thấy lo lắng sau sự cố đêm trước, bà Macron đã gọi những người biểu tình là “sales connes” (lũ đàn bà ngu ngốc) và nói rằng nếu họ quay lại, “chúng ta sẽ đẩy họ ra ngoài”. Trong thông cáo, văn phòng Đệ nhất phu nhân cho biết bà chỉ muốn trấn an nghệ sĩ trước giờ diễn: “Mục đích duy nhất của bà Macron là động viên một nghệ sĩ vừa nói rằng ông ấy sợ hãi sau khi buổi diễn bị gián đoạn tối hôm trước. Bà không tấn công phong trào hay một mục tiêu nào”. Thông cáo cũng cho biết bà Macron “không đồng tình với những phương thức cực đoan nhằm ngăn nghệ sĩ biểu diễn”. Tổ chức Nous Toutes (“Tất cả chúng ta”) xác nhận đã làm gián đoạn buổi diễn để phản đối “văn hóa dung túng bạo lực tình dục” tại Pháp. Trên Instagram, nhóm Nous Toutes viết: “Chúng tôi phản đối việc các địa điểm nghệ thuật trải thảm đỏ cho những người bị cáo buộc hiếp dâm, vì điều đó khiến bạo lực giới và bạo lực tình dục trở nên bình thường hóa. Đây là sự xúc phạm công khai đối với các nạn nhân”. Một số chính trị gia cánh tả cho rằng lời lẽ của bà Macron là “miệt thị giới tính” và bà nên công khai xin lỗi. Cựu Tổng thống François Hollande phát biểu trên RTL: “Có vấn đề về sự thô tục ở đây”. Lãnh đạo đảng Xanh Marine Tondelier gọi phát biểu của bà Macron là “rất nghiêm trọng” và không phù hợp với vị trí Đệ nhất phu nhân. Nhiều nghệ sĩ đã ủng hộ các nhà hoạt động nữ quyền bằng cách sử dụng lại chính từ ngữ gây tranh cãi kèm hashtag #salesconnes. Ở chiều ngược lại, nghị sĩ Jean-Philippe Tanguy của đảng Tập hợp Quốc gia cho rằng bình luận của bà Macron được nói trong bối cảnh riêng tư: “Nếu mỗi chúng ta bị quay lén khi trò chuyện với bạn bè, có lẽ cũng sẽ có rất nhiều điều để bàn tán”, ông nói trên BFMTV. “Tất cả chuyện này thật đạo đức giả”. Những cuốn sách hay về châu Âu Tri Thức - Znewsgiới thiệu tới độc giả các cuốn sách hay nên đọc để hiểu thêm về châu Âu, khu vực có bề dày lịch sử được mệnh danh là ""lục địa già"".  09:31 18/1/202409:3118/1/2024 0 Mạng xã hội xôn xao trước hình ảnh thân thiết của Lisa (BlackPink) và Đệ nhất phu nhân Pháp.  19:00 7/9/201919:007/9/2019 02 Việc tổng thống và bộ trưởng Brazil này chế giễu ngoại hình và tuổi tác của bà Brigitte Macron đã làm dấy lên làn sóng chỉ trích ở cả Brazil và Pháp.  08:55 6/12/202508:556/12/2025 0 Kết thúc chuyến thăm Trung Quốc, bà Brigitte Macron có cuộc hội ngộ đặc biệt với gấu trúc Yuan Meng, chú gấu sinh tại Pháp và được xem như “con nuôi ngoại giao” của hai nước."
znews,https://znews.vn/khanh-hoa-lai-mua-ngap-so-giao-duc-ra-thong-bao-khan-post1610059.html,Giáo dục,Null,,"Khánh Hòa lại mưa ngập, Sở Giáo dục ra thông báo khẩn","Thôn Khánh Phước tại xã Vĩnh Hải ngập sâu sau trận mưa sáng 10/12. Ảnh:Báo Khánh Hòa. Ngày 10/12, Sở GD&ĐT tỉnh Khánh Hòa có văn bản gửi các đơn vị trực thuộc, UBND cấp xã về việc chủ động ứng phó với mưa lớn, lũ, ngập lụt, sạt lở đất. Theo đó, sở đề nghị các đơn vị thường xuyên theo dõi chặt chẽ diễn biến thời tiết trên các phương tiện thông tin đại chúng, chủ động cho học sinh nghỉ học khi có mưa lũ lớn và tổ chức dạy bù sau. Đồng thời, sở yêu cầu không tổ chức dạy học, các hoạt động giáo dục cho học sinh khi không đảm bảo an toàn. Bên cạnh đó, các cơ sở giáo dục được yêu cầu tiếp tục triển khai thực hiện nghiêm túc văn bản chỉ đạo về công tác phòng, chống thiên tai; thường xuyên cập nhật thông tin, báo cáo về Sở GD&ĐT để nắm bắt, chỉ đạo kịp thời. Từ sáng 10/12, địa bàn phường Phan Rang và xã Vĩnh Hải của tỉnh Khánh Hòa xuất hiện mưa lớn kéo dài trong nhiều giờ khiến nhiều khu vực ngập cục bộ. Nhiều tuyến đường tại phường Phan Rang ngập sâu đến 50 cm, gây ảnh hưởng đến việc đi lại và sinh hoạt của người dân, theoBáo Khánh Hòa. Trước tình hình này, một số trường học trên địa bàn như THCS Lý Tự Trọng, THCS Trần Phú đã chủ động tổ chức dạy học online nhằm đảm bảo an toàn cho học sinh và giáo viên. Mục Giáo dục giới thiệu đến bạn đọc những cuốn sách nuôi dạy trẻ trong thời đại 4.0. Cuốn sáchNuôi con 4.0 - Làm thế nào để trẻ không bị nghiện thiết bị công nghệ?của TS Shimi Kang (nhà khoa học, tâm lý học, chuyên gia giáo dục, tác giả của nhiều tựa sách bán chạy) được đánh giá là hữu ích cho các phụ huynh có con em nghiện sử dụng thiết bị điện tử. TS Shimi Kang đưa ra hàng loạt dẫn chứng và phân tích khoa học về cách thức tác động của thiết bị công nghệ đến bộ não đang trong giai đoạn phát triển của trẻ. Sau đó, bà chỉ ra những tác động tiêu cực đến sức khỏe, hành vi và tính cách của trẻ.  Mưa lớn suốt đêm 4/12 khiến nhiều khu vực thuộc tỉnh Lâm Đồng ngập sâu trong lũ, một xã phải ra văn bản hỏa tốc cho toàn bộ học sinh tạm nghỉ học.  10:33 28/11/202510:3328/11/2025 0 Nhà xuất bản Giáo dục Việt Nam đã chốt thời gian cấp đủ sách giáo khoa trước ngày 4/12 cho học sinh vùng lũ Đắk Lắk, giúp các em trở lại trường đầy đủ điều kiện học tập.  13:05 26/11/202513:0526/11/2025 0 Bão lũ liên tiếp bao trùm Đông Nam Á những tuần qua, gây ngập diện rộng và phá kỷ lục nhiều nơi. Chuyên gia cảnh báo tình trạng này có thể nặng nề hơn trong những năm tới."
